Type,Date,Time,Latitude,Longitude,Datetime,hour,day_of_week,day_of_month,month,quarter,is_weekend,is_morning,is_afternoon,is_evening,is_night,hour_sin,hour_cos,day_sin,day_cos,month_sin,month_cos,lat_grid,lon_grid,crime_density,distance_to_center,crime_type_encoded,crime_severity,time_weighted_severity,is_high_risk,risk_score
Murder,29/07/2016,21:00,12.93297,77.58381,2016-07-29 21:00:00,21,4,29,7,3,0,0,0,1,0,-0.7071067811865477,0.7071067811865474,-0.433883739117558,-0.9009688679024191,-0.4999999999999998,-0.8660254037844388,12.93,77.58,74,4.451759426739089,6,10.0,12.0,1,51.80985736243572
Murder,13/11/2016,23:45,12.930433,77.549761,2016-11-13 23:45:00,23,6,13,11,4,1,0,0,0,1,-0.25881904510252157,0.9659258262890681,-0.7818314824680299,0.6234898018587334,-0.5000000000000004,0.8660254037844384,12.93,77.54,28,6.675651836588757,6,10.0,15.0,1,50.50943744979711
Murder,10/5/2017,21:00,12.923736,77.58182,2017-05-10 21:00:00,21,2,10,5,2,0,0,0,1,0,-0.7071067811865477,0.7071067811865474,0.9749279121818236,-0.22252093395631434,0.49999999999999994,-0.8660254037844387,12.92,77.58,144,5.499475861921142,6,10.0,12.0,1,59.72080490904689
Murder,19/07/2017,19:30,12.924123,77.576913,2017-07-19 19:30:00,19,2,19,7,3,0,0,0,1,0,-0.9659258262890684,0.2588190451025203,0.9749279121818236,-0.22252093395631434,-0.4999999999999998,-0.8660254037844388,12.92,77.57000000000001,55,5.616378484012549,6,10.0,12.0,1,48.304220288821796
Murder,21/06/2018,23:30,12.924377,77.582729,2018-06-21 23:30:00,23,3,21,6,2,0,0,0,0,1,-0.25881904510252157,0.9659258262890681,0.43388373911755823,-0.900968867902419,1.2246467991473532e-16,-1.0,12.92,77.58,144,5.4062435092694585,6,10.0,15.0,1,74.65100613630861
Murder,17/07/2018,21:15,12.920604,77.520557,2018-07-17 21:15:00,21,1,17,7,3,0,0,0,1,0,-0.7071067811865477,0.7071067811865474,0.7818314824680298,0.6234898018587336,-0.4999999999999998,-0.8660254037844388,12.92,77.52,1,9.825372622835117,6,10.0,12.0,1,8.317766166719343
Murder,18/06/2016,21:00,12.93878218,77.57956109,2016-06-18 21:00:00,21,5,18,6,2,1,0,0,1,0,-0.7071067811865477,0.7071067811865474,-0.9749279121818236,-0.2225209339563146,1.2246467991473532e-16,-1.0,12.93,77.57000000000001,40,3.9965423001908422,6,10.0,12.0,1,44.56286480045169
Murder,2/7/2017,18:30,12.9399013,77.57337112,2017-07-02 18:30:00,18,6,2,7,3,1,0,0,1,0,-1.0,-1.8369701987210297e-16,-0.7818314824680299,0.6234898018587334,-0.4999999999999998,-0.8660254037844388,12.93,77.57000000000001,40,4.2090184202971805,6,10.0,12.0,1,44.56286480045169
Murder,29/07/2019,18:00,12.944557,77.57758,2019-07-29 18:00:00,18,0,29,7,3,0,0,0,1,0,-1.0,-1.8369701987210297e-16,0.0,1.0,-0.4999999999999998,-0.8660254037844388,12.94,77.57000000000001,55,3.5275936809207553,6,10.0,12.0,1,48.304220288821796
Murder,2/12/2016,22:30,12.91986,77.56931,2016-12-02 22:30:00,22,4,2,12,4,0,0,0,0,1,-0.5000000000000004,0.8660254037844384,-0.433883739117558,-0.9009688679024191,-2.4492935982947064e-16,1.0,12.91,77.56,126,6.37265472718865,6,10.0,15.0,1,72.66280629687887
Murder,27/11/2017,11:00,12.958864,77.638363,2017-11-27 11:00:00,11,0,27,11,4,0,1,0,0,0,0.258819045102521,-0.9659258262890682,0.0,1.0,-0.5000000000000004,0.8660254037844384,12.950000000000001,77.63,1,4.949110997667617,6,10.0,8.0,1,5.545177444479562
Murder,23/07/2015,16:00,12.946595,77.59197,2015-07-23 16:00:00,16,3,23,7,3,0,0,1,0,0,-0.8660254037844384,-0.5000000000000004,0.43388373911755823,-0.900968867902419,-0.4999999999999998,-0.8660254037844388,12.94,77.59,130,2.794996947063688,6,10.0,10.0,1,48.75197323201151
Murder,23/12/2015,16:30,12.945264,77.59271,2015-12-23 16:30:00,16,2,23,12,4,0,0,1,0,0,-0.8660254037844384,-0.5000000000000004,0.9749279121818236,-0.22252093395631434,-2.4492935982947064e-16,1.0,12.94,77.59,130,2.935582646759516,6,10.0,10.0,1,48.75197323201151
Murder,10/4/2016,22:00,12.946042,77.593699,2016-04-10 22:00:00,22,6,10,4,2,1,0,0,0,1,-0.5000000000000004,0.8660254037844384,-0.7818314824680299,0.6234898018587334,0.8660254037844387,-0.49999999999999983,12.94,77.59,130,2.8435965810586237,6,10.0,15.0,1,73.12795984801727
Murder,16/05/2016,21:30,12.946042,77.593699,2016-05-16 21:30:00,21,0,16,5,2,0,0,0,1,0,-0.7071067811865477,0.7071067811865474,0.0,1.0,0.49999999999999994,-0.8660254037844387,12.94,77.59,130,2.8435965810586237,6,10.0,12.0,1,58.502367878413814
Murder,22/06/2019,2:00,12.944408,77.593165,2019-06-22 02:00:00,2,5,22,6,2,1,0,0,0,1,0.49999999999999994,0.8660254037844387,-0.9749279121818236,-0.2225209339563146,1.2246467991473532e-16,-1.0,12.94,77.59,130,3.0276084439744073,6,10.0,15.0,1,73.12795984801727
Murder,9/2/2015,15:00,12.90976685,77.55679873,2015-02-09 15:00:00,15,0,9,2,1,0,0,1,0,0,-0.7071067811865471,-0.7071067811865479,0.0,1.0,0.8660254037844386,0.5000000000000001,12.9,77.55,37,8.003418895115507,6,10.0,10.0,1,36.37586159726386
Murder,15/03/2015,16:45,12.901082,77.54753806,2015-03-15 16:45:00,16,6,15,3,1,1,0,1,0,0,-0.8660254037844384,-0.5000000000000004,-0.7818314824680299,0.6234898018587334,1.0,6.123233995736766e-17,12.9,77.54,56,9.354007568238664,6,10.0,10.0,1,40.4305126783455
Murder,26/03/2015,21:45,12.86854765,77.5801126,2015-03-26 21:45:00,21,3,26,3,1,0,0,0,1,0,-0.7071067811865477,0.7071067811865474,0.43388373911755823,-0.900968867902419,1.0,6.123233995736766e-17,12.86,77.58,63,11.565971563522291,6,10.0,12.0,1,49.906597000316054
Murder,26/02/2017,20:10,12.90245473,77.54181407,2017-02-26 20:10:00,20,6,26,2,1,1,0,0,1,0,-0.8660254037844386,0.5000000000000001,-0.7818314824680299,0.6234898018587334,0.8660254037844386,0.5000000000000001,12.9,77.54,56,9.583276557587427,6,10.0,12.0,1,48.51661521401461
Murder,12/3/2017,21:00,12.88563257,77.5482591,2017-03-12 21:00:00,21,6,12,3,1,1,0,0,1,0,-0.7071067811865477,0.7071067811865474,-0.7818314824680299,0.6234898018587334,1.0,6.123233995736766e-17,12.88,77.54,41,10.798154509782977,6,10.0,12.0,1,44.85203541940042
Murder,26/04/2017,23:50,12.88948381,77.56232091,2017-04-26 23:50:00,23,2,26,4,2,0,0,0,0,1,-0.25881904510252157,0.9659258262890681,0.9749279121818236,-0.22252093395631434,0.8660254037844387,-0.49999999999999983,12.88,77.56,64,9.778097199930913,6,10.0,15.0,1,62.61580904843455
Murder,12/1/2018,22:30,12.9057223,77.53558126,2018-01-12 22:30:00,22,4,12,1,1,0,0,0,0,1,-0.5000000000000004,0.8660254037844384,-0.433883739117558,-0.9009688679024191,0.49999999999999994,0.8660254037844387,12.9,77.53,36,9.724600488428452,6,10.0,15.0,1,54.163768689663364
Murder,8/5/2019,13:00,12.91082367,77.54398174,2019-05-08 13:00:00,13,2,8,5,2,0,0,1,0,0,-0.2588190451025208,-0.9659258262890683,0.9749279121818236,-0.22252093395631434,0.49999999999999994,-0.8660254037844387,12.91,77.54,47,8.704130418591133,6,10.0,10.0,1,38.71201010907891
Murder,14/07/2019,21:45,12.913512,77.554144,2019-07-14 21:45:00,21,6,14,7,3,1,0,0,1,0,-0.7071067811865477,0.7071067811865474,-0.7818314824680299,0.6234898018587334,-0.4999999999999998,-0.8660254037844388,12.91,77.55,40,7.806485811904927,6,10.0,12.0,1,44.56286480045169
Murder,5/10/2019,17:30,12.91084893,77.53745649,2019-10-05 17:30:00,17,5,5,10,4,1,0,1,0,0,-0.9659258262890683,-0.25881904510252063,-0.9749279121818236,-0.2225209339563146,-0.8660254037844386,0.5000000000000001,12.91,77.53,20,9.164175758878878,6,10.0,10.0,1,30.44522437723423
Murder,22/02/2015,15:00,12.87583,77.511157,2015-02-22 15:00:00,15,6,22,2,1,1,0,1,0,0,-0.7071067811865471,-0.7071067811865479,-0.7818314824680299,0.6234898018587334,0.8660254037844386,0.5000000000000001,12.870000000000001,77.51,3,13.97094361334644,6,10.0,10.0,1,13.862943611198906
Murder,17/03/2015,5:00,12.894725,77.542178,2015-03-17 05:00:00,5,1,17,3,1,0,0,0,0,1,0.9659258262890683,0.25881904510252074,0.7818314824680298,0.6234898018587336,1.0,6.123233995736766e-17,12.89,77.54,35,10.263823506701293,6,10.0,15.0,1,53.75278407684165
Murder,29/03/2015,16:00,12.874853,77.554205,2015-03-29 16:00:00,16,6,29,3,1,1,0,1,0,0,-0.8660254037844384,-0.5000000000000004,-0.7818314824680299,0.6234898018587334,1.0,6.123233995736766e-17,12.870000000000001,77.55,12,11.614480016371486,6,10.0,10.0,1,25.649493574615366
Murder,14/1/2016,14:45,12.860873,77.520947,2016-01-14 14:45:00,14,3,14,1,1,0,0,1,0,0,-0.4999999999999998,-0.8660254037844388,0.43388373911755823,-0.900968867902419,0.49999999999999994,0.8660254037844387,12.86,77.52,11,14.673596987895035,6,10.0,10.0,1,24.849066497880003
Murder,17/01/2017,12:30,12.864755,77.528047,2017-01-17 12:30:00,12,1,17,1,1,0,0,1,0,0,1.2246467991473532e-16,-1.0,0.7818314824680298,0.6234898018587336,0.49999999999999994,0.8660254037844387,12.86,77.52,11,13.898824645511638,6,10.0,10.0,1,24.849066497880003
Murder,13/04/2017,12:15,12.871198,77.536856,2017-04-13 12:15:00,12,3,13,4,2,0,0,1,0,0,1.2246467991473532e-16,-1.0,0.43388373911755823,-0.900968867902419,0.8660254037844387,-0.49999999999999983,12.870000000000001,77.53,25,12.798628189255393,6,10.0,10.0,1,32.58096538021482
Murder,24/04/2017,10:00,12.853954,77.553705,2017-04-24 10:00:00,10,0,24,4,2,0,1,0,0,0,0.49999999999999994,-0.8660254037844387,0.0,1.0,0.8660254037844387,-0.49999999999999983,12.85,77.55,7,13.81212238374062,6,10.0,8.0,1,16.635532333438686
Murder,5/8/2017,4:00,12.870574,77.571346,2017-08-05 04:00:00,4,5,5,8,3,1,0,0,0,1,0.8660254037844386,0.5000000000000001,-0.9749279121818236,-0.2225209339563146,-0.8660254037844384,-0.5000000000000004,12.870000000000001,77.57000000000001,14,11.512817443878207,6,10.0,15.0,1,40.62075301653315
Murder,17/08/2017,5:00,12879498.0,77.542792,2017-08-17 05:00:00,5,3,17,8,3,0,0,0,0,1,0.9659258262890683,0.25881904510252074,0.43388373911755823,-0.900968867902419,-0.8660254037844384,-0.5000000000000004,12879497.99,77.54,1,13902.521463192521,6,10.0,15.0,1,10.39720770839918
Murder,22/08/2017,4:00,12.87548,77.535128,2017-08-22 04:00:00,4,1,22,8,3,0,0,0,0,1,0.8660254037844386,0.5000000000000001,0.7818314824680298,0.6234898018587336,-0.8660254037844384,-0.5000000000000004,12.870000000000001,77.53,25,12.481132511243894,6,10.0,15.0,1,48.87144807032223
Murder,17/01/2018,22:00,12.870129,77.556345,2018-01-17 22:00:00,22,2,17,1,1,0,0,0,0,1,-0.5000000000000004,0.8660254037844384,0.9749279121818236,-0.22252093395631434,0.49999999999999994,0.8660254037844387,12.870000000000001,77.55,12,12.020699927798463,6,10.0,15.0,1,38.47424036192305
Murder,14/07/2018,21:00,12.878193,77.535515,2018-07-14 21:00:00,21,5,14,7,3,1,0,0,1,0,-0.7071067811865477,0.7071067811865474,-0.9749279121818236,-0.2225209339563146,-0.4999999999999998,-0.8660254037844388,12.870000000000001,77.53,25,12.201710561174831,6,10.0,12.0,1,39.09715845625779
Murder,19/09/2018,18:00,12.848726,77.572816,2018-09-19 18:00:00,18,2,19,9,3,0,0,0,1,0,-1.0,-1.8369701987210297e-16,0.9749279121818236,-0.22252093395631434,-1.0,-1.8369701987210297e-16,12.84,77.57000000000001,2,13.865465271580266,6,10.0,12.0,1,13.183347464017316
Murder,16/10/2018,19:00,12.872393,77.557753,2018-10-16 19:00:00,19,1,16,10,4,0,0,0,1,0,-0.9659258262890684,0.2588190451025203,0.7818314824680298,0.6234898018587336,-0.8660254037844386,0.5000000000000001,12.870000000000001,77.55,12,11.73189957421863,6,10.0,12.0,1,30.779392289538443
Murder,27/10/2018,10:10,12.871255,77.56033,2018-10-27 10:10:00,10,5,27,10,4,1,1,0,0,0,0.49999999999999994,-0.8660254037844387,-0.9749279121818236,-0.2225209339563146,-0.8660254037844386,0.5000000000000001,12.870000000000001,77.56,25,11.759790515869307,6,10.0,8.0,1,26.064772304171857
Murder,3/11/2018,20:00,12.879671,77.54543,2018-11-03 20:00:00,20,5,3,11,4,1,0,0,1,0,-0.8660254037844386,0.5000000000000001,-0.9749279121818236,-0.2225209339563146,-0.5000000000000004,0.8660254037844384,12.870000000000001,77.54,24,11.527680007142173,6,10.0,12.0,1,38.626509898418405
Murder,19/08/2019,14:00,12.859739,77.562719,2019-08-19 14:00:00,14,0,19,8,3,0,0,1,0,0,-0.4999999999999998,-0.8660254037844388,0.0,1.0,-0.8660254037844384,-0.5000000000000004,12.85,77.56,9,12.909392015348402,6,10.0,10.0,1,23.02585092994046
Murder,14/10/2019,1:00,12.862041,77.563487,2019-10-14 01:00:00,1,0,14,10,4,0,0,0,0,1,0.25881904510252074,0.9659258262890683,0.0,1.0,-0.8660254037844386,0.5000000000000001,12.86,77.56,11,12.640482813086415,6,10.0,15.0,1,37.273599746820004
Murder,17/11/2019,20:30,12.893051,77.543007,2019-11-17 20:30:00,20,6,17,11,4,1,0,0,1,0,-0.8660254037844386,0.5000000000000001,-0.7818314824680299,0.6234898018587334,-0.5000000000000004,0.8660254037844384,12.89,77.54,35,10.370654656330489,6,10.0,12.0,1,43.00222726147332
Murder,4/3/2017,1:30,12.882152,77.565325,2017-03-04 01:30:00,1,5,4,3,1,1,0,0,0,1,0.25881904510252074,0.9659258262890683,-0.9749279121818236,-0.2225209339563146,1.0,6.123233995736766e-17,12.88,77.56,64,10.43994256661004,6,10.0,15.0,1,62.61580904843455
Murder,29/07/2017,8:45,12.84488,77.583729,2017-07-29 08:45:00,8,5,29,7,3,1,1,0,0,0,0.8660254037844387,-0.49999999999999983,-0.9749279121818236,-0.2225209339563146,-0.4999999999999998,-0.8660254037844388,12.84,77.58,23,14.139797789783819,6,10.0,8.0,1,25.424430642783566
Murder,1/11/2017,15:00,12.890277,77.57144,2017-11-01 15:00:00,15,2,1,11,4,0,0,1,0,0,-0.7071067811865471,-0.7071067811865479,0.9749279121818236,-0.22252093395631434,-0.5000000000000004,0.8660254037844384,12.89,77.57000000000001,44,9.384585570944045,6,10.0,10.0,1,38.06662489770319
Murder,18/11/2017,0:00,12.885583,77.57054,2017-11-18 00:00:00,0,5,18,11,4,1,0,0,0,1,0.0,1.0,-0.9749279121818236,-0.2225209339563146,-0.5000000000000004,0.8660254037844384,12.88,77.57000000000001,71,9.913718366376001,6,10.0,15.0,1,64.14999178524083
Murder,7/9/2018,4:30,12.889932,77.57465,2018-09-07 04:30:00,4,4,7,9,3,0,0,0,0,1,0.8660254037844386,0.5000000000000001,-0.433883739117558,-0.9009688679024191,-1.0,-1.8369701987210297e-16,12.88,77.57000000000001,71,9.334901737398877,6,10.0,15.0,1,64.14999178524083
Murder,1/10/2018,0:00,12.861345,77.579767,2018-10-01 00:00:00,0,0,1,10,4,0,0,0,0,1,0.0,1.0,0.0,1.0,-0.8660254037844386,0.5000000000000001,12.86,77.57000000000001,10,12.364750580757336,6,10.0,15.0,1,35.96842909197556
Murder,21/11/2018,23:50,12.845887,77.583885,2018-11-21 23:50:00,23,2,21,11,4,0,0,0,0,1,-0.25881904510252157,0.9659258262890681,0.9749279121818236,-0.22252093395631434,-0.5000000000000004,0.8660254037844384,12.84,77.58,23,14.026806824446838,6,10.0,15.0,1,47.67080745521918
Murder,13/06/2019,16:10,12.873733,77.579546,2019-06-13 16:10:00,16,3,13,6,2,0,0,1,0,0,-0.8660254037844384,-0.5000000000000004,0.43388373911755823,-0.900968867902419,1.2246467991473532e-16,-1.0,12.870000000000001,77.57000000000001,14,11.003938071138412,6,10.0,10.0,1,27.0805020110221
Murder,2/1/2015,21:00,12.8966729945995,77.5607513795297,2015-01-02 21:00:00,21,4,2,1,1,0,0,0,1,0,-0.7071067811865477,0.7071067811865474,-0.433883739117558,-0.9009688679024191,0.49999999999999994,0.8660254037844387,12.89,77.56,99,9.103315989734341,6,10.0,12.0,1,55.2620422318571
Murder,30/04/2015,6:00,12.9050964485764,77.571337000055,2015-04-30 06:00:00,6,3,30,4,2,0,1,0,0,0,1.0,6.123233995736766e-17,0.43388373911755823,-0.900968867902419,0.8660254037844387,-0.49999999999999983,12.9,77.57000000000001,96,7.812786515211778,6,10.0,8.0,1,36.59768782802706
Murder,11/6/2015,5:00,12.9076945341477,77.5719852228203,2015-06-11 05:00:00,5,3,11,6,2,0,0,0,0,1,0.9659258262890683,0.25881904510252074,0.43388373911755823,-0.900968867902419,1.2246467991473532e-16,-1.0,12.9,77.57000000000001,96,7.516721537423073,6,10.0,15.0,1,68.62066467755074
Murder,11/1/2016,11:00,12.9008927627643,77.5698813716385,2016-01-11 11:00:00,11,0,11,1,1,0,1,0,0,0,0.258819045102521,-0.9659258262890682,0.0,1.0,0.49999999999999994,0.8660254037844387,12.9,77.56,89,8.306121321315375,6,10.0,8.0,1,35.99847736264212
Murder,7/5/2016,13:45,12.9023385605328,77.5653252772123,2016-05-07 13:45:00,13,5,7,5,2,1,0,1,0,0,-0.2588190451025208,-0.9659258262890683,-0.9749279121818236,-0.2225209339563146,0.49999999999999994,-0.8660254037844387,12.9,77.56,89,8.329384328620096,6,10.0,10.0,1,44.99809670330265
Murder,31/07/2016,21:30,12.9144905944493,77.5721064816148,2016-07-31 21:30:00,21,6,31,7,3,1,0,0,1,0,-0.7071067811865477,0.7071067811865474,-0.7818314824680299,0.6234898018587334,-0.4999999999999998,-0.8660254037844388,12.91,77.57000000000001,82,6.802057832792748,6,10.0,12.0,1,53.02608729355918
Murder,26/04/2017,15:00,12.9105468600267,77.5607455338601,2017-04-26 15:00:00,15,2,26,4,2,0,0,1,0,0,-0.7071067811865471,-0.7071067811865479,0.9749279121818236,-0.22252093395631434,0.8660254037844387,-0.49999999999999983,12.91,77.56,126,7.7167428211963385,6,10.0,10.0,1,48.44187086458591
Murder,27/08/2017,15:00,12.8993985560933,77.572584947246,2017-08-27 15:00:00,15,6,27,8,3,1,0,1,0,0,-0.7071067811865471,-0.7071067811865479,-0.7818314824680299,0.6234898018587334,-0.8660254037844384,-0.5000000000000004,12.89,77.57000000000001,44,8.37543943650657,6,10.0,10.0,1,38.06662489770319
Murder,5/2/2018,18:30,12.902333328087,77.56892819667,2018-02-05 18:30:00,18,0,5,2,1,0,0,0,1,0,-1.0,-1.8369701987210297e-16,0.0,1.0,0.8660254037844386,0.5000000000000001,12.9,77.56,89,8.18917297662404,6,10.0,12.0,1,53.99771604396318
Murder,30/04/2018,16:30,12.9143691111693,77.5733106370572,2018-04-30 16:30:00,16,0,30,4,2,0,0,1,0,0,-0.8660254037844384,-0.5000000000000004,0.0,1.0,0.8660254037844387,-0.49999999999999983,12.91,77.57000000000001,82,6.769089900214802,6,10.0,10.0,1,44.18840607796598
Murder,25/08/2018,1:30,12.9155359324014,77.5616258170776,2018-08-25 01:30:00,1,5,25,8,3,1,0,0,0,1,0.25881904510252074,0.9659258262890683,-0.9749279121818236,-0.2225209339563146,-0.8660254037844384,-0.5000000000000004,12.91,77.56,126,7.1855710018050445,6,10.0,15.0,1,72.66280629687887
Murder,24/03/2019,5:30,12.9142072407114,77.5618648043771,2019-03-24 05:30:00,5,6,24,3,1,1,0,0,0,1,0.9659258262890683,0.25881904510252074,-0.7818314824680299,0.6234898018587334,1.0,6.123233995736766e-17,12.91,77.56,126,7.301505544297149,6,10.0,15.0,1,72.66280629687887
Murder,8/6/2019,00:30,12.9061712471247,77.5698458437946,2019-06-08 00:30:00,0,5,8,6,2,1,0,0,0,1,0.0,1.0,-0.9749279121818236,-0.2225209339563146,1.2246467991473532e-16,-1.0,12.9,77.56,89,7.754176337433942,6,10.0,15.0,1,67.49714505495398
Murder,12/11/2019,7:30,12.8964515698276,77.5602433120194,2019-11-12 07:30:00,7,1,12,11,4,0,1,0,0,0,0.9659258262890683,-0.25881904510252063,0.7818314824680298,0.6234898018587336,-0.5000000000000004,0.8660254037844384,12.89,77.56,99,9.148127614473653,6,10.0,8.0,1,36.841361487904734
Murder,8/1/2017,8:30,12.939585,77.544317,2017-01-08 08:30:00,8,6,8,1,1,1,1,0,0,0,0.8660254037844387,-0.49999999999999983,-0.7818314824680299,0.6234898018587334,0.49999999999999994,0.8660254037844387,12.93,77.54,28,6.508707774248709,6,10.0,8.0,1,26.938366639891793
Murder,21/04/2017,9:10,12.937792,77.537268,2017-04-21 09:10:00,9,4,21,4,2,0,1,0,0,0,0.7071067811865476,-0.7071067811865475,-0.433883739117558,-0.9009688679024191,0.8660254037844387,-0.49999999999999983,12.93,77.53,9,7.26158771353162,6,10.0,8.0,1,18.420680743952367
Murder,8/4/2018,3:00,12.946026,77.544111,2018-04-08 03:00:00,3,6,8,4,2,1,0,0,0,1,0.7071067811865475,0.7071067811865476,-0.7818314824680299,0.6234898018587334,0.8660254037844387,-0.49999999999999983,12.94,77.54,29,6.166033526945424,6,10.0,15.0,1,51.01796072493233
Murder,9/7/2018,15:00,12.940271,77.542692,2018-07-09 15:00:00,15,0,9,7,3,0,0,1,0,0,-0.7071067811865471,-0.7071067811865479,0.0,1.0,-0.4999999999999998,-0.8660254037844388,12.94,77.54,29,6.616338162905598,6,10.0,10.0,1,34.011973816621555
Murder,15/04/2016,4:00,12.94865677,77.56227641,2016-04-15 04:00:00,4,4,15,4,2,0,0,0,0,1,0.8660254037844386,0.5000000000000001,-0.433883739117558,-0.9009688679024191,0.8660254037844387,-0.49999999999999983,12.94,77.56,99,4.333256174586505,6,10.0,15.0,1,69.07755278982138
Murder,7/7/2017,22:00,12.94953,77.56316,2017-07-07 22:00:00,22,4,7,7,3,0,0,0,0,1,-0.5000000000000004,0.8660254037844384,-0.433883739117558,-0.9009688679024191,-0.4999999999999998,-0.8660254037844388,12.94,77.56,99,4.1987484024083574,6,10.0,15.0,1,69.07755278982138
Murder,14/07/2017,17:00,12.94953,77.56316,2017-07-14 17:00:00,17,4,14,7,3,0,0,1,0,0,-0.9659258262890683,-0.25881904510252063,-0.433883739117558,-0.9009688679024191,-0.4999999999999998,-0.8660254037844388,12.94,77.56,99,4.1987484024083574,6,10.0,10.0,1,46.05170185988092
Murder,5/5/2016,17:45,12.9560843652345,77.5756127337875,2016-05-05 17:45:00,17,3,5,5,2,0,0,1,0,0,-0.9659258262890683,-0.25881904510252063,0.43388373911755823,-0.900968867902419,0.49999999999999994,-0.8660254037844387,12.950000000000001,77.57000000000001,30,2.685092961011906,6,10.0,10.0,1,34.33987204485146
Murder,4/12/2019,23:00,12.94885,77.55255,2019-12-04 23:00:00,23,2,4,12,4,0,0,0,0,1,-0.25881904510252157,0.9659258262890681,0.9749279121818236,-0.22252093395631434,-2.4492935982947064e-16,1.0,12.94,77.55,85,5.211740721497373,6,10.0,15.0,1,66.81520944380262
Attempted Murder,10/2/2016,7:00,12.971599,77.594563,2016-02-10 07:00:00,7,2,10,2,1,0,1,0,0,0,0.9659258262890683,-0.25881904510252063,0.9749279121818236,-0.22252093395631434,0.8660254037844386,0.5000000000000001,12.97,77.59,13,0.004010765238726935,3,2.0,1.6,0,4.222491727384414
Attempted Murder,9/11/2016,13:30,12.80642,77.52537,2016-11-09 13:30:00,13,2,9,11,4,0,0,1,0,0,-0.2588190451025208,-0.9659258262890683,0.9749279121818236,-0.22252093395631434,-0.5000000000000004,0.8660254037844384,12.8,77.52,1,19.8409722042825,3,2.0,2.0,0,1.3862943611198906
Attempted Murder,21/01/2017,23:50,12.921755,77.588346,2017-01-21 23:50:00,23,5,21,1,1,1,0,0,0,1,-0.25881904510252157,0.9659258262890681,-0.9749279121818236,-0.2225209339563146,0.49999999999999994,0.8660254037844387,12.92,77.58,144,5.5837938856865925,3,2.0,3.0,0,14.930201227261723
Attempted Murder,12/6/2017,7:35,12.922076,77.5589539,2017-06-12 07:35:00,7,0,12,6,2,0,1,0,0,0,0.9659258262890683,-0.25881904510252063,0.0,1.0,1.2246467991473532e-16,-1.0,12.92,77.55,55,6.726593125800254,3,2.0,1.6,0,6.44056270517624
Attempted Murder,22/05/2018,18:00,12.835635,77.653354,2018-05-22 18:00:00,18,1,22,5,2,0,0,0,1,0,-1.0,-1.8369701987210297e-16,0.7818314824680298,0.6234898018587336,0.49999999999999994,-0.8660254037844387,12.83,77.65,1,16.405064149490034,3,2.0,2.4,0,1.6635532333438687
Attempted Murder,13/08/2018,16:45,12.925635,77.583354,2018-08-13 16:45:00,16,0,13,8,3,0,0,1,0,0,-0.8660254037844384,-0.5000000000000004,0.0,1.0,-0.8660254037844384,-0.5000000000000004,12.92,77.58,144,5.25436148373017,3,2.0,2.0,0,9.953467484841148
Attempted Murder,30/11/2018,20:00,12.28784,76.63313,2018-11-30 20:00:00,20,4,30,11,4,0,0,0,1,0,-0.8660254037844386,0.5000000000000001,-0.433883739117558,-0.9009688679024191,-0.5000000000000004,0.8660254037844384,12.280000000000001,76.63,7,129.0888715369456,3,2.0,2.4,0,4.990659700031606
Attempted Murder,2/12/2018,16:25,12.79642,77.50537,2018-12-02 16:25:00,16,6,2,12,4,1,0,1,0,0,-0.8660254037844384,-0.5000000000000004,-0.7818314824680299,0.6234898018587334,-2.4492935982947064e-16,1.0,12.790000000000001,77.5,1,21.74824793586427,3,2.0,2.0,0,1.3862943611198906
Attempted Murder,28/04/2019,19:30,12.93443,77.592697,2019-04-28 19:30:00,19,6,28,4,2,1,0,0,1,0,-0.9659258262890684,0.2588190451025203,-0.7818314824680299,0.6234898018587334,0.8660254037844387,-0.49999999999999983,12.93,77.59,58,4.138256829833637,3,2.0,2.4,0,9.786089865373727
Attempted Murder,3/5/2017,17:00,12.87974,77.50031,2017-05-03 17:00:00,17,2,3,5,2,0,0,1,0,0,-0.9659258262890683,-0.25881904510252063,0.9749279121818236,-0.22252093395631434,0.49999999999999994,-0.8660254037844387,12.870000000000001,77.5,4,14.448501688713648,3,2.0,2.0,0,3.2188758248682006
Attempted Murder,1/10/2017,6:00,12.92957,77.57276,2017-10-01 06:00:00,6,6,1,10,4,1,1,0,0,0,1.0,6.123233995736766e-17,-0.7818314824680299,0.6234898018587334,-0.8660254037844386,0.5000000000000001,12.92,77.57000000000001,55,5.2386260739227275,3,2.0,1.6,0,6.44056270517624
Attempted Murder,8/11/2017,23:45,12.91851,77.58122,2017-11-08 23:45:00,23,2,8,11,4,0,0,0,0,1,-0.25881904510252157,0.9659258262890681,0.9749279121818236,-0.22252093395631434,-0.5000000000000004,0.8660254037844384,12.91,77.58,105,6.0788024247968275,3,2.0,3.0,0,13.9903172823362
Attempted Murder,9/11/2017,5:00,12.87974,77.50031,2017-11-09 05:00:00,5,3,9,11,4,0,0,0,0,1,0.9659258262890683,0.25881904510252074,0.43388373911755823,-0.900968867902419,-0.5000000000000004,0.8660254037844384,12.870000000000001,77.5,4,14.448501688713648,3,2.0,3.0,0,4.828313737302301
Attempted Murder,15/01/2018,18:15,12.89066,77.575524,2018-01-15 18:15:00,18,0,15,1,1,0,0,0,1,0,-1.0,-1.8369701987210297e-16,0.0,1.0,0.49999999999999994,0.8660254037844387,12.89,77.57000000000001,44,9.234505669854848,3,2.0,2.4,0,9.135989975448767
Attempted Murder,11/3/2019,13:15,13.01965,77.60673,2019-03-11 13:15:00,13,0,11,3,1,0,0,1,0,0,-0.2588190451025208,-0.9659258262890683,0.0,1.0,1.0,6.123233995736766e-17,13.01,77.60000000000001,1,5.502181546129388,3,2.0,2.0,0,1.3862943611198906
Attempted Murder,22/03/2015,14:30,12.944814,77.587996,2015-03-22 14:30:00,14,6,22,3,1,1,0,1,0,0,-0.4999999999999998,-0.8660254037844388,-0.7818314824680299,0.6234898018587334,1.0,6.123233995736766e-17,12.94,77.58,80,3.063232740879234,3,2.0,2.0,0,8.788898309344878
Attempted Murder,11/4/2015,14:00,12.942789,77.596405,2015-04-11 14:00:00,14,5,11,4,2,1,0,1,0,0,-0.4999999999999998,-0.8660254037844388,-0.9749279121818236,-0.2225209339563146,0.8660254037844387,-0.49999999999999983,12.94,77.59,130,3.2096024966926207,3,2.0,2.0,0,9.750394646402302
Attempted Murder,22/07/2015,18:30,12.946042,77.593699,2015-07-22 18:30:00,18,2,22,7,3,0,0,0,1,0,-1.0,-1.8369701987210297e-16,0.9749279121818236,-0.22252093395631434,-0.4999999999999998,-0.8660254037844388,12.94,77.59,130,2.8435965810586237,3,2.0,2.4,0,11.700473575682762
Attempted Murder,6/8/2015,21:00,12.93481,77.591525,2015-08-06 21:00:00,21,3,6,8,3,0,0,0,1,0,-0.7071067811865477,0.7071067811865474,0.43388373911755823,-0.900968867902419,-0.8660254037844384,-0.5000000000000004,12.93,77.59,58,4.104410379514386,3,2.0,2.4,0,9.786089865373727
Attempted Murder,11/8/2015,0:15,12.945283,77.58671,2015-08-11 00:15:00,0,1,11,8,3,0,0,0,0,1,0.0,1.0,0.7818314824680298,0.6234898018587336,-0.8660254037844384,-0.5000000000000004,12.94,77.58,80,3.048660345994816,3,2.0,3.0,0,13.183347464017316
Attempted Murder,16/08/2015,20:30,12.942789,77.596405,2015-08-16 20:30:00,20,6,16,8,3,1,0,0,1,0,-0.8660254037844386,0.5000000000000001,-0.7818314824680299,0.6234898018587334,-0.8660254037844384,-0.5000000000000004,12.94,77.59,130,3.2096024966926207,3,2.0,2.4,0,11.700473575682762
Attempted Murder,3/9/2015,20:00,12.934073,77.592244,2015-09-03 20:00:00,20,3,3,9,3,0,0,0,1,0,-0.8660254037844386,0.5000000000000001,0.43388373911755823,-0.900968867902419,-1.0,-1.8369701987210297e-16,12.93,77.59,58,4.180615134846257,3,2.0,2.4,0,9.786089865373727
Attempted Murder,6/9/2015,20:00,12.944485,77.591988,2015-09-06 20:00:00,20,6,6,9,3,1,0,0,1,0,-0.8660254037844386,0.5000000000000001,-0.7818314824680299,0.6234898018587334,-1.0,-1.8369701987210297e-16,12.94,77.59,130,3.0283070454804144,3,2.0,2.4,0,11.700473575682762
Attempted Murder,3/10/2015,9:15,12.945602,77.588022,2015-10-03 09:15:00,9,5,3,10,4,1,1,0,0,0,0.7071067811865476,-0.7071067811865475,-0.9749279121818236,-0.2225209339563146,-0.8660254037844386,0.5000000000000001,12.94,77.58,80,2.9774301078561316,3,2.0,1.6,0,7.031118647475903
Attempted Murder,17/11/2015,21:00,12.946595,77.59197,2015-11-17 21:00:00,21,1,17,11,4,0,0,0,1,0,-0.7071067811865477,0.7071067811865474,0.7818314824680298,0.6234898018587336,-0.5000000000000004,0.8660254037844384,12.94,77.59,130,2.794996947063688,3,2.0,2.4,0,11.700473575682762
Attempted Murder,8/3/2016,13:15,12.944814,77.587996,2016-03-08 13:15:00,13,1,8,3,1,0,0,1,0,0,-0.2588190451025208,-0.9659258262890683,0.7818314824680298,0.6234898018587336,1.0,6.123233995736766e-17,12.94,77.58,80,3.063232740879234,3,2.0,2.0,0,8.788898309344878
Attempted Murder,20/03/2016,13:00,12.944814,77.587996,2016-03-20 13:00:00,13,6,20,3,1,1,0,1,0,0,-0.2588190451025208,-0.9659258262890683,-0.7818314824680299,0.6234898018587334,1.0,6.123233995736766e-17,12.94,77.58,80,3.063232740879234,3,2.0,2.0,0,8.788898309344878
Attempted Murder,26/04/2016,4:00,12.942707,77.585262,2016-04-26 04:00:00,4,1,26,4,2,0,0,0,0,1,0.8660254037844386,0.5000000000000001,0.7818314824680298,0.6234898018587336,0.8660254037844387,-0.49999999999999983,12.94,77.58,80,3.3683432899084362,3,2.0,3.0,0,13.183347464017316
Attempted Murder,14/06/2017,4:30,12.935847,77.593125,2017-06-14 04:30:00,4,2,14,6,2,0,0,0,0,1,0.8660254037844386,0.5000000000000001,0.9749279121818236,-0.22252093395631434,1.2246467991473532e-16,-1.0,12.93,77.59,58,3.978764102171441,3,2.0,3.0,0,12.23261233171716
Attempted Murder,6/7/2017,20:45,12.944265,77.593685,2017-07-06 20:45:00,20,3,6,7,3,0,0,0,1,0,-0.8660254037844386,0.5000000000000001,0.43388373911755823,-0.900968867902419,-0.4999999999999998,-0.8660254037844388,12.94,77.59,130,3.0411301240603192,3,2.0,2.4,0,11.700473575682762
Attempted Murder,19/12/2017,14:00,12.945058,77.591578,2017-12-19 14:00:00,14,1,19,12,4,0,0,1,0,0,-0.4999999999999998,-0.8660254037844388,0.7818314824680298,0.6234898018587336,-2.4492935982947064e-16,1.0,12.94,77.59,130,2.9694480230264158,3,2.0,2.0,0,9.750394646402302
Attempted Murder,25/10/2018,10:45,12.9446676,77.592128,2018-10-25 10:45:00,10,3,25,10,4,0,1,0,0,0,0.49999999999999994,-0.8660254037844387,0.43388373911755823,-0.900968867902419,-0.8660254037844386,0.5000000000000001,12.94,77.59,130,3.006702765194235,3,2.0,1.6,0,7.800315717121842
Attempted Murder,28/11/2018,17:00,12.941015,77.580237,2018-11-28 17:00:00,17,2,28,11,4,0,0,1,0,0,-0.9659258262890683,-0.25881904510252063,0.9749279121818236,-0.22252093395631434,-0.5000000000000004,0.8660254037844384,12.94,77.58,80,3.74013134192559,3,2.0,2.0,0,8.788898309344878
Attempted Murder,24/12/2018,20:00,12.9446676,77.592128,2018-12-24 20:00:00,20,0,24,12,4,0,0,0,1,0,-0.8660254037844386,0.5000000000000001,0.0,1.0,-2.4492935982947064e-16,1.0,12.94,77.59,130,3.006702765194235,3,2.0,2.4,0,11.700473575682762
Attempted Murder,6/1/2019,15:00,12.938585,77.58509,2019-01-06 15:00:00,15,6,6,1,1,1,0,1,0,0,-0.7071067811865471,-0.7071067811865479,-0.7818314824680299,0.6234898018587334,0.49999999999999994,0.8660254037844387,12.93,77.58,74,3.8130048917841117,3,2.0,2.0,0,8.63497622707262
Attempted Murder,18/02/2019,9:45,12.946428,77.591183,2019-02-18 09:45:00,9,0,18,2,1,0,1,0,0,0,0.7071067811865476,-0.7071067811865475,0.0,1.0,0.8660254037844386,0.5000000000000001,12.94,77.59,130,2.8233841314766606,3,2.0,1.6,0,7.800315717121842
Attempted Murder,27/02/2019,13:30,12.951431,77.590558,2019-02-27 13:30:00,13,2,27,2,1,0,0,1,0,0,-0.2588190451025208,-0.9659258262890683,0.9749279121818236,-0.22252093395631434,0.8660254037844386,0.5000000000000001,12.950000000000001,77.59,7,2.2850608539305255,3,2.0,2.0,0,4.1588830833596715
Attempted Murder,8/4/2019,12:00,12.945058,77.591578,2019-04-08 12:00:00,12,0,8,4,2,0,0,1,0,0,1.2246467991473532e-16,-1.0,0.0,1.0,0.8660254037844387,-0.49999999999999983,12.94,77.59,130,2.9694480230264158,3,2.0,2.0,0,9.750394646402302
Attempted Murder,7/8/2019,12:00,12.946042,77.593699,2019-08-07 12:00:00,12,2,7,8,3,0,0,1,0,0,1.2246467991473532e-16,-1.0,0.9749279121818236,-0.22252093395631434,-0.8660254037844384,-0.5000000000000004,12.94,77.59,130,2.8435965810586237,3,2.0,2.0,0,9.750394646402302
Attempted Murder,9/12/2019,21:00,12.942008,77.593672,2019-12-09 21:00:00,21,0,9,12,4,0,0,0,1,0,-0.7071067811865477,0.7071067811865474,0.0,1.0,-2.4492935982947064e-16,1.0,12.94,77.59,130,3.2920165621370923,3,2.0,2.4,0,11.700473575682762
Attempted Murder,10/12/2019,21:30,12.936049,77.592597,2019-12-10 21:30:00,21,1,10,12,4,0,0,0,1,0,-0.7071067811865477,0.7071067811865474,0.7818314824680298,0.6234898018587336,-2.4492935982947064e-16,1.0,12.93,77.59,58,3.9590453639010876,3,2.0,2.4,0,9.786089865373727
Attempted Murder,22/12/2019,16:30,12.943814,77.59715,2019-12-22 16:30:00,16,6,22,12,4,1,0,1,0,0,-0.8660254037844384,-0.5000000000000004,-0.7818314824680299,0.6234898018587334,-2.4492935982947064e-16,1.0,12.94,77.59,130,3.101994389481793,3,2.0,2.0,0,9.750394646402302
Attempted Murder,20/03/2015,21:00,12.870927,77.536764,2015-03-20 21:00:00,21,4,20,3,1,0,0,0,1,0,-0.7071067811865477,0.7071067811865474,-0.433883739117558,-0.9009688679024191,1.0,6.123233995736766e-17,12.870000000000001,77.53,25,12.829792431102442,3,2.0,2.4,0,7.819431691251557
Attempted Murder,5/4/2015,21:00,12.891626,77.496854,2015-04-05 21:00:00,21,6,5,4,2,1,0,0,1,0,-0.7071067811865477,0.7071067811865474,-0.7818314824680299,0.6234898018587334,0.8660254037844387,-0.49999999999999983,12.89,77.49,1,13.830982275940395,3,2.0,2.4,0,1.6635532333438687
Attempted Murder,14/05/2015,14:00,12.862772,77.531239,2015-05-14 14:00:00,14,3,14,5,2,0,0,1,0,0,-0.4999999999999998,-0.8660254037844388,0.43388373911755823,-0.900968867902419,0.49999999999999994,-0.8660254037844387,12.86,77.53,13,13.91382840754579,3,2.0,2.0,0,5.278114659230517
Attempted Murder,17/09/2015,20:30,12.876155,77.53255,2015-09-17 20:30:00,20,3,17,9,3,0,0,0,1,0,-0.8660254037844386,0.5000000000000001,0.43388373911755823,-0.900968867902419,-1.0,-1.8369701987210297e-16,12.870000000000001,77.53,25,12.564216892175821,3,2.0,2.4,0,7.819431691251557
Attempted Murder,15/10/2015,9:30,12.872936,77.528647,2015-10-15 09:30:00,9,3,15,10,4,0,1,0,0,0,0.7071067811865476,-0.7071067811865475,0.43388373911755823,-0.900968867902419,-0.8660254037844386,0.5000000000000001,12.870000000000001,77.52,4,13.09404606798586,3,2.0,1.6,0,2.5751006598945607
Attempted Murder,30/03/2016,17:00,12.874927,77.542694,2016-03-30 17:00:00,17,2,30,3,1,0,0,1,0,0,-0.9659258262890683,-0.25881904510252063,0.9749279121818236,-0.22252093395631434,1.0,6.123233995736766e-17,12.870000000000001,77.54,24,12.13255499297147,3,2.0,2.0,0,6.437751649736401
Attempted Murder,29/06/2019,11:00,12.870315,77.5375,2019-06-29 11:00:00,11,5,29,6,2,1,1,0,0,0,0.258819045102521,-0.9659258262890682,-0.9749279121818236,-0.2225209339563146,1.2246467991473532e-16,-1.0,12.870000000000001,77.53,25,12.850612505746819,3,2.0,1.6,0,5.212954460834371
Attempted Murder,8/8/2016,15:00,12.872491,77560741.0,2016-08-08 15:00:00,15,0,8,8,3,0,0,1,0,0,-0.7071067811865471,-0.7071067811865479,0.0,1.0,-0.8660254037844384,-0.5000000000000004,12.870000000000001,77560740.99,2,11097.43837715662,3,2.0,2.0,0,2.1972245773362196
Attempted Murder,8/8/2016,15:30,12.872491,77560741.0,2016-08-08 15:30:00,15,0,8,8,3,0,0,1,0,0,-0.7071067811865471,-0.7071067811865479,0.0,1.0,-0.8660254037844384,-0.5000000000000004,12.870000000000001,77560740.99,2,11097.43837715662,3,2.0,2.0,0,2.1972245773362196
Attempted Murder,28/09/2016,13:00,12.876095,77.546538,2016-09-28 13:00:00,13,2,28,9,3,0,0,1,0,0,-0.2588190451025208,-0.9659258262890683,0.9749279121818236,-0.22252093395631434,-1.0,-1.8369701987210297e-16,12.870000000000001,77.54,24,11.82834528002831,3,2.0,2.0,0,6.437751649736401
Attempted Murder,25/11/2016,0:15,12.879245,77.512528,2016-11-25 00:15:00,0,4,25,11,4,0,0,0,0,1,0.0,1.0,-0.433883739117558,-0.9009688679024191,-0.5000000000000004,0.8660254037844384,12.870000000000001,77.51,3,13.585926327187147,3,2.0,3.0,0,4.1588830833596715
Attempted Murder,28/11/2016,17:00,12.891048,77.542411,2016-11-28 17:00:00,17,0,28,11,4,0,0,1,0,0,-0.9659258262890683,-0.25881904510252063,0.0,1.0,-0.5000000000000004,0.8660254037844384,12.89,77.54,35,10.593274392172367,3,2.0,2.0,0,7.16703787691222
Attempted Murder,3/12/2016,7:00,12.88374,77.501315,2016-12-03 07:00:00,7,5,3,12,4,1,1,0,0,0,0.9659258262890683,-0.25881904510252063,-0.9749279121818236,-0.2225209339563146,-2.4492935982947064e-16,1.0,12.88,77.5,3,14.058979432739807,3,2.0,1.6,0,2.218070977791825
Attempted Murder,1/2/2017,22:30,12.856318,77.559623,2017-02-01 22:30:00,22,2,1,2,1,0,0,0,0,1,-0.5000000000000004,0.8660254037844384,0.9749279121818236,-0.22252093395631434,0.8660254037844386,0.5000000000000001,12.85,77.55,7,13.367565904296734,3,2.0,3.0,0,6.238324625039507
Attempted Murder,27/02/2017,23:15,12.895099,77.542102,2017-02-27 23:15:00,23,0,27,2,1,0,0,0,0,1,-0.25881904510252157,0.9659258262890681,0.0,1.0,0.8660254037844386,0.5000000000000001,12.89,77.54,35,10.233788565724774,3,2.0,3.0,0,10.75055681536833
Attempted Murder,11/4/2017,1:00,12.869881,77.525669,2017-04-11 01:00:00,1,1,11,4,2,0,0,0,0,1,0.25881904510252074,0.9659258262890683,0.7818314824680298,0.6234898018587336,0.8660254037844387,-0.49999999999999983,12.86,77.52,11,13.555145164742001,3,2.0,3.0,0,7.4547199493640015
Attempted Murder,17/05/2017,13:30,12.868478,77.521805,2017-05-17 13:30:00,13,2,17,5,2,0,0,1,0,0,-0.2588190451025208,-0.9659258262890683,0.9749279121818236,-0.22252093395631434,0.49999999999999994,-0.8660254037844387,12.86,77.52,11,13.918628828201516,3,2.0,2.0,0,4.969813299576001
Attempted Murder,10/6/2017,14:45,12.877804,77.533739,2017-06-10 14:45:00,14,5,10,6,2,1,0,1,0,0,-0.4999999999999998,-0.8660254037844388,-0.9749279121818236,-0.2225209339563146,1.2246467991473532e-16,-1.0,12.870000000000001,77.53,25,12.340353475200121,3,2.0,2.0,0,6.516193076042964
Attempted Murder,16/08/2017,10:30,12.863084,77.526325,2017-08-16 10:30:00,10,2,16,8,3,0,1,0,0,0,0.49999999999999994,-0.8660254037844387,0.9749279121818236,-0.22252093395631434,-0.8660254037844384,-0.5000000000000004,12.86,77.52,11,14.154660402478042,3,2.0,1.6,0,3.9758506396608007
Attempted Murder,19/11/2017,12:10,12.880893,77.543751,2017-11-19 12:10:00,12,6,19,11,4,1,0,1,0,0,1.2246467991473532e-16,-1.0,-0.7818314824680299,0.6234898018587334,-0.5000000000000004,0.8660254037844384,12.88,77.54,41,11.49348711421917,3,2.0,2.0,0,7.475339236566737
Attempted Murder,26/11/2017,22:00,12.874507,77.529564,2017-11-26 22:00:00,22,6,26,11,4,1,0,0,0,1,-0.5000000000000004,0.8660254037844384,-0.7818314824680299,0.6234898018587334,-0.5000000000000004,0.8660254037844384,12.870000000000001,77.52,4,12.893424345349796,3,2.0,3.0,0,4.828313737302301
Attempted Murder,11/2/2018,12:00,12.853218,77.553667,2018-02-11 12:00:00,12,6,11,2,1,1,0,1,0,0,1.2246467991473532e-16,-1.0,-0.7818314824680299,0.6234898018587334,0.8660254037844386,0.5000000000000001,12.85,77.55,7,13.890975319976212,3,2.0,2.0,0,4.1588830833596715
Attempted Murder,1/4/2018,8:30,12.881532,77.511282,2018-04-01 08:30:00,8,6,1,4,2,1,1,0,0,0,0.8660254037844387,-0.49999999999999983,-0.7818314824680299,0.6234898018587334,0.8660254037844387,-0.49999999999999983,12.88,77.51,2,13.484759575205459,3,2.0,1.6,0,1.7577796618689758
Attempted Murder,18/06/2018,21:15,12.877385,77.534077,2018-06-18 21:15:00,21,0,18,6,2,0,0,0,1,0,-0.7071067811865477,0.7071067811865474,0.0,1.0,1.2246467991473532e-16,-1.0,12.870000000000001,77.53,25,12.360279637040795,3,2.0,2.4,0,7.819431691251557
Attempted Murder,11/9/2018,23:30,12.867237,77.535278,2018-09-11 23:30:00,23,1,11,9,3,0,0,0,0,1,-0.25881904510252157,0.9659258262890681,0.7818314824680298,0.6234898018587336,-1.0,-1.8369701987210297e-16,12.86,77.53,13,13.266640938699123,3,2.0,3.0,0,7.917171988845775
Attempted Murder,26/10/2018,13:00,12.878813,77.482329,2018-10-26 13:00:00,13,4,26,10,4,0,0,1,0,0,-0.2588190451025208,-0.9659258262890683,-0.433883739117558,-0.9009688679024191,-0.8660254037844386,0.5000000000000001,12.870000000000001,77.48,2,15.953103246064696,3,2.0,2.0,0,2.1972245773362196
Attempted Murder,22/11/2018,18:30,12.85092,77.557048,2018-11-22 18:30:00,18,3,22,11,4,0,0,0,1,0,-1.0,-1.8369701987210297e-16,0.43388373911755823,-0.900968867902419,-0.5000000000000004,0.8660254037844384,12.85,77.55,7,14.0226506310173,3,2.0,2.4,0,4.990659700031606
Attempted Murder,7/4/2019,3:45,12.880754,77.549448,2019-04-07 03:45:00,3,6,7,4,2,1,0,0,0,1,0.7071067811865475,0.7071067811865476,-0.7818314824680299,0.6234898018587334,0.8660254037844387,-0.49999999999999983,12.88,77.54,41,11.224455840910762,3,2.0,3.0,0,11.213008854850106
Attempted Murder,4/9/2019,18:30,12.895797,77.536992,2019-09-04 18:30:00,18,2,4,9,3,0,0,0,1,0,-1.0,-1.8369701987210297e-16,0.9749279121818236,-0.22252093395631434,-1.0,-1.8369701987210297e-16,12.89,77.53,8,10.489236294120703,3,2.0,2.4,0,5.273338985606927
Attempted Murder,5/9/2019,6:30,12.865399,77.520688,2019-09-05 06:30:00,6,3,5,9,3,0,1,0,0,0,1.0,6.123233995736766e-17,0.43388373911755823,-0.900968867902419,-1.0,-1.8369701987210297e-16,12.86,77.52,11,14.269644424161108,3,2.0,1.6,0,3.9758506396608007
Attempted Murder,17/09/2019,14:00,12.865652,77.516896,2019-09-17 14:00:00,14,1,17,9,3,0,0,1,0,0,-0.4999999999999998,-0.8660254037844388,0.7818314824680298,0.6234898018587336,-1.0,-1.8369701987210297e-16,12.86,77.51,2,14.481447823341394,3,2.0,2.0,0,2.1972245773362196
Attempted Murder,31/05/2017,9:00,12.881457,77.573157,2017-05-31 09:00:00,9,2,31,5,2,0,1,0,0,0,0.7071067811865476,-0.7071067811865475,0.9749279121818236,-0.22252093395631434,0.49999999999999994,-0.8660254037844387,12.88,77.57000000000001,71,10.289318470720994,3,2.0,1.6,0,6.842665790425689
Attempted Murder,2/7/2017,12:30,12.85708,77.577065,2017-07-02 12:30:00,12,6,2,7,3,1,0,1,0,0,1.2246467991473532e-16,-1.0,-0.7818314824680299,0.6234898018587334,-0.4999999999999998,-0.8660254037844388,12.85,77.57000000000001,9,12.875080062522516,3,2.0,2.0,0,4.605170185988092
Attempted Murder,12/10/2017,22:30,12.899251,77.576456,2017-10-12 22:30:00,22,3,12,10,4,0,0,0,0,1,-0.5000000000000004,0.8660254037844384,0.43388373911755823,-0.900968867902419,-0.8660254037844386,0.5000000000000001,12.89,77.57000000000001,44,8.281660500478308,3,2.0,3.0,0,11.419987469310959
Attempted Murder,2/12/2017,23:00,12.88967,77.571871,2017-12-02 23:00:00,23,5,2,12,4,1,0,0,0,1,-0.25881904510252157,0.9659258262890681,-0.9749279121818236,-0.2225209339563146,-2.4492935982947064e-16,1.0,12.88,77.57000000000001,71,9.437340710807252,3,2.0,3.0,0,12.829998357048165
Attempted Murder,3/12/2017,0:10,12.871945,77.57484,2017-12-03 00:10:00,0,6,3,12,4,1,0,0,0,1,0.0,1.0,-0.7818314824680299,0.6234898018587334,-2.4492935982947064e-16,1.0,12.870000000000001,77.57000000000001,14,11.28617618250763,3,2.0,3.0,0,8.12415060330663
Attempted Murder,5/2/2019,15:20,12.855507,77.587458,2019-02-05 15:20:00,15,1,5,2,1,0,0,1,0,0,-0.7071067811865471,-0.7071067811865479,0.7818314824680298,0.6234898018587336,0.8660254037844386,0.5000000000000001,12.85,77.58,11,12.932139801138922,3,2.0,2.0,0,4.969813299576001
Attempted Murder,30/03/2019,4:15,12.888075,77.570911,2019-03-30 04:15:00,4,5,30,3,1,1,0,0,0,1,0.8660254037844386,0.5000000000000001,-0.9749279121818236,-0.2225209339563146,1.0,6.123233995736766e-17,12.88,77.57000000000001,71,9.635858707113856,3,2.0,3.0,0,12.829998357048165
Attempted Murder,11/4/2018,9:40,12.88245,77.575277,2018-04-11 09:40:00,9,2,11,4,2,0,1,0,0,0,0.7071067811865476,-0.7071067811865475,0.9749279121818236,-0.22252093395631434,0.8660254037844387,-0.49999999999999983,12.88,77.57000000000001,71,10.131813375165134,3,2.0,1.6,0,6.842665790425689
Attempted Murder,26/05/2018,19:00,12.871945,77.57484,2018-05-26 19:00:00,19,5,26,5,2,1,0,0,1,0,-0.9659258262890684,0.2588190451025203,-0.9749279121818236,-0.2225209339563146,0.49999999999999994,-0.8660254037844387,12.870000000000001,77.57000000000001,14,11.28617618250763,3,2.0,2.4,0,6.499320482645304
Attempted Murder,2/7/2018,20:54,12.881966,77.566281,2018-07-02 20:54:00,20,0,2,7,3,0,0,0,1,0,-0.8660254037844386,0.5000000000000001,0.0,1.0,-0.4999999999999998,-0.8660254037844388,12.88,77.56,64,10.428688608336522,3,2.0,2.4,0,10.018529447749527
Attempted Murder,31/07/2018,13:10,12.84856,77.58442,2018-07-31 13:10:00,13,1,31,7,3,0,0,1,0,0,-0.2588190451025208,-0.9659258262890683,0.7818314824680298,0.6234898018587336,-0.4999999999999998,-0.8660254037844388,12.84,77.58,23,13.725841983773028,3,2.0,2.0,0,6.3561076606958915
Attempted Murder,25/08/2018,5:30,12.870638,77.583264,2018-08-25 05:30:00,5,5,25,8,3,1,0,0,0,1,0.9659258262890683,0.25881904510252074,-0.9749279121818236,-0.2225209339563146,-0.8660254037844384,-0.5000000000000004,12.870000000000001,77.58,22,11.2934884659272,3,2.0,3.0,0,9.406482647787449
Attempted Murder,26/04/2018,17:00,12.881012,77.57636,2018-04-26 17:00:00,17,3,26,4,2,0,0,1,0,0,-0.9659258262890683,-0.25881904510252063,0.43388373911755823,-0.900968867902419,0.8660254037844387,-0.49999999999999983,12.88,77.57000000000001,71,10.26506543633693,3,2.0,2.0,0,8.55333223803211
Attempted Murder,5/2/2019,21:00,12.88967,77.571871,2019-02-05 21:00:00,21,1,5,2,1,0,0,0,1,0,-0.7071067811865477,0.7071067811865474,0.7818314824680298,0.6234898018587336,0.8660254037844386,0.5000000000000001,12.88,77.57000000000001,71,9.437340710807252,3,2.0,2.4,0,10.263998685638532
Attempted Murder,30/03/2019,7:00,12.878993,77.557886,2019-03-30 07:00:00,7,5,30,3,1,1,1,0,0,0,0.9659258262890683,-0.25881904510252063,-0.9749279121818236,-0.2225209339563146,1.0,6.123233995736766e-17,12.870000000000001,77.55,12,11.039440840434706,3,2.0,1.6,0,4.103918971938459
Attempted Murder,31/03/2019,7:15,12.880183,77.567401,2019-03-31 07:15:00,7,6,31,3,1,1,1,0,0,0,0.9659258262890683,-0.25881904510252063,-0.7818314824680299,0.6234898018587334,1.0,6.123233995736766e-17,12.88,77.56,64,10.583885875530685,3,2.0,1.6,0,6.679019631833019
Attempted Murder,3/4/2019,21:10,12.896392,77.570185,2019-04-03 21:10:00,21,2,3,4,2,0,0,0,1,0,-0.7071067811865477,0.7071067811865474,0.9749279121818236,-0.22252093395631434,0.8660254037844387,-0.49999999999999983,12.89,77.57000000000001,44,8.77134991388276,3,2.0,2.4,0,9.135989975448767
Attempted Murder,4/4/2019,7:00,12.89639,77.570185,2019-04-04 07:00:00,7,3,4,4,2,0,1,0,0,0,0.9659258262890683,-0.25881904510252063,0.43388373911755823,-0.900968867902419,0.8660254037844387,-0.49999999999999983,12.89,77.57000000000001,44,8.7715619474476,3,2.0,1.6,0,6.090659983632512
Attempted Murder,30/05/2019,23:15,12.840624,77.580569,2019-05-30 23:15:00,23,3,30,5,2,0,0,0,0,1,-0.25881904510252157,0.9659258262890681,0.43388373911755823,-0.900968867902419,0.49999999999999994,-0.8660254037844387,12.84,77.58,23,14.643050539940061,3,2.0,3.0,0,9.534161491043838
Attempted Murder,20/11/2019,16:30,12.88818,77.570987,2019-11-20 16:30:00,16,2,20,11,4,0,0,1,0,0,-0.8660254037844384,-0.5000000000000004,0.9749279121818236,-0.22252093395631434,-0.5000000000000004,0.8660254037844384,12.88,77.57000000000001,71,9.622411850848106,3,2.0,2.0,0,8.55333223803211
Attempted Murder,25/11/2019,12:30,12.843536,77.5836,2019-11-25 12:30:00,12,0,25,11,4,0,0,1,0,0,1.2246467991473532e-16,-1.0,0.0,1.0,-0.5000000000000004,0.8660254037844384,12.84,77.58,23,14.289889431968817,3,2.0,2.0,0,6.3561076606958915
Attempted Murder,10/2/2015,19:00,12.9124182556892,77.5641048370764,2015-02-10 19:00:00,19,1,10,2,1,0,0,0,1,0,-0.9659258262890684,0.2588190451025203,0.7818314824680298,0.6234898018587336,0.8660254037844386,0.5000000000000001,12.91,77.56,126,7.363914550066436,3,2.0,2.4,0,11.626049007500619
Attempted Murder,6/3/2015,22:00,12.8999136414243,77.5724909471076,2015-03-06 22:00:00,22,4,6,3,1,0,0,0,0,1,-0.5000000000000004,0.8660254037844384,-0.433883739117558,-0.9009688679024191,1.0,6.123233995736766e-17,12.89,77.57000000000001,44,8.32347958797541,3,2.0,3.0,0,11.419987469310959
Attempted Murder,7/7/2015,17:00,12.9026072787272,77.5614887435773,2015-07-07 17:00:00,17,1,7,7,3,0,0,1,0,0,-0.9659258262890683,-0.25881904510252063,0.7818314824680298,0.6234898018587336,-0.4999999999999998,-0.8660254037844388,12.9,77.56,89,8.469374060741798,3,2.0,2.0,0,8.99961934066053
Attempted Murder,29/07/2015,18:30,12.9021874622456,77.5726241709647,2015-07-29 18:30:00,18,2,29,7,3,0,0,0,1,0,-1.0,-1.8369701987210297e-16,0.9749279121818236,-0.22252093395631434,-0.4999999999999998,-0.8660254037844388,12.9,77.57000000000001,96,8.077400297596036,3,2.0,2.4,0,10.979306348408118
Attempted Murder,29/07/2015,12:00,12.9021874622456,77.5726241709647,2015-07-29 12:00:00,12,2,29,7,3,0,0,1,0,0,1.2246467991473532e-16,-1.0,0.9749279121818236,-0.22252093395631434,-0.4999999999999998,-0.8660254037844388,12.9,77.57000000000001,96,8.077400297596036,3,2.0,2.0,0,9.149421957006766
Attempted Murder,3/12/2015,16:30,12.9085203452405,77.5725265251381,2015-12-03 16:30:00,16,3,3,12,4,0,0,1,0,0,-0.8660254037844384,-0.5000000000000004,0.43388373911755823,-0.900968867902419,-2.4492935982947064e-16,1.0,12.9,77.57000000000001,96,7.410829743574645,3,2.0,2.0,0,9.149421957006766
Attempted Murder,13/12/2015,21:00,12.9141256400484,77.5633354568206,2015-12-13 21:00:00,21,6,13,12,4,1,0,0,1,0,-0.7071067811865477,0.7071067811865474,-0.7818314824680299,0.6234898018587334,-2.4492935982947064e-16,1.0,12.91,77.56,126,7.233430468377265,3,2.0,2.4,0,11.626049007500619
Attempted Murder,19/12/2015,12:00,12.9021874622456,77.5726241709647,2015-12-19 12:00:00,12,5,19,12,4,1,0,1,0,0,1.2246467991473532e-16,-1.0,-0.9749279121818236,-0.2225209339563146,-2.4492935982947064e-16,1.0,12.9,77.57000000000001,96,8.077400297596036,3,2.0,2.0,0,9.149421957006766
Attempted Murder,7/1/2016,21:00,12.9071512442452,77.5706532660885,2016-01-07 21:00:00,21,3,7,1,1,0,0,0,1,0,-0.7071067811865477,0.7071067811865474,0.43388373911755823,-0.900968867902419,0.49999999999999994,0.8660254037844387,12.9,77.57000000000001,96,7.6217900783377095,3,2.0,2.4,0,10.979306348408118
Attempted Murder,9/1/2016,22:30,12.9105468600267,77.5607455338601,2016-01-09 22:30:00,22,5,9,1,1,1,0,0,0,1,-0.5000000000000004,0.8660254037844384,-0.9749279121818236,-0.2225209339563146,0.49999999999999994,0.8660254037844387,12.91,77.56,126,7.7167428211963385,3,2.0,3.0,0,14.532561259375774
Attempted Murder,27/01/2016,15:15,12.9156668834348,77.5615653226641,2016-01-27 15:15:00,15,2,27,1,1,0,0,1,0,0,-0.7071067811865471,-0.7071067811865479,0.9749279121818236,-0.22252093395631434,0.49999999999999994,0.8660254037844387,12.91,77.56,126,7.176209494447316,3,2.0,2.0,0,9.688374172917182
Attempted Murder,3/5/2016,22:00,12.9036664359072,77.567460870869,2016-05-03 22:00:00,22,1,3,5,2,0,0,0,0,1,-0.5000000000000004,0.8660254037844384,0.7818314824680298,0.6234898018587336,0.49999999999999994,-0.8660254037844387,12.9,77.56,89,8.106240795784819,3,2.0,3.0,0,13.499429010990795
Attempted Murder,4/6/2016,11:00,12.892719430893,77.5668159621641,2016-06-04 11:00:00,11,5,4,6,2,1,1,0,0,0,0.258819045102521,-0.9659258262890682,-0.9749279121818236,-0.2225209339563146,1.2246467991473532e-16,-1.0,12.89,77.56,99,9.273572489388954,3,2.0,1.6,0,7.368272297580948
Attempted Murder,7/7/2016,15:30,12.9144905944493,77.5721064816148,2016-07-07 15:30:00,15,3,7,7,3,0,0,1,0,0,-0.7071067811865471,-0.7071067811865479,0.43388373911755823,-0.900968867902419,-0.4999999999999998,-0.8660254037844388,12.91,77.57000000000001,82,6.802057832792748,3,2.0,2.0,0,8.837681215593197
Attempted Murder,31/07/2016,20:40,12.9144905944493,77.5721064816148,2016-07-31 20:40:00,20,6,31,7,3,1,0,0,1,0,-0.8660254037844386,0.5000000000000001,-0.7818314824680299,0.6234898018587334,-0.4999999999999998,-0.8660254037844388,12.91,77.57000000000001,82,6.802057832792748,3,2.0,2.4,0,10.605217458711836
Attempted Murder,7/8/2016,0:30,12.9073405371661,77.5726119249203,2016-08-07 00:30:00,0,6,7,8,3,1,0,0,0,1,0.0,1.0,-0.7818314824680299,0.6234898018587334,-0.8660254037844384,-0.5000000000000004,12.9,77.57000000000001,96,7.53218385308683,3,2.0,3.0,0,13.724132935510148
Attempted Murder,16/08/2016,23:01,12.9043309015663,77.5684681501214,2016-08-16 23:01:00,23,1,16,8,3,0,0,0,0,1,-0.25881904510252157,0.9659258262890681,0.7818314824680298,0.6234898018587336,-0.8660254037844384,-0.5000000000000004,12.9,77.56,89,7.998133702219984,3,2.0,3.0,0,13.499429010990795
Attempted Murder,5/9/2016,17:00,12.9008927627643,77.5698813716385,2016-09-05 17:00:00,17,0,5,9,3,0,0,1,0,0,-0.9659258262890683,-0.25881904510252063,0.0,1.0,-1.0,-1.8369701987210297e-16,12.9,77.56,89,8.306121321315375,3,2.0,2.0,0,8.99961934066053
Attempted Murder,3/9/2016,15:30,12.9162974053303,77.5707956209262,2016-09-03 15:30:00,15,5,3,9,3,1,0,1,0,0,-0.7071067811865471,-0.7071067811865479,-0.9749279121818236,-0.2225209339563146,-1.0,-1.8369701987210297e-16,12.91,77.57000000000001,82,6.668538594700288,3,2.0,2.0,0,8.837681215593197
Attempted Murder,19/10/2016,18:15,12.895284445528,77.5662128659953,2016-10-19 18:15:00,18,2,19,10,4,0,0,0,1,0,-1.0,-1.8369701987210297e-16,0.9749279121818236,-0.22252093395631434,-0.8660254037844386,0.5000000000000001,12.89,77.56,99,9.026347130844886,3,2.0,2.4,0,11.05240844637142
Attempted Murder,22/10/2016,9:30,12.8985485830136,77.5696633326515,2016-10-22 09:30:00,9,5,22,10,4,1,1,0,0,0,0.7071067811865476,-0.7071067811865475,-0.9749279121818236,-0.2225209339563146,-0.8660254037844386,0.5000000000000001,12.89,77.56,99,8.560701025326008,3,2.0,1.6,0,7.368272297580948
Attempted Murder,1/11/2016,11:55,12.8981950397319,77.5693753268396,2016-11-01 11:55:00,11,1,1,11,4,0,1,0,0,0,0.258819045102521,-0.9659258262890682,0.7818314824680298,0.6234898018587336,-0.5000000000000004,0.8660254037844384,12.89,77.56,99,8.607873954339478,3,2.0,1.6,0,7.368272297580948
Attempted Murder,21/12/2016,0:20,12.8988074924041,77.5722900133757,2016-12-21 00:20:00,0,2,21,12,4,0,0,0,0,1,0.0,1.0,0.9749279121818236,-0.22252093395631434,-2.4492935982947064e-16,1.0,12.89,77.57000000000001,44,8.447553938878785,3,2.0,3.0,0,11.419987469310959
Attempted Murder,4/2/2017,21:00,12.9124941271334,77.5724056559576,2017-02-04 21:00:00,21,5,4,2,1,1,0,0,1,0,-0.7071067811865477,0.7071067811865474,-0.9749279121818236,-0.2225209339563146,0.8660254037844386,0.5000000000000001,12.91,77.57000000000001,82,6.998556531896663,3,2.0,2.4,0,10.605217458711836
Attempted Murder,24/03/2017,21:00,12.9036664359072,77.567460870869,2017-03-24 21:00:00,21,4,24,3,1,0,0,0,1,0,-0.7071067811865477,0.7071067811865474,-0.433883739117558,-0.9009688679024191,1.0,6.123233995736766e-17,12.9,77.56,89,8.106240795784819,3,2.0,2.4,0,10.799543208792636
Attempted Murder,9/6/2017,23:00,12.8964515698276,77.5602433120194,2017-06-09 23:00:00,23,4,9,6,2,0,0,0,0,1,-0.25881904510252157,0.9659258262890681,-0.433883739117558,-0.9009688679024191,1.2246467991473532e-16,-1.0,12.89,77.56,99,9.148127614473653,3,2.0,3.0,0,13.815510557964275
Attempted Murder,23/08/2017,21:00,12.9026072787272,77.5614887435773,2017-08-23 21:00:00,21,2,23,8,3,0,0,0,1,0,-0.7071067811865477,0.7071067811865474,0.9749279121818236,-0.22252093395631434,-0.8660254037844384,-0.5000000000000004,12.9,77.56,89,8.469374060741798,3,2.0,2.4,0,10.799543208792636
Attempted Murder,22/11/2017,22:30,12.9007131600848,77.5651239475589,2017-11-22 22:30:00,22,2,22,11,4,0,0,0,0,1,-0.5000000000000004,0.8660254037844384,0.9749279121818236,-0.22252093395631434,-0.5000000000000004,0.8660254037844384,12.9,77.56,89,8.504950439245352,3,2.0,3.0,0,13.499429010990795
Attempted Murder,27/11/2017,21:00,12.9079107980595,77.5667368067783,2017-11-27 21:00:00,21,0,27,11,4,0,0,0,1,0,-0.7071067811865477,0.7071067811865474,0.0,1.0,-0.5000000000000004,0.8660254037844384,12.9,77.56,89,7.698787716022028,3,2.0,2.4,0,10.799543208792636
Attempted Murder,13/03/2018,18:00,12.9135166186977,77.5670477005948,2018-03-13 18:00:00,18,1,13,3,1,0,0,0,1,0,-1.0,-1.8369701987210297e-16,0.7818314824680298,0.6234898018587336,1.0,6.123233995736766e-17,12.91,77.56,126,7.115369401530013,3,2.0,2.4,0,11.626049007500619
Attempted Murder,29/05/2018,19:00,12.9008927627643,77.5698813716385,2018-05-29 19:00:00,19,1,29,5,2,0,0,0,1,0,-0.9659258262890684,0.2588190451025203,0.7818314824680298,0.6234898018587336,0.49999999999999994,-0.8660254037844387,12.9,77.56,89,8.306121321315375,3,2.0,2.4,0,10.799543208792636
Attempted Murder,18/06/2018,14:00,12.9043309015663,77.5684681501214,2018-06-18 14:00:00,14,0,18,6,2,0,0,1,0,0,-0.4999999999999998,-0.8660254037844388,0.0,1.0,1.2246467991473532e-16,-1.0,12.9,77.56,89,7.998133702219984,3,2.0,2.0,0,8.99961934066053
Attempted Murder,26/06/2018,15:00,12.9151436819703,77.5694191266274,2018-06-26 15:00:00,15,1,26,6,2,0,0,1,0,0,-0.7071067811865471,-0.7071067811865479,0.7818314824680298,0.6234898018587336,1.2246467991473532e-16,-1.0,12.91,77.56,126,6.845111442553426,3,2.0,2.0,0,9.688374172917182
Attempted Murder,9/7/2018,14:00,12.9023385605328,77.5653252772123,2018-07-09 14:00:00,14,0,9,7,3,0,0,1,0,0,-0.4999999999999998,-0.8660254037844388,0.0,1.0,-0.4999999999999998,-0.8660254037844388,12.9,77.56,89,8.329384328620096,3,2.0,2.0,0,8.99961934066053
Attempted Murder,18/07/2018,23:00,12.8982364488419,77.5694762090069,2018-07-18 23:00:00,23,2,18,7,3,0,0,0,0,1,-0.25881904510252157,0.9659258262890681,0.9749279121818236,-0.22252093395631434,-0.4999999999999998,-0.8660254037844388,12.89,77.56,99,8.600040301445038,3,2.0,3.0,0,13.815510557964275
Attempted Murder,5/9/2020,21:00,12.9050964485764,77.571337000055,2020-09-05 21:00:00,21,5,5,9,3,1,0,0,1,0,-0.7071067811865477,0.7071067811865474,-0.9749279121818236,-0.2225209339563146,-1.0,-1.8369701987210297e-16,12.9,77.57000000000001,96,7.812786515211778,3,2.0,2.4,0,10.979306348408118
Attempted Murder,3/11/2018,18:00,12.9061712471247,77.5698458437946,2018-11-03 18:00:00,18,5,3,11,4,1,0,0,1,0,-1.0,-1.8369701987210297e-16,-0.9749279121818236,-0.2225209339563146,-0.5000000000000004,0.8660254037844384,12.9,77.56,89,7.754176337433942,3,2.0,2.4,0,10.799543208792636
Attempted Murder,7/12/2018,23:30,12.9135166186977,77.5670477005948,2018-12-07 23:30:00,23,4,7,12,4,0,0,0,0,1,-0.25881904510252157,0.9659258262890681,-0.433883739117558,-0.9009688679024191,-2.4492935982947064e-16,1.0,12.91,77.56,126,7.115369401530013,3,2.0,3.0,0,14.532561259375774
Attempted Murder,29/01/2019,22:30,12.896847554625,77.5674809920983,2019-01-29 22:30:00,22,1,29,1,1,0,0,0,0,1,-0.5000000000000004,0.8660254037844384,0.7818314824680298,0.6234898018587336,0.49999999999999994,0.8660254037844387,12.89,77.56,99,8.816378031099623,3,2.0,3.0,0,13.815510557964275
Attempted Murder,17/08/2019,22:30,12.8979064683143,77.5594980995282,2019-08-17 22:30:00,22,5,17,8,3,1,0,0,0,1,-0.5000000000000004,0.8660254037844384,-0.9749279121818236,-0.2225209339563146,-0.8660254037844384,-0.5000000000000004,12.89,77.55,56,9.034300984632765,3,2.0,3.0,0,12.129153803503652
Attempted Murder,8/9/2019,13:30,12.8914388215753,77.5645044225484,2019-09-08 13:30:00,13,6,8,9,3,1,0,1,0,0,-0.2588190451025208,-0.9659258262890683,-0.7818314824680299,0.6234898018587334,-1.0,-1.8369701987210297e-16,12.89,77.56,99,9.491513360608556,3,2.0,2.0,0,9.210340371976184
Attempted Murder,9/9/2015,5:00,12.931754,77.539058,2015-09-09 05:00:00,5,2,9,9,3,0,0,0,0,1,0.9659258262890683,0.25881904510252074,0.9749279121818236,-0.22252093395631434,-1.0,-1.8369701987210297e-16,12.93,77.53,9,7.4737964895216535,3,2.0,3.0,0,6.907755278982138
Attempted Murder,2/6/2016,8:00,12.937792,77.537268,2016-06-02 08:00:00,8,3,2,6,2,0,1,0,0,0,0.8660254037844387,-0.49999999999999983,0.43388373911755823,-0.900968867902419,1.2246467991473532e-16,-1.0,12.93,77.53,9,7.26158771353162,3,2.0,1.6,0,3.684136148790474
Attempted Murder,1/1/2016,11:30,12.939647,77.552168,2016-01-01 11:30:00,11,4,1,1,1,0,1,0,0,0,0.258819045102521,-0.9659258262890682,-0.433883739117558,-0.9009688679024191,0.49999999999999994,0.8660254037844387,12.93,77.55,76,5.810900198378307,3,2.0,1.6,0,6.950088674965895
Attempted Murder,12/3/2016,16:00,12.943851,77.548762,2016-03-12 16:00:00,16,5,12,3,1,1,0,1,0,0,-0.8660254037844384,-0.5000000000000004,-0.9749279121818236,-0.2225209339563146,1.0,6.123233995736766e-17,12.94,77.54,29,5.847505032218965,3,2.0,2.0,0,6.802394763324311
Attempted Murder,3/11/2016,22:30,12.939585,77.544317,2016-11-03 22:30:00,22,3,3,11,4,0,0,0,0,1,-0.5000000000000004,0.8660254037844384,0.43388373911755823,-0.900968867902419,-0.5000000000000004,0.8660254037844384,12.93,77.54,28,6.508707774248709,3,2.0,3.0,0,10.101887489959422
Attempted Murder,10/11/2016,22:15,12.933474,77.543107,2016-11-10 22:15:00,22,3,10,11,4,0,0,0,0,1,-0.5000000000000004,0.8660254037844384,0.43388373911755823,-0.900968867902419,-0.5000000000000004,0.8660254037844384,12.93,77.54,28,7.007845147024232,3,2.0,3.0,0,10.101887489959422
Attempted Murder,12/5/2016,11:30,12.930897,77.53865,2016-05-12 11:30:00,11,3,12,5,2,0,1,0,0,0,0.258819045102521,-0.9659258262890682,0.43388373911755823,-0.900968867902419,0.49999999999999994,-0.8660254037844387,12.93,77.53,9,7.566072849418588,3,2.0,1.6,0,3.684136148790474
Attempted Murder,5/3/2017,19:00,12.939647,77.552168,2017-03-05 19:00:00,19,6,5,3,1,1,0,0,1,0,-0.9659258262890684,0.2588190451025203,-0.7818314824680299,0.6234898018587334,1.0,6.123233995736766e-17,12.93,77.55,76,5.810900198378307,3,2.0,2.4,0,10.42513301244884
Attempted Murder,7/12/2017,20:30,12.936892,77.551396,2017-12-07 20:30:00,20,3,7,12,4,0,0,0,1,0,-0.8660254037844386,0.5000000000000001,0.43388373911755823,-0.900968867902419,-2.4492935982947064e-16,1.0,12.93,77.55,76,6.067442013620032,3,2.0,2.4,0,10.42513301244884
Attempted Murder,1/12/2018,22:00,12.93586,77.54388,2018-12-01 22:00:00,22,5,1,12,4,1,0,0,0,1,-0.5000000000000004,0.8660254037844384,-0.9749279121818236,-0.2225209339563146,-2.4492935982947064e-16,1.0,12.93,77.54,28,6.782524125407959,3,2.0,3.0,0,10.101887489959422
Attempted Murder,10/12/2019,22:00,12.940715,77.545315,2019-12-10 22:00:00,22,1,10,12,4,0,0,0,0,1,-0.5000000000000004,0.8660254037844384,0.7818314824680298,0.6234898018587336,-2.4492935982947064e-16,1.0,12.94,77.54,29,6.349602918213509,3,2.0,3.0,0,10.203592144986466
Attempted Murder,30/05/2016,1:30,12.94953,77.56316,2016-05-30 01:30:00,1,0,30,5,2,0,0,0,0,1,0.25881904510252074,0.9659258262890683,0.0,1.0,0.49999999999999994,-0.8660254037844387,12.94,77.56,99,4.1987484024083574,3,2.0,3.0,0,13.815510557964275
Attempted Murder,20/03/2017,9:00,12.94953,77.56316,2017-03-20 09:00:00,9,0,20,3,1,0,1,0,0,0,0.7071067811865476,-0.7071067811865475,0.0,1.0,1.0,6.123233995736766e-17,12.94,77.56,99,4.1987484024083574,3,2.0,1.6,0,7.368272297580948
Attempted Murder,12/3/2018,21:30,12.951433,77.567242,2018-03-12 21:30:00,21,0,12,3,1,0,0,0,1,0,-0.7071067811865477,0.7071067811865474,0.0,1.0,1.0,6.123233995736766e-17,12.950000000000001,77.56,65,3.7171614173667464,3,2.0,2.4,0,10.05517138086342
Attempted Murder,16/03/2018,15:00,12.953511,77.559792,2018-03-16 15:00:00,15,4,16,3,1,0,0,1,0,0,-0.7071067811865471,-0.7071067811865479,-0.433883739117558,-0.9009688679024191,1.0,6.123233995736766e-17,12.950000000000001,77.55,16,4.274638737373318,3,2.0,2.0,0,5.666426688112432
Attempted Murder,10/4/2018,10:30,12.95046684,77.5643001,2018-04-10 10:30:00,10,1,10,4,2,0,1,0,0,0,0.49999999999999994,-0.8660254037844387,0.7818314824680298,0.6234898018587336,0.8660254037844387,-0.49999999999999983,12.950000000000001,77.56,65,4.037631453991637,3,2.0,1.6,0,6.70344758724228
Attempted Murder,6/6/2018,19:00,12.948701,77.559813,2018-06-06 19:00:00,19,2,6,6,2,0,0,0,1,0,-0.9659258262890684,0.2588190451025203,0.9749279121818236,-0.22252093395631434,1.2246467991473532e-16,-1.0,12.94,77.55,85,4.548989109817384,3,2.0,2.4,0,10.690433511008417
Attempted Murder,18/06/2019,11:30,12.95014,77.5604,2019-06-18 11:30:00,11,1,18,6,2,0,1,0,0,0,0.258819045102521,-0.9659258262890682,0.7818314824680298,0.6234898018587336,1.2246467991473532e-16,-1.0,12.950000000000001,77.56,65,4.407773062030834,3,2.0,1.6,0,6.70344758724228
Attempted Murder,17/07/2019,21:30,12.94968,77.56202,2019-07-17 21:30:00,21,2,17,7,3,0,0,0,1,0,-0.7071067811865477,0.7071067811865474,0.9749279121818236,-0.22252093395631434,-0.4999999999999998,-0.8660254037844388,12.94,77.56,99,4.290091544879954,3,2.0,2.4,0,11.05240844637142
Attempted Murder,20/09/2019,2:40,12.94827,77.55944,2019-09-20 02:40:00,2,4,20,9,3,0,0,0,0,1,0.49999999999999994,0.8660254037844387,-0.433883739117558,-0.9009688679024191,-1.0,-1.8369701987210297e-16,12.94,77.55,85,4.609343151438765,3,2.0,3.0,0,13.363041888760522
Attempted Murder,14/11/2019,22:30,12.94951,77.56312,2019-11-14 22:30:00,22,3,14,11,4,0,0,0,0,1,-0.5000000000000004,0.8660254037844384,0.43388373911755823,-0.900968867902419,-0.5000000000000004,0.8660254037844384,12.94,77.56,99,4.20356544228972,3,2.0,3.0,0,13.815510557964275
Attempted Murder,22/11/2019,12:30,12.94953,77.56316,2019-11-22 12:30:00,12,4,22,11,4,0,0,1,0,0,1.2246467991473532e-16,-1.0,-0.433883739117558,-0.9009688679024191,-0.5000000000000004,0.8660254037844384,12.94,77.56,99,4.1987484024083574,3,2.0,2.0,0,9.210340371976184
Attempted Murder,2/12/2019,23:00,12.94953,77.56316,2019-12-02 23:00:00,23,0,2,12,4,0,0,0,0,1,-0.25881904510252157,0.9659258262890681,0.0,1.0,-2.4492935982947064e-16,1.0,12.94,77.56,99,4.1987484024083574,3,2.0,3.0,0,13.815510557964275
Attempted Murder,24/08/2017,16:00,12.9533,77.57242,2017-08-24 16:00:00,16,3,24,8,3,0,0,1,0,0,-0.8660254037844384,-0.5000000000000004,0.43388373911755823,-0.900968867902419,-0.8660254037844384,-0.5000000000000004,12.950000000000001,77.57000000000001,30,3.1491716278056505,3,2.0,2.0,0,6.8679744089702925
Attempted Murder,29/09/2019,19:00,12.948775,77.572542,2019-09-29 19:00:00,19,6,29,9,3,1,0,0,1,0,-0.9659258262890684,0.2588190451025203,-0.7818314824680299,0.6234898018587334,-1.0,-1.8369701987210297e-16,12.94,77.57000000000001,55,3.4863871331839054,3,2.0,2.4,0,9.66084405776436
Attempted Murder,10/9/2017,4:3,12.951456020309,77.5799156304629,2017-09-10 04:03:00,4,6,10,9,3,1,0,0,0,1,0.8660254037844386,0.5000000000000001,-0.7818314824680299,0.6234898018587334,-1.0,-1.8369701987210297e-16,12.950000000000001,77.57000000000001,30,2.74757792836242,3,2.0,3.0,0,10.30196161345544
Attempted Murder,3/11/2017,19:3,12.9537220810801,77.5757708482381,2017-11-03 19:03:00,19,4,3,11,4,0,0,0,1,0,-0.9659258262890684,0.2588190451025203,-0.433883739117558,-0.9009688679024191,-0.5000000000000004,0.8660254037844384,12.950000000000001,77.57000000000001,30,2.8486687548514382,3,2.0,2.4,0,8.241569290764351
Attempted Murder,4/1/2015,15:15,12.9394,77.5543,2015-01-04 15:15:00,15,6,4,1,1,1,0,1,0,0,-0.7071067811865471,-0.7071067811865479,-0.7818314824680299,0.6234898018587334,0.49999999999999994,0.8660254037844387,12.93,77.55,76,5.6472336035389015,3,2.0,2.0,0,8.687610843707368
Attempted Murder,16/01/2015,12:15,12.9365,77.556,2015-01-16 12:15:00,12,4,16,1,1,0,0,1,0,0,1.2246467991473532e-16,-1.0,-0.433883739117558,-0.9009688679024191,0.49999999999999994,0.8660254037844387,12.93,77.55,76,5.7209724813222405,3,2.0,2.0,0,8.687610843707368
Attempted Murder,2/2/2015,17:00,12.5614,77.3305,2015-02-02 17:00:00,17,0,2,2,1,0,0,1,0,0,-0.9659258262890683,-0.25881904510252063,0.0,1.0,0.8660254037844386,0.5000000000000001,12.56,77.33,65,53.858601351993165,3,2.0,2.0,0,8.37930948405285
Attempted Murder,25/03/2015,18:00,12.5638,77.3316,2015-03-25 18:00:00,18,2,25,3,1,0,0,0,1,0,-1.0,-1.8369701987210297e-16,0.9749279121818236,-0.22252093395631434,1.0,6.123233995736766e-17,12.56,77.33,65,53.56910305285768,3,2.0,2.4,0,10.05517138086342
Attempted Murder,28/04/2015,2:30,12.565,77.3633,2015-04-28 02:30:00,2,1,28,4,2,0,0,0,0,1,0.49999999999999994,0.8660254037844387,0.7818314824680298,0.6234898018587336,0.8660254037844387,-0.49999999999999983,12.56,77.36,1,51.70382471224141,3,2.0,3.0,0,2.0794415416798357
Attempted Murder,2/6/2015,21:00,12.5648,77.3348,2015-06-02 21:00:00,21,1,2,6,2,0,0,0,1,0,-0.7071067811865477,0.7071067811865474,0.7818314824680298,0.6234898018587336,1.2246467991473532e-16,-1.0,12.56,77.33,65,53.29070348329415,3,2.0,2.4,0,10.05517138086342
Attempted Murder,19/09/2015,18:30,12.5629,77.3313,2015-09-19 18:30:00,18,5,19,9,3,1,0,0,1,0,-1.0,-1.8369701987210297e-16,-0.9749279121818236,-0.2225209339563146,-1.0,-1.8369701987210297e-16,12.56,77.33,65,53.67116960061735,3,2.0,2.4,0,10.05517138086342
Attempted Murder,18/07/2016,12:15,12.5653,77.3319,2016-07-18 12:15:00,12,0,18,7,3,0,0,1,0,0,1.2246467991473532e-16,-1.0,0.0,1.0,-0.4999999999999998,-0.8660254037844388,12.56,77.33,65,53.410585169488364,3,2.0,2.0,0,8.37930948405285
Attempted Murder,9/9/2016,9:50,12.561,77.3317,2016-09-09 09:50:00,9,4,9,9,3,0,1,0,0,0,0.7071067811865476,-0.7071067811865475,-0.433883739117558,-0.9009688679024191,-1.0,-1.8369701987210297e-16,12.56,77.33,65,53.827245310440595,3,2.0,1.6,0,6.70344758724228
Attempted Murder,27/10/2016,13:30,12.5626,77.3327,2016-10-27 13:30:00,13,3,27,10,4,0,0,1,0,0,-0.2588190451025208,-0.9659258262890683,0.43388373911755823,-0.900968867902419,-0.8660254037844386,0.5000000000000001,12.56,77.33,65,53.618851987828606,3,2.0,2.0,0,8.37930948405285
Attempted Murder,10/2/2017,8:45,12.9324412,77.564925,2017-02-10 08:45:00,8,4,10,2,1,0,1,0,0,0,0.8660254037844387,-0.49999999999999983,-0.433883739117558,-0.9009688679024191,0.8660254037844386,0.5000000000000001,12.93,77.56,63,5.4130104246318504,3,2.0,1.6,0,6.654212933375475
Attempted Murder,1/5/2017,21:30,12.5641,77.3316,2017-05-01 21:30:00,21,0,1,5,2,0,0,0,1,0,-0.7071067811865477,0.7071067811865474,0.0,1.0,0.49999999999999994,-0.8660254037844387,12.56,77.33,65,53.54085968254627,3,2.0,2.4,0,10.05517138086342
Attempted Murder,6/7/2017,11:15,12.5658,77.334,2017-07-06 11:15:00,11,3,6,7,3,0,1,0,0,0,0.258819045102521,-0.9659258262890682,0.43388373911755823,-0.900968867902419,-0.4999999999999998,-0.8660254037844388,12.56,77.33,65,53.24232111577199,3,2.0,1.6,0,6.70344758724228
Attempted Murder,18/07/2017,18:30,12.5631,77.3315,2017-07-18 18:30:00,18,1,18,7,3,0,0,0,1,0,-1.0,-1.8369701987210297e-16,0.7818314824680298,0.6234898018587336,-0.4999999999999998,-0.8660254037844388,12.56,77.33,65,53.64079461215344,3,2.0,2.4,0,10.05517138086342
Attempted Murder,5/2/2017,22:00,12.5546,77.3403,2017-02-05 22:00:00,22,6,5,2,1,1,0,0,0,1,-0.5000000000000004,0.8660254037844384,-0.7818314824680299,0.6234898018587334,0.8660254037844386,0.5000000000000001,12.55,77.34,2,53.94970801790384,3,2.0,3.0,0,3.295836866004329
Attempted Murder,14/07/2018,23:40,12.5643,77.3331,2018-07-14 23:40:00,23,5,14,7,3,1,0,0,0,1,-0.25881904510252157,0.9659258262890681,-0.9749279121818236,-0.2225209339563146,-0.4999999999999998,-0.8660254037844388,12.56,77.33,65,53.435528178192506,3,2.0,3.0,0,12.568964226079276
Attempted Murder,4/2/2019,12:30,12.5629,77.3454,2019-02-04 12:30:00,12,0,4,2,1,0,0,1,0,0,1.2246467991473532e-16,-1.0,0.0,1.0,0.8660254037844386,0.5000000000000001,12.56,77.34,5,52.8735353684925,3,2.0,2.0,0,3.58351893845611
Attempted Murder,4/4/2019,21:15,12.5649,77.3492,2019-04-04 21:15:00,21,3,4,4,2,0,0,0,1,0,-0.7071067811865477,0.7071067811865474,0.43388373911755823,-0.900968867902419,0.8660254037844387,-0.49999999999999983,12.56,77.34,5,52.472259225631376,3,2.0,2.4,0,4.300222726147331
Attempted Murder,30/04/2019,12:30,12.5668,77.3323,2019-04-30 12:30:00,12,1,30,4,2,0,0,1,0,0,1.2246467991473532e-16,-1.0,0.7818314824680298,0.6234898018587336,0.8660254037844387,-0.49999999999999983,12.56,77.33,65,53.24634384265316,3,2.0,2.0,0,8.37930948405285
Attempted Murder,31/12/2019,12:15,12.5654,77.3309,2019-12-31 12:15:00,12,1,31,12,4,0,0,1,0,0,1.2246467991473532e-16,-1.0,0.7818314824680298,0.6234898018587336,-2.4492935982947064e-16,1.0,12.56,77.33,65,53.45910877178625,3,2.0,2.0,0,8.37930948405285
Robbery,9/1/2015,15:15,12.914562,77.58467,2015-01-09 15:15:00,15,4,9,1,1,0,0,1,0,0,-0.7071067811865471,-0.7071067811865479,-0.433883739117558,-0.9009688679024191,0.49999999999999994,0.8660254037844387,12.91,77.58,105,6.432981116507851,9,7.0,7.0,1,32.64407365878447
Robbery,18/02/2015,13:00,12.912566,77.58986,2015-02-18 13:00:00,13,2,18,2,1,0,0,1,0,0,-0.2588190451025208,-0.9659258262890683,0.9749279121818236,-0.22252093395631434,0.8660254037844386,0.5000000000000001,12.91,77.58,105,6.584348933643392,9,7.0,7.0,1,32.64407365878447
Robbery,25/02/2015,13:30,12.91802,77.58833,2015-02-25 13:30:00,13,2,25,2,1,0,0,1,0,0,-0.2588190451025208,-0.9659258262890683,0.9749279121818236,-0.22252093395631434,0.8660254037844386,0.5000000000000001,12.91,77.58,105,5.996445084511069,9,7.0,7.0,1,32.64407365878447
Robbery,14/05/2015,0:05,12.554512,77.0,2015-05-14 00:05:00,0,3,14,5,2,0,0,0,0,1,0.0,1.0,0.43388373911755823,-0.900968867902419,0.49999999999999994,-0.8660254037844387,12.55,76.99,1,79.42887604534772,9,7.0,10.5,1,7.278045395879426
Robbery,5/7/2015,3:40,12.932946,77.58386,2015-07-05 03:40:00,3,6,5,7,3,1,0,0,0,1,0.7071067811865475,0.7071067811865476,-0.7818314824680299,0.6234898018587334,-0.4999999999999998,-0.8660254037844388,12.93,77.58,74,4.452915241743647,9,7.0,10.5,1,45.33362519213126
Robbery,2/11/2015,9:45,12.915644,77.56456,2015-11-02 09:45:00,9,0,2,11,4,0,1,0,0,0,0.7071067811865476,-0.7071067811865475,0.0,1.0,-0.5000000000000004,0.8660254037844384,12.91,77.56,126,7.022203673000202,9,7.0,5.6000000000000005,0,27.127447684168114
Robbery,7/2/2016,20:45,12.97194,77.59369,2016-02-07 20:45:00,20,6,7,2,1,1,0,0,1,0,-0.8660254037844386,0.5000000000000001,-0.7818314824680299,0.6234898018587334,0.8660254037844386,0.5000000000000001,12.97,77.59,13,0.10560441311587289,9,7.0,8.4,1,22.168081568768173
Robbery,29/02/2016,11:00,12.932554,77.589451,2016-02-29 11:00:00,11,0,29,2,1,0,1,0,0,0,0.258819045102521,-0.9659258262890682,0.0,1.0,0.8660254037844386,0.5000000000000001,12.93,77.58,74,4.377424425602134,9,7.0,5.6000000000000005,0,24.17793343580334
Robbery,7/4/2016,20:15,12.933705,77.5787847,2016-04-07 20:15:00,20,3,7,4,2,0,0,0,1,0,-0.8660254037844386,0.5000000000000001,0.43388373911755823,-0.900968867902419,0.8660254037844387,-0.49999999999999983,12.93,77.57000000000001,40,4.5489301965177615,9,7.0,8.4,1,31.194005360316186
Robbery,9/9/2016,20:15,12.96557,77.60625,2016-09-09 20:15:00,20,4,9,9,3,0,0,0,1,0,-0.8660254037844386,0.5000000000000001,-0.433883739117558,-0.9009688679024191,-1.0,-1.8369701987210297e-16,12.96,77.60000000000001,2,1.4293977960645055,9,7.0,8.4,1,9.228343224812123
Robbery,19/09/2016,23:30,12.916148,77.58543,2016-09-19 23:30:00,23,0,19,9,3,0,0,0,0,1,-0.25881904510252157,0.9659258262890681,0.0,1.0,-1.0,-1.8369701987210297e-16,12.91,77.58,105,6.245547009982673,9,7.0,10.5,1,48.9661104881767
Robbery,9/10/2016,22:00,12.922512,77.588537,2016-10-09 22:00:00,22,6,9,10,4,1,0,0,0,1,-0.5000000000000004,0.8660254037844384,-0.7818314824680299,0.6234898018587334,-0.8660254037844386,0.5000000000000001,12.92,77.58,144,5.4977389710868625,9,7.0,10.5,1,52.25570429541603
Robbery,26/10/2016,21:00,12.97194,77.59369,2016-10-26 21:00:00,21,2,26,10,4,0,0,0,1,0,-0.7071067811865477,0.7071067811865474,0.9749279121818236,-0.22252093395631434,-0.8660254037844386,0.5000000000000001,12.97,77.59,13,0.10560441311587289,9,7.0,8.4,1,22.168081568768173
Robbery,26/10/2016,16:30,12.97194,77.59369,2016-10-26 16:30:00,16,2,26,10,4,0,0,1,0,0,-0.8660254037844384,-0.5000000000000004,0.9749279121818236,-0.22252093395631434,-0.8660254037844386,0.5000000000000001,12.97,77.59,13,0.10560441311587289,9,7.0,7.0,1,18.47340130730681
Robbery,22/11/2016,9:15,12.922517,77.58415,2016-11-22 09:15:00,9,1,22,11,4,0,1,0,0,0,0.7071067811865476,-0.7071067811865475,0.7818314824680298,0.6234898018587336,-0.5000000000000004,0.8660254037844384,12.92,77.58,144,5.574029387112133,9,7.0,5.6000000000000005,0,27.86970895755522
Robbery,29/11/2016,21:35,12.929273,77.582423,2016-11-29 21:35:00,21,1,29,11,4,0,0,0,1,0,-0.7071067811865477,0.7071067811865474,0.7818314824680298,0.6234898018587336,-0.5000000000000004,0.8660254037844384,12.92,77.58,144,4.888034631387105,9,7.0,8.4,1,41.80456343633283
Robbery,2/12/2016,0:30,12.922918,77.58598,2016-12-02 00:30:00,0,4,2,12,4,0,0,0,0,1,0.0,1.0,-0.433883739117558,-0.9009688679024191,-2.4492935982947064e-16,1.0,12.92,77.58,144,5.49319979234788,9,7.0,10.5,1,52.25570429541603
Robbery,9/12/2016,20:00,12.96557,77.60625,2016-12-09 20:00:00,20,4,9,12,4,0,0,0,1,0,-0.8660254037844386,0.5000000000000001,-0.433883739117558,-0.9009688679024191,-2.4492935982947064e-16,1.0,12.96,77.60000000000001,2,1.4293977960645055,9,7.0,8.4,1,9.228343224812123
Robbery,18/12/2016,14:00,12.929273,77.58242,2016-12-18 14:00:00,14,6,18,12,4,1,0,1,0,0,-0.4999999999999998,-0.8660254037844388,-0.7818314824680299,0.6234898018587334,-2.4492935982947064e-16,1.0,12.92,77.58,144,4.888122405772352,9,7.0,7.0,1,34.837136196944016
Robbery,26/12/2016,10:30,12.929273,77.58242,2016-12-26 10:30:00,10,0,26,12,4,0,1,0,0,0,0.49999999999999994,-0.8660254037844387,0.0,1.0,-2.4492935982947064e-16,1.0,12.92,77.58,144,4.888122405772352,9,7.0,5.6000000000000005,0,27.86970895755522
Robbery,27/03/2017,12:30,12.924709,77.589568,2017-03-27 12:30:00,12,0,27,3,1,0,0,1,0,0,1.2246467991473532e-16,-1.0,0.0,1.0,1.0,6.123233995736766e-17,12.92,77.58,144,5.242478905616469,9,7.0,7.0,1,34.837136196944016
Robbery,21/04/2017,10:40,12.920751,77.574677,2017-04-21 10:40:00,10,4,21,4,2,0,1,0,0,0,0.49999999999999994,-0.8660254037844387,-0.433883739117558,-0.9009688679024191,0.8660254037844387,-0.49999999999999983,12.92,77.57000000000001,55,6.052339154098617,9,7.0,5.6000000000000005,0,22.54196946811684
Robbery,21/04/2017,16:30,12.91113,77.572982,2017-04-21 16:30:00,16,4,21,4,2,0,0,1,0,0,-0.8660254037844384,-0.5000000000000004,-0.433883739117558,-0.9009688679024191,0.8660254037844387,-0.49999999999999983,12.91,77.57000000000001,82,7.120400187237103,9,7.0,7.0,1,30.93188425457619
Robbery,25/07/2017,9:00,12.920042,77.583575,2017-07-25 09:00:00,9,1,25,7,3,0,1,0,0,0,0.7071067811865476,-0.7071067811865475,0.7818314824680298,0.6234898018587336,-0.4999999999999998,-0.8660254037844388,12.92,77.58,144,5.856160219030315,9,7.0,5.6000000000000005,0,27.86970895755522
Robbery,28/07/2017,23:30,12.933466,77.584554,2017-07-28 23:30:00,23,4,28,7,3,0,0,0,0,1,-0.25881904510252157,0.9659258262890681,-0.433883739117558,-0.9009688679024191,-0.4999999999999998,-0.8660254037844388,12.93,77.58,74,4.377824470306516,9,7.0,10.5,1,45.33362519213126
Robbery,28/08/2017,14:30,12.923436,77.583712,2017-08-28 14:30:00,14,0,28,8,3,0,0,1,0,0,-0.4999999999999998,-0.8660254037844388,0.0,1.0,-0.8660254037844384,-0.5000000000000004,12.92,77.58,144,5.484027406095201,9,7.0,7.0,1,34.837136196944016
Robbery,12/9/2017,12:10,12.921507,77.580242,2017-09-12 12:10:00,12,1,12,9,3,0,0,1,0,0,1.2246467991473532e-16,-1.0,0.7818314824680298,0.6234898018587336,-1.0,-1.8369701987210297e-16,12.92,77.58,144,5.7833260881125605,9,7.0,7.0,1,34.837136196944016
Robbery,20/09/2017,11:30,12.929507,77.580123,2017-09-20 11:30:00,11,2,20,9,3,0,1,0,0,0,0.258819045102521,-0.9659258262890682,0.9749279121818236,-0.22252093395631434,-1.0,-1.8369701987210297e-16,12.92,77.58,144,4.936450854532233,9,7.0,5.6000000000000005,0,27.86970895755522
Robbery,30/10/2017,22:30,12.933196,77.583949,2017-10-30 22:30:00,22,0,30,10,4,0,0,0,0,1,-0.5000000000000004,0.8660254037844384,0.0,1.0,-0.8660254037844386,0.5000000000000001,12.93,77.58,74,4.423562358402121,9,7.0,10.5,1,45.33362519213126
Robbery,8/11/2017,13:15,12.937057,77.579642,2017-11-08 13:15:00,13,2,8,11,4,0,0,1,0,0,-0.2588190451025208,-0.9659258262890683,0.9749279121818236,-0.22252093395631434,-0.5000000000000004,0.8660254037844384,12.93,77.57000000000001,40,4.169018946669267,9,7.0,7.0,1,25.995004466930155
Robbery,14/11/2017,20:45,12.926539,77.580657,2017-11-14 20:45:00,20,1,14,11,4,0,0,0,1,0,-0.8660254037844386,0.5000000000000001,0.7818314824680298,0.6234898018587336,-0.5000000000000004,0.8660254037844384,12.92,77.58,144,5.233418477148993,9,7.0,8.4,1,41.80456343633283
Robbery,14/11/2017,21:15,12.927594,77.587401,2017-11-14 21:15:00,21,1,14,11,4,0,0,0,1,0,-0.7071067811865477,0.7071067811865474,0.7818314824680298,0.6234898018587336,-0.5000000000000004,0.8660254037844384,12.92,77.58,144,4.955042382795857,9,7.0,8.4,1,41.80456343633283
Robbery,16/11/2017,10:00,12.924444,77.58544,2017-11-16 10:00:00,10,3,16,11,4,0,1,0,0,0,0.49999999999999994,-0.8660254037844387,0.43388373911755823,-0.900968867902419,-0.5000000000000004,0.8660254037844384,12.92,77.58,144,5.336639876289097,9,7.0,5.6000000000000005,0,27.86970895755522
Robbery,17/11/2017,3:15,12.919213,77.589206,2017-11-17 03:15:00,3,4,17,11,4,0,0,0,0,1,0.7071067811865475,0.7071067811865476,-0.433883739117558,-0.9009688679024191,-0.5000000000000004,0.8660254037844384,12.91,77.58,105,5.854423792349902,9,7.0,10.5,1,48.9661104881767
Robbery,1/12/2017,20:45,12.917612,77.57555,2017-12-01 20:45:00,20,4,1,12,4,0,0,0,1,0,-0.8660254037844386,0.5000000000000001,-0.433883739117558,-0.9009688679024191,-2.4492935982947064e-16,1.0,12.91,77.57000000000001,82,6.348243080820622,9,7.0,8.4,1,37.11826110549143
Robbery,20/02/2018,23:10,12.926114,77.584636,2018-02-20 23:10:00,23,1,20,2,1,0,0,0,0,1,-0.25881904510252157,0.9659258262890681,0.7818314824680298,0.6234898018587336,0.8660254037844386,0.5000000000000001,12.92,77.58,144,5.1717862928858676,9,7.0,10.5,1,52.25570429541603
Robbery,2/3/2018,19:50,12.91996,77.577755,2018-03-02 19:50:00,19,4,2,3,1,0,0,0,1,0,-0.9659258262890684,0.2588190451025203,-0.433883739117558,-0.9009688679024191,1.0,6.123233995736766e-17,12.91,77.57000000000001,82,6.025290063473874,9,7.0,8.4,1,37.11826110549143
Robbery,6/4/2018,20:00,12.932965,77.583821,2018-04-06 20:00:00,20,4,6,4,2,0,0,0,1,0,-0.8660254037844386,0.5000000000000001,-0.433883739117558,-0.9009688679024191,0.8660254037844387,-0.49999999999999983,12.93,77.58,74,4.451982984749232,9,7.0,8.4,1,36.26690015370501
Robbery,7/4/2018,0:10,12.922168,77.575662,2018-04-07 00:10:00,0,5,7,4,2,1,0,0,0,1,0.0,1.0,-0.9749279121818236,-0.2225209339563146,0.8660254037844387,-0.49999999999999983,12.92,77.57000000000001,55,5.86722353186107,9,7.0,10.5,1,42.26619275271907
Robbery,14/04/2018,1:15,12.936028,77.581004,2018-04-14 01:15:00,1,5,14,4,2,1,0,0,0,1,0.25881904510252074,0.9659258262890683,-0.9749279121818236,-0.2225209339563146,0.8660254037844387,-0.49999999999999983,12.93,77.58,74,4.220912524225769,9,7.0,10.5,1,45.33362519213126
Robbery,16/04/2018,9:30,12.91802,77.588333,2018-04-16 09:30:00,9,0,16,4,2,0,1,0,0,0,0.7071067811865476,-0.7071067811865475,0.0,1.0,0.8660254037844387,-0.49999999999999983,12.91,77.58,105,5.996408254413527,9,7.0,5.6000000000000005,0,26.115258927027575
Robbery,23/04/2018,0:15,12.918903,77.579729,2018-04-23 00:15:00,0,0,23,4,2,0,0,0,0,1,0.0,1.0,0.0,1.0,0.8660254037844387,-0.49999999999999983,12.91,77.57000000000001,82,6.077209364424743,9,7.0,10.5,1,46.397826381864284
Robbery,26/04/2018,22:30,12.926314,7.579646,2018-04-26 22:30:00,22,3,26,4,2,0,0,0,0,1,-0.5000000000000004,0.8660254037844384,0.43388373911755823,-0.900968867902419,0.8660254037844387,-0.49999999999999983,12.92,7.57,1,7559.745749802293,9,7.0,10.5,1,7.278045395879426
Robbery,8/6/2018,22:00,12.936564,77.579101,2018-06-08 22:00:00,22,4,8,6,2,0,0,0,0,1,-0.5000000000000004,0.8660254037844384,-0.433883739117558,-0.9009688679024191,1.2246467991473532e-16,-1.0,12.93,77.57000000000001,40,4.242445301636946,9,7.0,10.5,1,38.99250670039523
Robbery,27/06/2018,0:30,12.919622,77.576159,2018-06-27 00:30:00,0,2,27,6,2,0,0,0,0,1,0.0,1.0,0.9749279121818236,-0.22252093395631434,1.2246467991473532e-16,-1.0,12.91,77.57000000000001,82,6.115433468238629,9,7.0,10.5,1,46.397826381864284
Robbery,3/8/2018,12:00,12.922461,77.589067,2018-08-03 12:00:00,12,4,3,8,3,0,0,1,0,0,1.2246467991473532e-16,-1.0,-0.433883739117558,-0.9009688679024191,-0.8660254037844384,-0.5000000000000004,12.92,77.58,144,5.496808059585464,9,7.0,7.0,1,34.837136196944016
Robbery,19/08/2018,14:15,12.919946,77.580174,2018-08-19 14:15:00,14,6,19,8,3,1,0,1,0,0,-0.4999999999999998,-0.8660254037844388,-0.7818314824680299,0.6234898018587334,-0.8660254037844384,-0.5000000000000004,12.91,77.58,105,5.952617017673871,9,7.0,7.0,1,32.64407365878447
Robbery,24/10/2018,2:00,12.91795,77.588783,2018-10-24 02:00:00,2,2,24,10,4,0,0,0,0,1,0.49999999999999994,0.8660254037844387,0.9749279121818236,-0.22252093395631434,-0.8660254037844386,0.5000000000000001,12.91,77.58,105,5.998821477229027,9,7.0,10.5,1,48.9661104881767
Robbery,11/11/2018,16:30,12.917777,77.58849,2018-11-11 16:30:00,16,6,11,11,4,1,0,1,0,0,-0.8660254037844384,-0.5000000000000004,-0.7818314824680299,0.6234898018587334,-0.5000000000000004,0.8660254037844384,12.91,77.58,105,6.021360905416744,9,7.0,7.0,1,32.64407365878447
Robbery,6/12/2018,14:00,12.91691,77.5857,2018-12-06 14:00:00,14,3,6,12,4,0,0,1,0,0,-0.4999999999999998,-0.8660254037844388,0.43388373911755823,-0.900968867902419,-2.4492935982947064e-16,1.0,12.91,77.58,105,6.1572593445083985,9,7.0,7.0,1,32.64407365878447
Robbery,7/12/2018,20:10,12.94391,77.5656,2018-12-07 20:10:00,20,4,7,12,4,0,0,0,1,0,-0.8660254037844386,0.5000000000000001,-0.433883739117558,-0.9009688679024191,-2.4492935982947064e-16,1.0,12.94,77.56,99,4.399513225336744,9,7.0,8.4,1,38.68342956229997
Robbery,9/1/2019,11:45,12.91925,77.57409,2019-01-09 11:45:00,11,2,9,1,1,0,1,0,0,0,0.258819045102521,-0.9659258262890682,0.9749279121818236,-0.22252093395631434,0.49999999999999994,0.8660254037844387,12.91,77.57000000000001,82,6.230956536175634,9,7.0,5.6000000000000005,0,24.74550740366095
Robbery,10/1/2019,13:45,12.920789,77.584152,2019-01-10 13:45:00,13,3,10,1,1,0,0,1,0,0,-0.2588190451025208,-0.9659258262890683,0.43388373911755823,-0.900968867902419,0.49999999999999994,0.8660254037844387,12.92,77.58,144,5.7622573675867566,9,7.0,7.0,1,34.837136196944016
Robbery,22/02/2019,14:15,12.9218,77.58027,2019-02-22 14:15:00,14,4,22,2,1,0,0,1,0,0,-0.4999999999999998,-0.8660254037844388,-0.433883739117558,-0.9009688679024191,0.8660254037844386,0.5000000000000001,12.92,77.58,144,5.751133612474528,9,7.0,7.0,1,34.837136196944016
Robbery,10/6/2019,12:30,12.89658,77.58865,2019-06-10 12:30:00,12,0,10,6,2,0,0,1,0,0,1.2246467991473532e-16,-1.0,0.0,1.0,1.2246467991473532e-16,-1.0,12.89,77.58,36,8.366728669770339,9,7.0,7.0,1,25.27642538850957
Robbery,15/06/2019,12:10,12.937897,77.589756,2019-06-15 12:10:00,12,5,15,6,2,1,0,1,0,0,1.2246467991473532e-16,-1.0,-0.9749279121818236,-0.2225209339563146,1.2246467991473532e-16,-1.0,12.93,77.58,74,3.784186177588684,9,7.0,7.0,1,30.22241679475417
Robbery,22/06/2019,20:45,12.935478,77.586977,2019-06-22 20:45:00,20,5,22,6,2,1,0,0,1,0,-0.8660254037844386,0.5000000000000001,-0.9749279121818236,-0.2225209339563146,1.2246467991473532e-16,-1.0,12.93,77.58,74,4.100649827038107,9,7.0,8.4,1,36.26690015370501
Robbery,24/06/2019,20:45,12.913208,77.646289,2019-06-24 20:45:00,20,0,24,6,2,0,0,0,1,0,-0.8660254037844386,0.5000000000000001,0.0,1.0,1.2246467991473532e-16,-1.0,12.91,77.64,1,8.575251820258563,9,7.0,8.4,1,5.8224363167035404
Robbery,10/8/2019,22:30,12.91984,77.57982,2019-08-10 22:30:00,22,5,10,8,3,1,0,0,0,1,-0.5000000000000004,0.8660254037844384,-0.9749279121818236,-0.2225209339563146,-0.8660254037844384,-0.5000000000000004,12.91,77.57000000000001,82,5.9741614004805585,9,7.0,10.5,1,46.397826381864284
Robbery,9/9/2019,14:45,12.88411,77.49496,2019-09-09 14:45:00,14,0,9,9,3,0,0,1,0,0,-0.4999999999999998,-0.8660254037844388,0.0,1.0,-1.0,-1.8369701987210297e-16,12.88,77.49,5,14.534542559240077,9,7.0,7.0,1,12.542316284596385
Robbery,4/10/2019,14:00,13.12876,80.23122,2019-10-04 14:00:00,14,4,4,10,4,0,0,1,0,0,-0.4999999999999998,-0.8660254037844388,-0.433883739117558,-0.9009688679024191,-0.8660254037844386,0.5000000000000001,13.120000000000001,80.23,1,286.1394916504547,9,7.0,7.0,1,4.852030263919617
Robbery,10/10/2019,0:45,12.93131,77.55262,2019-10-10 00:45:00,0,3,10,10,4,0,0,0,0,1,0.0,1.0,0.43388373911755823,-0.900968867902419,-0.8660254037844386,0.5000000000000001,12.93,77.55,76,6.384834744252688,9,7.0,10.5,1,45.609956929463685
Robbery,30/12/2019,13:00,12.28657,76.63203,2019-12-30 13:00:00,13,0,30,12,4,0,0,1,0,0,-0.2588190451025208,-0.9659258262890683,0.0,1.0,-2.4492935982947064e-16,1.0,12.280000000000001,76.63,7,129.26871615654997,9,7.0,7.0,1,14.55609079175885
Robbery,20/03/2015,22:30,12.9164781,77.5877546,2015-03-20 22:30:00,22,4,20,3,1,0,0,0,0,1,-0.5000000000000004,0.8660254037844384,-0.433883739117558,-0.9009688679024191,1.0,6.123233995736766e-17,12.91,77.58,105,6.174004703873086,9,7.0,10.5,1,48.9661104881767
Robbery,22/06/2015,15:20,12.9113469,77.5934304,2015-06-22 15:20:00,15,0,22,6,2,0,0,1,0,0,-0.7071067811865471,-0.7071067811865479,0.0,1.0,1.2246467991473532e-16,-1.0,12.91,77.59,48,6.70103788123362,9,7.0,7.0,1,27.242742086774385
Robbery,6/7/2015,16:20,12.8136962,77.587486,2015-07-06 16:20:00,16,0,6,7,3,0,0,1,0,0,-0.8660254037844384,-0.5000000000000004,0.0,1.0,-0.4999999999999998,-0.8660254037844388,12.81,77.58,1,17.575025438772162,9,7.0,7.0,1,4.852030263919617
Robbery,7/7/2015,9:10,12.9155917,77.5770282,2015-07-07 09:10:00,9,1,7,7,3,0,1,0,0,0,0.7071067811865476,-0.7071067811865475,0.7818314824680298,0.6234898018587336,-0.4999999999999998,-0.8660254037844388,12.91,77.57000000000001,82,6.51246025345495,9,7.0,5.6000000000000005,0,24.74550740366095
Robbery,10/7/2015,16:30,12.8893536,77.5463813,2015-07-10 16:30:00,16,4,10,7,3,0,0,1,0,0,-0.8660254037844384,-0.5000000000000004,-0.433883739117558,-0.9009688679024191,-0.4999999999999998,-0.8660254037844388,12.88,77.54,41,10.533096043098885,9,7.0,7.0,1,26.163687327983578
Robbery,11/8/2015,2:30,12.911969,77.5861441,2015-08-11 02:30:00,2,1,11,8,3,0,0,0,0,1,0.49999999999999994,0.8660254037844387,0.7818314824680298,0.6234898018587336,-0.8660254037844384,-0.5000000000000004,12.91,77.58,105,6.69368702623738,9,7.0,10.5,1,48.9661104881767
Robbery,14/08/2015,20:00,12.9163635,77.5902451,2015-08-14 20:00:00,20,4,14,8,3,0,0,0,1,0,-0.8660254037844386,0.5000000000000001,-0.433883739117558,-0.9009688679024191,-0.8660254037844384,-0.5000000000000004,12.91,77.59,48,6.160123170046987,9,7.0,8.4,1,32.69129050412926
Robbery,29/09/2015,16:00,12.9081752,77.5982283,2015-09-29 16:00:00,16,1,29,9,3,0,0,1,0,0,-0.8660254037844384,-0.5000000000000004,0.7818314824680298,0.6234898018587336,-1.0,-1.8369701987210297e-16,12.9,77.59,25,7.063468725050685,9,7.0,7.0,1,22.806675766150374
Robbery,2/1/2016,9:15,12.9048333,77.5789134,2016-01-02 09:15:00,9,5,2,1,1,1,1,0,0,0,0.7071067811865476,-0.7071067811865475,-0.9749279121818236,-0.2225209339563146,0.49999999999999994,0.8660254037844387,12.9,77.57000000000001,96,7.616264688868263,9,7.0,5.6000000000000005,0,25.618381479618947
Robbery,27/02/2016,11:30,12.9126892,77.5892209,2016-02-27 11:30:00,11,5,27,2,1,1,1,0,0,0,0.258819045102521,-0.9659258262890682,-0.9749279121818236,-0.2225209339563146,0.8660254037844386,0.5000000000000001,12.91,77.58,105,6.576468496989851,9,7.0,5.6000000000000005,0,26.115258927027575
Robbery,31/03/2016,15:00,12.9016312,77.5710152,2016-03-31 15:00:00,15,3,31,3,1,0,0,1,0,0,-0.7071067811865471,-0.7071067811865479,0.43388373911755823,-0.900968867902419,1.0,6.123233995736766e-17,12.9,77.57000000000001,96,8.189260845067617,9,7.0,7.0,1,32.02297684952368
Robbery,11/4/2016,2:15,12.9164782,77.5901863,2016-04-11 02:15:00,2,0,11,4,2,0,0,0,0,1,0.49999999999999994,0.8660254037844387,0.0,1.0,0.8660254037844387,-0.49999999999999983,12.91,77.59,48,6.147899137356057,9,7.0,10.5,1,40.86411313016158
Robbery,2/5/2016,22:35,12.9165042,77.5836202,2016-05-02 22:35:00,22,0,2,5,2,0,0,0,0,1,-0.5000000000000004,0.8660254037844384,0.0,1.0,0.49999999999999994,-0.8660254037844387,12.91,77.58,105,6.24085345460861,9,7.0,10.5,1,48.9661104881767
Robbery,8/5/2016,3:30,12.9160929,77.5835311,2016-05-08 03:30:00,3,6,8,5,2,1,0,0,0,1,0.7071067811865475,0.7071067811865476,-0.7818314824680299,0.6234898018587334,0.49999999999999994,-0.8660254037844387,12.91,77.58,105,6.287590172364041,9,7.0,10.5,1,48.9661104881767
Robbery,2/6/2016,17:35,12.9064281,77.5923107,2016-06-02 17:35:00,17,3,2,6,2,0,0,1,0,0,-0.9659258262890683,-0.25881904510252063,0.43388373911755823,-0.900968867902419,1.2246467991473532e-16,-1.0,12.9,77.59,25,7.251030185794085,9,7.0,7.0,1,22.806675766150374
Robbery,9/6/2016,19:30,12.9138583,77.5843258,2016-06-09 19:30:00,19,3,9,6,2,0,0,0,1,0,-0.9659258262890684,0.2588190451025203,0.43388373911755823,-0.900968867902419,1.2246467991473532e-16,-1.0,12.91,77.58,105,6.516409447862006,9,7.0,8.4,1,39.17288839054137
Robbery,23/06/2016,12:45,12.9164782,77.5901863,2016-06-23 12:45:00,12,3,23,6,2,0,0,1,0,0,1.2246467991473532e-16,-1.0,0.43388373911755823,-0.900968867902419,1.2246467991473532e-16,-1.0,12.91,77.59,48,6.147899137356057,9,7.0,7.0,1,27.242742086774385
Robbery,15/07/2016,19:30,12.9105691,77.5737605,2016-07-15 19:30:00,19,4,15,7,3,0,0,0,1,0,-0.9659258262890684,0.2588190451025203,-0.433883739117558,-0.9009688679024191,-0.4999999999999998,-0.8660254037844388,12.91,77.57000000000001,82,7.15224120183731,9,7.0,8.4,1,37.11826110549143
Robbery,18/07/2016,16:35,12.9152662,77.5844226,2016-07-18 16:35:00,16,0,18,7,3,0,0,1,0,0,-0.8660254037844384,-0.5000000000000004,0.0,1.0,-0.4999999999999998,-0.8660254037844388,12.91,77.58,105,6.36038848141061,9,7.0,7.0,1,32.64407365878447
Robbery,30/07/2016,6:15,12.9116237,77.5965099,2016-07-30 06:15:00,6,5,30,7,3,1,1,0,0,0,1.0,6.123233995736766e-17,-0.9749279121818236,-0.2225209339563146,-0.4999999999999998,-0.8660254037844388,12.91,77.59,48,6.6722713041727015,9,7.0,5.6000000000000005,0,21.79419366941951
Robbery,24/08/2016,12:30,12.9116497,77.5899438,2016-08-24 12:30:00,12,2,24,8,3,0,0,1,0,0,1.2246467991473532e-16,-1.0,0.9749279121818236,-0.22252093395631434,-0.8660254037844384,-0.5000000000000004,12.91,77.58,105,6.685239521100619,9,7.0,7.0,1,32.64407365878447
Robbery,1/9/2016,12:30,12.9170307,77.5682909,2016-09-01 12:30:00,12,3,1,9,3,0,0,1,0,0,1.2246467991473532e-16,-1.0,0.43388373911755823,-0.900968867902419,-1.0,-1.8369701987210297e-16,12.91,77.56,126,6.704275570231904,9,7.0,7.0,1,33.90930960521014
Robbery,10/9/2016,2:05,12.9117957,77.5826913,2016-09-10 02:05:00,2,5,10,9,3,1,0,0,0,1,0.49999999999999994,0.8660254037844387,-0.9749279121818236,-0.2225209339563146,-1.0,-1.8369701987210297e-16,12.91,77.58,105,6.774005681263098,9,7.0,10.5,1,48.9661104881767
Robbery,13/10/2016,14:30,12.9047516,77.5859256,2016-10-13 14:30:00,14,3,13,10,4,0,0,1,0,0,-0.4999999999999998,-0.8660254037844388,0.43388373911755823,-0.900968867902419,-0.8660254037844386,0.5000000000000001,12.9,77.58,43,7.492410920213235,9,7.0,7.0,1,26.48932743742783
Robbery,18/10/2016,7:45,12.9080001,77.5989745,2016-10-18 07:45:00,7,1,18,10,4,0,1,0,0,0,0.9659258262890683,-0.25881904510252063,0.7818314824680298,0.6234898018587336,-0.8660254037844386,0.5000000000000001,12.9,77.59,25,7.0878580199170065,9,7.0,5.6000000000000005,0,18.2453406129203
Robbery,19/10/2016,21:00,12.9134896,77.5767334,2016-10-19 21:00:00,21,2,19,10,4,0,0,0,1,0,-0.7071067811865477,0.7071067811865474,0.9749279121818236,-0.22252093395631434,-0.8660254037844386,0.5000000000000001,12.91,77.57000000000001,82,6.7454372379791785,9,7.0,8.4,1,37.11826110549143
Robbery,19/10/2016,21:00,12.9087019,77.5877553,2016-10-19 21:00:00,21,2,19,10,4,0,0,0,1,0,-0.7071067811865477,0.7071067811865474,0.9749279121818236,-0.22252093395631434,-0.8660254037844386,0.5000000000000001,12.9,77.58,43,7.033174972924298,9,7.0,8.4,1,31.787192924913395
Robbery,20/10/2016,3:10,12.9151204,77.5837865,2016-10-20 03:10:00,3,3,20,10,4,0,0,0,0,1,0.7071067811865475,0.7071067811865476,0.43388373911755823,-0.900968867902419,-0.8660254037844386,0.5000000000000001,12.91,77.58,105,6.388640098667627,9,7.0,10.5,1,48.9661104881767
Robbery,22/12/2016,0:30,12.9166068,77.5773499,2016-12-22 00:30:00,0,3,22,12,4,0,0,0,0,1,0.0,1.0,0.43388373911755823,-0.900968867902419,-2.4492935982947064e-16,1.0,12.91,77.57000000000001,82,6.3943244195647795,9,7.0,10.5,1,46.397826381864284
Robbery,10/2/2017,11:40,12.9094322,77.5706543,2017-02-10 11:40:00,11,4,10,2,1,0,1,0,0,0,0.258819045102521,-0.9659258262890682,-0.433883739117558,-0.9009688679024191,0.8660254037844386,0.5000000000000001,12.9,77.57000000000001,96,7.383775734315842,9,7.0,5.6000000000000005,0,25.618381479618947
Robbery,28/03/2017,13:32,12.9168638,77.5832552,2017-03-28 13:32:00,13,1,28,3,1,0,0,1,0,0,-0.2588190451025208,-0.9659258262890683,0.7818314824680298,0.6234898018587336,1.0,6.123233995736766e-17,12.91,77.58,105,6.209316307895457,9,7.0,7.0,1,32.64407365878447
Robbery,5/6/2017,13:00,12.906925,77.5842211,2017-06-05 13:00:00,13,0,5,6,2,0,0,1,0,0,-0.2588190451025208,-0.9659258262890683,0.0,1.0,1.2246467991473532e-16,-1.0,12.9,77.58,43,7.2789596086046595,9,7.0,7.0,1,26.48932743742783
Robbery,30/07/2017,17:00,12.9174342,77.5735833,2017-07-30 17:00:00,17,6,30,7,3,1,0,1,0,0,-0.9659258262890683,-0.25881904510252063,-0.7818314824680299,0.6234898018587334,-0.4999999999999998,-0.8660254037844388,12.91,77.57000000000001,82,6.439205211726525,9,7.0,7.0,1,30.93188425457619
Robbery,4/9/2017,9:30,12.9174602,77.5670172,2017-09-04 09:30:00,9,0,4,9,3,0,1,0,0,0,0.7071067811865476,-0.7071067811865475,0.0,1.0,-1.0,-1.8369701987210297e-16,12.91,77.56,126,6.7213186816980866,9,7.0,5.6000000000000005,0,27.127447684168114
Robbery,20/09/2017,14:00,12.9064191,77.5945086,2017-09-20 14:00:00,14,2,20,9,3,0,0,1,0,0,-0.4999999999999998,-0.8660254037844388,0.9749279121818236,-0.22252093395631434,-1.0,-1.8369701987210297e-16,12.9,77.59,25,7.247792162550444,9,7.0,7.0,1,22.806675766150374
Robbery,2/10/2017,10:30,12.9142916,77.5909833,2017-10-02 10:30:00,10,0,2,10,4,0,1,0,0,0,0.49999999999999994,-0.8660254037844387,0.0,1.0,-0.8660254037844386,0.5000000000000001,12.91,77.59,48,6.384445332604964,9,7.0,5.6000000000000005,0,21.79419366941951
Robbery,21/01/2018,9:00,12.9103454,77.5902119,2018-01-21 09:00:00,9,6,21,1,1,1,1,0,0,0,0.7071067811865476,-0.7071067811865475,-0.7818314824680299,0.6234898018587334,0.49999999999999994,0.8660254037844387,12.91,77.59,48,6.827781151455446,9,7.0,5.6000000000000005,0,21.79419366941951
Chain Snatching,15/09/2017,20:30,12.94898752,77.56995676,2017-09-15 20:30:00,20,4,15,9,3,0,0,0,1,0,-0.8660254037844386,0.5000000000000001,-0.433883739117558,-0.9009688679024191,-1.0,-1.8369701987210297e-16,12.94,77.56,99,3.667860524541081,4,2.0,2.4,0,11.05240844637142
Chain Snatching,4/5/2018,22:00,12.9556,77.56883,2018-05-04 22:00:00,22,4,4,5,2,0,0,0,0,1,-0.5000000000000004,0.8660254037844384,-0.433883739117558,-0.9009688679024191,0.49999999999999994,-0.8660254037844387,12.950000000000001,77.56,65,3.3110565494562296,4,2.0,3.0,0,12.568964226079276
Chain Snatching,6/1/2015,15:30,12.9486433,77.57586657,2015-01-06 15:30:00,15,1,6,1,1,0,0,1,0,0,-0.7071067811865471,-0.7071067811865479,0.7818314824680298,0.6234898018587336,0.49999999999999994,0.8660254037844387,12.94,77.57000000000001,55,3.2614435164602544,4,2.0,2.0,0,8.0507033814703
Chain Snatching,8/7/2016,10:30,12.96020902,77.57035056,2016-07-08 10:30:00,10,4,8,7,3,0,1,0,0,0,0.49999999999999994,-0.8660254037844387,-0.433883739117558,-0.9009688679024191,-0.4999999999999998,-0.8660254037844388,12.96,77.57000000000001,4,2.9170111541524313,4,2.0,1.6,0,2.5751006598945607
Chain Snatching,11/6/2017,9:15,12.9527423802776,77.5763878294634,2017-06-11 09:15:00,9,6,11,6,2,1,1,0,0,0,0.7071067811865476,-0.7071067811865475,-0.7818314824680299,0.6234898018587334,1.2246467991473532e-16,-1.0,12.950000000000001,77.57000000000001,30,2.8795078384232866,4,2.0,1.6,0,5.494379527176235
Chain Snatching,12/3/2019,17:30,12.9579316,77.56937036,2019-03-12 17:30:00,17,1,12,3,1,0,0,1,0,0,-0.9659258262890683,-0.25881904510252063,0.7818314824680298,0.6234898018587336,1.0,6.123233995736766e-17,12.950000000000001,77.56,65,3.1279603570785435,4,2.0,2.0,0,8.37930948405285
Chain Snatching,1/6/2015,15:30,12.564415,77.333533,2015-06-01 15:30:00,15,0,1,6,2,0,0,1,0,0,-0.7071067811865471,-0.7071067811865479,0.0,1.0,1.2246467991473532e-16,-1.0,12.56,77.33,65,53.39977681701386,4,2.0,2.0,0,8.37930948405285
Chain Snatching,10/1/2015,12:30,12.93965,77.55687,2015-01-10 12:30:00,12,5,10,1,1,1,0,1,0,0,1.2246467991473532e-16,-1.0,-0.9749279121818236,-0.2225209339563146,0.49999999999999994,0.8660254037844387,12.93,77.55,76,5.416462148830346,4,2.0,2.0,0,8.687610843707368
Chain Snatching,10/2/2015,20:45,12.94464,77.56029,2015-02-10 20:45:00,20,1,10,2,1,0,0,0,1,0,-0.8660254037844386,0.5000000000000001,0.7818314824680298,0.6234898018587336,0.8660254037844386,0.5000000000000001,12.94,77.56,99,4.77598156289282,4,2.0,2.4,0,11.05240844637142
Chain Snatching,11/4/2015,11:30,12.94305,77.5541,2015-04-11 11:30:00,11,5,11,4,2,1,1,0,0,0,0.258819045102521,-0.9659258262890682,-0.9749279121818236,-0.2225209339563146,0.8660254037844387,-0.49999999999999983,12.94,77.55,85,5.416557761359549,4,2.0,1.6,0,7.126955674005612
Chain Snatching,1/8/2016,21:30,12.942041,77.561018,2016-08-01 21:30:00,21,0,1,8,3,0,0,0,1,0,-0.7071067811865477,0.7071067811865474,0.0,1.0,-0.8660254037844384,-0.5000000000000004,12.94,77.56,99,4.9036705819426265,4,2.0,2.4,0,11.05240844637142
Chain Snatching,1/8/2017,15:00,12.943552,77.550541,2017-08-01 15:00:00,15,1,1,8,3,0,0,1,0,0,-0.7071067811865471,-0.7071067811865479,0.7818314824680298,0.6234898018587336,-0.8660254037844384,-0.5000000000000004,12.94,77.55,85,5.702776398752255,4,2.0,2.0,0,8.908694592507015
Chain Snatching,4/1/2017,11:00,12.935795,77.656466,2017-01-04 11:00:00,11,2,4,1,1,0,1,0,0,0,0.258819045102521,-0.9659258262890682,0.9749279121818236,-0.22252093395631434,0.49999999999999994,0.8660254037844387,12.93,77.65,1,7.797195314452491,4,2.0,1.6,0,1.1090354888959124
Chain Snatching,5/2/2017,15:30,12.929073,77.570739,2017-02-05 15:30:00,15,6,5,2,1,1,0,1,0,0,-0.7071067811865471,-0.7071067811865479,-0.7818314824680299,0.6234898018587334,0.8660254037844386,0.5000000000000001,12.92,77.57000000000001,55,5.389569236281912,4,2.0,2.0,0,8.0507033814703
Chain Snatching,7/10/2017,23:00,12.942216,77.554679,2017-10-07 23:00:00,23,5,7,10,4,1,0,0,0,1,-0.25881904510252157,0.9659258262890681,-0.9749279121818236,-0.2225209339563146,-0.8660254037844386,0.5000000000000001,12.94,77.55,85,5.421234510705082,4,2.0,3.0,0,13.363041888760522
Chain Snatching,12/11/2017,22:30,12.944505,77.561971,2017-11-12 22:30:00,22,6,12,11,4,1,0,0,0,1,-0.5000000000000004,0.8660254037844384,-0.7818314824680299,0.6234898018587334,-0.5000000000000004,0.8660254037844384,12.94,77.56,99,4.645310000561886,4,2.0,3.0,0,13.815510557964275
Chain Snatching,7/9/2018,6:30,12.94619,77.55094,2018-09-07 06:30:00,6,4,7,9,3,0,1,0,0,0,1.0,6.123233995736766e-17,-0.433883739117558,-0.9009688679024191,-1.0,-1.8369701987210297e-16,12.94,77.55,85,5.510606849694729,4,2.0,1.6,0,7.126955674005612
Chain Snatching,9/5/2018,19:40,12.94354,77.56295,2018-05-09 19:40:00,19,2,9,5,2,0,0,0,1,0,-0.9659258262890684,0.2588190451025203,0.9749279121818236,-0.22252093395631434,0.49999999999999994,-0.8660254037844387,12.94,77.56,99,4.636602625019283,4,2.0,2.4,0,11.05240844637142
Chain Snatching,9/9/2018,22:00,12.942063,77.559585,2018-09-09 22:00:00,22,6,9,9,3,1,0,0,0,1,-0.5000000000000004,0.8660254037844384,-0.7818314824680299,0.6234898018587334,-1.0,-1.8369701987210297e-16,12.94,77.55,85,5.018387422042815,4,2.0,3.0,0,13.363041888760522
Chain Snatching,1/10/2019,21:45,12.94285,77.56216,2019-10-01 21:45:00,21,1,1,10,4,0,0,0,1,0,-0.7071067811865477,0.7071067811865474,0.7818314824680298,0.6234898018587336,-0.8660254037844386,0.5000000000000001,12.94,77.56,99,4.751560663844416,4,2.0,2.4,0,11.05240844637142
Chain Snatching,1/10/2019,23:30,12.94519,77.55699,2019-10-01 23:30:00,23,1,1,10,4,0,0,0,0,1,-0.25881904510252157,0.9659258262890681,0.7818314824680298,0.6234898018587336,-0.8660254037844386,0.5000000000000001,12.94,77.55,85,5.023342337013696,4,2.0,3.0,0,13.363041888760522
Chain Snatching,2/3/2019,20:15,12.935247,77.554545,2019-03-02 20:15:00,20,5,2,3,1,1,0,0,1,0,-0.8660254037844386,0.5000000000000001,-0.9749279121818236,-0.2225209339563146,1.0,6.123233995736766e-17,12.93,77.55,76,5.93131582044381,4,2.0,2.4,0,10.42513301244884
Chain Snatching,9/10/2019,16:00,12.94551,7756466.0,2019-10-09 16:00:00,16,2,9,10,4,0,0,1,0,0,-0.8660254037844384,-0.5000000000000004,0.9749279121818236,-0.22252093395631434,-0.8660254037844386,0.5000000000000001,12.94,7756465.99,1,16987.932559349974,4,2.0,2.0,0,1.3862943611198906
Chain Snatching,12/3/2019,18:30,12.944193,77.556826,2019-03-12 18:30:00,18,1,12,3,1,0,0,0,1,0,-1.0,-1.8369701987210297e-16,0.7818314824680298,0.6234898018587336,1.0,6.123233995736766e-17,12.94,77.55,85,5.103197266827475,4,2.0,2.4,0,10.690433511008417
Chain Snatching,12/9/2019,12:00,12.93912,77.55505,2019-09-12 12:00:00,12,3,12,9,3,0,0,1,0,0,1.2246467991473532e-16,-1.0,0.43388373911755823,-0.900968867902419,-1.0,-1.8369701987210297e-16,12.93,77.55,76,5.604635680914569,4,2.0,2.0,0,8.687610843707368
Robbery,28/01/2018,17:10,12.9217529,77.5825697,2018-01-28 17:10:00,17,6,28,1,1,1,0,1,0,0,-0.9659258262890683,-0.25881904510252063,-0.7818314824680299,0.6234898018587334,0.49999999999999994,0.8660254037844387,12.92,77.58,144,5.694001926520257,9,7.0,7.0,1,34.837136196944016
Robbery,29/01/2018,22:00,12.9116237,77.5965099,2018-01-29 22:00:00,22,0,29,1,1,0,0,0,0,1,-0.5000000000000004,0.8660254037844384,0.0,1.0,0.49999999999999994,0.8660254037844387,12.91,77.59,48,6.6722713041727015,9,7.0,10.5,1,40.86411313016158
Robbery,24/02/2018,9:30,12.9105119,77.5928196,2018-02-24 09:30:00,9,5,24,2,1,1,1,0,0,0,0.7071067811865476,-0.7071067811865475,-0.9749279121818236,-0.2225209339563146,0.8660254037844386,0.5000000000000001,12.91,77.59,48,6.795426476784104,9,7.0,5.6000000000000005,0,21.79419366941951
Robbery,7/3/2018,12:00,12.9074749,77.5904753,2018-03-07 12:00:00,12,2,7,3,1,0,0,1,0,0,1.2246467991473532e-16,-1.0,0.9749279121818236,-0.22252093395631434,1.0,6.123233995736766e-17,12.9,77.59,25,7.144383098277705,9,7.0,7.0,1,22.806675766150374
Robbery,24/03/2018,16:00,12.9296592,77.5521606,2018-03-24 16:00:00,16,5,24,3,1,1,0,1,0,0,-0.8660254037844384,-0.5000000000000004,-0.9749279121818236,-0.2225209339563146,1.0,6.123233995736766e-17,12.92,77.55,55,6.549816564773719,9,7.0,7.0,1,28.177461835146048
Robbery,11/5/2018,22:00,12.9094322,77.5706543,2018-05-11 22:00:00,22,4,11,5,2,0,0,0,0,1,-0.5000000000000004,0.8660254037844384,-0.433883739117558,-0.9009688679024191,0.49999999999999994,-0.8660254037844387,12.9,77.57000000000001,96,7.383775734315842,9,7.0,10.5,1,48.03446527428552
Robbery,12/7/2018,21:10,12.9159395,77.5922482,2018-07-12 21:10:00,21,3,12,7,3,0,0,0,1,0,-0.7071067811865477,0.7071067811865474,0.43388373911755823,-0.900968867902419,-0.4999999999999998,-0.8660254037844388,12.91,77.59,48,6.194410496470855,9,7.0,8.4,1,32.69129050412926
Robbery,29/07/2018,5:30,12.9106658,77.5759798,2018-07-29 05:30:00,5,6,29,7,3,1,0,0,0,1,0.9659258262890683,0.25881904510252074,-0.7818314824680299,0.6234898018587334,-0.4999999999999998,-0.8660254037844388,12.91,77.57000000000001,82,7.069671402533308,9,7.0,10.5,1,46.397826381864284
Robbery,9/8/2018,16:00,12.9169723,77.5901235,2018-08-09 16:00:00,16,3,9,8,3,0,0,1,0,0,-0.8660254037844384,-0.5000000000000004,0.43388373911755823,-0.900968867902419,-0.8660254037844384,-0.5000000000000004,12.91,77.59,48,6.093663731544162,9,7.0,7.0,1,27.242742086774385
Robbery,1/2/2019,22:55,12.9075378,77.5842326,2019-02-01 22:55:00,22,4,1,2,1,0,0,0,0,1,-0.5000000000000004,0.8660254037844384,-0.433883739117558,-0.9009688679024191,0.8660254037844386,0.5000000000000001,12.9,77.58,43,7.2114509914303975,9,7.0,10.5,1,39.73399115614174
Robbery,12/3/2019,16:30,12.9162687,77.5893259,2019-03-12 16:30:00,16,1,12,3,1,0,0,1,0,0,-0.8660254037844384,-0.5000000000000004,0.7818314824680298,0.6234898018587336,1.0,6.123233995736766e-17,12.91,77.58,105,6.179050365020802,9,7.0,7.0,1,32.64407365878447
Robbery,6/4/2019,4:15,12.9142916,77.5909833,2019-04-06 04:15:00,4,5,6,4,2,1,0,0,0,1,0.8660254037844386,0.5000000000000001,-0.9749279121818236,-0.2225209339563146,0.8660254037844387,-0.49999999999999983,12.91,77.59,48,6.384445332604964,9,7.0,10.5,1,40.86411313016158
Robbery,17/05/2019,15:30,12.9069002,77.592889,2019-05-17 15:30:00,15,4,17,5,2,0,0,1,0,0,-0.7071067811865471,-0.7071067811865479,-0.433883739117558,-0.9009688679024191,0.49999999999999994,-0.8660254037844387,12.9,77.59,25,7.196678645396568,9,7.0,7.0,1,22.806675766150374
Robbery,13/06/2019,19:00,12.9146676,77.5876323,2019-06-13 19:00:00,19,3,13,6,2,0,0,0,1,0,-0.9659258262890684,0.2588190451025203,0.43388373911755823,-0.900968867902419,1.2246467991473532e-16,-1.0,12.91,77.58,105,6.375466958080038,9,7.0,8.4,1,39.17288839054137
Robbery,14/11/2019,18:30,12.9166559,77.5836937,2019-11-14 18:30:00,18,3,14,11,4,0,0,0,1,0,-1.0,-1.8369701987210297e-16,0.43388373911755823,-0.900968867902419,-0.5000000000000004,0.8660254037844384,12.91,77.58,105,6.22277761762947,9,7.0,8.4,1,39.17288839054137
Robbery,27/06/2018,12:00,12.967071,77.670484,2018-06-27 12:00:00,12,2,27,6,2,0,0,1,0,0,1.2246467991473532e-16,-1.0,0.9749279121818236,-0.22252093395631434,1.2246467991473532e-16,-1.0,12.96,77.67,1,8.238074485690099,9,7.0,7.0,1,4.852030263919617
Robbery,25/10/2018,11:30,12.94355,77.60976,2018-10-25 11:30:00,11,3,25,10,4,0,1,0,0,0,0.258819045102521,-0.9659258262890682,0.43388373911755823,-0.900968867902419,-0.8660254037844386,0.5000000000000001,12.94,77.60000000000001,2,3.5251996298341797,9,7.0,5.6000000000000005,0,6.152228816541415
Robbery,6/6/2019,12:30,12.91166,77.5572,2019-06-06 12:30:00,12,3,6,6,2,0,0,1,0,0,1.2246467991473532e-16,-1.0,0.43388373911755823,-0.900968867902419,1.2246467991473532e-16,-1.0,12.91,77.55,40,7.800627569555512,9,7.0,7.0,1,25.995004466930155
Robbery,12/9/2019,20:45,12.92013,77.56925,2019-09-12 20:45:00,20,3,12,9,3,0,0,0,1,0,-0.8660254037844386,0.5000000000000001,0.43388373911755823,-0.900968867902419,-1.0,-1.8369701987210297e-16,12.92,77.56,33,6.348373790953578,9,7.0,8.4,1,29.62142840677576
Robbery,9/10/2015,0:35,12.94046,77.597527,2015-10-09 00:35:00,0,4,9,10,4,0,0,0,0,1,0.0,1.0,-0.433883739117558,-0.9009688679024191,-0.8660254037844386,0.5000000000000001,12.94,77.59,130,3.4771069145626936,9,7.0,10.5,1,51.18957189361209
Robbery,17/07/2016,13:00,12.943567,77.580167,2016-07-17 13:00:00,13,6,17,7,3,1,0,1,0,0,-0.2588190451025208,-0.9659258262890683,-0.7818314824680299,0.6234898018587334,-0.4999999999999998,-0.8660254037844388,12.94,77.58,80,3.487493564925773,9,7.0,7.0,1,30.761144082707073
Robbery,15/09/2016,10:00,12.939297,77.585205,2016-09-15 10:00:00,10,3,15,9,3,0,1,0,0,0,0.49999999999999994,-0.8660254037844387,0.43388373911755823,-0.900968867902419,-1.0,-1.8369701987210297e-16,12.93,77.58,74,3.7334238459446474,9,7.0,5.6000000000000005,0,24.17793343580334
Robbery,28/09/2016,9:00,12.937969,77.580158,2016-09-28 09:00:00,9,2,28,9,3,0,1,0,0,0,0.7071067811865476,-0.7071067811865475,0.9749279121818236,-0.22252093395631434,-1.0,-1.8369701987210297e-16,12.93,77.58,74,4.053864512481237,9,7.0,5.6000000000000005,0,24.17793343580334
Robbery,9/1/2017,5:30,12.943814,77.59715,2017-01-09 05:30:00,5,0,9,1,1,0,0,0,0,1,0.9659258262890683,0.25881904510252074,0.0,1.0,0.49999999999999994,0.8660254037844387,12.94,77.59,130,3.101994389481793,9,7.0,10.5,1,51.18957189361209
Robbery,1/2/2017,20:15,12.947515,77.593908,2017-02-01 20:15:00,20,2,1,2,1,0,0,0,1,0,-0.8660254037844386,0.5000000000000001,0.9749279121818236,-0.22252093395631434,0.8660254037844386,0.5000000000000001,12.94,77.59,130,2.6791794101030506,9,7.0,8.4,1,40.951657514889675
Robbery,23/02/2017,1:00,12.942503,77.580992,2017-02-23 01:00:00,1,3,23,2,1,0,0,0,0,1,0.25881904510252074,0.9659258262890683,0.43388373911755823,-0.900968867902419,0.8660254037844386,0.5000000000000001,12.94,77.58,80,3.5556362751613992,9,7.0,10.5,1,46.14171612406061
Robbery,27/05/2017,14:45,12.947859,77.592105,2017-05-27 14:45:00,14,5,27,5,2,1,0,1,0,0,-0.4999999999999998,-0.8660254037844388,-0.9749279121818236,-0.2225209339563146,0.49999999999999994,-0.8660254037844387,12.94,77.59,130,2.6536874051648467,9,7.0,7.0,1,34.12638126240806
Robbery,28/08/2017,11:00,12.947859,77.592105,2017-08-28 11:00:00,11,0,28,8,3,0,1,0,0,0,0.258819045102521,-0.9659258262890682,0.0,1.0,-0.8660254037844384,-0.5000000000000004,12.94,77.59,130,2.6536874051648467,9,7.0,5.6000000000000005,0,27.30110500992645
Robbery,6/1/2018,20:00,12.943814,77.59715,2018-01-06 20:00:00,20,5,6,1,1,1,0,0,1,0,-0.8660254037844386,0.5000000000000001,-0.9749279121818236,-0.2225209339563146,0.49999999999999994,0.8660254037844387,12.94,77.59,130,3.101994389481793,9,7.0,8.4,1,40.951657514889675
Robbery,9/1/2018,21:00,12.938436,77.583998,2018-01-09 21:00:00,21,1,9,1,1,0,0,0,1,0,-0.7071067811865477,0.7071067811865474,0.7818314824680298,0.6234898018587336,0.49999999999999994,0.8660254037844387,12.93,77.58,74,3.862489901978766,9,7.0,8.4,1,36.26690015370501
Robbery,17/01/2018,20:00,12.942646,77.581997,2018-01-17 20:00:00,20,2,17,1,1,0,0,0,1,0,-0.8660254037844386,0.5000000000000001,0.9749279121818236,-0.22252093395631434,0.49999999999999994,0.8660254037844387,12.94,77.58,80,3.4972248574479905,9,7.0,8.4,1,36.91337289924849
Robbery,27/01/2018,16:00,12.951453,77.590628,2018-01-27 16:00:00,16,5,27,1,1,1,0,1,0,0,-0.8660254037844384,-0.5000000000000004,-0.9749279121818236,-0.2225209339563146,0.49999999999999994,0.8660254037844387,12.950000000000001,77.59,7,2.281216639580188,9,7.0,7.0,1,14.55609079175885
Robbery,20/03/2018,11:00,12.943639,77.58514,2018-03-20 11:00:00,11,1,20,3,1,0,1,0,0,0,0.258819045102521,-0.9659258262890682,0.7818314824680298,0.6234898018587336,1.0,6.123233995736766e-17,12.94,77.58,80,3.273759840201509,9,7.0,5.6000000000000005,0,24.60891526616566
Robbery,22/03/2018,16:00,12.936762,77.585131,2018-03-22 16:00:00,16,3,22,3,1,0,0,1,0,0,-0.8660254037844384,-0.5000000000000004,0.43388373911755823,-0.900968867902419,1.0,6.123233995736766e-17,12.93,77.58,74,4.007404714934039,9,7.0,7.0,1,30.22241679475417
Robbery,28/03/2018,23:00,12.937108,77.601273,2018-03-28 23:00:00,23,2,28,3,1,0,0,0,0,1,-0.25881904510252157,0.9659258262890681,0.9749279121818236,-0.22252093395631434,1.0,6.123233995736766e-17,12.93,77.60000000000001,3,3.9029090116408987,9,7.0,10.5,1,14.556090791758852
Robbery,28/03/2018,11:00,12.938445,77.58516,2018-03-28 11:00:00,11,2,28,3,1,0,1,0,0,0,0.258819045102521,-0.9659258262890682,0.9749279121818236,-0.22252093395631434,1.0,6.123233995736766e-17,12.93,77.58,74,3.825960071782685,9,7.0,5.6000000000000005,0,24.17793343580334
Robbery,28/03/2018,21:00,12.936003,77.58669,2018-03-28 21:00:00,21,2,28,3,1,0,0,0,1,0,-0.7071067811865477,0.7071067811865474,0.9749279121818236,-0.22252093395631434,1.0,6.123233995736766e-17,12.93,77.58,74,4.049954394511987,9,7.0,8.4,1,36.26690015370501
Robbery,27/04/2018,21:00,12.941563,77.582748,2018-04-27 21:00:00,21,4,27,4,2,0,0,0,1,0,-0.7071067811865477,0.7071067811865474,-0.433883739117558,-0.9009688679024191,0.8660254037844387,-0.49999999999999983,12.94,77.58,80,3.578386228080766,9,7.0,8.4,1,36.91337289924849
Robbery,4/7/2018,22:00,12.939297,77.585205,2018-07-04 22:00:00,22,2,4,7,3,0,0,0,0,1,-0.5000000000000004,0.8660254037844384,0.9749279121818236,-0.22252093395631434,-0.4999999999999998,-0.8660254037844388,12.93,77.58,74,3.7334238459446474,9,7.0,10.5,1,45.33362519213126
Robbery,8/2/2019,9:00,12.936003,77.58669,2019-02-08 09:00:00,9,4,8,2,1,0,1,0,0,0,0.7071067811865476,-0.7071067811865475,-0.433883739117558,-0.9009688679024191,0.8660254037844386,0.5000000000000001,12.93,77.58,74,4.049954394511987,9,7.0,5.6000000000000005,0,24.17793343580334
Robbery,22/02/2019,12:10,12.942646,77.581997,2019-02-22 12:10:00,12,4,22,2,1,0,0,1,0,0,1.2246467991473532e-16,-1.0,-0.433883739117558,-0.9009688679024191,0.8660254037844386,0.5000000000000001,12.94,77.58,80,3.4972248574479905,9,7.0,7.0,1,30.761144082707073
Robbery,13/03/2019,12:30,12.936049,77.592597,2019-03-13 12:30:00,12,2,13,3,1,0,0,1,0,0,1.2246467991473532e-16,-1.0,0.9749279121818236,-0.22252093395631434,1.0,6.123233995736766e-17,12.93,77.59,58,3.9590453639010876,9,7.0,7.0,1,28.54276210734004
Robbery,25/03/2019,20:35,12.945058,77.591578,2019-03-25 20:35:00,20,0,25,3,1,0,0,0,1,0,-0.8660254037844386,0.5000000000000001,0.0,1.0,1.0,6.123233995736766e-17,12.94,77.59,130,2.9694480230264158,9,7.0,8.4,1,40.951657514889675
Robbery,7/4/2019,12:00,12.94576,77.587228,2019-04-07 12:00:00,12,6,7,4,2,1,0,1,0,0,1.2246467991473532e-16,-1.0,-0.7818314824680299,0.6234898018587334,0.8660254037844387,-0.49999999999999983,12.94,77.58,80,2.9822617175838366,9,7.0,7.0,1,30.761144082707073
Robbery,18/05/2019,11:00,12.947913,77.580038,2019-05-18 11:00:00,11,5,18,5,2,1,1,0,0,0,0.258819045102521,-0.9659258262890682,-0.9749279121818236,-0.2225209339563146,0.49999999999999994,-0.8660254037844387,12.94,77.58,80,3.070390844823454,9,7.0,5.6000000000000005,0,24.60891526616566
Robbery,27/06/2019,1:00,12.937956,77.598712,2019-06-27 01:00:00,1,3,27,6,2,0,0,0,0,1,0.25881904510252074,0.9659258262890683,0.43388373911755823,-0.900968867902419,1.2246467991473532e-16,-1.0,12.93,77.59,58,3.7674861138511417,9,7.0,10.5,1,42.81414316101006
Robbery,10/7/2019,15:00,12.943814,77.59715,2019-07-10 15:00:00,15,2,10,7,3,0,0,1,0,0,-0.7071067811865471,-0.7071067811865479,0.9749279121818236,-0.22252093395631434,-0.4999999999999998,-0.8660254037844388,12.94,77.59,130,3.101994389481793,9,7.0,7.0,1,34.12638126240806
Robbery,18/12/2019,16:30,12.942884,77.585104,2019-12-18 16:30:00,16,2,18,12,4,0,0,1,0,0,-0.8660254037844384,-0.5000000000000004,0.9749279121818236,-0.22252093395631434,-2.4492935982947064e-16,1.0,12.94,77.58,80,3.3547880707845925,9,7.0,7.0,1,30.761144082707073
Robbery,10/2/2015,22:00,12.859828,77.56893,2015-02-10 22:00:00,22,1,10,2,1,0,0,0,0,1,-0.5000000000000004,0.8660254037844384,0.7818314824680298,0.6234898018587336,0.8660254037844386,0.5000000000000001,12.85,77.56,9,12.736070763770595,9,7.0,10.5,1,24.177143476437482
Robbery,10/2/2015,22:30,12.859653,77.569358,2015-02-10 22:30:00,22,1,10,2,1,0,0,0,0,1,-0.5000000000000004,0.8660254037844384,0.7818314824680298,0.6234898018587336,0.8660254037844386,0.5000000000000001,12.85,77.56,9,12.745023134025503,9,7.0,10.5,1,24.177143476437482
Robbery,25/05/2015,3:00,12.873803,77.561605,2015-05-25 03:00:00,3,0,25,5,2,0,0,0,0,1,0.7071067811865475,0.7071067811865476,0.0,1.0,0.49999999999999994,-0.8660254037844387,12.870000000000001,77.56,25,11.447394874752506,9,7.0,10.5,1,34.210013649225566
Robbery,6/6/2015,9:00,12.870523,77.569048,2015-06-06 09:00:00,9,5,6,6,2,1,1,0,0,0,0.7071067811865476,-0.7071067811865475,-0.9749279121818236,-0.2225209339563146,1.2246467991473532e-16,-1.0,12.870000000000001,77.56,25,11.575396530765728,9,7.0,5.6000000000000005,0,18.2453406129203
Robbery,19/12/2015,23:00,12.857031,77.530484,2015-12-19 23:00:00,23,5,19,12,4,1,0,0,0,1,-0.25881904510252157,0.9659258262890681,-0.9749279121818236,-0.2225209339563146,-2.4492935982947064e-16,1.0,12.85,77.53,1,14.511504783854514,9,7.0,10.5,1,7.278045395879426
Robbery,23/12/2015,23:00,12.885917,77.545639,2015-12-23 23:00:00,23,2,23,12,4,0,0,0,0,1,-0.25881904510252157,0.9659258262890681,0.9749279121818236,-0.22252093395631434,-2.4492935982947064e-16,1.0,12.88,77.54,41,10.905470075076495,9,7.0,10.5,1,39.24553099197537
Robbery,18/3/2016,21:00,12.875936,77.53409,2016-03-18 21:00:00,21,4,18,3,1,0,0,0,1,0,-0.7071067811865477,0.7071067811865474,-0.433883739117558,-0.9009688679024191,1.0,6.123233995736766e-17,12.870000000000001,77.53,25,12.496404749173148,9,7.0,8.4,1,27.368010919380453
Robbery,20/03/2016,9:00,12.856699,77.562385,2016-03-20 09:00:00,9,6,20,3,1,1,1,0,0,0,0.7071067811865476,-0.7071067811865475,-0.7818314824680299,0.6234898018587334,1.0,6.123233995736766e-17,12.85,77.56,9,13.244902431698245,9,7.0,5.6000000000000005,0,12.894476520766657
Robbery,19/04/2016,21:00,12.887446,77.502459,2016-04-19 21:00:00,21,1,19,4,2,0,0,0,1,0,-0.7071067811865477,0.7071067811865474,0.7818314824680298,0.6234898018587336,0.8660254037844387,-0.49999999999999983,12.88,77.5,3,13.685022496266257,9,7.0,8.4,1,11.644872633407081
Robbery,19/10/2016,12:15,12.88599,77.502802,2016-10-19 12:15:00,12,2,19,10,4,0,0,1,0,0,1.2246467991473532e-16,-1.0,0.9749279121818236,-0.22252093395631434,-0.8660254037844386,0.5000000000000001,12.88,77.5,3,13.769370369658658,9,7.0,7.0,1,9.704060527839234
Robbery,5/11/2016,12:30,12.878482,77.495114,2016-11-05 12:30:00,12,5,5,11,4,1,0,1,0,0,1.2246467991473532e-16,-1.0,-0.9749279121818236,-0.2225209339563146,-0.5000000000000004,0.8660254037844384,12.870000000000001,77.49,3,14.948686123221302,9,7.0,7.0,1,9.704060527839234
Robbery,11/11/2016,12:30,12.857638,77.527322,2016-11-11 12:30:00,12,4,11,11,4,0,0,1,0,0,1.2246467991473532e-16,-1.0,-0.433883739117558,-0.9009688679024191,-0.5000000000000004,0.8660254037844384,12.85,77.52,3,14.620152824267247,9,7.0,7.0,1,9.704060527839234
Robbery,30/04/2017,23:30,12.865732,77.523058,2017-04-30 23:30:00,23,6,30,4,2,1,0,0,0,1,-0.25881904510252157,0.9659258262890681,-0.7818314824680299,0.6234898018587334,0.8660254037844387,-0.49999999999999983,12.86,77.52,11,14.096107754952723,9,7.0,10.5,1,26.091519822774004
Robbery,14/06/2017,3:30,12.892692,77.536615,2017-06-14 03:30:00,3,2,14,6,2,0,0,0,0,1,0.7071067811865475,0.7071067811865476,0.9749279121818236,-0.22252093395631434,1.2246467991473532e-16,-1.0,12.89,77.53,8,10.792401661904384,9,7.0,10.5,1,23.070858062030304
Robbery,4/11/2017,9:45,12.745859,77.487815,2017-11-04 09:45:00,9,5,4,11,4,1,1,0,0,0,0.7071067811865476,-0.7071067811865475,-0.9749279121818236,-0.2225209339563146,-0.5000000000000004,0.8660254037844384,12.74,77.48,3,27.64200631200978,9,7.0,5.6000000000000005,0,7.763248422271388
Robbery,12/7/2017,12:30,12.859938,77.56061,2017-07-12 12:30:00,12,2,12,7,3,0,0,1,0,0,1.2246467991473532e-16,-1.0,0.9749279121818236,-0.22252093395631434,-0.4999999999999998,-0.8660254037844388,12.85,77.56,9,12.951226681764899,9,7.0,7.0,1,16.11809565095832
Robbery,23/03/2018,9:00,12.874399,77.560296,2018-03-23 09:00:00,9,4,23,3,1,0,1,0,0,0,0.7071067811865476,-0.7071067811865475,-0.433883739117558,-0.9009688679024191,1.0,6.123233995736766e-17,12.870000000000001,77.56,25,11.429811959010367,9,7.0,5.6000000000000005,0,18.2453406129203
Robbery,9/4/2018,8:30,12.901526,77.513039,2018-04-09 08:30:00,8,0,9,4,2,0,1,0,0,0,0.8660254037844387,-0.49999999999999983,0.0,1.0,0.8660254037844387,-0.49999999999999983,12.9,77.51,1,11.783074927542824,9,7.0,5.6000000000000005,0,3.881624211135694
Robbery,27/05/2018,1:00,12.876377,77.53243,2018-05-27 01:00:00,1,6,27,5,2,1,0,0,0,1,0.25881904510252074,0.9659258262890683,-0.7818314824680299,0.6234898018587334,0.49999999999999994,-0.8660254037844387,12.870000000000001,77.53,25,12.550347940828852,9,7.0,10.5,1,34.210013649225566
Robbery,27/05/2018,1:00,12.892718,77.52418,2018-05-27 01:00:00,1,6,27,5,2,1,0,0,0,1,0.25881904510252074,0.9659258262890683,-0.7818314824680299,0.6234898018587334,0.49999999999999994,-0.8660254037844387,12.89,77.52,4,11.626637551219613,9,7.0,10.5,1,16.89909808055805
Robbery,27/08/2018,4:20,12.858318,77.525526,2018-08-27 04:20:00,4,0,27,8,3,0,0,0,0,1,0.8660254037844386,0.5000000000000001,0.0,1.0,-0.8660254037844384,-0.5000000000000004,12.85,77.52,3,14.653147613530551,9,7.0,10.5,1,14.556090791758852
Robbery,1/6/2019,17:30,12.876729,77.553495,2019-06-01 17:30:00,17,5,1,6,2,1,0,1,0,0,-0.9659258262890683,-0.25881904510252063,-0.9749279121818236,-0.2225209339563146,1.2246467991473532e-16,-1.0,12.870000000000001,77.55,12,11.451244779896324,9,7.0,7.0,1,17.954645502230758
Robbery,12/7/2019,21:25,12.85398,77.576174,2019-07-12 21:25:00,21,4,12,7,3,0,0,0,1,0,-0.7071067811865477,0.7071067811865474,-0.433883739117558,-0.9009688679024191,-0.4999999999999998,-0.8660254037844388,12.85,77.57000000000001,9,13.230339925219319,9,7.0,8.4,1,19.341714781149985
Robbery,29/11/2019,18:00,12.857882,77.527602,2019-11-29 18:00:00,18,4,29,11,4,0,0,0,1,0,-1.0,-1.8369701987210297e-16,-0.433883739117558,-0.9009688679024191,-0.5000000000000004,0.8660254037844384,12.85,77.52,3,14.58150498695676,9,7.0,8.4,1,11.644872633407081
Robbery,23/01/2017,15:00,12.889521,77.577839,2017-01-23 15:00:00,15,0,23,1,1,0,0,1,0,0,-0.7071067811865471,-0.7071067811865479,0.0,1.0,0.49999999999999994,0.8660254037844387,12.88,77.57000000000001,71,9.305777281674176,9,7.0,7.0,1,29.936662833112386
Robbery,24/02/2017,19:35,12.885756,77.579713,2017-02-24 19:35:00,19,4,24,2,1,0,0,0,1,0,-0.9659258262890684,0.2588190451025203,-0.433883739117558,-0.9009688679024191,0.8660254037844386,0.5000000000000001,12.88,77.57000000000001,71,9.68080740852909,9,7.0,8.4,1,35.923995399734864
Robbery,6/3/2017,5:15,12.888655,77.571018,2017-03-06 05:15:00,5,0,6,3,1,0,0,0,0,1,0.9659258262890683,0.25881904510252074,0.0,1.0,1.0,6.123233995736766e-17,12.88,77.57000000000001,71,9.570608336703627,9,7.0,10.5,1,44.90499424966858
Robbery,8/3/2017,15:30,12.87848,77.569592,2017-03-08 15:30:00,15,2,8,3,1,0,0,1,0,0,-0.7071067811865471,-0.7071067811865479,0.9749279121818236,-0.22252093395631434,1.0,6.123233995736766e-17,12.870000000000001,77.56,25,10.703310197781201,9,7.0,7.0,1,22.806675766150374
Robbery,16/05/2017,7:14,12.882357,77.77573462,2017-05-16 07:14:00,7,1,16,5,2,0,1,0,0,0,0.9659258262890683,-0.25881904510252063,0.7818314824680298,0.6234898018587336,0.49999999999999994,-0.8660254037844387,12.88,77.77,1,21.99638761357739,9,7.0,5.6000000000000005,0,3.881624211135694
Robbery,16/05/2017,17:14,12.891752,77.575516,2017-05-16 17:14:00,17,1,16,5,2,0,0,1,0,0,-0.9659258262890683,-0.25881904510252063,0.7818314824680298,0.6234898018587336,0.49999999999999994,-0.8660254037844387,12.89,77.57000000000001,44,9.11639895146411,9,7.0,7.0,1,26.64663742839224
Robbery,31/05/2017,21:00,12.885163,77.570415,2017-05-31 21:00:00,21,2,31,5,2,0,0,0,1,0,-0.7071067811865477,0.7071067811865474,0.9749279121818236,-0.22252093395631434,0.49999999999999994,-0.8660254037844387,12.88,77.57000000000001,71,9.962339627683939,9,7.0,8.4,1,35.923995399734864
Robbery,21/06/2017,22:15,12.875421,77.579941,2017-06-21 22:15:00,22,2,21,6,2,0,0,0,0,1,-0.5000000000000004,0.8660254037844384,0.9749279121818236,-0.22252093395631434,1.2246467991473532e-16,-1.0,12.870000000000001,77.57000000000001,14,10.811977264101237,9,7.0,10.5,1,28.434527111573207
Robbery,10/9/2017,15:30,12.860251,77.580196,2017-09-10 15:30:00,15,6,10,9,3,1,0,1,0,0,-0.7071067811865471,-0.7071067811865479,-0.7818314824680299,0.6234898018587334,-1.0,-1.8369701987210297e-16,12.86,77.58,63,12.479474108615744,9,7.0,7.0,1,29.1121815835177
Robbery,1/3/2018,3:30,12.850571,77.586299,2018-03-01 03:30:00,3,3,1,3,1,0,0,0,0,1,0.7071067811865475,0.7071067811865476,0.43388373911755823,-0.900968867902419,1.0,6.123233995736766e-17,12.85,77.58,11,13.487850760516373,9,7.0,10.5,1,26.091519822774004
Robbery,10/4/2018,21:00,12.8619,77.58093,2018-04-10 21:00:00,21,1,10,4,2,0,0,0,1,0,-0.7071067811865477,0.7071067811865474,0.7818314824680298,0.6234898018587336,0.8660254037844387,-0.49999999999999983,12.86,77.58,63,12.287729379851175,9,7.0,8.4,1,34.93461790022124
Robbery,12/10/2018,19:00,12.866076,77.580691,2018-10-12 19:00:00,19,4,12,10,4,0,0,0,1,0,-0.9659258262890684,0.2588190451025203,-0.433883739117558,-0.9009688679024191,-0.8660254037844386,0.5000000000000001,12.86,77.58,63,11.83017081299587,9,7.0,8.4,1,34.93461790022124
Robbery,20/10/2018,1:00,12.850571,77.586299,2018-10-20 01:00:00,1,5,20,10,4,1,0,0,0,1,0.25881904510252074,0.9659258262890683,-0.9749279121818236,-0.2225209339563146,-0.8660254037844386,0.5000000000000001,12.85,77.58,11,13.487850760516373,9,7.0,10.5,1,26.091519822774004
Robbery,26/02/2019,17:30,12.882334,77.576126,2019-02-26 17:30:00,17,1,26,2,1,0,0,1,0,0,-0.9659258262890683,-0.25881904510252063,0.7818314824680298,0.6234898018587336,0.8660254037844386,0.5000000000000001,12.88,77.57000000000001,71,10.125839684758326,9,7.0,7.0,1,29.936662833112386
Robbery,20/05/2019,5:00,12.897698,77.585786,2019-05-20 05:00:00,5,0,20,5,2,0,0,0,0,1,0.9659258262890683,0.25881904510252074,0.0,1.0,0.49999999999999994,-0.8660254037844387,12.89,77.58,36,8.272857531969326,9,7.0,10.5,1,37.914638082764355
Robbery,22/08/2019,16:30,12.882496,77.56783,2019-08-22 16:30:00,16,3,22,8,3,0,0,1,0,0,-0.8660254037844384,-0.5000000000000004,0.43388373911755823,-0.900968867902419,-0.8660254037844384,-0.5000000000000004,12.88,77.56,64,10.323950883611158,9,7.0,7.0,1,29.22071088926946
Robbery,20/12/2019,23:45,12.858499,77.592674,2019-12-20 23:45:00,23,4,20,12,4,0,0,0,0,1,-0.25881904510252157,0.9659258262890681,-0.433883739117558,-0.9009688679024191,-2.4492935982947064e-16,1.0,12.85,77.59,1,12.577989666910023,9,7.0,10.5,1,7.278045395879426
Robbery,5/2/2015,23:15,12.9061712471247,77.5698458437946,2015-02-05 23:15:00,23,3,5,2,1,0,0,0,0,1,-0.25881904510252157,0.9659258262890681,0.43388373911755823,-0.900968867902419,0.8660254037844386,0.5000000000000001,12.9,77.56,89,7.754176337433942,9,7.0,10.5,1,47.24800153846778
Robbery,11/2/2015,17:00,12.9028808337357,77.5721867734704,2015-02-11 17:00:00,17,2,11,2,1,0,0,1,0,0,-0.9659258262890683,-0.25881904510252063,0.9749279121818236,-0.22252093395631434,0.8660254037844386,0.5000000000000001,12.9,77.57000000000001,96,8.017992062652711,9,7.0,7.0,1,32.02297684952368
Robbery,2/5/2015,15:00,12.8928133912158,77.5666300513369,2015-05-02 15:00:00,15,5,2,5,2,1,0,1,0,0,-0.7071067811865471,-0.7071067811865479,-0.9749279121818236,-0.2225209339563146,0.49999999999999994,-0.8660254037844387,12.89,77.56,99,9.270259607280016,9,7.0,7.0,1,32.23619130191664
Robbery,12/5/2016,7:00,12.9135877680617,77.5722179865643,2016-05-12 07:00:00,7,3,12,5,2,0,1,0,0,0,0.9659258262890683,-0.25881904510252063,0.43388373911755823,-0.900968867902419,0.49999999999999994,-0.8660254037844387,12.91,77.57000000000001,82,6.891612999243473,9,7.0,5.6000000000000005,0,24.74550740366095
Robbery,31/05/2016,20:10,12.9080860118657,77.5629920799456,2016-05-31 20:10:00,20,1,31,5,2,0,0,0,1,0,-0.8660254037844386,0.5000000000000001,0.7818314824680298,0.6234898018587336,0.49999999999999994,-0.8660254037844387,12.9,77.56,89,7.849283332610608,9,7.0,8.4,1,37.798401230774225
Robbery,28/07/2016,23:45,12.8903442323649,77.5642779498096,2016-07-28 23:45:00,23,3,28,7,3,0,0,0,0,1,-0.25881904510252157,0.9659258262890681,0.43388373911755823,-0.900968867902419,-0.4999999999999998,-0.8660254037844388,12.89,77.56,99,9.614269199354531,9,7.0,10.5,1,48.354286952874965
Robbery,13/11/2016,11:45,12.9155719870194,77.5732155912695,2016-11-13 11:45:00,11,6,13,11,4,1,1,0,0,0,0.258819045102521,-0.9659258262890682,-0.7818314824680299,0.6234898018587334,-0.5000000000000004,0.8660254037844384,12.91,77.57000000000001,82,6.647083285787532,9,7.0,5.6000000000000005,0,24.74550740366095
Robbery,1/12/2016,18:30,12.9155359324014,77.5616258170776,2016-12-01 18:30:00,18,3,1,12,4,0,0,0,1,0,-1.0,-1.8369701987210297e-16,0.43388373911755823,-0.900968867902419,-2.4492935982947064e-16,1.0,12.91,77.56,126,7.1855710018050445,9,7.0,8.4,1,40.69117152625217
Robbery,12/12/2016,14:30,12.8957622003642,77.5599416215927,2016-12-12 14:30:00,14,0,12,12,4,0,0,1,0,0,-0.4999999999999998,-0.8660254037844388,0.0,1.0,-2.4492935982947064e-16,1.0,12.89,77.55,56,9.231455077323396,9,7.0,7.0,1,28.301358874841853
Robbery,5/1/2017,11:35,12.892719430893,77.5668159621641,2017-01-05 11:35:00,11,3,5,1,1,0,1,0,0,0,0.258819045102521,-0.9659258262890682,0.43388373911755823,-0.900968867902419,0.49999999999999994,0.8660254037844387,12.89,77.56,99,9.273572489388954,9,7.0,5.6000000000000005,0,25.788953041533315
Robbery,6/3/2017,23:50,12.9118926466343,77.5668833550517,2017-03-06 23:50:00,23,0,6,3,1,0,0,0,0,1,-0.25881904510252157,0.9659258262890681,0.0,1.0,1.0,6.123233995736766e-17,12.91,77.56,126,7.287000019080066,9,7.0,10.5,1,50.86396440781521
Robbery,21/07/2017,21:00,12.9084421818488,77.5636739766668,2017-07-21 21:00:00,21,4,21,7,3,0,0,0,1,0,-0.7071067811865477,0.7071067811865474,-0.433883739117558,-0.9009688679024191,-0.4999999999999998,-0.8660254037844388,12.9,77.56,89,7.781555008602226,9,7.0,8.4,1,37.798401230774225
Robbery,29/08/2017,23:00,12.9136600912658,77.5652671305881,2017-08-29 23:00:00,23,1,29,8,3,0,0,0,0,1,-0.25881904510252157,0.9659258262890681,0.7818314824680298,0.6234898018587336,-0.8660254037844384,-0.5000000000000004,12.91,77.56,126,7.184162476633018,9,7.0,10.5,1,50.86396440781521
Robbery,1/9/2017,18:00,12.9133048035839,77.5680350394204,2017-09-01 18:00:00,18,4,1,9,3,0,0,0,1,0,-1.0,-1.8369701987210297e-16,-0.433883739117558,-0.9009688679024191,-1.0,-1.8369701987210297e-16,12.91,77.56,126,7.0926559641855444,9,7.0,8.4,1,40.69117152625217
Robbery,11/2/2017,1:30,12.904336,77.559845,2017-02-11 01:30:00,1,5,11,2,1,1,0,0,0,1,0.25881904510252074,0.9659258262890683,-0.9749279121818236,-0.2225209339563146,0.8660254037844386,0.5000000000000001,12.9,77.55,37,8.374243209887597,9,7.0,10.5,1,38.19465467712705
Robbery,28/11/2017,21:00,12.915784,77.567908,2017-11-28 21:00:00,21,1,28,11,4,0,0,0,1,0,-0.7071067811865477,0.7071067811865474,0.7818314824680298,0.6234898018587336,-0.5000000000000004,0.8660254037844384,12.91,77.56,126,6.847424965304831,9,7.0,8.4,1,40.69117152625217
Robbery,1/1/2018,17:15,12.9143691111693,77.5733106370572,2018-01-01 17:15:00,17,0,1,1,1,0,0,1,0,0,-0.9659258262890683,-0.25881904510252063,0.0,1.0,0.49999999999999994,0.8660254037844387,12.91,77.57000000000001,82,6.769089900214802,9,7.0,7.0,1,30.93188425457619
Robbery,15/02/2018,13:00,12.9011494733062,77.5706465675149,2018-02-15 13:00:00,13,3,15,2,1,0,0,1,0,0,-0.2588190451025208,-0.9659258262890683,0.43388373911755823,-0.900968867902419,0.8660254037844386,0.5000000000000001,12.9,77.57000000000001,96,8.252647381646744,9,7.0,7.0,1,32.02297684952368
Robbery,27/07/2018,15:30,12.8987338627581,77.5582034663051,2018-07-27 15:30:00,15,4,27,7,3,0,0,1,0,0,-0.7071067811865471,-0.7071067811865479,-0.433883739117558,-0.9009688679024191,-0.4999999999999998,-0.8660254037844388,12.89,77.55,56,9.011457248378818,9,7.0,7.0,1,28.301358874841853
Robbery,28/07/2018,13:00,12.9061712471247,77.5698458437946,2018-07-28 13:00:00,13,5,28,7,3,1,0,1,0,0,-0.2588190451025208,-0.9659258262890683,-0.9749279121818236,-0.2225209339563146,-0.4999999999999998,-0.8660254037844388,12.9,77.56,89,7.754176337433942,9,7.0,7.0,1,31.498667692311855
Robbery,6/10/2018,18:00,12.892719430893,77.5668159621641,2018-10-06 18:00:00,18,5,6,10,4,1,0,0,1,0,-1.0,-1.8369701987210297e-16,-0.9749279121818236,-0.2225209339563146,-0.8660254037844386,0.5000000000000001,12.89,77.56,99,9.273572489388954,9,7.0,8.4,1,38.68342956229997
Robbery,16/11/2018,16:15,12.9028808337357,77.5721867734704,2018-11-16 16:15:00,16,4,16,11,4,0,0,1,0,0,-0.8660254037844384,-0.5000000000000004,-0.433883739117558,-0.9009688679024191,-0.5000000000000004,0.8660254037844384,12.9,77.57000000000001,96,8.017992062652711,9,7.0,7.0,1,32.02297684952368
Robbery,18/11/2018,9:30,12.9028808337357,77.5721867734704,2018-11-18 09:30:00,9,6,18,11,4,1,1,0,0,0,0.7071067811865476,-0.7071067811865475,-0.7818314824680299,0.6234898018587334,-0.5000000000000004,0.8660254037844384,12.9,77.57000000000001,96,8.017992062652711,9,7.0,5.6000000000000005,0,25.618381479618947
Robbery,4/12/2018,15:00,12.9155359324014,77.5616258170776,2018-12-04 15:00:00,15,1,4,12,4,0,0,1,0,0,-0.7071067811865471,-0.7071067811865479,0.7818314824680298,0.6234898018587336,-2.4492935982947064e-16,1.0,12.91,77.56,126,7.1855710018050445,9,7.0,7.0,1,33.90930960521014
Robbery,28/02/2019,14:30,12.897974662761,77.5627143420956,2019-02-28 14:30:00,14,3,28,2,1,0,0,1,0,0,-0.4999999999999998,-0.8660254037844388,0.43388373911755823,-0.900968867902419,0.8660254037844386,0.5000000000000001,12.89,77.56,99,8.886167865565659,9,7.0,7.0,1,32.23619130191664
Robbery,30/03/2019,11:50,12.9026072787272,77.5614887435773,2019-03-30 11:50:00,11,5,30,3,1,1,1,0,0,0,0.258819045102521,-0.9659258262890682,-0.9749279121818236,-0.2225209339563146,1.0,6.123233995736766e-17,12.9,77.56,89,8.469374060741798,9,7.0,5.6000000000000005,0,25.198934153849486
Robbery,6/6/2019,19:15,12.8928133912158,77.5666300513369,2019-06-06 19:15:00,19,3,6,6,2,0,0,0,1,0,-0.9659258262890684,0.2588190451025203,0.43388373911755823,-0.900968867902419,1.2246467991473532e-16,-1.0,12.89,77.56,99,9.270259607280016,9,7.0,8.4,1,38.68342956229997
Robbery,24/06/2019,23:00,12.8996965673904,77.5716115576741,2019-06-24 23:00:00,23,0,24,6,2,0,0,0,0,1,-0.25881904510252157,0.9659258262890681,0.0,1.0,1.2246467991473532e-16,-1.0,12.89,77.57000000000001,44,8.374454200327651,9,7.0,10.5,1,39.96995614258836
Robbery,10/7/2019,13:45,12.8957622003642,77.5599416215927,2019-07-10 13:45:00,13,2,10,7,3,0,0,1,0,0,-0.2588190451025208,-0.9659258262890683,0.9749279121818236,-0.22252093395631434,-0.4999999999999998,-0.8660254037844388,12.89,77.55,56,9.231455077323396,9,7.0,7.0,1,28.301358874841853
Robbery,14/10/2015,12:30,12.930897,77.53865,2015-10-14 12:30:00,12,2,14,10,4,0,0,1,0,0,1.2246467991473532e-16,-1.0,0.9749279121818236,-0.22252093395631434,-0.8660254037844386,0.5000000000000001,12.93,77.53,9,7.566072849418588,9,7.0,7.0,1,16.11809565095832
Robbery,26/11/2015,17:00,12.933404,77.543486,2015-11-26 17:00:00,17,3,26,11,4,0,0,1,0,0,-0.9659258262890683,-0.25881904510252063,0.43388373911755823,-0.900968867902419,-0.5000000000000004,0.8660254037844384,12.93,77.54,28,6.979920621356847,9,7.0,7.0,1,23.57107080990532
Robbery,5/1/2016,20:30,12.939522,77.544467,2016-01-05 20:30:00,20,1,5,1,1,0,0,0,1,0,-0.8660254037844386,0.5000000000000001,0.7818314824680298,0.6234898018587336,0.49999999999999994,0.8660254037844387,12.93,77.54,28,6.498948717196143,9,7.0,8.4,1,28.285284971886384
Robbery,2/6/2016,21:30,12.939585,77.441454,2016-06-02 21:30:00,21,3,2,6,2,0,0,0,1,0,-0.7071067811865477,0.7071067811865474,0.43388373911755823,-0.900968867902419,1.2246467991473532e-16,-1.0,12.93,77.44,1,16.97309071938187,9,7.0,8.4,1,5.8224363167035404
Robbery,11/8/2016,9:30,12.938629,77.544029,2016-08-11 09:30:00,9,3,11,8,3,0,1,0,0,0,0.7071067811865476,-0.7071067811865475,0.43388373911755823,-0.900968867902419,-0.8660254037844384,-0.5000000000000004,12.93,77.54,28,6.593377492905444,9,7.0,5.6000000000000005,0,18.856856647924257
Robbery,1/4/2017,2:35,12.943601,77.544829,2017-04-01 02:35:00,2,5,1,4,2,1,0,0,0,1,0.49999999999999994,0.8660254037844387,-0.9749279121818236,-0.2225209339563146,0.8660254037844387,-0.49999999999999983,12.94,77.54,29,6.227459393105369,9,7.0,10.5,1,35.712572507452634
Robbery,10/4/2017,18:10,12.935359,77.53956,2017-04-10 18:10:00,18,0,10,4,2,0,0,0,1,0,-1.0,-1.8369701987210297e-16,0.0,1.0,0.8660254037844387,-0.49999999999999983,12.93,77.53,9,7.198178714332832,9,7.0,8.4,1,19.341714781149985
Robbery,12/9/2017,14:10,12.935359,77.53956,2017-09-12 14:10:00,14,1,12,9,3,0,0,1,0,0,-0.4999999999999998,-0.8660254037844388,0.7818314824680298,0.6234898018587336,-1.0,-1.8369701987210297e-16,12.93,77.53,9,7.198178714332832,9,7.0,7.0,1,16.11809565095832
Robbery,2/8/2018,21:30,12.93875477,77.526116,2018-08-02 21:30:00,21,3,2,8,3,0,0,0,1,0,-0.7071067811865477,0.7071067811865474,0.43388373911755823,-0.900968867902419,-0.8660254037844384,-0.5000000000000004,12.93,77.52,2,8.2712450147994,9,7.0,8.4,1,9.228343224812123
Robbery,4/7/2018,9:00,12.940701,77.545438,2018-07-04 09:00:00,9,2,4,7,3,0,1,0,0,0,0.7071067811865476,-0.7071067811865475,0.9749279121818236,-0.22252093395631434,-0.4999999999999998,-0.8660254037844388,12.94,77.54,29,6.339239743920629,9,7.0,5.6000000000000005,0,19.046705337308072
Robbery,28/06/2015,6:30,12.95501377,77.5702211,2015-06-28 06:30:00,6,6,28,6,2,1,1,0,0,0,1.0,6.123233995736766e-17,-0.7818314824680299,0.6234898018587334,1.2246467991473532e-16,-1.0,12.950000000000001,77.57000000000001,30,3.221824814084269,9,7.0,5.6000000000000005,0,19.23032834511682
Robbery,26/08/2016,5:30,12.95641368,77.57027585,2016-08-26 05:30:00,5,4,26,8,3,0,0,0,0,1,0.9659258262890683,0.25881904510252074,-0.433883739117558,-0.9009688679024191,-0.8660254037844384,-0.5000000000000004,12.950000000000001,77.57000000000001,30,3.1303126346690884,9,7.0,10.5,1,36.056865647094035
Robbery,22/02/2017,5:30,12.94898752,77.56995676,2017-02-22 05:30:00,5,2,22,2,1,0,0,0,0,1,0.9659258262890683,0.25881904510252074,0.9749279121818236,-0.22252093395631434,0.8660254037844386,0.5000000000000001,12.94,77.56,99,3.667860524541081,9,7.0,10.5,1,48.354286952874965
Robbery,12/8/2017,13:00,12.95416,77.56679,2017-08-12 13:00:00,13,5,12,8,3,1,0,1,0,0,-0.2588190451025208,-0.9659258262890683,-0.9749279121818236,-0.2225209339563146,-0.8660254037844384,-0.5000000000000004,12.950000000000001,77.56,65,3.5835709830642144,9,7.0,7.0,1,29.327583194184975
Robbery,13/01/2018,4:15,12.95533,77.56768,2018-01-13 04:15:00,4,5,13,1,1,1,0,0,0,1,0.8660254037844386,0.5000000000000001,-0.9749279121818236,-0.2225209339563146,0.49999999999999994,0.8660254037844387,12.950000000000001,77.56,65,3.4325394989331808,9,7.0,10.5,1,43.991374791277465
Robbery,13/01/2018,5:00,12.95722,77.57187,2018-01-13 05:00:00,5,5,13,1,1,1,0,0,0,1,0.9659258262890683,0.25881904510252074,-0.9749279121818236,-0.2225209339563146,0.49999999999999994,0.8660254037844387,12.950000000000001,77.57000000000001,30,2.9365433361475293,9,7.0,10.5,1,36.056865647094035
Robbery,14/05/2018,21:50,12.94946,77.5713,2018-05-14 21:50:00,21,0,14,5,2,0,0,0,1,0,-0.7071067811865477,0.7071067811865474,0.0,1.0,0.49999999999999994,-0.8660254037844387,12.94,77.57000000000001,55,3.526407257211205,9,7.0,8.4,1,33.812954202175256
Robbery,22/10/2018,7:10,12.94898752,77.56995676,2018-10-22 07:10:00,7,0,22,10,4,0,1,0,0,0,0.9659258262890683,-0.25881904510252063,0.0,1.0,-0.8660254037844386,0.5000000000000001,12.94,77.56,99,3.667860524541081,9,7.0,5.6000000000000005,0,25.788953041533315
Robbery,18/05/2019,21:25,12.95135,77.56877,2019-05-18 21:25:00,21,5,18,5,2,1,0,0,1,0,-0.7071067811865477,0.7071067811865474,-0.9749279121818236,-0.2225209339563146,0.49999999999999994,-0.8660254037844387,12.950000000000001,77.56,65,3.5922777524750624,9,7.0,8.4,1,35.193099833021975
Robbery,12/9/2019,16:00,12.57118,77.34096,2019-09-12 16:00:00,16,3,12,9,3,0,0,1,0,0,-0.8660254037844384,-0.5000000000000004,0.43388373911755823,-0.900968867902419,-1.0,-1.8369701987210297e-16,12.57,77.34,1,52.33552956124596,9,7.0,7.0,1,4.852030263919617
Robbery,10/1/2016,21:30,12.95072643,77.57692629,2016-01-10 21:30:00,21,6,10,1,1,1,0,0,1,0,-0.7071067811865477,0.7071067811865474,-0.7818314824680299,0.6234898018587334,0.49999999999999994,0.8660254037844387,12.950000000000001,77.57000000000001,30,3.00915801008912,9,7.0,8.4,1,28.84549251767523
Robbery,3/2/2016,14:20,12.95274238,77.57638783,2016-02-03 14:20:00,14,2,3,2,1,0,0,1,0,0,-0.4999999999999998,-0.8660254037844388,0.9749279121818236,-0.22252093395631434,0.8660254037844386,0.5000000000000001,12.950000000000001,77.57000000000001,30,2.879507821050811,9,7.0,7.0,1,24.037910431396025
Robbery,6/8/2016,22:00,12.95154815,77.57555399,2016-08-06 22:00:00,22,5,6,8,3,1,0,0,0,1,-0.5000000000000004,0.8660254037844384,-0.9749279121818236,-0.2225209339563146,-0.8660254037844384,-0.5000000000000004,12.950000000000001,77.57000000000001,30,3.0382422593282694,9,7.0,10.5,1,36.056865647094035
Robbery,4/5/2017,20:30,12.9527423802776,77.5763878294634,2017-05-04 20:30:00,20,3,4,5,2,0,0,0,1,0,-0.8660254037844386,0.5000000000000001,0.43388373911755823,-0.900968867902419,0.49999999999999994,-0.8660254037844387,12.950000000000001,77.57000000000001,30,2.8795078384232866,9,7.0,8.4,1,28.84549251767523
Robbery,11/9/2017,22:00,12.9525086362044,77.5762103671186,2017-09-11 22:00:00,22,0,11,9,3,0,0,0,0,1,-0.5000000000000004,0.8660254037844384,0.0,1.0,-1.0,-1.8369701987210297e-16,12.950000000000001,77.57000000000001,30,2.9116173790523163,9,7.0,10.5,1,36.056865647094035
Robbery,30/06/2018,11:30,12.9562784515092,77.5765665270044,2018-06-30 11:30:00,11,5,30,6,2,1,1,0,0,0,0.258819045102521,-0.9659258262890682,-0.9749279121818236,-0.2225209339563146,1.2246467991473532e-16,-1.0,12.950000000000001,77.57000000000001,30,2.5925096648963177,9,7.0,5.6000000000000005,0,19.23032834511682
Robbery,10/7/2018,15:40,12.95515912,77.57389864,2018-07-10 15:40:00,15,1,10,7,3,0,0,1,0,0,-0.7071067811865471,-0.7071067811865479,0.7818314824680298,0.6234898018587336,-0.4999999999999998,-0.8660254037844388,12.950000000000001,77.57000000000001,30,2.893810383902291,9,7.0,7.0,1,24.037910431396025
Robbery,7/8/2018,20:15,12.9534180059278,77.5792773731584,2018-08-07 20:15:00,20,1,7,8,3,0,0,0,1,0,-0.8660254037844386,0.5000000000000001,0.7818314824680298,0.6234898018587336,-0.8660254037844384,-0.5000000000000004,12.950000000000001,77.57000000000001,30,2.616164833049048,9,7.0,8.4,1,28.84549251767523
Robbery,5/7/2019,0:30,12.9551591176542,77.573938439161,2019-07-05 00:30:00,0,4,5,7,3,0,0,0,0,1,0.0,1.0,-0.433883739117558,-0.9009688679024191,-0.4999999999999998,-0.8660254037844388,12.950000000000001,77.57000000000001,30,2.8904687394999145,9,7.0,10.5,1,36.056865647094035
Robbery,9/7/2019,22:45,12.96350804,77.57371142,2019-07-09 22:45:00,22,1,9,7,3,0,0,0,0,1,-0.5000000000000004,0.8660254037844384,0.7818314824680298,0.6234898018587336,-0.4999999999999998,-0.8660254037844388,12.96,77.57000000000001,4,2.4357553743991507,9,7.0,10.5,1,16.89909808055805
Robbery,8/10/2015,13:30,12.94227,77.56256,2015-10-08 13:30:00,13,3,8,10,4,0,0,1,0,0,-0.2588190451025208,-0.9659258262890683,0.43388373911755823,-0.900968867902419,-0.8660254037844386,0.5000000000000001,12.94,77.56,99,4.76350697860749,9,7.0,7.0,1,32.23619130191664
Robbery,2/10/2016,22:00,12.940936,77.556692,2016-10-02 22:00:00,22,6,2,10,4,1,0,0,0,1,-0.5000000000000004,0.8660254037844384,-0.7818314824680299,0.6234898018587334,-0.8660254037844386,0.5000000000000001,12.94,77.55,85,5.338584200668405,9,7.0,10.5,1,46.77064661066183
Robbery,8/9/2016,20:15,12.94022,77.55353,2016-09-08 20:15:00,20,3,8,9,3,0,0,0,1,0,-0.8660254037844386,0.5000000000000001,0.43388373911755823,-0.900968867902419,-1.0,-1.8369701987210297e-16,12.94,77.55,85,5.655290271247301,9,7.0,8.4,1,37.41651728852946
Robbery,1/8/2017,2:45,12.937009,77.557041,2017-08-01 02:45:00,2,1,1,8,3,0,0,0,0,1,0.49999999999999994,0.8660254037844387,0.7818314824680298,0.6234898018587336,-0.8660254037844384,-0.5000000000000004,12.93,77.55,76,5.599990647637396,9,7.0,10.5,1,45.609956929463685
Robbery,3/3/2017,1:15,12.940983,77.556662,2017-03-03 01:15:00,1,4,3,3,1,0,0,0,0,1,0.25881904510252074,0.9659258262890683,-0.433883739117558,-0.9009688679024191,1.0,6.123233995736766e-17,12.94,77.55,85,5.33775098410743,9,7.0,10.5,1,46.77064661066183
Robbery,4/8/2017,2:15,12.942452,77.556337,2017-08-04 02:15:00,2,4,4,8,3,0,0,0,0,1,0.49999999999999994,0.8660254037844387,-0.433883739117558,-0.9009688679024191,-0.8660254037844384,-0.5000000000000004,12.94,77.55,85,5.262772614853927,9,7.0,10.5,1,46.77064661066183
Robbery,7/2/2019,16:00,12.9472,77.56554,2019-02-07 16:00:00,16,3,7,2,1,0,0,1,0,0,-0.8660254037844384,-0.5000000000000004,0.43388373911755823,-0.900968867902419,0.8660254037844386,0.5000000000000001,12.94,77.56,99,4.156626607286685,9,7.0,7.0,1,32.23619130191664
Robbery,16/12/2015,17:00,12.955074,77.562575,2015-12-16 17:00:00,17,2,16,12,4,0,0,1,0,0,-0.9659258262890683,-0.25881904510252063,0.9749279121818236,-0.22252093395631434,-2.4492935982947064e-16,1.0,12.950000000000001,77.56,65,3.926768440861851,9,7.0,7.0,1,29.327583194184975
Robbery,4/5/2016,16:15,12.94395418,77.57535514,2016-05-04 16:15:00,16,2,4,5,2,0,0,1,0,0,-0.8660254037844384,-0.5000000000000004,0.9749279121818236,-0.22252093395631434,0.49999999999999994,-0.8660254037844387,12.94,77.57000000000001,55,3.7146993235094774,9,7.0,7.0,1,28.177461835146048
Robbery,23/11/2016,20:00,12.94949,77.56316,2016-11-23 20:00:00,20,2,23,11,4,0,0,0,1,0,-0.8660254037844386,0.5000000000000001,0.9749279121818236,-0.22252093395631434,-0.5000000000000004,0.8660254037844384,12.94,77.56,99,4.201349809606684,9,7.0,8.4,1,38.68342956229997
Robbery,4/1/2017,5:30,12.94731,77.56425,2017-01-04 05:30:00,5,2,4,1,1,0,0,0,0,1,0.9659258262890683,0.25881904510252074,0.9749279121818236,-0.22252093395631434,0.49999999999999994,0.8660254037844387,12.94,77.56,99,4.2557312387388055,9,7.0,10.5,1,48.354286952874965
Robbery,27/05/2018,20:45,12.950097,77.556479,2018-05-27 20:45:00,20,6,27,5,2,1,0,0,1,0,-0.8660254037844386,0.5000000000000001,-0.7818314824680299,0.6234898018587334,0.49999999999999994,-0.8660254037844387,12.950000000000001,77.55,16,4.772954042563198,9,7.0,8.4,1,23.79899209007222
Robbery,15/03/2019,18:30,12.95322,77.561991,2019-03-15 18:30:00,18,4,15,3,1,0,0,0,1,0,-1.0,-1.8369701987210297e-16,-0.433883739117558,-0.9009688679024191,1.0,6.123233995736766e-17,12.950000000000001,77.56,65,4.0820324872306974,9,7.0,8.4,1,35.193099833021975
Robbery,8/10/2019,9:30,12.94808,77.56789,2019-10-08 09:30:00,9,1,8,10,4,0,1,0,0,0,0.7071067811865476,-0.7071067811865475,0.7818314824680298,0.6234898018587336,-0.8660254037844386,0.5000000000000001,12.94,77.56,99,3.900917082504964,9,7.0,5.6000000000000005,0,25.788953041533315
Robbery,8/4/2019,3:00,12.923208,77.549238,2019-04-08 03:00:00,3,0,8,4,2,0,0,0,0,1,0.7071067811865475,0.7071067811865476,0.0,1.0,0.8660254037844387,-0.49999999999999983,12.92,77.54,49,7.288313649232264,9,7.0,10.5,1,41.076241556995534
Chain Snatching,2/3/2015,15:40,12.92043,77.5819,2015-03-02 15:40:00,15,0,2,3,1,0,0,1,0,0,-0.7071067811865471,-0.7071067811865479,0.0,1.0,1.0,6.123233995736766e-17,12.92,77.58,144,5.85392830349119,4,2.0,2.0,0,9.953467484841148
Chain Snatching,13/03/2015,17:30,12.921652,77.57928,2015-03-13 17:30:00,17,4,13,3,1,0,0,1,0,0,-0.9659258262890683,-0.25881904510252063,-0.433883739117558,-0.9009688679024191,1.0,6.123233995736766e-17,12.92,77.57000000000001,55,5.796791183580849,4,2.0,2.0,0,8.0507033814703
Chain Snatching,31/03/2015,20:15,12.920838,77.58481,2015-03-31 20:15:00,20,1,31,3,1,0,0,0,1,0,-0.8660254037844386,0.5000000000000001,0.7818314824680298,0.6234898018587336,1.0,6.123233995736766e-17,12.92,77.58,144,5.743316563524297,4,2.0,2.4,0,11.944160981809377
Chain Snatching,1/4/2015,19:45,12.918973,77.57598,2015-04-01 19:45:00,19,2,1,4,2,0,0,0,1,0,-0.9659258262890684,0.2588190451025203,0.9749279121818236,-0.22252093395631434,0.8660254037844387,-0.49999999999999983,12.91,77.57000000000001,82,6.189979056342001,4,2.0,2.4,0,10.605217458711836
Chain Snatching,8/5/2015,11:30,12.932486,77.58962,2015-05-08 11:30:00,11,4,8,5,2,0,1,0,0,0,0.258819045102521,-0.9659258262890682,-0.433883739117558,-0.9009688679024191,0.49999999999999994,-0.8660254037844387,12.93,77.58,74,4.382631350132435,4,2.0,1.6,0,6.907980981658096
Chain Snatching,9/6/2015,20:15,12.971599,77.59456,2015-06-09 20:15:00,20,1,9,6,2,0,0,0,1,0,-0.8660254037844386,0.5000000000000001,0.7818314824680298,0.6234898018587336,1.2246467991473532e-16,-1.0,12.97,77.59,13,0.004335721831508556,4,2.0,2.4,0,6.33373759107662
Chain Snatching,8/12/2015,20:20,12.92337,77.58371,2015-12-08 20:20:00,20,1,8,12,4,0,0,0,1,0,-0.8660254037844386,0.5000000000000001,0.7818314824680298,0.6234898018587336,-2.4492935982947064e-16,1.0,12.92,77.58,144,5.491241231632288,4,2.0,2.4,0,11.944160981809377
Chain Snatching,30/12/2015,7:40,12.91872,77.57955,2015-12-30 07:40:00,7,2,30,12,4,0,1,0,0,0,0.9659258262890683,-0.25881904510252063,0.9749279121818236,-0.22252093395631434,-2.4492935982947064e-16,1.0,12.91,77.57000000000001,82,6.101988168135735,4,2.0,1.6,0,7.070144972474558
Chain Snatching,20/03/2016,8:00,12.918907,77.577896,2016-03-20 08:00:00,8,6,20,3,1,1,1,0,0,0,0.8660254037844387,-0.49999999999999983,-0.7818314824680299,0.6234898018587334,1.0,6.123233995736766e-17,12.91,77.57000000000001,82,6.132451176787086,4,2.0,1.6,0,7.070144972474558
Chain Snatching,20/05/2016,22:00,12.91933,77.57601,2016-05-20 22:00:00,22,4,20,5,2,0,0,0,0,1,-0.5000000000000004,0.8660254037844384,-0.433883739117558,-0.9009688679024191,0.49999999999999994,-0.8660254037844387,12.91,77.57000000000001,82,6.151398517666984,4,2.0,3.0,0,13.256521823389795
Chain Snatching,31/08/2016,20:00,12.930433,77.549761,2016-08-31 20:00:00,20,2,31,8,3,0,0,0,1,0,-0.8660254037844386,0.5000000000000001,0.9749279121818236,-0.22252093395631434,-0.8660254037844384,-0.5000000000000004,12.93,77.54,28,6.675651836588757,4,2.0,2.4,0,8.081509991967538
Chain Snatching,29/09/2016,20:45,12.94462,77.617742,2016-09-29 20:45:00,20,3,29,9,3,0,0,0,1,0,-0.8660254037844386,0.5000000000000001,0.43388373911755823,-0.900968867902419,-1.0,-1.8369701987210297e-16,12.94,77.61,1,3.9101161269275932,4,2.0,2.4,0,1.6635532333438687
Chain Snatching,25/10/2016,7:30,12.92204,77.58221,2016-10-25 07:30:00,7,1,25,10,4,0,1,0,0,0,0.9659258262890683,-0.25881904510252063,0.7818314824680298,0.6234898018587336,-0.8660254037844386,0.5000000000000001,12.92,77.58,144,5.672031150572036,4,2.0,1.6,0,7.962773987872919
Chain Snatching,29/11/2016,10:00,12.932946,77.583869,2016-11-29 10:00:00,10,1,29,11,4,0,1,0,0,0,0.49999999999999994,-0.8660254037844387,0.7818314824680298,0.6234898018587336,-0.5000000000000004,0.8660254037844384,12.93,77.58,74,4.452660431256733,4,2.0,1.6,0,6.907980981658096
Chain Snatching,1/12/2016,7:30,12.932946,77.583869,2016-12-01 07:30:00,7,3,1,12,4,0,1,0,0,0,0.9659258262890683,-0.25881904510252063,0.43388373911755823,-0.900968867902419,-2.4492935982947064e-16,1.0,12.93,77.58,74,4.452660431256733,4,2.0,1.6,0,6.907980981658096
Chain Snatching,28/03/2017,20:00,12.923396,77.581194,2017-03-28 20:00:00,20,1,28,3,1,0,0,0,1,0,-0.8660254037844386,0.5000000000000001,0.7818314824680298,0.6234898018587336,1.0,6.123233995736766e-17,12.92,77.58,144,5.553431419798503,4,2.0,2.4,0,11.944160981809377
Chain Snatching,27/07/2017,10:40,12.921999,77.587034,2017-07-27 10:40:00,10,3,27,7,3,0,1,0,0,0,0.49999999999999994,-0.8660254037844387,0.43388373911755823,-0.900968867902419,-0.4999999999999998,-0.8660254037844388,12.92,77.58,144,5.57599050216385,4,2.0,1.6,0,7.962773987872919
Chain Snatching,18/09/2017,9:45,12.93398,77.57991,2017-09-18 09:45:00,9,0,18,9,3,0,1,0,0,0,0.7071067811865476,-0.7071067811865475,0.0,1.0,-1.0,-1.8369701987210297e-16,12.93,77.57000000000001,40,4.475811111496527,4,2.0,1.6,0,5.941715306726893
Chain Snatching,21/09/2017,14:00,12.918899,77.577344,2017-09-21 14:00:00,14,3,21,9,3,0,0,1,0,0,-0.4999999999999998,-0.8660254037844388,0.43388373911755823,-0.900968867902419,-1.0,-1.8369701987210297e-16,12.91,77.57000000000001,82,6.151221914279311,4,2.0,2.0,0,8.837681215593197
Chain Snatching,1/10/2017,8:45,12.923412,77.564778,2017-10-01 08:45:00,8,6,1,10,4,1,1,0,0,0,0.8660254037844387,-0.49999999999999983,-0.7818314824680299,0.6234898018587334,-0.8660254037844386,0.5000000000000001,12.92,77.56,33,6.257407578700251,4,2.0,1.6,0,5.642176839385859
Chain Snatching,30/10/2017,7:30,12.920834,77.584314,2017-10-30 07:30:00,7,0,30,10,4,0,1,0,0,0,0.9659258262890683,-0.25881904510252063,0.0,1.0,-0.8660254037844386,0.5000000000000001,12.92,77.58,144,5.753924472476256,4,2.0,1.6,0,7.962773987872919
Chain Snatching,7/12/2017,23:00,12.935706,77.582025,2017-12-07 23:00:00,23,3,7,12,4,0,0,0,0,1,-0.25881904510252157,0.9659258262890681,0.43388373911755823,-0.900968867902419,-2.4492935982947064e-16,1.0,12.93,77.58,74,4.217446284224992,4,2.0,3.0,0,12.95246434060893
Chain Snatching,25/12/2017,16:15,12.870884,77.655244,2017-12-25 16:15:00,16,0,25,12,4,0,0,1,0,0,-0.8660254037844384,-0.5000000000000004,0.0,1.0,-2.4492935982947064e-16,1.0,12.870000000000001,77.65,1,12.985317579933291,4,2.0,2.0,0,1.3862943611198906
Chain Snatching,24/02/2018,20:45,12.918859,77.579763,2018-02-24 20:45:00,20,5,24,2,1,1,0,0,1,0,-0.8660254037844386,0.5000000000000001,-0.9749279121818236,-0.2225209339563146,0.8660254037844386,0.5000000000000001,12.91,77.57000000000001,82,6.080951687666124,4,2.0,2.4,0,10.605217458711836
Chain Snatching,18/06/2018,22:30,12.919916,77.581878,2018-06-18 22:30:00,22,0,18,6,2,0,0,0,0,1,-0.5000000000000004,0.8660254037844384,0.0,1.0,1.2246467991473532e-16,-1.0,12.91,77.58,105,5.910051785431697,4,2.0,3.0,0,13.9903172823362
Chain Snatching,19/06/2018,17:00,12.92617,77.587036,2018-06-19 17:00:00,17,1,19,6,2,0,0,1,0,0,-0.9659258262890683,-0.25881904510252063,0.7818314824680298,0.6234898018587336,1.2246467991473532e-16,-1.0,12.92,77.58,144,5.117656501500657,4,2.0,2.0,0,9.953467484841148
Chain Snatching,10/7/2018,10:00,12.922168,77.575662,2018-07-10 10:00:00,10,1,10,7,3,0,1,0,0,0,0.49999999999999994,-0.8660254037844387,0.7818314824680298,0.6234898018587336,-0.4999999999999998,-0.8660254037844388,12.92,77.57000000000001,55,5.86722353186107,4,2.0,1.6,0,6.44056270517624
Chain Snatching,12/7/2018,21:15,12.92594,77.583042,2018-07-12 21:15:00,21,3,12,7,3,0,0,0,1,0,-0.7071067811865477,0.7071067811865474,0.43388373911755823,-0.900968867902419,-0.4999999999999998,-0.8660254037844388,12.92,77.58,144,5.229372565013582,4,2.0,2.4,0,11.944160981809377
Chain Snatching,20/10/2018,19:30,12.91714,77.58078,2018-10-20 19:30:00,19,5,20,10,4,1,0,0,1,0,-0.9659258262890684,0.2588190451025203,-0.9749279121818236,-0.2225209339563146,-0.8660254037844386,0.5000000000000001,12.91,77.58,105,6.238124904592429,4,2.0,2.4,0,11.19225382586896
Chain Snatching,8/3/2019,7:30,12.92585,77.5872,2019-03-08 07:30:00,7,4,8,3,1,0,1,0,0,0,0.9659258262890683,-0.25881904510252063,-0.433883739117558,-0.9009688679024191,1.0,6.123233995736766e-17,12.92,77.58,144,5.149985460126919,4,2.0,1.6,0,7.962773987872919
Chain Snatching,26/03/2019,14:00,12.92246,77.59624,2019-03-26 14:00:00,14,1,26,3,1,0,0,1,0,0,-0.4999999999999998,-0.8660254037844388,0.7818314824680298,0.6234898018587336,1.0,6.123233995736766e-17,12.92,77.59,10,5.467008214208073,4,2.0,2.0,0,4.795790545596741
Chain Snatching,16/04/2019,11:00,12.28784,76.633133,2019-04-16 11:00:00,11,1,16,4,2,0,1,0,0,0,0.258819045102521,-0.9659258262890682,0.7818314824680298,0.6234898018587336,0.8660254037844387,-0.49999999999999983,12.280000000000001,76.63,7,129.08860847640034,4,2.0,1.6,0,3.3271064666877375
Chain Snatching,24/04/2019,19:00,12.28784,76.633133,2019-04-24 19:00:00,19,2,24,4,2,0,0,0,1,0,-0.9659258262890684,0.2588190451025203,0.9749279121818236,-0.22252093395631434,0.8660254037844387,-0.49999999999999983,12.280000000000001,76.63,7,129.08860847640034,4,2.0,2.4,0,4.990659700031606
Chain Snatching,17/05/2019,18:30,12.94158,77.584159,2019-05-17 18:30:00,18,4,17,5,2,0,0,0,1,0,-1.0,-1.8369701987210297e-16,-0.433883739117558,-0.9009688679024191,0.49999999999999994,-0.8660254037844387,12.94,77.58,80,3.524606564270427,4,2.0,2.4,0,10.546677971213853
Chain Snatching,2/7/2019,15:30,13.11539,77.565361,2019-07-02 15:30:00,15,1,2,7,3,0,0,1,0,0,-0.7071067811865471,-0.7071067811865479,0.7818314824680298,0.6234898018587336,-0.4999999999999998,-0.8660254037844388,13.11,77.56,1,16.29942264326268,4,2.0,2.0,0,1.3862943611198906
Chain Snatching,2/5/2015,23:00,12.9097051,77.5811038,2015-05-02 23:00:00,23,5,2,5,2,1,0,0,0,1,-0.25881904510252157,0.9659258262890681,-0.9749279121818236,-0.2225209339563146,0.49999999999999994,-0.8660254037844387,12.9,77.58,43,7.0360924811946015,4,2.0,3.0,0,11.352568901754783
Chain Snatching,18/05/2015,14:50,12.9147063,77.5880828,2015-05-18 14:50:00,14,0,18,5,2,0,0,1,0,0,-0.4999999999999998,-0.8660254037844388,0.0,1.0,0.49999999999999994,-0.8660254037844387,12.91,77.58,105,6.365592585470416,4,2.0,2.0,0,9.326878188224134
Chain Snatching,27/05/2015,14:00,12.9045684,77.5909483,2015-05-27 14:00:00,14,2,27,5,2,0,0,1,0,0,-0.4999999999999998,-0.8660254037844388,0.9749279121818236,-0.22252093395631434,0.49999999999999994,-0.8660254037844387,12.9,77.59,25,7.464072261445164,4,2.0,2.0,0,6.516193076042964
Chain Snatching,2/6/2015,14:10,12.9122625,77.578695,2015-06-02 14:10:00,14,1,2,6,2,0,0,1,0,0,-0.4999999999999998,-0.8660254037844388,0.7818314824680298,0.6234898018587336,1.2246467991473532e-16,-1.0,12.91,77.57000000000001,82,6.819449031076985,4,2.0,2.0,0,8.837681215593197
Chain Snatching,12/6/2015,15:00,12.9075172,77.5850448,2015-06-12 15:00:00,15,4,12,6,2,0,0,1,0,0,-0.7071067811865471,-0.7071067811865479,-0.433883739117558,-0.9009688679024191,1.2246467991473532e-16,-1.0,12.9,77.58,43,7.200529690253439,4,2.0,2.0,0,7.568379267836522
Chain Snatching,27/08/2015,18:15,12.8931843,77.582965,2015-08-27 18:15:00,18,3,27,8,3,0,0,0,1,0,-1.0,-1.8369701987210297e-16,0.43388373911755823,-0.900968867902419,-0.8660254037844384,-0.5000000000000004,12.89,77.58,36,8.810129731286075,4,2.0,2.4,0,8.666202990346138
Chain Snatching,28/08/2015,12:30,12.7413241,77.2429893,2015-08-28 12:30:00,12,4,28,8,3,0,0,1,0,0,1.2246467991473532e-16,-1.0,-0.433883739117558,-0.9009688679024191,-0.8660254037844384,-0.5000000000000004,12.74,77.24,1,45.91904822066269,4,2.0,2.0,0,1.3862943611198906
Chain Snatching,9/9/2015,20:20,12.9030608,77.5867775,2015-09-09 20:20:00,20,2,9,9,3,0,0,0,1,0,-0.8660254037844386,0.5000000000000001,0.9749279121818236,-0.22252093395631434,-1.0,-1.8369701987210297e-16,12.9,77.58,43,7.668215496247764,4,2.0,2.4,0,9.082055121403826
Chain Snatching,30/09/2015,7:30,12.9168548,77.5954424,2015-09-30 07:30:00,7,2,30,9,3,0,1,0,0,0,0.9659258262890683,-0.25881904510252063,0.9749279121818236,-0.22252093395631434,-1.0,-1.8369701987210297e-16,12.91,77.59,48,6.088072982965174,4,2.0,1.6,0,6.226912476977002
Chain Snatching,30/09/2015,12:30,12.9119355,77.5866992,2015-09-30 12:30:00,12,2,30,9,3,0,0,1,0,0,1.2246467991473532e-16,-1.0,0.9749279121818236,-0.22252093395631434,-1.0,-1.8369701987210297e-16,12.91,77.58,105,6.689411538457584,4,2.0,2.0,0,9.326878188224134
Chain Snatching,30/10/2015,16:30,12.9045277,77.5896538,2015-10-30 16:30:00,16,4,30,10,4,0,0,1,0,0,-0.8660254037844384,-0.5000000000000004,-0.433883739117558,-0.9009688679024191,-0.8660254037844386,0.5000000000000001,12.9,77.58,43,7.47733745547901,4,2.0,2.0,0,7.568379267836522
Chain Snatching,2/1/2016,7:30,12.9082084,77.5712403,2016-01-02 07:30:00,7,5,2,1,1,1,1,0,0,0,0.9659258262890683,-0.25881904510252063,-0.9749279121818236,-0.2225209339563146,0.49999999999999994,0.8660254037844387,12.9,77.57000000000001,96,7.489626730958153,4,2.0,1.6,0,7.319537565605413
Chain Snatching,14/05/2016,21:30,12.8961435,77.5974439,2016-05-14 21:30:00,21,5,14,5,2,1,0,0,1,0,-0.7071067811865477,0.7071067811865474,-0.9749279121818236,-0.2225209339563146,0.49999999999999994,-0.8660254037844387,12.89,77.59,5,8.396038714830217,4,2.0,2.4,0,4.300222726147331
Chain Snatching,20/06/2016,21:35,12.9088745,77.5929109,2016-06-20 21:35:00,21,0,20,6,2,0,0,0,1,0,-0.7071067811865477,0.7071067811865474,0.0,1.0,1.2246467991473532e-16,-1.0,12.9,77.59,25,6.977158985686737,4,2.0,2.4,0,7.819431691251557
Chain Snatching,18/08/2016,21:35,12.9192124,77.585885,2016-08-18 21:35:00,21,3,18,8,3,0,0,0,1,0,-0.7071067811865477,0.7071067811865474,0.43388373911755823,-0.900968867902419,-0.8660254037844384,-0.5000000000000004,12.91,77.58,105,5.9012983583731025,4,2.0,2.4,0,11.19225382586896
Chain Snatching,27/09/2016,17:30,12.9081165,77.5808039,2016-09-27 17:30:00,17,1,27,9,3,0,0,1,0,0,-0.9659258262890683,-0.25881904510252063,0.7818314824680298,0.6234898018587336,-1.0,-1.8369701987210297e-16,12.9,77.58,43,7.2156367355477835,4,2.0,2.0,0,7.568379267836522
Chain Snatching,26/11/2016,15:30,12.9217529,77.5825697,2016-11-26 15:30:00,15,5,26,11,4,1,0,1,0,0,-0.7071067811865471,-0.7071067811865479,-0.9749279121818236,-0.2225209339563146,-0.5000000000000004,0.8660254037844384,12.92,77.58,144,5.694001926520257,4,2.0,2.0,0,9.953467484841148
Chain Snatching,3/2/2017,22:15,12.9133944,77.5859906,2017-02-03 22:15:00,22,4,3,2,1,0,0,0,0,1,-0.5000000000000004,0.8660254037844384,-0.433883739117558,-0.9009688679024191,0.8660254037844386,0.5000000000000001,12.91,77.58,105,6.539070441434152,4,2.0,3.0,0,13.9903172823362
Chain Snatching,26/02/2017,20:45,12.9173404,77.5683769,2017-02-26 20:45:00,20,6,26,2,1,1,0,0,1,0,-0.8660254037844386,0.5000000000000001,-0.7818314824680299,0.6234898018587334,0.8660254037844386,0.5000000000000001,12.91,77.56,126,6.66914642827061,4,2.0,2.4,0,11.626049007500619
Chain Snatching,6/3/2017,21:00,12.9360128,77.6282734,2017-03-06 21:00:00,21,0,6,3,1,0,0,0,1,0,-0.7071067811865477,0.7071067811865474,0.0,1.0,1.0,6.123233995736766e-17,12.93,77.62,2,5.382762653043667,4,2.0,2.4,0,2.6366694928034633
Chain Snatching,30/04/2017,18:05,12.9151844,77.5877742,2017-04-30 18:05:00,18,6,30,4,2,1,0,0,1,0,-1.0,-1.8369701987210297e-16,-0.7818314824680299,0.6234898018587334,0.8660254037844387,-0.49999999999999983,12.91,77.58,105,6.316590186375479,4,2.0,2.4,0,11.19225382586896
Chain Snatching,5/6/2017,8:45,12.8940952,77.581622,2017-06-05 08:45:00,8,0,5,6,2,0,1,0,0,0,0.8660254037844387,-0.49999999999999983,0.0,1.0,1.2246467991473532e-16,-1.0,12.89,77.58,36,8.732155234982734,4,2.0,1.6,0,5.77746866023076
Chain Snatching,22/06/2017,8:00,12.9101358,77.5832282,2017-06-22 08:00:00,8,3,22,6,2,0,1,0,0,0,0.8660254037844387,-0.49999999999999983,0.43388373911755823,-0.900968867902419,1.2246467991473532e-16,-1.0,12.91,77.58,105,6.944726495885818,4,2.0,1.6,0,7.461502550579308
Chain Snatching,15/07/2017,15:30,12.9102224,77.5503972,2017-07-15 15:30:00,15,5,15,7,3,1,0,1,0,0,-0.7071067811865471,-0.7071067811865479,-0.9749279121818236,-0.2225209339563146,-0.4999999999999998,-0.8660254037844388,12.91,77.55,40,8.338215386920705,4,2.0,2.0,0,7.427144133408616
Chain Snatching,20/08/2017,14:30,12.908417,77.592364,2017-08-20 14:30:00,14,6,20,8,3,1,0,1,0,0,-0.4999999999999998,-0.8660254037844388,-0.7818314824680299,0.6234898018587334,-0.8660254037844384,-0.5000000000000004,12.9,77.59,25,7.029806646857322,4,2.0,2.0,0,6.516193076042964
Chain Snatching,15/09/2017,8:40,12.9089146,77.5786233,2017-09-15 08:40:00,8,4,15,9,3,0,1,0,0,0,0.8660254037844387,-0.49999999999999983,-0.433883739117558,-0.9009688679024191,-1.0,-1.8369701987210297e-16,12.9,77.57000000000001,96,7.182119867587564,4,2.0,1.6,0,7.319537565605413
Chain Snatching,31/10/2017,8:00,12.9127003,77.5876934,2017-10-31 08:00:00,8,1,31,10,4,0,1,0,0,0,0.8660254037844387,-0.49999999999999983,0.7818314824680298,0.6234898018587336,-0.8660254037844386,0.5000000000000001,12.91,77.58,105,6.59197722091261,4,2.0,1.6,0,7.461502550579308
Chain Snatching,31/10/2017,8:30,12.9134518,77.5883934,2017-10-31 08:30:00,8,1,31,10,4,0,1,0,0,0,0.8660254037844387,-0.49999999999999983,0.7818314824680298,0.6234898018587336,-0.8660254037844386,0.5000000000000001,12.91,77.58,105,6.500675121348803,4,2.0,1.6,0,7.461502550579308
Chain Snatching,25/11/2017,14:10,12.9217529,77.5825697,2017-11-25 14:10:00,14,5,25,11,4,1,0,1,0,0,-0.4999999999999998,-0.8660254037844388,-0.9749279121818236,-0.2225209339563146,-0.5000000000000004,0.8660254037844384,12.92,77.58,144,5.694001926520257,4,2.0,2.0,0,9.953467484841148
Chain Snatching,10/12/2017,8:45,12.9070414,77.5897256,2017-12-10 08:45:00,8,6,10,12,4,1,1,0,0,0,0.8660254037844387,-0.49999999999999983,-0.7818314824680299,0.6234898018587334,-2.4492935982947064e-16,1.0,12.9,77.58,43,7.197998371585388,4,2.0,1.6,0,6.054703414269218
Chain Snatching,23/02/2018,7:15,12.9078012,77.5915234,2018-02-23 07:15:00,7,4,23,2,1,0,1,0,0,0,0.9659258262890683,-0.25881904510252063,-0.433883739117558,-0.9009688679024191,0.8660254037844386,0.5000000000000001,12.9,77.59,25,7.101933634184497,4,2.0,1.6,0,5.212954460834371
Chain Snatching,19/03/2018,7:00,12.9146922,77.5944367,2018-03-19 07:00:00,7,0,19,3,1,0,1,0,0,0,0.9659258262890683,-0.25881904510252063,0.0,1.0,1.0,6.123233995736766e-17,12.91,77.59,48,6.327883392278372,4,2.0,1.6,0,6.226912476977002
Chain Snatching,24/04/2018,7:50,12.9158154,77.5930411,2018-04-24 07:50:00,7,1,24,4,2,0,1,0,0,0,0.9659258262890683,-0.25881904510252063,0.7818314824680298,0.6234898018587336,0.8660254037844387,-0.49999999999999983,12.91,77.59,48,6.205264574923102,4,2.0,1.6,0,6.226912476977002
Chain Snatching,26/08/2018,10:30,12.9093911,77.5883412,2018-08-26 10:30:00,10,6,26,8,3,1,1,0,0,0,0.49999999999999994,-0.8660254037844387,-0.7818314824680299,0.6234898018587334,-0.8660254037844384,-0.5000000000000004,12.9,77.58,43,6.950488239677453,4,2.0,1.6,0,6.054703414269218
Chain Snatching,31/08/2018,20:00,12.9080505,77.5867443,2018-08-31 20:00:00,20,4,31,8,3,0,0,0,1,0,-0.8660254037844386,0.5000000000000001,-0.433883739117558,-0.9009688679024191,-0.8660254037844384,-0.5000000000000004,12.9,77.58,43,7.117479901905371,4,2.0,2.4,0,9.082055121403826
Chain Snatching,10/12/2018,20:00,12.9160925,77.5882166,2018-12-10 20:00:00,20,0,10,12,4,0,0,0,1,0,-0.8660254037844386,0.5000000000000001,0.0,1.0,-2.4492935982947064e-16,1.0,12.91,77.58,105,6.21079744040934,4,2.0,2.4,0,11.19225382586896
Chain Snatching,22/02/2019,14:25,12.9075608,77.5952252,2019-02-22 14:25:00,14,4,22,2,1,0,0,1,0,0,-0.4999999999999998,-0.8660254037844388,-0.433883739117558,-0.9009688679024191,0.8660254037844386,0.5000000000000001,12.9,77.59,25,7.121156472834402,4,2.0,2.0,0,6.516193076042964
Chain Snatching,9/4/2015,18:00,12.936003,77.58669,2015-04-09 18:00:00,18,3,9,4,2,0,0,0,1,0,-1.0,-1.8369701987210297e-16,0.43388373911755823,-0.900968867902419,0.8660254037844387,-0.49999999999999983,12.93,77.58,74,4.049954394511987,4,2.0,2.4,0,10.361971472487143
Chain Snatching,4/6/2015,7:15,12.93314,77.592321,2015-06-04 07:15:00,7,3,4,6,2,0,1,0,0,0,0.9659258262890683,-0.25881904510252063,0.43388373911755823,-0.900968867902419,1.2246467991473532e-16,-1.0,12.93,77.59,58,4.28368191284642,4,2.0,1.6,0,6.524059910249152
Chain Snatching,21/07/2015,19:45,12.943346,77.585274,2015-07-21 19:45:00,19,1,21,7,3,0,0,0,1,0,-0.9659258262890684,0.2588190451025203,0.7818314824680298,0.6234898018587336,-0.4999999999999998,-0.8660254037844388,12.94,77.58,80,3.3002419866507338,4,2.0,2.4,0,10.546677971213853
Chain Snatching,4/11/2015,4:30,12.943346,77.585274,2015-11-04 04:30:00,4,2,4,11,4,0,0,0,0,1,0.8660254037844386,0.5000000000000001,0.9749279121818236,-0.22252093395631434,-0.5000000000000004,0.8660254037844384,12.94,77.58,80,3.3002419866507338,4,2.0,3.0,0,13.183347464017316
Chain Snatching,25/10/2016,8:45,12.933437,77.591016,2016-10-25 08:45:00,8,1,25,10,4,0,1,0,0,0,0.8660254037844387,-0.49999999999999983,0.7818314824680298,0.6234898018587336,-0.8660254037844386,0.5000000000000001,12.93,77.59,58,4.261267980525216,4,2.0,1.6,0,6.524059910249152
Chain Snatching,2/11/2016,14:00,12.942483,77.581006,2016-11-02 14:00:00,14,2,2,11,4,0,0,1,0,0,-0.4999999999999998,-0.8660254037844388,0.9749279121818236,-0.22252093395631434,-0.5000000000000004,0.8660254037844384,12.94,77.58,80,3.557031496688886,4,2.0,2.0,0,8.788898309344878
Chain Snatching,2/11/2016,15:15,12.938548,77.585899,2016-11-02 15:15:00,15,2,2,11,4,0,0,1,0,0,-0.7071067811865471,-0.7071067811865479,0.9749279121818236,-0.22252093395631434,-0.5000000000000004,0.8660254037844384,12.93,77.58,74,3.794235943480387,4,2.0,2.0,0,8.63497622707262
Chain Snatching,12/11/2016,20:00,12.941202,77.586684,2016-11-12 20:00:00,20,5,12,11,4,1,0,0,1,0,-0.8660254037844386,0.5000000000000001,-0.9749279121818236,-0.2225209339563146,-0.5000000000000004,0.8660254037844384,12.94,77.58,80,3.487253358894379,4,2.0,2.4,0,10.546677971213853
Chain Snatching,16/11/2016,16:45,12.941528,77.585997,2016-11-16 16:45:00,16,2,16,11,4,0,0,1,0,0,-0.8660254037844384,-0.5000000000000004,0.9749279121818236,-0.22252093395631434,-0.5000000000000004,0.8660254037844384,12.94,77.58,80,3.4713769272931945,4,2.0,2.0,0,8.788898309344878
Chain Snatching,23/06/2017,12:30,12.936003,77.58669,2017-06-23 12:30:00,12,4,23,6,2,0,0,1,0,0,1.2246467991473532e-16,-1.0,-0.433883739117558,-0.9009688679024191,1.2246467991473532e-16,-1.0,12.93,77.58,74,4.049954394511987,4,2.0,2.0,0,8.63497622707262
Chain Snatching,3/11/2017,20:30,12.940991,77.584108,2017-11-03 20:30:00,20,4,3,11,4,0,0,0,1,0,-0.8660254037844386,0.5000000000000001,-0.433883739117558,-0.9009688679024191,-0.5000000000000004,0.8660254037844384,12.94,77.58,80,3.5884434449368565,4,2.0,2.4,0,10.546677971213853
Chain Snatching,10/5/2018,13:30,12.943683,77.584406,2018-05-10 13:30:00,13,3,10,5,2,0,0,1,0,0,-0.2588190451025208,-0.9659258262890683,0.43388373911755823,-0.900968867902419,0.49999999999999994,-0.8660254037844387,12.94,77.58,80,3.2949209067936094,4,2.0,2.0,0,8.788898309344878
Chain Snatching,14/06/2018,20:30,12.942375,77.58673,2018-06-14 20:30:00,20,3,14,6,2,0,0,0,1,0,-0.8660254037844386,0.5000000000000001,0.43388373911755823,-0.900968867902419,1.2246467991473532e-16,-1.0,12.94,77.58,80,3.3597132303808936,4,2.0,2.4,0,10.546677971213853
Chain Snatching,19/06/2018,7:30,12.943814,77.59715,2018-06-19 07:30:00,7,1,19,6,2,0,1,0,0,0,0.9659258262890683,-0.25881904510252063,0.7818314824680298,0.6234898018587336,1.2246467991473532e-16,-1.0,12.94,77.59,130,3.101994389481793,4,2.0,1.6,0,7.800315717121842
Chain Snatching,25/06/2018,20:30,12.939261,77.585214,2018-06-25 20:30:00,20,0,25,6,2,0,0,0,1,0,-0.8660254037844386,0.5000000000000001,0.0,1.0,1.2246467991473532e-16,-1.0,12.93,77.58,74,3.73700976974896,4,2.0,2.4,0,10.361971472487143
Chain Snatching,2/7/2018,20:50,12.938365,77.582962,2018-07-02 20:50:00,20,0,2,7,3,0,0,0,1,0,-0.8660254037844386,0.5000000000000001,0.0,1.0,-0.4999999999999998,-0.8660254037844388,12.93,77.58,74,3.9048280118564374,4,2.0,2.4,0,10.361971472487143
Chain Snatching,5/9/2018,9:00,12.935534,77.587228,2018-09-05 09:00:00,9,2,5,9,3,0,1,0,0,0,0.7071067811865476,-0.7071067811865475,0.9749279121818236,-0.22252093395631434,-1.0,-1.8369701987210297e-16,12.93,77.58,74,4.089150036470096,4,2.0,1.6,0,6.907980981658096
Chain Snatching,11/4/2019,12:30,12.948109,77.581263,2019-04-11 12:30:00,12,3,11,4,2,0,0,1,0,0,1.2246467991473532e-16,-1.0,0.43388373911755823,-0.900968867902419,0.8660254037844387,-0.49999999999999983,12.94,77.58,80,2.985239347419579,4,2.0,2.0,0,8.788898309344878
Chain Snatching,21/05/2019,19:15,12.942375,77.58673,2019-05-21 19:15:00,19,1,21,5,2,0,0,0,1,0,-0.9659258262890684,0.2588190451025203,0.7818314824680298,0.6234898018587336,0.49999999999999994,-0.8660254037844387,12.94,77.58,80,3.3597132303808936,4,2.0,2.4,0,10.546677971213853
Chain Snatching,22/05/2019,8:00,12.948222,77.580132,2019-05-22 08:00:00,8,2,22,5,2,0,1,0,0,0,0.8660254037844387,-0.49999999999999983,0.9749279121818236,-0.22252093395631434,0.49999999999999994,-0.8660254037844387,12.94,77.58,80,3.0356940958349177,4,2.0,1.6,0,7.031118647475903
Chain Snatching,1/11/2019,17:35,12.937003,77.601464,2019-11-01 17:35:00,17,4,1,11,4,0,0,1,0,0,-0.9659258262890683,-0.25881904510252063,-0.433883739117558,-0.9009688679024191,-0.5000000000000004,0.8660254037844384,12.93,77.60000000000001,3,3.9182593273818282,4,2.0,2.0,0,2.772588722239781
Chain Snatching,3/11/2019,8:45,12.941563,77.582748,2019-11-03 08:45:00,8,6,3,11,4,1,1,0,0,0,0.8660254037844387,-0.49999999999999983,-0.7818314824680299,0.6234898018587334,-0.5000000000000004,0.8660254037844384,12.94,77.58,80,3.578386228080766,4,2.0,1.6,0,7.031118647475903
Chain Snatching,25/12/2019,12:00,12.948109,77.581263,2019-12-25 12:00:00,12,2,25,12,4,0,0,1,0,0,1.2246467991473532e-16,-1.0,0.9749279121818236,-0.22252093395631434,-2.4492935982947064e-16,1.0,12.94,77.58,80,2.985239347419579,4,2.0,2.0,0,8.788898309344878
Chain Snatching,31/10/2015,17:00,12.877998,77.550186,2015-10-31 17:00:00,17,5,31,10,4,1,0,1,0,0,-0.9659258262890683,-0.25881904510252063,-0.9749279121818236,-0.2225209339563146,-0.8660254037844386,0.5000000000000001,12.870000000000001,77.55,12,11.467237741356403,4,2.0,2.0,0,5.1298987149230735
Chain Snatching,14/05/2016,21:55,12.897553,77.539272,2016-05-14 21:55:00,21,5,14,5,2,1,0,0,1,0,-0.7071067811865477,0.7071067811865474,-0.9749279121818236,-0.2225209339563146,0.49999999999999994,-0.8660254037844387,12.89,77.53,8,10.185582023335934,4,2.0,2.4,0,5.273338985606927
Chain Snatching,1/8/2016,15:00,12.898151,77.538374,2016-08-01 15:00:00,15,0,1,8,3,0,0,1,0,0,-0.7071067811865471,-0.7071067811865479,0.0,1.0,-0.8660254037844384,-0.5000000000000004,12.89,77.53,8,10.18979735611718,4,2.0,2.0,0,4.394449154672439
Chain Snatching,10/10/2018,21:30,12.866923,77.564722,2018-10-10 21:30:00,21,2,10,10,4,0,0,0,1,0,-0.7071067811865477,0.7071067811865474,0.9749279121818236,-0.22252093395631434,-0.8660254037844386,0.5000000000000001,12.86,77.56,11,12.081596541552349,4,2.0,2.4,0,5.9637759594912
Chain Snatching,1/11/2018,7:30,12.86607,77.541929,2018-11-01 07:30:00,7,3,1,11,4,0,1,0,0,0,0.9659258262890683,-0.25881904510252063,0.43388373911755823,-0.900968867902419,-0.5000000000000004,0.8660254037844384,12.86,77.54,98,13.049257645219988,4,2.0,1.6,0,7.352191760215344
Chain Snatching,7/3/2019,10:30,12.851503,77.552592,2019-03-07 10:30:00,10,3,7,3,1,0,1,0,0,0,0.49999999999999994,-0.8660254037844387,0.43388373911755823,-0.900968867902419,1.0,6.123233995736766e-17,12.85,77.55,7,14.108990300085287,4,2.0,1.6,0,3.3271064666877375
Chain Snatching,11/4/2019,8:00,12.873184,77.535641,2019-04-11 08:00:00,8,3,11,4,2,0,1,0,0,0,0.8660254037844387,-0.49999999999999983,0.43388373911755823,-0.900968867902419,0.8660254037844387,-0.49999999999999983,12.870000000000001,77.53,25,12.672332093219612,4,2.0,1.6,0,5.212954460834371
Chain Snatching,12/7/2019,8:00,12.892912,77.527128,2019-07-12 08:00:00,8,4,12,7,3,0,1,0,0,0,0.8660254037844387,-0.49999999999999983,-0.433883739117558,-0.9009688679024191,-0.4999999999999998,-0.8660254037844388,12.89,77.52,4,11.402906419583331,4,2.0,1.6,0,2.5751006598945607
Chain Snatching,23/1/2017,15:10,12.888051,77.5805,2017-01-23 15:10:00,15,0,23,1,1,0,0,1,0,0,-0.7071067811865471,-0.7071067811865479,0.0,1.0,0.49999999999999994,0.8660254037844387,12.88,77.58,29,9.415059975622805,4,2.0,2.0,0,6.802394763324311
Chain Snatching,24/02/2017,19:35,12.886996,77.5797,2017-02-24 19:35:00,19,4,24,2,1,0,0,0,1,0,-0.9659258262890684,0.2588190451025203,-0.433883739117558,-0.9009688679024191,0.8660254037844386,0.5000000000000001,12.88,77.57000000000001,71,9.545119264919503,4,2.0,2.4,0,10.263998685638532
Chain Snatching,16/05/2017,14:00,12.882084,77.5744,2017-05-16 14:00:00,14,1,16,5,2,0,0,1,0,0,-0.4999999999999998,-0.8660254037844388,0.7818314824680298,0.6234898018587336,0.49999999999999994,-0.8660254037844387,12.88,77.57000000000001,71,10.191628565023104,4,2.0,2.0,0,8.55333223803211
Chain Snatching,16/05/2017,14:30,12.886347,77.566189,2017-05-16 14:30:00,14,1,16,5,2,0,0,1,0,0,-0.4999999999999998,-0.8660254037844388,0.7818314824680298,0.6234898018587336,0.49999999999999994,-0.8660254037844387,12.88,77.56,64,9.967215965067865,4,2.0,2.0,0,8.348774539791274
Chain Snatching,21/06/2017,22:15,12.868679,77.5794,2017-06-21 22:15:00,22,2,21,6,2,0,0,0,0,1,-0.5000000000000004,0.8660254037844384,0.9749279121818236,-0.22252093395631434,1.2246467991473532e-16,-1.0,12.86,77.57000000000001,10,11.562252309865672,4,2.0,3.0,0,7.193685818395112
Chain Snatching,11/4/2018,11:00,12.881587,77.5762,2018-04-11 11:00:00,11,2,11,4,2,0,1,0,0,0,0.258819045102521,-0.9659258262890682,0.9749279121818236,-0.22252093395631434,0.8660254037844387,-0.49999999999999983,12.88,77.57000000000001,71,10.20570612735906,4,2.0,1.6,0,6.842665790425689
Chain Snatching,13/04/2018,18:45,12.891846,77.5766,2018-04-13 18:45:00,18,4,13,4,2,0,0,0,1,0,-1.0,-1.8369701987210297e-16,-0.433883739117558,-0.9009688679024191,0.8660254037844387,-0.49999999999999983,12.89,77.57000000000001,44,9.080258276099167,4,2.0,2.4,0,9.135989975448767
Chain Snatching,26/05/2018,20:00,12.862015,77.58549,2018-05-26 20:00:00,20,5,26,5,2,1,0,0,1,0,-0.8660254037844386,0.5000000000000001,-0.9749279121818236,-0.2225209339563146,0.49999999999999994,-0.8660254037844387,12.86,77.58,63,12.225232300256739,4,2.0,2.4,0,9.981319400063212
Chain Snatching,6/6/2018,21:30,12.88169,77.5791,2018-06-06 21:30:00,21,2,6,6,2,0,0,0,1,0,-0.7071067811865477,0.7071067811865474,0.9749279121818236,-0.22252093395631434,1.2246467991473532e-16,-1.0,12.88,77.57000000000001,71,10.137681871622384,4,2.0,2.4,0,10.263998685638532
Chain Snatching,13/06/2018,18:30,12.892977,77.57807,2018-06-13 18:30:00,18,2,13,6,2,0,0,0,1,0,-1.0,-1.8369701987210297e-16,0.9749279121818236,-0.22252093395631434,1.2246467991473532e-16,-1.0,12.89,77.57000000000001,44,8.924133363978534,4,2.0,2.4,0,9.135989975448767
Chain Snatching,24/06/2018,15:10,12.868153,77.57441,2018-06-24 15:10:00,15,6,24,6,2,1,0,1,0,0,-0.7071067811865471,-0.7071067811865479,-0.7818314824680299,0.6234898018587334,1.2246467991473532e-16,-1.0,12.86,77.57000000000001,10,11.709063032290306,4,2.0,2.0,0,4.795790545596741
Chain Snatching,8/7/2018,9:00,12.881898,77.57622,2018-07-08 09:00:00,9,6,8,7,3,1,1,0,0,0,0.7071067811865476,-0.7071067811865475,-0.7818314824680299,0.6234898018587334,-0.4999999999999998,-0.8660254037844388,12.88,77.57000000000001,71,10.171368360525411,4,2.0,1.6,0,6.842665790425689
Chain Snatching,19/07/2018,18:00,12.871359,77.57279,2018-07-19 18:00:00,18,3,19,7,3,0,0,0,1,0,-1.0,-1.8369701987210297e-16,0.43388373911755823,-0.900968867902419,-0.4999999999999998,-0.8660254037844388,12.870000000000001,77.57000000000001,14,11.394169897511357,4,2.0,2.4,0,6.499320482645304
Chain Snatching,16/01/2015,17:15,12.8937594596734,77.5615194330341,2015-01-16 17:15:00,17,4,16,1,1,0,0,1,0,0,-0.9659258262890683,-0.25881904510252063,-0.433883739117558,-0.9009688679024191,0.49999999999999994,0.8660254037844387,12.89,77.56,99,9.368566652583128,4,2.0,2.0,0,9.210340371976184
Chain Snatching,1/2/2015,21:20,12.8974156120756,77.5551514198462,2015-02-01 21:20:00,21,6,1,2,1,1,0,0,1,0,-0.7071067811865477,0.7071067811865474,-0.7818314824680299,0.6234898018587334,0.8660254037844386,0.5000000000000001,12.89,77.55,56,9.290962428987443,4,2.0,2.4,0,9.70332304280292
Chain Snatching,11/6/2015,17:45,12.8965230402704,77.5582735553316,2015-06-11 17:45:00,17,3,11,6,2,0,0,1,0,0,-0.9659258262890683,-0.25881904510252063,0.43388373911755823,-0.900968867902419,1.2246467991473532e-16,-1.0,12.89,77.55,56,9.22988101948408,4,2.0,2.0,0,8.0861025356691
Chain Snatching,24/08/2015,19:00,12.9109359450741,77.5646696875901,2015-08-24 19:00:00,19,0,24,8,3,0,0,0,1,0,-0.9659258262890684,0.2588190451025203,0.0,1.0,-0.8660254037844384,-0.5000000000000004,12.91,77.56,126,7.484848783116466,4,2.0,2.4,0,11.626049007500619
Chain Snatching,16/02/2016,16:15,12.9042104353826,77.5686183140161,2016-02-16 16:15:00,16,1,16,2,1,0,0,1,0,0,-0.8660254037844384,-0.5000000000000004,0.7818314824680298,0.6234898018587336,0.8660254037844386,0.5000000000000001,12.9,77.56,89,8.004924155933823,4,2.0,2.0,0,8.99961934066053
Chain Snatching,11/5/2016,22:15,12.8974156120756,77.5551514198462,2016-05-11 22:15:00,22,2,11,5,2,0,0,0,0,1,-0.5000000000000004,0.8660254037844384,0.9749279121818236,-0.22252093395631434,0.49999999999999994,-0.8660254037844387,12.89,77.55,56,9.290962428987443,4,2.0,3.0,0,12.129153803503652
Chain Snatching,8/12/2016,16:00,12.8974156120756,77.5551514198462,2016-12-08 16:00:00,16,3,8,12,4,0,0,1,0,0,-0.8660254037844384,-0.5000000000000004,0.43388373911755823,-0.900968867902419,-2.4492935982947064e-16,1.0,12.89,77.55,56,9.290962428987443,4,2.0,2.0,0,8.0861025356691
Chain Snatching,16/12/2016,17:30,12.8957622003642,77.5599416215927,2016-12-16 17:30:00,17,4,16,12,4,0,0,1,0,0,-0.9659258262890683,-0.25881904510252063,-0.433883739117558,-0.9009688679024191,-2.4492935982947064e-16,1.0,12.89,77.55,56,9.231455077323396,4,2.0,2.0,0,8.0861025356691
Chain Snatching,5/9/2017,15:00,12.9080332769306,77.5632487037232,2017-09-05 15:00:00,15,1,5,9,3,0,0,1,0,0,-0.7071067811865471,-0.7071067811865479,0.7818314824680298,0.6234898018587336,-1.0,-1.8369701987210297e-16,12.9,77.56,89,7.842471605931918,4,2.0,2.0,0,8.99961934066053
Chain Snatching,29/09/2017,23:00,12.9080332769306,77.5632487037232,2017-09-29 23:00:00,23,4,29,9,3,0,0,0,0,1,-0.25881904510252157,0.9659258262890681,-0.433883739117558,-0.9009688679024191,-1.0,-1.8369701987210297e-16,12.9,77.56,89,7.842471605931918,4,2.0,3.0,0,13.499429010990795
Chain Snatching,1/10/2017,18:00,12.8964474718431,77.5667368067783,2017-10-01 18:00:00,18,6,1,10,4,1,0,0,1,0,-1.0,-1.8369701987210297e-16,-0.7818314824680299,0.6234898018587334,-0.8660254037844386,0.5000000000000001,12.89,77.56,99,8.885417357544112,4,2.0,2.4,0,11.05240844637142
Chain Snatching,10/1/2017,7:15,12.904336,77.559845,2017-01-10 07:15:00,7,1,10,1,1,0,1,0,0,0,0.9659258262890683,-0.25881904510252063,0.7818314824680298,0.6234898018587336,0.49999999999999994,0.8660254037844387,12.9,77.55,37,8.374243209887597,4,2.0,1.6,0,5.820137855562217
Chain Snatching,10/4/2017,20:00,12.907846,77.558291,2017-04-10 20:00:00,20,0,10,4,2,0,0,0,1,0,-0.8660254037844386,0.5000000000000001,0.0,1.0,0.8660254037844387,-0.49999999999999983,12.9,77.55,37,8.107940637506863,4,2.0,2.4,0,8.730206783343325
Chain Snatching,10/7/2017,12:30,12.904811,77.552829,2017-07-10 12:30:00,12,0,10,7,3,0,0,1,0,0,1.2246467991473532e-16,-1.0,0.0,1.0,-0.4999999999999998,-0.8660254037844388,12.9,77.55,37,8.697488429294108,4,2.0,2.0,0,7.275172319452771
Chain Snatching,9/1/2018,15:00,12.8987338627581,77.5582034663051,2018-01-09 15:00:00,15,1,9,1,1,0,0,1,0,0,-0.7071067811865471,-0.7071067811865479,0.7818314824680298,0.6234898018587336,0.49999999999999994,0.8660254037844387,12.89,77.55,56,9.011457248378818,4,2.0,2.0,0,8.0861025356691
Chain Snatching,21/07/2018,18:00,12.8974156120756,77.5551514198462,2018-07-21 18:00:00,18,5,21,7,3,1,0,0,1,0,-1.0,-1.8369701987210297e-16,-0.9749279121818236,-0.2225209339563146,-0.4999999999999998,-0.8660254037844388,12.89,77.55,56,9.290962428987443,4,2.0,2.4,0,9.70332304280292
Chain Snatching,26/07/2018,23:00,12.9050607614656,77.5611611061094,2018-07-26 23:00:00,23,3,26,7,3,0,0,0,0,1,-0.25881904510252157,0.9659258262890681,0.43388373911755823,-0.900968867902419,-0.4999999999999998,-0.8660254037844388,12.9,77.56,89,8.238616612465572,4,2.0,3.0,0,13.499429010990795
Chain Snatching,9/9/2018,16:00,12.8979064683143,77.5594980995282,2018-09-09 16:00:00,16,6,9,9,3,1,0,1,0,0,-0.8660254037844384,-0.5000000000000004,-0.7818314824680299,0.6234898018587334,-1.0,-1.8369701987210297e-16,12.89,77.55,56,9.034300984632765,4,2.0,2.0,0,8.0861025356691
Chain Snatching,16/02/2019,16:00,12.9099852303812,77.562617357785,2019-02-16 16:00:00,16,5,16,2,1,1,0,1,0,0,-0.8660254037844384,-0.5000000000000004,-0.9749279121818236,-0.2225209339563146,0.8660254037844386,0.5000000000000001,12.9,77.56,89,7.678064246101113,4,2.0,2.0,0,8.99961934066053
Chain Snatching,11/6/2015,9:30,12.555468,77.325223,2015-06-11 09:30:00,9,3,11,6,2,0,1,0,0,0,0.7071067811865476,-0.7071067811865475,0.43388373911755823,-0.900968867902419,1.2246467991473532e-16,-1.0,12.55,77.32000000000001,2,54.721877340854896,4,2.0,1.6,0,1.7577796618689758
Chain Snatching,8/7/2015,12:30,12.93586,77.5523,2015-07-08 12:30:00,12,2,8,7,3,0,0,1,0,0,1.2246467991473532e-16,-1.0,0.9749279121818236,-0.22252093395631434,-0.4999999999999998,-0.8660254037844388,12.93,77.55,76,6.066726835805202,4,2.0,2.0,0,8.687610843707368
Chain Snatching,8/9/2015,14:15,12.941471,77.543027,2015-09-08 14:15:00,14,1,8,9,3,0,0,1,0,0,-0.4999999999999998,-0.8660254037844388,0.7818314824680298,0.6234898018587336,-1.0,-1.8369701987210297e-16,12.94,77.54,29,6.515891316501433,4,2.0,2.0,0,6.802394763324311
Chain Snatching,1/10/2015,13:30,12.939979,77.558802,2015-10-01 13:30:00,13,3,1,10,4,0,0,1,0,0,-0.2588190451025208,-0.9659258262890683,0.43388373911755823,-0.900968867902419,-0.8660254037844386,0.5000000000000001,12.93,77.55,76,5.235580550524384,4,2.0,2.0,0,8.687610843707368
Chain Snatching,10/4/2017,19:10,12.93586,77.5523,2017-04-10 19:10:00,19,0,10,4,2,0,0,0,1,0,-0.9659258262890684,0.2588190451025203,0.0,1.0,0.8660254037844387,-0.49999999999999983,12.93,77.55,76,6.066726835805202,4,2.0,2.4,0,10.42513301244884
Chain Snatching,3/5/2017,17:15,12.939397,77.541785,2017-05-03 17:15:00,17,2,3,5,2,0,0,1,0,0,-0.9659258262890683,-0.25881904510252063,0.9749279121818236,-0.22252093395631434,0.49999999999999994,-0.8660254037844387,12.93,77.54,28,6.751146113215588,4,2.0,2.0,0,6.734591659972948
Chain Snatching,2/8/2017,18:35,12.940679,77.559242,2017-08-02 18:35:00,18,2,2,8,3,0,0,0,1,0,-1.0,-1.8369701987210297e-16,0.9749279121818236,-0.22252093395631434,-0.8660254037844384,-0.5000000000000004,12.94,77.55,85,5.148039307270286,4,2.0,2.4,0,10.690433511008417
Chain Snatching,21/08/2017,17:30,12.938936,77.543658,2017-08-21 17:30:00,17,0,21,8,3,0,0,1,0,0,-0.9659258262890683,-0.25881904510252063,0.0,1.0,-0.8660254037844384,-0.5000000000000004,12.93,77.54,28,6.6080028299366464,4,2.0,2.0,0,6.734591659972948
Chain Snatching,3/9/2017,21:30,12.941142,77.545571,2017-09-03 21:30:00,21,6,3,9,3,1,0,0,1,0,-0.7071067811865477,0.7071067811865474,-0.7818314824680299,0.6234898018587334,-1.0,-1.8369701987210297e-16,12.94,77.54,29,6.300634721726609,4,2.0,2.4,0,8.162873715989173
Chain Snatching,30/09/2017,14:10,12.938936,77.543658,2017-09-30 14:10:00,14,5,30,9,3,1,0,1,0,0,-0.4999999999999998,-0.8660254037844388,-0.9749279121818236,-0.2225209339563146,-1.0,-1.8369701987210297e-16,12.93,77.54,28,6.6080028299366464,4,2.0,2.0,0,6.734591659972948
Chain Snatching,1/10/2017,7:20,12.936114,77.545066,2017-10-01 07:20:00,7,6,1,10,4,1,1,0,0,0,0.9659258262890683,-0.25881904510252063,-0.7818314824680299,0.6234898018587334,-0.8660254037844386,0.5000000000000001,12.93,77.54,28,6.662031062682778,4,2.0,1.6,0,5.387673327978359
Chain Snatching,3/11/2018,20:30,12.930845,77.539064,2018-11-03 20:30:00,20,5,3,11,4,1,0,0,1,0,-0.8660254037844386,0.5000000000000001,-0.9749279121818236,-0.2225209339563146,-0.5000000000000004,0.8660254037844384,12.93,77.53,9,7.533646331601868,4,2.0,2.4,0,5.52620422318571
Chain Snatching,4/11/2018,23:00,12.929961,77.538526,2018-11-04 23:00:00,23,6,4,11,4,1,0,0,0,1,-0.25881904510252157,0.9659258262890681,-0.7818314824680299,0.6234898018587334,-0.5000000000000004,0.8660254037844384,12.92,77.53,6,7.639480724037111,4,2.0,3.0,0,5.8377304471659395
Chain Snatching,6/3/2019,12:00,9.964648,76.298362,2019-03-06 12:00:00,12,2,6,3,1,0,0,1,0,0,1.2246467991473532e-16,-1.0,0.9749279121818236,-0.22252093395631434,1.0,6.123233995736766e-17,9.96,76.29,1,362.96507419274826,4,2.0,2.0,0,1.3862943611198906
2 wheeler theft,26/02/2016,12:0,12.945182,77.597825,2016-02-26 12:00:00,12,4,26,2,1,0,0,1,0,0,1.2246467991473532e-16,-1.0,-0.433883739117558,-0.9009688679024191,0.8660254037844386,0.5000000000000001,12.94,77.59,130,2.9582622963483862,0,2.0,2.0,0,9.750394646402302
Ordinary Theft,20/01/2015,13:15,12.9179451,77.5717196,2015-01-20 13:15:00,13,1,20,1,1,0,0,1,0,0,-0.2588190451025208,-0.9659258262890683,0.7818314824680298,0.6234898018587336,0.49999999999999994,0.8660254037844387,12.91,77.57000000000001,82,6.460884953908903,7,2.0,2.0,0,8.837681215593197
Ordinary Theft,21/01/2015,16:20,12.8978603,77.580407,2015-01-21 16:20:00,16,2,21,1,1,0,0,1,0,0,-0.8660254037844384,-0.5000000000000004,0.9749279121818236,-0.22252093395631434,0.49999999999999994,0.8660254037844387,12.89,77.58,36,8.342503698791427,7,2.0,2.0,0,7.221835825288449
Ordinary Theft,26/01/2015,14:15,12.9094322,77.5706543,2015-01-26 14:15:00,14,0,26,1,1,0,0,1,0,0,-0.4999999999999998,-0.8660254037844388,0.0,1.0,0.49999999999999994,0.8660254037844387,12.9,77.57000000000001,96,7.383775734315842,7,2.0,2.0,0,9.149421957006766
Ordinary Theft,27/01/2015,18:15,12.9073481,77.5925392,2015-01-27 18:15:00,18,1,27,1,1,0,0,0,1,0,-1.0,-1.8369701987210297e-16,0.7818314824680298,0.6234898018587336,0.49999999999999994,0.8660254037844387,12.9,77.59,25,7.147975052948778,7,2.0,2.4,0,7.819431691251557
Ordinary Theft,25/02/2015,10:45,12.9003431,77.5899003,2015-02-25 10:45:00,10,2,25,2,1,0,1,0,0,0,0.49999999999999994,-0.8660254037844387,0.9749279121818236,-0.22252093395631434,0.8660254037844386,0.5000000000000001,12.9,77.58,43,7.939758553066543,7,2.0,1.6,0,6.054703414269218
Ordinary Theft,27/02/2015,16:30,12.9217529,77.5825697,2015-02-27 16:30:00,16,4,27,2,1,0,0,1,0,0,-0.8660254037844384,-0.5000000000000004,-0.433883739117558,-0.9009688679024191,0.8660254037844386,0.5000000000000001,12.92,77.58,144,5.694001926520257,7,2.0,2.0,0,9.953467484841148
Ordinary Theft,16/03/2015,22:05,12.9097562,77.5770852,2015-03-16 22:05:00,22,0,16,3,1,0,0,0,0,1,-0.5000000000000004,0.8660254037844384,0.0,1.0,1.0,6.123233995736766e-17,12.9,77.57000000000001,96,7.133862445242765,7,2.0,3.0,0,13.724132935510148
Ordinary Theft,22/03/2015,11:50,12.9098583,77.5508203,2015-03-22 11:50:00,11,6,22,3,1,1,1,0,0,0,0.258819045102521,-0.9659258262890682,-0.7818314824680299,0.6234898018587334,1.0,6.123233995736766e-17,12.9,77.55,37,8.345235146781382,7,2.0,1.6,0,5.820137855562217
Ordinary Theft,23/03/2015,21:20,12.9164072,77.5833691,2015-03-23 21:20:00,21,0,23,3,1,0,0,0,1,0,-0.7071067811865477,0.7071067811865474,0.0,1.0,1.0,6.123233995736766e-17,12.91,77.58,105,6.256678260721543,7,2.0,2.4,0,11.19225382586896
Ordinary Theft,22/06/2015,18:05,12.8949474,77.5751356,2015-06-22 18:05:00,18,0,22,6,2,0,0,0,1,0,-1.0,-1.8369701987210297e-16,0.0,1.0,1.2246467991473532e-16,-1.0,12.89,77.57000000000001,44,8.780531345399597,7,2.0,2.4,0,9.135989975448767
Ordinary Theft,22/06/2015,19:30,12.9160929,77.5835311,2015-06-22 19:30:00,19,0,22,6,2,0,0,0,1,0,-0.9659258262890684,0.2588190451025203,0.0,1.0,1.2246467991473532e-16,-1.0,12.91,77.58,105,6.287590172364041,7,2.0,2.4,0,11.19225382586896
Ordinary Theft,14/07/2015,15:30,12.9110158,77.5842037,2015-07-14 15:30:00,15,1,14,7,3,0,0,1,0,0,-0.7071067811865471,-0.7071067811865479,0.7818314824680298,0.6234898018587336,-0.4999999999999998,-0.8660254037844388,12.91,77.58,105,6.830217897227836,7,2.0,2.0,0,9.326878188224134
Ordinary Theft,15/07/2015,10:05,12.9110418,77.5776376,2015-07-15 10:05:00,10,2,15,7,3,0,1,0,0,0,0.49999999999999994,-0.8660254037844387,0.9749279121818236,-0.22252093395631434,-0.4999999999999998,-0.8660254037844388,12.91,77.57000000000001,82,6.9801616244309335,7,2.0,1.6,0,7.070144972474558
Ordinary Theft,16/07/2015,21:55,12.9023591,77.5817811,2015-07-16 21:55:00,21,3,16,7,3,0,0,0,1,0,-0.7071067811865477,0.7071067811865474,0.43388373911755823,-0.900968867902419,-0.4999999999999998,-0.8660254037844388,12.9,77.58,43,7.823564860773434,7,2.0,2.4,0,9.082055121403826
Ordinary Theft,21/07/2015,21:00,12.9023591,77.5817811,2015-07-21 21:00:00,21,1,21,7,3,0,0,0,1,0,-0.7071067811865477,0.7071067811865474,0.7818314824680298,0.6234898018587336,-0.4999999999999998,-0.8660254037844388,12.9,77.58,43,7.823564860773434,7,2.0,2.4,0,9.082055121403826
Ordinary Theft,24/08/2015,14:30,12.9081128,77.5818518,2015-08-24 14:30:00,14,0,24,8,3,0,0,1,0,0,-0.4999999999999998,-0.8660254037844388,0.0,1.0,-0.8660254037844384,-0.5000000000000004,12.9,77.58,43,7.193368122682267,7,2.0,2.0,0,7.568379267836522
Ordinary Theft,27/08/2015,22:05,12.91152,77.5708782,2015-08-27 22:05:00,22,3,27,8,3,0,0,0,0,1,-0.5000000000000004,0.8660254037844384,0.43388373911755823,-0.900968867902419,-0.8660254037844384,-0.5000000000000004,12.91,77.57000000000001,82,7.158143257674942,7,2.0,3.0,0,13.256521823389795
Ordinary Theft,15/09/2015,10:30,12.915769,77.5925054,2015-09-15 10:30:00,10,1,15,9,3,0,1,0,0,0,0.49999999999999994,-0.8660254037844387,0.7818314824680298,0.6234898018587336,-1.0,-1.8369701987210297e-16,12.91,77.59,48,6.212272354722162,7,2.0,1.6,0,6.226912476977002
Ordinary Theft,15/09/2015,16:10,12.9087853,77.5799377,2015-09-15 16:10:00,16,1,15,9,3,0,0,1,0,0,-0.8660254037844384,-0.5000000000000004,0.7818314824680298,0.6234898018587336,-1.0,-1.8369701987210297e-16,12.9,77.57000000000001,96,7.1631362095196005,7,2.0,2.0,0,9.149421957006766
Ordinary Theft,17/09/2015,11:30,12.9062115,77.5912842,2015-09-17 11:30:00,11,3,17,9,3,0,1,0,0,0,0.258819045102521,-0.9659258262890682,0.43388373911755823,-0.900968867902419,-1.0,-1.8369701987210297e-16,12.9,77.59,25,7.279743603896165,7,2.0,1.6,0,5.212954460834371
Ordinary Theft,17/09/2015,21:00,12.9151204,77.5837865,2015-09-17 21:00:00,21,3,17,9,3,0,0,0,1,0,-0.7071067811865477,0.7071067811865474,0.43388373911755823,-0.900968867902419,-1.0,-1.8369701987210297e-16,12.91,77.58,105,6.388640098667627,7,2.0,2.4,0,11.19225382586896
Ordinary Theft,24/09/2015,18:15,12.9151669,77.5684655,2015-09-24 18:15:00,18,3,24,9,3,0,0,0,1,0,-1.0,-1.8369701987210297e-16,0.43388373911755823,-0.900968867902419,-1.0,-1.8369701987210297e-16,12.91,77.56,126,6.884609097768943,7,2.0,2.4,0,11.626049007500619
Ordinary Theft,24/09/2015,21:30,12.909258,77.5897063,2015-09-24 21:30:00,21,3,24,9,3,0,0,0,1,0,-0.7071067811865477,0.7071067811865474,0.43388373911755823,-0.900968867902419,-1.0,-1.8369701987210297e-16,12.9,77.58,43,6.952370908813222,7,2.0,2.4,0,9.082055121403826
Ordinary Theft,13/10/2015,20:35,12.9118422,77.5673703,2015-10-13 20:35:00,20,1,13,10,4,0,0,0,1,0,-0.8660254037844386,0.5000000000000001,0.7818314824680298,0.6234898018587336,-0.8660254037844386,0.5000000000000001,12.91,77.56,126,7.270533792374276,7,2.0,2.4,0,11.626049007500619
Ordinary Theft,23/10/2015,22:20,12.9119247,77.5673703,2015-10-23 22:20:00,22,4,23,10,4,0,0,0,0,1,-0.5000000000000004,0.8660254037844384,-0.433883739117558,-0.9009688679024191,-0.8660254037844386,0.5000000000000001,12.91,77.56,126,7.262150530728037,7,2.0,3.0,0,14.532561259375774
Ordinary Theft,24/10/2015,11:30,12.9016695,77.5859681,2015-10-24 11:30:00,11,5,24,10,4,1,1,0,0,0,0.258819045102521,-0.9659258262890682,-0.9749279121818236,-0.2225209339563146,-0.8660254037844386,0.5000000000000001,12.9,77.58,43,7.831983811515231,7,2.0,1.6,0,6.054703414269218
Ordinary Theft,26/11/2015,11:00,12.8944224,77.574979,2015-11-26 11:00:00,11,3,26,11,4,0,1,0,0,0,0.258819045102521,-0.9659258262890682,0.43388373911755823,-0.900968867902419,-0.5000000000000004,0.8660254037844384,12.89,77.57000000000001,44,8.841277096123397,7,2.0,1.6,0,6.090659983632512
Ordinary Theft,23/12/2015,11:05,12.9037982,77.5771592,2015-12-23 11:05:00,11,2,23,12,4,0,1,0,0,0,0.258819045102521,-0.9659258262890682,0.9749279121818236,-0.22252093395631434,-2.4492935982947064e-16,1.0,12.9,77.57000000000001,96,7.772531519605618,7,2.0,1.6,0,7.319537565605413
Ordinary Theft,14/01/2016,12:40,12.9077295,77.5782007,2016-01-14 12:40:00,12,3,14,1,1,0,0,1,0,0,1.2246467991473532e-16,-1.0,0.43388373911755823,-0.900968867902419,0.49999999999999994,0.8660254037844387,12.9,77.57000000000001,96,7.321063030997331,7,2.0,2.0,0,9.149421957006766
Ordinary Theft,22/01/2016,14:15,12.9117957,77.5826913,2016-01-22 14:15:00,14,4,22,1,1,0,0,1,0,0,-0.4999999999999998,-0.8660254037844388,-0.433883739117558,-0.9009688679024191,0.49999999999999994,0.8660254037844387,12.91,77.58,105,6.774005681263098,7,2.0,2.0,0,9.326878188224134
Ordinary Theft,22/01/2016,18:30,12.9156264,77.5962438,2016-01-22 18:30:00,18,4,22,1,1,0,0,0,1,0,-1.0,-1.8369701987210297e-16,-0.433883739117558,-0.9009688679024191,0.49999999999999994,0.8660254037844387,12.91,77.59,48,6.226529085867452,7,2.0,2.4,0,9.340368715465504
Ordinary Theft,31/01/2016,22:10,12.9156524,77.5896777,2016-01-31 22:10:00,22,6,31,1,1,1,0,0,0,1,-0.5000000000000004,0.8660254037844384,-0.7818314824680299,0.6234898018587334,0.49999999999999994,0.8660254037844387,12.91,77.58,105,6.243916775001696,7,2.0,3.0,0,13.9903172823362
Ordinary Theft,16/02/2016,18:30,12.9084786,77.5798039,2016-02-16 18:30:00,18,1,16,2,1,0,0,0,1,0,-1.0,-1.8369701987210297e-16,0.7818314824680298,0.6234898018587336,0.8660254037844386,0.5000000000000001,12.9,77.57000000000001,96,7.199609755427645,7,2.0,2.4,0,10.979306348408118
Ordinary Theft,17/02/2016,12:05,12.9070951,77.5783314,2016-02-17 12:05:00,12,2,17,2,1,0,0,1,0,0,1.2246467991473532e-16,-1.0,0.9749279121818236,-0.22252093395631434,0.8660254037844386,0.5000000000000001,12.9,77.57000000000001,96,7.386121672868971,7,2.0,2.0,0,9.149421957006766
Ordinary Theft,28/03/2016,12:45,12.9024929,77.5877414,2016-03-28 12:45:00,12,0,28,3,1,0,0,1,0,0,1.2246467991473532e-16,-1.0,0.0,1.0,1.0,6.123233995736766e-17,12.9,77.58,43,7.720222901928124,7,2.0,2.0,0,7.568379267836522
Ordinary Theft,14/04/2016,12:10,12.914277,77.5877554,2016-04-14 12:10:00,12,3,14,4,2,0,0,1,0,0,1.2246467991473532e-16,-1.0,0.43388373911755823,-0.900968867902419,0.8660254037844387,-0.49999999999999983,12.91,77.58,105,6.417040439224271,7,2.0,2.0,0,9.326878188224134
Ordinary Theft,13/05/2016,15:30,12.9124841,77.5910353,2016-05-13 15:30:00,15,4,13,5,2,0,0,1,0,0,-0.7071067811865471,-0.7071067811865479,-0.433883739117558,-0.9009688679024191,0.49999999999999994,-0.8660254037844387,12.91,77.59,48,6.584729712284794,7,2.0,2.0,0,7.783640596221253
Ordinary Theft,25/05/2016,21:05,12.8880151,77.5748036,2016-05-25 21:05:00,21,2,25,5,2,0,0,0,1,0,-0.7071067811865477,0.7071067811865474,0.9749279121818236,-0.22252093395631434,0.49999999999999994,-0.8660254037844387,12.88,77.57000000000001,71,9.538626974533262,7,2.0,2.4,0,10.263998685638532
Ordinary Theft,13/06/2016,18:15,12.8983605,77.573651,2016-06-13 18:15:00,18,0,13,6,2,0,0,0,1,0,-1.0,-1.8369701987210297e-16,0.0,1.0,1.2246467991473532e-16,-1.0,12.89,77.57000000000001,44,8.454394621041674,7,2.0,2.4,0,9.135989975448767
Ordinary Theft,13/06/2016,20:10,12.9230649,77.5691731,2016-06-13 20:10:00,20,0,13,6,2,0,0,0,1,0,-0.8660254037844386,0.5000000000000001,0.0,1.0,1.2246467991473532e-16,-1.0,12.92,77.56,33,6.0595899094740835,7,2.0,2.4,0,8.463265259078787
Ordinary Theft,20/06/2016,11:40,12.9054915,77.5781472,2016-06-20 11:40:00,11,0,20,6,2,0,1,0,0,0,0.258819045102521,-0.9659258262890682,0.0,1.0,1.2246467991473532e-16,-1.0,12.9,77.57000000000001,96,7.564081295973099,7,2.0,1.6,0,7.319537565605413
Ordinary Theft,20/06/2016,12:00,12.9358084,77.5222107,2016-06-20 12:00:00,12,0,20,6,2,0,0,1,0,0,1.2246467991473532e-16,-1.0,0.0,1.0,1.2246467991473532e-16,-1.0,12.93,77.52,2,8.796307260892041,7,2.0,2.0,0,2.1972245773362196
Ordinary Theft,20/06/2016,12:15,12.9055524,77.5772974,2016-06-20 12:15:00,12,0,20,6,2,0,0,1,0,0,1.2246467991473532e-16,-1.0,0.0,1.0,1.2246467991473532e-16,-1.0,12.9,77.57000000000001,96,7.579756359222608,7,2.0,2.0,0,9.149421957006766
Ordinary Theft,25/06/2016,9:00,12.9215017,77.5645742,2016-06-25 09:00:00,9,5,25,6,2,1,1,0,0,0,0.7071067811865476,-0.7071067811865475,-0.9749279121818236,-0.2225209339563146,1.2246467991473532e-16,-1.0,12.92,77.56,33,6.4513521670167995,7,2.0,1.6,0,5.642176839385859
Ordinary Theft,19/07/2016,16:45,12.9110706,77.5737475,2016-07-19 16:45:00,16,1,19,7,3,0,0,1,0,0,-0.8660254037844384,-0.5000000000000004,0.7818314824680298,0.6234898018587336,-0.4999999999999998,-0.8660254037844388,12.91,77.57000000000001,82,7.099799294539426,7,2.0,2.0,0,8.837681215593197
Ordinary Theft,23/07/2016,12:35,12.9066249,77.5873944,2016-07-23 12:35:00,12,5,23,7,3,1,0,1,0,0,1.2246467991473532e-16,-1.0,-0.9749279121818236,-0.2225209339563146,-0.4999999999999998,-0.8660254037844388,12.9,77.58,43,7.266978588791629,7,2.0,2.0,0,7.568379267836522
Ordinary Theft,23/07/2016,13:15,12.9034996,77.593697,2016-07-23 13:15:00,13,5,23,7,3,1,0,1,0,0,-0.2588190451025208,-0.9659258262890683,-0.9749279121818236,-0.2225209339563146,-0.4999999999999998,-0.8660254037844388,12.9,77.59,25,7.5730512902309846,7,2.0,2.0,0,6.516193076042964
Ordinary Theft,27/07/2016,15:35,12.9011822,77.5712258,2016-07-27 15:35:00,15,2,27,7,3,0,0,1,0,0,-0.7071067811865471,-0.7071067811865479,0.9749279121818236,-0.22252093395631434,-0.4999999999999998,-0.8660254037844388,12.9,77.57000000000001,96,8.229655059454894,7,2.0,2.0,0,9.149421957006766
Ordinary Theft,16/08/2016,16:00,12.9006982,77.5883553,2016-08-16 16:00:00,16,1,16,8,3,0,0,1,0,0,-0.8660254037844384,-0.5000000000000004,0.7818314824680298,0.6234898018587336,-0.8660254037844384,-0.5000000000000004,12.9,77.58,43,7.912913490093864,7,2.0,2.0,0,7.568379267836522
Ordinary Theft,22/08/2016,21:00,12.9084302,77.5854817,2016-08-22 21:00:00,21,0,22,8,3,0,0,0,1,0,-0.7071067811865477,0.7071067811865474,0.0,1.0,-0.8660254037844384,-0.5000000000000004,12.9,77.58,43,7.093328045611833,7,2.0,2.4,0,9.082055121403826
Ordinary Theft,23/08/2016,10:30,12.9058661,77.5849725,2016-08-23 10:30:00,10,1,23,8,3,0,1,0,0,0,0.49999999999999994,-0.8660254037844387,0.7818314824680298,0.6234898018587336,-0.8660254037844384,-0.5000000000000004,12.9,77.58,43,7.383366054971978,7,2.0,1.6,0,6.054703414269218
Ordinary Theft,24/08/2016,10:15,12.9057109,77.5879706,2016-08-24 10:15:00,10,2,24,8,3,0,1,0,0,0,0.49999999999999994,-0.8660254037844387,0.9749279121818236,-0.22252093395631434,-0.8660254037844384,-0.5000000000000004,12.9,77.58,43,7.361674434588876,7,2.0,1.6,0,6.054703414269218
Ordinary Theft,13/10/2016,13:45,12.908317,77.5904558,2016-10-13 13:45:00,13,3,13,10,4,0,0,1,0,0,-0.2588190451025208,-0.9659258262890683,0.43388373911755823,-0.900968867902419,-0.8660254037844386,0.5000000000000001,12.9,77.59,25,7.051065976676875,7,2.0,2.0,0,6.516193076042964
Ordinary Theft,18/10/2016,18:20,12.8802211,77.5651294,2016-10-18 18:20:00,18,1,18,10,4,0,0,0,1,0,-1.0,-1.8369701987210297e-16,0.7818314824680298,0.6234898018587336,-0.8660254037844386,0.5000000000000001,12.88,77.56,64,10.651035153988907,7,2.0,2.4,0,10.018529447749527
Ordinary Theft,27/12/2016,19:35,12.9057887,77.5929769,2016-12-27 19:35:00,19,1,27,12,4,0,0,0,1,0,-0.9659258262890684,0.2588190451025203,0.7818314824680298,0.6234898018587336,-2.4492935982947064e-16,1.0,12.9,77.59,25,7.319996380016956,7,2.0,2.4,0,7.819431691251557
Ordinary Theft,13/01/2017,18:20,12.9070982,77.5820122,2017-01-13 18:20:00,18,4,13,1,1,0,0,0,1,0,-1.0,-1.8369701987210297e-16,-0.433883739117558,-0.9009688679024191,0.49999999999999994,0.8660254037844387,12.9,77.58,43,7.30085099023698,7,2.0,2.4,0,9.082055121403826
Ordinary Theft,28/01/2017,16:20,12.9135052,77.5744027,2017-01-28 16:20:00,16,5,28,1,1,1,0,1,0,0,-0.8660254037844384,-0.5000000000000004,-0.9749279121818236,-0.2225209339563146,0.49999999999999994,0.8660254037844387,12.91,77.57000000000001,82,6.820585755063878,7,2.0,2.0,0,8.837681215593197
Ordinary Theft,16/02/2017,14:00,12.9535277,77.5726056,2017-02-16 14:00:00,14,3,16,2,1,0,0,1,0,0,-0.4999999999999998,-0.8660254037844388,0.43388373911755823,-0.900968867902419,0.8660254037844386,0.5000000000000001,12.950000000000001,77.57000000000001,30,3.117467621544107,7,2.0,2.0,0,6.8679744089702925
Ordinary Theft,21/07/2017,11:15,12.9083163,77.586334,2017-07-21 11:15:00,11,4,21,7,3,0,1,0,0,0,0.258819045102521,-0.9659258262890682,-0.433883739117558,-0.9009688679024191,-0.4999999999999998,-0.8660254037844388,12.9,77.58,43,7.09361514999646,7,2.0,1.6,0,6.054703414269218
4 Wheeler Theft,05/01/2015,18:40,12.92043,77.5819,2015-01-05 18:40:00,18,0,5,1,1,0,0,0,1,0,-1.0,-1.8369701987210297e-16,0.0,1.0,0.49999999999999994,0.8660254037844387,12.92,77.58,144,5.85392830349119,1,2.0,2.4,0,11.944160981809377
4 Wheeler Theft,06/02/2015,13:00,12.915668,77.589964,2015-02-06 13:00:00,13,4,6,2,1,0,0,1,0,0,-0.2588190451025208,-0.9659258262890683,-0.433883739117558,-0.9009688679024191,0.8660254037844386,0.5000000000000001,12.91,77.58,105,6.239613701074743,1,2.0,2.0,0,9.326878188224134
4 Wheeler Theft,04/09/2015,13:30,12.918081,77.587101,2015-09-04 13:30:00,13,4,4,9,3,0,0,1,0,0,-0.2588190451025208,-0.9659258262890683,-0.433883739117558,-0.9009688679024191,-1.0,-1.8369701987210297e-16,12.91,77.58,105,6.006272353269602,1,2.0,2.0,0,9.326878188224134
4 Wheeler Theft,20/11/2015,17:30,12.92819,77.62512,2015-11-20 17:30:00,17,4,20,11,4,0,0,1,0,0,-0.9659258262890683,-0.25881904510252063,-0.433883739117558,-0.9009688679024191,-0.5000000000000004,0.8660254037844384,12.92,77.62,3,5.851346798406174,1,2.0,2.0,0,2.772588722239781
4 Wheeler Theft,08/12/2015,17:15,12.92334,77.58484,2015-12-08 17:15:00,17,1,8,12,4,0,0,1,0,0,-0.9659258262890683,-0.25881904510252063,0.7818314824680298,0.6234898018587336,-2.4492935982947064e-16,1.0,12.92,77.58,144,5.469505496186577,1,2.0,2.0,0,9.953467484841148
4 Wheeler Theft,10/12/2015,18:45,12.92875,77.5801,2015-12-10 18:45:00,18,3,10,12,4,0,0,0,1,0,-1.0,-1.8369701987210297e-16,0.43388373911755823,-0.900968867902419,-2.4492935982947064e-16,1.0,12.92,77.58,144,5.017113636402217,1,2.0,2.4,0,11.944160981809377
4 Wheeler Theft,05/07/2016,14:45,12.931037,77.585842,2016-07-05 14:45:00,14,1,5,7,3,0,0,1,0,0,-0.4999999999999998,-0.8660254037844388,0.7818314824680298,0.6234898018587336,-0.4999999999999998,-0.8660254037844388,12.93,77.58,74,4.609169432632897,1,2.0,2.0,0,8.63497622707262
4 Wheeler Theft,19/10/2016,13:00,12.922657,77.589563,2016-10-19 13:00:00,13,2,19,10,4,0,0,1,0,0,-0.2588190451025208,-0.9659258262890683,0.9749279121818236,-0.22252093395631434,-0.8660254037844386,0.5000000000000001,12.92,77.58,144,5.4695189521692225,1,2.0,2.0,0,9.953467484841148
4 Wheeler Theft,21/10/2016,11:30,12.917125,77.578344,2016-10-21 11:30:00,11,4,21,10,4,0,1,0,0,0,0.258819045102521,-0.9659258262890682,-0.433883739117558,-0.9009688679024191,-0.8660254037844386,0.5000000000000001,12.91,77.57000000000001,82,6.30831387424652,1,2.0,1.6,0,7.070144972474558
4 Wheeler Theft,24/10/2016,17:00,12.922461,77.589557,2016-10-24 17:00:00,17,0,24,10,4,0,0,1,0,0,-0.9659258262890683,-0.25881904510252063,0.0,1.0,-0.8660254037844386,0.5000000000000001,12.92,77.58,144,5.491269477660546,1,2.0,2.0,0,9.953467484841148
4 Wheeler Theft,25/10/2016,15:00,12.891917,77.589229,2016-10-25 15:00:00,15,1,25,10,4,0,0,1,0,0,-0.7071067811865471,-0.7071067811865479,0.7818314824680298,0.6234898018587336,-0.8660254037844386,0.5000000000000001,12.89,77.58,36,8.879444652998545,1,2.0,2.0,0,7.221835825288449
4 Wheeler Theft,03/02/2017,11:30,12.93744,77.56426,2017-02-03 11:30:00,11,4,3,2,1,0,1,0,0,0,0.258819045102521,-0.9659258262890682,-0.433883739117558,-0.9009688679024191,0.8660254037844386,0.5000000000000001,12.93,77.56,63,5.023697849080952,1,2.0,1.6,0,6.654212933375475
4 Wheeler Theft,27/03/2017,12:15,12.928459,77.576972,2017-03-27 12:15:00,12,0,27,3,1,0,0,1,0,0,1.2246467991473532e-16,-1.0,0.0,1.0,1.0,6.123233995736766e-17,12.92,77.57000000000001,55,5.163428522023863,1,2.0,2.0,0,8.0507033814703
4 Wheeler Theft,21/08/2017,12:45,12.919182,77.57765,2017-08-21 12:45:00,12,0,21,8,3,0,0,1,0,0,1.2246467991473532e-16,-1.0,0.0,1.0,-0.8660254037844384,-0.5000000000000004,12.91,77.57000000000001,82,6.11120138958284,1,2.0,2.0,0,8.837681215593197
4 Wheeler Theft,14/04/2018,11:30,12.926192,77.586141,2018-04-14 11:30:00,11,5,14,4,2,1,1,0,0,0,0.258819045102521,-0.9659258262890682,-0.9749279121818236,-0.2225209339563146,0.8660254037844387,-0.49999999999999983,12.92,77.58,144,5.131676810649081,1,2.0,1.6,0,7.962773987872919
4 Wheeler Theft,09/06/2018,16:30,12.91743,77.583465,2018-06-09 16:30:00,16,5,9,6,2,1,0,1,0,0,-0.8660254037844384,-0.5000000000000004,-0.9749279121818236,-0.2225209339563146,1.2246467991473532e-16,-1.0,12.91,77.58,105,6.143110095776199,1,2.0,2.0,0,9.326878188224134
4 Wheeler Theft,29/06/2018,16:00,12.920162,77.587113,2018-06-29 16:00:00,16,4,29,6,2,0,0,1,0,0,-0.8660254037844384,-0.5000000000000004,-0.433883739117558,-0.9009688679024191,1.2246467991473532e-16,-1.0,12.92,77.58,144,5.776905108750635,1,2.0,2.0,0,9.953467484841148
4 Wheeler Theft,03/09/2018,18:00,12.92204,77.58221,2018-09-03 18:00:00,18,0,3,9,3,0,0,0,1,0,-1.0,-1.8369701987210297e-16,0.0,1.0,-1.0,-1.8369701987210297e-16,12.92,77.58,144,5.672031150572036,1,2.0,2.4,0,11.944160981809377
4 Wheeler Theft,14/11/2018,11:00,12.916744,77.597456,2018-11-14 11:00:00,11,2,14,11,4,0,1,0,0,0,0.258819045102521,-0.9659258262890682,0.9749279121818236,-0.22252093395631434,-0.5000000000000004,0.8660254037844384,12.91,77.59,48,6.107556024566457,1,2.0,1.6,0,6.226912476977002
4 Wheeler Theft,27/05/2019,11:00,12.9057223,77.53558126,2019-05-27 11:00:00,11,0,27,5,2,0,1,0,0,0,0.258819045102521,-0.9659258262890682,0.0,1.0,0.49999999999999994,-0.8660254037844387,12.9,77.53,36,9.724600488428452,1,2.0,1.6,0,5.77746866023076
4 Wheeler Theft,8/1/2015,10:55,12.9013564,77.5897255,2015-01-08 10:55:00,10,3,8,1,1,0,1,0,0,0,0.49999999999999994,-0.8660254037844387,0.43388373911755823,-0.900968867902419,0.49999999999999994,0.8660254037844387,12.9,77.58,43,7.8285755351896595,1,2.0,1.6,0,6.054703414269218
4 Wheeler Theft,21/01/2015,11:20,12.8940057,77.5828137,2015-01-21 11:20:00,11,2,21,1,1,0,1,0,0,0,0.258819045102521,-0.9659258262890682,0.9749279121818236,-0.22252093395631434,0.49999999999999994,0.8660254037844387,12.89,77.58,36,8.722130243629275,1,2.0,1.6,0,5.77746866023076
4 Wheeler Theft,5/3/2015,19:35,12.9045368,77.5843208,2015-03-05 19:35:00,19,3,5,3,1,0,0,0,1,0,-0.9659258262890684,0.2588190451025203,0.43388373911755823,-0.900968867902419,1.0,6.123233995736766e-17,12.9,77.58,43,7.539834265319371,1,2.0,2.4,0,9.082055121403826
4 Wheeler Theft,12/3/2015,18:30,12.9359949,77.5664314,2015-03-12 18:30:00,18,3,12,3,1,0,0,0,1,0,-1.0,-1.8369701987210297e-16,0.43388373911755823,-0.900968867902419,1.0,6.123233995736766e-17,12.93,77.56,63,4.999224506716598,1,2.0,2.4,0,9.981319400063212
4 Wheeler Theft,17/03/2015,21:00,12.9082055,77.5817295,2015-03-17 21:00:00,21,1,17,3,1,0,0,0,1,0,-0.7071067811865477,0.7071067811865474,0.7818314824680298,0.6234898018587336,1.0,6.123233995736766e-17,12.9,77.58,43,7.185813309440722,1,2.0,2.4,0,9.082055121403826
4 Wheeler Theft,15/04/2015,22:10,12.8820672,77.5798883,2015-04-15 22:10:00,22,2,15,4,2,0,0,0,0,1,-0.5000000000000004,0.8660254037844384,0.9749279121818236,-0.22252093395631434,0.8660254037844387,-0.49999999999999983,12.88,77.57000000000001,71,10.082458549576897,1,2.0,3.0,0,12.829998357048165
4 Wheeler Theft,17/04/2015,22:30,12.9009867,77.584761,2015-04-17 22:30:00,22,4,17,4,2,0,0,0,0,1,-0.5000000000000004,0.8660254037844384,-0.433883739117558,-0.9009688679024191,0.8660254037844387,-0.49999999999999983,12.9,77.58,43,7.923910299535256,1,2.0,3.0,0,11.352568901754783
4 Wheeler Theft,11/6/2015,17:45,12.8093213,77.2940594,2015-06-11 17:45:00,17,3,11,6,2,0,0,1,0,0,-0.9659258262890683,-0.25881904510252063,0.43388373911755823,-0.900968867902419,1.2246467991473532e-16,-1.0,12.8,77.29,2,37.24011877699521,1,2.0,2.0,0,2.1972245773362196
4 Wheeler Theft,7/10/2015,8:40,12.8920076,77.5837341,2015-10-07 08:40:00,8,2,7,10,4,0,1,0,0,0,0.8660254037844387,-0.49999999999999983,0.9749279121818236,-0.22252093395631434,-0.8660254037844386,0.5000000000000001,12.89,77.58,36,8.928270439509086,1,2.0,1.6,0,5.77746866023076
4 Wheeler Theft,19/10/2015,11:30,12.9059669,77.5793992,2015-10-19 11:30:00,11,0,19,10,4,0,1,0,0,0,0.258819045102521,-0.9659258262890682,0.0,1.0,-0.8660254037844386,0.5000000000000001,12.9,77.57000000000001,96,7.481678195011442,1,2.0,1.6,0,7.319537565605413
4 Wheeler Theft,3/12/2015,11:00,12.9059929,77.5728331,2015-12-03 11:00:00,11,3,3,12,4,0,1,0,0,0,0.258819045102521,-0.9659258262890682,0.43388373911755823,-0.900968867902419,-2.4492935982947064e-16,1.0,12.9,77.57000000000001,96,7.667077860026917,1,2.0,1.6,0,7.319537565605413
4 Wheeler Theft,9/1/2016,20:05,12.9092966,77.5739359,2016-01-09 20:05:00,20,5,9,1,1,1,0,0,1,0,-0.8660254037844386,0.5000000000000001,-0.9749279121818236,-0.2225209339563146,0.49999999999999994,0.8660254037844387,12.9,77.57000000000001,96,7.280767545030534,1,2.0,2.4,0,10.979306348408118
4 Wheeler Theft,5/3/2016,15:30,12.904328,77.5961512,2016-03-05 15:30:00,15,5,5,3,1,1,0,1,0,0,-0.7071067811865471,-0.7071067811865479,-0.9749279121818236,-0.2225209339563146,1.0,6.123233995736766e-17,12.9,77.59,25,7.482193817481998,1,2.0,2.0,0,6.516193076042964
4 Wheeler Theft,12/5/2016,13:00,12.913173,77.597754,2016-05-12 13:00:00,13,3,12,5,2,0,0,1,0,0,-0.2588190451025208,-0.9659258262890683,0.43388373911755823,-0.900968867902419,0.49999999999999994,-0.8660254037844387,12.91,77.59,48,6.505770885575111,1,2.0,2.0,0,7.783640596221253
4 Wheeler Theft,1/8/2016,20:05,12.9118554,77.5723761,2016-08-01 20:05:00,20,0,1,8,3,0,0,0,1,0,-0.8660254037844386,0.5000000000000001,0.0,1.0,-0.8660254037844384,-0.5000000000000004,12.91,77.57000000000001,82,7.066387944958739,1,2.0,2.4,0,10.605217458711836
4 Wheeler Theft,3/8/2016,19:35,12.8971425,77.5818036,2016-08-03 19:35:00,19,2,3,8,3,0,0,0,1,0,-0.9659258262890684,0.2588190451025203,0.9749279121818236,-0.22252093395631434,-0.8660254037844384,-0.5000000000000004,12.89,77.58,36,8.394637427605593,1,2.0,2.4,0,8.666202990346138
4 Wheeler Theft,7/8/2016,9:20,12.9107989,77.5758887,2016-08-07 09:20:00,9,6,7,8,3,1,1,0,0,0,0.7071067811865476,-0.7071067811865475,-0.7818314824680299,0.6234898018587334,-0.8660254037844384,-0.5000000000000004,12.91,77.57000000000001,82,7.058318059449318,1,2.0,1.6,0,7.070144972474558
4 Wheeler Theft,24/12/2016,17:00,12.9015479,77.5801482,2016-12-24 17:00:00,17,5,24,12,4,1,0,1,0,0,-0.9659258262890683,-0.25881904510252063,-0.9749279121818236,-0.2225209339563146,-2.4492935982947064e-16,1.0,12.9,77.58,43,7.945329722237298,1,2.0,2.0,0,7.568379267836522
4 Wheeler Theft,26/12/2016,11:20,12.9015739,77.5735821,2016-12-26 11:20:00,11,0,26,12,4,0,1,0,0,0,0.258819045102521,-0.9659258262890682,0.0,1.0,-2.4492935982947064e-16,1.0,12.9,77.57000000000001,96,8.112861867171599,1,2.0,1.6,0,7.319537565605413
4 Wheeler Theft,11/4/2017,11:30,12.9386699,77.5402407,2017-04-11 11:30:00,11,1,11,4,2,0,1,0,0,0,0.258819045102521,-0.9659258262890682,0.7818314824680298,0.6234898018587336,0.8660254037844387,-0.49999999999999983,12.93,77.54,28,6.93593375473803,1,2.0,1.6,0,5.387673327978359
4 Wheeler Theft,8/5/2017,13:00,12.9388326,77.5402407,2017-05-08 13:00:00,13,0,8,5,2,0,0,1,0,0,-0.2588190451025208,-0.9659258262890683,0.0,1.0,0.49999999999999994,-0.8660254037844387,12.93,77.54,28,6.926398232343141,1,2.0,2.0,0,6.734591659972948
4 Wheeler Theft,27/05/2017,18:00,12.9389952,77.5402406,2017-05-27 18:00:00,18,5,27,5,2,1,0,0,1,0,-1.0,-1.8369701987210297e-16,-0.9749279121818236,-0.2225209339563146,0.49999999999999994,-0.8660254037844387,12.93,77.54,28,6.916911941186294,1,2.0,2.4,0,8.081509991967538
4 Wheeler Theft,29/05/2017,17:30,12.9178748,77.5845514,2017-05-29 17:30:00,17,0,29,5,2,0,0,1,0,0,-0.9659258262890683,-0.25881904510252063,0.0,1.0,0.49999999999999994,-0.8660254037844387,12.91,77.58,105,6.072408265459242,1,2.0,2.0,0,9.326878188224134
4 Wheeler Theft,29/07/2017,13:00,12.9211693,77.5799377,2017-07-29 13:00:00,13,5,29,7,3,1,0,1,0,0,-0.2588190451025208,-0.9659258262890683,-0.9749279121818236,-0.2225209339563146,-0.4999999999999998,-0.8660254037844388,12.92,77.57000000000001,55,5.828404635034132,1,2.0,2.0,0,8.0507033814703
4 Wheeler Theft,11/10/2017,17:30,12.916245,77.5932261,2017-10-11 17:30:00,17,2,11,10,4,0,0,1,0,0,-0.9659258262890683,-0.25881904510252063,0.9749279121818236,-0.22252093395631434,-0.8660254037844386,0.5000000000000001,12.91,77.59,48,6.156995645270152,1,2.0,2.0,0,7.783640596221253
4 Wheeler Theft,10/12/2017,12:30,12.9077254,77.5978325,2017-12-10 12:30:00,12,6,10,12,4,1,0,1,0,0,1.2246467991473532e-16,-1.0,-0.7818314824680299,0.6234898018587334,-2.4492935982947064e-16,1.0,12.9,77.59,25,7.111165191209063,1,2.0,2.0,0,6.516193076042964
4 Wheeler Theft,14/02/2018,13:00,12.9097302,77.5836513,2018-02-14 13:00:00,13,2,14,2,1,0,0,1,0,0,-0.2588190451025208,-0.9659258262890683,0.9749279121818236,-0.22252093395631434,0.8660254037844386,0.5000000000000001,12.9,77.58,43,6.981177117269212,1,2.0,2.0,0,7.568379267836522
4 Wheeler Theft,5/6/2018,9:30,12.9154951,77.5931886,2018-06-05 09:30:00,9,1,5,6,2,0,1,0,0,0,0.7071067811865476,-0.7071067811865475,0.7818314824680298,0.6234898018587336,1.2246467991473532e-16,-1.0,12.91,77.59,48,6.240454950011045,1,2.0,1.6,0,6.226912476977002
4 Wheeler Theft,12/8/2018,15:15,12.9159378,77.5855939,2018-08-12 15:15:00,15,6,12,8,3,1,0,1,0,0,-0.7071067811865471,-0.7071067811865479,-0.7818314824680299,0.6234898018587334,-0.8660254037844384,-0.5000000000000004,12.91,77.58,105,6.265832404660011,1,2.0,2.0,0,9.326878188224134
4 Wheeler Theft,9/5/2019,9:30,12.911032,77.5759036,2019-05-09 09:30:00,9,3,9,5,2,0,1,0,0,0,0.7071067811865476,-0.7071067811865475,0.43388373911755823,-0.900968867902419,0.49999999999999994,-0.8660254037844387,12.91,77.57000000000001,82,7.033029478106421,1,2.0,1.6,0,7.070144972474558
4 Wheeler Theft,19/10/2019,11:00,12.908631,77.5866536,2019-10-19 11:00:00,11,5,19,10,4,1,1,0,0,0,0.258819045102521,-0.9659258262890682,-0.9749279121818236,-0.2225209339563146,-0.8660254037844386,0.5000000000000001,12.9,77.58,43,7.054591880782516,1,2.0,1.6,0,6.054703414269218
4 Wheeler Theft,28/01/2015,11:00,12.92945278,77.57361111,2015-01-28 11:00:00,11,2,28,1,1,0,1,0,0,0,0.258819045102521,-0.9659258262890682,0.9749279121818236,-0.22252093395631434,0.49999999999999994,0.8660254037844387,12.92,77.57000000000001,55,5.209331937380014,1,2.0,1.6,0,6.44056270517624
4 Wheeler Theft,30/07/2015,13:30,12.91519722,77.55861111,2015-07-30 13:30:00,13,3,30,7,3,0,0,1,0,0,-0.2588190451025208,-0.9659258262890683,0.43388373911755823,-0.900968867902419,-0.4999999999999998,-0.8660254037844388,12.91,77.55,40,7.385463276015144,1,2.0,2.0,0,7.427144133408616
4 Wheeler Theft,19/08/2015,13:30,12.92516111,77.56138889,2015-08-19 13:30:00,13,2,19,8,3,0,0,1,0,0,-0.2588190451025208,-0.9659258262890683,0.9749279121818236,-0.22252093395631434,-0.8660254037844384,-0.5000000000000004,12.92,77.56,33,6.294231139895671,1,2.0,2.0,0,7.052721049232323
4 Wheeler Theft,2/11/2015,5:30,12.92543056,77.56083333,2015-11-02 05:30:00,5,0,2,11,4,0,0,0,0,1,0.9659258262890683,0.25881904510252074,0.0,1.0,-0.5000000000000004,0.8660254037844384,12.92,77.56,33,6.304425337477978,1,2.0,3.0,0,10.579081573848484
4 Wheeler Theft,25/04/2016,13:00,12.92439444,77.56805556,2016-04-25 13:00:00,13,0,25,4,2,0,0,1,0,0,-0.2588190451025208,-0.9659258262890683,0.0,1.0,0.8660254037844387,-0.49999999999999983,12.92,77.56,33,5.985548373587789,1,2.0,2.0,0,7.052721049232323
4 Wheeler Theft,15/07/2016,19:30,12.93251111,77.57555556,2016-07-15 19:30:00,19,4,15,7,3,0,0,0,1,0,-0.9659258262890684,0.2588190451025203,-0.433883739117558,-0.9009688679024191,-0.4999999999999998,-0.8660254037844388,12.93,77.57000000000001,40,4.811556974189332,1,2.0,2.4,0,8.912572960090339
4 Wheeler Theft,13/07/2017,10:00,12.92543056,77.56083333,2017-07-13 10:00:00,10,3,13,7,3,0,1,0,0,0,0.49999999999999994,-0.8660254037844387,0.43388373911755823,-0.900968867902419,-0.4999999999999998,-0.8660254037844388,12.92,77.56,33,6.304425337477978,1,2.0,1.6,0,5.642176839385859
4 Wheeler Theft,31/07/2017,18:00,12.92635556,77.57694444,2017-07-31 18:00:00,18,0,31,7,3,0,0,0,1,0,-1.0,-1.8369701987210297e-16,0.0,1.0,-0.4999999999999998,-0.8660254037844388,12.92,77.57000000000001,55,5.382484230737628,1,2.0,2.4,0,9.66084405776436
4 Wheeler Theft,2/8/2017,9:30,12.91542222,77.56194444,2017-08-02 09:30:00,9,2,2,8,3,0,1,0,0,0,0.7071067811865476,-0.7071067811865475,0.9749279121818236,-0.22252093395631434,-0.8660254037844384,-0.5000000000000004,12.91,77.56,126,7.179461391809013,1,2.0,1.6,0,7.750699338333746
4 Wheeler Theft,17/11/2018,19:00,12.92088,77.56191,2018-11-17 19:00:00,19,5,17,11,4,1,0,0,1,0,-0.9659258262890684,0.2588190451025203,-0.9749279121818236,-0.2225209339563146,-0.5000000000000004,0.8660254037844384,12.92,77.56,33,6.660118463103552,1,2.0,2.4,0,8.463265259078787
4 Wheeler Theft,6/12/2018,16:15,12.9169,77.559677,2018-12-06 16:15:00,16,3,6,12,4,0,0,1,0,0,-0.8660254037844384,-0.5000000000000004,0.43388373911755823,-0.900968867902419,-2.4492935982947064e-16,1.0,12.91,77.55,40,7.163671174597801,1,2.0,2.0,0,7.427144133408616
4 Wheeler Theft,16/01/2019,19:30,12.92124722,77.57305556,2019-01-16 19:30:00,19,2,16,1,1,0,0,0,1,0,-0.9659258262890684,0.2588190451025203,0.9749279121818236,-0.22252093395631434,0.49999999999999994,0.8660254037844387,12.92,77.57000000000001,55,6.066258757609888,1,2.0,2.4,0,9.66084405776436
4 Wheeler Theft,20/02/2019,9:00,12.919,77.55535,2019-02-20 09:00:00,9,2,20,2,1,0,1,0,0,0,0.7071067811865476,-0.7071067811865475,0.9749279121818236,-0.22252093395631434,0.8660254037844386,0.5000000000000001,12.91,77.55,40,7.231953225696139,1,2.0,1.6,0,5.941715306726893
4 Wheeler Theft,17/07/2019,12:15,12.87823,77.50026,2019-07-17 12:15:00,12,2,17,7,3,0,0,1,0,0,1.2246467991473532e-16,-1.0,0.9749279121818236,-0.22252093395631434,-0.4999999999999998,-0.8660254037844388,12.870000000000001,77.5,4,14.571509055598884,1,2.0,2.0,0,3.2188758248682006
4 Wheeler Theft,29/04/2015,15:00,12.935347,77.587477,2015-04-29 15:00:00,15,2,29,4,2,0,0,1,0,0,-0.7071067811865471,-0.7071067811865479,0.9749279121818236,-0.22252093395631434,0.8660254037844387,-0.49999999999999983,12.93,77.58,74,4.1043849180345795,1,2.0,2.0,0,8.63497622707262
4 Wheeler Theft,24/06/2015,13:00,12.942437,77.591254,2015-06-24 13:00:00,13,2,24,6,2,0,0,1,0,0,-0.2588190451025208,-0.9659258262890683,0.9749279121818236,-0.22252093395631434,1.2246467991473532e-16,-1.0,12.94,77.59,130,3.2629855648416553,1,2.0,2.0,0,9.750394646402302
4 Wheeler Theft,29/10/2015,15:30,12.936294,77.593072,2015-10-29 15:30:00,15,3,29,10,4,0,0,1,0,0,-0.7071067811865471,-0.7071067811865479,0.43388373911755823,-0.900968867902419,-0.8660254037844386,0.5000000000000001,12.93,77.59,58,3.9293384293828835,1,2.0,2.0,0,8.15507488781144
4 Wheeler Theft,17/12/2015,17:50,12.938159,77.590823,2015-12-17 17:50:00,17,3,17,12,4,0,0,1,0,0,-0.9659258262890683,-0.25881904510252063,0.43388373911755823,-0.900968867902419,-2.4492935982947064e-16,1.0,12.93,77.59,58,3.740927263315505,1,2.0,2.0,0,8.15507488781144
4 Wheeler Theft,01/11/2017,13:00,12.93605,77.585719,2017-11-01 13:00:00,13,2,1,11,4,0,0,1,0,0,-0.2588190451025208,-0.9659258262890683,0.9749279121818236,-0.22252093395631434,-0.5000000000000004,0.8660254037844384,12.93,77.58,74,4.0684449036345995,1,2.0,2.0,0,8.63497622707262
4 Wheeler Theft,04/11/2017,18:15,12.942522,77.58286,2017-11-04 18:15:00,18,5,4,11,4,1,0,0,1,0,-1.0,-1.8369701987210297e-16,-0.9749279121818236,-0.2225209339563146,-0.5000000000000004,0.8660254037844384,12.94,77.58,80,3.4746028774181776,1,2.0,2.4,0,10.546677971213853
4 Wheeler Theft,04/07/2018,12:30,12.947692,77.591893,2018-07-04 12:30:00,12,2,4,7,3,0,0,1,0,0,1.2246467991473532e-16,-1.0,0.9749279121818236,-0.22252093395631434,-0.4999999999999998,-0.8660254037844388,12.94,77.59,130,2.6745830171433793,1,2.0,2.0,0,9.750394646402302
4 Wheeler Theft,19/11/2018,16:00,12.943024,77.5871144,2018-11-19 16:00:00,16,0,19,11,4,0,0,1,0,0,-0.8660254037844384,-0.5000000000000004,0.0,1.0,-0.5000000000000004,0.8660254037844384,12.94,77.58,80,3.279411098153135,1,2.0,2.0,0,8.788898309344878
4 Wheeler Theft,14/07/2019,12:30,12.935347,77.587477,2019-07-14 12:30:00,12,6,14,7,3,1,0,1,0,0,1.2246467991473532e-16,-1.0,-0.7818314824680299,0.6234898018587334,-0.4999999999999998,-0.8660254037844388,12.93,77.58,74,4.1043849180345795,1,2.0,2.0,0,8.63497622707262
4 Wheeler Theft,27/07/2019,14:00,12.941058,77.586061,2019-07-27 14:00:00,14,5,27,7,3,1,0,1,0,0,-0.4999999999999998,-0.8660254037844388,-0.9749279121818236,-0.2225209339563146,-0.4999999999999998,-0.8660254037844388,12.94,77.58,80,3.519917363713201,1,2.0,2.0,0,8.788898309344878
4 Wheeler Theft,18/01/2015,14:45,12.90471042,77.54488816,2015-01-18 14:45:00,14,6,18,1,1,1,0,1,0,0,-0.4999999999999998,-0.8660254037844388,-0.7818314824680299,0.6234898018587334,0.49999999999999994,0.8660254037844387,12.9,77.54,56,9.183917372715063,1,2.0,2.0,0,8.0861025356691
4 Wheeler Theft,18/01/2015,20:00,12.90626715,77.55057549,2015-01-18 20:00:00,20,6,18,1,1,1,0,0,1,0,-0.8660254037844386,0.5000000000000001,-0.7818314824680299,0.6234898018587334,0.49999999999999994,0.8660254037844387,12.9,77.55,37,8.691265741256066,1,2.0,2.4,0,8.730206783343325
4 Wheeler Theft,11/02/2015,22:10,12.90245473,77.54181407,2015-02-11 22:10:00,22,2,11,2,1,0,0,0,0,1,-0.5000000000000004,0.8660254037844384,0.9749279121818236,-0.22252093395631434,0.8660254037844386,0.5000000000000001,12.9,77.54,56,9.583276557587427,1,2.0,3.0,0,12.129153803503652
4 Wheeler Theft,06/04/2015,21:00,12.88924511,77.57370198,2015-04-06 21:00:00,21,0,6,4,2,0,0,0,1,0,-0.7071067811865477,0.7071067811865474,0.0,1.0,0.8660254037844387,-0.49999999999999983,12.88,77.57000000000001,71,9.433359257993082,1,2.0,2.4,0,10.263998685638532
4 Wheeler Theft,14/04/2015,8:00,12.88496438,77.55767556,2015-04-14 08:00:00,8,1,14,4,2,0,1,0,0,0,0.8660254037844387,-0.49999999999999983,0.7818314824680298,0.6234898018587336,0.8660254037844387,-0.49999999999999983,12.88,77.55,33,10.4315409423076,1,2.0,1.6,0,5.642176839385859
4 Wheeler Theft,17/07/2015,23:30,12.91633747,77.54077845,2015-07-17 23:30:00,23,4,17,7,3,0,0,0,0,1,-0.25881904510252157,0.9659258262890681,-0.433883739117558,-0.9009688679024191,-0.4999999999999998,-0.8660254037844388,12.91,77.54,47,8.47226604029929,1,2.0,3.0,0,11.613603032723674
4 Wheeler Theft,10/09/2015,20:30,12.90505271,77.54189573,2015-09-10 20:30:00,20,3,10,9,3,0,0,0,1,0,-0.8660254037844386,0.5000000000000001,0.43388373911755823,-0.900968867902419,-1.0,-1.8369701987210297e-16,12.9,77.54,56,9.347669771386116,1,2.0,2.4,0,9.70332304280292
4 Wheeler Theft,26/09/2015,2:45,12.88211726,77.55729374,2015-09-26 02:45:00,2,5,26,9,3,1,0,0,0,1,0.49999999999999994,0.8660254037844387,-0.9749279121818236,-0.2225209339563146,-1.0,-1.8369701987210297e-16,12.88,77.55,33,10.740110243061986,1,2.0,3.0,0,10.579081573848484
4 Wheeler Theft,08/10/2015,9:30,77.53502225,12.90784268,2015-10-08 09:30:00,9,3,8,10,4,0,1,0,0,0,0.7071067811865476,-0.7071067811865475,0.43388373911755823,-0.900968867902419,-0.8660254037844386,0.5000000000000001,77.53,12.9,1,8005.417642460163,1,2.0,1.6,0,1.1090354888959124
4 Wheeler Theft,23/12/2015,23:00,12.90759817,77.53481056,2015-12-23 23:00:00,23,2,23,12,4,0,0,0,0,1,-0.25881904510252157,0.9659258262890681,0.9749279121818236,-0.22252093395631434,-2.4492935982947064e-16,1.0,12.9,77.53,36,9.624474948478646,1,2.0,3.0,0,10.832753737932673
4 Wheeler Theft,06/01/2016,10:02,12.88982145,77.57974701,2016-01-06 10:02:00,10,2,6,1,1,0,1,0,0,0,0.49999999999999994,-0.8660254037844387,0.9749279121818236,-0.22252093395631434,0.49999999999999994,0.8660254037844387,12.88,77.57000000000001,71,9.234734028642427,1,2.0,1.6,0,6.842665790425689
4 Wheeler Theft,10/11/2016,10:00,12.89890617,77.54993736,2016-11-10 10:00:00,10,3,10,11,4,0,1,0,0,0,0.49999999999999994,-0.8660254037844387,0.43388373911755823,-0.900968867902419,-0.5000000000000004,0.8660254037844384,12.89,77.54,35,9.421557054992443,1,2.0,1.6,0,5.733630301529776
4 Wheeler Theft,09/02/2016,20:45,12.89537161,77.55032355,2016-02-09 20:45:00,20,1,9,2,1,0,0,0,1,0,-0.8660254037844386,0.5000000000000001,0.7818314824680298,0.6234898018587336,0.8660254037844386,0.5000000000000001,12.89,77.55,56,9.740170449921873,1,2.0,2.4,0,9.70332304280292
4 Wheeler Theft,06/03/2016,21:45,12.88982145,77.57974701,2016-03-06 21:45:00,21,6,6,3,1,1,0,0,1,0,-0.7071067811865477,0.7071067811865474,-0.7818314824680299,0.6234898018587334,1.0,6.123233995736766e-17,12.88,77.57000000000001,71,9.234734028642427,1,2.0,2.4,0,10.263998685638532
4 Wheeler Theft,28/03/2016,8:40,12.88947089,77.57420817,2016-03-28 08:40:00,8,0,28,3,1,0,1,0,0,0,0.8660254037844387,-0.49999999999999983,0.0,1.0,1.0,6.123233995736766e-17,12.88,77.57000000000001,71,9.395935602550736,1,2.0,1.6,0,6.842665790425689
4 Wheeler Theft,16/06/2016,10:15,12.90759817,77.53481056,2016-06-16 10:15:00,10,3,16,6,2,0,1,0,0,0,0.49999999999999994,-0.8660254037844387,0.43388373911755823,-0.900968867902419,1.2246467991473532e-16,-1.0,12.9,77.53,36,9.624474948478646,1,2.0,1.6,0,5.77746866023076
4 Wheeler Theft,20/08/2016,22:30,12.8887116,77.57377343,2016-08-20 22:30:00,22,5,20,8,3,1,0,0,0,1,-0.5000000000000004,0.8660254037844384,-0.9749279121818236,-0.2225209339563146,-0.8660254037844384,-0.5000000000000004,12.88,77.57000000000001,71,9.48911415343694,1,2.0,3.0,0,12.829998357048165
4 Wheeler Theft,24/09/2016,0:00,12.8776868,77.58071703,2016-09-24 00:00:00,0,5,24,9,3,1,0,0,0,1,0.0,1.0,-0.9749279121818236,-0.2225209339563146,-1.0,-1.8369701987210297e-16,12.870000000000001,77.58,22,10.550508235754675,1,2.0,3.0,0,9.406482647787449
4 Wheeler Theft,16/10/2016,16:00,12.8887116,77.57377343,2016-10-16 16:00:00,16,6,16,10,4,1,0,1,0,0,-0.8660254037844384,-0.5000000000000004,-0.7818314824680299,0.6234898018587334,-0.8660254037844386,0.5000000000000001,12.88,77.57000000000001,71,9.48911415343694,1,2.0,2.0,0,8.55333223803211
4 Wheeler Theft,22/11/2016,14:00,12.8776868,77.58071703,2016-11-22 14:00:00,14,1,22,11,4,0,0,1,0,0,-0.4999999999999998,-0.8660254037844388,0.7818314824680298,0.6234898018587336,-0.5000000000000004,0.8660254037844384,12.870000000000001,77.58,22,10.550508235754675,1,2.0,2.0,0,6.270988431858299
4 Wheeler Theft,06/12/2016,19:15,12.90504139,77.54315768,2016-12-06 19:15:00,19,1,6,12,4,0,0,0,1,0,-0.9659258262890684,0.2588190451025203,0.7818314824680298,0.6234898018587336,-2.4492935982947064e-16,1.0,12.9,77.54,56,9.265744066959424,1,2.0,2.4,0,9.70332304280292
4 Wheeler Theft,27/03/2017,10:30,12.91688388,77.54201107,2017-03-27 10:30:00,10,0,27,3,1,0,1,0,0,0,0.49999999999999994,-0.8660254037844387,0.0,1.0,1.0,6.123233995736766e-17,12.91,77.54,47,8.336415878134817,1,2.0,1.6,0,6.193921617452626
4 Wheeler Theft,27/07/2017,14:50,12.88376625,77.56842522,2017-07-27 14:50:00,14,3,27,7,3,0,0,1,0,0,-0.4999999999999998,-0.8660254037844388,0.43388373911755823,-0.900968867902419,-0.4999999999999998,-0.8660254037844388,12.88,77.56,64,10.17029163660703,1,2.0,2.0,0,8.348774539791274
4 Wheeler Theft,21/03/2018,21:30,12.9057223,77.53558126,2018-03-21 21:30:00,21,2,21,3,1,0,0,0,1,0,-0.7071067811865477,0.7071067811865474,0.9749279121818236,-0.22252093395631434,1.0,6.123233995736766e-17,12.9,77.53,36,9.724600488428452,1,2.0,2.4,0,8.666202990346138
4 Wheeler Theft,01/12/2018,16:00,12.89180481,77.55394005,2018-12-01 16:00:00,16,5,1,12,4,1,0,1,0,0,-0.8660254037844384,-0.5000000000000004,-0.9749279121818236,-0.2225209339563146,-2.4492935982947064e-16,1.0,12.89,77.55,56,9.906779632665451,1,2.0,2.0,0,8.0861025356691
4 Wheeler Theft,21/12/2018,17:30,12.88316591,77.56520086,2018-12-21 17:30:00,17,4,21,12,4,0,0,1,0,0,-0.9659258262890683,-0.25881904510252063,-0.433883739117558,-0.9009688679024191,-2.4492935982947064e-16,1.0,12.88,77.56,64,10.336727176991117,1,2.0,2.0,0,8.348774539791274
4 Wheeler Theft,19/03/2019,15:00,12.88627829,77.57129098,2019-03-19 15:00:00,15,1,19,3,1,0,0,1,0,0,-0.7071067811865471,-0.7071067811865479,0.7818314824680298,0.6234898018587336,1.0,6.123233995736766e-17,12.88,77.57000000000001,71,9.817892444374873,1,2.0,2.0,0,8.55333223803211
4 Wheeler Theft,19/03/2019,18:30,12.89157884,77.58142943,2019-03-19 18:30:00,18,1,19,3,1,0,0,0,1,0,-1.0,-1.8369701987210297e-16,0.7818314824680298,0.6234898018587336,1.0,6.123233995736766e-17,12.89,77.58,36,9.011704119053672,1,2.0,2.4,0,8.666202990346138
4 Wheeler Theft,13/03/2019,12:45,12.90711393,77.5439924,2019-03-13 12:45:00,12,2,13,3,1,0,0,1,0,0,1.2246467991473532e-16,-1.0,0.9749279121818236,-0.22252093395631434,1.0,6.123233995736766e-17,12.9,77.54,56,9.027471640350738,1,2.0,2.0,0,8.0861025356691
4 Wheeler Theft,24/03/2019,5:30,12.9072655,77.53613997,2019-03-24 05:30:00,5,6,24,3,1,1,0,0,0,1,0.9659258262890683,0.25881904510252074,-0.7818314824680299,0.6234898018587334,1.0,6.123233995736766e-17,12.9,77.53,36,9.555742509152322,1,2.0,3.0,0,10.832753737932673
4 Wheeler Theft,20/04/2019,11:30,12.90912148,77.55154907,2019-04-20 11:30:00,11,5,20,4,2,1,1,0,0,0,0.258819045102521,-0.9659258262890682,-0.9749279121818236,-0.2225209339563146,0.8660254037844387,-0.49999999999999983,12.9,77.55,37,8.36848397008389,1,2.0,1.6,0,5.820137855562217
4 Wheeler Theft,26/04/2019,13:00,12.91147818,77.55291868,2019-04-26 13:00:00,13,4,26,4,2,0,0,1,0,0,-0.2588190451025208,-0.9659258262890683,-0.433883739117558,-0.9009688679024191,0.8660254037844387,-0.49999999999999983,12.91,77.55,40,8.068206690347427,1,2.0,2.0,0,7.427144133408616
4 Wheeler Theft,13/09/2019,20:00,12.9057223,77.53558126,2019-09-13 20:00:00,20,4,13,9,3,0,0,0,1,0,-0.8660254037844386,0.5000000000000001,-0.433883739117558,-0.9009688679024191,-1.0,-1.8369701987210297e-16,12.9,77.53,36,9.724600488428452,1,2.0,2.4,0,8.666202990346138
4 Wheeler Theft,28/11/2015,18:30,12.87239,77.542482,2015-11-28 18:30:00,18,5,28,11,4,1,0,0,1,0,-1.0,-1.8369701987210297e-16,-0.9749279121818236,-0.2225209339563146,-0.5000000000000004,0.8660254037844384,12.870000000000001,77.54,24,12.393657887508063,1,2.0,2.4,0,7.725301979683681
4 Wheeler Theft,06/12/2016,18:00,12.865651,77.539388,2016-12-06 18:00:00,18,1,6,12,4,0,0,0,1,0,-1.0,-1.8369701987210297e-16,0.7818314824680298,0.6234898018587336,-2.4492935982947064e-16,1.0,12.86,77.53,13,13.213584013835707,1,2.0,2.4,0,6.33373759107662
4 Wheeler Theft,11/12/2016,19:45,12.872337,77.562521,2016-12-11 19:45:00,19,6,11,12,4,1,0,0,1,0,-0.9659258262890684,0.2588190451025203,-0.7818314824680299,0.6234898018587334,-2.4492935982947064e-16,1.0,12.870000000000001,77.56,25,11.572151786026597,1,2.0,2.4,0,7.819431691251557
4 Wheeler Theft,19/12/2016,15:00,12.870018,77.565913,2016-12-19 15:00:00,15,0,19,12,4,0,0,1,0,0,-0.7071067811865471,-0.7071067811865479,0.0,1.0,-2.4492935982947064e-16,1.0,12.870000000000001,77.56,25,11.715481979288223,1,2.0,2.0,0,6.516193076042964
4 Wheeler Theft,24/10/2017,11:30,12.89083,77.538516,2017-10-24 11:30:00,11,1,24,10,4,0,1,0,0,0,0.258819045102521,-0.9659258262890682,0.7818314824680298,0.6234898018587336,-0.8660254037844386,0.5000000000000001,12.89,77.53,8,10.844607689567507,1,2.0,1.6,0,3.5155593237379517
4 Wheeler Theft,18/12/2017,13:00,12.892083,77.542315,2017-12-18 13:00:00,13,0,18,12,4,0,0,1,0,0,-0.2588190451025208,-0.9659258262890683,0.0,1.0,-2.4492935982947064e-16,1.0,12.89,77.54,35,10.50174814174332,1,2.0,2.0,0,7.16703787691222
4 Wheeler Theft,20/02/2019,11:00,12.870325,77.547321,2019-02-20 11:00:00,11,2,20,2,1,0,1,0,0,0,0.258819045102521,-0.9659258262890682,0.9749279121818236,-0.22252093395631434,0.8660254037844386,0.5000000000000001,12.870000000000001,77.54,24,12.372235163814953,1,2.0,1.6,0,5.150201319789121
4 Wheeler Theft,05/03/2019,20:10,12.858186,77.578695,2019-03-05 20:10:00,20,1,5,3,1,0,0,0,1,0,-0.8660254037844386,0.5000000000000001,0.7818314824680298,0.6234898018587336,1.0,6.123233995736766e-17,12.85,77.57000000000001,9,12.728331066766437,1,2.0,2.4,0,5.52620422318571
4 Wheeler Theft,12/03/2019,9:30,12.891881,77.519617,2019-03-12 09:30:00,9,1,12,3,1,0,1,0,0,0,0.7071067811865476,-0.7071067811865475,0.7818314824680298,0.6234898018587336,1.0,6.123233995736766e-17,12.89,77.51,1,12.025506235256811,1,2.0,1.6,0,1.1090354888959124
4 Wheeler Theft,15/09/2019,11:30,12.857243,77.573414,2019-09-15 11:30:00,11,6,15,9,3,1,1,0,0,0,0.258819045102521,-0.9659258262890682,-0.7818314824680299,0.6234898018587334,-1.0,-1.8369701987210297e-16,12.85,77.57000000000001,9,12.921572885408722,1,2.0,1.6,0,3.684136148790474
4 Wheeler Theft,05/11/2019,21:00,12.869623,77.572816,2019-11-05 21:00:00,21,1,5,11,4,0,0,0,1,0,-0.7071067811865477,0.7071067811865474,0.7818314824680298,0.6234898018587336,-0.5000000000000004,0.8660254037844384,12.86,77.57000000000001,10,11.582501026263529,1,2.0,2.4,0,5.754948654716089
4 Wheeler Theft,04/04/2017,10:30,12.85514,77.588799,2017-04-04 10:30:00,10,1,4,4,2,0,1,0,0,0,0.49999999999999994,-0.8660254037844387,0.7818314824680298,0.6234898018587336,0.8660254037844387,-0.49999999999999983,12.85,77.58,11,12.965014957401205,1,2.0,1.6,0,3.9758506396608007
4 Wheeler Theft,29/05/2017,14:00,12.896403,77.570289,2017-05-29 14:00:00,14,0,29,5,2,0,0,1,0,0,-0.4999999999999998,-0.8660254037844388,0.0,1.0,0.49999999999999994,-0.8660254037844387,12.89,77.57000000000001,44,8.766789928094997,1,2.0,2.0,0,7.613324979540639
4 Wheeler Theft,30/05/2017,20:40,12.895925,77.585328,2017-05-30 20:40:00,20,1,30,5,2,0,0,0,1,0,-0.8660254037844386,0.5000000000000001,0.7818314824680298,0.6234898018587336,0.49999999999999994,-0.8660254037844387,12.89,77.58,36,8.474460539015563,1,2.0,2.4,0,8.666202990346138
4 Wheeler Theft,3/3/2017,16:30,12.90121944,77.59055556,2017-03-03 16:30:00,16,4,3,3,1,0,0,1,0,0,-0.8660254037844384,-0.5000000000000004,-0.433883739117558,-0.9009688679024191,1.0,6.123233995736766e-17,12.9,77.59,25,7.838225673492807,1,2.0,2.0,0,6.516193076042964
4 Wheeler Theft,1/9/2018,13:00,12.88985,77.59277778,2018-09-01 13:00:00,13,5,1,9,3,1,0,1,0,0,-0.2588190451025208,-0.9659258262890683,-0.9749279121818236,-0.2225209339563146,-1.0,-1.8369701987210297e-16,12.88,77.59,1,9.092330153771757,1,2.0,2.0,0,1.3862943611198906
4 Wheeler Theft,2/10/2018,12:30,12.894823,77.59862,2018-10-02 12:30:00,12,1,2,10,4,0,0,1,0,0,1.2246467991473532e-16,-1.0,0.7818314824680298,0.6234898018587336,-0.8660254037844386,0.5000000000000001,12.89,77.59,5,8.548321868426662,1,2.0,2.0,0,3.58351893845611
4 Wheeler Theft,4/4/2018,12:00,12.90393889,77.5825,2018-04-04 12:00:00,12,2,4,4,2,0,0,1,0,0,1.2246467991473532e-16,-1.0,0.9749279121818236,-0.22252093395631434,0.8660254037844387,-0.49999999999999983,12.9,77.58,43,7.636992355975661,1,2.0,2.0,0,7.568379267836522
4 Wheeler Theft,3/7/2019,18:30,12.893183,77.572113,2019-07-03 18:30:00,18,2,3,7,3,0,0,0,1,0,-1.0,-1.8369701987210297e-16,0.9749279121818236,-0.22252093395631434,-0.4999999999999998,-0.8660254037844388,12.89,77.57000000000001,44,9.053728106253743,1,2.0,2.4,0,9.135989975448767
4 Wheeler Theft,7/8/2019,10:30,12.904658,77.58838,2019-08-07 10:30:00,10,2,7,8,3,0,1,0,0,0,0.49999999999999994,-0.8660254037844387,0.9749279121818236,-0.22252093395631434,-0.8660254037844384,-0.5000000000000004,12.9,77.58,43,7.474069610632928,1,2.0,1.6,0,6.054703414269218
4 Wheeler Theft,11/6/2019,10:30,12.889763,77.585588,2019-06-11 10:30:00,10,1,11,6,2,0,1,0,0,0,0.49999999999999994,-0.8660254037844387,0.7818314824680298,0.6234898018587336,1.2246467991473532e-16,-1.0,12.88,77.58,29,9.152121932992815,1,2.0,1.6,0,5.441915810659449
4 Wheeler Theft,21/02/2016,19:50,12.936359,77.354721,2016-02-21 19:50:00,19,6,21,2,1,1,0,0,1,0,-0.9659258262890684,0.2588190451025203,-0.7818314824680299,0.6234898018587334,0.8660254037844386,0.5000000000000001,12.93,77.35000000000001,1,26.288204707928315,1,2.0,2.4,0,1.6635532333438687
4 Wheeler Theft,12/5/2016,19:45,12.936275,77.550704,2016-05-12 19:45:00,19,3,12,5,2,0,0,0,1,0,-0.9659258262890684,0.2588190451025203,0.43388373911755823,-0.900968867902419,0.49999999999999994,-0.8660254037844387,12.93,77.55,76,6.168951357154378,1,2.0,2.4,0,10.42513301244884
4 Wheeler Theft,14/11/2016,10:30,12.555043,77.322021,2016-11-14 10:30:00,10,0,14,11,4,0,1,0,0,0,0.49999999999999994,-0.8660254037844387,0.0,1.0,-0.5000000000000004,0.8660254037844384,12.55,77.32000000000001,2,54.947883600864095,1,2.0,1.6,0,1.7577796618689758
4 Wheeler Theft,21/11/2016,20:30,12.560156,77.320937,2016-11-21 20:30:00,20,0,21,11,4,0,0,0,1,0,-0.8660254037844386,0.5000000000000001,0.0,1.0,-0.5000000000000004,0.8660254037844384,12.56,77.32000000000001,3,54.53320927148104,1,2.0,2.4,0,3.3271064666877375
4 Wheeler Theft,7/6/2018,12:30,12.945085,77.548612,2018-06-07 12:30:00,12,3,7,6,2,0,0,1,0,0,1.2246467991473532e-16,-1.0,0.43388373911755823,-0.900968867902419,1.2246467991473532e-16,-1.0,12.94,77.54,29,5.790250224976681,1,2.0,2.0,0,6.802394763324311
4 Wheeler Theft,3/12/2019,14:00,12.943637,77.844691,2019-12-03 14:00:00,14,1,3,12,4,0,0,1,0,0,-0.4999999999999998,-0.8660254037844388,0.7818314824680298,0.6234898018587336,-2.4492935982947064e-16,1.0,12.94,77.84,1,27.27851857515532,1,2.0,2.0,0,1.3862943611198906
4 Wheeler Theft,27/11/2015,18:00,12.9578264,77.55941741,2015-11-27 18:00:00,18,4,27,11,4,0,0,0,1,0,-1.0,-1.8369701987210297e-16,-0.433883739117558,-0.9009688679024191,-0.5000000000000004,0.8660254037844384,12.950000000000001,77.55,16,4.108533436224985,1,2.0,2.4,0,6.799712025734919
4 Wheeler Theft,02/09/2016,17:15,12.9578264,77.55941741,2016-09-02 17:15:00,17,4,2,9,3,0,0,1,0,0,-0.9659258262890683,-0.25881904510252063,-0.433883739117558,-0.9009688679024191,-1.0,-1.8369701987210297e-16,12.950000000000001,77.55,16,4.108533436224985,1,2.0,2.0,0,5.666426688112432
4 Wheeler Theft,18/08/2018,16:15,12.94983,77.56041,2018-08-18 16:15:00,16,5,18,8,3,1,0,1,0,0,-0.8660254037844384,-0.5000000000000004,-0.9749279121818236,-0.2225209339563146,-0.8660254037844384,-0.5000000000000004,12.94,77.56,99,4.425623992095297,1,2.0,2.0,0,9.210340371976184
4 Wheeler Theft,08/12/2015,8:15,12.9556,77.56883,2015-12-08 08:15:00,8,1,8,12,4,0,1,0,0,0,0.8660254037844387,-0.49999999999999983,0.7818314824680298,0.6234898018587336,-2.4492935982947064e-16,1.0,12.950000000000001,77.56,65,3.3110565494562296,1,2.0,1.6,0,6.70344758724228
4 Wheeler Theft,4/11/2016,11:15,12.94176,77.55656,2016-11-04 11:15:00,11,4,4,11,4,0,1,0,0,0,0.258819045102521,-0.9659258262890682,-0.433883739117558,-0.9009688679024191,-0.5000000000000004,0.8660254037844384,12.94,77.55,85,5.291665288455461,1,2.0,1.6,0,7.126955674005612
4 Wheeler Theft,12/9/2016,12:30,12.943648,77.549789,2016-09-12 12:30:00,12,0,12,9,3,0,0,1,0,0,1.2246467991473532e-16,-1.0,0.0,1.0,-1.0,-1.8369701987210297e-16,12.94,77.54,29,5.765409177601171,1,2.0,2.0,0,6.802394763324311
4 Wheeler Theft,11/3/2017,10:30,12.9422,77.552401,2017-03-11 10:30:00,10,5,11,3,1,1,1,0,0,0,0.49999999999999994,-0.8660254037844387,-0.9749279121818236,-0.2225209339563146,1.0,6.123233995736766e-17,12.94,77.55,85,5.621220107355221,1,2.0,1.6,0,7.126955674005612
4 Wheeler Theft,29/01/2015,20:00,12.930861,77.554069,2015-01-29 20:00:00,20,3,29,1,1,0,0,0,1,0,-0.8660254037844386,0.5000000000000001,0.43388373911755823,-0.900968867902419,0.49999999999999994,0.8660254037844387,12.93,77.55,76,6.309674042174243,1,2.0,2.4,0,10.42513301244884
4 Wheeler Theft,29/3/2015,8:00,12.926837,77.544735,2015-03-29 08:00:00,8,6,29,3,1,1,1,0,0,0,0.8660254037844387,-0.49999999999999983,-0.7818314824680299,0.6234898018587334,1.0,6.123233995736766e-17,12.92,77.54,49,7.346765311162435,1,2.0,1.6,0,6.259236808685034
4 Wheeler Theft,31/01/2015,8:00,12.924688,77.548142,2015-01-31 08:00:00,8,5,31,1,1,1,1,0,0,0,0.8660254037844387,-0.49999999999999983,-0.9749279121818236,-0.2225209339563146,0.49999999999999994,0.8660254037844387,12.92,77.54,49,7.2496341119190095,1,2.0,1.6,0,6.259236808685034
4 Wheeler Theft,24/04/2015,23:00,12.930228,77.547624,2015-04-24 23:00:00,23,4,24,4,2,0,0,0,0,1,-0.25881904510252157,0.9659258262890681,-0.433883739117558,-0.9009688679024191,0.8660254037844387,-0.49999999999999983,12.93,77.54,28,6.8613183435180005,1,2.0,3.0,0,10.101887489959422
4 Wheeler Theft,23/07/2015,7:00,12.924729,77.558486,2015-07-23 07:00:00,7,3,23,7,3,0,1,0,0,0,0.9659258262890683,-0.25881904510252063,0.43388373911755823,-0.900968867902419,-0.4999999999999998,-0.8660254037844388,12.92,77.55,55,6.517607299305567,1,2.0,1.6,0,6.44056270517624
4 Wheeler Theft,31/08/2015,18:00,12.929702,77.553766,2015-08-31 18:00:00,18,0,31,8,3,0,0,0,1,0,-1.0,-1.8369701987210297e-16,0.0,1.0,-0.8660254037844384,-0.5000000000000004,12.92,77.55,55,6.425402601402339,1,2.0,2.4,0,9.66084405776436
4 Wheeler Theft,17/08/2016,11:30,12.9212651,77.54999552,2016-08-17 11:30:00,11,2,17,8,3,0,1,0,0,0,0.258819045102521,-0.9659258262890682,0.9749279121818236,-0.22252093395631434,-0.8660254037844384,-0.5000000000000004,12.92,77.54,49,7.395338633049649,1,2.0,1.6,0,6.259236808685034
4 Wheeler Theft,3/10/2017,10:00,12.552074,77333558.0,2017-10-03 10:00:00,10,1,3,10,4,0,1,0,0,0,0.49999999999999994,-0.8660254037844387,0.7818314824680298,0.6234898018587336,-0.8660254037844386,0.5000000000000001,12.55,77333557.99,1,8677.036099972758,1,2.0,1.6,0,1.1090354888959124
4 Wheeler Theft,09/11/2018,11:00,12.2553,77.552298,2018-11-09 11:00:00,11,4,9,11,4,0,1,0,0,0,0.258819045102521,-0.9659258262890682,-0.433883739117558,-0.9009688679024191,-0.5000000000000004,0.8660254037844384,12.25,77.55,1,79.78108446082179,1,2.0,1.6,0,1.1090354888959124
4 Wheeler Theft,22/05/2019,10:15,12.932284,77.54988,2019-05-22 10:15:00,10,2,22,5,2,0,1,0,0,0,0.49999999999999994,-0.8660254037844387,0.9749279121818236,-0.22252093395631434,0.49999999999999994,-0.8660254037844387,12.93,77.54,28,6.52664060437722,1,2.0,1.6,0,5.387673327978359
4 Wheeler Theft,23/09/2019,9:30,12.929298,77.54597,2019-09-23 09:30:00,9,0,23,9,3,0,1,0,0,0,0.7071067811865476,-0.7071067811865475,0.0,1.0,-1.0,-1.8369701987210297e-16,12.92,77.54,49,7.063776317399563,1,2.0,1.6,0,6.259236808685034
4 Wheeler Theft,18/10/2019,0:00,12.926366,77.549813,2019-10-18 00:00:00,0,4,18,10,4,0,0,0,0,1,0.0,1.0,-0.433883739117558,-0.9009688679024191,-0.8660254037844386,0.5000000000000001,12.92,77.54,49,6.989614619226988,1,2.0,3.0,0,11.736069016284437
Ordinary Theft,1/1/2015,12:30,12.92256,77.58698,2015-01-01 12:30:00,12,3,1,1,1,0,0,1,0,0,1.2246467991473532e-16,-1.0,0.43388373911755823,-0.900968867902419,0.49999999999999994,0.8660254037844387,12.92,77.58,144,5.515168856773,7,2.0,2.0,0,9.953467484841148
Ordinary Theft,14/01/2015,22:40,12.918025,7758835.0,2015-01-14 22:40:00,22,2,14,1,1,0,0,0,0,1,-0.5000000000000004,0.8660254037844384,0.9749279121818236,-0.22252093395631434,0.49999999999999994,0.8660254037844387,12.91,7758834.99,1,4049.828202261286,7,2.0,3.0,0,2.0794415416798357
Ordinary Theft,29/01/2015,19:25,12.92746121,77.58628835,2015-01-29 19:25:00,19,3,29,1,1,0,0,0,1,0,-0.9659258262890684,0.2588190451025203,0.43388373911755823,-0.900968867902419,0.49999999999999994,0.8660254037844387,12.92,77.58,144,4.9899732754052515,7,2.0,2.4,0,11.944160981809377
Ordinary Theft,4/2/2015,20:00,12.93692755,77.57899468,2015-02-04 20:00:00,20,2,4,2,1,0,0,0,1,0,-0.8660254037844386,0.5000000000000001,0.9749279121818236,-0.22252093395631434,0.8660254037844386,0.5000000000000001,12.93,77.57000000000001,40,4.209967870087055,7,2.0,2.4,0,8.912572960090339
Ordinary Theft,9/2/2015,13:30,12.934423,77.592768,2015-02-09 13:30:00,13,0,9,2,1,0,0,1,0,0,-0.2588190451025208,-0.9659258262890683,0.0,1.0,0.8660254037844386,0.5000000000000001,12.93,77.59,58,4.1386580251493905,7,2.0,2.0,0,8.15507488781144
Ordinary Theft,3/3/2015,18:00,12.91856,77.58466,2015-03-03 18:00:00,18,1,3,3,1,0,0,0,1,0,-1.0,-1.8369701987210297e-16,0.7818314824680298,0.6234898018587336,1.0,6.123233995736766e-17,12.91,77.58,105,5.995342212540722,7,2.0,2.4,0,11.19225382586896
Ordinary Theft,9/3/2015,19:30,12.947111,77.594474,2015-03-09 19:30:00,19,0,9,3,1,0,0,0,1,0,-0.9659258262890684,0.2588190451025203,0.0,1.0,1.0,6.123233995736766e-17,12.94,77.59,130,2.723086789013803,7,2.0,2.4,0,11.700473575682762
Ordinary Theft,28/03/2015,19:30,12.929333,77.58168,2015-03-28 19:30:00,19,5,28,3,1,1,0,0,1,0,-0.9659258262890684,0.2588190451025203,-0.9749279121818236,-0.2225209339563146,1.0,6.123233995736766e-17,12.92,77.58,144,4.9039885625378385,7,2.0,2.4,0,11.944160981809377
Ordinary Theft,7/4/2015,20:00,12.952429,77.543605,2015-04-07 20:00:00,20,1,7,4,2,0,0,0,1,0,-0.8660254037844386,0.5000000000000001,0.7818314824680298,0.6234898018587336,0.8660254037844387,-0.49999999999999983,12.950000000000001,77.54,1,5.9228178259378055,7,2.0,2.4,0,1.6635532333438687
Ordinary Theft,7/4/2015,21:40,12.9388,77.859975,2015-04-07 21:40:00,21,1,7,4,2,0,0,0,1,0,-0.7071067811865477,0.7071067811865474,0.7818314824680298,0.6234898018587336,0.8660254037844387,-0.49999999999999983,12.93,77.85000000000001,1,28.987594826927022,7,2.0,2.4,0,1.6635532333438687
Ordinary Theft,29/04/2015,13:00,12.919098,77.589485,2015-04-29 13:00:00,13,2,29,4,2,0,0,1,0,0,-0.2588190451025208,-0.9659258262890683,0.9749279121818236,-0.22252093395631434,0.8660254037844387,-0.49999999999999983,12.91,77.58,105,5.8642123411199405,7,2.0,2.0,0,9.326878188224134
Ordinary Theft,1/5/2015,15:00,12.912976,77.573242,2015-05-01 15:00:00,15,4,1,5,2,0,0,1,0,0,-0.7071067811865471,-0.7071067811865479,-0.433883739117558,-0.9009688679024191,0.49999999999999994,-0.8660254037844387,12.91,77.57000000000001,82,6.917410591542915,7,2.0,2.0,0,8.837681215593197
Ordinary Theft,2/5/2015,0:20,12.552347,77.35059,2015-05-02 00:20:00,0,5,2,5,2,1,0,0,0,1,0.0,1.0,-0.9749279121818236,-0.2225209339563146,0.49999999999999994,-0.8660254037844387,12.55,77.35000000000001,10,53.605668822239124,7,2.0,3.0,0,7.193685818395112
Ordinary Theft,2/5/2015,11:40,12.946444,77.579988,2015-05-02 11:40:00,11,5,2,5,2,1,1,0,0,0,0.258819045102521,-0.9659258262890682,-0.9749279121818236,-0.2225209339563146,0.49999999999999994,-0.8660254037844387,12.94,77.57000000000001,55,3.2142786640609313,7,2.0,1.6,0,6.44056270517624
Ordinary Theft,6/5/2015,11:00,12.928613,77.585359,2015-05-06 11:00:00,11,2,6,5,2,0,1,0,0,0,0.258819045102521,-0.9659258262890682,0.9749279121818236,-0.22252093395631434,0.49999999999999994,-0.8660254037844387,12.92,77.58,144,4.88371040760437,7,2.0,1.6,0,7.962773987872919
Ordinary Theft,22/05/2015,17:30,12.918025,77.58835,2015-05-22 17:30:00,17,4,22,5,2,0,0,1,0,0,-0.9659258262890683,-0.25881904510252063,-0.433883739117558,-0.9009688679024191,0.49999999999999994,-0.8660254037844387,12.91,77.58,105,5.995647462378003,7,2.0,2.0,0,9.326878188224134
Ordinary Theft,26/05/2015,19:20,12.930433,77.549761,2015-05-26 19:20:00,19,1,26,5,2,0,0,0,1,0,-0.9659258262890684,0.2588190451025203,0.7818314824680298,0.6234898018587336,0.49999999999999994,-0.8660254037844387,12.93,77.54,28,6.675651836588757,7,2.0,2.4,0,8.081509991967538
Ordinary Theft,30/05/2015,13:30,12.924603,77.588906,2015-05-30 13:30:00,13,5,30,5,2,1,0,1,0,0,-0.2588190451025208,-0.9659258262890683,-0.9749279121818236,-0.2225209339563146,0.49999999999999994,-0.8660254037844387,12.92,77.58,144,5.262131007403736,7,2.0,2.0,0,9.953467484841148
Ordinary Theft,3/6/2015,13:30,12.93349,77.576628,2015-06-03 13:30:00,13,2,3,6,2,0,0,1,0,0,-0.2588190451025208,-0.9659258262890683,0.9749279121818236,-0.22252093395631434,1.2246467991473532e-16,-1.0,12.93,77.57000000000001,40,4.663745809567128,7,2.0,2.0,0,7.427144133408616
Ordinary Theft,18/06/2015,13:00,12.928613,77.585359,2015-06-18 13:00:00,13,3,18,6,2,0,0,1,0,0,-0.2588190451025208,-0.9659258262890683,0.43388373911755823,-0.900968867902419,1.2246467991473532e-16,-1.0,12.92,77.58,144,4.88371040760437,7,2.0,2.0,0,9.953467484841148
Ordinary Theft,7/7/2015,14:15,12.927136,77.5907,2015-07-07 14:15:00,14,1,7,7,3,0,0,1,0,0,-0.4999999999999998,-0.8660254037844388,0.7818314824680298,0.6234898018587336,-0.4999999999999998,-0.8660254037844388,12.92,77.59,10,4.962201776587088,7,2.0,2.0,0,4.795790545596741
Ordinary Theft,15/07/2015,19:00,12.926523,77.579647,2015-07-15 19:00:00,19,2,15,7,3,0,0,0,1,0,-0.9659258262890684,0.2588190451025203,0.9749279121818236,-0.22252093395631434,-0.4999999999999998,-0.8660254037844388,12.92,77.57000000000001,55,5.267754087959543,7,2.0,2.4,0,9.66084405776436
Ordinary Theft,5/9/2015,21:15,12.916757,77.593434,2015-09-05 21:15:00,21,5,5,9,3,1,0,0,1,0,-0.7071067811865477,0.7071067811865474,-0.9749279121818236,-0.2225209339563146,-1.0,-1.8369701987210297e-16,12.91,77.59,48,6.099572323941534,7,2.0,2.4,0,9.340368715465504
Ordinary Theft,7/9/2015,17:30,12.909694,77.634426,2015-09-07 17:30:00,17,0,7,9,3,0,0,1,0,0,-0.9659258262890683,-0.25881904510252063,0.0,1.0,-1.0,-1.8369701987210297e-16,12.9,77.63,2,8.12478112506441,7,2.0,2.0,0,2.1972245773362196
Ordinary Theft,15/09/2015,14:30,12.265842,77.248562,2015-09-15 14:30:00,14,1,15,9,3,0,0,1,0,0,-0.4999999999999998,-0.8660254037844388,0.7818314824680298,0.6234898018587336,-1.0,-1.8369701987210297e-16,12.26,77.24,1,86.99680954976706,7,2.0,2.0,0,1.3862943611198906
Ordinary Theft,23/09/2015,16:00,12.91756,77.58486,2015-09-23 16:00:00,16,2,23,9,3,0,0,1,0,0,-0.8660254037844384,-0.5000000000000004,0.9749279121818236,-0.22252093395631434,-1.0,-1.8369701987210297e-16,12.91,77.58,105,6.100973652992097,7,2.0,2.0,0,9.326878188224134
Ordinary Theft,12/10/2015,20:45,12.922536,77.587568,2015-10-12 20:45:00,20,0,12,10,4,0,0,0,1,0,-0.8660254037844386,0.5000000000000001,0.0,1.0,-0.8660254037844386,0.5000000000000001,12.92,77.58,144,5.508631722298713,7,2.0,2.4,0,11.944160981809377
Ordinary Theft,18/10/2015,12:15,12.92253,77.585898,2015-10-18 12:15:00,12,6,18,10,4,1,0,1,0,0,1.2246467991473532e-16,-1.0,-0.7818314824680299,0.6234898018587334,-0.8660254037844386,0.5000000000000001,12.92,77.58,144,5.5372264602064565,7,2.0,2.0,0,9.953467484841148
Ordinary Theft,25/10/2015,20:20,12.918028,77.58842,2015-10-25 20:20:00,20,6,25,10,4,1,0,0,1,0,-0.8660254037844386,0.5000000000000001,-0.7818314824680299,0.6234898018587334,-0.8660254037844386,0.5000000000000001,12.91,77.58,105,5.994463759753703,7,2.0,2.4,0,11.19225382586896
Ordinary Theft,14/11/2015,18:00,12.922535,77.58565,2015-11-14 18:00:00,18,5,14,11,4,1,0,0,1,0,-1.0,-1.8369701987210297e-16,-0.9749279121818236,-0.2225209339563146,-0.5000000000000004,0.8660254037844384,12.92,77.58,144,5.541319343926224,7,2.0,2.4,0,11.944160981809377
Ordinary Theft,29/12/2015,9:15,12.95645,77.786586,2015-12-29 09:15:00,9,1,29,12,4,0,1,0,0,0,0.7071067811865476,-0.7071067811865475,0.7818314824680298,0.6234898018587336,-2.4492935982947064e-16,1.0,12.950000000000001,77.78,1,20.871830016989065,7,2.0,1.6,0,1.1090354888959124
Ordinary Theft,7/2/2015,13:00,12.93443,77.592708,2015-02-07 13:00:00,13,5,7,2,1,1,0,1,0,0,-0.2588190451025208,-0.9659258262890683,-0.9749279121818236,-0.2225209339563146,0.8660254037844386,0.5000000000000001,12.93,77.59,58,4.138197599788165,7,2.0,2.0,0,8.15507488781144
Ordinary Theft,9/2/2015,13:10,12.9165885,77.589965,2015-02-09 13:10:00,13,0,9,2,1,0,0,1,0,0,-0.2588190451025208,-0.9659258262890683,0.0,1.0,0.8660254037844386,0.5000000000000001,12.91,77.58,105,6.137587689350263,7,2.0,2.0,0,9.326878188224134
Ordinary Theft,1/3/2015,13:30,12.931988,77.590196,2015-03-01 13:30:00,13,6,1,3,1,1,0,1,0,0,-0.2588190451025208,-0.9659258262890683,-0.7818314824680299,0.6234898018587334,1.0,6.123233995736766e-17,12.93,77.59,58,4.430432668780564,7,2.0,2.0,0,8.15507488781144
Ordinary Theft,21/05/2015,10:30,12.931921,77.58029,2015-05-21 10:30:00,10,3,21,5,2,0,1,0,0,0,0.49999999999999994,-0.8660254037844387,0.43388373911755823,-0.900968867902419,0.49999999999999994,-0.8660254037844387,12.93,77.58,74,4.676685051445098,7,2.0,1.6,0,6.907980981658096
Ordinary Theft,19/06/2015,13:00,12.88605,77.494843,2015-06-19 13:00:00,13,4,19,6,2,0,0,1,0,0,-0.2588190451025208,-0.9659258262890683,-0.433883739117558,-0.9009688679024191,1.2246467991473532e-16,-1.0,12.88,77.49,5,14.40053349976088,7,2.0,2.0,0,3.58351893845611
Ordinary Theft,4/8/2015,19:30,13.05669,77.6256687,2015-08-04 19:30:00,19,1,4,8,3,0,0,0,1,0,-0.9659258262890684,0.2588190451025203,0.7818314824680298,0.6234898018587336,-0.8660254037844384,-0.5000000000000004,13.05,77.62,1,10.042460865430465,7,2.0,2.4,0,1.6635532333438687
Ordinary Theft,12/8/2015,15:00,12.919774,77.577703,2015-08-12 15:00:00,15,2,12,8,3,0,0,1,0,0,-0.7071067811865471,-0.7071067811865479,0.9749279121818236,-0.22252093395631434,-0.8660254037844384,-0.5000000000000004,12.91,77.57000000000001,82,6.0467078177909706,7,2.0,2.0,0,8.837681215593197
Ordinary Theft,10/9/2015,14:30,12.928613,77.585359,2015-09-10 14:30:00,14,3,10,9,3,0,0,1,0,0,-0.4999999999999998,-0.8660254037844388,0.43388373911755823,-0.900968867902419,-1.0,-1.8369701987210297e-16,12.92,77.58,144,4.88371040760437,7,2.0,2.0,0,9.953467484841148
Ordinary Theft,14/11/2015,13:00,12.93192,77.58016,2015-11-14 13:00:00,13,5,14,11,4,1,0,1,0,0,-0.2588190451025208,-0.9659258262890683,-0.9749279121818236,-0.2225209339563146,-0.5000000000000004,0.8660254037844384,12.93,77.58,74,4.681479946953246,7,2.0,2.0,0,8.63497622707262
Ordinary Theft,9/12/2015,4:00,12.88605,77.494843,2015-12-09 04:00:00,4,2,9,12,4,0,0,0,0,1,0.8660254037844386,0.5000000000000001,0.9749279121818236,-0.22252093395631434,-2.4492935982947064e-16,1.0,12.88,77.49,5,14.40053349976088,7,2.0,3.0,0,5.375278407684165
Ordinary Theft,11/12/2015,19:35,12.93192,77.580106,2015-12-11 19:35:00,19,4,11,12,4,0,0,0,1,0,-0.9659258262890684,0.2588190451025203,-0.433883739117558,-0.9009688679024191,-2.4492935982947064e-16,1.0,12.93,77.58,74,4.683439172827651,7,2.0,2.4,0,10.361971472487143
Ordinary Theft,24/03/2015,11:00,12.924857,77.583759,2015-03-24 11:00:00,11,1,24,3,1,0,1,0,0,0,0.258819045102521,-0.9659258262890682,0.7818314824680298,0.6234898018587336,1.0,6.123233995736766e-17,12.92,77.58,144,5.328702388794866,7,2.0,1.6,0,7.962773987872919
Ordinary Theft,6/1/2015,15:00,12.92885,77.5785,2015-01-06 15:00:00,15,1,6,1,1,0,0,1,0,0,-0.7071067811865471,-0.7071067811865479,0.7818314824680298,0.6234898018587336,0.49999999999999994,0.8660254037844387,12.92,77.57000000000001,55,5.063649246142571,7,2.0,2.0,0,8.0507033814703
Ordinary Theft,18/01/2015,16:30,12.9273,77.57806,2015-01-18 16:30:00,16,6,18,1,1,1,0,1,0,0,-0.8660254037844384,-0.5000000000000004,-0.7818314824680299,0.6234898018587334,0.49999999999999994,0.8660254037844387,12.92,77.57000000000001,55,5.241898748155623,7,2.0,2.0,0,8.0507033814703
Ordinary Theft,23/03/2015,17:00,12.930535,77.586997,2015-03-23 17:00:00,17,0,23,3,1,0,0,1,0,0,-0.9659258262890683,-0.25881904510252063,0.0,1.0,1.0,6.123233995736766e-17,12.93,77.58,74,4.639955642403402,7,2.0,2.0,0,8.63497622707262
Ordinary Theft,15/04/2015,12:00,12.928613,77.585359,2015-04-15 12:00:00,12,2,15,4,2,0,0,1,0,0,1.2246467991473532e-16,-1.0,0.9749279121818236,-0.22252093395631434,0.8660254037844387,-0.49999999999999983,12.92,77.58,144,4.88371040760437,7,2.0,2.0,0,9.953467484841148
Ordinary Theft,2/5/2015,14:00,12.934891,77.581991,2015-05-02 14:00:00,14,5,2,5,2,1,0,1,0,0,-0.4999999999999998,-0.8660254037844388,-0.9749279121818236,-0.2225209339563146,0.49999999999999994,-0.8660254037844387,12.93,77.58,74,4.304477724998098,7,2.0,2.0,0,8.63497622707262
Ordinary Theft,22/07/2015,15:40,12.936652,77.576437,2015-07-22 15:40:00,15,2,22,7,3,0,0,1,0,0,-0.7071067811865471,-0.7071067811865479,0.9749279121818236,-0.22252093395631434,-0.4999999999999998,-0.8660254037844388,12.93,77.57000000000001,40,4.356059245388782,7,2.0,2.0,0,7.427144133408616
Ordinary Theft,15/01/2015,19:30,12.923852,77.576402,2015-01-15 19:30:00,19,3,15,1,1,0,0,0,1,0,-0.9659258262890684,0.2588190451025203,0.43388373911755823,-0.900968867902419,0.49999999999999994,0.8660254037844387,12.92,77.57000000000001,55,5.663755741166135,7,2.0,2.4,0,9.66084405776436
Ordinary Theft,16/01/2015,21:20,12.93067,77.581281,2015-01-16 21:20:00,21,4,16,1,1,0,0,0,1,0,-0.7071067811865477,0.7071067811865474,-0.433883739117558,-0.9009688679024191,0.49999999999999994,0.8660254037844387,12.93,77.58,74,4.77458909462877,7,2.0,2.4,0,10.361971472487143
Ordinary Theft,3/3/2015,12:30,12.923852,77.576402,2015-03-03 12:30:00,12,1,3,3,1,0,0,1,0,0,1.2246467991473532e-16,-1.0,0.7818314824680298,0.6234898018587336,1.0,6.123233995736766e-17,12.92,77.57000000000001,55,5.663755741166135,7,2.0,2.0,0,8.0507033814703
Ordinary Theft,9/3/2015,17:30,12.923852,77.576402,2015-03-09 17:30:00,17,0,9,3,1,0,0,1,0,0,-0.9659258262890683,-0.25881904510252063,0.0,1.0,1.0,6.123233995736766e-17,12.92,77.57000000000001,55,5.663755741166135,7,2.0,2.0,0,8.0507033814703
Ordinary Theft,8/4/2015,11:30,12.930397,77.585753,2015-04-08 11:30:00,11,2,8,4,2,0,1,0,0,0,0.258819045102521,-0.9659258262890682,0.9749279121818236,-0.22252093395631434,0.8660254037844387,-0.49999999999999983,12.93,77.58,74,4.680798270643747,7,2.0,1.6,0,6.907980981658096
Ordinary Theft,30/04/2015,19:40,12.919817,77.58481,2015-04-30 19:40:00,19,3,30,4,2,0,0,0,1,0,-0.9659258262890684,0.2588190451025203,0.43388373911755823,-0.900968867902419,0.8660254037844387,-0.49999999999999983,12.91,77.58,105,5.8549307396223105,7,2.0,2.4,0,11.19225382586896
Ordinary Theft,4/5/2015,14:45,12.927082,77.588137,2015-05-04 14:45:00,14,0,4,5,2,0,0,1,0,0,-0.4999999999999998,-0.8660254037844388,0.0,1.0,0.49999999999999994,-0.8660254037844387,12.92,77.58,144,4.9994766766554735,7,2.0,2.0,0,9.953467484841148
Ordinary Theft,25/06/2015,9:50,12.925458,77.584816,2015-06-25 09:50:00,9,3,25,6,2,0,1,0,0,0,0.7071067811865476,-0.7071067811865475,0.43388373911755823,-0.900968867902419,1.2246467991473532e-16,-1.0,12.92,77.58,144,5.239162744538784,7,2.0,1.6,0,7.962773987872919
Ordinary Theft,28/08/2015,19:10,12.932553,77.580342,2015-08-28 19:10:00,19,4,28,8,3,0,0,0,1,0,-0.9659258262890684,0.2588190451025203,-0.433883739117558,-0.9009688679024191,-0.8660254037844384,-0.5000000000000004,12.93,77.58,74,4.608551597382891,7,2.0,2.4,0,10.361971472487143
Ordinary Theft,26/11/2015,9:15,12.935566,77.589964,2015-11-26 09:15:00,9,3,26,11,4,0,1,0,0,0,0.7071067811865476,-0.7071067811865475,0.43388373911755823,-0.900968867902419,-0.5000000000000004,0.8660254037844384,12.93,77.58,74,4.038170006701614,7,2.0,1.6,0,6.907980981658096
Ordinary Theft,24/02/2016,19:00,12.545787,77.342621,2016-02-24 19:00:00,19,2,24,2,1,0,0,0,1,0,-0.9659258262890684,0.2588190451025203,0.9749279121818236,-0.22252093395631434,0.8660254037844386,0.5000000000000001,12.540000000000001,77.34,4,54.668231871619554,7,2.0,2.4,0,3.8626509898418404
Ordinary Theft,3/5/2016,10:30,23.823643,90.35341,2016-05-03 10:30:00,10,1,3,5,2,0,1,0,0,0,0.49999999999999994,-0.8660254037844387,0.7818314824680298,0.6234898018587336,0.49999999999999994,-0.8660254037844387,23.82,90.35000000000001,1,1805.6543015099248,7,2.0,1.6,0,1.1090354888959124
Ordinary Theft,12/5/2016,10:00,12.55018,77.380103,2016-05-12 10:00:00,10,3,12,5,2,0,1,0,0,0,0.49999999999999994,-0.8660254037844387,0.43388373911755823,-0.900968867902419,0.49999999999999994,-0.8660254037844387,12.55,77.38,1,52.31586090683792,7,2.0,1.6,0,1.1090354888959124
Ordinary Theft,8/11/2016,13:00,12.926858,77.583552,2016-11-08 13:00:00,13,1,8,11,4,0,0,1,0,0,-0.2588190451025208,-0.9659258262890683,0.7818314824680298,0.6234898018587336,-0.5000000000000004,0.8660254037844384,12.92,77.58,144,5.117112328323887,7,2.0,2.0,0,9.953467484841148
Ordinary Theft,20/04/2016,15:00,12.91945,77.58582,2016-04-20 15:00:00,15,2,20,4,2,0,0,1,0,0,-0.7071067811865471,-0.7071067811865479,0.9749279121818236,-0.22252093395631434,0.8660254037844387,-0.49999999999999983,12.91,77.58,105,5.876356845300211,7,2.0,2.0,0,9.326878188224134
Ordinary Theft,28/06/2016,12:30,12.923975,77.579868,2016-06-28 12:30:00,12,1,28,6,2,0,0,1,0,0,1.2246467991473532e-16,-1.0,0.7818314824680298,0.6234898018587336,1.2246467991473532e-16,-1.0,12.92,77.57000000000001,55,5.531069165125949,7,2.0,2.0,0,8.0507033814703
Ordinary Theft,5/7/2016,13:30,12.916869,77.589571,2016-07-05 13:30:00,13,1,5,7,3,0,0,1,0,0,-0.2588190451025208,-0.9659258262890683,0.7818314824680298,0.6234898018587336,-0.4999999999999998,-0.8660254037844388,12.91,77.58,105,6.110162916046314,7,2.0,2.0,0,9.326878188224134
Ordinary Theft,3/9/2016,14:00,12.91845,77.584881,2016-09-03 14:00:00,14,5,3,9,3,1,0,1,0,0,-0.4999999999999998,-0.8660254037844388,-0.9749279121818236,-0.2225209339563146,-1.0,-1.8369701987210297e-16,12.91,77.58,105,6.003126880500964,7,2.0,2.0,0,9.326878188224134
Ordinary Theft,21/09/2016,13:30,12.921458,77.58764,2016-09-21 13:30:00,13,2,21,9,3,0,0,1,0,0,-0.2588190451025208,-0.9659258262890683,0.9749279121818236,-0.22252093395631434,-1.0,-1.8369701987210297e-16,12.92,77.58,144,5.626320723229501,7,2.0,2.0,0,9.953467484841148
Ordinary Theft,28/09/2016,14:00,12.92556,77.59763,2016-09-28 14:00:00,14,2,28,9,3,0,0,1,0,0,-0.4999999999999998,-0.8660254037844388,0.9749279121818236,-0.22252093395631434,-1.0,-1.8369701987210297e-16,12.92,77.59,10,5.129933711856213,7,2.0,2.0,0,4.795790545596741
Ordinary Theft,22/11/2016,17:00,12.92556,77.59763,2016-11-22 17:00:00,17,1,22,11,4,0,0,1,0,0,-0.9659258262890683,-0.25881904510252063,0.7818314824680298,0.6234898018587336,-0.5000000000000004,0.8660254037844384,12.92,77.59,10,5.129933711856213,7,2.0,2.0,0,4.795790545596741
Ordinary Theft,16/01/2016,18:00,12.92074,77.59957,2016-01-16 18:00:00,18,5,16,1,1,1,0,0,1,0,-1.0,-1.8369701987210297e-16,-0.9749279121818236,-0.2225209339563146,0.49999999999999994,0.8660254037844387,12.92,77.59,10,5.680962527738169,7,2.0,2.4,0,5.754948654716089
Ordinary Theft,21/01/2016,13:30,12.92847,77.58374,2016-01-21 13:30:00,13,3,21,1,1,0,0,1,0,0,-0.2588190451025208,-0.9659258262890683,0.43388373911755823,-0.900968867902419,0.49999999999999994,0.8660254037844387,12.92,77.58,144,4.938123256589082,7,2.0,2.0,0,9.953467484841148
Ordinary Theft,9/4/2016,16:30,12.92825,77.57483,2016-04-09 16:30:00,16,5,9,4,2,1,0,1,0,0,-0.8660254037844384,-0.5000000000000004,-0.9749279121818236,-0.2225209339563146,0.8660254037844387,-0.49999999999999983,12.92,77.57000000000001,55,5.274961844621392,7,2.0,2.0,0,8.0507033814703
Ordinary Theft,22/04/2016,12:00,12.922084,77.589585,2016-04-22 12:00:00,12,4,22,4,2,0,0,1,0,0,1.2246467991473532e-16,-1.0,-0.433883739117558,-0.9009688679024191,0.8660254037844387,-0.49999999999999983,12.92,77.58,144,5.532684581042954,7,2.0,2.0,0,9.953467484841148
Ordinary Theft,20/10/2016,10:00,12.935688,77.586954,2016-10-20 10:00:00,10,3,20,10,4,0,1,0,0,0,0.49999999999999994,-0.8660254037844387,0.43388373911755823,-0.900968867902419,-0.8660254037844386,0.5000000000000001,12.93,77.58,74,4.078285883811127,7,2.0,1.6,0,6.907980981658096
Ordinary Theft,12/11/2016,8:30,12.92847,77.58374,2016-11-12 08:30:00,8,5,12,11,4,1,1,0,0,0,0.8660254037844387,-0.49999999999999983,-0.9749279121818236,-0.2225209339563146,-0.5000000000000004,0.8660254037844384,12.92,77.58,144,4.938123256589082,7,2.0,1.6,0,7.962773987872919
Ordinary Theft,3/1/2016,18:50,12.9167,77.59763,2016-01-03 18:50:00,18,6,3,1,1,1,0,0,1,0,-1.0,-1.8369701987210297e-16,-0.7818314824680299,0.6234898018587334,0.49999999999999994,0.8660254037844387,12.91,77.59,48,6.113426112088208,7,2.0,2.4,0,9.340368715465504
Ordinary Theft,22/01/2016,17:00,12.91945,77.58582,2016-01-22 17:00:00,17,4,22,1,1,0,0,1,0,0,-0.9659258262890683,-0.25881904510252063,-0.433883739117558,-0.9009688679024191,0.49999999999999994,0.8660254037844387,12.91,77.58,105,5.876356845300211,7,2.0,2.0,0,9.326878188224134
Ordinary Theft,19/02/2016,18:00,12.92556,77.57561,2016-02-19 18:00:00,18,4,19,2,1,0,0,0,1,0,-1.0,-1.8369701987210297e-16,-0.433883739117558,-0.9009688679024191,0.8660254037844386,0.5000000000000001,12.92,77.57000000000001,55,5.51754877639884,7,2.0,2.4,0,9.66084405776436
Ordinary Theft,27/02/2016,16:00,12.92367,77.58014,2016-02-27 16:00:00,16,5,27,2,1,1,0,1,0,0,-0.8660254037844384,-0.5000000000000004,-0.9749279121818236,-0.2225209339563146,0.8660254037844386,0.5000000000000001,12.92,77.58,144,5.555162593197845,7,2.0,2.0,0,9.953467484841148
Ordinary Theft,22/04/2016,12:00,12.92556,77.57591,2016-04-22 12:00:00,12,4,22,4,2,0,0,1,0,0,1.2246467991473532e-16,-1.0,-0.433883739117558,-0.9009688679024191,0.8660254037844387,-0.49999999999999983,12.92,77.57000000000001,55,5.505505973889866,7,2.0,2.0,0,8.0507033814703
Ordinary Theft,31/05/2016,9:00,12.915868,77.58954,2016-05-31 09:00:00,9,1,31,5,2,0,1,0,0,0,0.7071067811865476,-0.7071067811865475,0.7818314824680298,0.6234898018587336,0.49999999999999994,-0.8660254037844387,12.91,77.58,105,6.221328623569216,7,2.0,1.6,0,7.461502550579308
Ordinary Theft,22/07/2016,10:35,12.91699,77.58934,2016-07-22 10:35:00,10,4,22,7,3,0,1,0,0,0,0.49999999999999994,-0.8660254037844387,-0.433883739117558,-0.9009688679024191,-0.4999999999999998,-0.8660254037844388,12.91,77.58,105,6.099050750966423,7,2.0,1.6,0,7.461502550579308
Ordinary Theft,8/9/2016,22:15,12.92367,77.58014,2016-09-08 22:15:00,22,3,8,9,3,0,0,0,0,1,-0.5000000000000004,0.8660254037844384,0.43388373911755823,-0.900968867902419,-1.0,-1.8369701987210297e-16,12.92,77.58,144,5.555162593197845,7,2.0,3.0,0,14.930201227261723
Ordinary Theft,6/11/2016,15:35,12.92556,77.57561,2016-11-06 15:35:00,15,6,6,11,4,1,0,1,0,0,-0.7071067811865471,-0.7071067811865479,-0.7818314824680299,0.6234898018587334,-0.5000000000000004,0.8660254037844384,12.92,77.57000000000001,55,5.51754877639884,7,2.0,2.0,0,8.0507033814703
Ordinary Theft,29/11/2016,10:25,12.909645,77.632545,2016-11-29 10:25:00,10,1,29,11,4,0,1,0,0,0,0.49999999999999994,-0.8660254037844387,0.7818314824680298,0.6234898018587336,-0.5000000000000004,0.8660254037844384,12.9,77.63,2,8.023034344162614,7,2.0,1.6,0,1.7577796618689758
Ordinary Theft,24/01/2016,22:30,12.92556,77.57591,2016-01-24 22:30:00,22,6,24,1,1,1,0,0,0,1,-0.5000000000000004,0.8660254037844384,-0.7818314824680299,0.6234898018587334,0.49999999999999994,0.8660254037844387,12.92,77.57000000000001,55,5.505505973889866,7,2.0,3.0,0,12.076055072205449
Ordinary Theft,29/02/2016,18:30,12.915785,77.58695,2016-02-29 18:30:00,18,0,29,2,1,0,0,0,1,0,-1.0,-1.8369701987210297e-16,0.0,1.0,0.8660254037844386,0.5000000000000001,12.91,77.58,105,6.261469619658211,7,2.0,2.4,0,11.19225382586896
Ordinary Theft,1/3/2016,12:35,12.91945,77.58582,2016-03-01 12:35:00,12,1,1,3,1,0,0,1,0,0,1.2246467991473532e-16,-1.0,0.7818314824680298,0.6234898018587336,1.0,6.123233995736766e-17,12.91,77.58,105,5.876356845300211,7,2.0,2.0,0,9.326878188224134
Ordinary Theft,1/3/2016,13:30,12.91945,77.58582,2016-03-01 13:30:00,13,1,1,3,1,0,0,1,0,0,-0.2588190451025208,-0.9659258262890683,0.7818314824680298,0.6234898018587336,1.0,6.123233995736766e-17,12.91,77.58,105,5.876356845300211,7,2.0,2.0,0,9.326878188224134
Ordinary Theft,11/3/2016,18:40,12.92311,77.5807,2016-03-11 18:40:00,18,4,11,3,1,0,0,0,1,0,-1.0,-1.8369701987210297e-16,-0.433883739117558,-0.9009688679024191,1.0,6.123233995736766e-17,12.92,77.58,144,5.598298233050702,7,2.0,2.4,0,11.944160981809377
Ordinary Theft,13/04/2016,10:30,12.91945,77.58582,2016-04-13 10:30:00,10,2,13,4,2,0,1,0,0,0,0.49999999999999994,-0.8660254037844387,0.9749279121818236,-0.22252093395631434,0.8660254037844387,-0.49999999999999983,12.91,77.58,105,5.876356845300211,7,2.0,1.6,0,7.461502550579308
Ordinary Theft,28/04/2016,19:30,12.923675,77.580145,2016-04-28 19:30:00,19,3,28,4,2,0,0,0,1,0,-0.9659258262890684,0.2588190451025203,0.43388373911755823,-0.900968867902419,0.8660254037844387,-0.49999999999999983,12.92,77.58,144,5.554476361770403,7,2.0,2.4,0,11.944160981809377
Ordinary Theft,15/06/2016,16:45,12.9237885,77.589685,2016-06-15 16:45:00,16,2,15,6,2,0,0,1,0,0,-0.8660254037844384,-0.5000000000000004,0.9749279121818236,-0.22252093395631434,1.2246467991473532e-16,-1.0,12.92,77.58,144,5.343010500201739,7,2.0,2.0,0,9.953467484841148
Ordinary Theft,22/06/2016,10:00,12.92367,77.58014,2016-06-22 10:00:00,10,2,22,6,2,0,1,0,0,0,0.49999999999999994,-0.8660254037844387,0.9749279121818236,-0.22252093395631434,1.2246467991473532e-16,-1.0,12.92,77.58,144,5.555162593197845,7,2.0,1.6,0,7.962773987872919
Ordinary Theft,7/7/2016,23:10,12.92397,77.57968,2016-07-07 23:10:00,23,3,7,7,3,0,0,0,0,1,-0.25881904510252157,0.9659258262890681,0.43388373911755823,-0.900968867902419,-0.4999999999999998,-0.8660254037844388,12.92,77.57000000000001,55,5.537515724385281,7,2.0,3.0,0,12.076055072205449
Ordinary Theft,19/07/2016,2:45,12.93047,77.57957,2016-07-19 02:45:00,2,1,19,7,3,0,0,0,0,1,0.49999999999999994,0.8660254037844387,0.7818314824680298,0.6234898018587336,-0.4999999999999998,-0.8660254037844388,12.93,77.57000000000001,40,4.8548155922499445,7,2.0,3.0,0,11.140716200112923
Ordinary Theft,9/8/2016,17:00,12.93091,77.57812,2016-08-09 17:00:00,17,1,9,8,3,0,0,1,0,0,-0.9659258262890683,-0.25881904510252063,0.7818314824680298,0.6234898018587336,-0.8660254037844384,-0.5000000000000004,12.93,77.57000000000001,40,4.86422116655978,7,2.0,2.0,0,7.427144133408616
Ordinary Theft,15/08/2016,23:15,12.91945,77.585805,2016-08-15 23:15:00,23,0,15,8,3,0,0,0,0,1,-0.25881904510252157,0.9659258262890681,0.0,1.0,-0.8660254037844384,-0.5000000000000004,12.91,77.58,105,5.876620264073012,7,2.0,3.0,0,13.9903172823362
Ordinary Theft,6/10/2016,19:35,12.92164,77.59149,2016-10-06 19:35:00,19,3,6,10,4,0,0,0,1,0,-0.9659258262890684,0.2588190451025203,0.43388373911755823,-0.900968867902419,-0.8660254037844386,0.5000000000000001,12.92,77.59,10,5.565512362900379,7,2.0,2.4,0,5.754948654716089
Ordinary Theft,8/10/2016,21:30,12.92178,77.57923,2016-10-08 21:30:00,21,5,8,10,4,1,0,0,1,0,-0.7071067811865477,0.7071067811865474,-0.9749279121818236,-0.2225209339563146,-0.8660254037844386,0.5000000000000001,12.92,77.57000000000001,55,5.7847135848696905,7,2.0,2.4,0,9.66084405776436
Ordinary Theft,18/11/2016,13:15,12.92239,77.58076,2016-11-18 13:15:00,13,4,18,11,4,0,0,1,0,0,-0.2588190451025208,-0.9659258262890683,-0.433883739117558,-0.9009688679024191,-0.5000000000000004,0.8660254037844384,12.92,77.58,144,5.673725290974302,7,2.0,2.0,0,9.953467484841148
Ordinary Theft,19/01/2016,21:00,12.92266,77.5854,2016-01-19 21:00:00,21,1,19,1,1,0,0,0,1,0,-0.7071067811865477,0.7071067811865474,0.7818314824680298,0.6234898018587336,0.49999999999999994,0.8660254037844387,12.92,77.58,144,5.532452962616461,7,2.0,2.4,0,11.944160981809377
Ordinary Theft,21/01/2016,17:30,12.921455,77.587621,2016-01-21 17:30:00,17,3,21,1,1,0,0,1,0,0,-0.9659258262890683,-0.25881904510252063,0.43388373911755823,-0.900968867902419,0.49999999999999994,0.8660254037844387,12.92,77.58,144,5.626927672976991,7,2.0,2.0,0,9.953467484841148
Ordinary Theft,29/01/2016,12:30,12.92297,77.5807,2016-01-29 12:30:00,12,4,29,1,1,0,0,1,0,0,1.2246467991473532e-16,-1.0,-0.433883739117558,-0.9009688679024191,0.49999999999999994,0.8660254037844387,12.92,77.58,144,5.613293102391464,7,2.0,2.0,0,9.953467484841148
Ordinary Theft,9/2/2016,13:30,12.92234,77.58076,2016-02-09 13:30:00,13,1,9,2,1,0,0,1,0,0,-0.2588190451025208,-0.9659258262890683,0.7818314824680298,0.6234898018587336,0.8660254037844386,0.5000000000000001,12.92,77.58,144,5.679087498631246,7,2.0,2.0,0,9.953467484841148
Ordinary Theft,15/02/2016,10:30,12.914568,77.587485,2016-02-15 10:30:00,10,0,15,2,1,0,1,0,0,0,0.49999999999999994,-0.8660254037844387,0.0,1.0,0.8660254037844386,0.5000000000000001,12.91,77.58,105,6.388371171642752,7,2.0,1.6,0,7.461502550579308
Ordinary Theft,19/02/2016,12:30,12.91945,77.58582,2016-02-19 12:30:00,12,4,19,2,1,0,0,1,0,0,1.2246467991473532e-16,-1.0,-0.433883739117558,-0.9009688679024191,0.8660254037844386,0.5000000000000001,12.91,77.58,105,5.876356845300211,7,2.0,2.0,0,9.326878188224134
Ordinary Theft,26/02/2016,10:30,12.92458,77.584796,2016-02-26 10:30:00,10,4,26,2,1,0,1,0,0,0,0.49999999999999994,-0.8660254037844387,-0.433883739117558,-0.9009688679024191,0.8660254037844386,0.5000000000000001,12.92,77.58,144,5.335239922473118,7,2.0,1.6,0,7.962773987872919
Ordinary Theft,29/06/2016,17:15,12.919458,77.585795,2016-06-29 17:15:00,17,2,29,6,2,0,0,1,0,0,-0.9659258262890683,-0.25881904510252063,0.9749279121818236,-0.22252093395631434,1.2246467991473532e-16,-1.0,12.91,77.58,105,5.875918363486105,7,2.0,2.0,0,9.326878188224134
Ordinary Theft,1/7/2016,11:30,12.919458,77.585795,2016-07-01 11:30:00,11,4,1,7,3,0,1,0,0,0,0.258819045102521,-0.9659258262890682,-0.433883739117558,-0.9009688679024191,-0.4999999999999998,-0.8660254037844388,12.91,77.58,105,5.875918363486105,7,2.0,1.6,0,7.461502550579308
Ordinary Theft,20/07/2016,21:45,12.914758,77.587965,2016-07-20 21:45:00,21,2,20,7,3,0,0,0,1,0,-0.7071067811865477,0.7071067811865474,0.9749279121818236,-0.22252093395631434,-0.4999999999999998,-0.8660254037844388,12.91,77.58,105,6.361309641732462,7,2.0,2.4,0,11.19225382586896
Ordinary Theft,26/07/2016,14:45,12.93457,77.578685,2016-07-26 14:45:00,14,1,26,7,3,0,0,1,0,0,-0.4999999999999998,-0.8660254037844388,0.7818314824680298,0.6234898018587336,-0.4999999999999998,-0.8660254037844388,12.93,77.57000000000001,40,4.464142973152951,7,2.0,2.0,0,7.427144133408616
Ordinary Theft,3/10/2016,17:30,12.92266,77.585845,2016-10-03 17:30:00,17,0,3,10,4,0,0,1,0,0,-0.9659258262890683,-0.25881904510252063,0.0,1.0,-0.8660254037844386,0.5000000000000001,12.92,77.58,144,5.52396637011242,7,2.0,2.0,0,9.953467484841148
Ordinary Theft,5/10/2016,17:30,12.916576,77.586945,2016-10-05 17:30:00,17,2,5,10,4,0,0,1,0,0,-0.9659258262890683,-0.25881904510252063,0.9749279121818236,-0.22252093395631434,-0.8660254037844386,0.5000000000000001,12.91,77.58,105,6.174372356534414,7,2.0,2.0,0,9.326878188224134
Ordinary Theft,17/11/2016,17:45,12.86984,77.575962,2016-11-17 17:45:00,17,3,17,11,4,0,0,1,0,0,-0.9659258262890683,-0.25881904510252063,0.43388373911755823,-0.900968867902419,-0.5000000000000004,0.8660254037844384,12.86,77.57000000000001,10,11.49408378230892,7,2.0,2.0,0,4.795790545596741
Ordinary Theft,10/9/2016,13:00,12.92234,77.582254,2016-09-10 13:00:00,13,5,10,9,3,1,0,1,0,0,-0.2588190451025208,-0.9659258262890683,-0.9749279121818236,-0.2225209339563146,-1.0,-1.8369701987210297e-16,12.92,77.58,144,5.638492814760947,7,2.0,2.0,0,9.953467484841148
Ordinary Theft,21/12/2017,16:40,12.9167,77.59763,2017-12-21 16:40:00,16,3,21,12,4,0,0,1,0,0,-0.8660254037844384,-0.5000000000000004,0.43388373911755823,-0.900968867902419,-2.4492935982947064e-16,1.0,12.91,77.59,48,6.113426112088208,7,2.0,2.0,0,7.783640596221253
Ordinary Theft,10/1/2017,18:15,12.91992,77.59044,2017-01-10 18:15:00,18,1,10,1,1,0,0,0,1,0,-1.0,-1.8369701987210297e-16,0.7818314824680298,0.6234898018587336,0.49999999999999994,0.8660254037844387,12.91,77.59,48,5.764209703746552,7,2.0,2.4,0,9.340368715465504
Ordinary Theft,30/01/2017,16:00,12.92556,77.57561,2017-01-30 16:00:00,16,0,30,1,1,0,0,1,0,0,-0.8660254037844384,-0.5000000000000004,0.0,1.0,0.49999999999999994,0.8660254037844387,12.92,77.57000000000001,55,5.51754877639884,7,2.0,2.0,0,8.0507033814703
Ordinary Theft,30/01/2017,20:15,12.92865,77.58178,2017-01-30 20:15:00,20,0,30,1,1,0,0,0,1,0,-0.8660254037844386,0.5000000000000001,0.0,1.0,0.49999999999999994,0.8660254037844387,12.92,77.58,144,4.973783715906442,7,2.0,2.4,0,11.944160981809377
Ordinary Theft,21/04/2017,18:00,12.93183,77.58355,2017-04-21 18:00:00,18,4,21,4,2,0,0,0,1,0,-1.0,-1.8369701987210297e-16,-0.433883739117558,-0.9009688679024191,0.8660254037844387,-0.49999999999999983,12.93,77.58,74,4.581476132946167,7,2.0,2.4,0,10.361971472487143
Ordinary Theft,23/04/2017,9:45,12.94158,77.58758,2017-04-23 09:45:00,9,6,23,4,2,1,1,0,0,0,0.7071067811865476,-0.7071067811865475,-0.7818314824680299,0.6234898018587334,0.8660254037844387,-0.49999999999999983,12.94,77.58,80,3.423654423911253,7,2.0,1.6,0,7.031118647475903
Ordinary Theft,14/06/2017,20:30,12.9179,77.58718,2017-06-14 20:30:00,20,2,14,6,2,0,0,0,1,0,-0.8660254037844386,0.5000000000000001,0.9749279121818236,-0.22252093395631434,1.2246467991473532e-16,-1.0,12.91,77.58,105,6.025065682150489,7,2.0,2.4,0,11.19225382586896
Ordinary Theft,5/7/2017,20:40,12.92316,77.59376,2017-07-05 20:40:00,20,2,5,7,3,0,0,0,1,0,-0.8660254037844386,0.5000000000000001,0.9749279121818236,-0.22252093395631434,-0.4999999999999998,-0.8660254037844388,12.92,77.59,10,5.38705139485264,7,2.0,2.4,0,5.754948654716089
Ordinary Theft,16/09/2017,11:00,12.92367,77.58014,2017-09-16 11:00:00,11,5,16,9,3,1,1,0,0,0,0.258819045102521,-0.9659258262890682,-0.9749279121818236,-0.2225209339563146,-1.0,-1.8369701987210297e-16,12.92,77.58,144,5.555162593197845,7,2.0,1.6,0,7.962773987872919
Ordinary Theft,17/01/2017,11:30,12.92367,77.58014,2017-01-17 11:30:00,11,1,17,1,1,0,1,0,0,0,0.258819045102521,-0.9659258262890682,0.7818314824680298,0.6234898018587336,0.49999999999999994,0.8660254037844387,12.92,77.58,144,5.555162593197845,7,2.0,1.6,0,7.962773987872919
Ordinary Theft,18/07/2017,13:25,12.92023,77.5819,2017-07-18 13:25:00,13,1,18,7,3,0,0,1,0,0,-0.2588190451025208,-0.9659258262890683,0.7818314824680298,0.6234898018587336,-0.4999999999999998,-0.8660254037844388,12.92,77.58,144,5.875546392102128,7,2.0,2.0,0,9.953467484841148
Ordinary Theft,17/09/2017,8:45,12.92458,77.5846852,2017-09-17 08:45:00,8,6,17,9,3,1,1,0,0,0,0.8660254037844387,-0.49999999999999983,-0.7818314824680299,0.6234898018587334,-1.0,-1.8369701987210297e-16,12.92,77.58,144,5.33764393953716,7,2.0,1.6,0,7.962773987872919
Ordinary Theft,17/09/2017,12:30,12.914686,77.5776952,2017-09-17 12:30:00,12,6,17,9,3,1,0,1,0,0,1.2246467991473532e-16,-1.0,-0.7818314824680299,0.6234898018587334,-1.0,-1.8369701987210297e-16,12.91,77.57000000000001,82,6.588370969488901,7,2.0,2.0,0,8.837681215593197
Ordinary Theft,17/09/2017,14:30,12.945852,77.576951,2017-09-17 14:30:00,14,6,17,9,3,1,0,1,0,0,-0.4999999999999998,-0.8660254037844388,-0.7818314824680299,0.6234898018587334,-1.0,-1.8369701987210297e-16,12.94,77.57000000000001,55,3.443063844626628,7,2.0,2.0,0,8.0507033814703
Ordinary Theft,8/12/2017,18:00,12.92952,77.57891,2017-12-08 18:00:00,18,4,8,12,4,0,0,0,1,0,-1.0,-1.8369701987210297e-16,-0.433883739117558,-0.9009688679024191,-2.4492935982947064e-16,1.0,12.92,77.57000000000001,55,4.978426974224268,7,2.0,2.4,0,9.66084405776436
Ordinary Theft,15/12/2017,11:00,12.92963,77.57702,2017-12-15 11:00:00,11,4,15,12,4,0,1,0,0,0,0.258819045102521,-0.9659258262890682,-0.433883739117558,-0.9009688679024191,-2.4492935982947064e-16,1.0,12.92,77.57000000000001,55,5.040718408642533,7,2.0,1.6,0,6.44056270517624
Ordinary Theft,16/12/2017,11:30,12.92085,77.58139,2017-12-16 11:30:00,11,5,16,12,4,1,1,0,0,0,0.258819045102521,-0.9659258262890682,-0.9749279121818236,-0.2225209339563146,-2.4492935982947064e-16,1.0,12.92,77.58,144,5.821888385462588,7,2.0,1.6,0,7.962773987872919
Ordinary Theft,23/07/2017,11:45,12.92596,77.55321,2017-07-23 11:45:00,11,6,23,7,3,1,1,0,0,0,0.258819045102521,-0.9659258262890682,-0.7818314824680299,0.6234898018587334,-0.4999999999999998,-0.8660254037844388,12.92,77.55,55,6.77296881294243,7,2.0,1.6,0,6.44056270517624
Ordinary Theft,26/07/2017,15:00,12.93006,77.57958,2017-07-26 15:00:00,15,2,26,7,3,0,0,1,0,0,-0.7071067811865471,-0.7071067811865479,0.9749279121818236,-0.22252093395631434,-0.4999999999999998,-0.8660254037844388,12.93,77.57000000000001,40,4.897427342707132,7,2.0,2.0,0,7.427144133408616
Ordinary Theft,27/07/2017,10:50,12.92367,77.58014,2017-07-27 10:50:00,10,3,27,7,3,0,1,0,0,0,0.49999999999999994,-0.8660254037844387,0.43388373911755823,-0.900968867902419,-0.4999999999999998,-0.8660254037844388,12.92,77.58,144,5.555162593197845,7,2.0,1.6,0,7.962773987872919
Ordinary Theft,11/9/2017,22:00,12.92603,77.57362,2017-09-11 22:00:00,22,0,11,9,3,0,0,0,0,1,-0.5000000000000004,0.8660254037844384,0.0,1.0,-1.0,-1.8369701987210297e-16,12.92,77.57000000000001,55,5.5538319600138,7,2.0,3.0,0,12.076055072205449
Ordinary Theft,15/12/2017,12:30,12.92115,77.58075,2017-12-15 12:30:00,12,4,15,12,4,0,0,1,0,0,1.2246467991473532e-16,-1.0,-0.433883739117558,-0.9009688679024191,-2.4492935982947064e-16,1.0,12.92,77.58,144,5.807097687368021,7,2.0,2.0,0,9.953467484841148
Ordinary Theft,4/7/2017,13:00,12.92847,77.58374,2017-07-04 13:00:00,13,1,4,7,3,0,0,1,0,0,-0.2588190451025208,-0.9659258262890683,0.7818314824680298,0.6234898018587336,-0.4999999999999998,-0.8660254037844388,12.92,77.58,144,4.938123256589082,7,2.0,2.0,0,9.953467484841148
Ordinary Theft,3/8/2017,14:00,12.929578,77.585484,2017-08-03 14:00:00,14,3,3,8,3,0,0,1,0,0,-0.4999999999999998,-0.8660254037844388,0.43388373911755823,-0.900968867902419,-0.8660254037844384,-0.5000000000000004,12.92,77.58,144,4.7759173912248825,7,2.0,2.0,0,9.953467484841148
Ordinary Theft,5/8/2017,13:00,12.92234,77.58076,2017-08-05 13:00:00,13,5,5,8,3,1,0,1,0,0,-0.2588190451025208,-0.9659258262890683,-0.9749279121818236,-0.2225209339563146,-0.8660254037844384,-0.5000000000000004,12.92,77.58,144,5.679087498631246,7,2.0,2.0,0,9.953467484841148
Ordinary Theft,19/10/2017,14:15,12.92028,77.58801,2017-10-19 14:15:00,14,3,19,10,4,0,0,1,0,0,-0.4999999999999998,-0.8660254037844388,0.43388373911755823,-0.900968867902419,-0.8660254037844386,0.5000000000000001,12.92,77.58,144,5.75103647087149,7,2.0,2.0,0,9.953467484841148
Ordinary Theft,11/8/2017,19:00,12.91945,77.58582,2017-08-11 19:00:00,19,4,11,8,3,0,0,0,1,0,-0.9659258262890684,0.2588190451025203,-0.433883739117558,-0.9009688679024191,-0.8660254037844384,-0.5000000000000004,12.91,77.58,105,5.876356845300211,7,2.0,2.4,0,11.19225382586896
Ordinary Theft,2/12/2017,10:00,12.923852,77.576401,2017-12-02 10:00:00,10,5,2,12,4,1,1,0,0,0,0.49999999999999994,-0.8660254037844387,-0.9749279121818236,-0.2225209339563146,-2.4492935982947064e-16,1.0,12.92,77.57000000000001,55,5.663793474917825,7,2.0,1.6,0,6.44056270517624
Ordinary Theft,8/1/2017,14:15,12.9248555,77.58965,2017-01-08 14:15:00,14,6,8,1,1,1,0,1,0,0,-0.4999999999999998,-0.8660254037844388,-0.7818314824680299,0.6234898018587334,0.49999999999999994,0.8660254037844387,12.92,77.58,144,5.225357772400514,7,2.0,2.0,0,9.953467484841148
Ordinary Theft,5/3/2017,18:00,12.92367,77.58014,2017-03-05 18:00:00,18,6,5,3,1,1,0,0,1,0,-1.0,-1.8369701987210297e-16,-0.7818314824680299,0.6234898018587334,1.0,6.123233995736766e-17,12.92,77.58,144,5.555162593197845,7,2.0,2.4,0,11.944160981809377
Ordinary Theft,9/3/2017,20:00,12.9218,77.58027,2017-03-09 20:00:00,20,3,9,3,1,0,0,0,1,0,-0.8660254037844386,0.5000000000000001,0.43388373911755823,-0.900968867902419,1.0,6.123233995736766e-17,12.92,77.58,144,5.751133612474528,7,2.0,2.4,0,11.944160981809377
Ordinary Theft,25/04/2017,12:20,12.92338,77.58074,2017-04-25 12:20:00,12,1,25,4,2,0,0,1,0,0,1.2246467991473532e-16,-1.0,0.7818314824680298,0.6234898018587336,0.8660254037844387,-0.49999999999999983,12.92,77.58,144,5.568217610724313,7,2.0,2.0,0,9.953467484841148
Ordinary Theft,31/05/2017,13:00,12.9218,77.58027,2017-05-31 13:00:00,13,2,31,5,2,0,0,1,0,0,-0.2588190451025208,-0.9659258262890683,0.9749279121818236,-0.22252093395631434,0.49999999999999994,-0.8660254037844387,12.92,77.58,144,5.751133612474528,7,2.0,2.0,0,9.953467484841148
Ordinary Theft,1/6/2017,14:30,12.9184,77.58268,2017-06-01 14:30:00,14,3,1,6,2,0,0,1,0,0,-0.4999999999999998,-0.8660254037844388,0.43388373911755823,-0.900968867902419,1.2246467991473532e-16,-1.0,12.91,77.58,105,6.054965603418878,7,2.0,2.0,0,9.326878188224134
Ordinary Theft,4/8/2017,16:30,12.92367,77.58014,2017-08-04 16:30:00,16,4,4,8,3,0,0,1,0,0,-0.8660254037844384,-0.5000000000000004,-0.433883739117558,-0.9009688679024191,-0.8660254037844384,-0.5000000000000004,12.92,77.58,144,5.555162593197845,7,2.0,2.0,0,9.953467484841148
Ordinary Theft,9/10/2017,19:00,12.91945,77.58582,2017-10-09 19:00:00,19,0,9,10,4,0,0,0,1,0,-0.9659258262890684,0.2588190451025203,0.0,1.0,-0.8660254037844386,0.5000000000000001,12.91,77.58,105,5.876356845300211,7,2.0,2.4,0,11.19225382586896
Ordinary Theft,5/12/2017,11:50,12.92239,77.580757,2017-12-05 11:50:00,11,1,5,12,4,0,1,0,0,0,0.258819045102521,-0.9659258262890682,0.7818314824680298,0.6234898018587336,-2.4492935982947064e-16,1.0,12.92,77.58,144,5.673811238962722,7,2.0,1.6,0,7.962773987872919
Ordinary Theft,15/12/2017,23:50,12.9167,77.59763,2017-12-15 23:50:00,23,4,15,12,4,0,0,0,0,1,-0.25881904510252157,0.9659258262890681,-0.433883739117558,-0.9009688679024191,-2.4492935982947064e-16,1.0,12.91,77.59,48,6.113426112088208,7,2.0,3.0,0,11.675460894331879
Ordinary Theft,22/03/2017,0:45,12.92053,77.58274,2017-03-22 00:45:00,0,2,22,3,1,0,0,0,0,1,0.0,1.0,0.9749279121818236,-0.22252093395631434,1.0,6.123233995736766e-17,12.92,77.58,144,5.822352205698642,7,2.0,3.0,0,14.930201227261723
Ordinary Theft,29/08/2017,16:00,12.924885,77.586855,2017-08-29 16:00:00,16,1,29,8,3,0,0,1,0,0,-0.8660254037844384,-0.5000000000000004,0.7818314824680298,0.6234898018587336,-0.8660254037844384,-0.5000000000000004,12.92,77.58,144,5.26184043092622,7,2.0,2.0,0,9.953467484841148
Ordinary Theft,7/10/2017,17:00,12.92367,77.58014,2017-10-07 17:00:00,17,5,7,10,4,1,0,1,0,0,-0.9659258262890683,-0.25881904510252063,-0.9749279121818236,-0.2225209339563146,-0.8660254037844386,0.5000000000000001,12.92,77.58,144,5.555162593197845,7,2.0,2.0,0,9.953467484841148
Ordinary Theft,13/01/2018,15:10,12.9218,77.58027,2018-01-13 15:10:00,15,5,13,1,1,1,0,1,0,0,-0.7071067811865471,-0.7071067811865479,-0.9749279121818236,-0.2225209339563146,0.49999999999999994,0.8660254037844387,12.92,77.58,144,5.751133612474528,7,2.0,2.0,0,9.953467484841148
Ordinary Theft,3/2/2018,14:00,12.91457,77.586042,2018-02-03 14:00:00,14,5,3,2,1,1,0,1,0,0,-0.4999999999999998,-0.8660254037844388,-0.9749279121818236,-0.2225209339563146,0.8660254037844386,0.5000000000000001,12.91,77.58,105,6.408905511159664,7,2.0,2.0,0,9.326878188224134
Ordinary Theft,17/04/2018,8:45,12.9184578,77.58458,2018-04-17 08:45:00,8,1,17,4,2,0,1,0,0,0,0.8660254037844387,-0.49999999999999983,0.7818314824680298,0.6234898018587336,0.8660254037844387,-0.49999999999999983,12.91,77.58,105,6.008082602936883,7,2.0,1.6,0,7.461502550579308
Ordinary Theft,21/04/2018,19:30,12.91945,77.58582,2018-04-21 19:30:00,19,5,21,4,2,1,0,0,1,0,-0.9659258262890684,0.2588190451025203,-0.9749279121818236,-0.2225209339563146,0.8660254037844387,-0.49999999999999983,12.91,77.58,105,5.876356845300211,7,2.0,2.4,0,11.19225382586896
Ordinary Theft,5/5/2018,14:30,12.92367,77.58014,2018-05-05 14:30:00,14,5,5,5,2,1,0,1,0,0,-0.4999999999999998,-0.8660254037844388,-0.9749279121818236,-0.2225209339563146,0.49999999999999994,-0.8660254037844387,12.92,77.58,144,5.555162593197845,7,2.0,2.0,0,9.953467484841148
Ordinary Theft,16/05/2018,10:45,12.925458,77.57486,2018-05-16 10:45:00,10,2,16,5,2,0,1,0,0,0,0.49999999999999994,-0.8660254037844387,0.9749279121818236,-0.22252093395631434,0.49999999999999994,-0.8660254037844387,12.92,77.57000000000001,55,5.558841766501799,7,2.0,1.6,0,6.44056270517624
Ordinary Theft,12/6/2018,19:30,12.92397,77.579678,2018-06-12 19:30:00,19,1,12,6,2,0,0,0,1,0,-0.9659258262890684,0.2588190451025203,0.7818314824680298,0.6234898018587336,1.2246467991473532e-16,-1.0,12.92,77.57000000000001,55,5.537579010818537,7,2.0,2.4,0,9.66084405776436
Ordinary Theft,23/06/2018,13:30,12.9309485,77.57875,2018-06-23 13:30:00,13,5,23,6,2,1,0,1,0,0,-0.2588190451025208,-0.9659258262890683,-0.9749279121818236,-0.2225209339563146,1.2246467991473532e-16,-1.0,12.93,77.57000000000001,40,4.835570413728597,7,2.0,2.0,0,7.427144133408616
Ordinary Theft,25/06/2018,18:00,12.92847,77.585475,2018-06-25 18:00:00,18,0,25,6,2,0,0,0,1,0,-1.0,-1.8369701987210297e-16,0.0,1.0,1.2246467991473532e-16,-1.0,12.92,77.58,144,4.896720574537015,7,2.0,2.4,0,11.944160981809377
Ordinary Theft,24/08/2018,15:30,12.93443,77.5927,2018-08-24 15:30:00,15,4,24,8,3,0,0,1,0,0,-0.7071067811865471,-0.7071067811865479,-0.433883739117558,-0.9009688679024191,-0.8660254037844384,-0.5000000000000004,12.93,77.59,58,4.138240642216582,7,2.0,2.0,0,8.15507488781144
Ordinary Theft,15/10/2018,11:00,12.928748,777.583475,2018-10-15 11:00:00,11,0,15,10,4,0,1,0,0,0,0.258819045102521,-0.9659258262890682,0.0,1.0,-0.8660254037844386,0.5000000000000001,12.92,777.58,1,2167.98515507764,7,2.0,1.6,0,1.1090354888959124
Ordinary Theft,23/01/2018,12:05,12.925648,77.575869,2018-01-23 12:05:00,12,1,23,1,1,0,0,1,0,0,1.2246467991473532e-16,-1.0,0.7818314824680298,0.6234898018587336,0.49999999999999994,0.8660254037844387,12.92,77.57000000000001,55,5.498046871234596,7,2.0,2.0,0,8.0507033814703
Ordinary Theft,10/9/2018,17:15,12.930911,77.578156,2018-09-10 17:15:00,17,0,10,9,3,0,0,1,0,0,-0.9659258262890683,-0.25881904510252063,0.0,1.0,-1.0,-1.8369701987210297e-16,12.93,77.57000000000001,40,4.86268675790917,7,2.0,2.0,0,7.427144133408616
Ordinary Theft,13/10/2018,17:30,12.925684,77.575458,2018-10-13 17:30:00,17,5,13,10,4,1,0,1,0,0,-0.9659258262890683,-0.25881904510252063,-0.9749279121818236,-0.2225209339563146,-0.8660254037844386,0.5000000000000001,12.92,77.57000000000001,55,5.510936744555729,7,2.0,2.0,0,8.0507033814703
Ordinary Theft,9/2/2018,17:35,12.9235485,77.58948,2018-02-09 17:35:00,17,4,9,2,1,0,0,1,0,0,-0.9659258262890683,-0.25881904510252063,-0.433883739117558,-0.9009688679024191,0.8660254037844386,0.5000000000000001,12.92,77.58,144,5.371814153660589,7,2.0,2.0,0,9.953467484841148
Ordinary Theft,27/02/2018,10:40,12.921645,77.580286,2018-02-27 10:40:00,10,1,27,2,1,0,1,0,0,0,0.49999999999999994,-0.8660254037844387,0.7818314824680298,0.6234898018587336,0.8660254037844386,0.5000000000000001,12.92,77.58,144,5.767264034930304,7,2.0,1.6,0,7.962773987872919
Ordinary Theft,27/02/2018,11:00,12.921645,77.580286,2018-02-27 11:00:00,11,1,27,2,1,0,1,0,0,0,0.258819045102521,-0.9659258262890682,0.7818314824680298,0.6234898018587336,0.8660254037844386,0.5000000000000001,12.92,77.58,144,5.767264034930304,7,2.0,1.6,0,7.962773987872919
Ordinary Theft,27/02/2018,11:30,12.9145885,77.58514,2018-02-27 11:30:00,11,1,27,2,1,0,1,0,0,0,0.258819045102521,-0.9659258262890682,0.7818314824680298,0.6234898018587336,0.8660254037844386,0.5000000000000001,12.91,77.58,105,6.421748236588103,7,2.0,1.6,0,7.461502550579308
Ordinary Theft,27/02/2018,13:00,12.9145885,77.58514,2018-02-27 13:00:00,13,1,27,2,1,0,0,1,0,0,-0.2588190451025208,-0.9659258262890683,0.7818314824680298,0.6234898018587336,0.8660254037844386,0.5000000000000001,12.91,77.58,105,6.421748236588103,7,2.0,2.0,0,9.326878188224134
Ordinary Theft,11/11/2018,17:00,12.917775,77.5854769,2018-11-11 17:00:00,17,6,11,11,4,1,0,1,0,0,-0.9659258262890683,-0.25881904510252063,-0.7818314824680299,0.6234898018587334,-0.5000000000000004,0.8660254037844384,12.91,77.58,105,6.066174984473802,7,2.0,2.0,0,9.326878188224134
Ordinary Theft,8/1/2019,11:00,12.92861,77.58447,2019-01-08 11:00:00,11,1,8,1,1,0,1,0,0,0,0.258819045102521,-0.9659258262890682,0.7818314824680298,0.6234898018587336,0.49999999999999994,0.8660254037844387,12.92,77.58,144,4.904696385191546,7,2.0,1.6,0,7.962773987872919
Ordinary Theft,21/01/2019,14:00,12.91965,77.5924,2019-01-21 14:00:00,14,0,21,1,1,0,0,1,0,0,-0.4999999999999998,-0.8660254037844388,0.0,1.0,0.49999999999999994,0.8660254037844387,12.91,77.59,48,5.7814942032461945,7,2.0,2.0,0,7.783640596221253
Ordinary Theft,26/01/2019,14:00,12.92385,77.576402,2019-01-26 14:00:00,14,5,26,1,1,1,0,1,0,0,-0.4999999999999998,-0.8660254037844388,-0.9749279121818236,-0.2225209339563146,0.49999999999999994,0.8660254037844387,12.92,77.57000000000001,55,5.663964217830223,7,2.0,2.0,0,8.0507033814703
Ordinary Theft,31/01/2019,10:00,12.92367,77.58014,2019-01-31 10:00:00,10,3,31,1,1,0,1,0,0,0,0.49999999999999994,-0.8660254037844387,0.43388373911755823,-0.900968867902419,0.49999999999999994,0.8660254037844387,12.92,77.58,144,5.555162593197845,7,2.0,1.6,0,7.962773987872919
Ordinary Theft,14/02/2019,14:30,12.92367,77.58374,2019-02-14 14:30:00,14,3,14,2,1,0,0,1,0,0,-0.4999999999999998,-0.8660254037844388,0.43388373911755823,-0.900968867902419,0.8660254037844386,0.5000000000000001,12.92,77.58,144,5.45796484375038,7,2.0,2.0,0,9.953467484841148
Ordinary Theft,17/02/2019,11:00,12.914588,77.587654,2019-02-17 11:00:00,11,6,17,2,1,1,1,0,0,0,0.258819045102521,-0.9659258262890682,-0.7818314824680299,0.6234898018587334,0.8660254037844386,0.5000000000000001,12.91,77.58,105,6.383978169330209,7,2.0,1.6,0,7.461502550579308
Ordinary Theft,24/02/2019,11:30,12.94247,77.55049,2019-02-24 11:30:00,11,6,24,2,1,1,1,0,0,0,0.258819045102521,-0.9659258262890682,-0.7818314824680299,0.6234898018587334,0.8660254037844386,0.5000000000000001,12.94,77.55,85,5.774036540875916,7,2.0,1.6,0,7.126955674005612
Ordinary Theft,26/02/2019,10:00,12.92253,77.58589,2019-02-26 10:00:00,10,1,26,2,1,0,1,0,0,0,0.49999999999999994,-0.8660254037844387,0.7818314824680298,0.6234898018587336,0.8660254037844386,0.5000000000000001,12.92,77.58,144,5.537374171339112,7,2.0,1.6,0,7.962773987872919
Ordinary Theft,02/03/2019,21:00,12.92847,77.58347,2019-03-02 21:00:00,21,5,2,3,1,1,0,0,1,0,-0.7071067811865477,0.7071067811865474,-0.9749279121818236,-0.2225209339563146,1.0,6.123233995736766e-17,12.92,77.58,144,4.945177968335507,7,2.0,2.4,0,11.944160981809377
Ordinary Theft,04/03/2019,22:00,12.92009,77.58204,2019-03-04 22:00:00,22,0,4,3,1,0,0,0,0,1,-0.5000000000000004,0.8660254037844384,0.0,1.0,1.0,6.123233995736766e-17,12.92,77.58,144,5.887155638801508,7,2.0,3.0,0,14.930201227261723
Ordinary Theft,15/03/2019,11:30,12.92861,77.58447,2019-03-15 11:30:00,11,4,15,3,1,0,1,0,0,0,0.258819045102521,-0.9659258262890682,-0.433883739117558,-0.9009688679024191,1.0,6.123233995736766e-17,12.92,77.58,144,4.904696385191546,7,2.0,1.6,0,7.962773987872919
Ordinary Theft,17/03/2019,12:00,12.93486,77.58008,2019-03-17 12:00:00,12,6,17,3,1,1,0,1,0,0,1.2246467991473532e-16,-1.0,-0.7818314824680299,0.6234898018587334,1.0,6.123233995736766e-17,12.93,77.58,74,4.3778399544202395,7,2.0,2.0,0,8.63497622707262
Ordinary Theft,04/04/2019,23:15,12.91921,77.57745,2019-04-04 23:15:00,23,3,4,4,2,0,0,0,0,1,-0.25881904510252157,0.9659258262890681,0.43388373911755823,-0.900968867902419,0.8660254037844387,-0.49999999999999983,12.91,77.57000000000001,82,6.114784551958826,7,2.0,3.0,0,13.256521823389795
Ordinary Theft,16/04/2019,23:45,12.92178,77.58074,2019-04-16 23:45:00,23,1,16,4,2,0,0,0,0,1,-0.25881904510252157,0.9659258262890681,0.7818314824680298,0.6234898018587336,0.8660254037844387,-0.49999999999999983,12.92,77.58,144,5.739736686054968,7,2.0,3.0,0,14.930201227261723
Ordinary Theft,24/04/2019,12:00,12.922657,77.589563,2019-04-24 12:00:00,12,2,24,4,2,0,0,1,0,0,1.2246467991473532e-16,-1.0,0.9749279121818236,-0.22252093395631434,0.8660254037844387,-0.49999999999999983,12.92,77.58,144,5.4695189521692225,7,2.0,2.0,0,9.953467484841148
Ordinary Theft,12/05/2019,11:30,12921652.0,77579288.0,2019-05-12 11:30:00,11,6,12,5,2,1,1,0,0,0,0.258819045102521,-0.9659258262890682,-0.7818314824680299,0.6234898018587334,0.49999999999999994,-0.8660254037844387,12921651.99,77579287.99,2,11983.610235667766,7,2.0,1.6,0,1.7577796618689758
Ordinary Theft,26/05/2019,18:00,12921652.0,77579288.0,2019-05-26 18:00:00,18,6,26,5,2,1,0,0,1,0,-1.0,-1.8369701987210297e-16,-0.7818314824680299,0.6234898018587334,0.49999999999999994,-0.8660254037844387,12921651.99,77579287.99,2,11983.610235667766,7,2.0,2.4,0,2.6366694928034633
Ordinary Theft,27/05/2019,18:30,12.92819,77.62512,2019-05-27 18:30:00,18,0,27,5,2,0,0,0,1,0,-1.0,-1.8369701987210297e-16,0.0,1.0,0.49999999999999994,-0.8660254037844387,12.92,77.62,3,5.851346798406174,7,2.0,2.4,0,3.3271064666877375
Ordinary Theft,20/06/2019,12:00,12.92253,77.58589,2019-06-20 12:00:00,12,3,20,6,2,0,0,1,0,0,1.2246467991473532e-16,-1.0,0.43388373911755823,-0.900968867902419,1.2246467991473532e-16,-1.0,12.92,77.58,144,5.537374171339112,7,2.0,2.0,0,9.953467484841148
Ordinary Theft,23/06/2019,17:00,12.92253,77.58589,2019-06-23 17:00:00,17,6,23,6,2,1,0,1,0,0,-0.9659258262890683,-0.25881904510252063,-0.7818314824680299,0.6234898018587334,1.2246467991473532e-16,-1.0,12.92,77.58,144,5.537374171339112,7,2.0,2.0,0,9.953467484841148
Ordinary Theft,08/07/2019,21:45,12.91953,77.57458,2019-07-08 21:45:00,21,0,8,7,3,0,0,0,1,0,-0.7071067811865477,0.7071067811865474,0.0,1.0,-0.4999999999999998,-0.8660254037844388,12.91,77.57000000000001,82,6.1830480409801005,7,2.0,2.4,0,10.605217458711836
Ordinary Theft,23/07/2019,19:00,12.28784,76.63313,2019-07-23 19:00:00,19,1,23,7,3,0,0,0,1,0,-0.9659258262890684,0.2588190451025203,0.7818314824680298,0.6234898018587336,-0.4999999999999998,-0.8660254037844388,12.280000000000001,76.63,7,129.0888715369456,7,2.0,2.4,0,4.990659700031606
Ordinary Theft,14/08/2019,20:00,12.92253,77.58589,2019-08-14 20:00:00,20,2,14,8,3,0,0,0,1,0,-0.8660254037844386,0.5000000000000001,0.9749279121818236,-0.22252093395631434,-0.8660254037844384,-0.5000000000000004,12.92,77.58,144,5.537374171339112,7,2.0,2.4,0,11.944160981809377
Ordinary Theft,12/09/2019,11:00,12.92334,77.58484,2019-09-12 11:00:00,11,3,12,9,3,0,1,0,0,0,0.258819045102521,-0.9659258262890682,0.43388373911755823,-0.900968867902419,-1.0,-1.8369701987210297e-16,12.92,77.58,144,5.469505496186577,7,2.0,1.6,0,7.962773987872919
Ordinary Theft,27/09/2019,11:35,12.92875,77.5801,2019-09-27 11:35:00,11,4,27,9,3,0,1,0,0,0,0.258819045102521,-0.9659258262890682,-0.433883739117558,-0.9009688679024191,-1.0,-1.8369701987210297e-16,12.92,77.58,144,5.017113636402217,7,2.0,1.6,0,7.962773987872919
Ordinary Theft,29/10/2019,20:30,12.928459,77.576972,2019-10-29 20:30:00,20,1,29,10,4,0,0,0,1,0,-0.8660254037844386,0.5000000000000001,0.7818314824680298,0.6234898018587336,-0.8660254037844386,0.5000000000000001,12.92,77.57000000000001,55,5.163428522023863,7,2.0,2.4,0,9.66084405776436
Ordinary Theft,13/11/2019,20:00,12.926192,77.586141,2019-11-13 20:00:00,20,2,13,11,4,0,0,0,1,0,-0.8660254037844386,0.5000000000000001,0.9749279121818236,-0.22252093395631434,-0.5000000000000004,0.8660254037844384,12.92,77.58,144,5.131676810649081,7,2.0,2.4,0,11.944160981809377
Ordinary Theft,15/11/2019,18:00,12.91743,77.583465,2019-11-15 18:00:00,18,4,15,11,4,0,0,0,1,0,-1.0,-1.8369701987210297e-16,-0.433883739117558,-0.9009688679024191,-0.5000000000000004,0.8660254037844384,12.91,77.58,105,6.143110095776199,7,2.0,2.4,0,11.19225382586896
Ordinary Theft,05/12/2019,23:40,12.92367,77.58374,2019-12-05 23:40:00,23,3,5,12,4,0,0,0,0,1,-0.25881904510252157,0.9659258262890681,0.43388373911755823,-0.900968867902419,-2.4492935982947064e-16,1.0,12.92,77.58,144,5.45796484375038,7,2.0,3.0,0,14.930201227261723
Ordinary Theft,14/12/2019,12:00,12.92556,77.57561,2019-12-14 12:00:00,12,5,14,12,4,1,0,1,0,0,1.2246467991473532e-16,-1.0,-0.9749279121818236,-0.2225209339563146,-2.4492935982947064e-16,1.0,12.92,77.57000000000001,55,5.51754877639884,7,2.0,2.0,0,8.0507033814703
Ordinary Theft,03/02/2015,4:30,12.948212,77.562999,2015-02-03 04:30:00,4,1,3,2,1,0,0,0,0,1,0.8660254037844386,0.5000000000000001,0.7818314824680298,0.6234898018587336,0.8660254037844386,0.5000000000000001,12.94,77.56,99,4.299944360338948,7,2.0,3.0,0,13.815510557964275
Ordinary Theft,04/04/2015,14:15,12.565868,77.333824,2015-04-04 14:15:00,14,5,4,4,2,1,0,1,0,0,-0.4999999999999998,-0.8660254037844388,-0.9749279121818236,-0.2225209339563146,0.8660254037844387,-0.49999999999999983,12.56,77.33,65,53.24604566217405,7,2.0,2.0,0,8.37930948405285
Ordinary Theft,15/04/2015,14:30,12.9522989999415,77.5644119997618,2015-04-15 14:30:00,14,2,15,4,2,0,0,1,0,0,-0.4999999999999998,-0.8660254037844388,0.9749279121818236,-0.22252093395631434,0.8660254037844387,-0.49999999999999983,12.950000000000001,77.56,65,3.912408349935059,7,2.0,2.0,0,8.37930948405285
Ordinary Theft,24/07/2015,17:30,12.94801,77.56771,2015-07-24 17:30:00,17,4,24,7,3,0,0,1,0,0,-0.9659258262890683,-0.25881904510252063,-0.433883739117558,-0.9009688679024191,-0.4999999999999998,-0.8660254037844388,12.94,77.56,99,3.9206149092498332,7,2.0,2.0,0,9.210340371976184
Ordinary Theft,23/10/2015,18:00,12.94801,77.56771,2015-10-23 18:00:00,18,4,23,10,4,0,0,0,1,0,-1.0,-1.8369701987210297e-16,-0.433883739117558,-0.9009688679024191,-0.8660254037844386,0.5000000000000001,12.94,77.56,99,3.9206149092498332,7,2.0,2.4,0,11.05240844637142
Ordinary Theft,29/11/2015,17:00,12.9508,77.56371,2015-11-29 17:00:00,17,6,29,11,4,1,0,1,0,0,-0.9659258262890683,-0.25881904510252063,-0.7818314824680299,0.6234898018587334,-0.5000000000000004,0.8660254037844384,12.950000000000001,77.56,65,4.06862524425003,7,2.0,2.0,0,8.37930948405285
Ordinary Theft,15/02/2016,10:00,12.953286,77.561639,2016-02-15 10:00:00,10,0,15,2,1,0,1,0,0,0,0.49999999999999994,-0.8660254037844387,0.0,1.0,0.8660254037844386,0.5000000000000001,12.950000000000001,77.56,65,4.111454633992721,7,2.0,1.6,0,6.70344758724228
Ordinary Theft,07/03/2016,13:00,12.95388,77.56341,2016-03-07 13:00:00,13,0,7,3,1,0,0,1,0,0,-0.2588190451025208,-0.9659258262890683,0.0,1.0,1.0,6.123233995736766e-17,12.950000000000001,77.56,65,3.9122036069016386,7,2.0,2.0,0,8.37930948405285
Ordinary Theft,08/09/2016,17:00,12.955074,77.562575,2016-09-08 17:00:00,17,3,8,9,3,0,0,1,0,0,-0.9659258262890683,-0.25881904510252063,0.43388373911755823,-0.900968867902419,-1.0,-1.8369701987210297e-16,12.950000000000001,77.56,65,3.926768440861851,7,2.0,2.0,0,8.37930948405285
Ordinary Theft,27/09/2016,18:00,12.9491686,77.5662899,2016-09-27 18:00:00,18,1,27,9,3,0,0,0,1,0,-1.0,-1.8369701987210297e-16,0.7818314824680298,0.6234898018587336,-1.0,-1.8369701987210297e-16,12.94,77.56,99,3.953782140946535,7,2.0,2.4,0,11.05240844637142
Ordinary Theft,07/01/2017,11:30,12.955174,77.567121,2017-01-07 11:30:00,11,5,7,1,1,1,1,0,0,0,0.258819045102521,-0.9659258262890682,-0.9749279121818236,-0.2225209339563146,0.49999999999999994,0.8660254037844387,12.950000000000001,77.56,65,3.493202519908053,7,2.0,1.6,0,6.70344758724228
Ordinary Theft,02/03/2017,14:30,12.956997,77.564332,2017-03-02 14:30:00,14,3,2,3,1,0,0,1,0,0,-0.4999999999999998,-0.8660254037844388,0.43388373911755823,-0.900968867902419,1.0,6.123233995736766e-17,12.950000000000001,77.56,65,3.6597987863563675,7,2.0,2.0,0,8.37930948405285
Ordinary Theft,26/04/2017,18:15,12.957033,77.564308,2017-04-26 18:15:00,18,2,26,4,2,0,0,0,1,0,-1.0,-1.8369701987210297e-16,0.9749279121818236,-0.22252093395631434,0.8660254037844387,-0.49999999999999983,12.950000000000001,77.56,65,3.6603562531217877,7,2.0,2.4,0,10.05517138086342
Ordinary Theft,05/05/2017,18:15,12.95695346,77.56145099,2017-05-05 18:15:00,18,4,5,5,2,0,0,0,1,0,-1.0,-1.8369701987210297e-16,-0.433883739117558,-0.9009688679024191,0.49999999999999994,-0.8660254037844387,12.950000000000001,77.56,65,3.944008208445902,7,2.0,2.4,0,10.05517138086342
Ordinary Theft,22/09/2017,13:00,12.953503,77.56495,2017-09-22 13:00:00,13,4,22,9,3,0,0,1,0,0,-0.2588190451025208,-0.9659258262890683,-0.433883739117558,-0.9009688679024191,-1.0,-1.8369701987210297e-16,12.950000000000001,77.56,65,3.7910609068124406,7,2.0,2.0,0,8.37930948405285
Ordinary Theft,19/08/2017,11:00,12.948212,77.562999,2017-08-19 11:00:00,11,5,19,8,3,1,1,0,0,0,0.258819045102521,-0.9659258262890682,-0.9749279121818236,-0.2225209339563146,-0.8660254037844384,-0.5000000000000004,12.94,77.56,99,4.299944360338948,7,2.0,1.6,0,7.368272297580948
Ordinary Theft,15/11/2017,15:00,12.948212,77.562999,2017-11-15 15:00:00,15,2,15,11,4,0,0,1,0,0,-0.7071067811865471,-0.7071067811865479,0.9749279121818236,-0.22252093395631434,-0.5000000000000004,0.8660254037844384,12.94,77.56,99,4.299944360338948,7,2.0,2.0,0,9.210340371976184
Ordinary Theft,25/11/2017,11:45,12.948212,77.562999,2017-11-25 11:45:00,11,5,25,11,4,1,1,0,0,0,0.258819045102521,-0.9659258262890682,-0.9749279121818236,-0.2225209339563146,-0.5000000000000004,0.8660254037844384,12.94,77.56,99,4.299944360338948,7,2.0,1.6,0,7.368272297580948
Ordinary Theft,27/12/2017,14:00,12.94896,77.56008,2017-12-27 14:00:00,14,2,27,12,4,0,0,1,0,0,-0.4999999999999998,-0.8660254037844388,0.9749279121818236,-0.22252093395631434,-2.4492935982947064e-16,1.0,12.94,77.56,99,4.508898136771872,7,2.0,2.0,0,9.210340371976184
Ordinary Theft,28/12/2017,15:00,12.94896,77.56008,2017-12-28 15:00:00,15,3,28,12,4,0,0,1,0,0,-0.7071067811865471,-0.7071067811865479,0.43388373911755823,-0.900968867902419,-2.4492935982947064e-16,1.0,12.94,77.56,99,4.508898136771872,7,2.0,2.0,0,9.210340371976184
Ordinary Theft,17/01/2018,14:00,12.951642,77.567167,2018-01-17 14:00:00,14,2,17,1,1,0,0,1,0,0,-0.4999999999999998,-0.8660254037844388,0.9749279121818236,-0.22252093395631434,0.49999999999999994,0.8660254037844387,12.950000000000001,77.56,65,3.7096961803971062,7,2.0,2.0,0,8.37930948405285
Ordinary Theft,10/03/2018,19:00,12.95522,77.56742,2018-03-10 19:00:00,19,5,10,3,1,1,0,0,1,0,-0.9659258262890684,0.2588190451025203,-0.9749279121818236,-0.2225209339563146,1.0,6.123233995736766e-17,12.950000000000001,77.56,65,3.4629325636241757,7,2.0,2.4,0,10.05517138086342
Ordinary Theft,29/05/2018,11:40,12.9491686,77.5662899,2018-05-29 11:40:00,11,1,29,5,2,0,1,0,0,0,0.258819045102521,-0.9659258262890682,0.7818314824680298,0.6234898018587336,0.49999999999999994,-0.8660254037844387,12.94,77.56,99,3.953782140946535,7,2.0,1.6,0,7.368272297580948
Ordinary Theft,05/06/2018,20:30,12.94868,77.55791,2018-06-05 20:30:00,20,1,5,6,2,0,0,0,1,0,-0.8660254037844386,0.5000000000000001,0.7818314824680298,0.6234898018587336,1.2246467991473532e-16,-1.0,12.94,77.55,85,4.722542819104608,7,2.0,2.4,0,10.690433511008417
Ordinary Theft,25/06/2018,15:30,12.9542,77.56451,2018-06-25 15:30:00,15,0,25,6,2,0,0,1,0,0,-0.7071067811865471,-0.7071067811865479,0.0,1.0,1.2246467991473532e-16,-1.0,12.950000000000001,77.56,65,3.791418303231773,7,2.0,2.0,0,8.37930948405285
Ordinary Theft,24/07/2018,10:45,12.95707,77.56642,2018-07-24 10:45:00,10,1,24,7,3,0,1,0,0,0,0.49999999999999994,-0.8660254037844387,0.7818314824680298,0.6234898018587336,-0.4999999999999998,-0.8660254037844388,12.950000000000001,77.56,65,3.454683856011769,7,2.0,1.6,0,6.70344758724228
Ordinary Theft,07/08/2018,18:15,12.95521,77.56497,2018-08-07 18:15:00,18,1,7,8,3,0,0,0,1,0,-1.0,-1.8369701987210297e-16,0.7818314824680298,0.6234898018587336,-0.8660254037844384,-0.5000000000000004,12.950000000000001,77.56,65,3.6919198401519564,7,2.0,2.4,0,10.05517138086342
Ordinary Theft,01/10/2018,14:30,12.9578264,77.55941741,2018-10-01 14:30:00,14,0,1,10,4,0,0,1,0,0,-0.4999999999999998,-0.8660254037844388,0.0,1.0,-0.8660254037844386,0.5000000000000001,12.950000000000001,77.55,16,4.108533436224985,7,2.0,2.0,0,5.666426688112432
Ordinary Theft,22/10/2018,16:00,12.956997,77.564332,2018-10-22 16:00:00,16,0,22,10,4,0,0,1,0,0,-0.8660254037844384,-0.5000000000000004,0.0,1.0,-0.8660254037844386,0.5000000000000001,12.950000000000001,77.56,65,3.6597987863563675,7,2.0,2.0,0,8.37930948405285
Ordinary Theft,10/12/2018,15:10,12.94966,77.55928,2018-12-10 15:10:00,15,0,10,12,4,0,0,1,0,0,-0.7071067811865471,-0.7071067811865479,0.0,1.0,-2.4492935982947064e-16,1.0,12.94,77.55,85,4.538761007771434,7,2.0,2.0,0,8.908694592507015
Ordinary Theft,16/02/2019,18:50,12.95709,77.56445,2019-02-16 18:50:00,18,5,16,2,1,1,0,0,1,0,-1.0,-1.8369701987210297e-16,-0.9749279121818236,-0.2225209339563146,0.8660254037844386,0.5000000000000001,12.950000000000001,77.56,65,3.643752744621611,7,2.0,2.4,0,10.05517138086342
Ordinary Theft,25/02/2019,17:00,12.955052,77.566014,2019-02-25 17:00:00,17,0,25,2,1,0,0,1,0,0,-0.9659258262890683,-0.25881904510252063,0.0,1.0,0.8660254037844386,0.5000000000000001,12.950000000000001,77.56,65,3.6029112105067767,7,2.0,2.0,0,8.37930948405285
Ordinary Theft,21/03/2019,9:00,12.957028,77.565483,2019-03-21 09:00:00,9,3,21,3,1,0,1,0,0,0,0.7071067811865476,-0.7071067811865475,0.43388373911755823,-0.900968867902419,1.0,6.123233995736766e-17,12.950000000000001,77.56,65,3.546879138226391,7,2.0,1.6,0,6.70344758724228
Ordinary Theft,22/03/2019,17:30,12.957045,77.562861,2019-03-22 17:30:00,17,4,22,3,1,0,0,1,0,0,-0.9659258262890683,-0.25881904510252063,-0.433883739117558,-0.9009688679024191,1.0,6.123233995736766e-17,12.950000000000001,77.56,65,3.801030915482087,7,2.0,2.0,0,8.37930948405285
Ordinary Theft,20/07/2019,11:30,12.94973,77.56443,2019-07-20 11:30:00,11,5,20,7,3,1,1,0,0,0,0.258819045102521,-0.9659258262890682,-0.9749279121818236,-0.2225209339563146,-0.4999999999999998,-0.8660254037844388,12.94,77.56,99,4.07456060232509,7,2.0,1.6,0,7.368272297580948
Ordinary Theft,14/08/2017,16:30,12.9084615,77.5808686,2017-08-14 16:30:00,16,0,14,8,3,0,0,1,0,0,-0.8660254037844384,-0.5000000000000004,0.0,1.0,-0.8660254037844384,-0.5000000000000004,12.9,77.58,43,7.176654065767451,7,2.0,2.0,0,7.568379267836522
Ordinary Theft,17/08/2017,21:45,12.9187108,77.5856202,2017-08-17 21:45:00,21,3,17,8,3,0,0,0,1,0,-0.7071067811865477,0.7071067811865474,0.43388373911755823,-0.900968867902419,-0.8660254037844384,-0.5000000000000004,12.91,77.58,105,5.9609790309743635,7,2.0,2.4,0,11.19225382586896
Ordinary Theft,14/09/2017,12:00,12.9071899,77.5490795,2017-09-14 12:00:00,12,3,14,9,3,0,0,1,0,0,1.2246467991473532e-16,-1.0,0.43388373911755823,-0.900968867902419,-1.0,-1.8369701987210297e-16,12.9,77.54,56,8.69660928100154,7,2.0,2.0,0,8.0861025356691
Ordinary Theft,19/09/2017,11:00,12.9155867,77.576883,2017-09-19 11:00:00,11,1,19,9,3,0,1,0,0,0,0.258819045102521,-0.9659258262890682,0.7818314824680298,0.6234898018587336,-1.0,-1.8369701987210297e-16,12.91,77.57000000000001,82,6.517609935681279,7,2.0,1.6,0,7.070144972474558
Ordinary Theft,20/09/2017,9:30,12.9068718,77.5705817,2017-09-20 09:30:00,9,2,20,9,3,0,1,0,0,0,0.7071067811865476,-0.7071067811865475,0.9749279121818236,-0.22252093395631434,-1.0,-1.8369701987210297e-16,12.9,77.57000000000001,96,7.653648150936686,7,2.0,1.6,0,7.319537565605413
Ordinary Theft,22/09/2017,10:30,12.9085532,77.5813653,2017-09-22 10:30:00,10,4,22,9,3,0,1,0,0,0,0.49999999999999994,-0.8660254037844387,-0.433883739117558,-0.9009688679024191,-1.0,-1.8369701987210297e-16,12.9,77.58,43,7.155696270456979,7,2.0,1.6,0,6.054703414269218
Ordinary Theft,22/09/2017,11:00,12.9054972,77.5732814,2017-09-22 11:00:00,11,4,22,9,3,0,1,0,0,0,0.258819045102521,-0.9659258262890682,-0.433883739117558,-0.9009688679024191,-1.0,-1.8369701987210297e-16,12.9,77.57000000000001,96,7.704835882813858,7,2.0,1.6,0,7.319537565605413
Ordinary Theft,24/09/2017,13:30,12.9084481,77.5880616,2017-09-24 13:30:00,13,6,24,9,3,1,0,1,0,0,-0.2588190451025208,-0.9659258262890683,-0.7818314824680299,0.6234898018587334,-1.0,-1.8369701987210297e-16,12.9,77.58,43,7.057829748893455,7,2.0,2.0,0,7.568379267836522
Ordinary Theft,15/10/2017,10:30,12.898444,77.5462742,2017-10-15 10:30:00,10,6,15,10,4,1,1,0,0,0,0.49999999999999994,-0.8660254037844387,-0.7818314824680299,0.6234898018587334,-0.8660254037844386,0.5000000000000001,12.89,77.54,35,9.674702398614253,7,2.0,1.6,0,5.733630301529776
Ordinary Theft,17/10/2017,17:00,12.9070514,77.5826242,2017-10-17 17:00:00,17,1,17,10,4,0,0,1,0,0,-0.9659258262890683,-0.25881904510252063,0.7818314824680298,0.6234898018587336,-0.8660254037844386,0.5000000000000001,12.9,77.58,43,7.293870601829357,7,2.0,2.0,0,7.568379267836522
Ordinary Theft,26/10/2017,12:00,12.887715,77.5673984,2017-10-26 12:00:00,12,3,26,10,4,0,0,1,0,0,1.2246467991473532e-16,-1.0,0.43388373911755823,-0.900968867902419,-0.8660254037844386,0.5000000000000001,12.88,77.56,64,9.782357370161836,7,2.0,2.0,0,8.348774539791274
Ordinary Theft,21/12/2017,12:20,12.909989,77.5850446,2017-12-21 12:20:00,12,3,21,12,4,0,0,1,0,0,1.2246467991473532e-16,-1.0,0.43388373911755823,-0.900968867902419,-2.4492935982947064e-16,1.0,12.9,77.58,43,6.9286502934551635,7,2.0,2.0,0,7.568379267836522
Ordinary Theft,21/12/2017,12:40,12.9094052,77.5852783,2017-12-21 12:40:00,12,3,21,12,4,0,0,1,0,0,1.2246467991473532e-16,-1.0,0.43388373911755823,-0.900968867902419,-2.4492935982947064e-16,1.0,12.9,77.58,43,6.989138163209239,7,2.0,2.0,0,7.568379267836522
Ordinary Theft,25/12/2017,11:00,12.9138985,77.5922627,2017-12-25 11:00:00,11,0,25,12,4,0,1,0,0,0,0.258819045102521,-0.9659258262890682,0.0,1.0,-2.4492935982947064e-16,1.0,12.91,77.59,48,6.421111820035707,7,2.0,1.6,0,6.226912476977002
Ordinary Theft,24/01/2018,13:00,12.9111604,77.582781,2018-01-24 13:00:00,13,2,24,1,1,0,0,1,0,0,-0.2588190451025208,-0.9659258262890683,0.9749279121818236,-0.22252093395631434,0.49999999999999994,0.8660254037844387,12.91,77.58,105,6.841540961093982,7,2.0,2.0,0,9.326878188224134
Ordinary Theft,24/01/2018,15:00,12.9174923,77.5905657,2018-01-24 15:00:00,15,2,24,1,1,0,0,1,0,0,-0.7071067811865471,-0.7071067811865479,0.9749279121818236,-0.22252093395631434,0.49999999999999994,0.8660254037844387,12.91,77.59,48,6.032365326757474,7,2.0,2.0,0,7.783640596221253
Ordinary Theft,20/02/2018,11:00,12.9093977,77.5743495,2018-02-20 11:00:00,11,1,20,2,1,0,1,0,0,0,0.258819045102521,-0.9659258262890682,0.7818314824680298,0.6234898018587336,0.8660254037844386,0.5000000000000001,12.9,77.57000000000001,96,7.256390172831574,7,2.0,1.6,0,7.319537565605413
Ordinary Theft,30/05/2018,19:00,12.9102953,77.6014317,2018-05-30 19:00:00,19,2,30,5,2,0,0,0,1,0,-0.9659258262890684,0.2588190451025203,0.9749279121818236,-0.22252093395631434,0.49999999999999994,-0.8660254037844387,12.91,77.60000000000001,2,6.85685808022352,7,2.0,2.4,0,2.6366694928034633
Ordinary Theft,15/06/2018,10:00,12.9109337,77.5768905,2018-06-15 10:00:00,10,4,15,6,2,0,1,0,0,0,0.49999999999999994,-0.8660254037844387,-0.433883739117558,-0.9009688679024191,1.2246467991473532e-16,-1.0,12.91,77.57000000000001,82,7.013479755467627,7,2.0,1.6,0,7.070144972474558
Ordinary Theft,13/08/2018,20:50,12.9164782,77.5901863,2018-08-13 20:50:00,20,0,13,8,3,0,0,0,1,0,-0.8660254037844386,0.5000000000000001,0.0,1.0,-0.8660254037844384,-0.5000000000000004,12.91,77.59,48,6.147899137356057,7,2.0,2.4,0,9.340368715465504
Ordinary Theft,16/12/2018,15:00,12.9121733,77.5904941,2018-12-16 15:00:00,15,6,16,12,4,1,0,1,0,0,-0.7071067811865471,-0.7071067811865479,-0.7818314824680299,0.6234898018587334,-2.4492935982947064e-16,1.0,12.91,77.59,48,6.622911604985713,7,2.0,2.0,0,7.783640596221253
Ordinary Theft,29/12/2018,13:00,12.9154502,77.5886665,2018-12-29 13:00:00,13,5,29,12,4,1,0,1,0,0,-0.2588190451025208,-0.9659258262890683,-0.9749279121818236,-0.2225209339563146,-2.4492935982947064e-16,1.0,12.91,77.58,105,6.276596663249979,7,2.0,2.0,0,9.326878188224134
Ordinary Theft,18/01/2019,12:00,12.9144517,77.5801036,2019-01-18 12:00:00,12,4,18,1,1,0,0,1,0,0,1.2246467991473532e-16,-1.0,-0.433883739117558,-0.9009688679024191,0.49999999999999994,0.8660254037844387,12.91,77.58,105,6.545907739726692,7,2.0,2.0,0,9.326878188224134
Ordinary Theft,13/02/2019,18:00,12.9094787,77.5553333,2019-02-13 18:00:00,18,2,13,2,1,0,0,0,1,0,-1.0,-1.8369701987210297e-16,0.9749279121818236,-0.22252093395631434,0.8660254037844386,0.5000000000000001,12.9,77.55,37,8.113120509635158,7,2.0,2.4,0,8.730206783343325
Ordinary Theft,16/08/2019,9:10,12.9117957,77.5826913,2019-08-16 09:10:00,9,4,16,8,3,0,1,0,0,0,0.7071067811865476,-0.7071067811865475,-0.433883739117558,-0.9009688679024191,-0.8660254037844384,-0.5000000000000004,12.91,77.58,105,6.774005681263098,7,2.0,1.6,0,7.461502550579308
Ordinary Theft,26/09/2019,10:45,12.9154896,77.594723,2019-09-26 10:45:00,10,3,26,9,3,0,1,0,0,0,0.49999999999999994,-0.8660254037844387,0.43388373911755823,-0.900968867902419,-1.0,-1.8369701987210297e-16,12.91,77.59,48,6.2392060505647375,7,2.0,1.6,0,6.226912476977002
Ordinary Theft,24/10/2019,18:00,12.9104019,77.5890694,2019-10-24 18:00:00,18,3,24,10,4,0,0,0,1,0,-1.0,-1.8369701987210297e-16,0.43388373911755823,-0.900968867902419,-0.8660254037844386,0.5000000000000001,12.91,77.58,105,6.831261865487784,7,2.0,2.4,0,11.19225382586896
Ordinary Theft,25/11/2019,21:15,12.91152,77.5708782,2019-11-25 21:15:00,21,0,25,11,4,0,0,0,1,0,-0.7071067811865477,0.7071067811865474,0.0,1.0,-0.5000000000000004,0.8660254037844384,12.91,77.57000000000001,82,7.158143257674942,7,2.0,2.4,0,10.605217458711836
Ordinary Theft,29/12/2019,4:30,12.9142916,77.5909833,2019-12-29 04:30:00,4,6,29,12,4,1,0,0,0,1,0.8660254037844386,0.5000000000000001,-0.7818314824680299,0.6234898018587334,-2.4492935982947064e-16,1.0,12.91,77.59,48,6.384445332604964,7,2.0,3.0,0,11.675460894331879
Ordinary Theft,26/02/2015,13:30,12.91678611,77.56083333,2015-02-26 13:30:00,13,3,26,2,1,0,0,1,0,0,-0.2588190451025208,-0.9659258262890683,0.43388373911755823,-0.900968867902419,0.8660254037844386,0.5000000000000001,12.91,77.56,126,7.109121695395572,7,2.0,2.0,0,9.688374172917182
Ordinary Theft,11/3/2015,16:00,12.93115556,77.57611111,2015-03-11 16:00:00,16,2,11,3,1,0,0,1,0,0,-0.8660254037844384,-0.5000000000000004,0.9749279121818236,-0.22252093395631434,1.0,6.123233995736766e-17,12.93,77.57000000000001,40,4.923337469738128,7,2.0,2.0,0,7.427144133408616
Ordinary Theft,23/04/2015,14:00,12.92954722,77.56416667,2015-04-23 14:00:00,14,3,23,4,2,0,0,1,0,0,-0.4999999999999998,-0.8660254037844388,0.43388373911755823,-0.900968867902419,0.8660254037844387,-0.49999999999999983,12.92,77.56,33,5.722062850791962,7,2.0,2.0,0,7.052721049232323
Ordinary Theft,23/06/2015,17:30,12.92588611,77.56416667,2015-06-23 17:30:00,17,1,23,6,2,0,0,1,0,0,-0.9659258262890683,-0.25881904510252063,0.7818314824680298,0.6234898018587336,1.2246467991473532e-16,-1.0,12.92,77.56,33,6.059299139632402,7,2.0,2.0,0,7.052721049232323
Ordinary Theft,31/07/2015,14:45,12.92172222,77.57361111,2015-07-31 14:45:00,14,4,31,7,3,0,0,1,0,0,-0.4999999999999998,-0.8660254037844388,-0.433883739117558,-0.9009688679024191,-0.4999999999999998,-0.8660254037844388,12.92,77.57000000000001,55,5.9944416018433015,7,2.0,2.0,0,8.0507033814703
Ordinary Theft,24/08/2015,14:00,12.92793333,77.56527778,2015-08-24 14:00:00,14,0,24,8,3,0,0,1,0,0,-0.4999999999999998,-0.8660254037844388,0.0,1.0,-0.8660254037844384,-0.5000000000000004,12.92,77.56,33,5.802833147055193,7,2.0,2.0,0,7.052721049232323
Ordinary Theft,1/12/2015,17:00,12.92248611,77.595,2015-12-01 17:00:00,17,1,1,12,4,0,0,1,0,0,-0.9659258262890683,-0.25881904510252063,0.7818314824680298,0.6234898018587336,-2.4492935982947064e-16,1.0,12.92,77.59,10,5.4613874227627885,7,2.0,2.0,0,4.795790545596741
Ordinary Theft,17/12/2015,15:00,12.92558889,77.56305556,2015-12-17 15:00:00,15,3,17,12,4,0,0,1,0,0,-0.7071067811865471,-0.7071067811865479,0.43388373911755823,-0.900968867902419,-2.4492935982947064e-16,1.0,12.92,77.56,33,6.153121688183042,7,2.0,2.0,0,7.052721049232323
Ordinary Theft,24/03/2016,12:00,12.92393889,77.56055556,2016-03-24 12:00:00,12,3,24,3,1,0,0,1,0,0,1.2246467991473532e-16,-1.0,0.43388373911755823,-0.900968867902419,1.0,6.123233995736766e-17,12.92,77.56,33,6.4573694936970085,7,2.0,2.0,0,7.052721049232323
Ordinary Theft,11/4/2016,19:45,12.91854167,77.57138889,2016-04-11 19:45:00,19,0,11,4,2,0,0,0,1,0,-0.9659258262890684,0.2588190451025203,0.0,1.0,0.8660254037844387,-0.49999999999999983,12.91,77.57000000000001,82,6.413649055049392,7,2.0,2.4,0,10.605217458711836
Ordinary Theft,17/05/2016,10:30,12.92945278,77.57361111,2016-05-17 10:30:00,10,1,17,5,2,0,1,0,0,0,0.49999999999999994,-0.8660254037844387,0.7818314824680298,0.6234898018587336,0.49999999999999994,-0.8660254037844387,12.92,77.57000000000001,55,5.209331937380014,7,2.0,1.6,0,6.44056270517624
Ordinary Theft,22/05/2016,16:30,12.92393889,77.56055556,2016-05-22 16:30:00,16,6,22,5,2,1,0,1,0,0,-0.8660254037844384,-0.5000000000000004,-0.7818314824680299,0.6234898018587334,0.49999999999999994,-0.8660254037844387,12.92,77.56,33,6.4573694936970085,7,2.0,2.0,0,7.052721049232323
Ordinary Theft,6/6/2016,18:00,12.91569722,77.55888889,2016-06-06 18:00:00,18,0,6,6,2,0,0,0,1,0,-1.0,-1.8369701987210297e-16,0.0,1.0,1.2246467991473532e-16,-1.0,12.91,77.55,40,7.322352384453851,7,2.0,2.4,0,8.912572960090339
Ordinary Theft,4/7/2016,14:30,12.91569722,77.55888889,2016-07-04 14:30:00,14,0,4,7,3,0,0,1,0,0,-0.4999999999999998,-0.8660254037844388,0.0,1.0,-0.4999999999999998,-0.8660254037844388,12.91,77.55,40,7.322352384453851,7,2.0,2.0,0,7.427144133408616
Ordinary Theft,6/8/2016,16:00,12.91615833,77.57,2016-08-06 16:00:00,16,5,6,8,3,1,0,1,0,0,-0.8660254037844384,-0.5000000000000004,-0.9749279121818236,-0.2225209339563146,-0.8660254037844384,-0.5000000000000004,12.91,77.56,126,6.7165556944617295,7,2.0,2.0,0,9.688374172917182
Ordinary Theft,25/08/2016,18:00,12.91566944,77.56166667,2016-08-25 18:00:00,18,3,25,8,3,0,0,0,1,0,-1.0,-1.8369701987210297e-16,0.43388373911755823,-0.900968867902419,-0.8660254037844384,-0.5000000000000004,12.91,77.56,126,7.170490231559664,7,2.0,2.4,0,11.626049007500619
Ordinary Theft,3/9/2016,13:00,12.92279444,77.57138889,2016-09-03 13:00:00,13,5,3,9,3,1,0,1,0,0,-0.2588190451025208,-0.9659258262890683,-0.9749279121818236,-0.2225209339563146,-1.0,-1.8369701987210297e-16,12.92,77.57000000000001,55,5.981514925251934,7,2.0,2.0,0,8.0507033814703
Ordinary Theft,19/09/2016,17:50,12.91837222,77.56638889,2016-09-19 17:50:00,17,0,19,9,3,0,0,1,0,0,-0.9659258262890683,-0.25881904510252063,0.0,1.0,-1.0,-1.8369701987210297e-16,12.91,77.56,126,6.661610317011773,7,2.0,2.0,0,9.688374172917182
Ordinary Theft,9/3/2017,14:40,12.87743,77.500191,2017-03-09 14:40:00,14,3,9,3,1,0,0,1,0,0,-0.4999999999999998,-0.8660254037844388,0.43388373911755823,-0.900968867902419,1.0,6.123233995736766e-17,12.870000000000001,77.5,4,14.640260451549455,7,2.0,2.0,0,3.2188758248682006
Ordinary Theft,4/10/2017,18:30,40.0446,75.08734,2017-10-04 18:30:00,18,2,4,10,4,0,0,0,1,0,-1.0,-1.8369701987210297e-16,0.9749279121818236,-0.22252093395631434,-0.8660254037844386,0.5000000000000001,40.04,75.08,1,3020.3620631033714,7,2.0,2.4,0,1.6635532333438687
Ordinary Theft,1/12/2017,10:30,77.554811,12.91595,2017-12-01 10:30:00,10,4,1,12,4,0,1,0,0,0,0.49999999999999994,-0.8660254037844387,-0.433883739117558,-0.9009688679024191,-2.4492935982947064e-16,1.0,77.55,12.91,1,8006.067008608708,7,2.0,1.6,0,1.1090354888959124
Ordinary Theft,29/07/2018,11:45,12.92578,77.566693,2018-07-29 11:45:00,11,6,29,7,3,1,1,0,0,0,0.258819045102521,-0.9659258262890682,-0.7818314824680299,0.6234898018587334,-0.4999999999999998,-0.8660254037844388,12.92,77.56,33,5.9248936624777,7,2.0,1.6,0,5.642176839385859
Ordinary Theft,21/09/2018,15:00,12.91762,77.55959,2018-09-21 15:00:00,15,4,21,9,3,0,0,1,0,0,-0.7071067811865471,-0.7071067811865479,-0.433883739117558,-0.9009688679024191,-1.0,-1.8369701987210297e-16,12.91,77.55,40,7.100851542135791,7,2.0,2.0,0,7.427144133408616
Ordinary Theft,21/11/2018,11:00,16.864691,-79.553238,2018-11-21 11:00:00,11,2,21,11,4,0,1,0,0,0,0.258819045102521,-0.9659258262890682,0.9749279121818236,-0.22252093395631434,-0.5000000000000004,0.8660254037844384,16.86,-79.56,2,15854.700894204741,7,2.0,1.6,0,1.7577796618689758
Ordinary Theft,23/11/2018,13:30,16.864691,-79.553238,2018-11-23 13:30:00,13,4,23,11,4,0,0,1,0,0,-0.2588190451025208,-0.9659258262890683,-0.433883739117558,-0.9009688679024191,-0.5000000000000004,0.8660254037844384,16.86,-79.56,2,15854.700894204741,7,2.0,2.0,0,2.1972245773362196
Ordinary Theft,15/12/2018,13:30,12.94351,77.546,2018-12-15 13:30:00,13,5,15,12,4,1,0,1,0,0,-0.2588190451025208,-0.9659258262890683,-0.9749279121818236,-0.2225209339563146,-2.4492935982947064e-16,1.0,12.94,77.54,29,6.123047061881751,7,2.0,2.0,0,6.802394763324311
Ordinary Theft,10/1/2019,19:00,12.91191,77.56723,2019-01-10 19:00:00,19,3,10,1,1,0,0,0,1,0,-0.9659258262890684,0.2588190451025203,0.43388373911755823,-0.900968867902419,0.49999999999999994,0.8660254037844387,12.91,77.56,126,7.269834261847345,7,2.0,2.4,0,11.626049007500619
Ordinary Theft,1/2/2019,15:45,12.927296,77.56474,2019-02-01 15:45:00,15,4,1,2,1,0,0,1,0,0,-0.7071067811865471,-0.7071067811865479,-0.433883739117558,-0.9009688679024191,0.8660254037844386,0.5000000000000001,12.92,77.56,33,5.8940544555465815,7,2.0,2.0,0,7.052721049232323
Ordinary Theft,12/2/2019,16:10,33.92954,93.00935,2019-02-12 16:10:00,16,1,12,2,1,0,0,1,0,0,-0.8660254037844384,-0.5000000000000004,0.7818314824680298,0.6234898018587336,0.8660254037844386,0.5000000000000001,33.92,93.0,2,2803.1565755135953,7,2.0,2.0,0,2.1972245773362196
Ordinary Theft,27/03/2019,11:30,12.92666,77.54795,2019-03-27 11:30:00,11,2,27,3,1,0,1,0,0,0,0.258819045102521,-0.9659258262890682,0.9749279121818236,-0.22252093395631434,1.0,6.123233995736766e-17,12.92,77.54,49,7.1082595944110265,7,2.0,1.6,0,6.259236808685034
Ordinary Theft,7/4/2019,15:00,12.92199,77.5692,2019-04-07 15:00:00,15,6,7,4,2,1,0,1,0,0,-0.7071067811865471,-0.7071067811865479,-0.7818314824680299,0.6234898018587334,0.8660254037844387,-0.49999999999999983,12.92,77.56,33,6.164981236836239,7,2.0,2.0,0,7.052721049232323
Ordinary Theft,20/04/2019,12:00,12.88999,77.5614,2019-04-20 12:00:00,12,5,20,4,2,1,0,1,0,0,1.2246467991473532e-16,-1.0,-0.9749279121818236,-0.2225209339563146,0.8660254037844387,-0.49999999999999983,12.88,77.56,64,9.761899723880967,7,2.0,2.0,0,8.348774539791274
Ordinary Theft,24/04/2019,11:00,12.97194,77.593689,2019-04-24 11:00:00,11,2,24,4,2,0,1,0,0,0,0.258819045102521,-0.9659258262890682,0.9749279121818236,-0.22252093395631434,0.8660254037844387,-0.49999999999999983,12.97,77.59,13,0.10570559584187403,7,2.0,1.6,0,4.222491727384414
Ordinary Theft,11/8/2019,17:30,12.92804,77.562111,2019-08-11 17:30:00,17,6,11,8,3,1,0,1,0,0,-0.9659258262890683,-0.25881904510252063,-0.7818314824680299,0.6234898018587334,-0.8660254037844384,-0.5000000000000004,12.92,77.56,33,5.988030022068626,7,2.0,2.0,0,7.052721049232323
Ordinary Theft,12/8/2019,11:45,12.92804,77.562111,2019-08-12 11:45:00,11,0,12,8,3,0,1,0,0,0,0.258819045102521,-0.9659258262890682,0.0,1.0,-0.8660254037844384,-0.5000000000000004,12.92,77.56,33,5.988030022068626,7,2.0,1.6,0,5.642176839385859
Ordinary Theft,26/09/2019,12:00,33.92954,93.00935,2019-09-26 12:00:00,12,3,26,9,3,0,0,1,0,0,1.2246467991473532e-16,-1.0,0.43388373911755823,-0.900968867902419,-1.0,-1.8369701987210297e-16,33.92,93.0,2,2803.1565755135953,7,2.0,2.0,0,2.1972245773362196
Ordinary Theft,17/10/2019,11:00,12.9171403,77.5709063,2019-10-17 11:00:00,11,3,17,10,4,0,1,0,0,0,0.258819045102521,-0.9659258262890682,0.43388373911755823,-0.900968867902419,-0.8660254037844386,0.5000000000000001,12.91,77.57000000000001,82,6.577516576150889,7,2.0,1.6,0,7.070144972474558
Ordinary Theft,15/12/2019,12:15,12.942789,77.5632,2019-12-15 12:15:00,12,6,15,12,4,1,0,1,0,0,1.2246467991473532e-16,-1.0,-0.7818314824680299,0.6234898018587334,-2.4492935982947064e-16,1.0,12.94,77.56,99,4.673446967866279,7,2.0,2.0,0,9.210340371976184
Ordinary Theft,08/01/2015,9:30,12.942789,77.596405,2015-01-08 09:30:00,9,3,8,1,1,0,1,0,0,0,0.7071067811865476,-0.7071067811865475,0.43388373911755823,-0.900968867902419,0.49999999999999994,0.8660254037844387,12.94,77.59,130,3.2096024966926207,7,2.0,1.6,0,7.800315717121842
Ordinary Theft,11/01/2015,10:30,12.935919,77.585853,2015-01-11 10:30:00,10,6,11,1,1,1,1,0,0,0,0.49999999999999994,-0.8660254037844387,-0.7818314824680299,0.6234898018587334,0.49999999999999994,0.8660254037844387,12.93,77.58,74,4.079200935482814,7,2.0,1.6,0,6.907980981658096
Ordinary Theft,15/01/2015,12:30,12.935211,77.585661,2015-01-15 12:30:00,12,3,15,1,1,0,0,1,0,0,1.2246467991473532e-16,-1.0,0.43388373911755823,-0.900968867902419,0.49999999999999994,0.8660254037844387,12.93,77.58,74,4.1606074962464925,7,2.0,2.0,0,8.63497622707262
Ordinary Theft,18/01/2015,18:30,12.952192,77.585083,2015-01-18 18:30:00,18,6,18,1,1,1,0,0,1,0,-1.0,-1.8369701987210297e-16,-0.7818314824680299,0.6234898018587334,0.49999999999999994,0.8660254037844387,12.950000000000001,77.58,7,2.391820301421842,7,2.0,2.4,0,4.990659700031606
Ordinary Theft,21/01/2015,16:30,12.942789,77.596405,2015-01-21 16:30:00,16,2,21,1,1,0,0,1,0,0,-0.8660254037844384,-0.5000000000000004,0.9749279121818236,-0.22252093395631434,0.49999999999999994,0.8660254037844387,12.94,77.59,130,3.2096024966926207,7,2.0,2.0,0,9.750394646402302
Ordinary Theft,21/01/2015,18:00,12.943529,77.58517,2015-01-21 18:00:00,18,2,21,1,1,0,0,0,1,0,-1.0,-1.8369701987210297e-16,0.9749279121818236,-0.22252093395631434,0.49999999999999994,0.8660254037844387,12.94,77.58,80,3.284365551946342,7,2.0,2.4,0,10.546677971213853
Ordinary Theft,02/02/2015,15:00,12.941945,77.585178,2015-02-02 15:00:00,15,0,2,2,1,0,0,1,0,0,-0.7071067811865471,-0.7071067811865479,0.0,1.0,0.8660254037844386,0.5000000000000001,12.94,77.58,80,3.451935756058673,7,2.0,2.0,0,8.788898309344878
Ordinary Theft,20/02/2015,23:00,12.936654,77.585267,2015-02-20 23:00:00,23,4,20,2,1,0,0,0,0,1,-0.25881904510252157,0.9659258262890681,-0.433883739117558,-0.9009688679024191,0.8660254037844386,0.5000000000000001,12.93,77.58,74,4.0152772184029075,7,2.0,3.0,0,12.95246434060893
Ordinary Theft,16/03/2015,19:00,12.943529,77.58517,2015-03-16 19:00:00,19,0,16,3,1,0,0,0,1,0,-0.9659258262890684,0.2588190451025203,0.0,1.0,1.0,6.123233995736766e-17,12.94,77.58,80,3.284365551946342,7,2.0,2.4,0,10.546677971213853
Ordinary Theft,20/03/2015,16:30,12.941945,77.585178,2015-03-20 16:30:00,16,4,20,3,1,0,0,1,0,0,-0.8660254037844384,-0.5000000000000004,-0.433883739117558,-0.9009688679024191,1.0,6.123233995736766e-17,12.94,77.58,80,3.451935756058673,7,2.0,2.0,0,8.788898309344878
Ordinary Theft,24/03/2015,18:00,12.941058,77.586061,2015-03-24 18:00:00,18,1,24,3,1,0,0,0,1,0,-1.0,-1.8369701987210297e-16,0.7818314824680298,0.6234898018587336,1.0,6.123233995736766e-17,12.94,77.58,80,3.519917363713201,7,2.0,2.4,0,10.546677971213853
Ordinary Theft,27/03/2015,11:30,12.940924,77.580135,2015-03-27 11:30:00,11,4,27,3,1,0,1,0,0,0,0.258819045102521,-0.9659258262890682,-0.433883739117558,-0.9009688679024191,1.0,6.123233995736766e-17,12.94,77.58,80,3.7539366539258463,7,2.0,1.6,0,7.031118647475903
Ordinary Theft,10/04/2015,13:30,12.952192,77.585083,2015-04-10 13:30:00,13,4,10,4,2,0,0,1,0,0,-0.2588190451025208,-0.9659258262890683,-0.433883739117558,-0.9009688679024191,0.8660254037844387,-0.49999999999999983,12.950000000000001,77.58,7,2.391820301421842,7,2.0,2.0,0,4.1588830833596715
Ordinary Theft,13/04/2015,17:00,12.944089,77.597031,2015-04-13 17:00:00,17,0,13,4,2,0,0,1,0,0,-0.9659258262890683,-0.25881904510252063,0.0,1.0,0.8660254037844387,-0.49999999999999983,12.94,77.59,130,3.0704053035490784,7,2.0,2.0,0,9.750394646402302
Ordinary Theft,01/06/2015,10:30,12.952192,77.585083,2015-06-01 10:30:00,10,0,1,6,2,0,1,0,0,0,0.49999999999999994,-0.8660254037844387,0.0,1.0,1.2246467991473532e-16,-1.0,12.950000000000001,77.58,7,2.391820301421842,7,2.0,1.6,0,3.3271064666877375
Ordinary Theft,15/06/2015,10:30,12.941116,77.587038,2015-06-15 10:30:00,10,0,15,6,2,0,1,0,0,0,0.49999999999999994,-0.8660254037844387,0.0,1.0,1.2246467991473532e-16,-1.0,12.94,77.58,80,3.4873102621134806,7,2.0,1.6,0,7.031118647475903
Ordinary Theft,24/06/2015,14:00,12.939949,77.597681,2015-06-24 14:00:00,14,2,24,6,2,0,0,1,0,0,-0.4999999999999998,-0.8660254037844388,0.9749279121818236,-0.22252093395631434,1.2246467991473532e-16,-1.0,12.93,77.59,58,3.5352314383822314,7,2.0,2.0,0,8.15507488781144
Ordinary Theft,11/07/2015,20:00,12.944009,77.59594,2015-07-11 20:00:00,20,5,11,7,3,1,0,0,1,0,-0.8660254037844386,0.5000000000000001,-0.9749279121818236,-0.2225209339563146,-0.4999999999999998,-0.8660254037844388,12.94,77.59,130,3.071413609439915,7,2.0,2.4,0,11.700473575682762
Ordinary Theft,21/07/2015,20:00,12.948133,77.580087,2015-07-21 20:00:00,20,1,21,7,3,0,0,0,1,0,-0.8660254037844386,0.5000000000000001,0.7818314824680298,0.6234898018587336,-0.4999999999999998,-0.8660254037844388,12.94,77.58,80,3.0466871689803083,7,2.0,2.4,0,10.546677971213853
Ordinary Theft,28/07/2015,18:40,12.944045,77.597072,2015-07-28 18:40:00,18,1,28,7,3,0,0,0,1,0,-1.0,-1.8369701987210297e-16,0.7818314824680298,0.6234898018587336,-0.4999999999999998,-0.8660254037844388,12.94,77.59,130,3.0756636386661027,7,2.0,2.4,0,11.700473575682762
Ordinary Theft,05/09/2015,17:00,12.944045,77.597072,2015-09-05 17:00:00,17,5,5,9,3,1,0,1,0,0,-0.9659258262890683,-0.25881904510252063,-0.9749279121818236,-0.2225209339563146,-1.0,-1.8369701987210297e-16,12.94,77.59,130,3.0756636386661027,7,2.0,2.0,0,9.750394646402302
Ordinary Theft,06/09/2015,10:00,12.951199,77.591267,2015-09-06 10:00:00,10,6,6,9,3,1,1,0,0,0,0.49999999999999994,-0.8660254037844387,-0.7818314824680299,0.6234898018587334,-1.0,-1.8369701987210297e-16,12.950000000000001,77.59,7,2.297059033312457,7,2.0,1.6,0,3.3271064666877375
Ordinary Theft,28/09/2015,13:00,12.944045,77.597072,2015-09-28 13:00:00,13,0,28,9,3,0,0,1,0,0,-0.2588190451025208,-0.9659258262890683,0.0,1.0,-1.0,-1.8369701987210297e-16,12.94,77.59,130,3.0756636386661027,7,2.0,2.0,0,9.750394646402302
Ordinary Theft,06/10/2015,13:30,12.939261,77.585214,2015-10-06 13:30:00,13,1,6,10,4,0,0,1,0,0,-0.2588190451025208,-0.9659258262890683,0.7818314824680298,0.6234898018587336,-0.8660254037844386,0.5000000000000001,12.93,77.58,74,3.73700976974896,7,2.0,2.0,0,8.63497622707262
Ordinary Theft,10/10/2015,10:30,12.938621,77.580436,2015-10-10 10:30:00,10,5,10,10,4,1,1,0,0,0,0.49999999999999994,-0.8660254037844387,-0.9749279121818236,-0.2225209339563146,-0.8660254037844386,0.5000000000000001,12.93,77.58,74,3.9753550286366823,7,2.0,1.6,0,6.907980981658096
Ordinary Theft,30/10/2015,14:00,12.940924,77.580135,2015-10-30 14:00:00,14,4,30,10,4,0,0,1,0,0,-0.4999999999999998,-0.8660254037844388,-0.433883739117558,-0.9009688679024191,-0.8660254037844386,0.5000000000000001,12.94,77.58,80,3.7539366539258463,7,2.0,2.0,0,8.788898309344878
Ordinary Theft,14/11/2015,6:00,12.941866,77.59739,2015-11-14 06:00:00,6,5,14,11,4,1,1,0,0,0,1.0,6.123233995736766e-17,-0.9749279121818236,-0.2225209339563146,-0.5000000000000004,0.8660254037844384,12.94,77.59,130,3.320064387464074,7,2.0,1.6,0,7.800315717121842
Ordinary Theft,17/11/2015,15:00,12.939172,77.594614,2015-11-17 15:00:00,15,1,17,11,4,0,0,1,0,0,-0.7071067811865471,-0.7071067811865479,0.7818314824680298,0.6234898018587336,-0.5000000000000004,0.8660254037844384,12.93,77.59,58,3.6058294003798586,7,2.0,2.0,0,8.15507488781144
Ordinary Theft,24/11/2015,19:00,12.944323,77.587775,2015-11-24 19:00:00,19,1,24,11,4,0,0,0,1,0,-0.9659258262890684,0.2588190451025203,0.7818314824680298,0.6234898018587336,-0.5000000000000004,0.8660254037844384,12.94,77.58,80,3.1219313714024395,7,2.0,2.4,0,10.546677971213853
Ordinary Theft,03/12/2015,11:00,12.944045,77.597072,2015-12-03 11:00:00,11,3,3,12,4,0,1,0,0,0,0.258819045102521,-0.9659258262890682,0.43388373911755823,-0.900968867902419,-2.4492935982947064e-16,1.0,12.94,77.59,130,3.0756636386661027,7,2.0,1.6,0,7.800315717121842
Ordinary Theft,16/12/2015,10:50,12.945061,77.585683,2015-12-16 10:50:00,10,2,16,12,4,0,1,0,0,0,0.49999999999999994,-0.8660254037844387,0.9749279121818236,-0.22252093395631434,-2.4492935982947064e-16,1.0,12.94,77.58,80,3.1051730904610437,7,2.0,1.6,0,7.031118647475903
Ordinary Theft,29/12/2015,19:40,12.940163,77.597572,2015-12-29 19:40:00,19,1,29,12,4,0,0,0,1,0,-0.9659258262890684,0.2588190451025203,0.7818314824680298,0.6234898018587336,-2.4492935982947064e-16,1.0,12.94,77.59,130,3.5104394451042675,7,2.0,2.4,0,11.700473575682762
Ordinary Theft,27/01/2016,10:30,12.950296,77.584509,2016-01-27 10:30:00,10,2,27,1,1,0,1,0,0,0,0.49999999999999994,-0.8660254037844387,0.9749279121818236,-0.22252093395631434,0.49999999999999994,0.8660254037844387,12.950000000000001,77.58,7,2.609094269394517,7,2.0,1.6,0,3.3271064666877375
Ordinary Theft,27/01/2016,14:20,12.938784,77.593298,2016-01-27 14:20:00,14,2,27,1,1,0,0,1,0,0,-0.4999999999999998,-0.8660254037844388,0.9749279121818236,-0.22252093395631434,0.49999999999999994,0.8660254037844387,12.93,77.59,58,3.651699388333528,7,2.0,2.0,0,8.15507488781144
Ordinary Theft,06/02/2016,21:30,12.942789,77.596405,2016-02-06 21:30:00,21,5,6,2,1,1,0,0,1,0,-0.7071067811865477,0.7071067811865474,-0.9749279121818236,-0.2225209339563146,0.8660254037844386,0.5000000000000001,12.94,77.59,130,3.2096024966926207,7,2.0,2.4,0,11.700473575682762
Ordinary Theft,08/02/2016,14:00,12.938784,77.593298,2016-02-08 14:00:00,14,0,8,2,1,0,0,1,0,0,-0.4999999999999998,-0.8660254037844388,0.0,1.0,0.8660254037844386,0.5000000000000001,12.93,77.59,58,3.651699388333528,7,2.0,2.0,0,8.15507488781144
Ordinary Theft,12/02/2016,11:00,12.941866,77.59739,2016-02-12 11:00:00,11,4,12,2,1,0,1,0,0,0,0.258819045102521,-0.9659258262890682,-0.433883739117558,-0.9009688679024191,0.8660254037844386,0.5000000000000001,12.94,77.59,130,3.320064387464074,7,2.0,1.6,0,7.800315717121842
Ordinary Theft,24/03/2016,18:20,12.944045,77.597072,2016-03-24 18:20:00,18,3,24,3,1,0,0,0,1,0,-1.0,-1.8369701987210297e-16,0.43388373911755823,-0.900968867902419,1.0,6.123233995736766e-17,12.94,77.59,130,3.0756636386661027,7,2.0,2.4,0,11.700473575682762
Ordinary Theft,30/03/2016,14:00,12.938889,77.582073,2016-03-30 14:00:00,14,2,30,3,1,0,0,1,0,0,-0.4999999999999998,-0.8660254037844388,0.9749279121818236,-0.22252093395631434,1.0,6.123233995736766e-17,12.93,77.58,74,3.8823561510887603,7,2.0,2.0,0,8.63497622707262
Ordinary Theft,13/04/2016,16:30,12.938784,77.593298,2016-04-13 16:30:00,16,2,13,4,2,0,0,1,0,0,-0.8660254037844384,-0.5000000000000004,0.9749279121818236,-0.22252093395631434,0.8660254037844387,-0.49999999999999983,12.93,77.59,58,3.651699388333528,7,2.0,2.0,0,8.15507488781144
Ordinary Theft,01/05/2016,23:30,12.951485,77.590503,2016-05-01 23:30:00,23,6,1,5,2,1,0,0,0,1,-0.25881904510252157,0.9659258262890681,-0.7818314824680299,0.6234898018587334,0.49999999999999994,-0.8660254037844387,12.950000000000001,77.59,7,2.280320789334047,7,2.0,3.0,0,6.238324625039507
Ordinary Theft,01/05/2016,23:35,12.951485,77.590503,2016-05-01 23:35:00,23,6,1,5,2,1,0,0,0,1,-0.25881904510252157,0.9659258262890681,-0.7818314824680299,0.6234898018587334,0.49999999999999994,-0.8660254037844387,12.950000000000001,77.59,7,2.280320789334047,7,2.0,3.0,0,6.238324625039507
Ordinary Theft,17/06/2016,13:00,12.939261,77.585214,2016-06-17 13:00:00,13,4,17,6,2,0,0,1,0,0,-0.2588190451025208,-0.9659258262890683,-0.433883739117558,-0.9009688679024191,1.2246467991473532e-16,-1.0,12.93,77.58,74,3.73700976974896,7,2.0,2.0,0,8.63497622707262
Ordinary Theft,19/06/2016,17:00,12.946087,77.588063,2016-06-19 17:00:00,17,6,19,6,2,1,0,1,0,0,-0.9659258262890683,-0.25881904510252063,-0.7818314824680299,0.6234898018587334,1.2246467991473532e-16,-1.0,12.94,77.58,80,2.924017675208877,7,2.0,2.0,0,8.788898309344878
Ordinary Theft,20/06/2016,15:00,12.94296,77.585117,2016-06-20 15:00:00,15,0,20,6,2,0,0,1,0,0,-0.7071067811865471,-0.7071067811865479,0.0,1.0,1.2246467991473532e-16,-1.0,12.94,77.58,80,3.3463127042440246,7,2.0,2.0,0,8.788898309344878
Ordinary Theft,26/06/2016,11:45,12.951485,77.590503,2016-06-26 11:45:00,11,6,26,6,2,1,1,0,0,0,0.258819045102521,-0.9659258262890682,-0.7818314824680299,0.6234898018587334,1.2246467991473532e-16,-1.0,12.950000000000001,77.59,7,2.280320789334047,7,2.0,1.6,0,3.3271064666877375
Ordinary Theft,02/07/2016,12:00,12.940373,77.58702,2016-07-02 12:00:00,12,5,2,7,3,1,0,1,0,0,1.2246467991473532e-16,-1.0,-0.9749279121818236,-0.2225209339563146,-0.4999999999999998,-0.8660254037844388,12.94,77.58,80,3.568116431444374,7,2.0,2.0,0,8.788898309344878
Ordinary Theft,27/08/2016,9:30,12.939543,77.584092,2016-08-27 09:30:00,9,5,27,8,3,1,1,0,0,0,0.7071067811865476,-0.7071067811865475,-0.9749279121818236,-0.2225209339563146,-0.8660254037844384,-0.5000000000000004,12.93,77.58,74,3.7420344276440503,7,2.0,1.6,0,6.907980981658096
Ordinary Theft,16/09/2016,11:00,12.940163,77.597572,2016-09-16 11:00:00,11,4,16,9,3,0,1,0,0,0,0.258819045102521,-0.9659258262890682,-0.433883739117558,-0.9009688679024191,-1.0,-1.8369701987210297e-16,12.94,77.59,130,3.5104394451042675,7,2.0,1.6,0,7.800315717121842
Ordinary Theft,24/07/2017,13:00,12.93455,77.588483,2017-07-24 13:00:00,13,0,24,7,3,0,0,1,0,0,-0.2588190451025208,-0.9659258262890683,0.0,1.0,-0.4999999999999998,-0.8660254037844388,12.93,77.58,74,4.172759303977219,7,2.0,2.0,0,8.63497622707262
Ordinary Theft,25/07/2017,17:30,12.935164,77.592701,2017-07-25 17:30:00,17,1,25,7,3,0,0,1,0,0,-0.9659258262890683,-0.25881904510252063,0.7818314824680298,0.6234898018587336,-0.4999999999999998,-0.8660254037844388,12.93,77.59,58,4.05672116749431,7,2.0,2.0,0,8.15507488781144
Ordinary Theft,19/10/2017,18:40,12.947819,77.593877,2017-10-19 18:40:00,18,3,19,10,4,0,0,0,1,0,-1.0,-1.8369701987210297e-16,0.43388373911755823,-0.900968867902419,-0.8660254037844386,0.5000000000000001,12.94,77.59,130,2.6454869160855217,7,2.0,2.4,0,11.700473575682762
Ordinary Theft,27/10/2017,12:30,12.953955,77.585205,2017-10-27 12:30:00,12,4,27,10,4,0,0,1,0,0,1.2246467991473532e-16,-1.0,-0.433883739117558,-0.9009688679024191,-0.8660254037844386,0.5000000000000001,12.950000000000001,77.58,7,2.210432727127041,7,2.0,2.0,0,4.1588830833596715
Ordinary Theft,07/11/2017,15:00,12.941771,77.585065,2017-11-07 15:00:00,15,1,7,11,4,0,0,1,0,0,-0.7071067811865471,-0.7071067811865479,0.7818314824680298,0.6234898018587336,-0.5000000000000004,0.8660254037844384,12.94,77.58,80,3.4740450595420302,7,2.0,2.0,0,8.788898309344878
Ordinary Theft,12/07/2018,13:00,12.947183,77.593819,2018-07-12 13:00:00,13,3,12,7,3,0,0,1,0,0,-0.2588190451025208,-0.9659258262890683,0.43388373911755823,-0.900968867902419,-0.4999999999999998,-0.8660254037844388,12.94,77.59,130,2.716365233089426,7,2.0,2.0,0,9.750394646402302
Ordinary Theft,07/08/2018,13:30,12.942983,77.583639,2018-08-07 13:30:00,13,1,7,8,3,0,0,1,0,0,-0.2588190451025208,-0.9659258262890683,0.7818314824680298,0.6234898018587336,-0.8660254037844384,-0.5000000000000004,12.94,77.58,80,3.396519585587812,7,2.0,2.0,0,8.788898309344878
Ordinary Theft,15/04/2019,13:00,12.94783,77.59203,2019-04-15 13:00:00,13,0,15,4,2,0,0,1,0,0,-0.2588190451025208,-0.9659258262890683,0.0,1.0,0.8660254037844387,-0.49999999999999983,12.94,77.59,130,2.6577346176979337,7,2.0,2.0,0,9.750394646402302
Ordinary Theft,03/09/2019,17:30,12.937991,77.598547,2019-09-03 17:30:00,17,1,3,9,3,0,0,1,0,0,-0.9659258262890683,-0.25881904510252063,0.7818314824680298,0.6234898018587336,-1.0,-1.8369701987210297e-16,12.93,77.59,58,3.7615466014835306,7,2.0,2.0,0,8.15507488781144
Ordinary Theft,21/09/2019,20:00,12.951485,77.590503,2019-09-21 20:00:00,20,5,21,9,3,1,0,0,1,0,-0.8660254037844386,0.5000000000000001,-0.9749279121818236,-0.2225209339563146,-1.0,-1.8369701987210297e-16,12.950000000000001,77.59,7,2.280320789334047,7,2.0,2.4,0,4.990659700031606
Ordinary Theft,25/10/2019,13:30,12.940004,77.597646,2019-10-25 13:30:00,13,4,25,10,4,0,0,1,0,0,-0.2588190451025208,-0.9659258262890683,-0.433883739117558,-0.9009688679024191,-0.8660254037844386,0.5000000000000001,12.94,77.59,130,3.528786307093176,7,2.0,2.0,0,9.750394646402302
Ordinary Theft,29/01/2015,23:45,12.88012131,77.55853349,2015-01-29 23:45:00,23,3,29,1,1,0,0,0,0,1,-0.25881904510252157,0.9659258262890681,0.43388373911755823,-0.900968867902419,0.49999999999999994,0.8660254037844387,12.88,77.55,33,10.897134275837,7,2.0,3.0,0,10.579081573848484
Ordinary Theft,2/2/2015,12:30,12.90716514,77.53591462,2015-02-02 12:30:00,12,0,2,2,1,0,0,1,0,0,1.2246467991473532e-16,-1.0,0.0,1.0,0.8660254037844386,0.5000000000000001,12.9,77.53,36,9.580295128067425,7,2.0,2.0,0,7.221835825288449
Ordinary Theft,21/02/2015,16:15,12.88211726,77.55729374,2015-02-21 16:15:00,16,5,21,2,1,1,0,1,0,0,-0.8660254037844384,-0.5000000000000004,-0.9749279121818236,-0.2225209339563146,0.8660254037844386,0.5000000000000001,12.88,77.55,33,10.740110243061986,7,2.0,2.0,0,7.052721049232323
Ordinary Theft,28/02/2015,16:40,12.9057223,77.53558126,2015-02-28 16:40:00,16,5,28,2,1,1,0,1,0,0,-0.8660254037844384,-0.5000000000000004,-0.9749279121818236,-0.2225209339563146,0.8660254037844386,0.5000000000000001,12.9,77.53,36,9.724600488428452,7,2.0,2.0,0,7.221835825288449
Ordinary Theft,15/03/2015,17:30,12.9069403,77.53562112,2015-03-15 17:30:00,17,6,15,3,1,1,0,1,0,0,-0.9659258262890683,-0.25881904510252063,-0.7818314824680299,0.6234898018587334,1.0,6.123233995736766e-17,12.9,77.53,36,9.620112189388376,7,2.0,2.0,0,7.221835825288449
Ordinary Theft,23/03/2015,18:00,12.91396307,77.53932649,2015-03-23 18:00:00,18,0,23,3,1,0,0,0,1,0,-1.0,-1.8369701987210297e-16,0.0,1.0,1.0,6.123233995736766e-17,12.91,77.53,20,8.772364190450688,7,2.0,2.4,0,7.306853850536215
Ordinary Theft,22/06/2015,18:50,12.8801656,77.57497677,2015-06-22 18:50:00,18,0,22,6,2,0,0,0,1,0,-1.0,-1.8369701987210297e-16,0.0,1.0,1.2246467991473532e-16,-1.0,12.88,77.57000000000001,71,10.387089795988949,7,2.0,2.4,0,10.263998685638532
Ordinary Theft,3/7/2015,10:45,12.91390096,77.55882025,2015-07-03 10:45:00,10,4,3,7,3,0,1,0,0,0,0.49999999999999994,-0.8660254037844387,-0.433883739117558,-0.9009688679024191,-0.4999999999999998,-0.8660254037844388,12.91,77.55,40,7.496507425124797,7,2.0,1.6,0,5.941715306726893
Ordinary Theft,01/10/2015,18:40,12.88276934,77.55756281,2015-10-01 18:40:00,18,3,1,10,4,0,0,0,1,0,-1.0,-1.8369701987210297e-16,0.43388373911755823,-0.900968867902419,-0.8660254037844386,0.5000000000000001,12.88,77.55,33,10.661956556288933,7,2.0,2.4,0,8.463265259078787
Ordinary Theft,17/10/2015,10:45,12.90626715,77.55057549,2015-10-17 10:45:00,10,5,17,10,4,1,1,0,0,0,0.49999999999999994,-0.8660254037844387,-0.9749279121818236,-0.2225209339563146,-0.8660254037844386,0.5000000000000001,12.9,77.55,37,8.691265741256066,7,2.0,1.6,0,5.820137855562217
Ordinary Theft,7/12/2015,11:30,12.88858018,77.56120326,2015-12-07 11:30:00,11,0,7,12,4,0,1,0,0,0,0.258819045102521,-0.9659258262890682,0.0,1.0,-2.4492935982947064e-16,1.0,12.88,77.56,64,9.915562783433487,7,2.0,1.6,0,6.679019631833019
Ordinary Theft,26/11/2015,21:35,12.91147627,77.5401234,2015-11-26 21:35:00,21,3,26,11,4,0,0,0,1,0,-0.7071067811865477,0.7071067811865474,0.43388373911755823,-0.900968867902419,-0.5000000000000004,0.8660254037844384,12.91,77.54,47,8.91899264915303,7,2.0,2.4,0,9.29088242617894
Ordinary Theft,05/12/2015,23:10,12.88316724,77.55773978,2015-12-05 23:10:00,23,5,5,12,4,1,0,0,0,1,-0.25881904510252157,0.9659258262890681,-0.9749279121818236,-0.2225209339563146,-2.4492935982947064e-16,1.0,12.88,77.55,33,10.61374558941124,7,2.0,3.0,0,10.579081573848484
Ordinary Theft,07/12/2015,18:30,12.90645643,77.54253804,2015-12-07 18:30:00,18,0,7,12,4,0,0,0,1,0,-1.0,-1.8369701987210297e-16,0.0,1.0,-2.4492935982947064e-16,1.0,12.9,77.54,56,9.181656033647405,7,2.0,2.4,0,9.70332304280292
Ordinary Theft,07/01/2016,17:40,12.90471042,77.54488816,2016-01-07 17:40:00,17,3,7,1,1,0,0,1,0,0,-0.9659258262890683,-0.25881904510252063,0.43388373911755823,-0.900968867902419,0.49999999999999994,0.8660254037844387,12.9,77.54,56,9.183917372715063,7,2.0,2.0,0,8.0861025356691
Ordinary Theft,23/02/2016,23:15,12.88683128,77.56992868,2016-02-23 23:15:00,23,1,23,2,1,0,0,0,0,1,-0.25881904510252157,0.9659258262890681,0.7818314824680298,0.6234898018587336,0.8660254037844386,0.5000000000000001,12.88,77.56,64,9.797741991673302,7,2.0,3.0,0,12.523161809686911
Ordinary Theft,30/03/2016,8:40,12.88867402,77.57312221,2016-03-30 08:40:00,8,2,30,3,1,0,1,0,0,0,0.8660254037844387,-0.49999999999999983,0.9749279121818236,-0.22252093395631434,1.0,6.123233995736766e-17,12.88,77.57000000000001,71,9.510200238036024,7,2.0,1.6,0,6.842665790425689
Ordinary Theft,1/4/2016,2:45,12.9066004,77.53756529,2016-04-01 02:45:00,2,4,1,4,2,0,0,0,0,1,0.49999999999999994,0.8660254037844387,-0.433883739117558,-0.9009688679024191,0.8660254037844387,-0.49999999999999983,12.9,77.53,36,9.510130170681958,7,2.0,3.0,0,10.832753737932673
Ordinary Theft,12/4/2016,6:00,12.8831411,77.56498259,2016-04-12 06:00:00,6,1,12,4,2,0,1,0,0,0,1.0,6.123233995736766e-17,0.7818314824680298,0.6234898018587336,0.8660254037844387,-0.49999999999999983,12.88,77.56,64,10.346665802017046,7,2.0,1.6,0,6.679019631833019
Ordinary Theft,7/5/2016,11:06,12.8941218,77.5507072,2016-05-07 11:06:00,11,5,7,5,2,1,1,0,0,0,0.258819045102521,-0.9659258262890682,-0.9749279121818236,-0.2225209339563146,0.49999999999999994,-0.8660254037844387,12.89,77.55,56,9.84118807235271,7,2.0,1.6,0,6.468882028535281
Ordinary Theft,23/05/2016,16:00,12.86717163,77.58310043,2016-05-23 16:00:00,16,0,23,5,2,0,0,1,0,0,-0.8660254037844384,-0.5000000000000004,0.0,1.0,0.49999999999999994,-0.8660254037844387,12.86,77.58,63,11.678598399804535,7,2.0,2.0,0,8.317766166719343
Ordinary Theft,23/05/2016,16:30,12.90931424,77.55526626,2016-05-23 16:30:00,16,0,23,5,2,0,0,1,0,0,-0.8660254037844384,-0.5000000000000004,0.0,1.0,0.49999999999999994,-0.8660254037844387,12.9,77.55,37,8.13250237393139,7,2.0,2.0,0,7.275172319452771
Ordinary Theft,31/05/2016,13:50,12.90862205,77.55531561,2016-05-31 13:50:00,13,1,31,5,2,0,0,1,0,0,-0.2588190451025208,-0.9659258262890683,0.7818314824680298,0.6234898018587336,0.49999999999999994,-0.8660254037844387,12.9,77.55,37,8.195373283526452,7,2.0,2.0,0,7.275172319452771
Ordinary Theft,29/08/2016,20:00,12.9057223,77.53558126,2016-08-29 20:00:00,20,0,29,8,3,0,0,0,1,0,-0.8660254037844386,0.5000000000000001,0.0,1.0,-0.8660254037844384,-0.5000000000000004,12.9,77.53,36,9.724600488428452,7,2.0,2.4,0,8.666202990346138
Ordinary Theft,30/08/2016,17:00,12.90519495,77.54491162,2016-08-30 17:00:00,17,1,30,8,3,0,0,1,0,0,-0.9659258262890683,-0.25881904510252063,0.7818314824680298,0.6234898018587336,-0.8660254037844384,-0.5000000000000004,12.9,77.54,56,9.138837049436777,7,2.0,2.0,0,8.0861025356691
Ordinary Theft,27/09/2016,17:00,12.90795681,77.53644101,2016-09-27 17:00:00,17,1,27,9,3,0,0,1,0,0,-0.9659258262890683,-0.25881904510252063,0.7818314824680298,0.6234898018587336,-1.0,-1.8369701987210297e-16,12.9,77.53,36,9.476597349134382,7,2.0,2.0,0,7.221835825288449
Ordinary Theft,06/10/2016,18:30,12.87795004,77.53644101,2016-10-06 18:30:00,18,3,6,10,4,0,0,0,1,0,-1.0,-1.8369701987210297e-16,0.43388373911755823,-0.900968867902419,-0.8660254037844386,0.5000000000000001,12.870000000000001,77.53,25,12.17244765244616,7,2.0,2.4,0,7.819431691251557
Ordinary Theft,21/10/2016,12:45,12.90626715,77.55057549,2016-10-21 12:45:00,12,4,21,10,4,0,0,1,0,0,1.2246467991473532e-16,-1.0,-0.433883739117558,-0.9009688679024191,-0.8660254037844386,0.5000000000000001,12.9,77.55,37,8.691265741256066,7,2.0,2.0,0,7.275172319452771
Ordinary Theft,27/10/2016,18:40,12.87547634,77.57041839,2016-10-27 18:40:00,18,3,27,10,4,0,0,0,1,0,-1.0,-1.8369701987210297e-16,0.43388373911755823,-0.900968867902419,-0.8660254037844386,0.5000000000000001,12.870000000000001,77.57000000000001,14,11.005073268431138,7,2.0,2.4,0,6.499320482645304
Ordinary Theft,27/12/2016,10:40,12.90616017,77.52982708,2016-12-27 10:40:00,10,1,27,12,4,0,1,0,0,0,0.49999999999999994,-0.8660254037844387,0.7818314824680298,0.6234898018587336,-2.4492935982947064e-16,1.0,12.9,77.52,1,10.110519568800845,7,2.0,1.6,0,1.1090354888959124
Ordinary Theft,06/03/2017,14:00,12.91564682,77.53910415,2017-03-06 14:00:00,14,0,6,3,1,0,0,1,0,0,-0.4999999999999998,-0.8660254037844388,0.0,1.0,1.0,6.123233995736766e-17,12.91,77.53,20,8.653242259019295,7,2.0,2.0,0,6.089044875446846
Ordinary Theft,04/04/2017,18:00,12.89537161,77.55032355,2017-04-04 18:00:00,18,1,4,4,2,0,0,0,1,0,-1.0,-1.8369701987210297e-16,0.7818314824680298,0.6234898018587336,0.8660254037844387,-0.49999999999999983,12.89,77.55,56,9.740170449921873,7,2.0,2.4,0,9.70332304280292
Ordinary Theft,14/06/2017,13:45,12.8831411,77.56498259,2017-06-14 13:45:00,13,2,14,6,2,0,0,1,0,0,-0.2588190451025208,-0.9659258262890683,0.9749279121818236,-0.22252093395631434,1.2246467991473532e-16,-1.0,12.88,77.56,64,10.346665802017046,7,2.0,2.0,0,8.348774539791274
Ordinary Theft,15/06/2017,13:00,12.88992359,77.58079977,2017-06-15 13:00:00,13,3,15,6,2,0,0,1,0,0,-0.2588190451025208,-0.9659258262890683,0.43388373911755823,-0.900968867902419,1.2246467991473532e-16,-1.0,12.88,77.58,29,9.204324693509061,7,2.0,2.0,0,6.802394763324311
Ordinary Theft,16/06/2017,11:30,12.904705,77.53011,2017-06-16 11:30:00,11,4,16,6,2,0,1,0,0,0,0.258819045102521,-0.9659258262890682,-0.433883739117558,-0.9009688679024191,1.2246467991473532e-16,-1.0,12.9,77.53,36,10.206584964046952,7,2.0,1.6,0,5.77746866023076
Ordinary Theft,16/07/2017,21:30,12.89977036,77.54865692,2017-07-16 21:30:00,21,6,16,7,3,1,0,0,1,0,-0.7071067811865477,0.7071067811865474,-0.7818314824680299,0.6234898018587334,-0.4999999999999998,-0.8660254037844388,12.89,77.54,35,9.411905814646184,7,2.0,2.4,0,8.600445452294663
Ordinary Theft,19/07/2017,10:00,12.9144943,77.55021425,2017-07-19 10:00:00,10,2,19,7,3,0,1,0,0,0,0.49999999999999994,-0.8660254037844387,0.9749279121818236,-0.22252093395631434,-0.4999999999999998,-0.8660254037844388,12.91,77.55,40,7.966027860339438,7,2.0,1.6,0,5.941715306726893
Ordinary Theft,25/07/2017,15:45,12.88296498,77.55735933,2017-07-25 15:45:00,15,1,25,7,3,0,0,1,0,0,-0.7071067811865471,-0.7071067811865479,0.7818314824680298,0.6234898018587336,-0.4999999999999998,-0.8660254037844388,12.88,77.55,33,10.650142997002153,7,2.0,2.0,0,7.052721049232323
Ordinary Theft,29/07/2017,10:30,12.9057223,77.53558126,2017-07-29 10:30:00,10,5,29,7,3,1,1,0,0,0,0.49999999999999994,-0.8660254037844387,-0.9749279121818236,-0.2225209339563146,-0.4999999999999998,-0.8660254037844388,12.9,77.53,36,9.724600488428452,7,2.0,1.6,0,5.77746866023076
Ordinary Theft,16/08/2017,14:00,12.8831411,77.56498259,2017-08-16 14:00:00,14,2,16,8,3,0,0,1,0,0,-0.4999999999999998,-0.8660254037844388,0.9749279121818236,-0.22252093395631434,-0.8660254037844384,-0.5000000000000004,12.88,77.56,64,10.346665802017046,7,2.0,2.0,0,8.348774539791274
Ordinary Theft,27/08/2017,17:15,12.88376625,77.56842522,2017-08-27 17:15:00,17,6,27,8,3,1,0,1,0,0,-0.9659258262890683,-0.25881904510252063,-0.7818314824680299,0.6234898018587334,-0.8660254037844384,-0.5000000000000004,12.88,77.56,64,10.17029163660703,7,2.0,2.0,0,8.348774539791274
Ordinary Theft,05/10/2017,22:30,12.90958449,77.55159728,2017-10-05 22:30:00,22,3,5,10,4,0,0,0,0,1,-0.5000000000000004,0.8660254037844384,0.43388373911755823,-0.900968867902419,-0.8660254037844386,0.5000000000000001,12.9,77.55,37,8.322863535402108,7,2.0,3.0,0,10.912758479179157
Ordinary Theft,30/11/2017,11:30,12.88316724,77.55773978,2017-11-30 11:30:00,11,3,30,11,4,0,1,0,0,0,0.258819045102521,-0.9659258262890682,0.43388373911755823,-0.900968867902419,-0.5000000000000004,0.8660254037844384,12.88,77.55,33,10.61374558941124,7,2.0,1.6,0,5.642176839385859
Ordinary Theft,6/2/2018,1:30,12.90590517,77.54273152,2018-02-06 01:30:00,1,1,6,2,1,0,0,0,0,1,0.25881904510252074,0.9659258262890683,0.7818314824680298,0.6234898018587336,0.8660254037844386,0.5000000000000001,12.9,77.54,56,9.217293726735024,7,2.0,3.0,0,12.129153803503652
Ordinary Theft,3/5/2018,4:45,12.87638468,77.57835281,2018-05-03 04:45:00,4,3,3,5,2,0,0,0,0,1,0.8660254037844386,0.5000000000000001,0.43388373911755823,-0.900968867902419,0.49999999999999994,-0.8660254037844387,12.870000000000001,77.57000000000001,14,10.732887553715518,7,2.0,3.0,0,8.12415060330663
Ordinary Theft,20/05/2018,7:30,12.90809631,77.54853759,2018-05-20 07:30:00,7,6,20,5,2,1,1,0,0,0,0.9659258262890683,-0.25881904510252063,-0.7818314824680299,0.6234898018587334,0.49999999999999994,-0.8660254037844387,12.9,77.54,56,8.647557128407843,7,2.0,1.6,0,6.468882028535281
Ordinary Theft,5/7/2018,9:30,12.89246857,77.57540769,2018-07-05 09:30:00,9,3,5,7,3,0,1,0,0,0,0.7071067811865476,-0.7071067811865475,0.43388373911755823,-0.900968867902419,-0.4999999999999998,-0.8660254037844388,12.89,77.57000000000001,44,9.041508064947038,7,2.0,1.6,0,6.090659983632512
Ordinary Theft,17/07/2018,8:20,12.89108917,77.55497675,2018-07-17 08:20:00,8,1,17,7,3,0,1,0,0,0,0.8660254037844387,-0.49999999999999983,0.7818314824680298,0.6234898018587336,-0.4999999999999998,-0.8660254037844388,12.89,77.55,56,9.929010430489956,7,2.0,1.6,0,6.468882028535281
Ordinary Theft,3/8/2018,5:30,12.91590055,77.54746898,2018-08-03 05:30:00,5,4,3,8,3,0,0,0,0,1,0.9659258262890683,0.25881904510252074,-0.433883739117558,-0.9009688679024191,-0.8660254037844384,-0.5000000000000004,12.91,77.54,47,8.02786524342381,7,2.0,3.0,0,11.613603032723674
Ordinary Theft,1/10/2018,1:11,12.9057223,77.53558126,2018-10-01 01:11:00,1,0,1,10,4,0,0,0,0,1,0.25881904510252074,0.9659258262890683,0.0,1.0,-0.8660254037844386,0.5000000000000001,12.9,77.53,36,9.724600488428452,7,2.0,3.0,0,10.832753737932673
Ordinary Theft,5/11/2018,10:30,12.9159205,77.53957438,2018-11-05 10:30:00,10,0,5,11,4,0,1,0,0,0,0.49999999999999994,-0.8660254037844387,0.0,1.0,-0.5000000000000004,0.8660254037844384,12.91,77.53,20,8.595956781189559,7,2.0,1.6,0,4.871235900357477
Ordinary Theft,11/12/2018,4:00,12.90657165,77.54644706,2018-12-11 04:00:00,4,1,11,12,4,0,0,0,0,1,0.8660254037844386,0.5000000000000001,0.7818314824680298,0.6234898018587336,-2.4492935982947064e-16,1.0,12.9,77.54,56,8.917206781796445,7,2.0,3.0,0,12.129153803503652
Ordinary Theft,24/01/2019,6:30,12.88293147,77.56708988,2019-01-24 06:30:00,6,3,24,1,1,0,1,0,0,0,1.0,6.123233995736766e-17,0.43388373911755823,-0.900968867902419,0.49999999999999994,0.8660254037844387,12.88,77.56,64,10.30041893889956,7,2.0,1.6,0,6.679019631833019
Ordinary Theft,11/2/2019,4:00,12.9069823,77.552059,2019-02-11 04:00:00,4,0,11,2,1,0,0,0,0,1,0.8660254037844386,0.5000000000000001,0.0,1.0,0.8660254037844386,0.5000000000000001,12.9,77.55,37,8.537022138177283,7,2.0,3.0,0,10.912758479179157
Ordinary Theft,12/2/2019,11:30,12.89900112,77.544042,2019-02-12 11:30:00,11,1,12,2,1,0,1,0,0,0,0.258819045102521,-0.9659258262890682,0.7818314824680298,0.6234898018587336,0.8660254037844386,0.5000000000000001,12.89,77.54,35,9.75644328896847,7,2.0,1.6,0,5.733630301529776
Ordinary Theft,12/2/2019,9:45,12.9069823,77.552059,2019-02-12 09:45:00,9,1,12,2,1,0,1,0,0,0,0.7071067811865476,-0.7071067811865475,0.7818314824680298,0.6234898018587336,0.8660254037844386,0.5000000000000001,12.9,77.55,37,8.537022138177283,7,2.0,1.6,0,5.820137855562217
Ordinary Theft,24/05/2019,5:00,12.90912148,77.55154907,2019-05-24 05:00:00,5,4,24,5,2,0,0,0,0,1,0.9659258262890683,0.25881904510252074,-0.433883739117558,-0.9009688679024191,0.49999999999999994,-0.8660254037844387,12.9,77.55,37,8.36848397008389,7,2.0,3.0,0,10.912758479179157
Ordinary Theft,28/05/2019,10:30,12.91242363,77.54851768,2019-05-28 10:30:00,10,1,28,5,2,0,1,0,0,0,0.49999999999999994,-0.8660254037844387,0.7818314824680298,0.6234898018587336,0.49999999999999994,-0.8660254037844387,12.91,77.54,47,8.260595812428392,7,2.0,1.6,0,6.193921617452626
Ordinary Theft,5/7/2019,11:50,12.9057223,77.53558126,2019-07-05 11:50:00,11,4,5,7,3,0,1,0,0,0,0.258819045102521,-0.9659258262890682,-0.433883739117558,-0.9009688679024191,-0.4999999999999998,-0.8660254037844388,12.9,77.53,36,9.724600488428452,7,2.0,1.6,0,5.77746866023076
Ordinary Theft,4/8/2019,5:30,12.91209012,77.54629226,2019-08-04 05:30:00,5,6,4,8,3,1,0,0,0,1,0.9659258262890683,0.25881904510252074,-0.7818314824680299,0.6234898018587334,-0.8660254037844384,-0.5000000000000004,12.91,77.54,47,8.437644012323252,7,2.0,3.0,0,11.613603032723674
Ordinary Theft,12/9/2019,2:00,12.91119993,77.54670654,2019-09-12 02:00:00,2,3,12,9,3,0,0,0,0,1,0.49999999999999994,0.8660254037844387,0.43388373911755823,-0.900968867902419,-1.0,-1.8369701987210297e-16,12.91,77.54,47,8.487972582076459,7,2.0,3.0,0,11.613603032723674
Ordinary Theft,14/09/2019,7:00,12.91381524,77.54861884,2019-09-14 07:00:00,7,5,14,9,3,1,1,0,0,0,0.9659258262890683,-0.25881904510252063,-0.9749279121818236,-0.2225209339563146,-1.0,-1.8369701987210297e-16,12.91,77.54,47,8.131141484295977,7,2.0,1.6,0,6.193921617452626
Ordinary Theft,17/10/2019,5:30,12.9057223,77.53558126,2019-10-17 05:30:00,5,3,17,10,4,0,0,0,0,1,0.9659258262890683,0.25881904510252074,0.43388373911755823,-0.900968867902419,-0.8660254037844386,0.5000000000000001,12.9,77.53,36,9.724600488428452,7,2.0,3.0,0,10.832753737932673
Ordinary Theft,25/11/2019,9:00,12.8790848983184,77.5678096465074,2019-11-25 09:00:00,9,0,25,11,4,0,1,0,0,0,0.7071067811865476,-0.7071067811865475,0.0,1.0,-0.5000000000000004,0.8660254037844384,12.870000000000001,77.56,25,10.689098870474128,7,2.0,1.6,0,5.212954460834371
Ordinary Theft,15/01/2015,17:00,12.885537,77.542174,2015-01-15 17:00:00,17,3,15,1,1,0,0,1,0,0,-0.9659258262890683,-0.25881904510252063,0.43388373911755823,-0.900968867902419,0.49999999999999994,0.8660254037844387,12.88,77.54,41,11.129352168460159,7,2.0,2.0,0,7.475339236566737
Ordinary Theft,21/01/2015,12:00,12.898497,77.531456,2015-01-21 12:00:00,12,2,21,1,1,0,0,1,0,0,1.2246467991473532e-16,-1.0,0.9749279121818236,-0.22252093395631434,0.49999999999999994,0.8660254037844387,12.89,77.53,8,10.625620513583252,7,2.0,2.0,0,4.394449154672439
Ordinary Theft,04/02/2015,10:30,12.882547,77.531487,2015-02-04 10:30:00,10,2,4,2,1,0,1,0,0,0,0.49999999999999994,-0.8660254037844387,0.9749279121818236,-0.22252093395631434,0.8660254037844386,0.5000000000000001,12.88,77.53,2,12.03493827453802,7,2.0,1.6,0,1.7577796618689758
Ordinary Theft,11/02/2015,10:30,12.894879,77.531497,2015-02-11 10:30:00,10,2,11,2,1,0,1,0,0,0,0.49999999999999994,-0.8660254037844387,0.9749279121818236,-0.22252093395631434,0.8660254037844386,0.5000000000000001,12.89,77.53,8,10.93370637674585,7,2.0,1.6,0,3.5155593237379517
Ordinary Theft,24/04/2015,8:00,12.882457,77.534879,2015-04-24 08:00:00,8,4,24,4,2,0,1,0,0,0,0.8660254037844387,-0.49999999999999983,-0.433883739117558,-0.9009688679024191,0.8660254037844387,-0.49999999999999983,12.88,77.53,2,11.83825341778825,7,2.0,1.6,0,1.7577796618689758
Ordinary Theft,16/06/2015,10:00,12.894578,77.543257,2015-06-16 10:00:00,10,1,16,6,2,0,1,0,0,0,0.49999999999999994,-0.8660254037844387,0.7818314824680298,0.6234898018587336,1.2246467991473532e-16,-1.0,12.89,77.54,35,10.21326659267499,7,2.0,1.6,0,5.733630301529776
Ordinary Theft,21/06/2015,11:30,12.883578,77.546789,2015-06-21 11:30:00,11,6,21,6,2,1,1,0,0,0,0.258819045102521,-0.9659258262890682,-0.7818314824680299,0.6234898018587334,1.2246467991473532e-16,-1.0,12.88,77.54,41,11.074564725075152,7,2.0,1.6,0,5.98027138925339
Ordinary Theft,27/08/2015,20:10,12.897588,77.548791,2015-08-27 20:10:00,20,3,27,8,3,0,0,0,1,0,-0.8660254037844386,0.5000000000000001,0.43388373911755823,-0.900968867902419,-0.8660254037844384,-0.5000000000000004,12.89,77.54,35,9.61119149353945,7,2.0,2.4,0,8.600445452294663
Ordinary Theft,28/08/2015,13:45,12.887891,77.545712,2015-08-28 13:45:00,13,4,28,8,3,0,0,1,0,0,-0.2588190451025208,-0.9659258262890683,-0.433883739117558,-0.9009688679024191,-0.8660254037844384,-0.5000000000000004,12.88,77.54,41,10.71031198390594,7,2.0,2.0,0,7.475339236566737
Ordinary Theft,07/10/2015,19:00,12.882457,77.545721,2015-10-07 19:00:00,19,2,7,10,4,0,0,0,1,0,-0.9659258262890684,0.2588190451025203,0.9749279121818236,-0.22252093395631434,-0.8660254037844386,0.5000000000000001,12.88,77.54,41,11.23897599240365,7,2.0,2.4,0,8.970407083880083
Ordinary Theft,04/11/2015,13:00,12.892457,77.565478,2015-11-04 13:00:00,13,2,4,11,4,0,0,1,0,0,-0.2588190451025208,-0.9659258262890683,0.9749279121818236,-0.22252093395631434,-0.5000000000000004,0.8660254037844384,12.89,77.56,99,9.349125833911401,7,2.0,2.0,0,9.210340371976184
Ordinary Theft,04/11/2015,13:00,12.882487,77.545321,2015-11-04 13:00:00,13,2,4,11,4,0,0,1,0,0,-0.2588190451025208,-0.9659258262890683,0.9749279121818236,-0.22252093395631434,-0.5000000000000004,0.8660254037844384,12.88,77.54,41,11.256536961647303,7,2.0,2.0,0,7.475339236566737
Ordinary Theft,28/11/2015,11:00,12.875461,77.545211,2015-11-28 11:00:00,11,5,28,11,4,1,1,0,0,0,0.258819045102521,-0.9659258262890682,-0.9749279121818236,-0.2225209339563146,-0.5000000000000004,0.8660254037844384,12.870000000000001,77.54,24,11.95537774481677,7,2.0,1.6,0,5.150201319789121
Ordinary Theft,21/12/2015,15:00,12.887489,77.546881,2015-12-21 15:00:00,15,0,21,12,4,0,0,1,0,0,-0.7071067811865471,-0.7071067811865479,0.0,1.0,-2.4492935982947064e-16,1.0,12.88,77.54,41,10.687307057581336,7,2.0,2.0,0,7.475339236566737
Ordinary Theft,16/01/2016,12:30,12.894781,77.546621,2016-01-16 12:30:00,12,5,16,1,1,1,0,1,0,0,1.2246467991473532e-16,-1.0,-0.9749279121818236,-0.2225209339563146,0.49999999999999994,0.8660254037844387,12.89,77.54,35,10.000022201412277,7,2.0,2.0,0,7.16703787691222
Ordinary Theft,25/01/2016,12:40,12.889541,77.546913,2016-01-25 12:40:00,12,0,25,1,1,0,0,1,0,0,1.2246467991473532e-16,-1.0,0.0,1.0,0.49999999999999994,0.8660254037844387,12.88,77.54,41,10.486489457378847,7,2.0,2.0,0,7.475339236566737
Ordinary Theft,04/02/2016,13:00,12.891231,77.543871,2016-02-04 13:00:00,13,3,4,2,1,0,0,1,0,0,-0.2588190451025208,-0.9659258262890683,0.43388373911755823,-0.900968867902419,0.8660254037844386,0.5000000000000001,12.89,77.54,35,10.492306912647315,7,2.0,2.0,0,7.16703787691222
Ordinary Theft,18/02/2016,11:45,12.88381,77.546289,2016-02-18 11:45:00,11,3,18,2,1,0,1,0,0,0,0.258819045102521,-0.9659258262890682,0.43388373911755823,-0.900968867902419,0.8660254037844386,0.5000000000000001,12.88,77.54,41,11.07728022381588,7,2.0,1.6,0,5.98027138925339
Ordinary Theft,25/02/2016,19:00,12.893471,77.552697,2016-02-25 19:00:00,19,3,25,2,1,0,0,0,1,0,-0.9659258262890684,0.2588190451025203,0.43388373911755823,-0.900968867902419,0.8660254037844386,0.5000000000000001,12.89,77.55,56,9.802861784656825,7,2.0,2.4,0,9.70332304280292
Ordinary Theft,29/02/2016,11:00,12.882138,77.542211,2016-02-29 11:00:00,11,0,29,2,1,0,1,0,0,0,0.258819045102521,-0.9659258262890682,0.0,1.0,0.8660254037844386,0.5000000000000001,12.88,77.54,41,11.453996386332571,7,2.0,1.6,0,5.98027138925339
Ordinary Theft,03/03/2016,11:30,12.884451,77.546187,2016-03-03 11:30:00,11,3,3,3,1,0,1,0,0,0,0.258819045102521,-0.9659258262890682,0.43388373911755823,-0.900968867902419,1.0,6.123233995736766e-17,12.88,77.54,41,11.019775962321296,7,2.0,1.6,0,5.98027138925339
Ordinary Theft,20/03/2016,19:00,12.872431,77.546971,2016-03-20 19:00:00,19,6,20,3,1,1,0,0,1,0,-0.9659258262890684,0.2588190451025203,-0.7818314824680299,0.6234898018587334,1.0,6.123233995736766e-17,12.870000000000001,77.54,24,12.175497871678363,7,2.0,2.4,0,7.725301979683681
Ordinary Theft,22/03/2016,14:30,12.88591,77.546978,2016-03-22 14:30:00,14,1,22,3,1,0,0,1,0,0,-0.4999999999999998,-0.8660254037844388,0.7818314824680298,0.6234898018587336,1.0,6.123233995736766e-17,12.88,77.54,41,10.836288396138634,7,2.0,2.0,0,7.475339236566737
Ordinary Theft,14/04/2016,21:40,12.88112,77.54662,2016-04-14 21:40:00,21,3,14,4,2,0,0,0,1,0,-0.7071067811865477,0.7071067811865474,0.43388373911755823,-0.900968867902419,0.8660254037844387,-0.49999999999999983,12.88,77.54,41,11.325252007594921,7,2.0,2.4,0,8.970407083880083
Ordinary Theft,21/05/2016,18:00,12.894257,77.54691,2016-05-21 18:00:00,18,5,21,5,2,1,0,0,1,0,-1.0,-1.8369701987210297e-16,-0.9749279121818236,-0.2225209339563146,0.49999999999999994,-0.8660254037844387,12.89,77.54,35,10.033671906980064,7,2.0,2.4,0,8.600445452294663
Ordinary Theft,19/11/2016,12:00,12.883891,77.5413,2016-11-19 12:00:00,12,5,19,11,4,1,0,1,0,0,1.2246467991473532e-16,-1.0,-0.9749279121818236,-0.2225209339563146,-0.5000000000000004,0.8660254037844384,12.88,77.54,41,11.335103602772952,7,2.0,2.0,0,7.475339236566737
Ordinary Theft,29/12/2016,15:20,12.884496,77.541287,2016-12-29 15:20:00,15,3,29,12,4,0,0,1,0,0,-0.7071067811865471,-0.7071067811865479,0.43388373911755823,-0.900968867902419,-2.4492935982947064e-16,1.0,12.88,77.54,41,11.277991800181224,7,2.0,2.0,0,7.475339236566737
Ordinary Theft,29/01/2017,22:30,12.875419,77.551481,2017-01-29 22:30:00,22,6,29,1,1,1,0,0,0,1,-0.5000000000000004,0.8660254037844384,-0.7818314824680299,0.6234898018587334,0.49999999999999994,0.8660254037844387,12.870000000000001,77.55,12,11.671248570262595,7,2.0,3.0,0,7.694848072384611
Ordinary Theft,04/02/2017,10:00,12.882148,77.545514,2017-02-04 10:00:00,10,5,4,2,1,1,1,0,0,0,0.49999999999999994,-0.8660254037844387,-0.9749279121818236,-0.2225209339563146,0.8660254037844386,0.5000000000000001,12.88,77.54,41,11.279855319942829,7,2.0,1.6,0,5.98027138925339
Ordinary Theft,21/02/2017,14:30,12.885124,77.546871,2017-02-21 14:30:00,14,1,21,2,1,0,0,1,0,0,-0.4999999999999998,-0.8660254037844388,0.7818314824680298,0.6234898018587336,0.8660254037844386,0.5000000000000001,12.88,77.54,41,10.918710195995029,7,2.0,2.0,0,7.475339236566737
Ordinary Theft,21/02/2017,12:00,12.881133,77.541236,2017-02-21 12:00:00,12,1,21,2,1,0,0,1,0,0,1.2246467991473532e-16,-1.0,0.7818314824680298,0.6234898018587336,0.8660254037844386,0.5000000000000001,12.88,77.54,41,11.603493532491058,7,2.0,2.0,0,7.475339236566737
Ordinary Theft,26/08/2017,21:00,12.889457,77.541887,2017-08-26 21:00:00,21,5,26,8,3,1,0,0,1,0,-0.7071067811865477,0.7071067811865474,-0.9749279121818236,-0.2225209339563146,-0.8660254037844384,-0.5000000000000004,12.88,77.54,41,10.773289084409669,7,2.0,2.4,0,8.970407083880083
Ordinary Theft,26/10/2017,15:15,12.881137,77.54461,2017-10-26 15:15:00,15,3,26,10,4,0,0,1,0,0,-0.7071067811865471,-0.7071067811865479,0.43388373911755823,-0.900968867902419,-0.8660254037844386,0.5000000000000001,12.88,77.54,41,11.425245523047431,7,2.0,2.0,0,7.475339236566737
Ordinary Theft,05/12/2017,15:00,12.881497,77.54487,2017-12-05 15:00:00,15,1,5,12,4,0,0,1,0,0,-0.7071067811865471,-0.7071067811865479,0.7818314824680298,0.6234898018587336,-2.4492935982947064e-16,1.0,12.88,77.54,41,11.376639949734294,7,2.0,2.0,0,7.475339236566737
Ordinary Theft,05/12/2017,16:30,12.88991,77.544001,2017-12-05 16:30:00,16,1,5,12,4,0,0,1,0,0,-0.8660254037844384,-0.5000000000000004,0.7818314824680298,0.6234898018587336,-2.4492935982947064e-16,1.0,12.88,77.54,41,10.61041471041743,7,2.0,2.0,0,7.475339236566737
Ordinary Theft,07/12/2017,18:00,12.881128,77.541978,2017-12-07 18:00:00,18,3,7,12,4,0,0,0,1,0,-1.0,-1.8369701987210297e-16,0.43388373911755823,-0.900968867902419,-2.4492935982947064e-16,1.0,12.88,77.54,41,11.564106406863345,7,2.0,2.4,0,8.970407083880083
Ordinary Theft,19/12/2017,13:00,12.876128,77.546139,2017-12-19 13:00:00,13,1,19,12,4,0,0,1,0,0,-0.2588190451025208,-0.9659258262890683,0.7818314824680298,0.6234898018587336,-2.4492935982947064e-16,1.0,12.870000000000001,77.54,24,11.844162637962079,7,2.0,2.0,0,6.437751649736401
Ordinary Theft,05/01/2018,21:00,12.881276,77.5546123,2018-01-05 21:00:00,21,4,5,1,1,0,0,0,1,0,-0.7071067811865477,0.7071067811865474,-0.433883739117558,-0.9009688679024191,0.49999999999999994,0.8660254037844387,12.88,77.55,33,10.938678128853917,7,2.0,2.4,0,8.463265259078787
Ordinary Theft,02/05/2018,10:15,12.894438,77.559917,2018-05-02 10:15:00,10,2,2,5,2,0,1,0,0,0,0.49999999999999994,-0.8660254037844387,0.9749279121818236,-0.22252093395631434,0.49999999999999994,-0.8660254037844387,12.89,77.55,56,9.367226316250072,7,2.0,1.6,0,6.468882028535281
Ordinary Theft,20/06/2018,13:00,12.884297,77.543971,2018-06-20 13:00:00,13,2,20,6,2,0,0,1,0,0,-0.2588190451025208,-0.9659258262890683,0.9749279121818236,-0.22252093395631434,1.2246467991473532e-16,-1.0,12.88,77.54,41,11.151031700443484,7,2.0,2.0,0,7.475339236566737
Ordinary Theft,29/10/2018,14:00,12.894781,77.546913,2018-10-29 14:00:00,14,0,29,10,4,0,0,1,0,0,-0.4999999999999998,-0.8660254037844388,0.0,1.0,-0.8660254037844386,0.5000000000000001,12.89,77.54,35,9.98360432052831,7,2.0,2.0,0,7.16703787691222
Ordinary Theft,11/11/2018,13:00,12.884331,77.549177,2018-11-11 13:00:00,13,6,11,11,4,1,0,1,0,0,-0.2588190451025208,-0.9659258262890683,-0.7818314824680299,0.6234898018587334,-0.5000000000000004,0.8660254037844384,12.88,77.54,41,10.88112356602151,7,2.0,2.0,0,7.475339236566737
Ordinary Theft,30/12/2018,10:00,12.89771,77.551288,2018-12-30 10:00:00,10,6,30,12,4,1,1,0,0,0,0.49999999999999994,-0.8660254037844387,-0.7818314824680299,0.6234898018587334,-2.4492935982947064e-16,1.0,12.89,77.55,56,9.462465624926702,7,2.0,1.6,0,6.468882028535281
Ordinary Theft,06/07/2018,18:30,12.886114,77.554697,2018-07-06 18:30:00,18,4,6,7,3,0,0,0,1,0,-1.0,-1.8369701987210297e-16,-0.433883739117558,-0.9009688679024191,-0.4999999999999998,-0.8660254037844388,12.88,77.55,33,10.443090556287345,7,2.0,2.4,0,8.463265259078787
Ordinary Theft,04/03/2019,23:30,12.88921,77.546991,2019-03-04 23:30:00,23,0,4,3,1,0,0,0,0,1,-0.25881904510252157,0.9659258262890681,0.0,1.0,1.0,6.123233995736766e-17,12.88,77.54,41,10.51438135340216,7,2.0,3.0,0,11.213008854850106
Ordinary Theft,27/06/2019,14:30,12.879241,77.54813,2019-06-27 14:30:00,14,3,27,6,2,0,0,1,0,0,-0.4999999999999998,-0.8660254037844388,0.43388373911755823,-0.900968867902419,1.2246467991473532e-16,-1.0,12.870000000000001,77.54,24,11.438277353101789,7,2.0,2.0,0,6.437751649736401
Ordinary Theft,13/08/2019,17:00,12.88411,77.548118,2019-08-13 17:00:00,17,1,13,8,3,0,0,1,0,0,-0.9659258262890683,-0.25881904510252063,0.7818314824680298,0.6234898018587336,-0.8660254037844384,-0.5000000000000004,12.88,77.54,41,10.955343732653295,7,2.0,2.0,0,7.475339236566737
Ordinary Theft,26/10/2019,14:45,12.897001,77.55416,2019-10-26 14:45:00,14,5,26,10,4,1,0,1,0,0,-0.4999999999999998,-0.8660254037844388,-0.9749279121818236,-0.2225209339563146,-0.8660254037844386,0.5000000000000001,12.89,77.55,56,9.381629030699726,7,2.0,2.0,0,8.0861025356691
Ordinary Theft,30/10/2019,19:00,12.87161,77.54891,2019-10-30 19:00:00,19,2,30,10,4,0,0,0,1,0,-0.9659258262890684,0.2588190451025203,0.9749279121818236,-0.22252093395631434,-0.8660254037844386,0.5000000000000001,12.870000000000001,77.54,24,12.171241785117148,7,2.0,2.4,0,7.725301979683681
Ordinary Theft,07/01/2017,12:30,12.861944,77.589989,2017-01-07 12:30:00,12,5,7,1,1,1,0,1,0,0,1.2246467991473532e-16,-1.0,-0.9749279121818236,-0.2225209339563146,0.49999999999999994,0.8660254037844387,12.86,77.58,63,12.20342777915458,7,2.0,2.0,0,8.317766166719343
Ordinary Theft,07/03/2017,17:00,12.881514,77.565853,2017-03-07 17:00:00,17,1,7,3,1,0,0,1,0,0,-0.9659258262890683,-0.25881904510252063,0.7818314824680298,0.6234898018587336,1.0,6.123233995736766e-17,12.88,77.56,64,10.49041635710204,7,2.0,2.0,0,8.348774539791274
Ordinary Theft,18/03/2017,19:00,12.885954,77.575194,2017-03-18 19:00:00,19,5,18,3,1,1,0,0,1,0,-0.9659258262890684,0.2588190451025203,-0.9749279121818236,-0.2225209339563146,1.0,6.123233995736766e-17,12.88,77.57000000000001,71,9.752865147663444,7,2.0,2.4,0,10.263998685638532
Ordinary Theft,20/04/2017,16:00,12.88365,77.567108,2017-04-20 16:00:00,16,3,20,4,2,0,0,1,0,0,-0.8660254037844384,-0.5000000000000004,0.43388373911755823,-0.900968867902419,0.8660254037844387,-0.49999999999999983,12.88,77.56,64,10.223394592473078,7,2.0,2.0,0,8.348774539791274
Ordinary Theft,02/07/2017,13:40,12.8890144,77.581716,2017-07-02 13:40:00,13,6,2,7,3,1,0,1,0,0,-0.2588190451025208,-0.9659258262890683,-0.7818314824680299,0.6234898018587334,-0.4999999999999998,-0.8660254037844388,12.88,77.58,29,9.288648798707852,7,2.0,2.0,0,6.802394763324311
Ordinary Theft,18/08/2017,20:45,12.854933,77.588491,2017-08-18 20:45:00,20,4,18,8,3,0,0,0,1,0,-0.8660254037844386,0.5000000000000001,-0.433883739117558,-0.9009688679024191,-0.8660254037844384,-0.5000000000000004,12.85,77.58,11,12.98966404278612,7,2.0,2.4,0,5.9637759594912
Ordinary Theft,22/08/2017,15:40,12.882116,77.574506,2017-08-22 15:40:00,15,1,22,8,3,0,0,1,0,0,-0.7071067811865471,-0.7071067811865479,0.7818314824680298,0.6234898018587336,-0.8660254037844384,-0.5000000000000004,12.88,77.57000000000001,71,10.185691056223675,7,2.0,2.0,0,8.55333223803211
Ordinary Theft,20/09/2017,18:15,12.88207,77.57099,2017-09-20 18:15:00,18,2,20,9,3,0,0,0,1,0,-1.0,-1.8369701987210297e-16,0.9749279121818236,-0.22252093395631434,-1.0,-1.8369701987210297e-16,12.88,77.57000000000001,71,10.278860689258703,7,2.0,2.4,0,10.263998685638532
Ordinary Theft,06/10/2017,18:25,12.884707,77.55162,2017-10-06 18:25:00,18,4,6,10,4,0,0,0,1,0,-1.0,-1.8369701987210297e-16,-0.433883739117558,-0.9009688679024191,-0.8660254037844386,0.5000000000000001,12.88,77.55,33,10.726252712538107,7,2.0,2.4,0,8.463265259078787
Ordinary Theft,07/10/2017,7:35,12.892301,77.570581,2017-10-07 07:35:00,7,5,7,10,4,1,1,0,0,0,0.9659258262890683,-0.25881904510252063,-0.9749279121818236,-0.2225209339563146,-0.8660254037844386,0.5000000000000001,12.89,77.57000000000001,44,9.193843596093943,7,2.0,1.6,0,6.090659983632512
Ordinary Theft,01/12/2017,14:00,12.86121,77.579766,2017-12-01 14:00:00,14,4,1,12,4,0,0,1,0,0,-0.4999999999999998,-0.8660254037844388,-0.433883739117558,-0.9009688679024191,-2.4492935982947064e-16,1.0,12.86,77.57000000000001,10,12.379648762500985,7,2.0,2.0,0,4.795790545596741
Ordinary Theft,08/12/2017,19:15,12.884707,77.55162,2017-12-08 19:15:00,19,4,8,12,4,0,0,0,1,0,-0.9659258262890684,0.2588190451025203,-0.433883739117558,-0.9009688679024191,-2.4492935982947064e-16,1.0,12.88,77.55,33,10.726252712538107,7,2.0,2.4,0,8.463265259078787
Ordinary Theft,14/01/2018,10:00,12.884587,77.569498,2018-01-14 10:00:00,10,6,14,1,1,1,1,0,0,0,0.49999999999999994,-0.8660254037844387,-0.7818314824680299,0.6234898018587334,0.49999999999999994,0.8660254037844387,12.88,77.56,64,10.050589967289454,7,2.0,1.6,0,6.679019631833019
Ordinary Theft,10/02/2018,19:30,12.845696,77.584186,2018-02-10 19:30:00,19,5,10,2,1,1,0,0,1,0,-0.9659258262890684,0.2588190451025203,-0.9749279121818236,-0.2225209339563146,0.8660254037844386,0.5000000000000001,12.84,77.58,23,14.045312911778181,7,2.0,2.4,0,7.627329192835069
Ordinary Theft,12/02/2018,20:20,12.845696,77.584186,2018-02-12 20:20:00,20,0,12,2,1,0,0,0,1,0,-0.8660254037844386,0.5000000000000001,0.0,1.0,0.8660254037844386,0.5000000000000001,12.84,77.58,23,14.045312911778181,7,2.0,2.4,0,7.627329192835069
Ordinary Theft,14/02/2018,11:30,12.883196,77.566016,2018-02-14 11:30:00,11,2,14,2,1,0,1,0,0,0,0.258819045102521,-0.9659258262890682,0.9749279121818236,-0.22252093395631434,0.8660254037844386,0.5000000000000001,12.88,77.56,64,10.306648005299103,7,2.0,1.6,0,6.679019631833019
Ordinary Theft,07/03/2018,18:30,12.891883,77.5783,2018-03-07 18:30:00,18,2,7,3,1,0,0,0,1,0,-1.0,-1.8369701987210297e-16,0.9749279121818236,-0.22252093395631434,1.0,6.123233995736766e-17,12.89,77.57000000000001,44,9.03843346299311,7,2.0,2.4,0,9.135989975448767
Ordinary Theft,21/03/2018,12:00,12.869362,77.581945,2018-03-21 12:00:00,12,2,21,3,1,0,0,1,0,0,1.2246467991473532e-16,-1.0,0.9749279121818236,-0.22252093395631434,1.0,6.123233995736766e-17,12.86,77.58,63,11.450783556081108,7,2.0,2.0,0,8.317766166719343
Ordinary Theft,24/05/2018,11:00,12.87046,77.557984,2018-05-24 11:00:00,11,3,24,5,2,0,1,0,0,0,0.258819045102521,-0.9659258262890682,0.43388373911755823,-0.900968867902419,0.49999999999999994,-0.8660254037844387,12.870000000000001,77.55,12,11.925879280821954,7,2.0,1.6,0,4.103918971938459
Ordinary Theft,10/07/2018,11:00,12.89046,77.567984,2018-07-10 11:00:00,11,1,10,7,3,0,1,0,0,0,0.258819045102521,-0.9659258262890682,0.7818314824680298,0.6234898018587336,-0.4999999999999998,-0.8660254037844388,12.89,77.56,99,9.47223894686326,7,2.0,1.6,0,7.368272297580948
Ordinary Theft,23/07/2018,12:00,12.856442,77.589423,2018-07-23 12:00:00,12,0,23,7,3,0,0,1,0,0,1.2246467991473532e-16,-1.0,0.0,1.0,-0.4999999999999998,-0.8660254037844388,12.85,77.58,11,12.817272662465143,7,2.0,2.0,0,4.969813299576001
Ordinary Theft,30/10/2018,19:05,12.866,77.580872,2018-10-30 19:05:00,19,1,30,10,4,0,0,0,1,0,-0.9659258262890684,0.2588190451025203,0.7818314824680298,0.6234898018587336,-0.8660254037844386,0.5000000000000001,12.86,77.58,63,11.83607089863298,7,2.0,2.4,0,9.981319400063212
Ordinary Theft,18/12/2018,11:00,12.885353,77.567029,2018-12-18 11:00:00,11,1,18,12,4,0,1,0,0,0,0.258819045102521,-0.9659258262890682,0.7818314824680298,0.6234898018587336,-2.4492935982947064e-16,1.0,12.88,77.56,64,10.044942158890958,7,2.0,1.6,0,6.679019631833019
Ordinary Theft,11/03/2019,15:00,12.885016,77.577965,2019-03-11 15:00:00,15,0,11,3,1,0,0,1,0,0,-0.7071067811865471,-0.7071067811865479,0.0,1.0,1.0,6.123233995736766e-17,12.88,77.57000000000001,71,9.79504274908524,7,2.0,2.0,0,8.55333223803211
Ordinary Theft,21/04/2019,14:00,12.885887,77.566884,2019-04-21 14:00:00,14,6,21,4,2,1,0,1,0,0,-0.4999999999999998,-0.8660254037844388,-0.7818314824680299,0.6234898018587334,0.8660254037844387,-0.49999999999999983,12.88,77.56,64,9.992978972300659,7,2.0,2.0,0,8.348774539791274
Ordinary Theft,03/07/2019,19:00,12.884592,77.551678,2019-07-03 19:00:00,19,2,3,7,3,0,0,0,1,0,-0.9659258262890684,0.2588190451025203,0.9749279121818236,-0.22252093395631434,-0.4999999999999998,-0.8660254037844388,12.88,77.55,33,10.735048064145312,7,2.0,2.4,0,8.463265259078787
Ordinary Theft,10/08/2019,18:30,12.888167,77.570945,2019-08-10 18:30:00,18,5,10,8,3,1,0,0,1,0,-1.0,-1.8369701987210297e-16,-0.9749279121818236,-0.2225209339563146,-0.8660254037844384,-0.5000000000000004,12.88,77.57000000000001,71,9.625016716757788,7,2.0,2.4,0,10.263998685638532
Ordinary Theft,21/09/2019,13:00,12.887851,77.573581,2019-09-21 13:00:00,13,5,21,9,3,1,0,1,0,0,-0.2588190451025208,-0.9659258262890683,-0.9749279121818236,-0.2225209339563146,-1.0,-1.8369701987210297e-16,12.88,77.57000000000001,71,9.58702377835587,7,2.0,2.0,0,8.55333223803211
Ordinary Theft,1/5/2015,14:30,12.8996965673904,77.5716115576741,2015-05-01 14:30:00,14,4,1,5,2,0,0,1,0,0,-0.4999999999999998,-0.8660254037844388,-0.433883739117558,-0.9009688679024191,0.49999999999999994,-0.8660254037844387,12.89,77.57000000000001,44,8.374454200327651,7,2.0,2.0,0,7.613324979540639
Ordinary Theft,1/7/2015,13:00,12.8928133912158,77.5666300513369,2015-07-01 13:00:00,13,2,1,7,3,0,0,1,0,0,-0.2588190451025208,-0.9659258262890683,0.9749279121818236,-0.22252093395631434,-0.4999999999999998,-0.8660254037844388,12.89,77.56,99,9.270259607280016,7,2.0,2.0,0,9.210340371976184
Ordinary Theft,4/3/2015,14:15,12.9008927627643,77.5698813716385,2015-03-04 14:15:00,14,2,4,3,1,0,0,1,0,0,-0.4999999999999998,-0.8660254037844388,0.9749279121818236,-0.22252093395631434,1.0,6.123233995736766e-17,12.9,77.56,89,8.306121321315375,7,2.0,2.0,0,8.99961934066053
Ordinary Theft,5/11/2015,11:30,12.9076945341477,77.5719852228203,2015-11-05 11:30:00,11,3,5,11,4,0,1,0,0,0,0.258819045102521,-0.9659258262890682,0.43388373911755823,-0.900968867902419,-0.5000000000000004,0.8660254037844384,12.9,77.57000000000001,96,7.516721537423073,7,2.0,1.6,0,7.319537565605413
Ordinary Theft,6/9/2015,12:45,12.9084899772541,77.5597687026855,2015-09-06 12:45:00,12,6,6,9,3,1,0,1,0,0,1.2246467991473532e-16,-1.0,-0.7818314824680299,0.6234898018587334,-1.0,-1.8369701987210297e-16,12.9,77.55,37,7.968307059889,7,2.0,2.0,0,7.275172319452771
Ordinary Theft,9/1/2015,15:00,12.8966729945995,77.5607513795297,2015-01-09 15:00:00,15,4,9,1,1,0,0,1,0,0,-0.7071067811865471,-0.7071067811865479,-0.433883739117558,-0.9009688679024191,0.49999999999999994,0.8660254037844387,12.89,77.56,99,9.103315989734341,7,2.0,2.0,0,9.210340371976184
Ordinary Theft,12/4/2015,15:30,12.8928133912158,77.5666300513369,2015-04-12 15:30:00,15,6,12,4,2,1,0,1,0,0,-0.7071067811865471,-0.7071067811865479,-0.7818314824680299,0.6234898018587334,0.8660254037844387,-0.49999999999999983,12.89,77.56,99,9.270259607280016,7,2.0,2.0,0,9.210340371976184
Ordinary Theft,12/8/2015,10:00,12.9094534210642,77.5650951734528,2015-08-12 10:00:00,10,2,12,8,3,0,1,0,0,0,0.49999999999999994,-0.8660254037844387,0.9749279121818236,-0.22252093395631434,-0.8660254037844384,-0.5000000000000004,12.9,77.56,89,7.614275558359293,7,2.0,1.6,0,7.199695472528425
Ordinary Theft,14/01/2016,13:00,12.9072110220065,77.569757509609,2016-01-14 13:00:00,13,3,14,1,1,0,0,1,0,0,-0.2588190451025208,-0.9659258262890683,0.43388373911755823,-0.900968867902419,0.49999999999999994,0.8660254037844387,12.9,77.56,89,7.649164911130182,7,2.0,2.0,0,8.99961934066053
Ordinary Theft,25/01/2016,10:30,12.9166716189819,77.5734553925553,2016-01-25 10:30:00,10,0,25,1,1,0,1,0,0,0,0.49999999999999994,-0.8660254037844387,0.0,1.0,0.49999999999999994,0.8660254037844387,12.91,77.57000000000001,82,6.52344522530072,7,2.0,1.6,0,7.070144972474558
Ordinary Theft,03/02/2016,21:30,12.9011494733062,77.5706465675149,2016-02-03 21:30:00,21,2,3,2,1,0,0,0,1,0,-0.7071067811865477,0.7071067811865474,0.9749279121818236,-0.22252093395631434,0.8660254037844386,0.5000000000000001,12.9,77.57000000000001,96,8.252647381646744,7,2.0,2.4,0,10.979306348408118
Ordinary Theft,07/02/2016,21:15,12.9058822540435,77.5714810872207,2016-02-07 21:15:00,21,6,7,2,1,1,0,0,1,0,-0.7071067811865477,0.7071067811865474,-0.7818314824680299,0.6234898018587334,0.8660254037844386,0.5000000000000001,12.9,77.57000000000001,96,7.7250546936285165,7,2.0,2.4,0,10.979306348408118
Ordinary Theft,19/02/2016,15:45,12.9124182556892,77.5641048370764,2016-02-19 15:45:00,15,4,19,2,1,0,0,1,0,0,-0.7071067811865471,-0.7071067811865479,-0.433883739117558,-0.9009688679024191,0.8660254037844386,0.5000000000000001,12.91,77.56,126,7.363914550066436,7,2.0,2.0,0,9.688374172917182
Ordinary Theft,04/03/2016,14:20,12.8928133912158,77.5666300513369,2016-03-04 14:20:00,14,4,4,3,1,0,0,1,0,0,-0.4999999999999998,-0.8660254037844388,-0.433883739117558,-0.9009688679024191,1.0,6.123233995736766e-17,12.89,77.56,99,9.270259607280016,7,2.0,2.0,0,9.210340371976184
Ordinary Theft,04/03/2016,14:35,12.8928133912158,77.5666300513369,2016-03-04 14:35:00,14,4,4,3,1,0,0,1,0,0,-0.4999999999999998,-0.8660254037844388,-0.433883739117558,-0.9009688679024191,1.0,6.123233995736766e-17,12.89,77.56,99,9.270259607280016,7,2.0,2.0,0,9.210340371976184
Ordinary Theft,21/03/2016,13:15,12.9021874622456,77.5726241709647,2016-03-21 13:15:00,13,0,21,3,1,0,0,1,0,0,-0.2588190451025208,-0.9659258262890683,0.0,1.0,1.0,6.123233995736766e-17,12.9,77.57000000000001,96,8.077400297596036,7,2.0,2.0,0,9.149421957006766
Ordinary Theft,18/04/2016,9:10,12.8985572712756,77.5691445545836,2016-04-18 09:10:00,9,0,18,4,2,0,1,0,0,0,0.7071067811865476,-0.7071067811865475,0.0,1.0,0.8660254037844387,-0.49999999999999983,12.89,77.56,99,8.577700343714186,7,2.0,1.6,0,7.368272297580948
Ordinary Theft,16/05/2016,20:00,12.9026072787272,77.5614887435773,2016-05-16 20:00:00,20,0,16,5,2,0,0,0,1,0,-0.8660254037844386,0.5000000000000001,0.0,1.0,0.49999999999999994,-0.8660254037844387,12.9,77.56,89,8.469374060741798,7,2.0,2.4,0,10.799543208792636
Ordinary Theft,18/06/2016,21:30,12.9106184436134,77.5668939212685,2016-06-18 21:30:00,21,5,18,6,2,1,0,0,1,0,-0.7071067811865477,0.7071067811865474,-0.9749279121818236,-0.2225209339563146,1.2246467991473532e-16,-1.0,12.91,77.56,126,7.415857911778103,7,2.0,2.4,0,11.626049007500619
Ordinary Theft,26/06/2016,10:00,12.9076945341477,77.5719852228203,2016-06-26 10:00:00,10,6,26,6,2,1,1,0,0,0,0.49999999999999994,-0.8660254037844387,-0.7818314824680299,0.6234898018587334,1.2246467991473532e-16,-1.0,12.9,77.57000000000001,96,7.516721537423073,7,2.0,1.6,0,7.319537565605413
Ordinary Theft,11/07/2016,13:30,12.8928133912158,77.5666300513369,2016-07-11 13:30:00,13,0,11,7,3,0,0,1,0,0,-0.2588190451025208,-0.9659258262890683,0.0,1.0,-0.4999999999999998,-0.8660254037844388,12.89,77.56,99,9.270259607280016,7,2.0,2.0,0,9.210340371976184
Ordinary Theft,18/07/2016,14:00,12.9045264921368,77.5661519120365,2016-07-18 14:00:00,14,0,18,7,3,0,0,1,0,0,-0.4999999999999998,-0.8660254037844388,0.0,1.0,-0.4999999999999998,-0.8660254037844388,12.9,77.56,89,8.070315318313014,7,2.0,2.0,0,8.99961934066053
Ordinary Theft,28/09/2016,17:30,12.9020804066762,77.5651518006063,2016-09-28 17:30:00,17,2,28,9,3,0,0,1,0,0,-0.9659258262890683,-0.25881904510252063,0.9749279121818236,-0.22252093395631434,-1.0,-1.8369701987210297e-16,12.9,77.56,89,8.36308980106048,7,2.0,2.0,0,8.99961934066053
Ordinary Theft,07/10/2016,14:00,12.9021874622456,77.5726241709647,2016-10-07 14:00:00,14,4,7,10,4,0,0,1,0,0,-0.4999999999999998,-0.8660254037844388,-0.433883739117558,-0.9009688679024191,-0.8660254037844386,0.5000000000000001,12.9,77.57000000000001,96,8.077400297596036,7,2.0,2.0,0,9.149421957006766
Ordinary Theft,11/10/2016,13:00,12.9124182556892,77.5641048370764,2016-10-11 13:00:00,13,1,11,10,4,0,0,1,0,0,-0.2588190451025208,-0.9659258262890683,0.7818314824680298,0.6234898018587336,-0.8660254037844386,0.5000000000000001,12.91,77.56,126,7.363914550066436,7,2.0,2.0,0,9.688374172917182
Ordinary Theft,15/10/2016,11:30,12.8928133912158,77.5666300513369,2016-10-15 11:30:00,11,5,15,10,4,1,1,0,0,0,0.258819045102521,-0.9659258262890682,-0.9749279121818236,-0.2225209339563146,-0.8660254037844386,0.5000000000000001,12.89,77.56,99,9.270259607280016,7,2.0,1.6,0,7.368272297580948
Ordinary Theft,21/10/2016,23:40,12.9085203452405,77.5725265251381,2016-10-21 23:40:00,23,4,21,10,4,0,0,0,0,1,-0.25881904510252157,0.9659258262890681,-0.433883739117558,-0.9009688679024191,-0.8660254037844386,0.5000000000000001,12.9,77.57000000000001,96,7.410829743574645,7,2.0,3.0,0,13.724132935510148
Ordinary Theft,31/10/2016,15:00,12.9085203452405,77.5725265251381,2016-10-31 15:00:00,15,0,31,10,4,0,0,1,0,0,-0.7071067811865471,-0.7071067811865479,0.0,1.0,-0.8660254037844386,0.5000000000000001,12.9,77.57000000000001,96,7.410829743574645,7,2.0,2.0,0,9.149421957006766
Ordinary Theft,14/12/2016,17:20,12.895284445528,77.5662128659953,2016-12-14 17:20:00,17,2,14,12,4,0,0,1,0,0,-0.9659258262890683,-0.25881904510252063,0.9749279121818236,-0.22252093395631434,-2.4492935982947064e-16,1.0,12.89,77.56,99,9.026347130844886,7,2.0,2.0,0,9.210340371976184
Ordinary Theft,15/12/2016,15:00,12.898358820125,77.5613959011009,2016-12-15 15:00:00,15,3,15,12,4,0,0,1,0,0,-0.7071067811865471,-0.7071067811865479,0.43388373911755823,-0.900968867902419,-2.4492935982947064e-16,1.0,12.89,77.56,99,8.903609927612983,7,2.0,2.0,0,9.210340371976184
Ordinary Theft,23/12/2016,14:00,12.8928133912158,77.5666300513369,2016-12-23 14:00:00,14,4,23,12,4,0,0,1,0,0,-0.4999999999999998,-0.8660254037844388,-0.433883739117558,-0.9009688679024191,-2.4492935982947064e-16,1.0,12.89,77.56,99,9.270259607280016,7,2.0,2.0,0,9.210340371976184
Ordinary Theft,1/6/2017,16:00,12.9166716189819,77.5734553925553,2017-06-01 16:00:00,16,3,1,6,2,0,0,1,0,0,-0.8660254037844384,-0.5000000000000004,0.43388373911755823,-0.900968867902419,1.2246467991473532e-16,-1.0,12.91,77.57000000000001,82,6.52344522530072,7,2.0,2.0,0,8.837681215593197
Ordinary Theft,1/12/2017,14:15,12.8928133912158,77.5666300513369,2017-12-01 14:15:00,14,4,1,12,4,0,0,1,0,0,-0.4999999999999998,-0.8660254037844388,-0.433883739117558,-0.9009688679024191,-2.4492935982947064e-16,1.0,12.89,77.56,99,9.270259607280016,7,2.0,2.0,0,9.210340371976184
Ordinary Theft,4/7/2017,3:00,12.8928133912158,77.5666300513369,2017-07-04 03:00:00,3,1,4,7,3,0,0,0,0,1,0.7071067811865475,0.7071067811865476,0.7818314824680298,0.6234898018587336,-0.4999999999999998,-0.8660254037844388,12.89,77.56,99,9.270259607280016,7,2.0,3.0,0,13.815510557964275
Ordinary Theft,4/11/2017,14:00,12.898358820125,77.5613959011009,2017-11-04 14:00:00,14,5,4,11,4,1,0,1,0,0,-0.4999999999999998,-0.8660254037844388,-0.9749279121818236,-0.2225209339563146,-0.5000000000000004,0.8660254037844384,12.89,77.56,99,8.903609927612983,7,2.0,2.0,0,9.210340371976184
Ordinary Theft,12/6/2018,22:00,12.9109359450741,77.5646696875901,2018-06-12 22:00:00,22,1,12,6,2,0,0,0,0,1,-0.5000000000000004,0.8660254037844384,0.7818314824680298,0.6234898018587336,1.2246467991473532e-16,-1.0,12.91,77.56,126,7.484848783116466,7,2.0,3.0,0,14.532561259375774
Ordinary Theft,12/8/2018,12:30,12.8999136414243,77.5724909471076,2018-08-12 12:30:00,12,6,12,8,3,1,0,1,0,0,1.2246467991473532e-16,-1.0,-0.7818314824680299,0.6234898018587334,-0.8660254037844384,-0.5000000000000004,12.89,77.57000000000001,44,8.32347958797541,7,2.0,2.0,0,7.613324979540639
Ordinary Theft,1/11/2019,17:20,12.8928133912158,77.5666300513369,2019-11-01 17:20:00,17,4,1,11,4,0,0,1,0,0,-0.9659258262890683,-0.25881904510252063,-0.433883739117558,-0.9009688679024191,-0.5000000000000004,0.8660254037844384,12.89,77.56,99,9.270259607280016,7,2.0,2.0,0,9.210340371976184
Ordinary Theft,2/2/2019,19:00,12.898358820125,77.5613959011009,2019-02-02 19:00:00,19,5,2,2,1,1,0,0,1,0,-0.9659258262890684,0.2588190451025203,-0.9749279121818236,-0.2225209339563146,0.8660254037844386,0.5000000000000001,12.89,77.56,99,8.903609927612983,7,2.0,2.4,0,11.05240844637142
Ordinary Theft,11/2/2019,12:45,12.8903442323649,77.5642779498096,2019-02-11 12:45:00,12,0,11,2,1,0,0,1,0,0,1.2246467991473532e-16,-1.0,0.0,1.0,0.8660254037844386,0.5000000000000001,12.89,77.56,99,9.614269199354531,7,2.0,2.0,0,9.210340371976184
Ordinary Theft,30/12/2019,1:30,12.95142,77.558217,2019-12-30 01:30:00,1,0,30,12,4,0,0,0,0,1,0.25881904510252074,0.9659258262890683,0.0,1.0,-2.4492935982947064e-16,1.0,12.950000000000001,77.55,16,4.536371502949481,7,2.0,3.0,0,8.49964003216865
Ordinary Theft,5/3/2015,20:25,12.9548104164414,77.5678155931017,2015-03-05 20:25:00,20,3,5,3,1,0,0,0,1,0,-0.8660254037844386,0.5000000000000001,0.43388373911755823,-0.900968867902419,1.0,6.123233995736766e-17,12.950000000000001,77.56,65,3.450974377055486,7,2.0,2.4,0,10.05517138086342
Ordinary Theft,16/07/2015,20:45,12.95501377,77.5702211,2015-07-16 20:45:00,20,3,16,7,3,0,0,0,1,0,-0.8660254037844386,0.5000000000000001,0.43388373911755823,-0.900968867902419,-0.4999999999999998,-0.8660254037844388,12.950000000000001,77.57000000000001,30,3.221824814084269,7,2.0,2.4,0,8.241569290764351
Ordinary Theft,27/08/2015,15:00,12.95682,77.56796,2015-08-27 15:00:00,15,3,27,8,3,0,0,1,0,0,-0.7071067811865471,-0.7071067811865479,0.43388373911755823,-0.900968867902419,-0.8660254037844384,-0.5000000000000004,12.950000000000001,77.56,65,3.321769863652065,7,2.0,2.0,0,8.37930948405285
Ordinary Theft,15/09/2015,7:30,12.95568836,77.56907015,2015-09-15 07:30:00,7,1,15,9,3,0,1,0,0,0,0.9659258262890683,-0.25881904510252063,0.7818314824680298,0.6234898018587336,-1.0,-1.8369701987210297e-16,12.950000000000001,77.56,65,3.283834730475502,7,2.0,1.6,0,6.70344758724228
Ordinary Theft,7/10/2015,12:15,12.95682,77.56796,2015-10-07 12:15:00,12,2,7,10,4,0,0,1,0,0,1.2246467991473532e-16,-1.0,0.9749279121818236,-0.22252093395631434,-0.8660254037844386,0.5000000000000001,12.950000000000001,77.56,65,3.321769863652065,7,2.0,2.0,0,8.37930948405285
Ordinary Theft,11/10/2015,15:00,12.95682,77.56796,2015-10-11 15:00:00,15,6,11,10,4,1,0,1,0,0,-0.7071067811865471,-0.7071067811865479,-0.7818314824680299,0.6234898018587334,-0.8660254037844386,0.5000000000000001,12.950000000000001,77.56,65,3.321769863652065,7,2.0,2.0,0,8.37930948405285
Ordinary Theft,30/10/2015,17:30,12.95176411,77.56840735,2015-10-30 17:30:00,17,4,30,10,4,0,0,1,0,0,-0.9659258262890683,-0.25881904510252063,-0.433883739117558,-0.9009688679024191,-0.8660254037844386,0.5000000000000001,12.950000000000001,77.56,65,3.594541541735979,7,2.0,2.0,0,8.37930948405285
Ordinary Theft,19/02/2016,12:30,12.94951,77.5674,2016-02-19 12:30:00,12,4,19,2,1,0,0,1,0,0,1.2246467991473532e-16,-1.0,-0.433883739117558,-0.9009688679024191,0.8660254037844386,0.5000000000000001,12.94,77.56,99,3.8367775960154638,7,2.0,2.0,0,9.210340371976184
Ordinary Theft,20/07/2016,15:00,12.95682,77.56796,2016-07-20 15:00:00,15,2,20,7,3,0,0,1,0,0,-0.7071067811865471,-0.7071067811865479,0.9749279121818236,-0.22252093395631434,-0.4999999999999998,-0.8660254037844388,12.950000000000001,77.56,65,3.321769863652065,7,2.0,2.0,0,8.37930948405285
Ordinary Theft,17/03/2017,14:30,12.95682,77.56796,2017-03-17 14:30:00,14,4,17,3,1,0,0,1,0,0,-0.4999999999999998,-0.8660254037844388,-0.433883739117558,-0.9009688679024191,1.0,6.123233995736766e-17,12.950000000000001,77.56,65,3.321769863652065,7,2.0,2.0,0,8.37930948405285
Ordinary Theft,05/08/2017,12:30,12.95289,77.57194,2017-08-05 12:30:00,12,5,5,8,3,1,0,1,0,0,1.2246467991473532e-16,-1.0,-0.9749279121818236,-0.2225209339563146,-0.8660254037844384,-0.5000000000000004,12.950000000000001,77.57000000000001,30,3.2183285465658966,7,2.0,2.0,0,6.8679744089702925
Ordinary Theft,19/11/2017,18:00,12.95682,77.56796,2017-11-19 18:00:00,18,6,19,11,4,1,0,0,1,0,-1.0,-1.8369701987210297e-16,-0.7818314824680299,0.6234898018587334,-0.5000000000000004,0.8660254037844384,12.950000000000001,77.56,65,3.321769863652065,7,2.0,2.4,0,10.05517138086342
Ordinary Theft,26/11/2017,17:15,12.94946,77.5713,2017-11-26 17:15:00,17,6,26,11,4,1,0,1,0,0,-0.9659258262890683,-0.25881904510252063,-0.7818314824680299,0.6234898018587334,-0.5000000000000004,0.8660254037844384,12.94,77.57000000000001,55,3.526407257211205,7,2.0,2.0,0,8.0507033814703
Ordinary Theft,5/6/2018,11:00,12.94946,77.5713,2018-06-05 11:00:00,11,1,5,6,2,0,1,0,0,0,0.258819045102521,-0.9659258262890682,0.7818314824680298,0.6234898018587336,1.2246467991473532e-16,-1.0,12.94,77.57000000000001,55,3.526407257211205,7,2.0,1.6,0,6.44056270517624
Ordinary Theft,29/11/2018,15:00,12.95722,77.57187,2018-11-29 15:00:00,15,3,29,11,4,0,0,1,0,0,-0.7071067811865471,-0.7071067811865479,0.43388373911755823,-0.900968867902419,-0.5000000000000004,0.8660254037844384,12.950000000000001,77.57000000000001,30,2.9365433361475293,7,2.0,2.0,0,6.8679744089702925
Ordinary Theft,12/06/2019,11:45,12.950731,77.568905,2019-06-12 11:45:00,11,2,12,6,2,0,1,0,0,0,0.258819045102521,-0.9659258262890682,0.9749279121818236,-0.22252093395631434,1.2246467991473532e-16,-1.0,12.950000000000001,77.56,65,3.624569702034688,7,2.0,1.6,0,6.70344758724228
Ordinary Theft,12/01/2015,12:45,12.95072643,77.57692629,2015-01-12 12:45:00,12,0,12,1,1,0,0,1,0,0,1.2246467991473532e-16,-1.0,0.0,1.0,0.49999999999999994,0.8660254037844387,12.950000000000001,77.57000000000001,30,3.00915801008912,7,2.0,2.0,0,6.8679744089702925
Ordinary Theft,2/2/2015,20:45,12.94103,77.5482,2015-02-02 20:45:00,20,0,2,2,1,0,0,0,1,0,-0.8660254037844386,0.5000000000000001,0.0,1.0,0.8660254037844386,0.5000000000000001,12.94,77.54,29,6.069305044769689,7,2.0,2.4,0,8.162873715989173
Ordinary Theft,19/02/2015,16:15,12.938832,77.55328,2015-02-19 16:15:00,16,3,19,2,1,0,0,1,0,0,-0.8660254037844384,-0.5000000000000004,0.43388373911755823,-0.900968867902419,0.8660254037844386,0.5000000000000001,12.93,77.55,76,5.772796429530107,7,2.0,2.0,0,8.687610843707368
Ordinary Theft,12/3/2015,12:30,12.934955,77.566136,2015-03-12 12:30:00,12,3,12,3,1,0,0,1,0,0,1.2246467991473532e-16,-1.0,0.43388373911755823,-0.900968867902419,1.0,6.123233995736766e-17,12.93,77.56,63,5.110548266408582,7,2.0,2.0,0,8.317766166719343
Ordinary Theft,1/4/2015,12:00,12.94103,77.5482,2015-04-01 12:00:00,12,2,1,4,2,0,0,1,0,0,1.2246467991473532e-16,-1.0,0.9749279121818236,-0.22252093395631434,0.8660254037844387,-0.49999999999999983,12.94,77.54,29,6.069305044769689,7,2.0,2.0,0,6.802394763324311
Ordinary Theft,11/4/2015,19:00,12.938832,77.55328,2015-04-11 19:00:00,19,5,11,4,2,1,0,0,1,0,-0.9659258262890684,0.2588190451025203,-0.9749279121818236,-0.2225209339563146,0.8660254037844387,-0.49999999999999983,12.93,77.55,76,5.772796429530107,7,2.0,2.4,0,10.42513301244884
Ordinary Theft,12/5/2015,14:15,12.938832,77.55328,2015-05-12 14:15:00,14,1,12,5,2,0,0,1,0,0,-0.4999999999999998,-0.8660254037844388,0.7818314824680298,0.6234898018587336,0.49999999999999994,-0.8660254037844387,12.93,77.55,76,5.772796429530107,7,2.0,2.0,0,8.687610843707368
Ordinary Theft,20/05/2015,16:45,12.938832,77.55328,2015-05-20 16:45:00,16,2,20,5,2,0,0,1,0,0,-0.8660254037844384,-0.5000000000000004,0.9749279121818236,-0.22252093395631434,0.49999999999999994,-0.8660254037844387,12.93,77.55,76,5.772796429530107,7,2.0,2.0,0,8.687610843707368
Ordinary Theft,8/8/2015,21:30,12.938822,77.55128,2015-08-08 21:30:00,21,5,8,8,3,1,0,0,1,0,-0.7071067811865477,0.7071067811865474,-0.9749279121818236,-0.2225209339563146,-0.8660254037844384,-0.5000000000000004,12.93,77.55,76,5.943157145614462,7,2.0,2.4,0,10.42513301244884
Ordinary Theft,31/08/2015,20:25,12.938102,77.55128,2015-08-31 20:25:00,20,0,31,8,3,0,0,0,1,0,-0.8660254037844386,0.5000000000000001,0.0,1.0,-0.8660254037844384,-0.5000000000000004,12.93,77.55,76,5.992594568240649,7,2.0,2.4,0,10.42513301244884
Ordinary Theft,22/09/2015,13:00,12.948832,77.55328,2015-09-22 13:00:00,13,1,22,9,3,0,0,1,0,0,-0.2588190451025208,-0.9659258262890683,0.7818314824680298,0.6234898018587336,-1.0,-1.8369701987210297e-16,12.94,77.55,85,5.143707774305071,7,2.0,2.0,0,8.908694592507015
Ordinary Theft,8/10/2015,3:00,12.938722,77.55128,2015-10-08 03:00:00,3,3,8,10,4,0,0,0,0,1,0.7071067811865475,0.7071067811865476,0.43388373911755823,-0.900968867902419,-0.8660254037844386,0.5000000000000001,12.93,77.55,76,5.949983598808614,7,2.0,3.0,0,13.031416265561052
Ordinary Theft,4/12/2015,10:20,12.938832,77.55328,2015-12-04 10:20:00,10,4,4,12,4,0,1,0,0,0,0.49999999999999994,-0.8660254037844387,-0.433883739117558,-0.9009688679024191,-2.4492935982947064e-16,1.0,12.93,77.55,76,5.772796429530107,7,2.0,1.6,0,6.950088674965895
Ordinary Theft,8/12/2015,17:00,12.938822,77.55328,2015-12-08 17:00:00,17,1,8,12,4,0,0,1,0,0,-0.9659258262890683,-0.25881904510252063,0.7818314824680298,0.6234898018587336,-2.4492935982947064e-16,1.0,12.93,77.55,76,5.773498396392198,7,2.0,2.0,0,8.687610843707368
Ordinary Theft,29/12/2015,18:30,12.938822,77.55328,2015-12-29 18:30:00,18,1,29,12,4,0,0,0,1,0,-1.0,-1.8369701987210297e-16,0.7818314824680298,0.6234898018587336,-2.4492935982947064e-16,1.0,12.93,77.55,76,5.773498396392198,7,2.0,2.4,0,10.42513301244884
Ordinary Theft,8/1/2016,11:00,12.938822,77.55328,2016-01-08 11:00:00,11,4,8,1,1,0,1,0,0,0,0.258819045102521,-0.9659258262890682,-0.433883739117558,-0.9009688679024191,0.49999999999999994,0.8660254037844387,12.93,77.55,76,5.773498396392198,7,2.0,1.6,0,6.950088674965895
Ordinary Theft,25/01/2016,22:30,12.938822,77.55328,2016-01-25 22:30:00,22,0,25,1,1,0,0,0,0,1,-0.5000000000000004,0.8660254037844384,0.0,1.0,0.49999999999999994,0.8660254037844387,12.93,77.55,76,5.773498396392198,7,2.0,3.0,0,13.031416265561052
Ordinary Theft,28/01/2016,16:00,12.938822,77.55328,2016-01-28 16:00:00,16,3,28,1,1,0,0,1,0,0,-0.8660254037844384,-0.5000000000000004,0.43388373911755823,-0.900968867902419,0.49999999999999994,0.8660254037844387,12.93,77.55,76,5.773498396392198,7,2.0,2.0,0,8.687610843707368
Ordinary Theft,20/02/2016,11:15,12.938832,77.55328,2016-02-20 11:15:00,11,5,20,2,1,1,1,0,0,0,0.258819045102521,-0.9659258262890682,-0.9749279121818236,-0.2225209339563146,0.8660254037844386,0.5000000000000001,12.93,77.55,76,5.772796429530107,7,2.0,1.6,0,6.950088674965895
Ordinary Theft,29/02/2016,10:30,12.938832,77.55328,2016-02-29 10:30:00,10,0,29,2,1,0,1,0,0,0,0.49999999999999994,-0.8660254037844387,0.0,1.0,0.8660254037844386,0.5000000000000001,12.93,77.55,76,5.772796429530107,7,2.0,1.6,0,6.950088674965895
Ordinary Theft,12/3/2016,11:10,12.937832,77.55328,2016-03-12 11:10:00,11,5,12,3,1,1,1,0,0,0,0.258819045102521,-0.9659258262890682,-0.9749279121818236,-0.2225209339563146,1.0,6.123233995736766e-17,12.93,77.55,76,5.8436230985721105,7,2.0,1.6,0,6.950088674965895
Ordinary Theft,26/05/2016,13:00,12.937832,77.55329,2016-05-26 13:00:00,13,3,26,5,2,0,0,1,0,0,-0.2588190451025208,-0.9659258262890683,0.43388373911755823,-0.900968867902419,0.49999999999999994,-0.8660254037844387,12.93,77.55,76,5.842792803590487,7,2.0,2.0,0,8.687610843707368
Ordinary Theft,30/05/2016,20:30,12.937832,77.55329,2016-05-30 20:30:00,20,0,30,5,2,0,0,0,1,0,-0.8660254037844386,0.5000000000000001,0.0,1.0,0.49999999999999994,-0.8660254037844387,12.93,77.55,76,5.842792803590487,7,2.0,2.4,0,10.42513301244884
Ordinary Theft,20/08/2016,15:00,12.938102,77.55128,2016-08-20 15:00:00,15,5,20,8,3,1,0,1,0,0,-0.7071067811865471,-0.7071067811865479,-0.9749279121818236,-0.2225209339563146,-0.8660254037844384,-0.5000000000000004,12.93,77.55,76,5.992594568240649,7,2.0,2.0,0,8.687610843707368
Ordinary Theft,22/09/2016,17:00,12.94103,77.5482,2016-09-22 17:00:00,17,3,22,9,3,0,0,1,0,0,-0.9659258262890683,-0.25881904510252063,0.43388373911755823,-0.900968867902419,-1.0,-1.8369701987210297e-16,12.94,77.54,29,6.069305044769689,7,2.0,2.0,0,6.802394763324311
Ordinary Theft,24/11/2016,14:30,12.94103,77.5482,2016-11-24 14:30:00,14,3,24,11,4,0,0,1,0,0,-0.4999999999999998,-0.8660254037844388,0.43388373911755823,-0.900968867902419,-0.5000000000000004,0.8660254037844384,12.94,77.54,29,6.069305044769689,7,2.0,2.0,0,6.802394763324311
Ordinary Theft,27/12/2016,10:30,12.94103,77.5482,2016-12-27 10:30:00,10,1,27,12,4,0,1,0,0,0,0.49999999999999994,-0.8660254037844387,0.7818314824680298,0.6234898018587336,-2.4492935982947064e-16,1.0,12.94,77.54,29,6.069305044769689,7,2.0,1.6,0,5.441915810659449
Ordinary Theft,9/1/2017,15:30,12.934955,77.566136,2017-01-09 15:30:00,15,0,9,1,1,0,0,1,0,0,-0.7071067811865471,-0.7071067811865479,0.0,1.0,0.49999999999999994,0.8660254037844387,12.93,77.56,63,5.110548266408582,7,2.0,2.0,0,8.317766166719343
Ordinary Theft,10/1/2017,16:00,12.934955,77.566136,2017-01-10 16:00:00,16,1,10,1,1,0,0,1,0,0,-0.8660254037844384,-0.5000000000000004,0.7818314824680298,0.6234898018587336,0.49999999999999994,0.8660254037844387,12.93,77.56,63,5.110548266408582,7,2.0,2.0,0,8.317766166719343
Ordinary Theft,23/01/2017,21:00,12.934855,77.566137,2017-01-23 21:00:00,21,0,23,1,1,0,0,0,1,0,-0.7071067811865477,0.7071067811865474,0.0,1.0,0.49999999999999994,0.8660254037844387,12.93,77.56,63,5.11935353216122,7,2.0,2.4,0,9.981319400063212
Ordinary Theft,8/2/2017,17:00,12.934955,77.566138,2017-02-08 17:00:00,17,2,8,2,1,0,0,1,0,0,-0.9659258262890683,-0.25881904510252063,0.9749279121818236,-0.22252093395631434,0.8660254037844386,0.5000000000000001,12.93,77.56,63,5.110417459782485,7,2.0,2.0,0,8.317766166719343
Ordinary Theft,20/02/2017,14:30,12.934955,77.566139,2017-02-20 14:30:00,14,0,20,2,1,0,0,1,0,0,-0.4999999999999998,-0.8660254037844388,0.0,1.0,0.8660254037844386,0.5000000000000001,12.93,77.56,63,5.110352058659464,7,2.0,2.0,0,8.317766166719343
Ordinary Theft,25/02/2017,21:20,12.934955,77.56614,2017-02-25 21:20:00,21,5,25,2,1,1,0,0,1,0,-0.7071067811865477,0.7071067811865474,-0.9749279121818236,-0.2225209339563146,0.8660254037844386,0.5000000000000001,12.93,77.56,63,5.110286658999032,7,2.0,2.4,0,9.981319400063212
Ordinary Theft,1/4/2017,10:30,12.94103,77.5482,2017-04-01 10:30:00,10,5,1,4,2,1,1,0,0,0,0.49999999999999994,-0.8660254037844387,-0.9749279121818236,-0.2225209339563146,0.8660254037844387,-0.49999999999999983,12.94,77.54,29,6.069305044769689,7,2.0,1.6,0,5.441915810659449
Ordinary Theft,10/6/2017,19:00,12.934955,77.566138,2017-06-10 19:00:00,19,5,10,6,2,1,0,0,1,0,-0.9659258262890684,0.2588190451025203,-0.9749279121818236,-0.2225209339563146,1.2246467991473532e-16,-1.0,12.93,77.56,63,5.110417459782485,7,2.0,2.4,0,9.981319400063212
Ordinary Theft,30/06/2017,3:00,12.94103,77.5482,2017-06-30 03:00:00,3,4,30,6,2,0,0,0,0,1,0.7071067811865475,0.7071067811865476,-0.433883739117558,-0.9009688679024191,1.2246467991473532e-16,-1.0,12.94,77.54,29,6.069305044769689,7,2.0,3.0,0,10.203592144986466
Ordinary Theft,7/8/2017,16:30,12.94103,77.5482,2017-08-07 16:30:00,16,0,7,8,3,0,0,1,0,0,-0.8660254037844384,-0.5000000000000004,0.0,1.0,-0.8660254037844384,-0.5000000000000004,12.94,77.54,29,6.069305044769689,7,2.0,2.0,0,6.802394763324311
Ordinary Theft,10/11/2017,7:30,12.934955,77.566138,2017-11-10 07:30:00,7,4,10,11,4,0,1,0,0,0,0.9659258262890683,-0.25881904510252063,-0.433883739117558,-0.9009688679024191,-0.5000000000000004,0.8660254037844384,12.93,77.56,63,5.110417459782485,7,2.0,1.6,0,6.654212933375475
Ordinary Theft,16/12/2017,15:00,12.94103,77.5482,2017-12-16 15:00:00,15,5,16,12,4,1,0,1,0,0,-0.7071067811865471,-0.7071067811865479,-0.9749279121818236,-0.2225209339563146,-2.4492935982947064e-16,1.0,12.94,77.54,29,6.069305044769689,7,2.0,2.0,0,6.802394763324311
Ordinary Theft,26/01/2018,13:45,12.94103,77.5482,2018-01-26 13:45:00,13,4,26,1,1,0,0,1,0,0,-0.2588190451025208,-0.9659258262890683,-0.433883739117558,-0.9009688679024191,0.49999999999999994,0.8660254037844387,12.94,77.54,29,6.069305044769689,7,2.0,2.0,0,6.802394763324311
Ordinary Theft,22/02/2018,15:30,12.934955,77.566138,2018-02-22 15:30:00,15,3,22,2,1,0,0,1,0,0,-0.7071067811865471,-0.7071067811865479,0.43388373911755823,-0.900968867902419,0.8660254037844386,0.5000000000000001,12.93,77.56,63,5.110417459782485,7,2.0,2.0,0,8.317766166719343
Ordinary Theft,20/06/2018,14:00,12.94103,77.5482,2018-06-20 14:00:00,14,2,20,6,2,0,0,1,0,0,-0.4999999999999998,-0.8660254037844388,0.9749279121818236,-0.22252093395631434,1.2246467991473532e-16,-1.0,12.94,77.54,29,6.069305044769689,7,2.0,2.0,0,6.802394763324311
Ordinary Theft,12/8/2018,23:30,12.937832,77.55328,2018-08-12 23:30:00,23,6,12,8,3,1,0,0,0,1,-0.25881904510252157,0.9659258262890681,-0.7818314824680299,0.6234898018587334,-0.8660254037844384,-0.5000000000000004,12.93,77.55,76,5.8436230985721105,7,2.0,3.0,0,13.031416265561052
Ordinary Theft,9/10/2018,9:45,12.94103,77.5482,2018-10-09 09:45:00,9,1,9,10,4,0,1,0,0,0,0.7071067811865476,-0.7071067811865475,0.7818314824680298,0.6234898018587336,-0.8660254037844386,0.5000000000000001,12.94,77.54,29,6.069305044769689,7,2.0,1.6,0,5.441915810659449
Ordinary Theft,18/10/2018,13:15,12.937932,77.55328,2018-10-18 13:15:00,13,3,18,10,4,0,0,1,0,0,-0.2588190451025208,-0.9659258262890683,0.43388373911755823,-0.900968867902419,-0.8660254037844386,0.5000000000000001,12.93,77.55,76,5.836483778796792,7,2.0,2.0,0,8.687610843707368
Ordinary Theft,15/03/2019,18:00,12.934955,77.566138,2019-03-15 18:00:00,18,4,15,3,1,0,0,0,1,0,-1.0,-1.8369701987210297e-16,-0.433883739117558,-0.9009688679024191,1.0,6.123233995736766e-17,12.93,77.56,63,5.110417459782485,7,2.0,2.4,0,9.981319400063212
Ordinary Theft,8/4/2019,21:15,12.934955,77.566138,2019-04-08 21:15:00,21,0,8,4,2,0,0,0,1,0,-0.7071067811865477,0.7071067811865474,0.0,1.0,0.8660254037844387,-0.49999999999999983,12.93,77.56,63,5.110417459782485,7,2.0,2.4,0,9.981319400063212
Ordinary Theft,7/5/2019,13:15,12.94103,77.5482,2019-05-07 13:15:00,13,1,7,5,2,0,0,1,0,0,-0.2588190451025208,-0.9659258262890683,0.7818314824680298,0.6234898018587336,0.49999999999999994,-0.8660254037844387,12.94,77.54,29,6.069305044769689,7,2.0,2.0,0,6.802394763324311
Ordinary Theft,21/05/2019,19:00,12.934955,77.566138,2019-05-21 19:00:00,19,1,21,5,2,0,0,0,1,0,-0.9659258262890684,0.2588190451025203,0.7818314824680298,0.6234898018587336,0.49999999999999994,-0.8660254037844387,12.93,77.56,63,5.110417459782485,7,2.0,2.4,0,9.981319400063212
Ordinary Theft,1/6/2019,23:30,12.94103,77.5482,2019-06-01 23:30:00,23,5,1,6,2,1,0,0,0,1,-0.25881904510252157,0.9659258262890681,-0.9749279121818236,-0.2225209339563146,1.2246467991473532e-16,-1.0,12.94,77.54,29,6.069305044769689,7,2.0,3.0,0,10.203592144986466
Ordinary Theft,10/10/2019,18:00,12.934955,77.566138,2019-10-10 18:00:00,18,3,10,10,4,0,0,0,1,0,-1.0,-1.8369701987210297e-16,0.43388373911755823,-0.900968867902419,-0.8660254037844386,0.5000000000000001,12.93,77.56,63,5.110417459782485,7,2.0,2.4,0,9.981319400063212
Ordinary Theft,26/11/2019,10:30,12.94103,77.5482,2019-11-26 10:30:00,10,1,26,11,4,0,1,0,0,0,0.49999999999999994,-0.8660254037844387,0.7818314824680298,0.6234898018587336,-0.5000000000000004,0.8660254037844384,12.94,77.54,29,6.069305044769689,7,2.0,1.6,0,5.441915810659449
Ordinary Theft,27/11/2019,20:00,12.934955,77.566138,2019-11-27 20:00:00,20,2,27,11,4,0,0,0,1,0,-0.8660254037844386,0.5000000000000001,0.9749279121818236,-0.22252093395631434,-0.5000000000000004,0.8660254037844384,12.93,77.56,63,5.110417459782485,7,2.0,2.4,0,9.981319400063212
Ordinary Theft,02/01/2015,19:00,12.926291,77.547338,2015-01-02 19:00:00,19,4,2,1,1,0,0,0,1,0,-0.9659258262890684,0.2588190451025203,-0.433883739117558,-0.9009688679024191,0.49999999999999994,0.8660254037844387,12.92,77.54,49,7.184294849114452,7,2.0,2.4,0,9.38885521302755
Ordinary Theft,18/02/2015,9:00,12.928179,77.55161,2015-02-18 09:00:00,9,2,18,2,1,0,1,0,0,0,0.7071067811865476,-0.7071067811865475,0.9749279121818236,-0.22252093395631434,0.8660254037844386,0.5000000000000001,12.92,77.55,55,6.709311645699801,7,2.0,1.6,0,6.44056270517624
Ordinary Theft,24/03/2015,15:20,12.928197,77.550652,2015-03-24 15:20:00,15,1,24,3,1,0,0,1,0,0,-0.7071067811865471,-0.7071067811865479,0.7818314824680298,0.6234898018587336,1.0,6.123233995736766e-17,12.92,77.55,55,6.780383716962577,7,2.0,2.0,0,8.0507033814703
Ordinary Theft,10/04/2015,11:00,12.935006,77.5437545,2015-04-10 11:00:00,11,4,10,4,2,0,1,0,0,0,0.258819045102521,-0.9659258262890682,-0.433883739117558,-0.9009688679024191,0.8660254037844387,-0.49999999999999983,12.93,77.54,28,6.849540350442813,7,2.0,1.6,0,5.387673327978359
Ordinary Theft,24/04/2015,11:00,12.930121,77.560592,2015-04-24 11:00:00,11,4,24,4,2,0,1,0,0,0,0.258819045102521,-0.9659258262890682,-0.433883739117558,-0.9009688679024191,0.8660254037844387,-0.49999999999999983,12.93,77.56,63,5.903770971233528,7,2.0,1.6,0,6.654212933375475
Ordinary Theft,21/05/2015,15:00,12.946995,77.552044,2015-05-21 15:00:00,15,3,21,5,2,0,0,1,0,0,-0.7071067811865471,-0.7071067811865479,0.43388373911755823,-0.900968867902419,0.49999999999999994,-0.8660254037844387,12.94,77.55,85,5.362016782930965,7,2.0,2.0,0,8.908694592507015
Ordinary Theft,17/06/2015,21:00,12.930147,77.560524,2015-06-17 21:00:00,21,2,17,6,2,0,0,0,1,0,-0.7071067811865477,0.7071067811865474,0.9749279121818236,-0.22252093395631434,1.2246467991473532e-16,-1.0,12.93,77.56,63,5.906116993486528,7,2.0,2.4,0,9.981319400063212
Ordinary Theft,22/06/2015,18:00,12.923311,77.549288,2015-06-22 18:00:00,18,0,22,6,2,0,0,0,1,0,-1.0,-1.8369701987210297e-16,0.0,1.0,1.2246467991473532e-16,-1.0,12.92,77.54,49,7.276203565085954,7,2.0,2.4,0,9.38885521302755
Ordinary Theft,21/07/2015,12:45,12.934049,77.548061,2015-07-21 12:45:00,12,1,21,7,3,0,0,1,0,0,1.2246467991473532e-16,-1.0,0.7818314824680298,0.6234898018587336,-0.4999999999999998,-0.8660254037844388,12.93,77.54,28,6.547423708832335,7,2.0,2.0,0,6.734591659972948
Ordinary Theft,06/09/2015,9:00,12.928378,77.556654,2015-09-06 09:00:00,9,6,6,9,3,1,1,0,0,0,0.7071067811865476,-0.7071067811865475,-0.7818314824680299,0.6234898018587334,-1.0,-1.8369701987210297e-16,12.92,77.55,55,6.32515108580597,7,2.0,1.6,0,6.44056270517624
Ordinary Theft,21/09/2015,12:30,12.921303,77.549263,2015-09-21 12:30:00,12,0,21,9,3,0,0,1,0,0,1.2246467991473532e-16,-1.0,0.0,1.0,-1.0,-1.8369701987210297e-16,12.92,77.54,49,7.44429942682216,7,2.0,2.0,0,7.824046010856292
Ordinary Theft,24/02/2016,11:00,12.925561,77.554801,2016-02-24 11:00:00,11,2,24,2,1,0,1,0,0,0,0.258819045102521,-0.9659258262890682,0.9749279121818236,-0.22252093395631434,0.8660254037844386,0.5000000000000001,12.92,77.55,55,6.693914926440874,7,2.0,1.6,0,6.44056270517624
Ordinary Theft,26/05/2016,22:42,12.926701,77.56077,2016-05-26 22:42:00,22,3,26,5,2,0,0,0,0,1,-0.5000000000000004,0.8660254037844384,0.43388373911755823,-0.900968867902419,0.49999999999999994,-0.8660254037844387,12.92,77.56,33,6.1939865552721,7,2.0,3.0,0,10.579081573848484
Ordinary Theft,23/06/2016,11:00,12.930108,77.560549,2016-06-23 11:00:00,11,3,23,6,2,0,1,0,0,0,0.258819045102521,-0.9659258262890682,0.43388373911755823,-0.900968867902419,1.2246467991473532e-16,-1.0,12.93,77.56,63,5.907809743609162,7,2.0,1.6,0,6.654212933375475
Ordinary Theft,8/11/2016,15:30,12.92320855,77.550565,2016-11-08 15:30:00,15,1,8,11,4,0,0,1,0,0,-0.7071067811865471,-0.7071067811865479,0.7818314824680298,0.6234898018587336,-0.5000000000000004,0.8660254037844384,12.92,77.55,55,7.192059216599343,7,2.0,2.0,0,8.0507033814703
Ordinary Theft,10/12/2016,14:45,12.923029,77.553841,2016-12-10 14:45:00,14,5,10,12,4,1,0,1,0,0,-0.4999999999999998,-0.8660254037844388,-0.9749279121818236,-0.2225209339563146,-2.4492935982947064e-16,1.0,12.92,77.55,55,6.9770185857330125,7,2.0,2.0,0,8.0507033814703
Ordinary Theft,16/01/2017,17:00,12.930108,77.560549,2017-01-16 17:00:00,17,0,16,1,1,0,0,1,0,0,-0.9659258262890683,-0.25881904510252063,0.0,1.0,0.49999999999999994,0.8660254037844387,12.93,77.56,63,5.907809743609162,7,2.0,2.0,0,8.317766166719343
Ordinary Theft,18/01/2017,12:30,12.930108,77.560549,2017-01-18 12:30:00,12,2,18,1,1,0,0,1,0,0,1.2246467991473532e-16,-1.0,0.9749279121818236,-0.22252093395631434,0.49999999999999994,0.8660254037844387,12.93,77.56,63,5.907809743609162,7,2.0,2.0,0,8.317766166719343
Ordinary Theft,22/01/2017,15:30,12.930106,77.555115,2017-01-22 15:30:00,15,6,22,1,1,1,0,1,0,0,-0.7071067811865471,-0.7071067811865479,-0.7818314824680299,0.6234898018587334,0.49999999999999994,0.8660254037844387,12.93,77.55,76,6.2926004356476115,7,2.0,2.0,0,8.687610843707368
Ordinary Theft,05/04/2017,23:15,12.925223,77.550043,2017-04-05 23:15:00,23,2,5,4,2,0,0,0,0,1,-0.25881904510252157,0.9659258262890681,0.9749279121818236,-0.22252093395631434,0.8660254037844387,-0.49999999999999983,12.92,77.55,55,7.064572579759256,7,2.0,3.0,0,12.076055072205449
Ordinary Theft,27/04/2017,14:45,12.925255,77.550376,2017-04-27 14:45:00,14,3,27,4,2,0,0,1,0,0,-0.4999999999999998,-0.8660254037844388,0.43388373911755823,-0.900968867902419,0.8660254037844387,-0.49999999999999983,12.92,77.55,55,7.037351104440582,7,2.0,2.0,0,8.0507033814703
Ordinary Theft,19/08/2017,10:30,12.928742,77.556882,2017-08-19 10:30:00,10,5,19,8,3,1,1,0,0,0,0.49999999999999994,-0.8660254037844387,-0.9749279121818236,-0.2225209339563146,-0.8660254037844384,-0.5000000000000004,12.92,77.55,55,6.27833656737184,7,2.0,1.6,0,6.44056270517624
Ordinary Theft,20/08/2017,6:30,12.92286,77.543799,2017-08-20 06:30:00,6,6,20,8,3,1,1,0,0,0,1.0,6.123233995736766e-17,-0.7818314824680299,0.6234898018587334,-0.8660254037844384,-0.5000000000000004,12.92,77.54,49,7.725267673296653,7,2.0,1.6,0,6.259236808685034
Ordinary Theft,22/08/2017,9:30,12.93079,77.774284,2017-08-22 09:30:00,9,1,22,8,3,0,1,0,0,0,0.7071067811865476,-0.7071067811865475,0.7818314824680298,0.6234898018587336,-0.8660254037844384,-0.5000000000000004,12.93,77.77,1,19.993467227456808,7,2.0,1.6,0,1.1090354888959124
Ordinary Theft,13/9/2017,10:15,12.922719,77.559596,2017-09-13 10:15:00,10,2,13,9,3,0,1,0,0,0,0.49999999999999994,-0.8660254037844387,0.9749279121818236,-0.22252093395631434,-1.0,-1.8369701987210297e-16,12.92,77.55,55,6.628116549049737,7,2.0,1.6,0,6.44056270517624
Ordinary Theft,16/6/2017,3:00,12.929455,77.55393,2017-06-16 03:00:00,3,4,16,6,2,0,0,0,0,1,0.7071067811865475,0.7071067811865476,-0.433883739117558,-0.9009688679024191,1.2246467991473532e-16,-1.0,12.92,77.55,55,6.433157486068008,7,2.0,3.0,0,12.076055072205449
Ordinary Theft,19/9/2017,12:45,12.928169,77.556016,2017-09-19 12:45:00,12,1,19,9,3,0,0,1,0,0,1.2246467991473532e-16,-1.0,0.7818314824680298,0.6234898018587336,-1.0,-1.8369701987210297e-16,12.92,77.55,55,6.387867998182854,7,2.0,2.0,0,8.0507033814703
Ordinary Theft,24/9/2017,10:00,12.924486,77.55189,2017-09-24 10:00:00,10,6,24,9,3,1,1,0,0,0,0.49999999999999994,-0.8660254037844387,-0.7818314824680299,0.6234898018587334,-1.0,-1.8369701987210297e-16,12.92,77.55,55,6.990517949558641,7,2.0,1.6,0,6.44056270517624
Ordinary Theft,24/9/2017,2:30,12.922643,77.532899,2017-09-24 02:30:00,2,6,24,9,3,1,0,0,0,1,0.49999999999999994,0.8660254037844387,-0.7818314824680299,0.6234898018587334,-1.0,-1.8369701987210297e-16,12.92,77.53,6,8.622227032422078,7,2.0,3.0,0,5.8377304471659395
Ordinary Theft,27/9/2017,10:00,12.923575,77.553426,2017-09-27 10:00:00,10,2,27,9,3,0,1,0,0,0,0.49999999999999994,-0.8660254037844387,0.9749279121818236,-0.22252093395631434,-1.0,-1.8369701987210297e-16,12.92,77.55,55,6.958875061498951,7,2.0,1.6,0,6.44056270517624
Ordinary Theft,24/11/2017,10:30,12.93424856,77.560608,2017-11-24 10:30:00,10,4,24,11,4,0,1,0,0,0,0.49999999999999994,-0.8660254037844387,-0.433883739117558,-0.9009688679024191,-0.5000000000000004,0.8660254037844384,12.93,77.56,63,5.551436127485633,7,2.0,1.6,0,6.654212933375475
Ordinary Theft,26/11/2017,11:15,12.925357,77.551042,2017-11-26 11:15:00,11,6,26,11,4,1,1,0,0,0,0.258819045102521,-0.9659258262890682,-0.7818314824680299,0.6234898018587334,-0.5000000000000004,0.8660254037844384,12.92,77.55,55,6.980041159814903,7,2.0,1.6,0,6.44056270517624
Ordinary Theft,18/01/2018,3:30,12.926615,77.559433,2018-01-18 03:30:00,3,3,18,1,1,0,0,0,0,1,0.7071067811865475,0.7071067811865476,0.43388373911755823,-0.900968867902419,0.49999999999999994,0.8660254037844387,12.92,77.55,55,6.28843156089075,7,2.0,3.0,0,12.076055072205449
Ordinary Theft,23/01/2018,7:00,12.922988,77.543718,2018-01-23 07:00:00,7,1,23,1,1,0,1,0,0,0,0.9659258262890683,-0.25881904510252063,0.7818314824680298,0.6234898018587336,0.49999999999999994,0.8660254037844387,12.92,77.54,49,7.721554047380736,7,2.0,1.6,0,6.259236808685034
Ordinary Theft,22/02/2018,3:30,12.925671,77.548944,2018-02-22 03:30:00,3,3,22,2,1,0,0,0,0,1,0.7071067811865475,0.7071067811865476,0.43388373911755823,-0.900968867902419,0.8660254037844386,0.5000000000000001,12.92,77.54,49,7.110635624141117,7,2.0,3.0,0,11.736069016284437
Ordinary Theft,24/02/2018,2:00,12.925293,77.549804,2018-02-24 02:00:00,2,5,24,2,1,1,0,0,0,1,0.49999999999999994,0.8660254037844387,-0.9749279121818236,-0.2225209339563146,0.8660254037844386,0.5000000000000001,12.92,77.54,49,7.076633941347993,7,2.0,3.0,0,11.736069016284437
Ordinary Theft,21/03/2018,10:50,12.926135,77.550311,2018-03-21 10:50:00,10,2,21,3,1,0,1,0,0,0,0.49999999999999994,-0.8660254037844387,0.9749279121818236,-0.22252093395631434,1.0,6.123233995736766e-17,12.92,77.55,55,6.970856932664902,7,2.0,1.6,0,6.44056270517624
Ordinary Theft,17/08/2018,7:30,12.932048,77.549266,2018-08-17 07:30:00,7,4,17,8,3,0,1,0,0,0,0.9659258262890683,-0.25881904510252063,-0.433883739117558,-0.9009688679024191,-0.8660254037844384,-0.5000000000000004,12.93,77.54,28,6.593672185341041,7,2.0,1.6,0,5.387673327978359
Ordinary Theft,23/08/2018,9:15,12.928496,77.545938,2018-08-23 09:15:00,9,3,23,8,3,0,1,0,0,0,0.7071067811865476,-0.7071067811865475,0.43388373911755823,-0.900968867902419,-0.8660254037844384,-0.5000000000000004,12.92,77.54,49,7.126042899446427,7,2.0,1.6,0,6.259236808685034
Ordinary Theft,29/08/2018,12:15,12.919309,77.53946,2018-08-29 12:15:00,12,2,29,8,3,0,0,1,0,0,1.2246467991473532e-16,-1.0,0.9749279121818236,-0.22252093395631434,-0.8660254037844384,-0.5000000000000004,12.91,77.53,20,8.337528869455555,7,2.0,2.0,0,6.089044875446846
Ordinary Theft,31/08/2018,10:30,12.027957,77.632495,2018-08-31 10:30:00,10,4,31,8,3,0,1,0,0,0,0.49999999999999994,-0.8660254037844387,-0.433883739117558,-0.9009688679024191,-0.8660254037844384,-0.5000000000000004,12.02,77.63,1,105.00892562434016,7,2.0,1.6,0,1.1090354888959124
Ordinary Theft,22/11/2018,11:50,12.923881,77.553337,2018-11-22 11:50:00,11,3,22,11,4,0,1,0,0,0,0.258819045102521,-0.9659258262890682,0.43388373911755823,-0.900968867902419,-0.5000000000000004,0.8660254037844384,12.92,77.55,55,6.939008112969997,7,2.0,1.6,0,6.44056270517624
Ordinary Theft,17/12/2018,5:30,12.923268,77.5479842,2018-12-17 05:30:00,5,0,17,12,4,0,0,0,0,1,0.9659258262890683,0.25881904510252074,0.0,1.0,-2.4492935982947064e-16,1.0,12.92,77.54,49,7.375774369784094,7,2.0,3.0,0,11.736069016284437
Ordinary Theft,22/02/2019,6:37,12.928504,77.562012,2019-02-22 06:37:00,6,4,22,2,1,0,1,0,0,0,1.0,6.123233995736766e-17,-0.433883739117558,-0.9009688679024191,0.8660254037844386,0.5000000000000001,12.92,77.56,33,5.952729584278607,7,2.0,1.6,0,5.642176839385859
Ordinary Theft,27/02/2019,10:00,12.923777,77.553303,2019-02-27 10:00:00,10,2,27,2,1,0,1,0,0,0,0.49999999999999994,-0.8660254037844387,0.9749279121818236,-0.22252093395631434,0.8660254037844386,0.5000000000000001,12.92,77.55,55,6.950227548664829,7,2.0,1.6,0,6.44056270517624
Ordinary Theft,27/05/2019,2:00,12.924268,77.551878,2019-05-27 02:00:00,2,0,27,5,2,0,0,0,0,1,0.49999999999999994,0.8660254037844387,0.0,1.0,0.49999999999999994,-0.8660254037844387,12.92,77.55,55,7.0095628157709156,7,2.0,3.0,0,12.076055072205449
Kidnap,24/02/2016,13:30,12.544211,77.342996,2016-02-24 13:30:00,13,2,24,2,1,0,0,1,0,0,-0.2588190451025208,-0.9659258262890683,0.9749279121818236,-0.22252093395631434,0.8660254037844386,0.5000000000000001,12.540000000000001,77.34,4,54.79986114640664,5,2.0,2.0,0,3.2188758248682006
Kidnap,1/9/2016,12:35,12.926974,77.576626,2016-09-01 12:35:00,12,3,1,9,3,0,0,1,0,0,1.2246467991473532e-16,-1.0,0.43388373911755823,-0.900968867902419,-1.0,-1.8369701987210297e-16,12.92,77.57000000000001,55,5.33077526834044,5,2.0,2.0,0,8.0507033814703
Kidnap,9/1/2017,11:20,12.919712,77.575901,2017-01-09 11:20:00,11,0,9,1,1,0,1,0,0,0,0.258819045102521,-0.9659258262890682,0.0,1.0,0.49999999999999994,0.8660254037844387,12.91,77.57000000000001,82,6.115183925255365,5,2.0,1.6,0,7.070144972474558
Kidnap,13/09/2017,16:00,12.912479,77.574069,2017-09-13 16:00:00,16,2,13,9,3,0,0,1,0,0,-0.8660254037844384,-0.5000000000000004,0.9749279121818236,-0.22252093395631434,-1.0,-1.8369701987210297e-16,12.91,77.57000000000001,82,6.940265737855887,5,2.0,2.0,0,8.837681215593197
Kidnap,24/10/2017,12:45,12.922032,77.575659,2017-10-24 12:45:00,12,1,24,10,4,0,0,1,0,0,1.2246467991473532e-16,-1.0,0.7818314824680298,0.6234898018587336,-0.8660254037844386,0.5000000000000001,12.92,77.57000000000001,55,5.881506769256849,5,2.0,2.0,0,8.0507033814703
Kidnap,31/10/2017,18:15,12.933466,77.584554,2017-10-31 18:15:00,18,1,31,10,4,0,0,0,1,0,-1.0,-1.8369701987210297e-16,0.7818314824680298,0.6234898018587336,-0.8660254037844386,0.5000000000000001,12.93,77.58,74,4.377824470306516,5,2.0,2.4,0,10.361971472487143
Kidnap,20/03/2018,13:00,12.929851,77.585404,2018-03-20 13:00:00,13,1,20,3,1,0,0,1,0,0,-0.2588190451025208,-0.9659258262890683,0.7818314824680298,0.6234898018587336,1.0,6.123233995736766e-17,12.92,77.58,144,4.74803368749297,5,2.0,2.0,0,9.953467484841148
Kidnap,10/4/2018,16:15,12.932018,77.586094,2018-04-10 16:15:00,16,1,10,4,2,0,0,1,0,0,-0.8660254037844384,-0.5000000000000004,0.7818314824680298,0.6234898018587336,0.8660254037844387,-0.49999999999999983,12.93,77.58,74,4.496803340975623,5,2.0,2.0,0,8.63497622707262
Kidnap,24/04/2018,11:00,12.91974,77.578194,2018-04-24 11:00:00,11,1,24,4,2,0,1,0,0,0,0.258819045102521,-0.9659258262890682,0.7818314824680298,0.6234898018587336,0.8660254037844387,-0.49999999999999983,12.91,77.57000000000001,82,6.03442065522923,5,2.0,1.6,0,7.070144972474558
Kidnap,29/07/2018,17:00,12.922096,77.57601,2018-07-29 17:00:00,17,6,29,7,3,1,0,1,0,0,-0.9659258262890683,-0.25881904510252063,-0.7818314824680299,0.6234898018587334,-0.4999999999999998,-0.8660254037844388,12.92,77.57000000000001,55,5.861656749984373,5,2.0,2.0,0,8.0507033814703
Kidnap,2/11/2018,10:00,13.08022,80.16636,2018-11-02 10:00:00,10,4,2,11,4,0,1,0,0,0,0.49999999999999994,-0.8660254037844387,-0.433883739117558,-0.9009688679024191,-0.5000000000000004,0.8660254037844384,13.08,80.16,1,278.86867769886203,5,2.0,1.6,0,1.1090354888959124
Kidnap,30/03/2019,20:45,12.93091,77.57812,2019-03-30 20:45:00,20,5,30,3,1,1,0,0,1,0,-0.8660254037844386,0.5000000000000001,-0.9749279121818236,-0.2225209339563146,1.0,6.123233995736766e-17,12.93,77.57000000000001,40,4.86422116655978,5,2.0,2.4,0,8.912572960090339
Kidnap,27/06/2019,21:30,12.935478,77.589671,2019-06-27 21:30:00,21,3,27,6,2,0,0,0,1,0,-0.7071067811865477,0.7071067811865474,0.43388373911755823,-0.900968867902419,1.2246467991473532e-16,-1.0,12.93,77.58,74,4.0519424321281,5,2.0,2.4,0,10.361971472487143
Kidnap,10/8/2019,18:00,12.92924,77.57816,2019-08-10 18:00:00,18,5,10,8,3,1,0,0,1,0,-1.0,-1.8369701987210297e-16,-0.9749279121818236,-0.2225209339563146,-0.8660254037844384,-0.5000000000000004,12.92,77.57000000000001,55,5.035876783808762,5,2.0,2.4,0,9.66084405776436
Kidnap,19/11/2019,20:30,12.2879,76.63267,2019-11-19 20:30:00,20,1,19,11,4,0,0,0,1,0,-0.8660254037844386,0.5000000000000001,0.7818314824680298,0.6234898018587336,-0.5000000000000004,0.8660254037844384,12.280000000000001,76.63,7,129.12527290876736,5,2.0,2.4,0,4.990659700031606
Kidnap,20/11/2019,16:00,12.28792,76.63243,2019-11-20 16:00:00,16,2,20,11,4,0,0,1,0,0,-0.8660254037844384,-0.5000000000000004,0.9749279121818236,-0.22252093395631434,-0.5000000000000004,0.8660254037844384,12.280000000000001,76.63,7,129.1450104153642,5,2.0,2.0,0,4.1588830833596715
Kidnap,18/07/2015,20:45,12.943265,77.574663,2015-07-18 20:45:00,20,5,18,7,3,1,0,0,1,0,-0.8660254037844386,0.5000000000000001,-0.9749279121818236,-0.2225209339563146,-0.4999999999999998,-0.8660254037844388,12.94,77.57000000000001,55,3.820272506970818,5,2.0,2.4,0,9.66084405776436
Kidnap,26/11/2015,18:15,12.940063,77.573045,2015-11-26 18:15:00,18,3,26,11,4,0,0,0,1,0,-1.0,-1.8369701987210297e-16,0.43388373911755823,-0.900968867902419,-0.5000000000000004,0.8660254037844384,12.94,77.57000000000001,55,4.213460406609628,5,2.0,2.4,0,9.66084405776436
Kidnap,30/11/2015,23:50,12.940191,77.568224,2015-11-30 23:50:00,23,0,30,11,4,0,0,0,0,1,-0.25881904510252157,0.9659258262890681,0.0,1.0,-0.5000000000000004,0.8660254037844384,12.94,77.56,99,4.512992186864732,5,2.0,3.0,0,13.815510557964275
Kidnap,19/12/2015,20:45,12.947992,77.573527,2015-12-19 20:45:00,20,5,19,12,4,1,0,0,1,0,-0.8660254037844386,0.5000000000000001,-0.9749279121818236,-0.2225209339563146,-2.4492935982947064e-16,1.0,12.94,77.57000000000001,55,3.479306943421764,5,2.0,2.4,0,9.66084405776436
Kidnap,13/01/2016,12:30,12.94156,77.567074,2016-01-13 12:30:00,12,2,13,1,1,0,0,1,0,0,1.2246467991473532e-16,-1.0,0.9749279121818236,-0.22252093395631434,0.49999999999999994,0.8660254037844387,12.94,77.56,99,4.478261160242029,5,2.0,2.0,0,9.210340371976184
Kidnap,28/03/2017,14:00,12.563457,77.343049,2017-03-28 14:00:00,14,1,28,3,1,0,0,1,0,0,-0.4999999999999998,-0.8660254037844388,0.7818314824680298,0.6234898018587336,1.0,6.123233995736766e-17,12.56,77.34,5,52.95119179200835,5,2.0,2.0,0,3.58351893845611
Kidnap,25/06/2017,14:30,12.9402772,77.572097,2017-06-25 14:30:00,14,6,25,6,2,1,0,1,0,0,-0.4999999999999998,-0.8660254037844388,-0.7818314824680299,0.6234898018587334,1.2246467991473532e-16,-1.0,12.94,77.57000000000001,55,4.251732023618713,5,2.0,2.0,0,8.0507033814703
Kidnap,16/10/2017,21:10,12.93543,77.5668,2017-10-16 21:10:00,21,0,16,10,4,0,0,0,1,0,-0.7071067811865477,0.7071067811865474,0.0,1.0,-0.8660254037844386,0.5000000000000001,12.93,77.56,63,5.025069960428947,5,2.0,2.4,0,9.981319400063212
Kidnap,26/12/2017,17:00,12.943663,77.574706,2017-12-26 17:00:00,17,1,26,12,4,0,0,1,0,0,-0.9659258262890683,-0.25881904510252063,0.7818314824680298,0.6234898018587336,-2.4492935982947064e-16,1.0,12.94,77.57000000000001,55,3.7811966715646066,5,2.0,2.0,0,8.0507033814703
Kidnap,19/07/2018,22:30,12.944817,77.578516,2018-07-19 22:30:00,22,3,19,7,3,0,0,0,0,1,-0.5000000000000004,0.8660254037844384,0.43388373911755823,-0.900968867902419,-0.4999999999999998,-0.8660254037844388,12.94,77.57000000000001,55,3.4506564481289144,5,2.0,3.0,0,12.076055072205449
Kidnap,16/02/2019,10:40,12.941435,77.571215,2019-02-16 10:40:00,10,5,16,2,1,1,1,0,0,0,0.49999999999999994,-0.8660254037844387,-0.9749279121818236,-0.2225209339563146,0.8660254037844386,0.5000000000000001,12.94,77.57000000000001,55,4.203836564771648,5,2.0,1.6,0,6.44056270517624
Kidnap,14/01/2015,4:10,12.906409,77.5714701,2015-01-14 04:10:00,4,2,14,1,1,0,0,0,0,1,0.8660254037844386,0.5000000000000001,0.9749279121818236,-0.22252093395631434,0.49999999999999994,0.8660254037844387,12.9,77.57000000000001,96,7.67006098137986,5,2.0,3.0,0,13.724132935510148
Kidnap,24/08/2015,7:30,12.8976927,77.5808958,2015-08-24 07:30:00,7,0,24,8,3,0,1,0,0,0,0.9659258262890683,-0.25881904510252063,0.0,1.0,-0.8660254037844384,-0.5000000000000004,12.89,77.58,36,8.351238133392117,5,2.0,1.6,0,5.77746866023076
Kidnap,24/09/2015,3:05,12.8977965,77.5836728,2015-09-24 03:05:00,3,3,24,9,3,0,0,0,0,1,0.7071067811865475,0.7071067811865476,0.43388373911755823,-0.900968867902419,-1.0,-1.8369701987210297e-16,12.89,77.58,36,8.291576583307897,5,2.0,3.0,0,10.832753737932673
Kidnap,24/12/2015,1:45,12.9059617,77.5793992,2015-12-24 01:45:00,1,3,24,12,4,0,0,0,0,1,0.25881904510252074,0.9659258262890683,0.43388373911755823,-0.900968867902419,-2.4492935982947064e-16,1.0,12.9,77.57000000000001,96,7.482242223349992,5,2.0,3.0,0,13.724132935510148
Kidnap,30/12/2015,5:05,12.8986817,77.5690523,2015-12-30 05:05:00,5,2,30,12,4,0,0,0,0,1,0.9659258262890683,0.25881904510252074,0.9749279121818236,-0.22252093395631434,-2.4492935982947064e-16,1.0,12.89,77.56,99,8.567826109203173,5,2.0,3.0,0,13.815510557964275
Kidnap,23/01/2016,1:00,12.8980073,77.5939724,2016-01-23 01:00:00,1,5,23,1,1,1,0,0,0,1,0.25881904510252074,0.9659258262890683,-0.9749279121818236,-0.2225209339563146,0.49999999999999994,0.8660254037844387,12.89,77.59,5,8.183417531332505,5,2.0,3.0,0,5.375278407684165
Kidnap,14/04/2016,6:10,12.8842378,77.5595444,2016-04-14 06:10:00,6,3,14,4,2,0,1,0,0,0,1.0,6.123233995736766e-17,0.43388373911755823,-0.900968867902419,0.8660254037844387,-0.49999999999999983,12.88,77.55,33,10.430735529261725,5,2.0,1.6,0,5.642176839385859
Kidnap,17/08/2016,3:25,12.9052883,77.5764984,2016-08-17 03:25:00,3,2,17,8,3,0,0,0,0,1,0.7071067811865475,0.7071067811865476,0.9749279121818236,-0.22252093395631434,-0.8660254037844384,-0.5000000000000004,12.9,77.57000000000001,96,7.630016032820526,5,2.0,3.0,0,13.724132935510148
Kidnap,18/08/2016,8:30,12.9096707,77.5790691,2016-08-18 08:30:00,8,3,18,8,3,0,1,0,0,0,0.8660254037844387,-0.49999999999999983,0.43388373911755823,-0.900968867902419,-0.8660254037844384,-0.5000000000000004,12.9,77.57000000000001,96,7.088927708832063,5,2.0,1.6,0,7.319537565605413
Kidnap,25/12/2016,9:30,12.911281,77.5902845,2016-12-25 09:30:00,9,6,25,12,4,1,1,0,0,0,0.7071067811865476,-0.7071067811865475,-0.7818314824680299,0.6234898018587334,-2.4492935982947064e-16,1.0,12.91,77.59,48,6.723451806609839,5,2.0,1.6,0,6.226912476977002
Kidnap,28/01/2017,4:00,12.915219,77.5818953,2017-01-28 04:00:00,4,5,28,1,1,1,0,0,0,1,0.8660254037844386,0.5000000000000001,-0.9749279121818236,-0.2225209339563146,0.49999999999999994,0.8660254037844387,12.91,77.58,105,6.418681749522069,5,2.0,3.0,0,13.9903172823362
Kidnap,28/09/2018,4:00,12.9085194,77.5796617,2018-09-28 04:00:00,4,4,28,9,3,0,0,0,0,1,0.8660254037844386,0.5000000000000001,-0.433883739117558,-0.9009688679024191,-1.0,-1.8369701987210297e-16,12.9,77.57000000000001,96,7.198636917195638,5,2.0,3.0,0,13.724132935510148
Kidnap,17/11/2018,4:00,12.9085194,77.5796617,2018-11-17 04:00:00,4,5,17,11,4,1,0,0,0,1,0.8660254037844386,0.5000000000000001,-0.9749279121818236,-0.2225209339563146,-0.5000000000000004,0.8660254037844384,12.9,77.57000000000001,96,7.198636917195638,5,2.0,3.0,0,13.724132935510148
Kidnap,17/11/2018,4:45,12.9096936,77.5792533,2018-11-17 04:45:00,4,5,17,11,4,1,0,0,0,1,0.8660254037844386,0.5000000000000001,-0.9749279121818236,-0.2225209339563146,-0.5000000000000004,0.8660254037844384,12.9,77.57000000000001,96,7.081739576997165,5,2.0,3.0,0,13.724132935510148
Kidnap,13/12/2018,4:25,12.9074697,77.5904753,2018-12-13 04:25:00,4,3,13,12,4,0,0,0,0,1,0.8660254037844386,0.5000000000000001,0.43388373911755823,-0.900968867902419,-2.4492935982947064e-16,1.0,12.9,77.59,25,7.144960179440348,5,2.0,3.0,0,9.774289614064447
Kidnap,19/12/2018,10:00,12.9085194,77.5796617,2018-12-19 10:00:00,10,2,19,12,4,0,1,0,0,0,0.49999999999999994,-0.8660254037844387,0.9749279121818236,-0.22252093395631434,-2.4492935982947064e-16,1.0,12.9,77.57000000000001,96,7.198636917195638,5,2.0,1.6,0,7.319537565605413
Kidnap,20/08/2019,12:00,12.9107582,77.5767422,2019-08-20 12:00:00,12,1,20,8,3,0,0,1,0,0,1.2246467991473532e-16,-1.0,0.7818314824680298,0.6234898018587336,-0.8660254037844384,-0.5000000000000004,12.91,77.57000000000001,82,7.0366548893601015,5,2.0,2.0,0,8.837681215593197
Kidnap,21/11/2019,8:35,12.9117832,77.5929617,2019-11-21 08:35:00,8,3,21,11,4,0,1,0,0,0,0.8660254037844387,-0.49999999999999983,0.43388373911755823,-0.900968867902419,-0.5000000000000004,0.8660254037844384,12.91,77.59,48,6.653693839125148,5,2.0,1.6,0,6.226912476977002
Kidnap,29/12/2018,10:30,12.9261268,77.575693,2018-12-29 10:30:00,10,5,29,12,4,1,1,0,0,0,0.49999999999999994,-0.8660254037844387,-0.9749279121818236,-0.2225209339563146,-2.4492935982947064e-16,1.0,12.92,77.57000000000001,55,5.455736747220019,5,2.0,1.6,0,6.44056270517624
Kidnap,16/01/2017,13:00,12.551022,77.334785,2017-01-16 13:00:00,13,0,16,1,1,0,0,1,0,0,-0.2588190451025208,-0.9659258262890683,0.0,1.0,0.49999999999999994,0.8660254037844387,12.55,77.33,2,54.59837092377823,5,2.0,2.0,0,2.1972245773362196
Kidnap,11/10/2018,21:00,12.9261268,77.575693,2018-10-11 21:00:00,21,3,11,10,4,0,0,0,1,0,-0.7071067811865477,0.7071067811865474,0.43388373911755823,-0.900968867902419,-0.8660254037844386,0.5000000000000001,12.92,77.57000000000001,55,5.455736747220019,5,2.0,2.4,0,9.66084405776436
Kidnap,25/10/2018,11:30,12.94355,77.60976,2018-10-25 11:30:00,11,3,25,10,4,0,1,0,0,0,0.258819045102521,-0.9659258262890682,0.43388373911755823,-0.900968867902419,-0.8660254037844386,0.5000000000000001,12.94,77.60000000000001,2,3.5251996298341797,5,2.0,1.6,0,1.7577796618689758
Kidnap,29/12/2018,18:30,12.9261268,77.575693,2018-12-29 18:30:00,18,5,29,12,4,1,0,0,1,0,-1.0,-1.8369701987210297e-16,-0.9749279121818236,-0.2225209339563146,-2.4492935982947064e-16,1.0,12.92,77.57000000000001,55,5.455736747220019,5,2.0,2.4,0,9.66084405776436
Kidnap,4/5/2015,15:30,12.934299,77.591433,2015-05-04 15:30:00,15,0,4,5,2,0,0,1,0,0,-0.7071067811865471,-0.7071067811865479,0.0,1.0,0.49999999999999994,-0.8660254037844387,12.93,77.59,58,4.161856251393414,5,2.0,2.0,0,8.15507488781144
Kidnap,13/06/2015,19:30,12.946052,77.591889,2015-06-13 19:30:00,19,5,13,6,2,1,0,0,1,0,-0.9659258262890684,0.2588190451025203,-0.9749279121818236,-0.2225209339563146,1.2246467991473532e-16,-1.0,12.94,77.59,130,2.8559572794901005,5,2.0,2.4,0,11.700473575682762
Kidnap,13/07/2015,18:45,12.944562,77.592138,2015-07-13 18:45:00,18,0,13,7,3,0,0,0,1,0,-1.0,-1.8369701987210297e-16,0.0,1.0,-0.4999999999999998,-0.8660254037844388,12.94,77.59,130,3.018302465292814,5,2.0,2.4,0,11.700473575682762
Kidnap,29/08/2015,11:00,12.936308,77.593096,2015-08-29 11:00:00,11,5,29,8,3,1,1,0,0,0,0.258819045102521,-0.9659258262890682,-0.9749279121818236,-0.2225209339563146,-0.8660254037844384,-0.5000000000000004,12.93,77.59,58,3.927674303931395,5,2.0,1.6,0,6.524059910249152
Kidnap,4/9/2015,13:00,12.934135,77.591152,2015-09-04 13:00:00,13,4,4,9,3,0,0,1,0,0,-0.2588190451025208,-0.9659258262890683,-0.433883739117558,-0.9009688679024191,-1.0,-1.8369701987210297e-16,12.93,77.59,58,4.182640590644058,5,2.0,2.0,0,8.15507488781144
Kidnap,15/01/2016,12:30,12.934263,77.592712,2016-01-15 12:30:00,12,4,15,1,1,0,0,1,0,0,1.2246467991473532e-16,-1.0,-0.433883739117558,-0.9009688679024191,0.49999999999999994,0.8660254037844387,12.93,77.59,58,4.156723094656064,5,2.0,2.0,0,8.15507488781144
Kidnap,23/02/2016,12:40,12.943446,77.594168,2016-02-23 12:40:00,12,1,23,2,1,0,0,1,0,0,1.2246467991473532e-16,-1.0,0.7818314824680298,0.6234898018587336,0.8660254037844386,0.5000000000000001,12.94,77.59,130,3.130931953721457,5,2.0,2.0,0,9.750394646402302
Kidnap,30/03/2016,11:10,12.946683,77.594379,2016-03-30 11:10:00,11,2,30,3,1,0,1,0,0,0,0.258819045102521,-0.9659258262890682,0.9749279121818236,-0.22252093395631434,1.0,6.123233995736766e-17,12.94,77.59,130,2.7707474838511326,5,2.0,1.6,0,7.800315717121842
Kidnap,16/06/2016,14:00,12.936308,77.593096,2016-06-16 14:00:00,14,3,16,6,2,0,0,1,0,0,-0.4999999999999998,-0.8660254037844388,0.43388373911755823,-0.900968867902419,1.2246467991473532e-16,-1.0,12.93,77.59,58,3.927674303931395,5,2.0,2.0,0,8.15507488781144
Kidnap,15/07/2016,17:30,12.943578,77.591104,2016-07-15 17:30:00,17,4,15,7,3,0,0,1,0,0,-0.9659258262890683,-0.25881904510252063,-0.433883739117558,-0.9009688679024191,-0.4999999999999998,-0.8660254037844388,12.94,77.59,130,3.1388497910476256,5,2.0,2.0,0,9.750394646402302
Kidnap,28/07/2016,15:00,12.942478,77.589838,2016-07-28 15:00:00,15,3,28,7,3,0,0,1,0,0,-0.7071067811865471,-0.7071067811865479,0.43388373911755823,-0.900968867902419,-0.4999999999999998,-0.8660254037844388,12.94,77.58,80,3.2790768575933202,5,2.0,2.0,0,8.788898309344878
Kidnap,17/10/2016,18:30,12.942789,77.596405,2016-10-17 18:30:00,18,0,17,10,4,0,0,0,1,0,-1.0,-1.8369701987210297e-16,0.0,1.0,-0.8660254037844386,0.5000000000000001,12.94,77.59,130,3.2096024966926207,5,2.0,2.4,0,11.700473575682762
Kidnap,7/1/2017,8:20,12.936244,77.596173,2017-01-07 08:20:00,8,5,7,1,1,1,1,0,0,0,0.8660254037844387,-0.49999999999999983,-0.9749279121818236,-0.2225209339563146,0.49999999999999994,0.8660254037844387,12.93,77.59,58,3.9351014629437735,5,2.0,1.6,0,6.524059910249152
Kidnap,29/04/2017,22:05,12.945109,77.592747,2017-04-29 22:05:00,22,5,29,4,2,1,0,0,0,1,-0.5000000000000004,0.8660254037844384,-0.9749279121818236,-0.2225209339563146,0.8660254037844387,-0.49999999999999983,12.94,77.59,130,2.9525007252995175,5,2.0,3.0,0,14.625591969603454
Kidnap,1/5/2017,18:00,12.946168,77.591807,2017-05-01 18:00:00,18,0,1,5,2,0,0,0,1,0,-1.0,-1.8369701987210297e-16,0.0,1.0,0.49999999999999994,-0.8660254037844387,12.94,77.59,130,2.8440592626077987,5,2.0,2.4,0,11.700473575682762
Kidnap,4/7/2017,17:00,12.942161,77.592299,2017-07-04 17:00:00,17,1,4,7,3,0,0,1,0,0,-0.9659258262890683,-0.25881904510252063,0.7818314824680298,0.6234898018587336,-0.4999999999999998,-0.8660254037844388,12.94,77.59,130,3.282950212515822,5,2.0,2.0,0,9.750394646402302
Kidnap,8/7/2017,15:00,12.945109,77.592747,2017-07-08 15:00:00,15,5,8,7,3,1,0,1,0,0,-0.7071067811865471,-0.7071067811865479,-0.9749279121818236,-0.2225209339563146,-0.4999999999999998,-0.8660254037844388,12.94,77.59,130,2.9525007252995175,5,2.0,2.0,0,9.750394646402302
Kidnap,17/07/2017,20:00,12.935645,77.591333,2017-07-17 20:00:00,20,0,17,7,3,0,0,0,1,0,-0.8660254037844386,0.5000000000000001,0.0,1.0,-0.4999999999999998,-0.8660254037844388,12.93,77.59,58,4.01365784481178,5,2.0,2.4,0,9.786089865373727
Kidnap,24/10/2017,17:00,12.945109,77.592747,2017-10-24 17:00:00,17,1,24,10,4,0,0,1,0,0,-0.9659258262890683,-0.25881904510252063,0.7818314824680298,0.6234898018587336,-0.8660254037844386,0.5000000000000001,12.94,77.59,130,2.9525007252995175,5,2.0,2.0,0,9.750394646402302
Kidnap,5/2/2018,20:00,12.940933,77.580283,2018-02-05 20:00:00,20,0,5,2,1,0,0,0,1,0,-0.8660254037844386,0.5000000000000001,0.0,1.0,0.8660254037844386,0.5000000000000001,12.94,77.58,80,3.7463573017529495,5,2.0,2.4,0,10.546677971213853
Kidnap,30/04/2018,14:00,12.940022,77.594191,2018-04-30 14:00:00,14,0,30,4,2,0,0,1,0,0,-0.4999999999999998,-0.8660254037844388,0.0,1.0,0.8660254037844387,-0.49999999999999983,12.94,77.59,130,3.5115930996661406,5,2.0,2.0,0,9.750394646402302
Kidnap,17/05/2018,16:00,12.944786,77.592797,2018-05-17 16:00:00,16,3,17,5,2,0,0,1,0,0,-0.8660254037844384,-0.5000000000000004,0.43388373911755823,-0.900968867902419,0.49999999999999994,-0.8660254037844387,12.94,77.59,130,2.9879753617078704,5,2.0,2.0,0,9.750394646402302
Kidnap,4/7/2018,10:00,12.942787,77.58337,2018-07-04 10:00:00,10,2,4,7,3,0,1,0,0,0,0.49999999999999994,-0.8660254037844387,0.9749279121818236,-0.22252093395631434,-0.4999999999999998,-0.8660254037844388,12.94,77.58,80,3.4271882191427836,5,2.0,1.6,0,7.031118647475903
Kidnap,19/09/2018,14:30,12.936244,77.596173,2018-09-19 14:30:00,14,2,19,9,3,0,0,1,0,0,-0.4999999999999998,-0.8660254037844388,0.9749279121818236,-0.22252093395631434,-1.0,-1.8369701987210297e-16,12.93,77.59,58,3.9351014629437735,5,2.0,2.0,0,8.15507488781144
Kidnap,24/07/2019,14:00,12.935678,77.597567,2019-07-24 14:00:00,14,2,24,7,3,0,0,1,0,0,-0.4999999999999998,-0.8660254037844388,0.9749279121818236,-0.22252093395631434,-0.4999999999999998,-0.8660254037844388,12.93,77.59,58,4.007263413738981,5,2.0,2.0,0,8.15507488781144
Kidnap,5/9/2019,12:00,12.933417,77.590693,2019-09-05 12:00:00,12,3,5,9,3,0,0,1,0,0,1.2246467991473532e-16,-1.0,0.43388373911755823,-0.900968867902419,-1.0,-1.8369701987210297e-16,12.93,77.59,58,4.2668135314876245,5,2.0,2.0,0,8.15507488781144
Kidnap,16/09/2019,16:00,12.942787,77.58337,2019-09-16 16:00:00,16,0,16,9,3,0,0,1,0,0,-0.8660254037844384,-0.5000000000000004,0.0,1.0,-1.0,-1.8369701987210297e-16,12.94,77.58,80,3.4271882191427836,5,2.0,2.0,0,8.788898309344878
Kidnap,16/11/2019,18:00,12.944786,77.592797,2019-11-16 18:00:00,18,5,16,11,4,1,0,0,1,0,-1.0,-1.8369701987210297e-16,-0.9749279121818236,-0.2225209339563146,-0.5000000000000004,0.8660254037844384,12.94,77.59,130,2.9879753617078704,5,2.0,2.4,0,11.700473575682762
Kidnap,9/1/2015,5:00,12.90353394,77.54124559,2015-01-09 05:00:00,5,4,9,1,1,0,0,0,0,1,0.9659258262890683,0.25881904510252074,-0.433883739117558,-0.9009688679024191,0.49999999999999994,0.8660254037844387,12.9,77.54,56,9.524536322669908,5,2.0,3.0,0,12.129153803503652
Kidnap,24/02/2015,18:15,12.91094209,77.5562327,2015-02-24 18:15:00,18,1,24,2,1,0,0,0,1,0,-1.0,-1.8369701987210297e-16,0.7818314824680298,0.6234898018587336,0.8660254037844386,0.5000000000000001,12.91,77.55,40,7.923449275209888,5,2.0,2.4,0,8.912572960090339
Kidnap,12/3/2015,9:15,12.9060275,77.54555561,2015-03-12 09:15:00,9,3,12,3,1,0,1,0,0,0,0.7071067811865476,-0.7071067811865475,0.43388373911755823,-0.900968867902419,1.0,6.123233995736766e-17,12.9,77.54,56,9.022911783480478,5,2.0,1.6,0,6.468882028535281
Kidnap,8/5/2015,14:20,12.91147627,77.5401234,2015-05-08 14:20:00,14,4,8,5,2,0,0,1,0,0,-0.4999999999999998,-0.8660254037844388,-0.433883739117558,-0.9009688679024191,0.49999999999999994,-0.8660254037844387,12.91,77.54,47,8.91899264915303,5,2.0,2.0,0,7.742402021815782
Kidnap,12/6/2015,11:45,12.88273731,77.55652345,2015-06-12 11:45:00,11,4,12,6,2,0,1,0,0,0,0.258819045102521,-0.9659258262890682,-0.433883739117558,-0.9009688679024191,1.2246467991473532e-16,-1.0,12.88,77.55,33,10.708158846100648,5,2.0,1.6,0,5.642176839385859
Kidnap,18/08/2015,13:00,12.88289563,77.56647782,2015-08-18 13:00:00,13,1,18,8,3,0,0,1,0,0,-0.2588190451025208,-0.9659258262890683,0.7818314824680298,0.6234898018587336,-0.8660254037844384,-0.5000000000000004,12.88,77.56,64,10.323621942872908,5,2.0,2.0,0,8.348774539791274
Kidnap,1/9/2015,15:00,12.90557877,77.55645958,2015-09-01 15:00:00,15,1,1,9,3,0,0,1,0,0,-0.7071067811865471,-0.7071067811865479,0.7818314824680298,0.6234898018587336,-1.0,-1.8369701987210297e-16,12.9,77.55,37,8.424851883984875,5,2.0,2.0,0,7.275172319452771
Kidnap,15/10/2015,14:10,12.91429834,77.55075847,2015-10-15 14:10:00,14,3,15,10,4,0,0,1,0,0,-0.4999999999999998,-0.8660254037844388,0.43388373911755823,-0.900968867902419,-0.8660254037844386,0.5000000000000001,12.91,77.55,40,7.9480140200790945,5,2.0,2.0,0,7.427144133408616
Kidnap,26/10/2015,16:00,12.88982145,77.57974701,2015-10-26 16:00:00,16,0,26,10,4,0,0,1,0,0,-0.8660254037844384,-0.5000000000000004,0.0,1.0,-0.8660254037844386,0.5000000000000001,12.88,77.57000000000001,71,9.234734028642427,5,2.0,2.0,0,8.55333223803211
Kidnap,30/10/2015,10:00,12.90795681,77.53644101,2015-10-30 10:00:00,10,4,30,10,4,0,1,0,0,0,0.49999999999999994,-0.8660254037844387,-0.433883739117558,-0.9009688679024191,-0.8660254037844386,0.5000000000000001,12.9,77.53,36,9.476597349134382,5,2.0,1.6,0,5.77746866023076
Kidnap,20/11/2015,12:00,12.8894463,77.57152367,2015-11-20 12:00:00,12,4,20,11,4,0,0,1,0,0,1.2246467991473532e-16,-1.0,-0.433883739117558,-0.9009688679024191,-0.5000000000000004,0.8660254037844384,12.88,77.57000000000001,71,9.471225084412897,5,2.0,2.0,0,8.55333223803211
Kidnap,7/12/2015,17:50,12.90874577,77.55546611,2015-12-07 17:50:00,17,0,7,12,4,0,0,1,0,0,-0.9659258262890683,-0.25881904510252063,0.0,1.0,-2.4492935982947064e-16,1.0,12.9,77.55,37,8.17514780882462,5,2.0,2.0,0,7.275172319452771
Kidnap,16/12/2015,1:00,12.91766067,77.57653512,2015-12-16 01:00:00,1,2,16,12,4,0,0,0,0,1,0.25881904510252074,0.9659258262890683,0.9749279121818236,-0.22252093395631434,-2.4492935982947064e-16,1.0,12.91,77.57000000000001,82,6.309188172235273,5,2.0,3.0,0,13.256521823389795
Kidnap,24/03/2016,17:50,12.91242363,77.54851768,2016-03-24 17:50:00,17,3,24,3,1,0,0,1,0,0,-0.9659258262890683,-0.25881904510252063,0.43388373911755823,-0.900968867902419,1.0,6.123233995736766e-17,12.91,77.54,47,8.260595812428392,5,2.0,2.0,0,7.742402021815782
Kidnap,30/03/2016,22:10,12.89153086,77.58114868,2016-03-30 22:10:00,22,2,30,3,1,0,0,0,0,1,-0.5000000000000004,0.8660254037844384,0.9749279121818236,-0.22252093395631434,1.0,6.123233995736766e-17,12.89,77.58,36,9.02183836104813,5,2.0,3.0,0,10.832753737932673
Kidnap,12/4/2016,13:30,12.88948381,77.56232091,2016-04-12 13:30:00,13,1,12,4,2,0,0,1,0,0,-0.2588190451025208,-0.9659258262890683,0.7818314824680298,0.6234898018587336,0.8660254037844387,-0.49999999999999983,12.88,77.56,64,9.778097199930913,5,2.0,2.0,0,8.348774539791274
Kidnap,13/04/2016,22:50,12.89153086,77.58114868,2016-04-13 22:50:00,22,2,13,4,2,0,0,0,0,1,-0.5000000000000004,0.8660254037844384,0.9749279121818236,-0.22252093395631434,0.8660254037844387,-0.49999999999999983,12.89,77.58,36,9.02183836104813,5,2.0,3.0,0,10.832753737932673
Kidnap,21/04/2016,3:30,12.88168453,77.56599502,2016-04-21 03:30:00,3,3,21,4,2,0,0,0,0,1,0.7071067811865475,0.7071067811865476,0.43388373911755823,-0.900968867902419,0.8660254037844387,-0.49999999999999983,12.88,77.56,64,10.46774230882558,5,2.0,3.0,0,12.523161809686911
Kidnap,2/5/2016,5:00,12.89047086,77.57081006,2016-05-02 05:00:00,5,0,2,5,2,0,0,0,0,1,0.9659258262890683,0.25881904510252074,0.0,1.0,0.49999999999999994,-0.8660254037844387,12.89,77.57000000000001,44,9.382346338245986,5,2.0,3.0,0,11.419987469310959
Kidnap,9/5/2016,14:00,12.89157884,77.58142943,2016-05-09 14:00:00,14,0,9,5,2,0,0,1,0,0,-0.4999999999999998,-0.8660254037844388,0.0,1.0,0.49999999999999994,-0.8660254037844387,12.89,77.58,36,9.011704119053672,5,2.0,2.0,0,7.221835825288449
Kidnap,16/05/2016,10:30,12.8894463,77.57152367,2016-05-16 10:30:00,10,0,16,5,2,0,1,0,0,0,0.49999999999999994,-0.8660254037844387,0.0,1.0,0.49999999999999994,-0.8660254037844387,12.88,77.57000000000001,71,9.471225084412897,5,2.0,1.6,0,6.842665790425689
Kidnap,18/05/2016,17:40,12.8967726,77.5445644,2016-05-18 17:40:00,17,2,18,5,2,0,0,1,0,0,-0.9659258262890683,-0.25881904510252063,0.9749279121818236,-0.22252093395631434,0.49999999999999994,-0.8660254037844387,12.89,77.54,35,9.931438030122395,5,2.0,2.0,0,7.16703787691222
Kidnap,23/05/2016,18:30,12.91684492,77.54985732,2016-05-23 18:30:00,18,0,23,5,2,0,0,0,1,0,-1.0,-1.8369701987210297e-16,0.0,1.0,0.49999999999999994,-0.8660254037844387,12.91,77.54,47,7.7833082316946465,5,2.0,2.4,0,9.29088242617894
Kidnap,2/6/2016,7:30,12.89594801,77.55219028,2016-06-02 07:30:00,7,3,2,6,2,0,1,0,0,0,0.9659258262890683,-0.25881904510252063,0.43388373911755823,-0.900968867902419,1.2246467991473532e-16,-1.0,12.89,77.55,56,9.585817321355508,5,2.0,1.6,0,6.468882028535281
Kidnap,7/6/2016,10:00,12.87685568,77.58185534,2016-06-07 10:00:00,10,1,7,6,2,0,1,0,0,0,0.49999999999999994,-0.8660254037844387,0.7818314824680298,0.6234898018587336,1.2246467991473532e-16,-1.0,12.870000000000001,77.58,22,10.625248156555923,5,2.0,1.6,0,5.01679074548664
Kidnap,25/06/2016,14:00,12.88274382,77.55727251,2016-06-25 14:00:00,14,5,25,6,2,1,0,1,0,0,-0.4999999999999998,-0.8660254037844388,-0.9749279121818236,-0.2225209339563146,1.2246467991473532e-16,-1.0,12.88,77.55,33,10.67646706120513,5,2.0,2.0,0,7.052721049232323
Kidnap,18/07/2016,20:00,12.88376625,77.56842522,2016-07-18 20:00:00,20,0,18,7,3,0,0,0,1,0,-0.8660254037844386,0.5000000000000001,0.0,1.0,-0.4999999999999998,-0.8660254037844388,12.88,77.56,64,10.17029163660703,5,2.0,2.4,0,10.018529447749527
Kidnap,22/07/2016,13:00,12.88613796,77.5717955,2016-07-22 13:00:00,13,4,22,7,3,0,0,1,0,0,-0.2588190451025208,-0.9659258262890683,-0.433883739117558,-0.9009688679024191,-0.4999999999999998,-0.8660254037844388,12.88,77.57000000000001,71,9.819067263484602,5,2.0,2.0,0,8.55333223803211
Kidnap,12/11/2016,10:45,12.89138852,77.57009241,2016-11-12 10:45:00,10,5,12,11,4,1,1,0,0,0,0.49999999999999994,-0.8660254037844387,-0.9749279121818236,-0.2225209339563146,-0.5000000000000004,0.8660254037844384,12.89,77.57000000000001,44,9.306174492397139,5,2.0,1.6,0,6.090659983632512
Kidnap,26/12/2016,13:50,12.90711393,77.5439924,2016-12-26 13:50:00,13,0,26,12,4,0,0,1,0,0,-0.2588190451025208,-0.9659258262890683,0.0,1.0,-2.4492935982947064e-16,1.0,12.9,77.54,56,9.027471640350738,5,2.0,2.0,0,8.0861025356691
Kidnap,17/01/2017,16:30,12.88255509,77.5563552,2017-01-17 16:30:00,16,1,17,1,1,0,0,1,0,0,-0.8660254037844384,-0.5000000000000004,0.7818314824680298,0.6234898018587336,0.49999999999999994,0.8660254037844387,12.88,77.55,33,10.733887158297923,5,2.0,2.0,0,7.052721049232323
Kidnap,6/2/2017,11:00,12.89528068,77.55067452,2017-02-06 11:00:00,11,0,6,2,1,0,1,0,0,0,0.258819045102521,-0.9659258262890682,0.0,1.0,0.8660254037844386,0.5000000000000001,12.89,77.55,56,9.730306146038496,5,2.0,1.6,0,6.468882028535281
Kidnap,21/02/2017,12:30,12.90827601,77.55022679,2017-02-21 12:30:00,12,1,21,2,1,0,0,1,0,0,1.2246467991473532e-16,-1.0,0.7818314824680298,0.6234898018587336,0.8660254037844386,0.5000000000000001,12.9,77.55,37,8.52668319448319,5,2.0,2.0,0,7.275172319452771
Kidnap,22/02/2017,11:30,12.89189796,77.55236918,2017-02-22 11:30:00,11,2,22,2,1,0,1,0,0,0,0.258819045102521,-0.9659258262890682,0.9749279121818236,-0.22252093395631434,0.8660254037844386,0.5000000000000001,12.89,77.55,56,9.974462937955352,5,2.0,1.6,0,6.468882028535281
Kidnap,25/03/2017,14:00,12.89043496,77.5635394,2017-03-25 14:00:00,14,5,25,3,1,1,0,1,0,0,-0.4999999999999998,-0.8660254037844388,-0.9749279121818236,-0.2225209339563146,1.0,6.123233995736766e-17,12.89,77.56,99,9.632467148590454,5,2.0,2.0,0,9.210340371976184
Kidnap,28/03/2017,12:45,12.88613796,77.5717955,2017-03-28 12:45:00,12,1,28,3,1,0,0,1,0,0,1.2246467991473532e-16,-1.0,0.7818314824680298,0.6234898018587336,1.0,6.123233995736766e-17,12.88,77.57000000000001,71,9.819067263484602,5,2.0,2.0,0,8.55333223803211
Kidnap,26/04/2017,16:00,12.91429834,77.55075847,2017-04-26 16:00:00,16,2,26,4,2,0,0,1,0,0,-0.8660254037844384,-0.5000000000000004,0.9749279121818236,-0.22252093395631434,0.8660254037844387,-0.49999999999999983,12.91,77.55,40,7.9480140200790945,5,2.0,2.0,0,7.427144133408616
Kidnap,5/5/2017,17:00,12.89594801,77.55219028,2017-05-05 17:00:00,17,4,5,5,2,0,0,1,0,0,-0.9659258262890683,-0.25881904510252063,-0.433883739117558,-0.9009688679024191,0.49999999999999994,-0.8660254037844387,12.89,77.55,56,9.585817321355508,5,2.0,2.0,0,8.0861025356691
Kidnap,31/05/2017,23:00,12.87236619,77.56684297,2017-05-31 23:00:00,23,2,31,5,2,0,0,0,0,1,-0.25881904510252157,0.9659258262890681,0.9749279121818236,-0.22252093395631434,0.49999999999999994,-0.8660254037844387,12.870000000000001,77.56,25,11.4370200874278,5,2.0,3.0,0,9.774289614064447
Kidnap,10/9/2017,8:30,12.91900624,77.5453977,2017-09-10 08:30:00,8,6,10,9,3,1,1,0,0,0,0.8660254037844387,-0.49999999999999983,-0.7818314824680299,0.6234898018587334,-1.0,-1.8369701987210297e-16,12.91,77.54,47,7.913984233441577,5,2.0,1.6,0,6.193921617452626
Kidnap,8/10/2017,17:45,12.91242457,77.53558039,2017-10-08 17:45:00,17,6,8,10,4,1,0,1,0,0,-0.9659258262890683,-0.25881904510252063,-0.7818314824680299,0.6234898018587334,-0.8660254037844386,0.5000000000000001,12.91,77.53,20,9.17632496886453,5,2.0,2.0,0,6.089044875446846
Kidnap,9/11/2017,12:30,12.904705,77.53011,2017-11-09 12:30:00,12,3,9,11,4,0,0,1,0,0,1.2246467991473532e-16,-1.0,0.43388373911755823,-0.900968867902419,-0.5000000000000004,0.8660254037844384,12.9,77.53,36,10.206584964046952,5,2.0,2.0,0,7.221835825288449
Kidnap,14/02/2018,23:00,12.90657165,77.54644706,2018-02-14 23:00:00,23,2,14,2,1,0,0,0,0,1,-0.25881904510252157,0.9659258262890681,0.9749279121818236,-0.22252093395631434,0.8660254037844386,0.5000000000000001,12.9,77.54,56,8.917206781796445,5,2.0,3.0,0,12.129153803503652
Kidnap,19/02/2018,15:30,12.88023219,77.57384591,2018-02-19 15:30:00,15,0,19,2,1,0,0,1,0,0,-0.7071067811865471,-0.7071067811865479,0.0,1.0,0.8660254037844386,0.5000000000000001,12.88,77.57000000000001,71,10.405644774375258,5,2.0,2.0,0,8.55333223803211
Kidnap,22/02/2018,8:50,12.88948381,77.56232091,2018-02-22 08:50:00,8,3,22,2,1,0,1,0,0,0,0.8660254037844387,-0.49999999999999983,0.43388373911755823,-0.900968867902419,0.8660254037844386,0.5000000000000001,12.88,77.56,64,9.778097199930913,5,2.0,1.6,0,6.679019631833019
Kidnap,2/3/2018,14:00,12.86881387,77.58083431,2018-03-02 14:00:00,14,4,2,3,1,0,0,1,0,0,-0.4999999999999998,-0.8660254037844388,-0.433883739117558,-0.9009688679024191,1.0,6.123233995736766e-17,12.86,77.58,63,11.52625878055109,5,2.0,2.0,0,8.317766166719343
Kidnap,17/03/2018,21:40,12.91031858,77.5563932,2018-03-17 21:40:00,21,5,17,3,1,1,0,0,1,0,-0.7071067811865477,0.7071067811865474,-0.9749279121818236,-0.2225209339563146,1.0,6.123233995736766e-17,12.91,77.55,40,7.973507196650967,5,2.0,2.4,0,8.912572960090339
Kidnap,17/04/2018,12:15,12.91022894,77.5481594,2018-04-17 12:15:00,12,1,17,4,2,0,0,1,0,0,1.2246467991473532e-16,-1.0,0.7818314824680298,0.6234898018587336,0.8660254037844387,-0.49999999999999983,12.91,77.54,47,8.479276359855465,5,2.0,2.0,0,7.742402021815782
Kidnap,19/05/2018,15:45,12.88290759,77.56690606,2018-05-19 15:45:00,15,5,19,5,2,1,0,1,0,0,-0.7071067811865471,-0.7071067811865479,-0.9749279121818236,-0.2225209339563146,0.49999999999999994,-0.8660254037844387,12.88,77.56,64,10.308743254676209,5,2.0,2.0,0,8.348774539791274
Kidnap,6/7/2018,18:30,12.90532964,77.54489953,2018-07-06 18:30:00,18,4,6,7,3,0,0,0,1,0,-1.0,-1.8369701987210297e-16,-0.433883739117558,-0.9009688679024191,-0.4999999999999998,-0.8660254037844388,12.9,77.54,56,9.127512714356087,5,2.0,2.4,0,9.70332304280292
Kidnap,26/07/2018,10:30,12.905759,77.542703,2018-07-26 10:30:00,10,3,26,7,3,0,1,0,0,0,0.49999999999999994,-0.8660254037844387,0.43388373911755823,-0.900968867902419,-0.4999999999999998,-0.8660254037844388,12.9,77.54,56,9.232063804164417,5,2.0,1.6,0,6.468882028535281
Kidnap,5/8/2018,19:10,12.91739661,77.54533797,2018-08-05 19:10:00,19,6,5,8,3,1,0,0,1,0,-0.9659258262890684,0.2588190451025203,-0.7818314824680299,0.6234898018587334,-0.8660254037844384,-0.5000000000000004,12.91,77.54,47,8.051451560427926,5,2.0,2.4,0,9.29088242617894
Kidnap,13/08/2018,17:45,12.88888678,77.57180041,2018-08-13 17:45:00,17,0,13,8,3,0,0,1,0,0,-0.9659258262890683,-0.25881904510252063,0.0,1.0,-0.8660254037844384,-0.5000000000000004,12.88,77.57000000000001,71,9.523422035775555,5,2.0,2.0,0,8.55333223803211
Kidnap,16/08/2018,6:50,12.89486583,77.55129522,2018-08-16 06:50:00,6,3,16,8,3,0,1,0,0,0,1.0,6.123233995736766e-17,0.43388373911755823,-0.900968867902419,-0.8660254037844384,-0.5000000000000004,12.89,77.55,56,9.73796908928951,5,2.0,1.6,0,6.468882028535281
Kidnap,29/08/2018,10:15,12.90476548,77.5371549,2018-08-29 10:15:00,10,2,29,8,3,0,1,0,0,0,0.49999999999999994,-0.8660254037844387,0.9749279121818236,-0.22252093395631434,-0.8660254037844384,-0.5000000000000004,12.9,77.53,36,9.69461797908005,5,2.0,1.6,0,5.77746866023076
Kidnap,11/9/2018,14:30,12.90913455,77.55325268,2018-09-11 14:30:00,14,1,11,9,3,0,0,1,0,0,-0.4999999999999998,-0.8660254037844388,0.7818314824680298,0.6234898018587336,-1.0,-1.8369701987210297e-16,12.9,77.55,37,8.265755909369508,5,2.0,2.0,0,7.275172319452771
Kidnap,22/09/2018,12:30,12.89043496,77.5635394,2018-09-22 12:30:00,12,5,22,9,3,1,0,1,0,0,1.2246467991473532e-16,-1.0,-0.9749279121818236,-0.2225209339563146,-1.0,-1.8369701987210297e-16,12.89,77.56,99,9.632467148590454,5,2.0,2.0,0,9.210340371976184
Kidnap,24/10/2018,18:00,12.91555088,77.53947694,2018-10-24 18:00:00,18,2,24,10,4,0,0,0,1,0,-1.0,-1.8369701987210297e-16,0.9749279121818236,-0.22252093395631434,-0.8660254037844386,0.5000000000000001,12.91,77.53,20,8.632912773330657,5,2.0,2.4,0,7.306853850536215
Kidnap,27/10/2018,11:10,12.90512329,77.54375125,2018-10-27 11:10:00,11,5,27,10,4,1,1,0,0,0,0.258819045102521,-0.9659258262890682,-0.9749279121818236,-0.2225209339563146,-0.8660254037844386,0.5000000000000001,12.9,77.54,56,9.219880653043482,5,2.0,1.6,0,6.468882028535281
Kidnap,14/11/2018,18:30,12.87024907,77.57579285,2018-11-14 18:30:00,18,2,14,11,4,0,0,0,1,0,-1.0,-1.8369701987210297e-16,0.9749279121818236,-0.22252093395631434,-0.5000000000000004,0.8660254037844384,12.870000000000001,77.57000000000001,14,11.452556257285096,5,2.0,2.4,0,6.499320482645304
Kidnap,17/11/2018,12:10,12.91298108,77.55815356,2018-11-17 12:10:00,12,5,17,11,4,1,0,1,0,0,1.2246467991473532e-16,-1.0,-0.9749279121818236,-0.2225209339563146,-0.5000000000000004,0.8660254037844384,12.91,77.55,40,7.621427001139097,5,2.0,2.0,0,7.427144133408616
Kidnap,20/11/2018,16:00,12.917986,77.553778,2018-11-20 16:00:00,16,1,20,11,4,0,0,1,0,0,-0.8660254037844384,-0.5000000000000004,0.7818314824680298,0.6234898018587336,-0.5000000000000004,0.8660254037844384,12.91,77.55,40,7.4236854540176,5,2.0,2.0,0,7.427144133408616
Kidnap,4/12/2018,12:15,12.89528068,77.55067452,2018-12-04 12:15:00,12,1,4,12,4,0,0,1,0,0,1.2246467991473532e-16,-1.0,0.7818314824680298,0.6234898018587336,-2.4492935982947064e-16,1.0,12.89,77.55,56,9.730306146038496,5,2.0,2.0,0,8.0861025356691
Kidnap,17/12/2018,13:00,12.8967726,77.5445644,2018-12-17 13:00:00,13,0,17,12,4,0,0,1,0,0,-0.2588190451025208,-0.9659258262890683,0.0,1.0,-2.4492935982947064e-16,1.0,12.89,77.54,35,9.931438030122395,5,2.0,2.0,0,7.16703787691222
Kidnap,28/01/2019,8:15,12.88292452,77.58206937,2019-01-28 08:15:00,8,0,28,1,1,0,1,0,0,0,0.8660254037844387,-0.49999999999999983,0.0,1.0,0.49999999999999994,0.8660254037844387,12.88,77.58,29,9.953342948170413,5,2.0,1.6,0,5.441915810659449
Kidnap,13/03/2019,13:10,12.88992359,77.58079977,2019-03-13 13:10:00,13,2,13,3,1,0,0,1,0,0,-0.2588190451025208,-0.9659258262890683,0.9749279121818236,-0.22252093395631434,1.0,6.123233995736766e-17,12.88,77.58,29,9.204324693509061,5,2.0,2.0,0,6.802394763324311
Kidnap,15/04/2019,23:00,12.91739661,77.54533797,2019-04-15 23:00:00,23,0,15,4,2,0,0,0,0,1,-0.25881904510252157,0.9659258262890681,0.0,1.0,0.8660254037844387,-0.49999999999999983,12.91,77.54,47,8.051451560427926,5,2.0,3.0,0,11.613603032723674
Kidnap,22/04/2019,17:40,12.90108207,77.54753806,2019-04-22 17:40:00,17,0,22,4,2,0,0,1,0,0,-0.9659258262890683,-0.25881904510252063,0.0,1.0,0.8660254037844387,-0.49999999999999983,12.9,77.54,56,9.354001043004194,5,2.0,2.0,0,8.0861025356691
Kidnap,24/04/2019,23:15,12.9057223,77.53558126,2019-04-24 23:15:00,23,2,24,4,2,0,0,0,0,1,-0.25881904510252157,0.9659258262890681,0.9749279121818236,-0.22252093395631434,0.8660254037844387,-0.49999999999999983,12.9,77.53,36,9.724600488428452,5,2.0,3.0,0,10.832753737932673
Kidnap,3/5/2019,14:45,12.89760184,77.54575434,2019-05-03 14:45:00,14,4,3,5,2,0,0,1,0,0,-0.4999999999999998,-0.8660254037844388,-0.433883739117558,-0.9009688679024191,0.49999999999999994,-0.8660254037844387,12.89,77.54,35,9.783942507848124,5,2.0,2.0,0,7.16703787691222
Kidnap,29/05/2019,21:00,12.8836526,77.58177943,2019-05-29 21:00:00,21,2,29,5,2,0,0,0,1,0,-0.7071067811865477,0.7071067811865474,0.9749279121818236,-0.22252093395631434,0.49999999999999994,-0.8660254037844387,12.88,77.58,29,9.877518290389173,5,2.0,2.4,0,8.162873715989173
Kidnap,3/7/2019,12:30,12.89157884,77.58142943,2019-07-03 12:30:00,12,2,3,7,3,0,0,1,0,0,1.2246467991473532e-16,-1.0,0.9749279121818236,-0.22252093395631434,-0.4999999999999998,-0.8660254037844388,12.89,77.58,36,9.011704119053672,5,2.0,2.0,0,7.221835825288449
Kidnap,28/07/2019,20:45,12.90958258,77.55696166,2019-07-28 20:45:00,20,6,28,7,3,1,0,0,1,0,-0.8660254037844386,0.5000000000000001,-0.7818314824680299,0.6234898018587334,-0.4999999999999998,-0.8660254037844388,12.9,77.55,37,8.012025404345339,5,2.0,2.4,0,8.730206783343325
Kidnap,26/09/2019,14:10,12.87991967,77.55749353,2019-09-26 14:10:00,14,3,26,9,3,0,0,1,0,0,-0.4999999999999998,-0.8660254037844388,0.43388373911755823,-0.900968867902419,-1.0,-1.8369701987210297e-16,12.870000000000001,77.55,12,10.958923149854082,5,2.0,2.0,0,5.1298987149230735
Kidnap,26/10/2019,12:45,12.88962293,77.57213196,2019-10-26 12:45:00,12,5,26,10,4,1,0,1,0,0,1.2246467991473532e-16,-1.0,-0.9749279121818236,-0.2225209339563146,-0.8660254037844386,0.5000000000000001,12.88,77.57000000000001,71,9.435054997437604,5,2.0,2.0,0,8.55333223803211
Kidnap,12/11/2019,14:30,12.9100853,77.55656592,2019-11-12 14:30:00,14,1,12,11,4,0,0,1,0,0,-0.4999999999999998,-0.8660254037844388,0.7818314824680298,0.6234898018587336,-0.5000000000000004,0.8660254037844384,12.91,77.55,40,7.986010760190292,5,2.0,2.0,0,7.427144133408616
Kidnap,26/11/2019,11:45,12.89594801,77.55219028,2019-11-26 11:45:00,11,1,26,11,4,0,1,0,0,0,0.258819045102521,-0.9659258262890682,0.7818314824680298,0.6234898018587336,-0.5000000000000004,0.8660254037844384,12.89,77.55,56,9.585817321355508,5,2.0,1.6,0,6.468882028535281
Kidnap,12/3/2015,12:30,12.868638,77.533289,2015-03-12 12:30:00,12,3,12,3,1,0,0,1,0,0,1.2246467991473532e-16,-1.0,0.43388373911755823,-0.900968867902419,1.0,6.123233995736766e-17,12.86,77.53,13,13.23746685644147,5,2.0,2.0,0,5.278114659230517
Kidnap,13/07/2015,14:00,12.874392,77.567161,2015-07-13 14:00:00,14,0,13,7,3,0,0,1,0,0,-0.4999999999999998,-0.8660254037844388,0.0,1.0,-0.4999999999999998,-0.8660254037844388,12.870000000000001,77.56,25,11.210653106070508,5,2.0,2.0,0,6.516193076042964
Kidnap,30/11/2015,14:00,12.86388,77.535496,2015-11-30 14:00:00,14,0,30,11,4,0,0,1,0,0,-0.4999999999999998,-0.8660254037844388,0.0,1.0,-0.5000000000000004,0.8660254037844384,12.86,77.53,13,13.583224551277958,5,2.0,2.0,0,5.278114659230517
Kidnap,7/12/2015,12:30,12.859705,77.580537,2015-12-07 12:30:00,12,0,7,12,4,0,0,1,0,0,1.2246467991473532e-16,-1.0,0.0,1.0,-2.4492935982947064e-16,1.0,12.85,77.58,11,12.535164672537297,5,2.0,2.0,0,4.969813299576001
Kidnap,29/01/2016,8:45,12.865177,77.51857,2016-01-29 08:45:00,8,4,29,1,1,0,1,0,0,0,0.8660254037844387,-0.49999999999999983,-0.433883739117558,-0.9009688679024191,0.49999999999999994,0.8660254037844387,12.86,77.51,2,14.420013980916101,5,2.0,1.6,0,1.7577796618689758
Kidnap,30/01/2016,20:00,12.859851,77.574956,2016-01-30 20:00:00,20,5,30,1,1,1,0,0,1,0,-0.8660254037844386,0.5000000000000001,-0.9749279121818236,-0.2225209339563146,0.49999999999999994,0.8660254037844387,12.85,77.57000000000001,9,12.606997471180104,5,2.0,2.4,0,5.52620422318571
Kidnap,18/03/2016,23:10,12.874882,77.539331,2016-03-18 23:10:00,23,4,18,3,1,0,0,0,0,1,-0.25881904510252157,0.9659258262890681,-0.433883739117558,-0.9009688679024191,1.0,6.123233995736766e-17,12.870000000000001,77.53,25,12.310160822598611,5,2.0,3.0,0,9.774289614064447
Kidnap,13/04/2016,16:00,12.863415,77.527177,2016-04-13 16:00:00,16,2,13,4,2,0,0,1,0,0,-0.8660254037844384,-0.5000000000000004,0.9749279121818236,-0.22252093395631434,0.8660254037844387,-0.49999999999999983,12.86,77.52,11,14.07513454573342,5,2.0,2.0,0,4.969813299576001
Kidnap,20/09/2016,19:45,12.885824,77.546078,2016-09-20 19:45:00,19,1,20,9,3,0,0,0,1,0,-0.9659258262890684,0.2588190451025203,0.7818314824680298,0.6234898018587336,-1.0,-1.8369701987210297e-16,12.88,77.54,41,10.891455465766162,5,2.0,2.4,0,8.970407083880083
Kidnap,6/2/2017,20:00,12.875491,77.537771,2017-02-06 20:00:00,20,0,6,2,1,0,0,0,1,0,-0.8660254037844386,0.5000000000000001,0.0,1.0,0.8660254037844386,0.5000000000000001,12.870000000000001,77.53,25,12.334587196589919,5,2.0,2.4,0,7.819431691251557
Kidnap,1/4/2017,5:30,12.891469,77.541803,2017-04-01 05:30:00,5,5,1,4,2,1,0,0,0,1,0.9659258262890683,0.25881904510252074,-0.9749279121818236,-0.2225209339563146,0.8660254037844387,-0.49999999999999983,12.89,77.54,35,10.589178452620832,5,2.0,3.0,0,10.75055681536833
Kidnap,27/04/2017,17:00,12.863955,77.556258,2017-04-27 17:00:00,17,3,27,4,2,0,0,1,0,0,-0.9659258262890683,-0.25881904510252063,0.43388373911755823,-0.900968867902419,0.8660254037844387,-0.49999999999999983,12.86,77.55,8,12.670409259727194,5,2.0,2.0,0,4.394449154672439
Kidnap,14/05/2017,15:00,12.86562,77.537673,2017-05-14 15:00:00,15,6,14,5,2,1,0,1,0,0,-0.7071067811865471,-0.7071067811865479,-0.7818314824680299,0.6234898018587334,0.49999999999999994,-0.8660254037844387,12.86,77.53,13,13.301844611460105,5,2.0,2.0,0,5.278114659230517
Kidnap,8/7/2017,4:00,12.873222,77.534888,2017-07-08 04:00:00,4,5,8,7,3,1,0,0,0,1,0.8660254037844386,0.5000000000000001,-0.9749279121818236,-0.2225209339563146,-0.4999999999999998,-0.8660254037844388,12.870000000000001,77.53,25,12.71004099397215,5,2.0,3.0,0,9.774289614064447
Kidnap,17/08/2017,12:00,12.866595,77.529815,2017-08-17 12:00:00,12,3,17,8,3,0,0,1,0,0,1.2246467991473532e-16,-1.0,0.43388373911755823,-0.900968867902419,-0.8660254037844384,-0.5000000000000004,12.86,77.52,11,13.624600423587198,5,2.0,2.0,0,4.969813299576001
Kidnap,22/08/2017,16:00,12.889883,77.544416,2017-08-22 16:00:00,16,1,22,8,3,0,0,1,0,0,-0.8660254037844384,-0.5000000000000004,0.7818314824680298,0.6234898018587336,-0.8660254037844384,-0.5000000000000004,12.88,77.54,41,10.589816501249581,5,2.0,2.0,0,7.475339236566737
Kidnap,1/11/2017,12:00,12.871322,77.532192,2017-11-01 12:00:00,12,2,1,11,4,0,0,1,0,0,1.2246467991473532e-16,-1.0,0.9749279121818236,-0.22252093395631434,-0.5000000000000004,0.8660254037844384,12.870000000000001,77.53,25,13.041454702479085,5,2.0,2.0,0,6.516193076042964
Kidnap,16/11/2017,11:00,12.864404,77.554397,2017-11-16 11:00:00,11,3,16,11,4,0,1,0,0,0,0.258819045102521,-0.9659258262890682,0.43388373911755823,-0.900968867902419,-0.5000000000000004,0.8660254037844384,12.86,77.55,8,12.691080611916195,5,2.0,1.6,0,3.5155593237379517
Kidnap,10/12/2017,10:00,12.886135,77.545482,2017-12-10 10:00:00,10,6,10,12,4,1,1,0,0,0,0.49999999999999994,-0.8660254037844387,-0.7818314824680299,0.6234898018587334,-2.4492935982947064e-16,1.0,12.88,77.54,41,10.89260285227066,5,2.0,1.6,0,5.98027138925339
Kidnap,16/12/2017,13:00,12.857223,77.548885,2017-12-16 13:00:00,13,5,16,12,4,1,0,1,0,0,-0.2588190451025208,-0.9659258262890683,-0.9749279121818236,-0.2225209339563146,-2.4492935982947064e-16,1.0,12.85,77.54,1,13.649180513989222,5,2.0,2.0,0,1.3862943611198906
Kidnap,18/12/2017,22:00,12.870656,77.536163,2017-12-18 22:00:00,22,0,18,12,4,0,0,0,0,1,-0.5000000000000004,0.8660254037844384,0.0,1.0,-2.4492935982947064e-16,1.0,12.870000000000001,77.53,25,12.887978777115645,5,2.0,3.0,0,9.774289614064447
Kidnap,6/1/2018,13:00,12.852892,77.553711,2018-01-06 13:00:00,13,5,6,1,1,1,0,1,0,0,-0.2588190451025208,-0.9659258262890683,-0.9749279121818236,-0.2225209339563146,0.49999999999999994,0.8660254037844387,12.85,77.55,7,13.923813570126939,5,2.0,2.0,0,4.1588830833596715
Kidnap,29/01/2018,16:00,12.878402,77.55041,2018-01-29 16:00:00,16,0,29,1,1,0,0,1,0,0,-0.8660254037844384,-0.5000000000000004,0.0,1.0,0.49999999999999994,0.8660254037844387,12.870000000000001,77.55,12,11.416272742836004,5,2.0,2.0,0,5.1298987149230735
Kidnap,13/10/2018,21:00,12.875019,77.529843,2018-10-13 21:00:00,21,5,13,10,4,1,0,0,1,0,-0.7071067811865477,0.7071067811865474,-0.9749279121818236,-0.2225209339563146,-0.8660254037844386,0.5000000000000001,12.870000000000001,77.52,4,12.829220030559139,5,2.0,2.4,0,3.8626509898418404
Kidnap,17/12/2018,21:00,12.867056,77.536419,2018-12-17 21:00:00,21,0,17,12,4,0,0,0,1,0,-0.7071067811865477,0.7071067811865474,0.0,1.0,-2.4492935982947064e-16,1.0,12.86,77.53,13,13.224843402978102,5,2.0,2.4,0,6.33373759107662
Kidnap,17/01/2018,15:00,12.878899,77.485867,2018-01-17 15:00:00,15,2,17,1,1,0,0,1,0,0,-0.7071067811865471,-0.7071067811865479,0.9749279121818236,-0.22252093395631434,0.49999999999999994,0.8660254037844387,12.870000000000001,77.48,2,15.656312449691628,5,2.0,2.0,0,2.1972245773362196
Kidnap,19/01/2018,10:00,12.876592,77.491665,2018-01-19 10:00:00,10,4,19,1,1,0,1,0,0,0,0.49999999999999994,-0.8660254037844387,-0.433883739117558,-0.9009688679024191,0.49999999999999994,0.8660254037844387,12.870000000000001,77.49,3,15.364265576476866,5,2.0,1.6,0,2.218070977791825
Kidnap,25/02/2019,13:13,12.86738,77.563821,2019-02-25 13:13:00,13,0,25,2,1,0,0,1,0,0,-0.2588190451025208,-0.9659258262890683,0.0,1.0,0.8660254037844386,0.5000000000000001,12.86,77.56,11,12.05929267645955,5,2.0,2.0,0,4.969813299576001
Kidnap,22/03/2019,16:00,12.867925,77.563568,2019-03-22 16:00:00,16,4,22,3,1,0,0,1,0,0,-0.8660254037844384,-0.5000000000000004,-0.433883739117558,-0.9009688679024191,1.0,6.123233995736766e-17,12.86,77.56,11,12.008717421035227,5,2.0,2.0,0,4.969813299576001
Kidnap,29/03/2019,10:00,12.853787,77.573044,2019-03-29 10:00:00,10,4,29,3,1,0,1,0,0,0,0.49999999999999994,-0.8660254037844387,-0.433883739117558,-0.9009688679024191,1.0,6.123233995736766e-17,12.85,77.57000000000001,9,13.306906494622961,5,2.0,1.6,0,3.684136148790474
Kidnap,24/05/2019,16:30,12.857401,77.561101,2019-05-24 16:30:00,16,4,24,5,2,0,0,1,0,0,-0.8660254037844384,-0.5000000000000004,-0.433883739117558,-0.9009688679024191,0.49999999999999994,-0.8660254037844387,12.85,77.56,9,13.207195950822163,5,2.0,2.0,0,4.605170185988092
Kidnap,7/6/2019,21:30,12.869011,77.565298,2019-06-07 21:30:00,21,4,7,6,2,0,0,0,1,0,-0.7071067811865477,0.7071067811865474,-0.433883739117558,-0.9009688679024191,1.2246467991473532e-16,-1.0,12.86,77.56,11,11.841181010345819,5,2.0,2.4,0,5.9637759594912
Kidnap,14/08/2019,16:40,12.880097,77.513418,2019-08-14 16:40:00,16,2,14,8,3,0,0,1,0,0,-0.8660254037844384,-0.5000000000000004,0.9749279121818236,-0.22252093395631434,-0.8660254037844384,-0.5000000000000004,12.88,77.51,2,13.451159715484287,5,2.0,2.0,0,2.1972245773362196
Kidnap,21/08/2019,4:00,12.861796,77.538009,2019-08-21 04:00:00,4,2,21,8,3,0,0,0,0,1,0.8660254037844386,0.5000000000000001,0.9749279121818236,-0.22252093395631434,-0.8660254037844384,-0.5000000000000004,12.86,77.53,13,13.663605946233949,5,2.0,3.0,0,7.917171988845775
Kidnap,25/09/2019,21:15,12.85984,77.575677,2019-09-25 21:15:00,21,2,25,9,3,0,0,0,1,0,-0.7071067811865477,0.7071067811865474,0.9749279121818236,-0.22252093395631434,-1.0,-1.8369701987210297e-16,12.85,77.57000000000001,9,12.59524312168123,5,2.0,2.4,0,5.52620422318571
Kidnap,1/10/2019,18:00,12.870019,77.564431,2019-10-01 18:00:00,18,1,1,10,4,0,0,0,1,0,-1.0,-1.8369701987210297e-16,0.7818314824680298,0.6234898018587336,-0.8660254037844386,0.5000000000000001,12.870000000000001,77.56,25,11.759020172363838,5,2.0,2.4,0,7.819431691251557
Kidnap,5/1/2017,16:35,12.888188,77.570812,2017-01-05 16:35:00,16,3,5,1,1,0,0,1,0,0,-0.8660254037844384,-0.5000000000000004,0.43388373911755823,-0.900968867902419,0.49999999999999994,0.8660254037844387,12.88,77.57000000000001,71,9.626616043525456,5,2.0,2.0,0,8.55333223803211
Kidnap,14/02/2017,17:30,12.87769,77.56715,2017-02-14 17:30:00,17,1,14,2,1,0,0,1,0,0,-0.9659258262890683,-0.25881904510252063,0.7818314824680298,0.6234898018587336,0.8660254037844386,0.5000000000000001,12.870000000000001,77.56,25,10.857826854700582,5,2.0,2.0,0,6.516193076042964
Kidnap,17/02/2017,10:50,12.883525,77.563547,2017-02-17 10:50:00,10,4,17,2,1,0,1,0,0,0,0.49999999999999994,-0.8660254037844387,-0.433883739117558,-0.9009688679024191,0.8660254037844386,0.5000000000000001,12.88,77.56,64,10.355604104129482,5,2.0,1.6,0,6.679019631833019
Kidnap,3/3/2017,10:30,12.86409,77.584085,2017-03-03 10:30:00,10,4,3,3,1,0,1,0,0,0,0.49999999999999994,-0.8660254037844387,-0.433883739117558,-0.9009688679024191,1.0,6.123233995736766e-17,12.86,77.58,63,12.008763612528037,5,2.0,1.6,0,6.654212933375475
Kidnap,6/4/2017,9:30,12.878194,77.57011,2017-04-06 09:30:00,9,3,6,4,2,0,1,0,0,0,0.7071067811865476,-0.7071067811865475,0.43388373911755823,-0.900968867902419,0.8660254037844387,-0.49999999999999983,12.870000000000001,77.57000000000001,14,10.720041494029315,5,2.0,1.6,0,4.332880321763536
Kidnap,16/04/2017,17:00,12.884022,77.583093,2017-04-16 17:00:00,17,6,16,4,2,1,0,1,0,0,-0.9659258262890683,-0.25881904510252063,-0.7818314824680299,0.6234898018587334,0.8660254037844387,-0.49999999999999983,12.88,77.58,29,9.817756205341798,5,2.0,2.0,0,6.802394763324311
Kidnap,2/5/2017,12:00,12.840839,77.581043,2017-05-02 12:00:00,12,1,2,5,2,0,0,1,0,0,1.2246467991473532e-16,-1.0,0.7818314824680298,0.6234898018587336,0.49999999999999994,-0.8660254037844387,12.84,77.58,23,14.614018140918445,5,2.0,2.0,0,6.3561076606958915
Kidnap,5/5/2017,15:00,12.878992,77.562182,2017-05-05 15:00:00,15,4,5,5,2,0,0,1,0,0,-0.7071067811865471,-0.7071067811865479,-0.433883739117558,-0.9009688679024191,0.49999999999999994,-0.8660254037844387,12.870000000000001,77.56,25,10.880403502195266,5,2.0,2.0,0,6.516193076042964
Kidnap,30/05/2017,16:00,12.887529,77.573481,2017-05-30 16:00:00,16,1,30,5,2,0,0,1,0,0,-0.8660254037844384,-0.5000000000000004,0.7818314824680298,0.6234898018587336,0.49999999999999994,-0.8660254037844387,12.88,77.57000000000001,71,9.624378788510068,5,2.0,2.0,0,8.55333223803211
Kidnap,9/9/2017,12:00,12.87822,77.570138,2017-09-09 12:00:00,12,5,9,9,3,1,0,1,0,0,1.2246467991473532e-16,-1.0,-0.9749279121818236,-0.2225209339563146,-1.0,-1.8369701987210297e-16,12.870000000000001,77.57000000000001,14,10.716489307050796,5,2.0,2.0,0,5.41610040220442
Kidnap,26/10/2017,9:00,12.846865,77.582922,2017-10-26 09:00:00,9,3,26,10,4,0,1,0,0,0,0.7071067811865476,-0.7071067811865475,0.43388373911755823,-0.900968867902419,-0.8660254037844386,0.5000000000000001,12.84,77.58,23,13.927531538108457,5,2.0,1.6,0,5.084886128556714
Kidnap,30/10/2017,8:00,12.748862,77.486417,2017-10-30 08:00:00,8,0,30,10,4,0,1,0,0,0,0.8660254037844387,-0.49999999999999983,0.0,1.0,-0.8660254037844386,0.5000000000000001,12.74,77.48,3,27.403623547550456,5,2.0,1.6,0,2.218070977791825
Kidnap,9/1/2018,13:00,12.860378,77.571322,2018-01-09 13:00:00,13,1,9,1,1,0,0,1,0,0,-0.2588190451025208,-0.9659258262890683,0.7818314824680298,0.6234898018587336,0.49999999999999994,0.8660254037844387,12.86,77.57000000000001,10,12.622032710510329,5,2.0,2.0,0,4.795790545596741
Kidnap,16/03/2018,21:35,12.886841,77.567815,2018-03-16 21:35:00,21,4,16,3,1,0,0,0,1,0,-0.7071067811865477,0.7071067811865474,-0.433883739117558,-0.9009688679024191,1.0,6.123233995736766e-17,12.88,77.56,64,9.861684454337247,5,2.0,2.4,0,10.018529447749527
Kidnap,10/5/2018,13:15,12.84564,77.584142,2018-05-10 13:15:00,13,3,10,5,2,0,0,1,0,0,-0.2588190451025208,-0.9659258262890683,0.43388373911755823,-0.900968867902419,0.49999999999999994,-0.8660254037844387,12.84,77.58,23,14.051903585448699,5,2.0,2.0,0,6.3561076606958915
Kidnap,29/05/2018,10:30,12.880104,77.567961,2018-05-29 10:30:00,10,1,29,5,2,0,1,0,0,0,0.49999999999999994,-0.8660254037844387,0.7818314824680298,0.6234898018587336,0.49999999999999994,-0.8660254037844387,12.88,77.56,64,10.575593905375571,5,2.0,1.6,0,6.679019631833019
Kidnap,1/6/2018,19:15,12.88288,77.578462,2018-06-01 19:15:00,19,4,1,6,2,0,0,0,1,0,-0.9659258262890684,0.2588190451025203,-0.433883739117558,-0.9009688679024191,1.2246467991473532e-16,-1.0,12.88,77.57000000000001,71,10.019051140814836,5,2.0,2.4,0,10.263998685638532
Kidnap,3/6/2018,16:00,12.8667989,77.580991,2018-06-03 16:00:00,16,6,3,6,2,1,0,1,0,0,-0.8660254037844384,-0.5000000000000004,-0.7818314824680299,0.6234898018587334,1.2246467991473532e-16,-1.0,12.86,77.58,63,11.746320498047607,5,2.0,2.0,0,8.317766166719343
Kidnap,13/06/2018,15:00,12.8813,77.570951,2018-06-13 15:00:00,15,2,13,6,2,0,0,1,0,0,-0.7071067811865471,-0.7071067811865479,0.9749279121818236,-0.22252093395631434,1.2246467991473532e-16,-1.0,12.88,77.57000000000001,71,10.362852919841506,5,2.0,2.0,0,8.55333223803211
Kidnap,7/7/2018,12:45,12.966528,77.401109,2018-07-07 12:45:00,12,5,7,7,3,1,0,1,0,0,1.2246467991473532e-16,-1.0,-0.9749279121818236,-0.2225209339563146,-0.4999999999999998,-0.8660254037844388,12.96,77.4,1,20.97397753203145,5,2.0,2.0,0,1.3862943611198906
Kidnap,29/07/2018,9:30,12.85706,77.58406,2018-07-29 09:30:00,9,6,29,7,3,1,1,0,0,0,0.7071067811865476,-0.7071067811865475,-0.7818314824680299,0.6234898018587334,-0.4999999999999998,-0.8660254037844388,12.85,77.58,11,12.787394415385604,5,2.0,1.6,0,3.9758506396608007
Kidnap,3/11/2018,9:00,12.884005,77.56634,2018-11-03 09:00:00,9,5,3,11,4,1,1,0,0,0,0.7071067811865476,-0.7071067811865475,-0.9749279121818236,-0.2225209339563146,-0.5000000000000004,0.8660254037844384,12.88,77.56,64,10.210297281340695,5,2.0,1.6,0,6.679019631833019
Kidnap,12/11/2018,17:30,12.878655,77.566708,2018-11-12 17:30:00,17,0,12,11,4,0,0,1,0,0,-0.9659258262890683,-0.25881904510252063,0.0,1.0,-0.5000000000000004,0.8660254037844384,12.870000000000001,77.56,25,10.768017997116436,5,2.0,2.0,0,6.516193076042964
Kidnap,6/12/2018,9:50,12.794486,77.62091,2018-12-06 09:50:00,9,3,6,12,4,0,1,0,0,0,0.7071067811865476,-0.7071067811865475,0.43388373911755823,-0.900968867902419,-2.4492935982947064e-16,1.0,12.790000000000001,77.62,1,19.899596773017578,5,2.0,1.6,0,1.1090354888959124
Kidnap,17/01/2019,13:30,12.872893,77.582921,2019-01-17 13:30:00,13,3,17,1,1,0,0,1,0,0,-0.2588190451025208,-0.9659258262890683,0.43388373911755823,-0.900968867902419,0.49999999999999994,0.8660254037844387,12.870000000000001,77.58,22,11.048462188532307,5,2.0,2.0,0,6.270988431858299
Kidnap,2/2/2019,11:30,12.87331,77.574396,2019-02-02 11:30:00,11,5,2,2,1,1,1,0,0,0,0.258819045102521,-0.9659258262890682,-0.9749279121818236,-0.2225209339563146,0.8660254037844386,0.5000000000000001,12.870000000000001,77.57000000000001,14,11.146541790525308,5,2.0,1.6,0,4.332880321763536
Kidnap,3/2/2019,19:00,12.8863383,77.573795,2019-02-03 19:00:00,19,6,3,2,1,1,0,0,1,0,-0.9659258262890684,0.2588190451025203,-0.7818314824680299,0.6234898018587334,0.8660254037844386,0.5000000000000001,12.88,77.57000000000001,71,9.745102475718218,5,2.0,2.4,0,10.263998685638532
Kidnap,1/3/2019,16:40,12.869624,77.58232,2019-03-01 16:40:00,16,4,1,3,1,0,0,1,0,0,-0.8660254037844384,-0.5000000000000004,-0.433883739117558,-0.9009688679024191,1.0,6.123233995736766e-17,12.86,77.58,63,11.417051610861055,5,2.0,2.0,0,8.317766166719343
Kidnap,8/3/2019,10:30,12.89341,77.580255,2019-03-08 10:30:00,10,4,8,3,1,0,1,0,0,0,0.49999999999999994,-0.8660254037844387,-0.433883739117558,-0.9009688679024191,1.0,6.123233995736766e-17,12.89,77.58,36,8.832229239409441,5,2.0,1.6,0,5.77746866023076
Kidnap,9/4/2019,21:00,12.86383,77.57767,2019-04-09 21:00:00,21,1,9,4,2,0,0,0,1,0,-0.7071067811865477,0.7071067811865474,0.7818314824680298,0.6234898018587336,0.8660254037844387,-0.49999999999999983,12.86,77.57000000000001,10,12.123140558316141,5,2.0,2.4,0,5.754948654716089
Kidnap,29/04/2019,21:30,12.873437,77.583593,2019-04-29 21:30:00,21,0,29,4,2,0,0,0,1,0,-0.7071067811865477,0.7071067811865474,0.0,1.0,0.8660254037844387,-0.49999999999999983,12.870000000000001,77.58,22,10.98022141070445,5,2.0,2.4,0,7.525186118229959
Kidnap,1/5/2019,21:00,12.89065,77.564006,2019-05-01 21:00:00,21,2,1,5,2,0,0,0,1,0,-0.7071067811865477,0.7071067811865474,0.9749279121818236,-0.22252093395631434,0.49999999999999994,-0.8660254037844387,12.89,77.56,99,9.592470698025496,5,2.0,2.4,0,11.05240844637142
Kidnap,7/5/2019,15:00,12.8824024,77.560456,2019-05-07 15:00:00,15,1,7,5,2,0,0,1,0,0,-0.7071067811865471,-0.7071067811865479,0.7818314824680298,0.6234898018587336,0.49999999999999994,-0.8660254037844387,12.88,77.56,64,10.586130861337226,5,2.0,2.0,0,8.348774539791274
Kidnap,9/5/2019,21:00,12.861253,77.579712,2019-05-09 21:00:00,21,3,9,5,2,0,0,0,1,0,-0.7071067811865477,0.7071067811865474,0.43388373911755823,-0.900968867902419,0.49999999999999994,-0.8660254037844387,12.86,77.57000000000001,10,12.375669591355772,5,2.0,2.4,0,5.754948654716089
Kidnap,22/05/2019,13:00,12.844501,77.584473,2019-05-22 13:00:00,13,2,22,5,2,0,0,1,0,0,-0.2588190451025208,-0.9659258262890683,0.9749279121818236,-0.22252093395631434,0.49999999999999994,-0.8660254037844387,12.84,77.58,23,14.17532277857049,5,2.0,2.0,0,6.3561076606958915
Kidnap,29/05/2019,21:30,12.885465,77.569815,2019-05-29 21:30:00,21,2,29,5,2,0,0,0,1,0,-0.7071067811865477,0.7071067811865474,0.9749279121818236,-0.22252093395631434,0.49999999999999994,-0.8660254037844387,12.88,77.56,64,9.947307057234408,5,2.0,2.4,0,10.018529447749527
Kidnap,13/06/2019,15:15,12.88829,77.580217,2019-06-13 15:15:00,15,3,13,6,2,0,0,1,0,0,-0.7071067811865471,-0.7071067811865479,0.43388373911755823,-0.900968867902419,1.2246467991473532e-16,-1.0,12.88,77.58,29,9.393878155543737,5,2.0,2.0,0,6.802394763324311
Kidnap,10/8/2019,15:30,12.882462,77.569158,2019-08-10 15:30:00,15,5,10,8,3,1,0,1,0,0,-0.7071067811865471,-0.7071067811865479,-0.9749279121818236,-0.2225209339563146,-0.8660254037844384,-0.5000000000000004,12.88,77.56,64,10.288075035302427,5,2.0,2.0,0,8.348774539791274
Kidnap,19/08/2019,19:00,12.845799,77.584087,2019-08-19 19:00:00,19,0,19,8,3,0,0,0,1,0,-0.9659258262890684,0.2588190451025203,0.0,1.0,-0.8660254037844384,-0.5000000000000004,12.84,77.58,23,14.03476396323247,5,2.0,2.4,0,7.627329192835069
Kidnap,25/08/2019,15:00,12.835799,77.584087,2019-08-25 15:00:00,15,6,25,8,3,1,0,1,0,0,-0.7071067811865471,-0.7071067811865479,-0.7818314824680299,0.6234898018587334,-0.8660254037844384,-0.5000000000000004,12.83,77.58,7,15.143313311603592,5,2.0,2.0,0,4.1588830833596715
Kidnap,31/08/2019,12:15,12.878746,77.5622,2019-08-31 12:15:00,12,5,31,8,3,1,0,1,0,0,1.2246467991473532e-16,-1.0,-0.9749279121818236,-0.2225209339563146,-0.8660254037844384,-0.5000000000000004,12.870000000000001,77.56,25,10.90566795682934,5,2.0,2.0,0,6.516193076042964
Kidnap,21/10/2019,12:30,12.863913,77.585848,2019-10-21 12:30:00,12,0,21,10,4,0,0,1,0,0,1.2246467991473532e-16,-1.0,0.0,1.0,-0.8660254037844386,0.5000000000000001,12.86,77.58,63,12.011759288251149,5,2.0,2.0,0,8.317766166719343
Kidnap,19/11/2019,14:30,12.881754,77.569001,2019-11-19 14:30:00,14,1,19,11,4,0,0,1,0,0,-0.4999999999999998,-0.8660254037844388,0.7818314824680298,0.6234898018587336,-0.5000000000000004,0.8660254037844384,12.88,77.56,64,10.368483284899146,5,2.0,2.0,0,8.348774539791274
Kidnap,6/1/2015,17:00,12.8928133912158,77.5666300513369,2015-01-06 17:00:00,17,1,6,1,1,0,0,1,0,0,-0.9659258262890683,-0.25881904510252063,0.7818314824680298,0.6234898018587336,0.49999999999999994,0.8660254037844387,12.89,77.56,99,9.270259607280016,5,2.0,2.0,0,9.210340371976184
Kidnap,12/1/2015,17:30,12.8928133912158,77.5666300513369,2015-01-12 17:30:00,17,0,12,1,1,0,0,1,0,0,-0.9659258262890683,-0.25881904510252063,0.0,1.0,0.49999999999999994,0.8660254037844387,12.89,77.56,99,9.270259607280016,5,2.0,2.0,0,9.210340371976184
Kidnap,14/06/2016,13:30,12.905037,77.560909,2016-06-14 13:30:00,13,1,14,6,2,0,0,1,0,0,-0.2588190451025208,-0.9659258262890683,0.7818314824680298,0.6234898018587336,1.2246467991473532e-16,-1.0,12.9,77.56,89,8.253040117145249,5,2.0,2.0,0,8.99961934066053
Kidnap,3/7/2015,14:00,12.910991,77.561872,2015-07-03 14:00:00,14,4,3,7,3,0,0,1,0,0,-0.4999999999999998,-0.8660254037844388,-0.433883739117558,-0.9009688679024191,-0.4999999999999998,-0.8660254037844388,12.91,77.56,126,7.615716802526917,5,2.0,2.0,0,9.688374172917182
Kidnap,14/07/2015,18:30,12.904553,77.560433,2015-07-14 18:30:00,18,1,14,7,3,0,0,0,1,0,-1.0,-1.8369701987210297e-16,0.7818314824680298,0.6234898018587336,-0.4999999999999998,-0.8660254037844388,12.9,77.56,89,8.324158489687902,5,2.0,2.4,0,10.799543208792636
Kidnap,30/07/2015,6:30,12.893906,77.556449,2015-07-30 06:30:00,6,3,30,7,3,0,1,0,0,0,1.0,6.123233995736766e-17,0.43388373911755823,-0.900968867902419,-0.4999999999999998,-0.8660254037844388,12.89,77.55,56,9.577589403471656,5,2.0,1.6,0,6.468882028535281
Kidnap,23/11/2015,18:45,12.902361,77.56838,2015-11-23 18:45:00,18,0,23,11,4,0,0,0,1,0,-1.0,-1.8369701987210297e-16,0.0,1.0,-0.5000000000000004,0.8660254037844384,12.9,77.56,89,8.206659584570419,5,2.0,2.4,0,10.799543208792636
Kidnap,13/02/2016,13:00,12.9157553,77.571373,2016-02-13 13:00:00,13,5,13,2,1,1,0,1,0,0,-0.2588190451025208,-0.9659258262890683,-0.9749279121818236,-0.2225209339563146,0.8660254037844386,0.5000000000000001,12.91,77.57000000000001,82,6.700411079353566,5,2.0,2.0,0,8.837681215593197
Kidnap,31/03/2016,13:30,12.904553,77.560433,2016-03-31 13:30:00,13,3,31,3,1,0,0,1,0,0,-0.2588190451025208,-0.9659258262890683,0.43388373911755823,-0.900968867902419,1.0,6.123233995736766e-17,12.9,77.56,89,8.324158489687902,5,2.0,2.0,0,8.99961934066053
Kidnap,22/07/2016,20:00,12.9116,77.572476,2016-07-22 20:00:00,20,4,22,7,3,0,0,0,1,0,-0.8660254037844386,0.5000000000000001,-0.433883739117558,-0.9009688679024191,-0.4999999999999998,-0.8660254037844388,12.91,77.57000000000001,82,7.0894251296779816,5,2.0,2.4,0,10.605217458711836
Kidnap,3/10/2016,23:45,12.893906,77.556449,2016-10-03 23:45:00,23,0,3,10,4,0,0,0,0,1,-0.25881904510252157,0.9659258262890681,0.0,1.0,-0.8660254037844386,0.5000000000000001,12.89,77.55,56,9.577589403471656,5,2.0,3.0,0,12.129153803503652
Kidnap,18/11/2016,18:00,12.910991,77.561872,2016-11-18 18:00:00,18,4,18,11,4,0,0,0,1,0,-1.0,-1.8369701987210297e-16,-0.433883739117558,-0.9009688679024191,-0.5000000000000004,0.8660254037844384,12.91,77.56,126,7.615716802526917,5,2.0,2.4,0,11.626049007500619
Kidnap,2/12/2016,16:45,12.894779,77.562256,2016-12-02 16:45:00,16,4,2,12,4,0,0,1,0,0,-0.8660254037844384,-0.5000000000000004,-0.433883739117558,-0.9009688679024191,-2.4492935982947064e-16,1.0,12.89,77.56,99,9.23332847236158,5,2.0,2.0,0,9.210340371976184
Kidnap,27/01/2017,12:00,12.906422,77.570394,2017-01-27 12:00:00,12,4,27,1,1,0,0,1,0,0,1.2246467991473532e-16,-1.0,-0.433883739117558,-0.9009688679024191,0.49999999999999994,0.8660254037844387,12.9,77.57000000000001,96,7.7076013186935945,5,2.0,2.0,0,9.149421957006766
Kidnap,1/2/2017,23:30,12.893906,77.556449,2017-02-01 23:30:00,23,2,1,2,1,0,0,0,0,1,-0.25881904510252157,0.9659258262890681,0.9749279121818236,-0.22252093395631434,0.8660254037844386,0.5000000000000001,12.89,77.55,56,9.577589403471656,5,2.0,3.0,0,12.129153803503652
Kidnap,8/2/2017,16:40,12.898577,77.569538,2017-02-08 16:40:00,16,2,8,2,1,0,0,1,0,0,-0.8660254037844384,-0.5000000000000004,0.9749279121818236,-0.22252093395631434,0.8660254037844386,0.5000000000000001,12.89,77.56,99,8.56200182129663,5,2.0,2.0,0,9.210340371976184
Kidnap,11/3/2018,10:30,12.90237,77.55504,2018-03-11 10:30:00,10,6,11,3,1,1,1,0,0,0,0.49999999999999994,-0.8660254037844387,-0.7818314824680299,0.6234898018587334,1.0,6.123233995736766e-17,12.9,77.55,37,8.811344310658482,5,2.0,1.6,0,5.820137855562217
Kidnap,7/5/2017,11:15,12.893906,77.556449,2017-05-07 11:15:00,11,6,7,5,2,1,1,0,0,0,0.258819045102521,-0.9659258262890682,-0.7818314824680299,0.6234898018587334,0.49999999999999994,-0.8660254037844387,12.89,77.55,56,9.577589403471656,5,2.0,1.6,0,6.468882028535281
Kidnap,13/05/2017,16:00,12.893906,77.556449,2017-05-13 16:00:00,16,5,13,5,2,1,0,1,0,0,-0.8660254037844384,-0.5000000000000004,-0.9749279121818236,-0.2225209339563146,0.49999999999999994,-0.8660254037844387,12.89,77.55,56,9.577589403471656,5,2.0,2.0,0,8.0861025356691
Kidnap,31/05/2017,10:00,12.91267,77.562103,2017-05-31 10:00:00,10,2,31,5,2,0,1,0,0,0,0.49999999999999994,-0.8660254037844387,0.9749279121818236,-0.22252093395631434,0.49999999999999994,-0.8660254037844387,12.91,77.56,126,7.4391208066354,5,2.0,1.6,0,7.750699338333746
Kidnap,5/6/2017,13:00,12.900415,77.569332,2017-06-05 13:00:00,13,0,5,6,2,0,0,1,0,0,-0.2588190451025208,-0.9659258262890683,0.0,1.0,1.2246467991473532e-16,-1.0,12.9,77.56,89,8.375701490100079,5,2.0,2.0,0,8.99961934066053
Kidnap,27/06/2017,20:45,12.900415,77.569332,2017-06-27 20:45:00,20,1,27,6,2,0,0,0,1,0,-0.8660254037844386,0.5000000000000001,0.7818314824680298,0.6234898018587336,1.2246467991473532e-16,-1.0,12.9,77.56,89,8.375701490100079,5,2.0,2.4,0,10.799543208792636
Kidnap,17/7/2017,12:30,12.904553,77.560433,2017-07-17 12:30:00,12,0,17,7,3,0,0,1,0,0,1.2246467991473532e-16,-1.0,0.0,1.0,-0.4999999999999998,-0.8660254037844388,12.9,77.56,89,8.324158489687902,5,2.0,2.0,0,8.99961934066053
Kidnap,28/8/2017,13:00,12.91267,77.562103,2017-08-28 13:00:00,13,0,28,8,3,0,0,1,0,0,-0.2588190451025208,-0.9659258262890683,0.0,1.0,-0.8660254037844384,-0.5000000000000004,12.91,77.56,126,7.4391208066354,5,2.0,2.0,0,9.688374172917182
Kidnap,13/12/2017,14:00,12.894779,77.562256,2017-12-13 14:00:00,14,2,13,12,4,0,0,1,0,0,-0.4999999999999998,-0.8660254037844388,0.9749279121818236,-0.22252093395631434,-2.4492935982947064e-16,1.0,12.89,77.56,99,9.23332847236158,5,2.0,2.0,0,9.210340371976184
Kidnap,1/8/2018,10:30,12.904553,77.560433,2018-08-01 10:30:00,10,2,1,8,3,0,1,0,0,0,0.49999999999999994,-0.8660254037844387,0.9749279121818236,-0.22252093395631434,-0.8660254037844384,-0.5000000000000004,12.9,77.56,89,8.324158489687902,5,2.0,1.6,0,7.199695472528425
Kidnap,2/11/2018,16:00,12.904553,77.560433,2018-11-02 16:00:00,16,4,2,11,4,0,0,1,0,0,-0.8660254037844384,-0.5000000000000004,-0.433883739117558,-0.9009688679024191,-0.5000000000000004,0.8660254037844384,12.9,77.56,89,8.324158489687902,5,2.0,2.0,0,8.99961934066053
Kidnap,22/02/2018,16:00,12.896566,77.557231,2018-02-22 16:00:00,16,3,22,2,1,0,0,1,0,0,-0.8660254037844384,-0.5000000000000004,0.43388373911755823,-0.900968867902419,0.8660254037844386,0.5000000000000001,12.89,77.55,56,9.274337875223148,5,2.0,2.0,0,8.0861025356691
Kidnap,26/02/2018,15:10,12.904553,77.560433,2018-02-26 15:10:00,15,0,26,2,1,0,0,1,0,0,-0.7071067811865471,-0.7071067811865479,0.0,1.0,0.8660254037844386,0.5000000000000001,12.9,77.56,89,8.324158489687902,5,2.0,2.0,0,8.99961934066053
Kidnap,3/2/2018,15:00,12.8928133912158,77.5666300513369,2018-02-03 15:00:00,15,5,3,2,1,1,0,1,0,0,-0.7071067811865471,-0.7071067811865479,-0.9749279121818236,-0.2225209339563146,0.8660254037844386,0.5000000000000001,12.89,77.56,99,9.270259607280016,5,2.0,2.0,0,9.210340371976184
Kidnap,13/03/2018,14:00,12.894779,77.562256,2018-03-13 14:00:00,14,1,13,3,1,0,0,1,0,0,-0.4999999999999998,-0.8660254037844388,0.7818314824680298,0.6234898018587336,1.0,6.123233995736766e-17,12.89,77.56,99,9.23332847236158,5,2.0,2.0,0,9.210340371976184
Kidnap,4/4/2018,15:00,12.904553,77.560433,2018-04-04 15:00:00,15,2,4,4,2,0,0,1,0,0,-0.7071067811865471,-0.7071067811865479,0.9749279121818236,-0.22252093395631434,0.8660254037844387,-0.49999999999999983,12.9,77.56,89,8.324158489687902,5,2.0,2.0,0,8.99961934066053
Kidnap,20/04/2018,19:00,12.9157553,77.571373,2018-04-20 19:00:00,19,4,20,4,2,0,0,0,1,0,-0.9659258262890684,0.2588190451025203,-0.433883739117558,-0.9009688679024191,0.8660254037844387,-0.49999999999999983,12.91,77.57000000000001,82,6.700411079353566,5,2.0,2.4,0,10.605217458711836
Kidnap,27/05/2018,13:00,12.910991,77.561872,2018-05-27 13:00:00,13,6,27,5,2,1,0,1,0,0,-0.2588190451025208,-0.9659258262890683,-0.7818314824680299,0.6234898018587334,0.49999999999999994,-0.8660254037844387,12.91,77.56,126,7.615716802526917,5,2.0,2.0,0,9.688374172917182
Kidnap,7/7/2018,18:00,12.904553,77.560433,2018-07-07 18:00:00,18,5,7,7,3,1,0,0,1,0,-1.0,-1.8369701987210297e-16,-0.9749279121818236,-0.2225209339563146,-0.4999999999999998,-0.8660254037844388,12.9,77.56,89,8.324158489687902,5,2.0,2.4,0,10.799543208792636
Kidnap,11/7/2018,17:00,12.904553,77.560433,2018-07-11 17:00:00,17,2,11,7,3,0,0,1,0,0,-0.9659258262890683,-0.25881904510252063,0.9749279121818236,-0.22252093395631434,-0.4999999999999998,-0.8660254037844388,12.9,77.56,89,8.324158489687902,5,2.0,2.0,0,8.99961934066053
Kidnap,27/07/2018,23:00,12.906422,77.570394,2018-07-27 23:00:00,23,4,27,7,3,0,0,0,0,1,-0.25881904510252157,0.9659258262890681,-0.433883739117558,-0.9009688679024191,-0.4999999999999998,-0.8660254037844388,12.9,77.57000000000001,96,7.7076013186935945,5,2.0,3.0,0,13.724132935510148
Kidnap,10/8/2018,15:00,12.902556,77.562012,2018-08-10 15:00:00,15,4,10,8,3,0,0,1,0,0,-0.7071067811865471,-0.7071067811865479,-0.433883739117558,-0.9009688679024191,-0.8660254037844384,-0.5000000000000004,12.9,77.56,89,8.450684505239051,5,2.0,2.0,0,8.99961934066053
Kidnap,17/08/2018,14:00,12.9116,77.572476,2018-08-17 14:00:00,14,4,17,8,3,0,0,1,0,0,-0.4999999999999998,-0.8660254037844388,-0.433883739117558,-0.9009688679024191,-0.8660254037844384,-0.5000000000000004,12.91,77.57000000000001,82,7.0894251296779816,5,2.0,2.0,0,8.837681215593197
Kidnap,31/08/2018,18:00,12.9157553,77.571373,2018-08-31 18:00:00,18,4,31,8,3,0,0,0,1,0,-1.0,-1.8369701987210297e-16,-0.433883739117558,-0.9009688679024191,-0.8660254037844384,-0.5000000000000004,12.91,77.57000000000001,82,6.700411079353566,5,2.0,2.4,0,10.605217458711836
Kidnap,4/9/2018,18:00,12.9157553,77.571373,2018-09-04 18:00:00,18,1,4,9,3,0,0,0,1,0,-1.0,-1.8369701987210297e-16,0.7818314824680298,0.6234898018587336,-1.0,-1.8369701987210297e-16,12.91,77.57000000000001,82,6.700411079353566,5,2.0,2.4,0,10.605217458711836
Kidnap,8/9/2018,18:00,12.894779,77.562256,2018-09-08 18:00:00,18,5,8,9,3,1,0,0,1,0,-1.0,-1.8369701987210297e-16,-0.9749279121818236,-0.2225209339563146,-1.0,-1.8369701987210297e-16,12.89,77.56,99,9.23332847236158,5,2.0,2.4,0,11.05240844637142
Kidnap,12/12/2018,10:30,12.906422,77.570394,2018-12-12 10:30:00,10,2,12,12,4,0,1,0,0,0,0.49999999999999994,-0.8660254037844387,0.9749279121818236,-0.22252093395631434,-2.4492935982947064e-16,1.0,12.9,77.57000000000001,96,7.7076013186935945,5,2.0,1.6,0,7.319537565605413
Kidnap,19/12/2018,13:00,12.892905,77.561042,2018-12-19 13:00:00,13,2,19,12,4,0,0,1,0,0,-0.2588190451025208,-0.9659258262890683,0.9749279121818236,-0.22252093395631434,-2.4492935982947064e-16,1.0,12.89,77.56,99,9.476155664427903,5,2.0,2.0,0,9.210340371976184
Kidnap,29/12/2018,14:15,12.91267,77.562103,2018-12-29 14:15:00,14,5,29,12,4,1,0,1,0,0,-0.4999999999999998,-0.8660254037844388,-0.9749279121818236,-0.2225209339563146,-2.4492935982947064e-16,1.0,12.91,77.56,126,7.4391208066354,5,2.0,2.0,0,9.688374172917182
Kidnap,5/1/2019,10:30,12.9157553,77.571373,2019-01-05 10:30:00,10,5,5,1,1,1,1,0,0,0,0.49999999999999994,-0.8660254037844387,-0.9749279121818236,-0.2225209339563146,0.49999999999999994,0.8660254037844387,12.91,77.57000000000001,82,6.700411079353566,5,2.0,1.6,0,7.070144972474558
Kidnap,15/02/2019,14:00,12.9157553,77.571373,2019-02-15 14:00:00,14,4,15,2,1,0,0,1,0,0,-0.4999999999999998,-0.8660254037844388,-0.433883739117558,-0.9009688679024191,0.8660254037844386,0.5000000000000001,12.91,77.57000000000001,82,6.700411079353566,5,2.0,2.0,0,8.837681215593197
Kidnap,15/02/2019,20:00,12.910581,77.558642,2019-02-15 20:00:00,20,4,15,2,1,0,0,0,1,0,-0.8660254037844386,0.5000000000000001,-0.433883739117558,-0.9009688679024191,0.8660254037844386,0.5000000000000001,12.91,77.55,40,7.824401504664213,5,2.0,2.4,0,8.912572960090339
Kidnap,27/02/2019,12:00,12.9157553,77.571373,2019-02-27 12:00:00,12,2,27,2,1,0,0,1,0,0,1.2246467991473532e-16,-1.0,0.9749279121818236,-0.22252093395631434,0.8660254037844386,0.5000000000000001,12.91,77.57000000000001,82,6.700411079353566,5,2.0,2.0,0,8.837681215593197
Kidnap,11/3/2019,12:20,12.904531,77.565234,2019-03-11 12:20:00,12,0,11,3,1,0,0,1,0,0,1.2246467991473532e-16,-1.0,0.0,1.0,1.0,6.123233995736766e-17,12.9,77.56,89,8.108376641205213,5,2.0,2.0,0,8.99961934066053
Kidnap,15/03/2019,20:20,12.894779,77.562256,2019-03-15 20:20:00,20,4,15,3,1,0,0,0,1,0,-0.8660254037844386,0.5000000000000001,-0.433883739117558,-0.9009688679024191,1.0,6.123233995736766e-17,12.89,77.56,99,9.23332847236158,5,2.0,2.4,0,11.05240844637142
Kidnap,26/04/2019,11:50,12.904553,77.560433,2019-04-26 11:50:00,11,4,26,4,2,0,1,0,0,0,0.258819045102521,-0.9659258262890682,-0.433883739117558,-0.9009688679024191,0.8660254037844387,-0.49999999999999983,12.9,77.56,89,8.324158489687902,5,2.0,1.6,0,7.199695472528425
Kidnap,8/5/2019,11:00,12.902361,77.56838,2019-05-08 11:00:00,11,2,8,5,2,0,1,0,0,0,0.258819045102521,-0.9659258262890682,0.9749279121818236,-0.22252093395631434,0.49999999999999994,-0.8660254037844387,12.9,77.56,89,8.206659584570419,5,2.0,1.6,0,7.199695472528425
Kidnap,31/07/2019,15:00,12.9157553,77.571373,2019-07-31 15:00:00,15,2,31,7,3,0,0,1,0,0,-0.7071067811865471,-0.7071067811865479,0.9749279121818236,-0.22252093395631434,-0.4999999999999998,-0.8660254037844388,12.91,77.57000000000001,82,6.700411079353566,5,2.0,2.0,0,8.837681215593197
Kidnap,12/8/2019,12:00,12.904553,77.560433,2019-08-12 12:00:00,12,0,12,8,3,0,0,1,0,0,1.2246467991473532e-16,-1.0,0.0,1.0,-0.8660254037844384,-0.5000000000000004,12.9,77.56,89,8.324158489687902,5,2.0,2.0,0,8.99961934066053
Kidnap,23/10/2019,23:00,12.894779,77.562256,2019-10-23 23:00:00,23,2,23,10,4,0,0,0,0,1,-0.25881904510252157,0.9659258262890681,0.9749279121818236,-0.22252093395631434,-0.8660254037844386,0.5000000000000001,12.89,77.56,99,9.23332847236158,5,2.0,3.0,0,13.815510557964275
Kidnap,24/10/2019,19:30,12.8928133912158,77.5666300513369,2019-10-24 19:30:00,19,3,24,10,4,0,0,0,1,0,-0.9659258262890684,0.2588190451025203,0.43388373911755823,-0.900968867902419,-0.8660254037844386,0.5000000000000001,12.89,77.56,99,9.270259607280016,5,2.0,2.4,0,11.05240844637142
Kidnap,16/11/2019,11:00,12.904553,77.560433,2019-11-16 11:00:00,11,5,16,11,4,1,1,0,0,0,0.258819045102521,-0.9659258262890682,-0.9749279121818236,-0.2225209339563146,-0.5000000000000004,0.8660254037844384,12.9,77.56,89,8.324158489687902,5,2.0,1.6,0,7.199695472528425
Kidnap,14/12/2019,14:15,12.894779,77.562256,2019-12-14 14:15:00,14,5,14,12,4,1,0,1,0,0,-0.4999999999999998,-0.8660254037844388,-0.9749279121818236,-0.2225209339563146,-2.4492935982947064e-16,1.0,12.89,77.56,99,9.23332847236158,5,2.0,2.0,0,9.210340371976184
Kidnap,26/12/2019,11:30,12.8928133912158,77.5666300513369,2019-12-26 11:30:00,11,3,26,12,4,0,1,0,0,0,0.258819045102521,-0.9659258262890682,0.43388373911755823,-0.900968867902419,-2.4492935982947064e-16,1.0,12.89,77.56,99,9.270259607280016,5,2.0,1.6,0,7.368272297580948
Kidnap,25/12/2019,13:00,12.9157553,77.571373,2019-12-25 13:00:00,13,2,25,12,4,0,0,1,0,0,-0.2588190451025208,-0.9659258262890683,0.9749279121818236,-0.22252093395631434,-2.4492935982947064e-16,1.0,12.91,77.57000000000001,82,6.700411079353566,5,2.0,2.0,0,8.837681215593197
Kidnap,17/12/2016,11:00,12.942908,77.538157,2016-12-17 11:00:00,11,5,17,12,4,1,1,0,0,0,0.258819045102521,-0.9659258262890682,-0.9749279121818236,-0.2225209339563146,-2.4492935982947064e-16,1.0,12.94,77.53,1,6.898452748071316,5,2.0,1.6,0,1.1090354888959124
