Type,Date,Time,Latitude,Longitude,Datetime,hour,is_night,crime_weight,time_weight,risk_score
Murder,29/07/2016,21:00,12.93297,77.58381,2016-07-29 21:00:00,21,1,5.0,1.5,7.5
Murder,13/11/2016,23:45,12.930433,77.549761,2016-11-13 23:45:00,23,1,5.0,1.5,7.5
Murder,10/5/2017,21:00,12.923736,77.58182,2017-05-10 21:00:00,21,1,5.0,1.5,7.5
Murder,19/07/2017,19:30,12.924123,77.576913,2017-07-19 19:30:00,19,1,5.0,1.5,7.5
Murder,21/06/2018,23:30,12.924377,77.582729,2018-06-21 23:30:00,23,1,5.0,1.5,7.5
Murder,17/07/2018,21:15,12.920604,77.520557,2018-07-17 21:15:00,21,1,5.0,1.5,7.5
Murder,18/06/2016,21:00,12.93878218,77.57956109,2016-06-18 21:00:00,21,1,5.0,1.5,7.5
Murder,2/7/2017,18:30,12.9399013,77.57337112,2017-07-02 18:30:00,18,0,5.0,1.0,5.0
Murder,29/07/2019,18:00,12.944557,77.57758,2019-07-29 18:00:00,18,0,5.0,1.0,5.0
Murder,25/03/2016,21:40,"12°55'3.65""N","77°34'6.67""E",2016-03-25 21:40:00,21,1,5.0,1.5,7.5
Murder,26/04/2016,8:15,"12°54'55.52""N","77°33'43.22""E",2016-04-26 08:15:00,8,0,5.0,1.0,5.0
Murder,8/5/2016,6:15,"12°54'54.21""N","77°33'57.57""E",2016-05-08 06:15:00,6,0,5.0,1.0,5.0
Murder,23/05/2016,0:45,"12°55'10.75""N","77°34'26.57""E",2016-05-23 00:45:00,0,1,5.0,1.5,7.5
Murder,2/12/2016,22:30,12.91986,77.56931,2016-12-02 22:30:00,22,1,5.0,1.5,7.5
Murder,9/2/2017,19:00,"12°55'29.68""N","77°34'9.51""E",2017-02-09 19:00:00,19,1,5.0,1.5,7.5
Murder,27/11/2017,11:00,12.958864,77.638363,2017-11-27 11:00:00,11,0,5.0,1.0,5.0
Murder,23/07/2015,16:00,12.946595,77.59197,2015-07-23 16:00:00,16,0,5.0,1.0,5.0
Murder,23/12/2015,16:30,12.945264,77.59271,2015-12-23 16:30:00,16,0,5.0,1.0,5.0
Murder,10/4/2016,22:00,12.946042,77.593699,2016-04-10 22:00:00,22,1,5.0,1.5,7.5
Murder,16/05/2016,21:30,12.946042,77.593699,2016-05-16 21:30:00,21,1,5.0,1.5,7.5
Murder,22/06/2019,2:00,12.944408,77.593165,2019-06-22 02:00:00,2,1,5.0,1.5,7.5
Murder,9/2/2015,15:00,12.90976685,77.55679873,2015-02-09 15:00:00,15,0,5.0,1.0,5.0
Murder,15/03/2015,16:45,12.901082,77.54753806,2015-03-15 16:45:00,16,0,5.0,1.0,5.0
Murder,26/03/2015,21:45,12.86854765,77.5801126,2015-03-26 21:45:00,21,1,5.0,1.5,7.5
Murder,26/02/2017,20:10,12.90245473,77.54181407,2017-02-26 20:10:00,20,1,5.0,1.5,7.5
Murder,12/3/2017,21:00,12.88563257,77.5482591,2017-03-12 21:00:00,21,1,5.0,1.5,7.5
Murder,26/04/2017,23:50,12.88948381,77.56232091,2017-04-26 23:50:00,23,1,5.0,1.5,7.5
Murder,12/1/2018,22:30,12.9057223,77.53558126,2018-01-12 22:30:00,22,1,5.0,1.5,7.5
Murder,8/5/2019,13:00,12.91082367,77.54398174,2019-05-08 13:00:00,13,0,5.0,1.0,5.0
Murder,14/07/2019,21:45,12.913512,77.554144,2019-07-14 21:45:00,21,1,5.0,1.5,7.5
Murder,5/10/2019,17:30,12.91084893,77.53745649,2019-10-05 17:30:00,17,0,5.0,1.0,5.0
Murder,22/02/2015,15:00,12.87583,77.511157,2015-02-22 15:00:00,15,0,5.0,1.0,5.0
Murder,17/03/2015,5:00,12.894725,77.542178,2015-03-17 05:00:00,5,1,5.0,1.5,7.5
Murder,29/03/2015,16:00,12.874853,77.554205,2015-03-29 16:00:00,16,0,5.0,1.0,5.0
Murder,14/1/2016,14:45,12.860873,77.520947,2016-01-14 14:45:00,14,0,5.0,1.0,5.0
Murder,17/01/2017,12:30,12.864755,77.528047,2017-01-17 12:30:00,12,0,5.0,1.0,5.0
Murder,13/04/2017,12:15,12.871198,77.536856,2017-04-13 12:15:00,12,0,5.0,1.0,5.0
Murder,24/04/2017,10:00,12.853954,77.553705,2017-04-24 10:00:00,10,0,5.0,1.0,5.0
Murder,5/8/2017,4:00,12.870574,77.571346,2017-08-05 04:00:00,4,1,5.0,1.5,7.5
Murder,17/08/2017,5:00,12879498,77.542792,2017-08-17 05:00:00,5,1,5.0,1.5,7.5
Murder,22/08/2017,4:00,12.87548,77.535128,2017-08-22 04:00:00,4,1,5.0,1.5,7.5
Murder,17/01/2018,22:00,12.870129,77.556345,2018-01-17 22:00:00,22,1,5.0,1.5,7.5
Murder,14/07/2018,21:00,12.878193,77.535515,2018-07-14 21:00:00,21,1,5.0,1.5,7.5
Murder,19/09/2018,18:00,12.848726,77.572816,2018-09-19 18:00:00,18,0,5.0,1.0,5.0
Murder,16/10/2018,19:00,12.872393,77.557753,2018-10-16 19:00:00,19,1,5.0,1.5,7.5
Murder,27/10/2018,10:10,12.871255,77.56033,2018-10-27 10:10:00,10,0,5.0,1.0,5.0
Murder,3/11/2018,20:00,12.879671,77.54543,2018-11-03 20:00:00,20,1,5.0,1.5,7.5
Murder,19/08/2019,14:00,12.859739,77.562719,2019-08-19 14:00:00,14,0,5.0,1.0,5.0
Murder,14/10/2019,1:00,12.862041,77.563487,2019-10-14 01:00:00,1,1,5.0,1.5,7.5
Murder,17/11/2019,20:30,12.893051,77.543007,2019-11-17 20:30:00,20,1,5.0,1.5,7.5
Murder,4/3/2017,1:30,12.882152,77.565325,2017-03-04 01:30:00,1,1,5.0,1.5,7.5
Murder,29/07/2017,8:45,12.84488,77.583729,2017-07-29 08:45:00,8,0,5.0,1.0,5.0
Murder,1/11/2017,15:00,12.890277,77.57144,2017-11-01 15:00:00,15,0,5.0,1.0,5.0
Murder,18/11/2017,0:00,12.885583,77.57054,2017-11-18 00:00:00,0,1,5.0,1.5,7.5
Murder,7/9/2018,4:30,12.889932,77.57465,2018-09-07 04:30:00,4,1,5.0,1.5,7.5
Murder,1/10/2018,0:00,12.861345,77.579767,2018-10-01 00:00:00,0,1,5.0,1.5,7.5
Murder,21/11/2018,23:50,12.845887,77.583885,2018-11-21 23:50:00,23,1,5.0,1.5,7.5
Murder,13/06/2019,16:10,12.873733,77.579546,2019-06-13 16:10:00,16,0,5.0,1.0,5.0
Murder,2/1/2015,21:00,12.8966729945995,77.5607513795297,2015-01-02 21:00:00,21,1,5.0,1.5,7.5
Murder,30/04/2015,6:00,12.9050964485764,77.571337000055,2015-04-30 06:00:00,6,0,5.0,1.0,5.0
Murder,11/6/2015,5:00,12.9076945341477,77.5719852228203,2015-06-11 05:00:00,5,1,5.0,1.5,7.5
Murder,11/1/2016,11:00,12.9008927627643,77.5698813716385,2016-01-11 11:00:00,11,0,5.0,1.0,5.0
Murder,7/5/2016,13:45,12.9023385605328,77.5653252772123,2016-05-07 13:45:00,13,0,5.0,1.0,5.0
Murder,31/07/2016,21:30,12.9144905944493,77.5721064816148,2016-07-31 21:30:00,21,1,5.0,1.5,7.5
Murder,26/04/2017,15:00,12.9105468600267,77.5607455338601,2017-04-26 15:00:00,15,0,5.0,1.0,5.0
Murder,27/08/2017,15:00,12.8993985560933,77.572584947246,2017-08-27 15:00:00,15,0,5.0,1.0,5.0
Murder,5/2/2018,18:30,12.902333328087,77.56892819667,2018-02-05 18:30:00,18,0,5.0,1.0,5.0
Murder,30/04/2018,16:30,12.9143691111693,77.5733106370572,2018-04-30 16:30:00,16,0,5.0,1.0,5.0
Murder,25/08/2018,1:30,12.9155359324014,77.5616258170776,2018-08-25 01:30:00,1,1,5.0,1.5,7.5
Murder,24/03/2019,5:30,12.9142072407114,77.5618648043771,2019-03-24 05:30:00,5,1,5.0,1.5,7.5
Murder,8/6/2019,00:30,12.9061712471247,77.5698458437946,2019-06-08 00:30:00,0,1,5.0,1.5,7.5
Murder,12/11/2019,7:30,12.8964515698276,77.5602433120194,2019-11-12 07:30:00,7,0,5.0,1.0,5.0
Murder,8/1/2017,8:30,12.939585,77.544317,2017-01-08 08:30:00,8,0,5.0,1.0,5.0
Murder,21/04/2017,9:10,12.937792,77.537268,2017-04-21 09:10:00,9,0,5.0,1.0,5.0
Murder,8/4/2018,3:00,12.946026,77.544111,2018-04-08 03:00:00,3,1,5.0,1.5,7.5
Murder,9/7/2018,15:00,12.940271,77.542692,2018-07-09 15:00:00,15,0,5.0,1.0,5.0
Murder,15/04/2016,4:00,12.94865677,77.56227641,2016-04-15 04:00:00,4,1,5.0,1.5,7.5
Murder,7/7/2017,22:00,12.94953,77.56316,2017-07-07 22:00:00,22,1,5.0,1.5,7.5
Murder,14/07/2017,17:00,12.94953,77.56316,2017-07-14 17:00:00,17,0,5.0,1.0,5.0
Murder,5/5/2016,17:45,12.9560843652345,77.5756127337875,2016-05-05 17:45:00,17,0,5.0,1.0,5.0
Murder,4/12/2019,23:00,12.94885,77.55255,2019-12-04 23:00:00,23,1,5.0,1.5,7.5
Attempted Murder,10/2/2016,7:00,12.971599,77.594563,2016-02-10 07:00:00,7,0,1.0,1.0,1.0
Attempted Murder,9/11/2016,13:30,12.80642,77.52537,2016-11-09 13:30:00,13,0,1.0,1.0,1.0
Attempted Murder,21/01/2017,23:50,12.921755,77.588346,2017-01-21 23:50:00,23,1,1.0,1.5,1.5
Attempted Murder,12/6/2017,7:35,12.922076,77.5589539,2017-06-12 07:35:00,7,0,1.0,1.0,1.0
Attempted Murder,22/05/2018,18:00,12.835635,77.653354,2018-05-22 18:00:00,18,0,1.0,1.0,1.0
Attempted Murder,13/08/2018,16:45,12.925635,77.583354,2018-08-13 16:45:00,16,0,1.0,1.0,1.0
Attempted Murder,30/11/2018,20:00,12.28784,76.63313,2018-11-30 20:00:00,20,1,1.0,1.5,1.5
Attempted Murder,2/12/2018,16:25,12.79642,77.50537,2018-12-02 16:25:00,16,0,1.0,1.0,1.0
Attempted Murder,28/04/2019,19:30,12.93443,77.592697,2019-04-28 19:30:00,19,1,1.0,1.5,1.5
Attempted Murder,3/1/2015,1:15,"12°55'3.64""N","77°33'49.98""E",2015-01-03 01:15:00,1,1,1.0,1.5,1.5
Attempted Murder,28/02/2015,20:00,"12°55'3.12""N","77°34'24.16""E",2015-02-28 20:00:00,20,1,1.0,1.5,1.5
Attempted Murder,1/3/2015,14:30,"12°55'10.75""N","77°34'26.57""E",2015-03-01 14:30:00,14,0,1.0,1.0,1.0
Attempted Murder,7/4/2015,17:45,"12°55'45.40""N","77°34'25.14""E",2015-04-07 17:45:00,17,0,1.0,1.0,1.0
Attempted Murder,17/04/2015,21:00,"12°56'9.55""N","77°34'28.85""E",2015-04-17 21:00:00,21,1,1.0,1.5,1.5
Attempted Murder,19/05/2015,13:30,"12°55'41.94""N","77°33'51.82""E",2015-05-19 13:30:00,13,0,1.0,1.0,1.0
Attempted Murder,9/10/2015,13:00,"12°55'40.70""N","77°34'11.52""E",2015-10-09 13:00:00,13,0,1.0,1.0,1.0
Attempted Murder,4/11/2015,22:30,"12°55'10.79""N","77°34'25.18""E",2015-11-04 22:30:00,22,1,1.0,1.5,1.5
Attempted Murder,25/12/2015,18:10,"12°55'26.11""N","77°34'16.67""E",2015-12-25 18:10:00,18,0,1.0,1.0,1.0
Attempted Murder,31/12/2015,15:00,"12°55'26.11""N","77°34'16.67""E",2015-12-31 15:00:00,15,0,1.0,1.0,1.0
Attempted Murder,1/6/2016,15:30,"12°54'56.05""N","77°33'24.38""E",2016-06-01 15:30:00,15,0,1.0,1.0,1.0
Attempted Murder,24/06/2016,21:00,"12°55'11.17""N",77°34'14.98,2016-06-24 21:00:00,21,1,1.0,1.5,1.5
Attempted Murder,16/07/2016,21:00,"12°55'18.20""N",77°34'24.78,2016-07-16 21:00:00,21,1,1.0,1.5,1.5
Attempted Murder,16/07/2016,21:30,"12°55'18.20""N",77°34'24.78,2016-07-16 21:30:00,21,1,1.0,1.5,1.5
Attempted Murder,31/07/2016,23:30,"12°55'10.75""N","77°34'26.57""E",2016-07-31 23:30:00,23,1,1.0,1.5,1.5
Attempted Murder,31/08/2016,21:00,"12°55'1.60""N","77°33'45.66""E",2016-08-31 21:00:00,21,1,1.0,1.5,1.5
Attempted Murder,30/09/2016,0:30,"77°34'19.68""E","77°34'25.60""E",2016-09-30 00:30:00,0,1,1.0,1.5,1.5
Attempted Murder,12/11/2016,10:30,"12°54'56.05""N",77°33'24.38,2016-11-12 10:30:00,10,0,1.0,1.0,1.0
Attempted Murder,16/12/2016,11:45,"12°55'36.30""N",77°33'48.98,2016-12-16 11:45:00,11,0,1.0,1.0,1.0
Attempted Murder,22/12/2016,22:15,"12°55'10.22""N","77°33'47.85""E",2016-12-22 22:15:00,22,1,1.0,1.5,1.5
Attempted Murder,3/5/2017,17:00,12.87974,77.50031,2017-05-03 17:00:00,17,0,1.0,1.0,1.0
Attempted Murder,27/06/2017,9:30,"12°55'3.12""N","77°34'24.16""E",2017-06-27 09:30:00,9,0,1.0,1.0,1.0
Attempted Murder,27/06/2017,10:00,"12°55'5.33""N","77°34'19.83""E",2017-06-27 10:00:00,10,0,1.0,1.0,1.0
Attempted Murder,1/10/2017,6:00,12.92957,77.57276,2017-10-01 06:00:00,6,0,1.0,1.0,1.0
Attempted Murder,8/11/2017,23:45,12.91851,77.58122,2017-11-08 23:45:00,23,1,1.0,1.5,1.5
Attempted Murder,9/11/2017,5:00,12.87974,77.50031,2017-11-09 05:00:00,5,1,1.0,1.5,1.5
Attempted Murder,9/11/2017,8:00,"12°55'38.80""N","77°34'36.95""E",2017-11-09 08:00:00,8,0,1.0,1.0,1.0
Attempted Murder,16/11/2017,10:45,"12°55'5.33""N","77°34'19.83""E",2017-11-16 10:45:00,10,0,1.0,1.0,1.0
Attempted Murder,15/01/2018,18:15,12.89066,77.575524,2018-01-15 18:15:00,18,0,1.0,1.0,1.0
Attempted Murder,8/4/2018,10:50,"12°55'3.12""N","77°34'24.16""E",2018-04-08 10:50:00,10,0,1.0,1.0,1.0
Attempted Murder,12/4/2018,15:30,"12°55'3.12""N","77°34'24.16""E",2018-04-12 15:30:00,15,0,1.0,1.0,1.0
Attempted Murder,7/9/2018,9:30,"12°55'4.22""N","77°33'51.21""E",2018-09-07 09:30:00,9,0,1.0,1.0,1.0
Attempted Murder,4/12/2018,9:45,"12°55'3.12""N","77°34'24.16""E",2018-12-04 09:45:00,9,0,1.0,1.0,1.0
Attempted Murder,11/3/2019,13:15,13.01965,77.60673,2019-03-11 13:15:00,13,0,1.0,1.0,1.0
Attempted Murder,13/06/2019,9:30,"12°55'4.22""N","77°33'51.21""E",2019-06-13 09:30:00,9,0,1.0,1.0,1.0
Attempted Murder,12/4/2018,15:45,"12°55'10.75""N","77°34'26.57""E",2018-04-12 15:45:00,15,0,1.0,1.0,1.0
Attempted Murder,29/10/2019,20:40,"12°55'10.75""N","77°34'26.57""E",2019-10-29 20:40:00,20,1,1.0,1.5,1.5
Attempted Murder,22/03/2015,14:30,12.944814,77.587996,2015-03-22 14:30:00,14,0,1.0,1.0,1.0
Attempted Murder,11/4/2015,14:00,12.942789,77.596405,2015-04-11 14:00:00,14,0,1.0,1.0,1.0
Attempted Murder,22/07/2015,18:30,12.946042,77.593699,2015-07-22 18:30:00,18,0,1.0,1.0,1.0
Attempted Murder,6/8/2015,21:00,12.93481,77.591525,2015-08-06 21:00:00,21,1,1.0,1.5,1.5
Attempted Murder,11/8/2015,0:15,12.945283,77.58671,2015-08-11 00:15:00,0,1,1.0,1.5,1.5
Attempted Murder,16/08/2015,20:30,12.942789,77.596405,2015-08-16 20:30:00,20,1,1.0,1.5,1.5
Attempted Murder,3/9/2015,20:00,12.934073,77.592244,2015-09-03 20:00:00,20,1,1.0,1.5,1.5
Attempted Murder,6/9/2015,20:00,12.944485,77.591988,2015-09-06 20:00:00,20,1,1.0,1.5,1.5
Attempted Murder,3/10/2015,9:15,12.945602,77.588022,2015-10-03 09:15:00,9,0,1.0,1.0,1.0
Attempted Murder,17/11/2015,21:00,12.946595,77.59197,2015-11-17 21:00:00,21,1,1.0,1.5,1.5
Attempted Murder,8/3/2016,13:15,12.944814,77.587996,2016-03-08 13:15:00,13,0,1.0,1.0,1.0
Attempted Murder,20/03/2016,13:00,12.944814,77.587996,2016-03-20 13:00:00,13,0,1.0,1.0,1.0
Attempted Murder,26/04/2016,4:00,12.942707,77.585262,2016-04-26 04:00:00,4,1,1.0,1.5,1.5
Attempted Murder,14/06/2017,4:30,12.935847,77.593125,2017-06-14 04:30:00,4,1,1.0,1.5,1.5
Attempted Murder,6/7/2017,20:45,12.944265,77.593685,2017-07-06 20:45:00,20,1,1.0,1.5,1.5
Attempted Murder,19/12/2017,14:00,12.945058,77.591578,2017-12-19 14:00:00,14,0,1.0,1.0,1.0
Attempted Murder,25/10/2018,10:45,12.9446676,77.592128,2018-10-25 10:45:00,10,0,1.0,1.0,1.0
Attempted Murder,28/11/2018,17:00,12.941015,77.580237,2018-11-28 17:00:00,17,0,1.0,1.0,1.0
Attempted Murder,24/12/2018,20:00,12.9446676,77.592128,2018-12-24 20:00:00,20,1,1.0,1.5,1.5
Attempted Murder,6/1/2019,15:00,12.938585,77.58509,2019-01-06 15:00:00,15,0,1.0,1.0,1.0
Attempted Murder,18/02/2019,9:45,12.946428,77.591183,2019-02-18 09:45:00,9,0,1.0,1.0,1.0
Attempted Murder,27/02/2019,13:30,12.951431,77.590558,2019-02-27 13:30:00,13,0,1.0,1.0,1.0
Attempted Murder,8/4/2019,12:00,12.945058,77.591578,2019-04-08 12:00:00,12,0,1.0,1.0,1.0
Attempted Murder,7/8/2019,12:00,12.946042,77.593699,2019-08-07 12:00:00,12,0,1.0,1.0,1.0
Attempted Murder,9/12/2019,21:00,12.942008,77.593672,2019-12-09 21:00:00,21,1,1.0,1.5,1.5
Attempted Murder,10/12/2019,21:30,12.936049,77.592597,2019-12-10 21:30:00,21,1,1.0,1.5,1.5
Attempted Murder,22/12/2019,16:30,12.943814,77.59715,2019-12-22 16:30:00,16,0,1.0,1.0,1.0
Attempted Murder,20/03/2015,21:00,12.870927,77.536764,2015-03-20 21:00:00,21,1,1.0,1.5,1.5
Attempted Murder,5/4/2015,21:00,12.891626,77.496854,2015-04-05 21:00:00,21,1,1.0,1.5,1.5
Attempted Murder,14/05/2015,14:00,12.862772,77.531239,2015-05-14 14:00:00,14,0,1.0,1.0,1.0
Attempted Murder,17/09/2015,20:30,12.876155,77.53255,2015-09-17 20:30:00,20,1,1.0,1.5,1.5
Attempted Murder,15/10/2015,9:30,12.872936,77.528647,2015-10-15 09:30:00,9,0,1.0,1.0,1.0
Attempted Murder,30/03/2016,17:00,12.874927,77.542694,2016-03-30 17:00:00,17,0,1.0,1.0,1.0
Attempted Murder,29/06/2019,11:00,12.870315,77.5375,2019-06-29 11:00:00,11,0,1.0,1.0,1.0
Attempted Murder,8/8/2016,15:00,12.872491,77560741,2016-08-08 15:00:00,15,0,1.0,1.0,1.0
Attempted Murder,8/8/2016,15:30,12.872491,77560741,2016-08-08 15:30:00,15,0,1.0,1.0,1.0
Attempted Murder,28/09/2016,13:00,12.876095,77.546538,2016-09-28 13:00:00,13,0,1.0,1.0,1.0
Attempted Murder,25/11/2016,0:15,12.879245,77.512528,2016-11-25 00:15:00,0,1,1.0,1.5,1.5
Attempted Murder,28/11/2016,17:00,12.891048,77.542411,2016-11-28 17:00:00,17,0,1.0,1.0,1.0
Attempted Murder,3/12/2016,7:00,12.88374,77.501315,2016-12-03 07:00:00,7,0,1.0,1.0,1.0
Attempted Murder,1/2/2017,22:30,12.856318,77.559623,2017-02-01 22:30:00,22,1,1.0,1.5,1.5
Attempted Murder,27/02/2017,23:15,12.895099,77.542102,2017-02-27 23:15:00,23,1,1.0,1.5,1.5
Attempted Murder,11/4/2017,1:00,12.869881,77.525669,2017-04-11 01:00:00,1,1,1.0,1.5,1.5
Attempted Murder,17/05/2017,13:30,12.868478,77.521805,2017-05-17 13:30:00,13,0,1.0,1.0,1.0
Attempted Murder,10/6/2017,14:45,12.877804,77.533739,2017-06-10 14:45:00,14,0,1.0,1.0,1.0
Attempted Murder,16/08/2017,10:30,12.863084,77.526325,2017-08-16 10:30:00,10,0,1.0,1.0,1.0
Attempted Murder,19/11/2017,12:10,12.880893,77.543751,2017-11-19 12:10:00,12,0,1.0,1.0,1.0
Attempted Murder,26/11/2017,22:00,12.874507,77.529564,2017-11-26 22:00:00,22,1,1.0,1.5,1.5
Attempted Murder,11/2/2018,12:00,12.853218,77.553667,2018-02-11 12:00:00,12,0,1.0,1.0,1.0
Attempted Murder,1/4/2018,8:30,12.881532,77.511282,2018-04-01 08:30:00,8,0,1.0,1.0,1.0
Attempted Murder,18/06/2018,21:15,12.877385,77.534077,2018-06-18 21:15:00,21,1,1.0,1.5,1.5
Attempted Murder,11/9/2018,23:30,12.867237,77.535278,2018-09-11 23:30:00,23,1,1.0,1.5,1.5
Attempted Murder,26/10/2018,13:00,12.878813,77.482329,2018-10-26 13:00:00,13,0,1.0,1.0,1.0
Attempted Murder,22/11/2018,18:30,12.85092,77.557048,2018-11-22 18:30:00,18,0,1.0,1.0,1.0
Attempted Murder,7/4/2019,3:45,12.880754,77.549448,2019-04-07 03:45:00,3,1,1.0,1.5,1.5
Attempted Murder,4/9/2019,18:30,12.895797,77.536992,2019-09-04 18:30:00,18,0,1.0,1.0,1.0
Attempted Murder,5/9/2019,6:30,12.865399,77.520688,2019-09-05 06:30:00,6,0,1.0,1.0,1.0
Attempted Murder,17/09/2019,14:00,12.865652,77.516896,2019-09-17 14:00:00,14,0,1.0,1.0,1.0
Attempted Murder,31/05/2017,9:00,12.881457,77.573157,2017-05-31 09:00:00,9,0,1.0,1.0,1.0
Attempted Murder,2/7/2017,12:30,12.85708,77.577065,2017-07-02 12:30:00,12,0,1.0,1.0,1.0
Attempted Murder,12/10/2017,22:30,12.899251,77.576456,2017-10-12 22:30:00,22,1,1.0,1.5,1.5
Attempted Murder,2/12/2017,23:00,12.88967,77.571871,2017-12-02 23:00:00,23,1,1.0,1.5,1.5
Attempted Murder,3/12/2017,0:10,12.871945,77.57484,2017-12-03 00:10:00,0,1,1.0,1.5,1.5
Attempted Murder,5/2/2019,15:20,12.855507,77.587458,2019-02-05 15:20:00,15,0,1.0,1.0,1.0
Attempted Murder,30/03/2019,4:15,12.888075,77.570911,2019-03-30 04:15:00,4,1,1.0,1.5,1.5
Attempted Murder,11/4/2018,9:40,12.88245,77.575277,2018-04-11 09:40:00,9,0,1.0,1.0,1.0
Attempted Murder,26/05/2018,19:00,12.871945,77.57484,2018-05-26 19:00:00,19,1,1.0,1.5,1.5
Attempted Murder,2/7/2018,20:54,12.881966,77.566281,2018-07-02 20:54:00,20,1,1.0,1.5,1.5
Attempted Murder,31/07/2018,13:10,12.84856,77.58442,2018-07-31 13:10:00,13,0,1.0,1.0,1.0
Attempted Murder,25/08/2018,5:30,12.870638,77.583264,2018-08-25 05:30:00,5,1,1.0,1.5,1.5
Attempted Murder,26/04/2018,17:00,12.881012,77.57636,2018-04-26 17:00:00,17,0,1.0,1.0,1.0
Attempted Murder,5/2/2019,21:00,12.88967,77.571871,2019-02-05 21:00:00,21,1,1.0,1.5,1.5
Attempted Murder,30/03/2019,7:00,12.878993,77.557886,2019-03-30 07:00:00,7,0,1.0,1.0,1.0
Attempted Murder,31/03/2019,7:15,12.880183,77.567401,2019-03-31 07:15:00,7,0,1.0,1.0,1.0
Attempted Murder,3/4/2019,21:10,12.896392,77.570185,2019-04-03 21:10:00,21,1,1.0,1.5,1.5
Attempted Murder,4/4/2019,7:00,12.89639,77.570185,2019-04-04 07:00:00,7,0,1.0,1.0,1.0
Attempted Murder,30/05/2019,23:15,12.840624,77.580569,2019-05-30 23:15:00,23,1,1.0,1.5,1.5
Attempted Murder,20/11/2019,16:30,12.88818,77.570987,2019-11-20 16:30:00,16,0,1.0,1.0,1.0
Attempted Murder,25/11/2019,12:30,12.843536,77.5836,2019-11-25 12:30:00,12,0,1.0,1.0,1.0
Attempted Murder,10/2/2015,19:00,12.9124182556892,77.5641048370764,2015-02-10 19:00:00,19,1,1.0,1.5,1.5
Attempted Murder,6/3/2015,22:00,12.8999136414243,77.5724909471076,2015-03-06 22:00:00,22,1,1.0,1.5,1.5
Attempted Murder,7/7/2015,17:00,12.9026072787272,77.5614887435773,2015-07-07 17:00:00,17,0,1.0,1.0,1.0
Attempted Murder,29/07/2015,18:30,12.9021874622456,77.5726241709647,2015-07-29 18:30:00,18,0,1.0,1.0,1.0
Attempted Murder,29/07/2015,12:00,12.9021874622456,77.5726241709647,2015-07-29 12:00:00,12,0,1.0,1.0,1.0
Attempted Murder,3/12/2015,16:30,12.9085203452405,77.5725265251381,2015-12-03 16:30:00,16,0,1.0,1.0,1.0
Attempted Murder,13/12/2015,21:00,12.9141256400484,77.5633354568206,2015-12-13 21:00:00,21,1,1.0,1.5,1.5
Attempted Murder,19/12/2015,12:00,12.9021874622456,77.5726241709647,2015-12-19 12:00:00,12,0,1.0,1.0,1.0
Attempted Murder,7/1/2016,21:00,12.9071512442452,77.5706532660885,2016-01-07 21:00:00,21,1,1.0,1.5,1.5
Attempted Murder,9/1/2016,22:30,12.9105468600267,77.5607455338601,2016-01-09 22:30:00,22,1,1.0,1.5,1.5
Attempted Murder,27/01/2016,15:15,12.9156668834348,77.5615653226641,2016-01-27 15:15:00,15,0,1.0,1.0,1.0
Attempted Murder,3/5/2016,22:00,12.9036664359072,77.567460870869,2016-05-03 22:00:00,22,1,1.0,1.5,1.5
Attempted Murder,4/6/2016,11:00,12.892719430893,77.5668159621641,2016-06-04 11:00:00,11,0,1.0,1.0,1.0
Attempted Murder,7/7/2016,15:30,12.9144905944493,77.5721064816148,2016-07-07 15:30:00,15,0,1.0,1.0,1.0
Attempted Murder,31/07/2016,20:40,12.9144905944493,77.5721064816148,2016-07-31 20:40:00,20,1,1.0,1.5,1.5
Attempted Murder,7/8/2016,0:30,12.9073405371661,77.5726119249203,2016-08-07 00:30:00,0,1,1.0,1.5,1.5
Attempted Murder,16/08/2016,23:01,12.9043309015663,77.5684681501214,2016-08-16 23:01:00,23,1,1.0,1.5,1.5
Attempted Murder,5/9/2016,17:00,12.9008927627643,77.5698813716385,2016-09-05 17:00:00,17,0,1.0,1.0,1.0
Attempted Murder,3/9/2016,15:30,12.9162974053303,77.5707956209262,2016-09-03 15:30:00,15,0,1.0,1.0,1.0
Attempted Murder,19/10/2016,18:15,12.895284445528,77.5662128659953,2016-10-19 18:15:00,18,0,1.0,1.0,1.0
Attempted Murder,22/10/2016,9:30,12.8985485830136,77.5696633326515,2016-10-22 09:30:00,9,0,1.0,1.0,1.0
Attempted Murder,1/11/2016,11:55,12.8981950397319,77.5693753268396,2016-11-01 11:55:00,11,0,1.0,1.0,1.0
Attempted Murder,21/12/2016,0:20,12.8988074924041,77.5722900133757,2016-12-21 00:20:00,0,1,1.0,1.5,1.5
Attempted Murder,4/2/2017,21:00,12.9124941271334,77.5724056559576,2017-02-04 21:00:00,21,1,1.0,1.5,1.5
Attempted Murder,24/03/2017,21:00,12.9036664359072,77.567460870869,2017-03-24 21:00:00,21,1,1.0,1.5,1.5
Attempted Murder,9/6/2017,23:00,12.8964515698276,77.5602433120194,2017-06-09 23:00:00,23,1,1.0,1.5,1.5
Attempted Murder,23/08/2017,21:00,12.9026072787272,77.5614887435773,2017-08-23 21:00:00,21,1,1.0,1.5,1.5
Attempted Murder,22/11/2017,22:30,12.9007131600848,77.5651239475589,2017-11-22 22:30:00,22,1,1.0,1.5,1.5
Attempted Murder,27/11/2017,21:00,12.9079107980595,77.5667368067783,2017-11-27 21:00:00,21,1,1.0,1.5,1.5
Attempted Murder,13/03/2018,18:00,12.9135166186977,77.5670477005948,2018-03-13 18:00:00,18,0,1.0,1.0,1.0
Attempted Murder,29/05/2018,19:00,12.9008927627643,77.5698813716385,2018-05-29 19:00:00,19,1,1.0,1.5,1.5
Attempted Murder,18/06/2018,14:00,12.9043309015663,77.5684681501214,2018-06-18 14:00:00,14,0,1.0,1.0,1.0
Attempted Murder,26/06/2018,15:00,12.9151436819703,77.5694191266274,2018-06-26 15:00:00,15,0,1.0,1.0,1.0
Attempted Murder,9/7/2018,14:00,12.9023385605328,77.5653252772123,2018-07-09 14:00:00,14,0,1.0,1.0,1.0
Attempted Murder,18/07/2018,23:00,12.8982364488419,77.5694762090069,2018-07-18 23:00:00,23,1,1.0,1.5,1.5
Attempted Murder,5/9/2020,21:00,12.9050964485764,77.571337000055,2020-09-05 21:00:00,21,1,1.0,1.5,1.5
Attempted Murder,3/11/2018,18:00,12.9061712471247,77.5698458437946,2018-11-03 18:00:00,18,0,1.0,1.0,1.0
Attempted Murder,7/12/2018,23:30,12.9135166186977,77.5670477005948,2018-12-07 23:30:00,23,1,1.0,1.5,1.5
Attempted Murder,29/01/2019,22:30,12.896847554625,77.5674809920983,2019-01-29 22:30:00,22,1,1.0,1.5,1.5
Attempted Murder,17/08/2019,22:30,12.8979064683143,77.5594980995282,2019-08-17 22:30:00,22,1,1.0,1.5,1.5
Attempted Murder,8/9/2019,13:30,12.8914388215753,77.5645044225484,2019-09-08 13:30:00,13,0,1.0,1.0,1.0
Attempted Murder,9/9/2015,5:00,12.931754,77.539058,2015-09-09 05:00:00,5,1,1.0,1.5,1.5
Attempted Murder,2/6/2016,8:00,12.937792,77.537268,2016-06-02 08:00:00,8,0,1.0,1.0,1.0
Attempted Murder,1/1/2016,11:30,12.939647,77.552168,2016-01-01 11:30:00,11,0,1.0,1.0,1.0
Attempted Murder,12/3/2016,16:00,12.943851,77.548762,2016-03-12 16:00:00,16,0,1.0,1.0,1.0
Attempted Murder,3/11/2016,22:30,12.939585,77.544317,2016-11-03 22:30:00,22,1,1.0,1.5,1.5
Attempted Murder,10/11/2016,22:15,12.933474,77.543107,2016-11-10 22:15:00,22,1,1.0,1.5,1.5
Attempted Murder,12/5/2016,11:30,12.930897,77.53865,2016-05-12 11:30:00,11,0,1.0,1.0,1.0
Attempted Murder,5/3/2017,19:00,12.939647,77.552168,2017-03-05 19:00:00,19,1,1.0,1.5,1.5
Attempted Murder,7/12/2017,20:30,12.936892,77.551396,2017-12-07 20:30:00,20,1,1.0,1.5,1.5
Attempted Murder,1/12/2018,22:00,12.93586,77.54388,2018-12-01 22:00:00,22,1,1.0,1.5,1.5
Attempted Murder,10/12/2019,22:00,12.940715,77.545315,2019-12-10 22:00:00,22,1,1.0,1.5,1.5
Attempted Murder,30/05/2016,1:30,12.94953,77.56316,2016-05-30 01:30:00,1,1,1.0,1.5,1.5
Attempted Murder,20/03/2017,9:00,12.94953,77.56316,2017-03-20 09:00:00,9,0,1.0,1.0,1.0
Attempted Murder,12/3/2018,21:30,12.951433,77.567242,2018-03-12 21:30:00,21,1,1.0,1.5,1.5
Attempted Murder,16/03/2018,15:00,12.953511,77.559792,2018-03-16 15:00:00,15,0,1.0,1.0,1.0
Attempted Murder,10/4/2018,10:30,12.95046684,77.5643001,2018-04-10 10:30:00,10,0,1.0,1.0,1.0
Attempted Murder,6/6/2018,19:00,12.948701,77.559813,2018-06-06 19:00:00,19,1,1.0,1.5,1.5
Attempted Murder,18/06/2019,11:30,12.95014,77.5604,2019-06-18 11:30:00,11,0,1.0,1.0,1.0
Attempted Murder,17/07/2019,21:30,12.94968,77.56202,2019-07-17 21:30:00,21,1,1.0,1.5,1.5
Attempted Murder,20/09/2019,2:40,12.94827,77.55944,2019-09-20 02:40:00,2,1,1.0,1.5,1.5
Attempted Murder,14/11/2019,22:30,12.94951,77.56312,2019-11-14 22:30:00,22,1,1.0,1.5,1.5
Attempted Murder,22/11/2019,12:30,12.94953,77.56316,2019-11-22 12:30:00,12,0,1.0,1.0,1.0
Attempted Murder,2/12/2019,23:00,12.94953,77.56316,2019-12-02 23:00:00,23,1,1.0,1.5,1.5
Attempted Murder,24/08/2017,16:00,12.9533,77.57242,2017-08-24 16:00:00,16,0,1.0,1.0,1.0
Attempted Murder,29/09/2019,19:00,12.948775,77.572542,2019-09-29 19:00:00,19,1,1.0,1.5,1.5
Attempted Murder,10/9/2017,4:3,12.951456020309,77.5799156304629,2017-09-10 04:03:00,4,1,1.0,1.5,1.5
Attempted Murder,3/11/2017,19:3,12.9537220810801,77.5757708482381,2017-11-03 19:03:00,19,1,1.0,1.5,1.5
Attempted Murder,4/1/2015,15:15,12.9394,77.5543,2015-01-04 15:15:00,15,0,1.0,1.0,1.0
Attempted Murder,16/01/2015,12:15,12.9365,77.556,2015-01-16 12:15:00,12,0,1.0,1.0,1.0
Attempted Murder,2/2/2015,17:00,12.5614,77.3305,2015-02-02 17:00:00,17,0,1.0,1.0,1.0
Attempted Murder,25/03/2015,18:00,12.5638,77.3316,2015-03-25 18:00:00,18,0,1.0,1.0,1.0
Attempted Murder,28/04/2015,2:30,12.565,77.3633,2015-04-28 02:30:00,2,1,1.0,1.5,1.5
Attempted Murder,2/6/2015,21:00,12.5648,77.3348,2015-06-02 21:00:00,21,1,1.0,1.5,1.5
Attempted Murder,19/09/2015,18:30,12.5629,77.3313,2015-09-19 18:30:00,18,0,1.0,1.0,1.0
Attempted Murder,18/07/2016,12:15,12.5653,77.3319,2016-07-18 12:15:00,12,0,1.0,1.0,1.0
Attempted Murder,9/9/2016,9:50,12.561,77.3317,2016-09-09 09:50:00,9,0,1.0,1.0,1.0
Attempted Murder,27/10/2016,13:30,12.5626,77.3327,2016-10-27 13:30:00,13,0,1.0,1.0,1.0
Attempted Murder,10/2/2017,8:45,12.9324412,77.564925,2017-02-10 08:45:00,8,0,1.0,1.0,1.0
Attempted Murder,1/5/2017,21:30,12.5641,77.3316,2017-05-01 21:30:00,21,1,1.0,1.5,1.5
Attempted Murder,6/7/2017,11:15,12.5658,77.334,2017-07-06 11:15:00,11,0,1.0,1.0,1.0
Attempted Murder,18/07/2017,18:30,12.5631,77.3315,2017-07-18 18:30:00,18,0,1.0,1.0,1.0
Attempted Murder,5/2/2017,22:00,12.5546,77.3403,2017-02-05 22:00:00,22,1,1.0,1.5,1.5
Attempted Murder,14/07/2018,23:40,12.5643,77.3331,2018-07-14 23:40:00,23,1,1.0,1.5,1.5
Attempted Murder,4/2/2019,12:30,12.5629,77.3454,2019-02-04 12:30:00,12,0,1.0,1.0,1.0
Attempted Murder,4/4/2019,21:15,12.5649,77.3492,2019-04-04 21:15:00,21,1,1.0,1.5,1.5
Attempted Murder,30/04/2019,12:30,12.5668,77.3323,2019-04-30 12:30:00,12,0,1.0,1.0,1.0
Attempted Murder,31/12/2019,12:15,12.5654,77.3309,2019-12-31 12:15:00,12,0,1.0,1.0,1.0
Robbery,9/1/2015,15:15,12.914562,77.58467,2015-01-09 15:15:00,15,0,4.0,1.0,4.0
Robbery,18/02/2015,13:00,12.912566,77.58986,2015-02-18 13:00:00,13,0,4.0,1.0,4.0
Robbery,25/02/2015,13:30,12.91802,77.58833,2015-02-25 13:30:00,13,0,4.0,1.0,4.0
Robbery,14/05/2015,0:05,12.554512,77,2015-05-14 00:05:00,0,1,4.0,1.5,6.0
Robbery,5/7/2015,3:40,12.932946,77.58386,2015-07-05 03:40:00,3,1,4.0,1.5,6.0
Robbery,2/11/2015,9:45,12.915644,77.56456,2015-11-02 09:45:00,9,0,4.0,1.0,4.0
Robbery,7/2/2016,20:45,12.97194,77.59369,2016-02-07 20:45:00,20,1,4.0,1.5,6.0
Robbery,29/02/2016,11:00,12.932554,77.589451,2016-02-29 11:00:00,11,0,4.0,1.0,4.0
Robbery,7/4/2016,20:15,12.933705,77.5787847,2016-04-07 20:15:00,20,1,4.0,1.5,6.0
Robbery,9/9/2016,20:15,12.96557,77.60625,2016-09-09 20:15:00,20,1,4.0,1.5,6.0
Robbery,19/09/2016,23:30,12.916148,77.58543,2016-09-19 23:30:00,23,1,4.0,1.5,6.0
Robbery,9/10/2016,22:00,12.922512,77.588537,2016-10-09 22:00:00,22,1,4.0,1.5,6.0
Robbery,26/10/2016,21:00,12.97194,77.59369,2016-10-26 21:00:00,21,1,4.0,1.5,6.0
Robbery,26/10/2016,16:30,12.97194,77.59369,2016-10-26 16:30:00,16,0,4.0,1.0,4.0
Robbery,22/11/2016,9:15,12.922517,77.58415,2016-11-22 09:15:00,9,0,4.0,1.0,4.0
Robbery,29/11/2016,21:35,12.929273,77.582423,2016-11-29 21:35:00,21,1,4.0,1.5,6.0
Robbery,2/12/2016,0:30,12.922918,77.58598,2016-12-02 00:30:00,0,1,4.0,1.5,6.0
Robbery,9/12/2016,20:00,12.96557,77.60625,2016-12-09 20:00:00,20,1,4.0,1.5,6.0
Robbery,18/12/2016,14:00,12.929273,77.58242,2016-12-18 14:00:00,14,0,4.0,1.0,4.0
Robbery,26/12/2016,10:30,12.929273,77.58242,2016-12-26 10:30:00,10,0,4.0,1.0,4.0
Robbery,27/03/2017,12:30,12.924709,77.589568,2017-03-27 12:30:00,12,0,4.0,1.0,4.0
Robbery,21/04/2017,10:40,12.920751,77.574677,2017-04-21 10:40:00,10,0,4.0,1.0,4.0
Robbery,21/04/2017,16:30,12.91113,77.572982,2017-04-21 16:30:00,16,0,4.0,1.0,4.0
Robbery,25/07/2017,9:00,12.920042,77.583575,2017-07-25 09:00:00,9,0,4.0,1.0,4.0
Robbery,28/07/2017,23:30,12.933466,77.584554,2017-07-28 23:30:00,23,1,4.0,1.5,6.0
Robbery,28/08/2017,14:30,12.923436,77.583712,2017-08-28 14:30:00,14,0,4.0,1.0,4.0
Robbery,12/9/2017,12:10,12.921507,77.580242,2017-09-12 12:10:00,12,0,4.0,1.0,4.0
Robbery,20/09/2017,11:30,12.929507,77.580123,2017-09-20 11:30:00,11,0,4.0,1.0,4.0
Robbery,30/10/2017,22:30,12.933196,77.583949,2017-10-30 22:30:00,22,1,4.0,1.5,6.0
Robbery,8/11/2017,13:15,12.937057,77.579642,2017-11-08 13:15:00,13,0,4.0,1.0,4.0
Robbery,14/11/2017,20:45,12.926539,77.580657,2017-11-14 20:45:00,20,1,4.0,1.5,6.0
Robbery,14/11/2017,21:15,12.927594,77.587401,2017-11-14 21:15:00,21,1,4.0,1.5,6.0
Robbery,16/11/2017,10:00,12.924444,77.58544,2017-11-16 10:00:00,10,0,4.0,1.0,4.0
Robbery,17/11/2017,3:15,12.919213,77.589206,2017-11-17 03:15:00,3,1,4.0,1.5,6.0
Robbery,1/12/2017,20:45,12.917612,77.57555,2017-12-01 20:45:00,20,1,4.0,1.5,6.0
Robbery,20/02/2018,23:10,12.926114,77.584636,2018-02-20 23:10:00,23,1,4.0,1.5,6.0
Robbery,2/3/2018,19:50,12.91996,77.577755,2018-03-02 19:50:00,19,1,4.0,1.5,6.0
Robbery,6/4/2018,20:00,12.932965,77.583821,2018-04-06 20:00:00,20,1,4.0,1.5,6.0
Robbery,7/4/2018,0:10,12.922168,77.575662,2018-04-07 00:10:00,0,1,4.0,1.5,6.0
Robbery,14/04/2018,1:15,12.936028,77.581004,2018-04-14 01:15:00,1,1,4.0,1.5,6.0
Robbery,16/04/2018,9:30,12.91802,77.588333,2018-04-16 09:30:00,9,0,4.0,1.0,4.0
Robbery,23/04/2018,0:15,12.918903,77.579729,2018-04-23 00:15:00,0,1,4.0,1.5,6.0
Robbery,26/04/2018,22:30,12.926314,7.579646,2018-04-26 22:30:00,22,1,4.0,1.5,6.0
Robbery,8/6/2018,22:00,12.936564,77.579101,2018-06-08 22:00:00,22,1,4.0,1.5,6.0
Robbery,27/06/2018,0:30,12.919622,77.576159,2018-06-27 00:30:00,0,1,4.0,1.5,6.0
Robbery,3/8/2018,12:00,12.922461,77.589067,2018-08-03 12:00:00,12,0,4.0,1.0,4.0
Robbery,19/08/2018,14:15,12.919946,77.580174,2018-08-19 14:15:00,14,0,4.0,1.0,4.0
Robbery,24/10/2018,2:00,12.91795,77.588783,2018-10-24 02:00:00,2,1,4.0,1.5,6.0
Robbery,11/11/2018,16:30,12.917777,77.58849,2018-11-11 16:30:00,16,0,4.0,1.0,4.0
Robbery,6/12/2018,14:00,12.91691,77.5857,2018-12-06 14:00:00,14,0,4.0,1.0,4.0
Robbery,7/12/2018,20:10,12.94391,77.5656,2018-12-07 20:10:00,20,1,4.0,1.5,6.0
Robbery,9/1/2019,11:45,12.91925,77.57409,2019-01-09 11:45:00,11,0,4.0,1.0,4.0
Robbery,10/1/2019,13:45,12.920789,77.584152,2019-01-10 13:45:00,13,0,4.0,1.0,4.0
Robbery,22/02/2019,14:15,12.9218,77.58027,2019-02-22 14:15:00,14,0,4.0,1.0,4.0
Robbery,10/6/2019,12:30,12.89658,77.58865,2019-06-10 12:30:00,12,0,4.0,1.0,4.0
Robbery,15/06/2019,12:10,12.937897,77.589756,2019-06-15 12:10:00,12,0,4.0,1.0,4.0
Robbery,22/06/2019,20:45,12.935478,77.586977,2019-06-22 20:45:00,20,1,4.0,1.5,6.0
Robbery,24/06/2019,20:45,12.913208,77.646289,2019-06-24 20:45:00,20,1,4.0,1.5,6.0
Robbery,10/8/2019,22:30,12.91984,77.57982,2019-08-10 22:30:00,22,1,4.0,1.5,6.0
Robbery,9/9/2019,14:45,12.88411,77.49496,2019-09-09 14:45:00,14,0,4.0,1.0,4.0
Robbery,4/10/2019,14:00,13.12876,80.23122,2019-10-04 14:00:00,14,0,4.0,1.0,4.0
Robbery,10/10/2019,0:45,12.93131,77.55262,2019-10-10 00:45:00,0,1,4.0,1.5,6.0
Robbery,30/12/2019,13:00,12.28657,76.63203,2019-12-30 13:00:00,13,0,4.0,1.0,4.0
Robbery,20/03/2015,22:30,12.9164781,77.5877546,2015-03-20 22:30:00,22,1,4.0,1.5,6.0
Robbery,22/06/2015,15:20,12.9113469,77.5934304,2015-06-22 15:20:00,15,0,4.0,1.0,4.0
Robbery,6/7/2015,16:20,12.8136962,77.587486,2015-07-06 16:20:00,16,0,4.0,1.0,4.0
Robbery,7/7/2015,9:10,12.9155917,77.5770282,2015-07-07 09:10:00,9,0,4.0,1.0,4.0
Robbery,10/7/2015,16:30,12.8893536,77.5463813,2015-07-10 16:30:00,16,0,4.0,1.0,4.0
Robbery,11/8/2015,2:30,12.911969,77.5861441,2015-08-11 02:30:00,2,1,4.0,1.5,6.0
Robbery,14/08/2015,20:00,12.9163635,77.5902451,2015-08-14 20:00:00,20,1,4.0,1.5,6.0
Robbery,29/09/2015,16:00,12.9081752,77.5982283,2015-09-29 16:00:00,16,0,4.0,1.0,4.0
Robbery,2/1/2016,9:15,12.9048333,77.5789134,2016-01-02 09:15:00,9,0,4.0,1.0,4.0
Robbery,27/02/2016,11:30,12.9126892,77.5892209,2016-02-27 11:30:00,11,0,4.0,1.0,4.0
Robbery,31/03/2016,15:00,12.9016312,77.5710152,2016-03-31 15:00:00,15,0,4.0,1.0,4.0
Robbery,11/4/2016,2:15,12.9164782,77.5901863,2016-04-11 02:15:00,2,1,4.0,1.5,6.0
Robbery,2/5/2016,22:35,12.9165042,77.5836202,2016-05-02 22:35:00,22,1,4.0,1.5,6.0
Robbery,8/5/2016,3:30,12.9160929,77.5835311,2016-05-08 03:30:00,3,1,4.0,1.5,6.0
Robbery,2/6/2016,17:35,12.9064281,77.5923107,2016-06-02 17:35:00,17,0,4.0,1.0,4.0
Robbery,9/6/2016,19:30,12.9138583,77.5843258,2016-06-09 19:30:00,19,1,4.0,1.5,6.0
Robbery,23/06/2016,12:45,12.9164782,77.5901863,2016-06-23 12:45:00,12,0,4.0,1.0,4.0
Robbery,15/07/2016,19:30,12.9105691,77.5737605,2016-07-15 19:30:00,19,1,4.0,1.5,6.0
Robbery,18/07/2016,16:35,12.9152662,77.5844226,2016-07-18 16:35:00,16,0,4.0,1.0,4.0
Robbery,30/07/2016,6:15,12.9116237,77.5965099,2016-07-30 06:15:00,6,0,4.0,1.0,4.0
Robbery,24/08/2016,12:30,12.9116497,77.5899438,2016-08-24 12:30:00,12,0,4.0,1.0,4.0
Robbery,1/9/2016,12:30,12.9170307,77.5682909,2016-09-01 12:30:00,12,0,4.0,1.0,4.0
Robbery,10/9/2016,2:05,12.9117957,77.5826913,2016-09-10 02:05:00,2,1,4.0,1.5,6.0
Robbery,13/10/2016,14:30,12.9047516,77.5859256,2016-10-13 14:30:00,14,0,4.0,1.0,4.0
Robbery,18/10/2016,7:45,12.9080001,77.5989745,2016-10-18 07:45:00,7,0,4.0,1.0,4.0
Robbery,19/10/2016,21:00,12.9134896,77.5767334,2016-10-19 21:00:00,21,1,4.0,1.5,6.0
Robbery,19/10/2016,21:00,12.9087019,77.5877553,2016-10-19 21:00:00,21,1,4.0,1.5,6.0
Robbery,20/10/2016,3:10,12.9151204,77.5837865,2016-10-20 03:10:00,3,1,4.0,1.5,6.0
Robbery,22/12/2016,0:30,12.9166068,77.5773499,2016-12-22 00:30:00,0,1,4.0,1.5,6.0
Robbery,10/2/2017,11:40,12.9094322,77.5706543,2017-02-10 11:40:00,11,0,4.0,1.0,4.0
Robbery,28/03/2017,13:32,12.9168638,77.5832552,2017-03-28 13:32:00,13,0,4.0,1.0,4.0
Robbery,5/6/2017,13:00,12.906925,77.5842211,2017-06-05 13:00:00,13,0,4.0,1.0,4.0
Robbery,30/07/2017,17:00,12.9174342,77.5735833,2017-07-30 17:00:00,17,0,4.0,1.0,4.0
Robbery,4/9/2017,9:30,12.9174602,77.5670172,2017-09-04 09:30:00,9,0,4.0,1.0,4.0
Robbery,20/09/2017,14:00,12.9064191,77.5945086,2017-09-20 14:00:00,14,0,4.0,1.0,4.0
Robbery,2/10/2017,10:30,12.9142916,77.5909833,2017-10-02 10:30:00,10,0,4.0,1.0,4.0
Robbery,21/01/2018,9:00,12.9103454,77.5902119,2018-01-21 09:00:00,9,0,4.0,1.0,4.0
Chain Snatching,15/09/2017,20:30,12.94898752,77.56995676,2017-09-15 20:30:00,20,1,1.0,1.5,1.5
Chain Snatching,4/5/2018,22:00,12.9556,77.56883,2018-05-04 22:00:00,22,1,1.0,1.5,1.5
Chain Snatching,6/1/2015,15:30,12.9486433,77.57586657,2015-01-06 15:30:00,15,0,1.0,1.0,1.0
Chain Snatching,8/7/2016,10:30,12.96020902,77.57035056,2016-07-08 10:30:00,10,0,1.0,1.0,1.0
Chain Snatching,11/6/2017,9:15,12.9527423802776,77.5763878294634,2017-06-11 09:15:00,9,0,1.0,1.0,1.0
Chain Snatching,12/3/2019,17:30,12.9579316,77.56937036,2019-03-12 17:30:00,17,0,1.0,1.0,1.0
Chain Snatching,1/6/2015,15:30,12.564415,77.333533,2015-06-01 15:30:00,15,0,1.0,1.0,1.0
Chain Snatching,10/1/2015,12:30,12.93965,77.55687,2015-01-10 12:30:00,12,0,1.0,1.0,1.0
Chain Snatching,10/2/2015,20:45,12.94464,77.56029,2015-02-10 20:45:00,20,1,1.0,1.5,1.5
Chain Snatching,11/4/2015,11:30,12.94305,77.5541,2015-04-11 11:30:00,11,0,1.0,1.0,1.0
Chain Snatching,1/8/2016,21:30,12.942041,77.561018,2016-08-01 21:30:00,21,1,1.0,1.5,1.5
Chain Snatching,1/8/2017,15:00,12.943552,77.550541,2017-08-01 15:00:00,15,0,1.0,1.0,1.0
Chain Snatching,4/1/2017,11:00,12.935795,77.656466,2017-01-04 11:00:00,11,0,1.0,1.0,1.0
Chain Snatching,5/2/2017,15:30,12.929073,77.570739,2017-02-05 15:30:00,15,0,1.0,1.0,1.0
Chain Snatching,7/10/2017,23:00,12.942216,77.554679,2017-10-07 23:00:00,23,1,1.0,1.5,1.5
Chain Snatching,12/11/2017,22:30,12.944505,77.561971,2017-11-12 22:30:00,22,1,1.0,1.5,1.5
Chain Snatching,7/9/2018,6:30,12.94619,77.55094,2018-09-07 06:30:00,6,0,1.0,1.0,1.0
Chain Snatching,9/5/2018,19:40,12.94354,77.56295,2018-05-09 19:40:00,19,1,1.0,1.5,1.5
Chain Snatching,9/9/2018,22:00,12.942063,77.559585,2018-09-09 22:00:00,22,1,1.0,1.5,1.5
Chain Snatching,1/10/2019,21:45,12.94285,77.56216,2019-10-01 21:45:00,21,1,1.0,1.5,1.5
Chain Snatching,1/10/2019,23:30,12.94519,77.55699,2019-10-01 23:30:00,23,1,1.0,1.5,1.5
Chain Snatching,2/3/2019,20:15,12.935247,77.554545,2019-03-02 20:15:00,20,1,1.0,1.5,1.5
Chain Snatching,9/10/2019,16:00,12.94551,7756466,2019-10-09 16:00:00,16,0,1.0,1.0,1.0
Chain Snatching,12/3/2019,18:30,12.944193,77.556826,2019-03-12 18:30:00,18,0,1.0,1.0,1.0
Chain Snatching,12/9/2019,12:00,12.93912,77.55505,2019-09-12 12:00:00,12,0,1.0,1.0,1.0
Robbery,28/01/2018,17:10,12.9217529,77.5825697,2018-01-28 17:10:00,17,0,4.0,1.0,4.0
Robbery,29/01/2018,22:00,12.9116237,77.5965099,2018-01-29 22:00:00,22,1,4.0,1.5,6.0
Robbery,24/02/2018,9:30,12.9105119,77.5928196,2018-02-24 09:30:00,9,0,4.0,1.0,4.0
Robbery,7/3/2018,12:00,12.9074749,77.5904753,2018-03-07 12:00:00,12,0,4.0,1.0,4.0
Robbery,24/03/2018,16:00,12.9296592,77.5521606,2018-03-24 16:00:00,16,0,4.0,1.0,4.0
Robbery,11/5/2018,22:00,12.9094322,77.5706543,2018-05-11 22:00:00,22,1,4.0,1.5,6.0
Robbery,12/7/2018,21:10,12.9159395,77.5922482,2018-07-12 21:10:00,21,1,4.0,1.5,6.0
Robbery,29/07/2018,5:30,12.9106658,77.5759798,2018-07-29 05:30:00,5,1,4.0,1.5,6.0
Robbery,9/8/2018,16:00,12.9169723,77.5901235,2018-08-09 16:00:00,16,0,4.0,1.0,4.0
Robbery,1/2/2019,22:55,12.9075378,77.5842326,2019-02-01 22:55:00,22,1,4.0,1.5,6.0
Robbery,12/3/2019,16:30,12.9162687,77.5893259,2019-03-12 16:30:00,16,0,4.0,1.0,4.0
Robbery,6/4/2019,4:15,12.9142916,77.5909833,2019-04-06 04:15:00,4,1,4.0,1.5,6.0
Robbery,17/05/2019,15:30,12.9069002,77.592889,2019-05-17 15:30:00,15,0,4.0,1.0,4.0
Robbery,13/06/2019,19:00,12.9146676,77.5876323,2019-06-13 19:00:00,19,1,4.0,1.5,6.0
Robbery,14/11/2019,18:30,12.9166559,77.5836937,2019-11-14 18:30:00,18,0,4.0,1.0,4.0
Robbery,21/04/2015,23:45,"12°54'58.78""N","77°33'37.87""E",2015-04-21 23:45:00,23,1,4.0,1.5,6.0
Robbery,9/5/2015,17:45,"12°55'48.81""N","77°33'54.98""E",2015-05-09 17:45:00,17,0,4.0,1.0,4.0
Robbery,13/09/2015,19:30,"12°55'32.44""N","77°33'51.19""E",2015-09-13 19:30:00,19,1,4.0,1.5,6.0
Robbery,1/4/2016,20:15,"12°55'29.32""N","77°34'34.18""E",2016-04-01 20:15:00,20,1,4.0,1.5,6.0
Robbery,31/07/2016,22:30,"12°55'4.54""N","77°34'24.60""E",2016-07-31 22:30:00,22,1,4.0,1.5,6.0
Robbery,27/09/2016,13:00,"12°55'18.71""N","77°34'11.31""E",2016-09-27 13:00:00,13,0,4.0,1.0,4.0
Robbery,17/10/2016,2:00,"12°55'34.59""N","77°33'44.40""E",2016-10-17 02:00:00,2,1,4.0,1.5,6.0
Robbery,24/12/2016,19:00,"12°55'6.47""N","77°33'23.65""E",2016-12-24 19:00:00,19,1,4.0,1.5,6.0
Robbery,27/12/2016,17:00,"12°55'34.84""N","77°33'39.82""E",2016-12-27 17:00:00,17,0,4.0,1.0,4.0
Robbery,18/09/2017,11:30,"38°57'33.85""N","95°15'55.75""",2017-09-18 11:30:00,11,0,4.0,1.0,4.0
Robbery,17/10/2017,7:10,"12°55'12.73""N","77°33'38.41""E",2017-10-17 07:10:00,7,0,4.0,1.0,4.0
Robbery,12/4/2018,13:40,"12°55'6.93""N","77°34'24.80""E",2018-04-12 13:40:00,13,0,4.0,1.0,4.0
Robbery,27/06/2018,12:00,12.967071,77.670484,2018-06-27 12:00:00,12,0,4.0,1.0,4.0
Robbery,9/10/2016,20:00,13.02075,75.592430.,2016-10-09 20:00:00,20,1,4.0,1.5,6.0
Robbery,25/10/2018,11:30,12.94355,77.60976,2018-10-25 11:30:00,11,0,4.0,1.0,4.0
Robbery,6/6/2019,12:30,12.91166,77.5572,2019-06-06 12:30:00,12,0,4.0,1.0,4.0
Robbery,12/9/2019,20:45,12.92013,77.56925,2019-09-12 20:45:00,20,1,4.0,1.5,6.0
Robbery,9/10/2015,0:35,12.94046,77.597527,2015-10-09 00:35:00,0,1,4.0,1.5,6.0
Robbery,17/07/2016,13:00,12.943567,77.580167,2016-07-17 13:00:00,13,0,4.0,1.0,4.0
Robbery,15/09/2016,10:00,12.939297,77.585205,2016-09-15 10:00:00,10,0,4.0,1.0,4.0
Robbery,28/09/2016,9:00,12.937969,77.580158,2016-09-28 09:00:00,9,0,4.0,1.0,4.0
Robbery,9/1/2017,5:30,12.943814,77.59715,2017-01-09 05:30:00,5,1,4.0,1.5,6.0
Robbery,1/2/2017,20:15,12.947515,77.593908,2017-02-01 20:15:00,20,1,4.0,1.5,6.0
Robbery,23/02/2017,1:00,12.942503,77.580992,2017-02-23 01:00:00,1,1,4.0,1.5,6.0
Robbery,27/05/2017,14:45,12.947859,77.592105,2017-05-27 14:45:00,14,0,4.0,1.0,4.0
Robbery,28/08/2017,11:00,12.947859,77.592105,2017-08-28 11:00:00,11,0,4.0,1.0,4.0
Robbery,6/1/2018,20:00,12.943814,77.59715,2018-01-06 20:00:00,20,1,4.0,1.5,6.0
Robbery,9/1/2018,21:00,12.938436,77.583998,2018-01-09 21:00:00,21,1,4.0,1.5,6.0
Robbery,17/01/2018,20:00,12.942646,77.581997,2018-01-17 20:00:00,20,1,4.0,1.5,6.0
Robbery,27/01/2018,16:00,12.951453,77.590628,2018-01-27 16:00:00,16,0,4.0,1.0,4.0
Robbery,20/03/2018,11:00,12.943639,77.58514,2018-03-20 11:00:00,11,0,4.0,1.0,4.0
Robbery,22/03/2018,16:00,12.936762,77.585131,2018-03-22 16:00:00,16,0,4.0,1.0,4.0
Robbery,28/03/2018,23:00,12.937108,77.601273,2018-03-28 23:00:00,23,1,4.0,1.5,6.0
Robbery,28/03/2018,11:00,12.938445,77.58516,2018-03-28 11:00:00,11,0,4.0,1.0,4.0
Robbery,28/03/2018,21:00,12.936003,77.58669,2018-03-28 21:00:00,21,1,4.0,1.5,6.0
Robbery,27/04/2018,21:00,12.941563,77.582748,2018-04-27 21:00:00,21,1,4.0,1.5,6.0
Robbery,4/7/2018,22:00,12.939297,77.585205,2018-07-04 22:00:00,22,1,4.0,1.5,6.0
Robbery,8/2/2019,9:00,12.936003,77.58669,2019-02-08 09:00:00,9,0,4.0,1.0,4.0
Robbery,22/02/2019,12:10,12.942646,77.581997,2019-02-22 12:10:00,12,0,4.0,1.0,4.0
Robbery,13/03/2019,12:30,12.936049,77.592597,2019-03-13 12:30:00,12,0,4.0,1.0,4.0
Robbery,25/03/2019,20:35,12.945058,77.591578,2019-03-25 20:35:00,20,1,4.0,1.5,6.0
Robbery,7/4/2019,12:00,12.94576,77.587228,2019-04-07 12:00:00,12,0,4.0,1.0,4.0
Robbery,18/05/2019,11:00,12.947913,77.580038,2019-05-18 11:00:00,11,0,4.0,1.0,4.0
Robbery,27/06/2019,1:00,12.937956,77.598712,2019-06-27 01:00:00,1,1,4.0,1.5,6.0
Robbery,10/7/2019,15:00,12.943814,77.59715,2019-07-10 15:00:00,15,0,4.0,1.0,4.0
Robbery,18/12/2019,16:30,12.942884,77.585104,2019-12-18 16:30:00,16,0,4.0,1.0,4.0
Robbery,10/2/2015,22:00,12.859828,77.56893,2015-02-10 22:00:00,22,1,4.0,1.5,6.0
Robbery,10/2/2015,22:30,12.859653,77.569358,2015-02-10 22:30:00,22,1,4.0,1.5,6.0
Robbery,25/05/2015,3:00,12.873803,77.561605,2015-05-25 03:00:00,3,1,4.0,1.5,6.0
Robbery,6/6/2015,9:00,12.870523,77.569048,2015-06-06 09:00:00,9,0,4.0,1.0,4.0
Robbery,19/12/2015,23:00,12.857031,77.530484,2015-12-19 23:00:00,23,1,4.0,1.5,6.0
Robbery,23/12/2015,23:00,12.885917,77.545639,2015-12-23 23:00:00,23,1,4.0,1.5,6.0
Robbery,18/3/2016,21:00,12.875936,77.53409,2016-03-18 21:00:00,21,1,4.0,1.5,6.0
Robbery,20/03/2016,9:00,12.856699,77.562385,2016-03-20 09:00:00,9,0,4.0,1.0,4.0
Robbery,19/04/2016,21:00,12.887446,77.502459,2016-04-19 21:00:00,21,1,4.0,1.5,6.0
Robbery,19/10/2016,12:15,12.88599,77.502802,2016-10-19 12:15:00,12,0,4.0,1.0,4.0
Robbery,5/11/2016,12:30,12.878482,77.495114,2016-11-05 12:30:00,12,0,4.0,1.0,4.0
Robbery,11/11/2016,12:30,12.857638,77.527322,2016-11-11 12:30:00,12,0,4.0,1.0,4.0
Robbery,30/04/2017,23:30,12.865732,77.523058,2017-04-30 23:30:00,23,1,4.0,1.5,6.0
Robbery,14/06/2017,3:30,12.892692,77.536615,2017-06-14 03:30:00,3,1,4.0,1.5,6.0
Robbery,4/11/2017,9:45,12.745859,77.487815,2017-11-04 09:45:00,9,0,4.0,1.0,4.0
Robbery,12/7/2017,12:30,12.859938,77.56061,2017-07-12 12:30:00,12,0,4.0,1.0,4.0
Robbery,23/03/2018,9:00,12.874399,77.560296,2018-03-23 09:00:00,9,0,4.0,1.0,4.0
Robbery,9/4/2018,8:30,12.901526,77.513039,2018-04-09 08:30:00,8,0,4.0,1.0,4.0
Robbery,27/05/2018,1:00,12.876377,77.53243,2018-05-27 01:00:00,1,1,4.0,1.5,6.0
Robbery,27/05/2018,1:00,12.892718,77.52418,2018-05-27 01:00:00,1,1,4.0,1.5,6.0
Robbery,27/08/2018,4:20,12.858318,77.525526,2018-08-27 04:20:00,4,1,4.0,1.5,6.0
Robbery,1/6/2019,17:30,12.876729,77.553495,2019-06-01 17:30:00,17,0,4.0,1.0,4.0
Robbery,12/7/2019,21:25,12.85398,77.576174,2019-07-12 21:25:00,21,1,4.0,1.5,6.0
Robbery,29/11/2019,18:00,12.857882,77.527602,2019-11-29 18:00:00,18,0,4.0,1.0,4.0
Robbery,23/01/2017,15:00,12.889521,77.577839,2017-01-23 15:00:00,15,0,4.0,1.0,4.0
Robbery,24/02/2017,19:35,12.885756,77.579713,2017-02-24 19:35:00,19,1,4.0,1.5,6.0
Robbery,6/3/2017,5:15,12.888655,77.571018,2017-03-06 05:15:00,5,1,4.0,1.5,6.0
Robbery,8/3/2017,15:30,12.87848,77.569592,2017-03-08 15:30:00,15,0,4.0,1.0,4.0
Robbery,16/05/2017,7:14,12.882357,77.77573462,2017-05-16 07:14:00,7,0,4.0,1.0,4.0
Robbery,16/05/2017,17:14,12.891752,77.575516,2017-05-16 17:14:00,17,0,4.0,1.0,4.0
Robbery,31/05/2017,21:00,12.885163,77.570415,2017-05-31 21:00:00,21,1,4.0,1.5,6.0
Robbery,21/06/2017,22:15,12.875421,77.579941,2017-06-21 22:15:00,22,1,4.0,1.5,6.0
Robbery,10/9/2017,15:30,12.860251,77.580196,2017-09-10 15:30:00,15,0,4.0,1.0,4.0
Robbery,1/3/2018,3:30,12.850571,77.586299,2018-03-01 03:30:00,3,1,4.0,1.5,6.0
Robbery,10/4/2018,21:00,12.8619,77.58093,2018-04-10 21:00:00,21,1,4.0,1.5,6.0
Robbery,12/10/2018,19:00,12.866076,77.580691,2018-10-12 19:00:00,19,1,4.0,1.5,6.0
Robbery,20/10/2018,1:00,12.850571,77.586299,2018-10-20 01:00:00,1,1,4.0,1.5,6.0
Robbery,26/02/2019,17:30,12.882334,77.576126,2019-02-26 17:30:00,17,0,4.0,1.0,4.0
Robbery,20/05/2019,5:00,12.897698,77.585786,2019-05-20 05:00:00,5,1,4.0,1.5,6.0
Robbery,22/08/2019,16:30,12.882496,77.56783,2019-08-22 16:30:00,16,0,4.0,1.0,4.0
Robbery,20/12/2019,23:45,12.858499,77.592674,2019-12-20 23:45:00,23,1,4.0,1.5,6.0
Robbery,5/2/2015,23:15,12.9061712471247,77.5698458437946,2015-02-05 23:15:00,23,1,4.0,1.5,6.0
Robbery,11/2/2015,17:00,12.9028808337357,77.5721867734704,2015-02-11 17:00:00,17,0,4.0,1.0,4.0
Robbery,2/5/2015,15:00,12.8928133912158,77.5666300513369,2015-05-02 15:00:00,15,0,4.0,1.0,4.0
Robbery,12/5/2016,7:00,12.9135877680617,77.5722179865643,2016-05-12 07:00:00,7,0,4.0,1.0,4.0
Robbery,31/05/2016,20:10,12.9080860118657,77.5629920799456,2016-05-31 20:10:00,20,1,4.0,1.5,6.0
Robbery,28/07/2016,23:45,12.8903442323649,77.5642779498096,2016-07-28 23:45:00,23,1,4.0,1.5,6.0
Robbery,13/11/2016,11:45,12.9155719870194,77.5732155912695,2016-11-13 11:45:00,11,0,4.0,1.0,4.0
Robbery,1/12/2016,18:30,12.9155359324014,77.5616258170776,2016-12-01 18:30:00,18,0,4.0,1.0,4.0
Robbery,12/12/2016,14:30,12.8957622003642,77.5599416215927,2016-12-12 14:30:00,14,0,4.0,1.0,4.0
Robbery,5/1/2017,11:35,12.892719430893,77.5668159621641,2017-01-05 11:35:00,11,0,4.0,1.0,4.0
Robbery,6/3/2017,23:50,12.9118926466343,77.5668833550517,2017-03-06 23:50:00,23,1,4.0,1.5,6.0
Robbery,21/07/2017,21:00,12.9084421818488,77.5636739766668,2017-07-21 21:00:00,21,1,4.0,1.5,6.0
Robbery,29/08/2017,23:00,12.9136600912658,77.5652671305881,2017-08-29 23:00:00,23,1,4.0,1.5,6.0
Robbery,1/9/2017,18:00,12.9133048035839,77.5680350394204,2017-09-01 18:00:00,18,0,4.0,1.0,4.0
Robbery,11/2/2017,1:30,12.904336,77.559845,2017-02-11 01:30:00,1,1,4.0,1.5,6.0
Robbery,28/11/2017,21:00,12.915784,77.567908,2017-11-28 21:00:00,21,1,4.0,1.5,6.0
Robbery,1/1/2018,17:15,12.9143691111693,77.5733106370572,2018-01-01 17:15:00,17,0,4.0,1.0,4.0
Robbery,15/02/2018,13:00,12.9011494733062,77.5706465675149,2018-02-15 13:00:00,13,0,4.0,1.0,4.0
Robbery,27/07/2018,15:30,12.8987338627581,77.5582034663051,2018-07-27 15:30:00,15,0,4.0,1.0,4.0
Robbery,28/07/2018,13:00,12.9061712471247,77.5698458437946,2018-07-28 13:00:00,13,0,4.0,1.0,4.0
Robbery,6/10/2018,18:00,12.892719430893,77.5668159621641,2018-10-06 18:00:00,18,0,4.0,1.0,4.0
Robbery,16/11/2018,16:15,12.9028808337357,77.5721867734704,2018-11-16 16:15:00,16,0,4.0,1.0,4.0
Robbery,18/11/2018,9:30,12.9028808337357,77.5721867734704,2018-11-18 09:30:00,9,0,4.0,1.0,4.0
Robbery,4/12/2018,15:00,12.9155359324014,77.5616258170776,2018-12-04 15:00:00,15,0,4.0,1.0,4.0
Robbery,28/02/2019,14:30,12.897974662761,77.5627143420956,2019-02-28 14:30:00,14,0,4.0,1.0,4.0
Robbery,30/03/2019,11:50,12.9026072787272,77.5614887435773,2019-03-30 11:50:00,11,0,4.0,1.0,4.0
Robbery,6/6/2019,19:15,12.8928133912158,77.5666300513369,2019-06-06 19:15:00,19,1,4.0,1.5,6.0
Robbery,24/06/2019,23:00,12.8996965673904,77.5716115576741,2019-06-24 23:00:00,23,1,4.0,1.5,6.0
Robbery,10/7/2019,13:45,12.8957622003642,77.5599416215927,2019-07-10 13:45:00,13,0,4.0,1.0,4.0
Robbery,14/10/2015,12:30,12.930897,77.53865,2015-10-14 12:30:00,12,0,4.0,1.0,4.0
Robbery,26/11/2015,17:00,12.933404,77.543486,2015-11-26 17:00:00,17,0,4.0,1.0,4.0
Robbery,5/1/2016,20:30,12.939522,77.544467,2016-01-05 20:30:00,20,1,4.0,1.5,6.0
Robbery,2/6/2016,21:30,12.939585,77.441454,2016-06-02 21:30:00,21,1,4.0,1.5,6.0
Robbery,11/8/2016,9:30,12.938629,77.544029,2016-08-11 09:30:00,9,0,4.0,1.0,4.0
Robbery,1/4/2017,2:35,12.943601,77.544829,2017-04-01 02:35:00,2,1,4.0,1.5,6.0
Robbery,10/4/2017,18:10,12.935359,77.53956,2017-04-10 18:10:00,18,0,4.0,1.0,4.0
Robbery,12/9/2017,14:10,12.935359,77.53956,2017-09-12 14:10:00,14,0,4.0,1.0,4.0
Robbery,2/8/2018,21:30,12.93875477,77.526116,2018-08-02 21:30:00,21,1,4.0,1.5,6.0
Robbery,4/7/2018,9:00,12.940701,77.545438,2018-07-04 09:00:00,9,0,4.0,1.0,4.0
Robbery,28/06/2015,6:30,12.95501377,77.5702211,2015-06-28 06:30:00,6,0,4.0,1.0,4.0
Robbery,26/08/2016,5:30,12.95641368,77.57027585,2016-08-26 05:30:00,5,1,4.0,1.5,6.0
Robbery,22/02/2017,5:30,12.94898752,77.56995676,2017-02-22 05:30:00,5,1,4.0,1.5,6.0
Robbery,12/8/2017,13:00,12.95416,77.56679,2017-08-12 13:00:00,13,0,4.0,1.0,4.0
Robbery,13/01/2018,4:15,12.95533,77.56768,2018-01-13 04:15:00,4,1,4.0,1.5,6.0
Robbery,13/01/2018,5:00,12.95722,77.57187,2018-01-13 05:00:00,5,1,4.0,1.5,6.0
Robbery,14/05/2018,21:50,12.94946,77.5713,2018-05-14 21:50:00,21,1,4.0,1.5,6.0
Robbery,22/10/2018,7:10,12.94898752,77.56995676,2018-10-22 07:10:00,7,0,4.0,1.0,4.0
Robbery,18/05/2019,21:25,12.95135,77.56877,2019-05-18 21:25:00,21,1,4.0,1.5,6.0
Robbery,12/9/2019,16:00,12.57118,77.34096,2019-09-12 16:00:00,16,0,4.0,1.0,4.0
Robbery,10/1/2016,21:30,12.95072643,77.57692629,2016-01-10 21:30:00,21,1,4.0,1.5,6.0
Robbery,3/2/2016,14:20,12.95274238,77.57638783,2016-02-03 14:20:00,14,0,4.0,1.0,4.0
Robbery,6/8/2016,22:00,12.95154815,77.57555399,2016-08-06 22:00:00,22,1,4.0,1.5,6.0
Robbery,4/5/2017,20:30,12.9527423802776,77.5763878294634,2017-05-04 20:30:00,20,1,4.0,1.5,6.0
Robbery,11/9/2017,22:00,12.9525086362044,77.5762103671186,2017-09-11 22:00:00,22,1,4.0,1.5,6.0
Robbery,30/06/2018,11:30,12.9562784515092,77.5765665270044,2018-06-30 11:30:00,11,0,4.0,1.0,4.0
Robbery,10/7/2018,15:40,12.95515912,77.57389864,2018-07-10 15:40:00,15,0,4.0,1.0,4.0
Robbery,7/8/2018,20:15,12.9534180059278,77.5792773731584,2018-08-07 20:15:00,20,1,4.0,1.5,6.0
Robbery,5/7/2019,0:30,12.9551591176542,77.573938439161,2019-07-05 00:30:00,0,1,4.0,1.5,6.0
Robbery,9/7/2019,22:45,12.96350804,77.57371142,2019-07-09 22:45:00,22,1,4.0,1.5,6.0
Robbery,8/10/2015,13:30,12.94227,77.56256,2015-10-08 13:30:00,13,0,4.0,1.0,4.0
Robbery,2/10/2016,22:00,12.940936,77.556692,2016-10-02 22:00:00,22,1,4.0,1.5,6.0
Robbery,8/9/2016,20:15,12.94022,77.55353,2016-09-08 20:15:00,20,1,4.0,1.5,6.0
Robbery,1/8/2017,2:45,12.937009,77.557041,2017-08-01 02:45:00,2,1,4.0,1.5,6.0
Robbery,3/3/2017,1:15,12.940983,77.556662,2017-03-03 01:15:00,1,1,4.0,1.5,6.0
Robbery,4/8/2017,2:15,12.942452,77.556337,2017-08-04 02:15:00,2,1,4.0,1.5,6.0
Robbery,7/2/2019,16:00,12.9472,77.56554,2019-02-07 16:00:00,16,0,4.0,1.0,4.0
Robbery,16/12/2015,17:00,12.955074,77.562575,2015-12-16 17:00:00,17,0,4.0,1.0,4.0
Robbery,4/5/2016,16:15,12.94395418,77.57535514,2016-05-04 16:15:00,16,0,4.0,1.0,4.0
Robbery,23/11/2016,20:00,12.94949,77.56316,2016-11-23 20:00:00,20,1,4.0,1.5,6.0
Robbery,4/1/2017,5:30,12.94731,77.56425,2017-01-04 05:30:00,5,1,4.0,1.5,6.0
Robbery,27/05/2018,20:45,12.950097,77.556479,2018-05-27 20:45:00,20,1,4.0,1.5,6.0
Robbery,15/03/2019,18:30,12.95322,77.561991,2019-03-15 18:30:00,18,0,4.0,1.0,4.0
Robbery,8/10/2019,9:30,12.94808,77.56789,2019-10-08 09:30:00,9,0,4.0,1.0,4.0
Robbery,8/4/2019,3:00,12.923208,77.549238,2019-04-08 03:00:00,3,1,4.0,1.5,6.0
Chain Snatching,2/3/2015,15:40,12.92043,77.5819,2015-03-02 15:40:00,15,0,1.0,1.0,1.0
Chain Snatching,13/03/2015,17:30,12.921652,77.57928,2015-03-13 17:30:00,17,0,1.0,1.0,1.0
Chain Snatching,31/03/2015,20:15,12.920838,77.58481,2015-03-31 20:15:00,20,1,1.0,1.5,1.5
Chain Snatching,1/4/2015,19:45,12.918973,77.57598,2015-04-01 19:45:00,19,1,1.0,1.5,1.5
Chain Snatching,8/5/2015,11:30,12.932486,77.58962,2015-05-08 11:30:00,11,0,1.0,1.0,1.0
Chain Snatching,9/6/2015,20:15,12.971599,77.59456,2015-06-09 20:15:00,20,1,1.0,1.5,1.5
Chain Snatching,8/12/2015,20:20,12.92337,77.58371,2015-12-08 20:20:00,20,1,1.0,1.5,1.5
Chain Snatching,30/12/2015,7:40,12.91872,77.57955,2015-12-30 07:40:00,7,0,1.0,1.0,1.0
Chain Snatching,20/03/2016,8:00,12.918907,77.577896,2016-03-20 08:00:00,8,0,1.0,1.0,1.0
Chain Snatching,20/05/2016,22:00,12.91933,77.57601,2016-05-20 22:00:00,22,1,1.0,1.5,1.5
Chain Snatching,31/08/2016,20:00,12.930433,77.549761,2016-08-31 20:00:00,20,1,1.0,1.5,1.5
Chain Snatching,29/09/2016,20:45,12.94462,77.617742,2016-09-29 20:45:00,20,1,1.0,1.5,1.5
Chain Snatching,25/10/2016,7:30,12.92204,77.58221,2016-10-25 07:30:00,7,0,1.0,1.0,1.0
Chain Snatching,29/11/2016,10:00,12.932946,77.583869,2016-11-29 10:00:00,10,0,1.0,1.0,1.0
Chain Snatching,1/12/2016,7:30,12.932946,77.583869,2016-12-01 07:30:00,7,0,1.0,1.0,1.0
Chain Snatching,28/03/2017,20:00,12.923396,77.581194,2017-03-28 20:00:00,20,1,1.0,1.5,1.5
Chain Snatching,27/07/2017,10:40,12.921999,77.587034,2017-07-27 10:40:00,10,0,1.0,1.0,1.0
Chain Snatching,18/09/2017,9:45,12.93398,77.57991,2017-09-18 09:45:00,9,0,1.0,1.0,1.0
Chain Snatching,21/09/2017,14:00,12.918899,77.577344,2017-09-21 14:00:00,14,0,1.0,1.0,1.0
Chain Snatching,1/10/2017,8:45,12.923412,77.564778,2017-10-01 08:45:00,8,0,1.0,1.0,1.0
Chain Snatching,30/10/2017,7:30,12.920834,77.584314,2017-10-30 07:30:00,7,0,1.0,1.0,1.0
Chain Snatching,7/12/2017,23:00,12.935706,77.582025,2017-12-07 23:00:00,23,1,1.0,1.5,1.5
Chain Snatching,25/12/2017,16:15,12.870884,77.655244,2017-12-25 16:15:00,16,0,1.0,1.0,1.0
Chain Snatching,24/02/2018,20:45,12.918859,77.579763,2018-02-24 20:45:00,20,1,1.0,1.5,1.5
Chain Snatching,18/06/2018,22:30,12.919916,77.581878,2018-06-18 22:30:00,22,1,1.0,1.5,1.5
Chain Snatching,19/06/2018,17:00,12.92617,77.587036,2018-06-19 17:00:00,17,0,1.0,1.0,1.0
Chain Snatching,10/7/2018,10:00,12.922168,77.575662,2018-07-10 10:00:00,10,0,1.0,1.0,1.0
Chain Snatching,12/7/2018,21:15,12.92594,77.583042,2018-07-12 21:15:00,21,1,1.0,1.5,1.5
Chain Snatching,20/10/2018,19:30,12.91714,77.58078,2018-10-20 19:30:00,19,1,1.0,1.5,1.5
Chain Snatching,8/3/2019,7:30,12.92585,77.5872,2019-03-08 07:30:00,7,0,1.0,1.0,1.0
Chain Snatching,26/03/2019,14:00,12.92246,77.59624,2019-03-26 14:00:00,14,0,1.0,1.0,1.0
Chain Snatching,16/04/2019,11:00,12.28784,76.633133,2019-04-16 11:00:00,11,0,1.0,1.0,1.0
Chain Snatching,24/04/2019,19:00,12.28784,76.633133,2019-04-24 19:00:00,19,1,1.0,1.5,1.5
Chain Snatching,17/05/2019,18:30,12.94158,77.584159,2019-05-17 18:30:00,18,0,1.0,1.0,1.0
Chain Snatching,2/7/2019,15:30,13.11539,77.565361,2019-07-02 15:30:00,15,0,1.0,1.0,1.0
Chain Snatching,2/5/2015,23:00,12.9097051,77.5811038,2015-05-02 23:00:00,23,1,1.0,1.5,1.5
Chain Snatching,18/05/2015,14:50,12.9147063,77.5880828,2015-05-18 14:50:00,14,0,1.0,1.0,1.0
Chain Snatching,27/05/2015,14:00,12.9045684,77.5909483,2015-05-27 14:00:00,14,0,1.0,1.0,1.0
Chain Snatching,2/6/2015,14:10,12.9122625,77.578695,2015-06-02 14:10:00,14,0,1.0,1.0,1.0
Chain Snatching,12/6/2015,15:00,12.9075172,77.5850448,2015-06-12 15:00:00,15,0,1.0,1.0,1.0
Chain Snatching,27/08/2015,18:15,12.8931843,77.582965,2015-08-27 18:15:00,18,0,1.0,1.0,1.0
Chain Snatching,28/08/2015,12:30,12.7413241,77.2429893,2015-08-28 12:30:00,12,0,1.0,1.0,1.0
Chain Snatching,9/9/2015,20:20,12.9030608,77.5867775,2015-09-09 20:20:00,20,1,1.0,1.5,1.5
Chain Snatching,30/09/2015,7:30,12.9168548,77.5954424,2015-09-30 07:30:00,7,0,1.0,1.0,1.0
Chain Snatching,30/09/2015,12:30,12.9119355,77.5866992,2015-09-30 12:30:00,12,0,1.0,1.0,1.0
Chain Snatching,30/10/2015,16:30,12.9045277,77.5896538,2015-10-30 16:30:00,16,0,1.0,1.0,1.0
Chain Snatching,2/1/2016,7:30,12.9082084,77.5712403,2016-01-02 07:30:00,7,0,1.0,1.0,1.0
Chain Snatching,14/05/2016,21:30,12.8961435,77.5974439,2016-05-14 21:30:00,21,1,1.0,1.5,1.5
Chain Snatching,20/06/2016,21:35,12.9088745,77.5929109,2016-06-20 21:35:00,21,1,1.0,1.5,1.5
Chain Snatching,18/08/2016,21:35,12.9192124,77.585885,2016-08-18 21:35:00,21,1,1.0,1.5,1.5
Chain Snatching,27/09/2016,17:30,12.9081165,77.5808039,2016-09-27 17:30:00,17,0,1.0,1.0,1.0
Chain Snatching,26/11/2016,15:30,12.9217529,77.5825697,2016-11-26 15:30:00,15,0,1.0,1.0,1.0
Chain Snatching,3/2/2017,22:15,12.9133944,77.5859906,2017-02-03 22:15:00,22,1,1.0,1.5,1.5
Chain Snatching,26/02/2017,20:45,12.9173404,77.5683769,2017-02-26 20:45:00,20,1,1.0,1.5,1.5
Chain Snatching,6/3/2017,21:00,12.9360128,77.6282734,2017-03-06 21:00:00,21,1,1.0,1.5,1.5
Chain Snatching,30/04/2017,18:05,12.9151844,77.5877742,2017-04-30 18:05:00,18,0,1.0,1.0,1.0
Chain Snatching,5/6/2017,8:45,12.8940952,77.581622,2017-06-05 08:45:00,8,0,1.0,1.0,1.0
Chain Snatching,22/06/2017,8:00,12.9101358,77.5832282,2017-06-22 08:00:00,8,0,1.0,1.0,1.0
Chain Snatching,15/07/2017,15:30,12.9102224,77.5503972,2017-07-15 15:30:00,15,0,1.0,1.0,1.0
Chain Snatching,20/08/2017,14:30,12.908417,77.592364,2017-08-20 14:30:00,14,0,1.0,1.0,1.0
Chain Snatching,15/09/2017,8:40,12.9089146,77.5786233,2017-09-15 08:40:00,8,0,1.0,1.0,1.0
Chain Snatching,31/10/2017,8:00,12.9127003,77.5876934,2017-10-31 08:00:00,8,0,1.0,1.0,1.0
Chain Snatching,31/10/2017,8:30,12.9134518,77.5883934,2017-10-31 08:30:00,8,0,1.0,1.0,1.0
Chain Snatching,25/11/2017,14:10,12.9217529,77.5825697,2017-11-25 14:10:00,14,0,1.0,1.0,1.0
Chain Snatching,10/12/2017,8:45,12.9070414,77.5897256,2017-12-10 08:45:00,8,0,1.0,1.0,1.0
Chain Snatching,23/02/2018,7:15,12.9078012,77.5915234,2018-02-23 07:15:00,7,0,1.0,1.0,1.0
Chain Snatching,19/03/2018,7:00,12.9146922,77.5944367,2018-03-19 07:00:00,7,0,1.0,1.0,1.0
Chain Snatching,24/04/2018,7:50,12.9158154,77.5930411,2018-04-24 07:50:00,7,0,1.0,1.0,1.0
Chain Snatching,26/08/2018,10:30,12.9093911,77.5883412,2018-08-26 10:30:00,10,0,1.0,1.0,1.0
Chain Snatching,31/08/2018,20:00,12.9080505,77.5867443,2018-08-31 20:00:00,20,1,1.0,1.5,1.5
Chain Snatching,10/12/2018,20:00,12.9160925,77.5882166,2018-12-10 20:00:00,20,1,1.0,1.5,1.5
Chain Snatching,22/02/2019,14:25,12.9075608,77.5952252,2019-02-22 14:25:00,14,0,1.0,1.0,1.0
Chain Snatching,9/4/2015,18:00,12.936003,77.58669,2015-04-09 18:00:00,18,0,1.0,1.0,1.0
Chain Snatching,4/6/2015,7:15,12.93314,77.592321,2015-06-04 07:15:00,7,0,1.0,1.0,1.0
Chain Snatching,21/07/2015,19:45,12.943346,77.585274,2015-07-21 19:45:00,19,1,1.0,1.5,1.5
Chain Snatching,4/11/2015,4:30,12.943346,77.585274,2015-11-04 04:30:00,4,1,1.0,1.5,1.5
Chain Snatching,25/10/2016,8:45,12.933437,77.591016,2016-10-25 08:45:00,8,0,1.0,1.0,1.0
Chain Snatching,2/11/2016,14:00,12.942483,77.581006,2016-11-02 14:00:00,14,0,1.0,1.0,1.0
Chain Snatching,2/11/2016,15:15,12.938548,77.585899,2016-11-02 15:15:00,15,0,1.0,1.0,1.0
Chain Snatching,12/11/2016,20:00,12.941202,77.586684,2016-11-12 20:00:00,20,1,1.0,1.5,1.5
Chain Snatching,16/11/2016,16:45,12.941528,77.585997,2016-11-16 16:45:00,16,0,1.0,1.0,1.0
Chain Snatching,23/06/2017,12:30,12.936003,77.58669,2017-06-23 12:30:00,12,0,1.0,1.0,1.0
Chain Snatching,3/11/2017,20:30,12.940991,77.584108,2017-11-03 20:30:00,20,1,1.0,1.5,1.5
Chain Snatching,10/5/2018,13:30,12.943683,77.584406,2018-05-10 13:30:00,13,0,1.0,1.0,1.0
Chain Snatching,14/06/2018,20:30,12.942375,77.58673,2018-06-14 20:30:00,20,1,1.0,1.5,1.5
Chain Snatching,19/06/2018,7:30,12.943814,77.59715,2018-06-19 07:30:00,7,0,1.0,1.0,1.0
Chain Snatching,25/06/2018,20:30,12.939261,77.585214,2018-06-25 20:30:00,20,1,1.0,1.5,1.5
Chain Snatching,2/7/2018,20:50,12.938365,77.582962,2018-07-02 20:50:00,20,1,1.0,1.5,1.5
Chain Snatching,5/9/2018,9:00,12.935534,77.587228,2018-09-05 09:00:00,9,0,1.0,1.0,1.0
Chain Snatching,11/4/2019,12:30,12.948109,77.581263,2019-04-11 12:30:00,12,0,1.0,1.0,1.0
Chain Snatching,21/05/2019,19:15,12.942375,77.58673,2019-05-21 19:15:00,19,1,1.0,1.5,1.5
Chain Snatching,22/05/2019,8:00,12.948222,77.580132,2019-05-22 08:00:00,8,0,1.0,1.0,1.0
Chain Snatching,1/11/2019,17:35,12.937003,77.601464,2019-11-01 17:35:00,17,0,1.0,1.0,1.0
Chain Snatching,3/11/2019,8:45,12.941563,77.582748,2019-11-03 08:45:00,8,0,1.0,1.0,1.0
Chain Snatching,25/12/2019,12:00,12.948109,77.581263,2019-12-25 12:00:00,12,0,1.0,1.0,1.0
Chain Snatching,31/10/2015,17:00,12.877998,77.550186,2015-10-31 17:00:00,17,0,1.0,1.0,1.0
Chain Snatching,14/05/2016,21:55,12.897553,77.539272,2016-05-14 21:55:00,21,1,1.0,1.5,1.5
Chain Snatching,1/8/2016,15:00,12.898151,77.538374,2016-08-01 15:00:00,15,0,1.0,1.0,1.0
Chain Snatching,10/10/2018,21:30,12.866923,77.564722,2018-10-10 21:30:00,21,1,1.0,1.5,1.5
Chain Snatching,1/11/2018,7:30,12.86607,77.541929,2018-11-01 07:30:00,7,0,1.0,1.0,1.0
Chain Snatching,7/3/2019,10:30,12.851503,77.552592,2019-03-07 10:30:00,10,0,1.0,1.0,1.0
Chain Snatching,11/4/2019,8:00,12.873184,77.535641,2019-04-11 08:00:00,8,0,1.0,1.0,1.0
Chain Snatching,12/7/2019,8:00,12.892912,77.527128,2019-07-12 08:00:00,8,0,1.0,1.0,1.0
Chain Snatching,23/1/2017,15:10,12.888051,77.5805,2017-01-23 15:10:00,15,0,1.0,1.0,1.0
Chain Snatching,24/02/2017,19:35,12.886996,77.5797,2017-02-24 19:35:00,19,1,1.0,1.5,1.5
Chain Snatching,16/05/2017,14:00,12.882084,77.5744,2017-05-16 14:00:00,14,0,1.0,1.0,1.0
Chain Snatching,16/05/2017,14:30,12.886347,77.566189,2017-05-16 14:30:00,14,0,1.0,1.0,1.0
Chain Snatching,21/06/2017,22:15,12.868679,77.5794,2017-06-21 22:15:00,22,1,1.0,1.5,1.5
Chain Snatching,11/4/2018,11:00,12.881587,77.5762,2018-04-11 11:00:00,11,0,1.0,1.0,1.0
Chain Snatching,13/04/2018,18:45,12.891846,77.5766,2018-04-13 18:45:00,18,0,1.0,1.0,1.0
Chain Snatching,26/05/2018,20:00,12.862015,77.58549,2018-05-26 20:00:00,20,1,1.0,1.5,1.5
Chain Snatching,6/6/2018,21:30,12.88169,77.5791,2018-06-06 21:30:00,21,1,1.0,1.5,1.5
Chain Snatching,13/06/2018,18:30,12.892977,77.57807,2018-06-13 18:30:00,18,0,1.0,1.0,1.0
Chain Snatching,24/06/2018,15:10,12.868153,77.57441,2018-06-24 15:10:00,15,0,1.0,1.0,1.0
Chain Snatching,8/7/2018,9:00,12.881898,77.57622,2018-07-08 09:00:00,9,0,1.0,1.0,1.0
Chain Snatching,19/07/2018,18:00,12.871359,77.57279,2018-07-19 18:00:00,18,0,1.0,1.0,1.0
Chain Snatching,16/01/2015,17:15,12.8937594596734,77.5615194330341,2015-01-16 17:15:00,17,0,1.0,1.0,1.0
Chain Snatching,1/2/2015,21:20,12.8974156120756,77.5551514198462,2015-02-01 21:20:00,21,1,1.0,1.5,1.5
Chain Snatching,11/6/2015,17:45,12.8965230402704,77.5582735553316,2015-06-11 17:45:00,17,0,1.0,1.0,1.0
Chain Snatching,24/08/2015,19:00,12.9109359450741,77.5646696875901,2015-08-24 19:00:00,19,1,1.0,1.5,1.5
Chain Snatching,16/02/2016,16:15,12.9042104353826,77.5686183140161,2016-02-16 16:15:00,16,0,1.0,1.0,1.0
Chain Snatching,11/5/2016,22:15,12.8974156120756,77.5551514198462,2016-05-11 22:15:00,22,1,1.0,1.5,1.5
Chain Snatching,8/12/2016,16:00,12.8974156120756,77.5551514198462,2016-12-08 16:00:00,16,0,1.0,1.0,1.0
Chain Snatching,16/12/2016,17:30,12.8957622003642,77.5599416215927,2016-12-16 17:30:00,17,0,1.0,1.0,1.0
Chain Snatching,5/9/2017,15:00,12.9080332769306,77.5632487037232,2017-09-05 15:00:00,15,0,1.0,1.0,1.0
Chain Snatching,29/09/2017,23:00,12.9080332769306,77.5632487037232,2017-09-29 23:00:00,23,1,1.0,1.5,1.5
Chain Snatching,1/10/2017,18:00,12.8964474718431,77.5667368067783,2017-10-01 18:00:00,18,0,1.0,1.0,1.0
Chain Snatching,10/1/2017,7:15,12.904336,77.559845,2017-01-10 07:15:00,7,0,1.0,1.0,1.0
Chain Snatching,10/4/2017,20:00,12.907846,77.558291,2017-04-10 20:00:00,20,1,1.0,1.5,1.5
Chain Snatching,10/7/2017,12:30,12.904811,77.552829,2017-07-10 12:30:00,12,0,1.0,1.0,1.0
Chain Snatching,9/1/2018,15:00,12.8987338627581,77.5582034663051,2018-01-09 15:00:00,15,0,1.0,1.0,1.0
Chain Snatching,21/07/2018,18:00,12.8974156120756,77.5551514198462,2018-07-21 18:00:00,18,0,1.0,1.0,1.0
Chain Snatching,26/07/2018,23:00,12.9050607614656,77.5611611061094,2018-07-26 23:00:00,23,1,1.0,1.5,1.5
Chain Snatching,9/9/2018,16:00,12.8979064683143,77.5594980995282,2018-09-09 16:00:00,16,0,1.0,1.0,1.0
Chain Snatching,16/02/2019,16:00,12.9099852303812,77.562617357785,2019-02-16 16:00:00,16,0,1.0,1.0,1.0
Chain Snatching,11/6/2015,9:30,12.555468,77.325223,2015-06-11 09:30:00,9,0,1.0,1.0,1.0
Chain Snatching,8/7/2015,12:30,12.93586,77.5523,2015-07-08 12:30:00,12,0,1.0,1.0,1.0
Chain Snatching,8/9/2015,14:15,12.941471,77.543027,2015-09-08 14:15:00,14,0,1.0,1.0,1.0
Chain Snatching,1/10/2015,13:30,12.939979,77.558802,2015-10-01 13:30:00,13,0,1.0,1.0,1.0
Chain Snatching,10/4/2017,19:10,12.93586,77.5523,2017-04-10 19:10:00,19,1,1.0,1.5,1.5
Chain Snatching,3/5/2017,17:15,12.939397,77.541785,2017-05-03 17:15:00,17,0,1.0,1.0,1.0
Chain Snatching,2/8/2017,18:35,12.940679,77.559242,2017-08-02 18:35:00,18,0,1.0,1.0,1.0
Chain Snatching,21/08/2017,17:30,12.938936,77.543658,2017-08-21 17:30:00,17,0,1.0,1.0,1.0
Chain Snatching,3/9/2017,21:30,12.941142,77.545571,2017-09-03 21:30:00,21,1,1.0,1.5,1.5
Chain Snatching,30/09/2017,14:10,12.938936,77.543658,2017-09-30 14:10:00,14,0,1.0,1.0,1.0
Chain Snatching,1/10/2017,7:20,12.936114,77.545066,2017-10-01 07:20:00,7,0,1.0,1.0,1.0
Chain Snatching,3/11/2018,20:30,12.930845,77.539064,2018-11-03 20:30:00,20,1,1.0,1.5,1.5
Chain Snatching,4/11/2018,23:00,12.929961,77.538526,2018-11-04 23:00:00,23,1,1.0,1.5,1.5
Chain Snatching,6/3/2019,12:00,9.964648,76.298362,2019-03-06 12:00:00,12,0,1.0,1.0,1.0
2 wheeler theft,26/02/2016,12:0,12.945182,77.597825,2016-02-26 12:00:00,12,0,1.0,1.0,1.0
Ordinary Theft,20/01/2015,13:15,12.9179451,77.5717196,2015-01-20 13:15:00,13,0,1.0,1.0,1.0
Ordinary Theft,21/01/2015,16:20,12.8978603,77.580407,2015-01-21 16:20:00,16,0,1.0,1.0,1.0
Ordinary Theft,26/01/2015,14:15,12.9094322,77.5706543,2015-01-26 14:15:00,14,0,1.0,1.0,1.0
Ordinary Theft,27/01/2015,18:15,12.9073481,77.5925392,2015-01-27 18:15:00,18,0,1.0,1.0,1.0
Ordinary Theft,25/02/2015,10:45,12.9003431,77.5899003,2015-02-25 10:45:00,10,0,1.0,1.0,1.0
Ordinary Theft,27/02/2015,16:30,12.9217529,77.5825697,2015-02-27 16:30:00,16,0,1.0,1.0,1.0
Ordinary Theft,16/03/2015,22:05,12.9097562,77.5770852,2015-03-16 22:05:00,22,1,1.0,1.5,1.5
Ordinary Theft,22/03/2015,11:50,12.9098583,77.5508203,2015-03-22 11:50:00,11,0,1.0,1.0,1.0
Ordinary Theft,23/03/2015,21:20,12.9164072,77.5833691,2015-03-23 21:20:00,21,1,1.0,1.5,1.5
Ordinary Theft,22/06/2015,18:05,12.8949474,77.5751356,2015-06-22 18:05:00,18,0,1.0,1.0,1.0
Ordinary Theft,22/06/2015,19:30,12.9160929,77.5835311,2015-06-22 19:30:00,19,1,1.0,1.5,1.5
Ordinary Theft,14/07/2015,15:30,12.9110158,77.5842037,2015-07-14 15:30:00,15,0,1.0,1.0,1.0
Ordinary Theft,15/07/2015,10:05,12.9110418,77.5776376,2015-07-15 10:05:00,10,0,1.0,1.0,1.0
Ordinary Theft,16/07/2015,21:55,12.9023591,77.5817811,2015-07-16 21:55:00,21,1,1.0,1.5,1.5
Ordinary Theft,21/07/2015,21:00,12.9023591,77.5817811,2015-07-21 21:00:00,21,1,1.0,1.5,1.5
Ordinary Theft,24/08/2015,14:30,12.9081128,77.5818518,2015-08-24 14:30:00,14,0,1.0,1.0,1.0
Ordinary Theft,27/08/2015,22:05,12.91152,77.5708782,2015-08-27 22:05:00,22,1,1.0,1.5,1.5
Ordinary Theft,15/09/2015,10:30,12.915769,77.5925054,2015-09-15 10:30:00,10,0,1.0,1.0,1.0
Ordinary Theft,15/09/2015,16:10,12.9087853,77.5799377,2015-09-15 16:10:00,16,0,1.0,1.0,1.0
Ordinary Theft,17/09/2015,11:30,12.9062115,77.5912842,2015-09-17 11:30:00,11,0,1.0,1.0,1.0
Ordinary Theft,17/09/2015,21:00,12.9151204,77.5837865,2015-09-17 21:00:00,21,1,1.0,1.5,1.5
Ordinary Theft,24/09/2015,18:15,12.9151669,77.5684655,2015-09-24 18:15:00,18,0,1.0,1.0,1.0
Ordinary Theft,24/09/2015,21:30,12.909258,77.5897063,2015-09-24 21:30:00,21,1,1.0,1.5,1.5
Ordinary Theft,13/10/2015,20:35,12.9118422,77.5673703,2015-10-13 20:35:00,20,1,1.0,1.5,1.5
Ordinary Theft,23/10/2015,22:20,12.9119247,77.5673703,2015-10-23 22:20:00,22,1,1.0,1.5,1.5
Ordinary Theft,24/10/2015,11:30,12.9016695,77.5859681,2015-10-24 11:30:00,11,0,1.0,1.0,1.0
Ordinary Theft,26/11/2015,11:00,12.8944224,77.574979,2015-11-26 11:00:00,11,0,1.0,1.0,1.0
Ordinary Theft,23/12/2015,11:05,12.9037982,77.5771592,2015-12-23 11:05:00,11,0,1.0,1.0,1.0
Ordinary Theft,14/01/2016,12:40,12.9077295,77.5782007,2016-01-14 12:40:00,12,0,1.0,1.0,1.0
Ordinary Theft,22/01/2016,14:15,12.9117957,77.5826913,2016-01-22 14:15:00,14,0,1.0,1.0,1.0
Ordinary Theft,22/01/2016,18:30,12.9156264,77.5962438,2016-01-22 18:30:00,18,0,1.0,1.0,1.0
Ordinary Theft,31/01/2016,22:10,12.9156524,77.5896777,2016-01-31 22:10:00,22,1,1.0,1.5,1.5
Ordinary Theft,16/02/2016,18:30,12.9084786,77.5798039,2016-02-16 18:30:00,18,0,1.0,1.0,1.0
Ordinary Theft,17/02/2016,12:05,12.9070951,77.5783314,2016-02-17 12:05:00,12,0,1.0,1.0,1.0
Ordinary Theft,28/03/2016,12:45,12.9024929,77.5877414,2016-03-28 12:45:00,12,0,1.0,1.0,1.0
Ordinary Theft,14/04/2016,12:10,12.914277,77.5877554,2016-04-14 12:10:00,12,0,1.0,1.0,1.0
Ordinary Theft,13/05/2016,15:30,12.9124841,77.5910353,2016-05-13 15:30:00,15,0,1.0,1.0,1.0
Ordinary Theft,25/05/2016,21:05,12.8880151,77.5748036,2016-05-25 21:05:00,21,1,1.0,1.5,1.5
Ordinary Theft,13/06/2016,18:15,12.8983605,77.573651,2016-06-13 18:15:00,18,0,1.0,1.0,1.0
Ordinary Theft,13/06/2016,20:10,12.9230649,77.5691731,2016-06-13 20:10:00,20,1,1.0,1.5,1.5
Ordinary Theft,20/06/2016,11:40,12.9054915,77.5781472,2016-06-20 11:40:00,11,0,1.0,1.0,1.0
Ordinary Theft,20/06/2016,12:00,12.9358084,77.5222107,2016-06-20 12:00:00,12,0,1.0,1.0,1.0
Ordinary Theft,20/06/2016,12:15,12.9055524,77.5772974,2016-06-20 12:15:00,12,0,1.0,1.0,1.0
Ordinary Theft,25/06/2016,9:00,12.9215017,77.5645742,2016-06-25 09:00:00,9,0,1.0,1.0,1.0
Ordinary Theft,19/07/2016,16:45,12.9110706,77.5737475,2016-07-19 16:45:00,16,0,1.0,1.0,1.0
Ordinary Theft,23/07/2016,12:35,12.9066249,77.5873944,2016-07-23 12:35:00,12,0,1.0,1.0,1.0
Ordinary Theft,23/07/2016,13:15,12.9034996,77.593697,2016-07-23 13:15:00,13,0,1.0,1.0,1.0
Ordinary Theft,27/07/2016,15:35,12.9011822,77.5712258,2016-07-27 15:35:00,15,0,1.0,1.0,1.0
Ordinary Theft,16/08/2016,16:00,12.9006982,77.5883553,2016-08-16 16:00:00,16,0,1.0,1.0,1.0
Ordinary Theft,22/08/2016,21:00,12.9084302,77.5854817,2016-08-22 21:00:00,21,1,1.0,1.5,1.5
Ordinary Theft,23/08/2016,10:30,12.9058661,77.5849725,2016-08-23 10:30:00,10,0,1.0,1.0,1.0
Ordinary Theft,24/08/2016,10:15,12.9057109,77.5879706,2016-08-24 10:15:00,10,0,1.0,1.0,1.0
Ordinary Theft,13/10/2016,13:45,12.908317,77.5904558,2016-10-13 13:45:00,13,0,1.0,1.0,1.0
Ordinary Theft,18/10/2016,18:20,12.8802211,77.5651294,2016-10-18 18:20:00,18,0,1.0,1.0,1.0
Ordinary Theft,27/12/2016,19:35,12.9057887,77.5929769,2016-12-27 19:35:00,19,1,1.0,1.5,1.5
Ordinary Theft,13/01/2017,18:20,12.9070982,77.5820122,2017-01-13 18:20:00,18,0,1.0,1.0,1.0
Ordinary Theft,28/01/2017,16:20,12.9135052,77.5744027,2017-01-28 16:20:00,16,0,1.0,1.0,1.0
Ordinary Theft,16/02/2017,14:00,12.9535277,77.5726056,2017-02-16 14:00:00,14,0,1.0,1.0,1.0
Ordinary Theft,21/07/2017,11:15,12.9083163,77.586334,2017-07-21 11:15:00,11,0,1.0,1.0,1.0
4 Wheeler Theft,05/01/2015,18:40,12.92043,77.5819,2015-01-05 18:40:00,18,0,1.0,1.0,1.0
4 Wheeler Theft,06/02/2015,13:00,12.915668,77.589964,2015-02-06 13:00:00,13,0,1.0,1.0,1.0
4 Wheeler Theft,04/09/2015,13:30,12.918081,77.587101,2015-09-04 13:30:00,13,0,1.0,1.0,1.0
4 Wheeler Theft,20/11/2015,17:30,12.92819,77.62512,2015-11-20 17:30:00,17,0,1.0,1.0,1.0
4 Wheeler Theft,08/12/2015,17:15,12.92334,77.58484,2015-12-08 17:15:00,17,0,1.0,1.0,1.0
4 Wheeler Theft,10/12/2015,18:45,12.92875,77.5801,2015-12-10 18:45:00,18,0,1.0,1.0,1.0
4 Wheeler Theft,05/07/2016,14:45,12.931037,77.585842,2016-07-05 14:45:00,14,0,1.0,1.0,1.0
4 Wheeler Theft,19/10/2016,13:00,12.922657,77.589563,2016-10-19 13:00:00,13,0,1.0,1.0,1.0
4 Wheeler Theft,21/10/2016,11:30,12.917125,77.578344,2016-10-21 11:30:00,11,0,1.0,1.0,1.0
4 Wheeler Theft,24/10/2016,17:00,12.922461,77.589557,2016-10-24 17:00:00,17,0,1.0,1.0,1.0
4 Wheeler Theft,25/10/2016,15:00,12.891917,77.589229,2016-10-25 15:00:00,15,0,1.0,1.0,1.0
4 Wheeler Theft,03/02/2017,11:30,12.93744,77.56426,2017-02-03 11:30:00,11,0,1.0,1.0,1.0
4 Wheeler Theft,27/03/2017,12:15,12.928459,77.576972,2017-03-27 12:15:00,12,0,1.0,1.0,1.0
4 Wheeler Theft,21/08/2017,12:45,12.919182,77.57765,2017-08-21 12:45:00,12,0,1.0,1.0,1.0
4 Wheeler Theft,14/04/2018,11:30,12.926192,77.586141,2018-04-14 11:30:00,11,0,1.0,1.0,1.0
4 Wheeler Theft,09/06/2018,16:30,12.91743,77.583465,2018-06-09 16:30:00,16,0,1.0,1.0,1.0
4 Wheeler Theft,29/06/2018,16:00,12.920162,77.587113,2018-06-29 16:00:00,16,0,1.0,1.0,1.0
4 Wheeler Theft,03/09/2018,18:00,12.92204,77.58221,2018-09-03 18:00:00,18,0,1.0,1.0,1.0
4 Wheeler Theft,14/11/2018,11:00,12.916744,77.597456,2018-11-14 11:00:00,11,0,1.0,1.0,1.0
4 Wheeler Theft,27/05/2019,11:00,12.9057223,77.53558126,2019-05-27 11:00:00,11,0,1.0,1.0,1.0
4 Wheeler Theft,8/1/2015,10:55,12.9013564,77.5897255,2015-01-08 10:55:00,10,0,1.0,1.0,1.0
4 Wheeler Theft,21/01/2015,11:20,12.8940057,77.5828137,2015-01-21 11:20:00,11,0,1.0,1.0,1.0
4 Wheeler Theft,5/3/2015,19:35,12.9045368,77.5843208,2015-03-05 19:35:00,19,1,1.0,1.5,1.5
4 Wheeler Theft,12/3/2015,18:30,12.9359949,77.5664314,2015-03-12 18:30:00,18,0,1.0,1.0,1.0
4 Wheeler Theft,17/03/2015,21:00,12.9082055,77.5817295,2015-03-17 21:00:00,21,1,1.0,1.5,1.5
4 Wheeler Theft,15/04/2015,22:10,12.8820672,77.5798883,2015-04-15 22:10:00,22,1,1.0,1.5,1.5
4 Wheeler Theft,17/04/2015,22:30,12.9009867,77.584761,2015-04-17 22:30:00,22,1,1.0,1.5,1.5
4 Wheeler Theft,11/6/2015,17:45,12.8093213,77.2940594,2015-06-11 17:45:00,17,0,1.0,1.0,1.0
4 Wheeler Theft,7/10/2015,8:40,12.8920076,77.5837341,2015-10-07 08:40:00,8,0,1.0,1.0,1.0
4 Wheeler Theft,19/10/2015,11:30,12.9059669,77.5793992,2015-10-19 11:30:00,11,0,1.0,1.0,1.0
4 Wheeler Theft,3/12/2015,11:00,12.9059929,77.5728331,2015-12-03 11:00:00,11,0,1.0,1.0,1.0
4 Wheeler Theft,9/1/2016,20:05,12.9092966,77.5739359,2016-01-09 20:05:00,20,1,1.0,1.5,1.5
4 Wheeler Theft,5/3/2016,15:30,12.904328,77.5961512,2016-03-05 15:30:00,15,0,1.0,1.0,1.0
4 Wheeler Theft,12/5/2016,13:00,12.913173,77.597754,2016-05-12 13:00:00,13,0,1.0,1.0,1.0
4 Wheeler Theft,1/8/2016,20:05,12.9118554,77.5723761,2016-08-01 20:05:00,20,1,1.0,1.5,1.5
4 Wheeler Theft,3/8/2016,19:35,12.8971425,77.5818036,2016-08-03 19:35:00,19,1,1.0,1.5,1.5
4 Wheeler Theft,7/8/2016,9:20,12.9107989,77.5758887,2016-08-07 09:20:00,9,0,1.0,1.0,1.0
4 Wheeler Theft,24/12/2016,17:00,12.9015479,77.5801482,2016-12-24 17:00:00,17,0,1.0,1.0,1.0
4 Wheeler Theft,26/12/2016,11:20,12.9015739,77.5735821,2016-12-26 11:20:00,11,0,1.0,1.0,1.0
4 Wheeler Theft,11/4/2017,11:30,12.9386699,77.5402407,2017-04-11 11:30:00,11,0,1.0,1.0,1.0
4 Wheeler Theft,8/5/2017,13:00,12.9388326,77.5402407,2017-05-08 13:00:00,13,0,1.0,1.0,1.0
4 Wheeler Theft,27/05/2017,18:00,12.9389952,77.5402406,2017-05-27 18:00:00,18,0,1.0,1.0,1.0
4 Wheeler Theft,29/05/2017,17:30,12.9178748,77.5845514,2017-05-29 17:30:00,17,0,1.0,1.0,1.0
4 Wheeler Theft,29/07/2017,13:00,12.9211693,77.5799377,2017-07-29 13:00:00,13,0,1.0,1.0,1.0
4 Wheeler Theft,11/10/2017,17:30,12.916245,77.5932261,2017-10-11 17:30:00,17,0,1.0,1.0,1.0
4 Wheeler Theft,10/12/2017,12:30,12.9077254,77.5978325,2017-12-10 12:30:00,12,0,1.0,1.0,1.0
4 Wheeler Theft,14/02/2018,13:00,12.9097302,77.5836513,2018-02-14 13:00:00,13,0,1.0,1.0,1.0
4 Wheeler Theft,5/6/2018,9:30,12.9154951,77.5931886,2018-06-05 09:30:00,9,0,1.0,1.0,1.0
4 Wheeler Theft,12/8/2018,15:15,12.9159378,77.5855939,2018-08-12 15:15:00,15,0,1.0,1.0,1.0
4 Wheeler Theft,9/5/2019,9:30,12.911032,77.5759036,2019-05-09 09:30:00,9,0,1.0,1.0,1.0
4 Wheeler Theft,19/10/2019,11:00,12.908631,77.5866536,2019-10-19 11:00:00,11,0,1.0,1.0,1.0
4 Wheeler Theft,28/01/2015,11:00,12.92945278,77.57361111,2015-01-28 11:00:00,11,0,1.0,1.0,1.0
4 Wheeler Theft,30/07/2015,13:30,12.91519722,77.55861111,2015-07-30 13:30:00,13,0,1.0,1.0,1.0
4 Wheeler Theft,19/08/2015,13:30,12.92516111,77.56138889,2015-08-19 13:30:00,13,0,1.0,1.0,1.0
4 Wheeler Theft,2/11/2015,5:30,12.92543056,77.56083333,2015-11-02 05:30:00,5,1,1.0,1.5,1.5
4 Wheeler Theft,25/04/2016,13:00,12.92439444,77.56805556,2016-04-25 13:00:00,13,0,1.0,1.0,1.0
4 Wheeler Theft,15/07/2016,19:30,12.93251111,77.57555556,2016-07-15 19:30:00,19,1,1.0,1.5,1.5
4 Wheeler Theft,13/07/2017,10:00,12.92543056,77.56083333,2017-07-13 10:00:00,10,0,1.0,1.0,1.0
4 Wheeler Theft,31/07/2017,18:00,12.92635556,77.57694444,2017-07-31 18:00:00,18,0,1.0,1.0,1.0
4 Wheeler Theft,2/8/2017,9:30,12.91542222,77.56194444,2017-08-02 09:30:00,9,0,1.0,1.0,1.0
4 Wheeler Theft,25/05/2018,8:00,12.928291,77.574512.,2018-05-25 08:00:00,8,0,1.0,1.0,1.0
4 Wheeler Theft,17/11/2018,19:00,12.92088,77.56191,2018-11-17 19:00:00,19,1,1.0,1.5,1.5
4 Wheeler Theft,6/12/2018,16:15,12.9169,77.559677,2018-12-06 16:15:00,16,0,1.0,1.0,1.0
4 Wheeler Theft,16/01/2019,19:30,12.92124722,77.57305556,2019-01-16 19:30:00,19,1,1.0,1.5,1.5
4 Wheeler Theft,20/02/2019,9:00,12.919,77.55535,2019-02-20 09:00:00,9,0,1.0,1.0,1.0
4 Wheeler Theft,17/07/2019,12:15,12.87823,77.50026,2019-07-17 12:15:00,12,0,1.0,1.0,1.0
4 Wheeler Theft,29/04/2015,15:00,12.935347,77.587477,2015-04-29 15:00:00,15,0,1.0,1.0,1.0
4 Wheeler Theft,24/06/2015,13:00,12.942437,77.591254,2015-06-24 13:00:00,13,0,1.0,1.0,1.0
4 Wheeler Theft,29/10/2015,15:30,12.936294,77.593072,2015-10-29 15:30:00,15,0,1.0,1.0,1.0
4 Wheeler Theft,17/12/2015,17:50,12.938159,77.590823,2015-12-17 17:50:00,17,0,1.0,1.0,1.0
4 Wheeler Theft,01/11/2017,13:00,12.93605,77.585719,2017-11-01 13:00:00,13,0,1.0,1.0,1.0
4 Wheeler Theft,04/11/2017,18:15,12.942522,77.58286,2017-11-04 18:15:00,18,0,1.0,1.0,1.0
4 Wheeler Theft,04/07/2018,12:30,12.947692,77.591893,2018-07-04 12:30:00,12,0,1.0,1.0,1.0
4 Wheeler Theft,19/11/2018,16:00,12.943024,77.5871144,2018-11-19 16:00:00,16,0,1.0,1.0,1.0
4 Wheeler Theft,14/07/2019,12:30,12.935347,77.587477,2019-07-14 12:30:00,12,0,1.0,1.0,1.0
4 Wheeler Theft,27/07/2019,14:00,12.941058,77.586061,2019-07-27 14:00:00,14,0,1.0,1.0,1.0
4 Wheeler Theft,18/01/2015,14:45,12.90471042,77.54488816,2015-01-18 14:45:00,14,0,1.0,1.0,1.0
4 Wheeler Theft,18/01/2015,20:00,12.90626715,77.55057549,2015-01-18 20:00:00,20,1,1.0,1.5,1.5
4 Wheeler Theft,11/02/2015,22:10,12.90245473,77.54181407,2015-02-11 22:10:00,22,1,1.0,1.5,1.5
4 Wheeler Theft,06/04/2015,21:00,12.88924511,77.57370198,2015-04-06 21:00:00,21,1,1.0,1.5,1.5
4 Wheeler Theft,14/04/2015,8:00,12.88496438,77.55767556,2015-04-14 08:00:00,8,0,1.0,1.0,1.0
4 Wheeler Theft,17/07/2015,23:30,12.91633747,77.54077845,2015-07-17 23:30:00,23,1,1.0,1.5,1.5
4 Wheeler Theft,10/09/2015,20:30,12.90505271,77.54189573,2015-09-10 20:30:00,20,1,1.0,1.5,1.5
4 Wheeler Theft,26/09/2015,2:45,12.88211726,77.55729374,2015-09-26 02:45:00,2,1,1.0,1.5,1.5
4 Wheeler Theft,08/10/2015,9:30,77.53502225,12.90784268,2015-10-08 09:30:00,9,0,1.0,1.0,1.0
4 Wheeler Theft,23/12/2015,23:00,12.90759817,77.53481056,2015-12-23 23:00:00,23,1,1.0,1.5,1.5
4 Wheeler Theft,06/01/2016,10:02,12.88982145,77.57974701,2016-01-06 10:02:00,10,0,1.0,1.0,1.0
4 Wheeler Theft,10/11/2016,10:00,12.89890617,77.54993736,2016-11-10 10:00:00,10,0,1.0,1.0,1.0
4 Wheeler Theft,09/02/2016,20:45,12.89537161,77.55032355,2016-02-09 20:45:00,20,1,1.0,1.5,1.5
4 Wheeler Theft,06/03/2016,21:45,12.88982145,77.57974701,2016-03-06 21:45:00,21,1,1.0,1.5,1.5
4 Wheeler Theft,28/03/2016,8:40,12.88947089,77.57420817,2016-03-28 08:40:00,8,0,1.0,1.0,1.0
4 Wheeler Theft,16/06/2016,10:15,12.90759817,77.53481056,2016-06-16 10:15:00,10,0,1.0,1.0,1.0
4 Wheeler Theft,20/08/2016,22:30,12.8887116,77.57377343,2016-08-20 22:30:00,22,1,1.0,1.5,1.5
4 Wheeler Theft,24/09/2016,0:00,12.8776868,77.58071703,2016-09-24 00:00:00,0,1,1.0,1.5,1.5
4 Wheeler Theft,16/10/2016,16:00,12.8887116,77.57377343,2016-10-16 16:00:00,16,0,1.0,1.0,1.0
4 Wheeler Theft,22/11/2016,14:00,12.8776868,77.58071703,2016-11-22 14:00:00,14,0,1.0,1.0,1.0
4 Wheeler Theft,06/12/2016,19:15,12.90504139,77.54315768,2016-12-06 19:15:00,19,1,1.0,1.5,1.5
4 Wheeler Theft,27/03/2017,10:30,12.91688388,77.54201107,2017-03-27 10:30:00,10,0,1.0,1.0,1.0
4 Wheeler Theft,27/07/2017,14:50,12.88376625,77.56842522,2017-07-27 14:50:00,14,0,1.0,1.0,1.0
4 Wheeler Theft,21/03/2018,21:30,12.9057223,77.53558126,2018-03-21 21:30:00,21,1,1.0,1.5,1.5
4 Wheeler Theft,01/12/2018,16:00,12.89180481,77.55394005,2018-12-01 16:00:00,16,0,1.0,1.0,1.0
4 Wheeler Theft,21/12/2018,17:30,12.88316591,77.56520086,2018-12-21 17:30:00,17,0,1.0,1.0,1.0
4 Wheeler Theft,19/03/2019,15:00,12.88627829,77.57129098,2019-03-19 15:00:00,15,0,1.0,1.0,1.0
4 Wheeler Theft,19/03/2019,18:30,12.89157884,77.58142943,2019-03-19 18:30:00,18,0,1.0,1.0,1.0
4 Wheeler Theft,13/03/2019,12:45,12.90711393,77.5439924,2019-03-13 12:45:00,12,0,1.0,1.0,1.0
4 Wheeler Theft,24/03/2019,5:30,12.9072655,77.53613997,2019-03-24 05:30:00,5,1,1.0,1.5,1.5
4 Wheeler Theft,20/04/2019,11:30,12.90912148,77.55154907,2019-04-20 11:30:00,11,0,1.0,1.0,1.0
4 Wheeler Theft,26/04/2019,13:00,12.91147818,77.55291868,2019-04-26 13:00:00,13,0,1.0,1.0,1.0
4 Wheeler Theft,13/09/2019,20:00,12.9057223,77.53558126,2019-09-13 20:00:00,20,1,1.0,1.5,1.5
4 Wheeler Theft,28/11/2015,18:30,12.87239,77.542482,2015-11-28 18:30:00,18,0,1.0,1.0,1.0
4 Wheeler Theft,06/12/2016,18:00,12.865651,77.539388,2016-12-06 18:00:00,18,0,1.0,1.0,1.0
4 Wheeler Theft,11/12/2016,19:45,12.872337,77.562521,2016-12-11 19:45:00,19,1,1.0,1.5,1.5
4 Wheeler Theft,19/12/2016,15:00,12.870018,77.565913,2016-12-19 15:00:00,15,0,1.0,1.0,1.0
4 Wheeler Theft,24/10/2017,11:30,12.89083,77.538516,2017-10-24 11:30:00,11,0,1.0,1.0,1.0
4 Wheeler Theft,18/12/2017,13:00,12.892083,77.542315,2017-12-18 13:00:00,13,0,1.0,1.0,1.0
4 Wheeler Theft,20/02/2019,11:00,12.870325,77.547321,2019-02-20 11:00:00,11,0,1.0,1.0,1.0
4 Wheeler Theft,05/03/2019,20:10,12.858186,77.578695,2019-03-05 20:10:00,20,1,1.0,1.5,1.5
4 Wheeler Theft,12/03/2019,9:30,12.891881,77.519617,2019-03-12 09:30:00,9,0,1.0,1.0,1.0
4 Wheeler Theft,15/09/2019,11:30,12.857243,77.573414,2019-09-15 11:30:00,11,0,1.0,1.0,1.0
4 Wheeler Theft,05/11/2019,21:00,12.869623,77.572816,2019-11-05 21:00:00,21,1,1.0,1.5,1.5
4 Wheeler Theft,04/04/2017,10:30,12.85514,77.588799,2017-04-04 10:30:00,10,0,1.0,1.0,1.0
4 Wheeler Theft,29/05/2017,14:00,12.896403,77.570289,2017-05-29 14:00:00,14,0,1.0,1.0,1.0
4 Wheeler Theft,30/05/2017,20:40,12.895925,77.585328,2017-05-30 20:40:00,20,1,1.0,1.5,1.5
4 Wheeler Theft,3/3/2017,16:30,12.90121944,77.59055556,2017-03-03 16:30:00,16,0,1.0,1.0,1.0
4 Wheeler Theft,1/9/2018,13:00,12.88985,77.59277778,2018-09-01 13:00:00,13,0,1.0,1.0,1.0
4 Wheeler Theft,2/10/2018,12:30,12.894823,77.59862,2018-10-02 12:30:00,12,0,1.0,1.0,1.0
4 Wheeler Theft,4/4/2018,12:00,12.90393889,77.5825,2018-04-04 12:00:00,12,0,1.0,1.0,1.0
4 Wheeler Theft,3/7/2019,18:30,12.893183,77.572113,2019-07-03 18:30:00,18,0,1.0,1.0,1.0
4 Wheeler Theft,7/8/2019,10:30,12.904658,77.58838,2019-08-07 10:30:00,10,0,1.0,1.0,1.0
4 Wheeler Theft,11/6/2019,10:30,12.889763,77.585588,2019-06-11 10:30:00,10,0,1.0,1.0,1.0
4 Wheeler Theft,21/02/2016,19:50,12.936359,77.354721,2016-02-21 19:50:00,19,1,1.0,1.5,1.5
4 Wheeler Theft,12/5/2016,19:45,12.936275,77.550704,2016-05-12 19:45:00,19,1,1.0,1.5,1.5
4 Wheeler Theft,14/11/2016,10:30,12.555043,77.322021,2016-11-14 10:30:00,10,0,1.0,1.0,1.0
4 Wheeler Theft,21/11/2016,20:30,12.560156,77.320937,2016-11-21 20:30:00,20,1,1.0,1.5,1.5
4 Wheeler Theft,7/6/2018,12:30,12.945085,77.548612,2018-06-07 12:30:00,12,0,1.0,1.0,1.0
4 Wheeler Theft,3/12/2019,14:00,12.943637,77.844691,2019-12-03 14:00:00,14,0,1.0,1.0,1.0
4 Wheeler Theft,7/12/2019,13:10,12.937255.,77.534241,2019-12-07 13:10:00,13,0,1.0,1.0,1.0
4 Wheeler Theft,27/11/2015,18:00,12.9578264,77.55941741,2015-11-27 18:00:00,18,0,1.0,1.0,1.0
4 Wheeler Theft,02/09/2016,17:15,12.9578264,77.55941741,2016-09-02 17:15:00,17,0,1.0,1.0,1.0
4 Wheeler Theft,18/08/2018,16:15,12.94983,77.56041,2018-08-18 16:15:00,16,0,1.0,1.0,1.0
4 Wheeler Theft,08/12/2015,8:15,12.9556,77.56883,2015-12-08 08:15:00,8,0,1.0,1.0,1.0
4 Wheeler Theft,4/11/2016,11:15,12.94176,77.55656,2016-11-04 11:15:00,11,0,1.0,1.0,1.0
4 Wheeler Theft,12/9/2016,12:30,12.943648,77.549789,2016-09-12 12:30:00,12,0,1.0,1.0,1.0
4 Wheeler Theft,11/3/2017,10:30,12.9422,77.552401,2017-03-11 10:30:00,10,0,1.0,1.0,1.0
4 Wheeler Theft,29/01/2015,20:00,12.930861,77.554069,2015-01-29 20:00:00,20,1,1.0,1.5,1.5
4 Wheeler Theft,29/3/2015,8:00,12.926837,77.544735,2015-03-29 08:00:00,8,0,1.0,1.0,1.0
4 Wheeler Theft,31/01/2015,8:00,12.924688,77.548142,2015-01-31 08:00:00,8,0,1.0,1.0,1.0
4 Wheeler Theft,24/04/2015,23:00,12.930228,77.547624,2015-04-24 23:00:00,23,1,1.0,1.5,1.5
4 Wheeler Theft,23/07/2015,7:00,12.924729,77.558486,2015-07-23 07:00:00,7,0,1.0,1.0,1.0
4 Wheeler Theft,31/08/2015,18:00,12.929702,77.553766,2015-08-31 18:00:00,18,0,1.0,1.0,1.0
4 Wheeler Theft,17/08/2016,11:30,12.9212651,77.54999552,2016-08-17 11:30:00,11,0,1.0,1.0,1.0
4 Wheeler Theft,3/10/2017,10:00,12.552074,77333558,2017-10-03 10:00:00,10,0,1.0,1.0,1.0
4 Wheeler Theft,09/11/2018,11:00,12.2553,77.552298,2018-11-09 11:00:00,11,0,1.0,1.0,1.0
4 Wheeler Theft,22/05/2019,10:15,12.932284,77.54988,2019-05-22 10:15:00,10,0,1.0,1.0,1.0
4 Wheeler Theft,23/09/2019,9:30,12.929298,77.54597,2019-09-23 09:30:00,9,0,1.0,1.0,1.0
4 Wheeler Theft,18/10/2019,0:00,12.926366,77.549813,2019-10-18 00:00:00,0,1,1.0,1.5,1.5
Ordinary Theft,1/1/2015,12:30,12.92256,77.58698,2015-01-01 12:30:00,12,0,1.0,1.0,1.0
Ordinary Theft,14/01/2015,22:40,12.918025,7758835,2015-01-14 22:40:00,22,1,1.0,1.5,1.5
Ordinary Theft,29/01/2015,19:25,12.92746121,77.58628835,2015-01-29 19:25:00,19,1,1.0,1.5,1.5
Ordinary Theft,4/2/2015,20:00,12.93692755,77.57899468,2015-02-04 20:00:00,20,1,1.0,1.5,1.5
Ordinary Theft,9/2/2015,13:30,12.934423,77.592768,2015-02-09 13:30:00,13,0,1.0,1.0,1.0
Ordinary Theft,3/3/2015,18:00,12.91856,77.58466,2015-03-03 18:00:00,18,0,1.0,1.0,1.0
Ordinary Theft,9/3/2015,19:30,12.947111,77.594474,2015-03-09 19:30:00,19,1,1.0,1.5,1.5
Ordinary Theft,28/03/2015,19:30,12.929333,77.58168,2015-03-28 19:30:00,19,1,1.0,1.5,1.5
Ordinary Theft,7/4/2015,20:00,12.952429,77.543605,2015-04-07 20:00:00,20,1,1.0,1.5,1.5
Ordinary Theft,7/4/2015,21:40,12.9388,77.859975,2015-04-07 21:40:00,21,1,1.0,1.5,1.5
Ordinary Theft,29/04/2015,13:00,12.919098,77.589485,2015-04-29 13:00:00,13,0,1.0,1.0,1.0
Ordinary Theft,1/5/2015,15:00,12.912976,77.573242,2015-05-01 15:00:00,15,0,1.0,1.0,1.0
Ordinary Theft,2/5/2015,0:20,12.552347,77.35059,2015-05-02 00:20:00,0,1,1.0,1.5,1.5
Ordinary Theft,2/5/2015,11:40,12.946444,77.579988,2015-05-02 11:40:00,11,0,1.0,1.0,1.0
Ordinary Theft,6/5/2015,11:00,12.928613,77.585359,2015-05-06 11:00:00,11,0,1.0,1.0,1.0
Ordinary Theft,22/05/2015,17:30,12.918025,77.58835,2015-05-22 17:30:00,17,0,1.0,1.0,1.0
Ordinary Theft,26/05/2015,19:20,12.930433,77.549761,2015-05-26 19:20:00,19,1,1.0,1.5,1.5
Ordinary Theft,30/05/2015,13:30,12.924603,77.588906,2015-05-30 13:30:00,13,0,1.0,1.0,1.0
Ordinary Theft,3/6/2015,13:30,12.93349,77.576628,2015-06-03 13:30:00,13,0,1.0,1.0,1.0
Ordinary Theft,18/06/2015,13:00,12.928613,77.585359,2015-06-18 13:00:00,13,0,1.0,1.0,1.0
Ordinary Theft,7/7/2015,14:15,12.927136,77.5907,2015-07-07 14:15:00,14,0,1.0,1.0,1.0
Ordinary Theft,15/07/2015,19:00,12.926523,77.579647,2015-07-15 19:00:00,19,1,1.0,1.5,1.5
Ordinary Theft,5/9/2015,21:15,12.916757,77.593434,2015-09-05 21:15:00,21,1,1.0,1.5,1.5
Ordinary Theft,7/9/2015,17:30,12.909694,77.634426,2015-09-07 17:30:00,17,0,1.0,1.0,1.0
Ordinary Theft,15/09/2015,14:30,12.265842,77.248562,2015-09-15 14:30:00,14,0,1.0,1.0,1.0
Ordinary Theft,23/09/2015,16:00,12.91756,77.58486,2015-09-23 16:00:00,16,0,1.0,1.0,1.0
Ordinary Theft,12/10/2015,20:45,12.922536,77.587568,2015-10-12 20:45:00,20,1,1.0,1.5,1.5
Ordinary Theft,18/10/2015,12:15,12.92253,77.585898,2015-10-18 12:15:00,12,0,1.0,1.0,1.0
Ordinary Theft,25/10/2015,20:20,12.918028,77.58842,2015-10-25 20:20:00,20,1,1.0,1.5,1.5
Ordinary Theft,14/11/2015,18:00,12.922535,77.58565,2015-11-14 18:00:00,18,0,1.0,1.0,1.0
Ordinary Theft,29/12/2015,9:15,12.95645,77.786586,2015-12-29 09:15:00,9,0,1.0,1.0,1.0
Ordinary Theft,7/2/2015,13:00,12.93443,77.592708,2015-02-07 13:00:00,13,0,1.0,1.0,1.0
Ordinary Theft,9/2/2015,13:10,12.9165885,77.589965,2015-02-09 13:10:00,13,0,1.0,1.0,1.0
Ordinary Theft,1/3/2015,13:30,12.931988,77.590196,2015-03-01 13:30:00,13,0,1.0,1.0,1.0
Ordinary Theft,21/05/2015,10:30,12.931921,77.58029,2015-05-21 10:30:00,10,0,1.0,1.0,1.0
Ordinary Theft,19/06/2015,13:00,12.88605,77.494843,2015-06-19 13:00:00,13,0,1.0,1.0,1.0
Ordinary Theft,4/8/2015,19:30,13.05669,77.6256687,2015-08-04 19:30:00,19,1,1.0,1.5,1.5
Ordinary Theft,12/8/2015,15:00,12.919774,77.577703,2015-08-12 15:00:00,15,0,1.0,1.0,1.0
Ordinary Theft,3/9/2015,21:00,"12.361426,",77.243652,2015-09-03 21:00:00,21,1,1.0,1.5,1.5
Ordinary Theft,10/9/2015,14:30,12.928613,77.585359,2015-09-10 14:30:00,14,0,1.0,1.0,1.0
Ordinary Theft,14/11/2015,13:00,12.93192,77.58016,2015-11-14 13:00:00,13,0,1.0,1.0,1.0
Ordinary Theft,9/12/2015,4:00,12.88605,77.494843,2015-12-09 04:00:00,4,1,1.0,1.5,1.5
Ordinary Theft,11/12/2015,19:35,12.93192,77.580106,2015-12-11 19:35:00,19,1,1.0,1.5,1.5
Ordinary Theft,24/03/2015,11:00,12.924857,77.583759,2015-03-24 11:00:00,11,0,1.0,1.0,1.0
Ordinary Theft,6/1/2015,15:00,12.92885,77.5785,2015-01-06 15:00:00,15,0,1.0,1.0,1.0
Ordinary Theft,18/01/2015,16:30,12.9273,77.57806,2015-01-18 16:30:00,16,0,1.0,1.0,1.0
Ordinary Theft,23/03/2015,17:00,12.930535,77.586997,2015-03-23 17:00:00,17,0,1.0,1.0,1.0
Ordinary Theft,15/04/2015,12:00,12.928613,77.585359,2015-04-15 12:00:00,12,0,1.0,1.0,1.0
Ordinary Theft,2/5/2015,14:00,12.934891,77.581991,2015-05-02 14:00:00,14,0,1.0,1.0,1.0
Ordinary Theft,22/07/2015,15:40,12.936652,77.576437,2015-07-22 15:40:00,15,0,1.0,1.0,1.0
Ordinary Theft,15/01/2015,19:30,12.923852,77.576402,2015-01-15 19:30:00,19,1,1.0,1.5,1.5
Ordinary Theft,16/01/2015,21:20,12.93067,77.581281,2015-01-16 21:20:00,21,1,1.0,1.5,1.5
Ordinary Theft,3/3/2015,12:30,12.923852,77.576402,2015-03-03 12:30:00,12,0,1.0,1.0,1.0
Ordinary Theft,9/3/2015,17:30,12.923852,77.576402,2015-03-09 17:30:00,17,0,1.0,1.0,1.0
Ordinary Theft,8/4/2015,11:30,12.930397,77.585753,2015-04-08 11:30:00,11,0,1.0,1.0,1.0
Ordinary Theft,30/04/2015,19:40,12.919817,77.58481,2015-04-30 19:40:00,19,1,1.0,1.5,1.5
Ordinary Theft,4/5/2015,14:45,12.927082,77.588137,2015-05-04 14:45:00,14,0,1.0,1.0,1.0
Ordinary Theft,25/06/2015,9:50,12.925458,77.584816,2015-06-25 09:50:00,9,0,1.0,1.0,1.0
Ordinary Theft,28/08/2015,19:10,12.932553,77.580342,2015-08-28 19:10:00,19,1,1.0,1.5,1.5
Ordinary Theft,26/11/2015,9:15,12.935566,77.589964,2015-11-26 09:15:00,9,0,1.0,1.0,1.0
Ordinary Theft,24/02/2016,19:00,12.545787,77.342621,2016-02-24 19:00:00,19,1,1.0,1.5,1.5
Ordinary Theft,3/5/2016,10:30,23.823643,90.35341,2016-05-03 10:30:00,10,0,1.0,1.0,1.0
Ordinary Theft,12/5/2016,10:00,12.55018,77.380103,2016-05-12 10:00:00,10,0,1.0,1.0,1.0
Ordinary Theft,8/11/2016,13:00,12.926858,77.583552,2016-11-08 13:00:00,13,0,1.0,1.0,1.0
Ordinary Theft,20/04/2016,15:00,12.91945,77.58582,2016-04-20 15:00:00,15,0,1.0,1.0,1.0
Ordinary Theft,28/06/2016,12:30,12.923975,77.579868,2016-06-28 12:30:00,12,0,1.0,1.0,1.0
Ordinary Theft,5/7/2016,13:30,12.916869,77.589571,2016-07-05 13:30:00,13,0,1.0,1.0,1.0
Ordinary Theft,3/9/2016,14:00,12.91845,77.584881,2016-09-03 14:00:00,14,0,1.0,1.0,1.0
Ordinary Theft,21/09/2016,13:30,12.921458,77.58764,2016-09-21 13:30:00,13,0,1.0,1.0,1.0
Ordinary Theft,28/09/2016,14:00,12.92556,77.59763,2016-09-28 14:00:00,14,0,1.0,1.0,1.0
Ordinary Theft,22/11/2016,17:00,12.92556,77.59763,2016-11-22 17:00:00,17,0,1.0,1.0,1.0
Ordinary Theft,16/01/2016,18:00,12.92074,77.59957,2016-01-16 18:00:00,18,0,1.0,1.0,1.0
Ordinary Theft,21/01/2016,13:30,12.92847,77.58374,2016-01-21 13:30:00,13,0,1.0,1.0,1.0
Ordinary Theft,9/4/2016,16:30,12.92825,77.57483,2016-04-09 16:30:00,16,0,1.0,1.0,1.0
Ordinary Theft,22/04/2016,12:00,12.922084,77.589585,2016-04-22 12:00:00,12,0,1.0,1.0,1.0
Ordinary Theft,20/10/2016,10:00,12.935688,77.586954,2016-10-20 10:00:00,10,0,1.0,1.0,1.0
Ordinary Theft,12/11/2016,8:30,12.92847,77.58374,2016-11-12 08:30:00,8,0,1.0,1.0,1.0
Ordinary Theft,3/1/2016,18:50,12.9167,77.59763,2016-01-03 18:50:00,18,0,1.0,1.0,1.0
Ordinary Theft,22/01/2016,17:00,12.91945,77.58582,2016-01-22 17:00:00,17,0,1.0,1.0,1.0
Ordinary Theft,19/02/2016,18:00,12.92556,77.57561,2016-02-19 18:00:00,18,0,1.0,1.0,1.0
Ordinary Theft,27/02/2016,16:00,12.92367,77.58014,2016-02-27 16:00:00,16,0,1.0,1.0,1.0
Ordinary Theft,22/04/2016,12:00,12.92556,77.57591,2016-04-22 12:00:00,12,0,1.0,1.0,1.0
Ordinary Theft,31/05/2016,9:00,12.915868,77.58954,2016-05-31 09:00:00,9,0,1.0,1.0,1.0
Ordinary Theft,22/07/2016,10:35,12.91699,77.58934,2016-07-22 10:35:00,10,0,1.0,1.0,1.0
Ordinary Theft,8/9/2016,22:15,12.92367,77.58014,2016-09-08 22:15:00,22,1,1.0,1.5,1.5
Ordinary Theft,6/11/2016,15:35,12.92556,77.57561,2016-11-06 15:35:00,15,0,1.0,1.0,1.0
Ordinary Theft,29/11/2016,10:25,12.909645,77.632545,2016-11-29 10:25:00,10,0,1.0,1.0,1.0
Ordinary Theft,24/01/2016,22:30,12.92556,77.57591,2016-01-24 22:30:00,22,1,1.0,1.5,1.5
Ordinary Theft,29/02/2016,18:30,12.915785,77.58695,2016-02-29 18:30:00,18,0,1.0,1.0,1.0
Ordinary Theft,1/3/2016,12:35,12.91945,77.58582,2016-03-01 12:35:00,12,0,1.0,1.0,1.0
Ordinary Theft,1/3/2016,13:30,12.91945,77.58582,2016-03-01 13:30:00,13,0,1.0,1.0,1.0
Ordinary Theft,11/3/2016,18:40,12.92311,77.5807,2016-03-11 18:40:00,18,0,1.0,1.0,1.0
Ordinary Theft,13/04/2016,10:30,12.91945,77.58582,2016-04-13 10:30:00,10,0,1.0,1.0,1.0
Ordinary Theft,28/04/2016,19:30,12.923675,77.580145,2016-04-28 19:30:00,19,1,1.0,1.5,1.5
Ordinary Theft,15/06/2016,16:45,12.9237885,77.589685,2016-06-15 16:45:00,16,0,1.0,1.0,1.0
Ordinary Theft,22/06/2016,10:00,12.92367,77.58014,2016-06-22 10:00:00,10,0,1.0,1.0,1.0
Ordinary Theft,7/7/2016,23:10,12.92397,77.57968,2016-07-07 23:10:00,23,1,1.0,1.5,1.5
Ordinary Theft,19/07/2016,2:45,12.93047,77.57957,2016-07-19 02:45:00,2,1,1.0,1.5,1.5
Ordinary Theft,9/8/2016,17:00,12.93091,77.57812,2016-08-09 17:00:00,17,0,1.0,1.0,1.0
Ordinary Theft,15/08/2016,23:15,12.91945,77.585805,2016-08-15 23:15:00,23,1,1.0,1.5,1.5
Ordinary Theft,6/10/2016,19:35,12.92164,77.59149,2016-10-06 19:35:00,19,1,1.0,1.5,1.5
Ordinary Theft,8/10/2016,21:30,12.92178,77.57923,2016-10-08 21:30:00,21,1,1.0,1.5,1.5
Ordinary Theft,18/11/2016,13:15,12.92239,77.58076,2016-11-18 13:15:00,13,0,1.0,1.0,1.0
Ordinary Theft,19/01/2016,21:00,12.92266,77.5854,2016-01-19 21:00:00,21,1,1.0,1.5,1.5
Ordinary Theft,21/01/2016,17:30,12.921455,77.587621,2016-01-21 17:30:00,17,0,1.0,1.0,1.0
Ordinary Theft,29/01/2016,12:30,12.92297,77.5807,2016-01-29 12:30:00,12,0,1.0,1.0,1.0
Ordinary Theft,9/2/2016,13:30,12.92234,77.58076,2016-02-09 13:30:00,13,0,1.0,1.0,1.0
Ordinary Theft,15/02/2016,10:30,12.914568,77.587485,2016-02-15 10:30:00,10,0,1.0,1.0,1.0
Ordinary Theft,19/02/2016,12:30,12.91945,77.58582,2016-02-19 12:30:00,12,0,1.0,1.0,1.0
Ordinary Theft,26/02/2016,10:30,12.92458,77.584796,2016-02-26 10:30:00,10,0,1.0,1.0,1.0
Ordinary Theft,29/06/2016,17:15,12.919458,77.585795,2016-06-29 17:15:00,17,0,1.0,1.0,1.0
Ordinary Theft,1/7/2016,11:30,12.919458,77.585795,2016-07-01 11:30:00,11,0,1.0,1.0,1.0
Ordinary Theft,20/07/2016,21:45,12.914758,77.587965,2016-07-20 21:45:00,21,1,1.0,1.5,1.5
Ordinary Theft,26/07/2016,14:45,12.93457,77.578685,2016-07-26 14:45:00,14,0,1.0,1.0,1.0
Ordinary Theft,3/10/2016,17:30,12.92266,77.585845,2016-10-03 17:30:00,17,0,1.0,1.0,1.0
Ordinary Theft,5/10/2016,17:30,12.916576,77.586945,2016-10-05 17:30:00,17,0,1.0,1.0,1.0
Ordinary Theft,17/11/2016,17:45,12.86984,77.575962,2016-11-17 17:45:00,17,0,1.0,1.0,1.0
Ordinary Theft,10/9/2016,13:00,12.92234,77.582254,2016-09-10 13:00:00,13,0,1.0,1.0,1.0
Ordinary Theft,21/12/2017,16:40,12.9167,77.59763,2017-12-21 16:40:00,16,0,1.0,1.0,1.0
Ordinary Theft,10/1/2017,18:15,12.91992,77.59044,2017-01-10 18:15:00,18,0,1.0,1.0,1.0
Ordinary Theft,30/01/2017,16:00,12.92556,77.57561,2017-01-30 16:00:00,16,0,1.0,1.0,1.0
Ordinary Theft,30/01/2017,20:15,12.92865,77.58178,2017-01-30 20:15:00,20,1,1.0,1.5,1.5
Ordinary Theft,21/04/2017,18:00,12.93183,77.58355,2017-04-21 18:00:00,18,0,1.0,1.0,1.0
Ordinary Theft,23/04/2017,9:45,12.94158,77.58758,2017-04-23 09:45:00,9,0,1.0,1.0,1.0
Ordinary Theft,14/06/2017,20:30,12.9179,77.58718,2017-06-14 20:30:00,20,1,1.0,1.5,1.5
Ordinary Theft,5/7/2017,20:40,12.92316,77.59376,2017-07-05 20:40:00,20,1,1.0,1.5,1.5
Ordinary Theft,16/09/2017,11:00,12.92367,77.58014,2017-09-16 11:00:00,11,0,1.0,1.0,1.0
Ordinary Theft,17/01/2017,11:30,12.92367,77.58014,2017-01-17 11:30:00,11,0,1.0,1.0,1.0
Ordinary Theft,18/07/2017,13:25,12.92023,77.5819,2017-07-18 13:25:00,13,0,1.0,1.0,1.0
Ordinary Theft,17/09/2017,8:45,12.92458,77.5846852,2017-09-17 08:45:00,8,0,1.0,1.0,1.0
Ordinary Theft,17/09/2017,12:30,12.914686,77.5776952,2017-09-17 12:30:00,12,0,1.0,1.0,1.0
Ordinary Theft,17/09/2017,14:30,12.945852,77.576951,2017-09-17 14:30:00,14,0,1.0,1.0,1.0
Ordinary Theft,8/12/2017,18:00,12.92952,77.57891,2017-12-08 18:00:00,18,0,1.0,1.0,1.0
Ordinary Theft,15/12/2017,11:00,12.92963,77.57702,2017-12-15 11:00:00,11,0,1.0,1.0,1.0
Ordinary Theft,16/12/2017,11:30,12.92085,77.58139,2017-12-16 11:30:00,11,0,1.0,1.0,1.0
Ordinary Theft,23/07/2017,11:45,12.92596,77.55321,2017-07-23 11:45:00,11,0,1.0,1.0,1.0
Ordinary Theft,26/07/2017,15:00,12.93006,77.57958,2017-07-26 15:00:00,15,0,1.0,1.0,1.0
Ordinary Theft,27/07/2017,10:50,12.92367,77.58014,2017-07-27 10:50:00,10,0,1.0,1.0,1.0
Ordinary Theft,11/9/2017,22:00,12.92603,77.57362,2017-09-11 22:00:00,22,1,1.0,1.5,1.5
Ordinary Theft,15/12/2017,12:30,12.92115,77.58075,2017-12-15 12:30:00,12,0,1.0,1.0,1.0
Ordinary Theft,4/7/2017,13:00,12.92847,77.58374,2017-07-04 13:00:00,13,0,1.0,1.0,1.0
Ordinary Theft,3/8/2017,14:00,12.929578,77.585484,2017-08-03 14:00:00,14,0,1.0,1.0,1.0
Ordinary Theft,5/8/2017,13:00,12.92234,77.58076,2017-08-05 13:00:00,13,0,1.0,1.0,1.0
Ordinary Theft,19/10/2017,14:15,12.92028,77.58801,2017-10-19 14:15:00,14,0,1.0,1.0,1.0
Ordinary Theft,11/8/2017,19:00,12.91945,77.58582,2017-08-11 19:00:00,19,1,1.0,1.5,1.5
Ordinary Theft,2/12/2017,10:00,12.923852,77.576401,2017-12-02 10:00:00,10,0,1.0,1.0,1.0
Ordinary Theft,8/1/2017,14:15,12.9248555,77.58965,2017-01-08 14:15:00,14,0,1.0,1.0,1.0
Ordinary Theft,5/3/2017,18:00,12.92367,77.58014,2017-03-05 18:00:00,18,0,1.0,1.0,1.0
Ordinary Theft,9/3/2017,20:00,12.9218,77.58027,2017-03-09 20:00:00,20,1,1.0,1.5,1.5
Ordinary Theft,25/04/2017,12:20,12.92338,77.58074,2017-04-25 12:20:00,12,0,1.0,1.0,1.0
Ordinary Theft,31/05/2017,13:00,12.9218,77.58027,2017-05-31 13:00:00,13,0,1.0,1.0,1.0
Ordinary Theft,1/6/2017,14:30,12.9184,77.58268,2017-06-01 14:30:00,14,0,1.0,1.0,1.0
Ordinary Theft,4/8/2017,16:30,12.92367,77.58014,2017-08-04 16:30:00,16,0,1.0,1.0,1.0
Ordinary Theft,9/10/2017,19:00,12.91945,77.58582,2017-10-09 19:00:00,19,1,1.0,1.5,1.5
Ordinary Theft,5/12/2017,11:50,12.92239,77.580757,2017-12-05 11:50:00,11,0,1.0,1.0,1.0
Ordinary Theft,15/12/2017,23:50,12.9167,77.59763,2017-12-15 23:50:00,23,1,1.0,1.5,1.5
Ordinary Theft,22/03/2017,0:45,12.92053,77.58274,2017-03-22 00:45:00,0,1,1.0,1.5,1.5
Ordinary Theft,29/08/2017,16:00,12.924885,77.586855,2017-08-29 16:00:00,16,0,1.0,1.0,1.0
Ordinary Theft,7/10/2017,17:00,12.92367,77.58014,2017-10-07 17:00:00,17,0,1.0,1.0,1.0
Ordinary Theft,13/01/2018,15:10,12.9218,77.58027,2018-01-13 15:10:00,15,0,1.0,1.0,1.0
Ordinary Theft,3/2/2018,14:00,12.91457,77.586042,2018-02-03 14:00:00,14,0,1.0,1.0,1.0
Ordinary Theft,17/04/2018,8:45,12.9184578,77.58458,2018-04-17 08:45:00,8,0,1.0,1.0,1.0
Ordinary Theft,21/04/2018,19:30,12.91945,77.58582,2018-04-21 19:30:00,19,1,1.0,1.5,1.5
Ordinary Theft,5/5/2018,14:30,12.92367,77.58014,2018-05-05 14:30:00,14,0,1.0,1.0,1.0
Ordinary Theft,16/05/2018,10:45,12.925458,77.57486,2018-05-16 10:45:00,10,0,1.0,1.0,1.0
Ordinary Theft,12/6/2018,19:30,12.92397,77.579678,2018-06-12 19:30:00,19,1,1.0,1.5,1.5
Ordinary Theft,23/06/2018,13:30,12.9309485,77.57875,2018-06-23 13:30:00,13,0,1.0,1.0,1.0
Ordinary Theft,25/06/2018,18:00,12.92847,77.585475,2018-06-25 18:00:00,18,0,1.0,1.0,1.0
Ordinary Theft,24/08/2018,15:30,12.93443,77.5927,2018-08-24 15:30:00,15,0,1.0,1.0,1.0
Ordinary Theft,15/10/2018,11:00,12.928748,777.583475,2018-10-15 11:00:00,11,0,1.0,1.0,1.0
Ordinary Theft,23/01/2018,12:05,12.925648,77.575869,2018-01-23 12:05:00,12,0,1.0,1.0,1.0
Ordinary Theft,10/9/2018,17:15,12.930911,77.578156,2018-09-10 17:15:00,17,0,1.0,1.0,1.0
Ordinary Theft,13/10/2018,17:30,12.925684,77.575458,2018-10-13 17:30:00,17,0,1.0,1.0,1.0
Ordinary Theft,9/2/2018,17:35,12.9235485,77.58948,2018-02-09 17:35:00,17,0,1.0,1.0,1.0
Ordinary Theft,27/02/2018,10:40,12.921645,77.580286,2018-02-27 10:40:00,10,0,1.0,1.0,1.0
Ordinary Theft,27/02/2018,11:00,12.921645,77.580286,2018-02-27 11:00:00,11,0,1.0,1.0,1.0
Ordinary Theft,27/02/2018,11:30,12.9145885,77.58514,2018-02-27 11:30:00,11,0,1.0,1.0,1.0
Ordinary Theft,27/02/2018,13:00,12.9145885,77.58514,2018-02-27 13:00:00,13,0,1.0,1.0,1.0
Ordinary Theft,11/11/2018,17:00,12.917775,77.5854769,2018-11-11 17:00:00,17,0,1.0,1.0,1.0
Ordinary Theft,8/1/2019,11:00,12.92861,77.58447,2019-01-08 11:00:00,11,0,1.0,1.0,1.0
Ordinary Theft,21/01/2019,14:00,12.91965,77.5924,2019-01-21 14:00:00,14,0,1.0,1.0,1.0
Ordinary Theft,26/01/2019,14:00,12.92385,77.576402,2019-01-26 14:00:00,14,0,1.0,1.0,1.0
Ordinary Theft,31/01/2019,10:00,12.92367,77.58014,2019-01-31 10:00:00,10,0,1.0,1.0,1.0
Ordinary Theft,14/02/2019,14:30,12.92367,77.58374,2019-02-14 14:30:00,14,0,1.0,1.0,1.0
Ordinary Theft,17/02/2019,11:00,12.914588,77.587654,2019-02-17 11:00:00,11,0,1.0,1.0,1.0
Ordinary Theft,24/02/2019,11:30,12.94247,77.55049,2019-02-24 11:30:00,11,0,1.0,1.0,1.0
Ordinary Theft,26/02/2019,10:00,12.92253,77.58589,2019-02-26 10:00:00,10,0,1.0,1.0,1.0
Ordinary Theft,02/03/2019,21:00,12.92847,77.58347,2019-03-02 21:00:00,21,1,1.0,1.5,1.5
Ordinary Theft,04/03/2019,22:00,12.92009,77.58204,2019-03-04 22:00:00,22,1,1.0,1.5,1.5
Ordinary Theft,15/03/2019,11:30,12.92861,77.58447,2019-03-15 11:30:00,11,0,1.0,1.0,1.0
Ordinary Theft,17/03/2019,12:00,12.93486,77.58008,2019-03-17 12:00:00,12,0,1.0,1.0,1.0
Ordinary Theft,04/04/2019,23:15,12.91921,77.57745,2019-04-04 23:15:00,23,1,1.0,1.5,1.5
Ordinary Theft,16/04/2019,23:45,12.92178,77.58074,2019-04-16 23:45:00,23,1,1.0,1.5,1.5
Ordinary Theft,24/04/2019,12:00,12.922657,77.589563,2019-04-24 12:00:00,12,0,1.0,1.0,1.0
Ordinary Theft,12/05/2019,11:30,12921652,77579288,2019-05-12 11:30:00,11,0,1.0,1.0,1.0
Ordinary Theft,26/05/2019,18:00,12921652,77579288,2019-05-26 18:00:00,18,0,1.0,1.0,1.0
Ordinary Theft,27/05/2019,18:30,12.92819,77.62512,2019-05-27 18:30:00,18,0,1.0,1.0,1.0
Ordinary Theft,20/06/2019,12:00,12.92253,77.58589,2019-06-20 12:00:00,12,0,1.0,1.0,1.0
Ordinary Theft,23/06/2019,17:00,12.92253,77.58589,2019-06-23 17:00:00,17,0,1.0,1.0,1.0
Ordinary Theft,08/07/2019,21:45,12.91953,77.57458,2019-07-08 21:45:00,21,1,1.0,1.5,1.5
Ordinary Theft,23/07/2019,19:00,12.28784,76.63313,2019-07-23 19:00:00,19,1,1.0,1.5,1.5
Ordinary Theft,14/08/2019,20:00,12.92253,77.58589,2019-08-14 20:00:00,20,1,1.0,1.5,1.5
Ordinary Theft,12/09/2019,11:00,12.92334,77.58484,2019-09-12 11:00:00,11,0,1.0,1.0,1.0
Ordinary Theft,27/09/2019,11:35,12.92875,77.5801,2019-09-27 11:35:00,11,0,1.0,1.0,1.0
Ordinary Theft,29/10/2019,20:30,12.928459,77.576972,2019-10-29 20:30:00,20,1,1.0,1.5,1.5
Ordinary Theft,13/11/2019,20:00,12.926192,77.586141,2019-11-13 20:00:00,20,1,1.0,1.5,1.5
Ordinary Theft,15/11/2019,18:00,12.91743,77.583465,2019-11-15 18:00:00,18,0,1.0,1.0,1.0
Ordinary Theft,05/12/2019,23:40,12.92367,77.58374,2019-12-05 23:40:00,23,1,1.0,1.5,1.5
Ordinary Theft,14/12/2019,12:00,12.92556,77.57561,2019-12-14 12:00:00,12,0,1.0,1.0,1.0
Ordinary Theft,03/02/2015,4:30,12.948212,77.562999,2015-02-03 04:30:00,4,1,1.0,1.5,1.5
Ordinary Theft,04/04/2015,14:15,12.565868,77.333824,2015-04-04 14:15:00,14,0,1.0,1.0,1.0
Ordinary Theft,15/04/2015,14:30,12.9522989999415,77.5644119997618,2015-04-15 14:30:00,14,0,1.0,1.0,1.0
Ordinary Theft,24/07/2015,17:30,12.94801,77.56771,2015-07-24 17:30:00,17,0,1.0,1.0,1.0
Ordinary Theft,23/10/2015,18:00,12.94801,77.56771,2015-10-23 18:00:00,18,0,1.0,1.0,1.0
Ordinary Theft,29/11/2015,17:00,12.9508,77.56371,2015-11-29 17:00:00,17,0,1.0,1.0,1.0
Ordinary Theft,15/02/2016,10:00,12.953286,77.561639,2016-02-15 10:00:00,10,0,1.0,1.0,1.0
Ordinary Theft,07/03/2016,13:00,12.95388,77.56341,2016-03-07 13:00:00,13,0,1.0,1.0,1.0
Ordinary Theft,08/09/2016,17:00,12.955074,77.562575,2016-09-08 17:00:00,17,0,1.0,1.0,1.0
Ordinary Theft,27/09/2016,18:00,12.9491686,77.5662899,2016-09-27 18:00:00,18,0,1.0,1.0,1.0
Ordinary Theft,07/01/2017,11:30,12.955174,77.567121,2017-01-07 11:30:00,11,0,1.0,1.0,1.0
Ordinary Theft,02/03/2017,14:30,12.956997,77.564332,2017-03-02 14:30:00,14,0,1.0,1.0,1.0
Ordinary Theft,26/04/2017,18:15,12.957033,77.564308,2017-04-26 18:15:00,18,0,1.0,1.0,1.0
Ordinary Theft,05/05/2017,18:15,12.95695346,77.56145099,2017-05-05 18:15:00,18,0,1.0,1.0,1.0
Ordinary Theft,22/09/2017,13:00,12.953503,77.56495,2017-09-22 13:00:00,13,0,1.0,1.0,1.0
Ordinary Theft,19/08/2017,11:00,12.948212,77.562999,2017-08-19 11:00:00,11,0,1.0,1.0,1.0
Ordinary Theft,15/11/2017,15:00,12.948212,77.562999,2017-11-15 15:00:00,15,0,1.0,1.0,1.0
Ordinary Theft,25/11/2017,11:45,12.948212,77.562999,2017-11-25 11:45:00,11,0,1.0,1.0,1.0
Ordinary Theft,27/12/2017,14:00,12.94896,77.56008,2017-12-27 14:00:00,14,0,1.0,1.0,1.0
Ordinary Theft,28/12/2017,15:00,12.94896,77.56008,2017-12-28 15:00:00,15,0,1.0,1.0,1.0
Ordinary Theft,17/01/2018,14:00,12.951642,77.567167,2018-01-17 14:00:00,14,0,1.0,1.0,1.0
Ordinary Theft,10/03/2018,19:00,12.95522,77.56742,2018-03-10 19:00:00,19,1,1.0,1.5,1.5
Ordinary Theft,29/05/2018,11:40,12.9491686,77.5662899,2018-05-29 11:40:00,11,0,1.0,1.0,1.0
Ordinary Theft,05/06/2018,20:30,12.94868,77.55791,2018-06-05 20:30:00,20,1,1.0,1.5,1.5
Ordinary Theft,25/06/2018,15:30,12.9542,77.56451,2018-06-25 15:30:00,15,0,1.0,1.0,1.0
Ordinary Theft,24/07/2018,10:45,12.95707,77.56642,2018-07-24 10:45:00,10,0,1.0,1.0,1.0
Ordinary Theft,07/08/2018,18:15,12.95521,77.56497,2018-08-07 18:15:00,18,0,1.0,1.0,1.0
Ordinary Theft,01/10/2018,14:30,12.9578264,77.55941741,2018-10-01 14:30:00,14,0,1.0,1.0,1.0
Ordinary Theft,22/10/2018,16:00,12.956997,77.564332,2018-10-22 16:00:00,16,0,1.0,1.0,1.0
Ordinary Theft,10/12/2018,15:10,12.94966,77.55928,2018-12-10 15:10:00,15,0,1.0,1.0,1.0
Ordinary Theft,16/02/2019,18:50,12.95709,77.56445,2019-02-16 18:50:00,18,0,1.0,1.0,1.0
Ordinary Theft,25/02/2019,17:00,12.955052,77.566014,2019-02-25 17:00:00,17,0,1.0,1.0,1.0
Ordinary Theft,21/03/2019,9:00,12.957028,77.565483,2019-03-21 09:00:00,9,0,1.0,1.0,1.0
Ordinary Theft,22/03/2019,17:30,12.957045,77.562861,2019-03-22 17:30:00,17,0,1.0,1.0,1.0
Ordinary Theft,20/07/2019,11:30,12.94973,77.56443,2019-07-20 11:30:00,11,0,1.0,1.0,1.0
Ordinary Theft,14/08/2017,16:30,12.9084615,77.5808686,2017-08-14 16:30:00,16,0,1.0,1.0,1.0
Ordinary Theft,17/08/2017,21:45,12.9187108,77.5856202,2017-08-17 21:45:00,21,1,1.0,1.5,1.5
Ordinary Theft,14/09/2017,12:00,12.9071899,77.5490795,2017-09-14 12:00:00,12,0,1.0,1.0,1.0
Ordinary Theft,19/09/2017,11:00,12.9155867,77.576883,2017-09-19 11:00:00,11,0,1.0,1.0,1.0
Ordinary Theft,20/09/2017,9:30,12.9068718,77.5705817,2017-09-20 09:30:00,9,0,1.0,1.0,1.0
Ordinary Theft,22/09/2017,10:30,12.9085532,77.5813653,2017-09-22 10:30:00,10,0,1.0,1.0,1.0
Ordinary Theft,22/09/2017,11:00,12.9054972,77.5732814,2017-09-22 11:00:00,11,0,1.0,1.0,1.0
Ordinary Theft,24/09/2017,13:30,12.9084481,77.5880616,2017-09-24 13:30:00,13,0,1.0,1.0,1.0
Ordinary Theft,15/10/2017,10:30,12.898444,77.5462742,2017-10-15 10:30:00,10,0,1.0,1.0,1.0
Ordinary Theft,17/10/2017,17:00,12.9070514,77.5826242,2017-10-17 17:00:00,17,0,1.0,1.0,1.0
Ordinary Theft,26/10/2017,12:00,12.887715,77.5673984,2017-10-26 12:00:00,12,0,1.0,1.0,1.0
Ordinary Theft,21/12/2017,12:20,12.909989,77.5850446,2017-12-21 12:20:00,12,0,1.0,1.0,1.0
Ordinary Theft,21/12/2017,12:40,12.9094052,77.5852783,2017-12-21 12:40:00,12,0,1.0,1.0,1.0
Ordinary Theft,25/12/2017,11:00,12.9138985,77.5922627,2017-12-25 11:00:00,11,0,1.0,1.0,1.0
Ordinary Theft,24/01/2018,13:00,12.9111604,77.582781,2018-01-24 13:00:00,13,0,1.0,1.0,1.0
Ordinary Theft,24/01/2018,15:00,12.9174923,77.5905657,2018-01-24 15:00:00,15,0,1.0,1.0,1.0
Ordinary Theft,20/02/2018,11:00,12.9093977,77.5743495,2018-02-20 11:00:00,11,0,1.0,1.0,1.0
Ordinary Theft,30/05/2018,19:00,12.9102953,77.6014317,2018-05-30 19:00:00,19,1,1.0,1.5,1.5
Ordinary Theft,15/06/2018,10:00,12.9109337,77.5768905,2018-06-15 10:00:00,10,0,1.0,1.0,1.0
Ordinary Theft,13/08/2018,20:50,12.9164782,77.5901863,2018-08-13 20:50:00,20,1,1.0,1.5,1.5
Ordinary Theft,16/12/2018,15:00,12.9121733,77.5904941,2018-12-16 15:00:00,15,0,1.0,1.0,1.0
Ordinary Theft,29/12/2018,13:00,12.9154502,77.5886665,2018-12-29 13:00:00,13,0,1.0,1.0,1.0
Ordinary Theft,18/01/2019,12:00,12.9144517,77.5801036,2019-01-18 12:00:00,12,0,1.0,1.0,1.0
Ordinary Theft,13/02/2019,18:00,12.9094787,77.5553333,2019-02-13 18:00:00,18,0,1.0,1.0,1.0
Ordinary Theft,16/08/2019,9:10,12.9117957,77.5826913,2019-08-16 09:10:00,9,0,1.0,1.0,1.0
Ordinary Theft,26/09/2019,10:45,12.9154896,77.594723,2019-09-26 10:45:00,10,0,1.0,1.0,1.0
Ordinary Theft,24/10/2019,18:00,12.9104019,77.5890694,2019-10-24 18:00:00,18,0,1.0,1.0,1.0
Ordinary Theft,25/11/2019,21:15,12.91152,77.5708782,2019-11-25 21:15:00,21,1,1.0,1.5,1.5
Ordinary Theft,29/12/2019,4:30,12.9142916,77.5909833,2019-12-29 04:30:00,4,1,1.0,1.5,1.5
Ordinary Theft,26/02/2015,13:30,12.91678611,77.56083333,2015-02-26 13:30:00,13,0,1.0,1.0,1.0
Ordinary Theft,11/3/2015,16:00,12.93115556,77.57611111,2015-03-11 16:00:00,16,0,1.0,1.0,1.0
Ordinary Theft,23/04/2015,14:00,12.92954722,77.56416667,2015-04-23 14:00:00,14,0,1.0,1.0,1.0
Ordinary Theft,23/06/2015,17:30,12.92588611,77.56416667,2015-06-23 17:30:00,17,0,1.0,1.0,1.0
Ordinary Theft,31/07/2015,14:45,12.92172222,77.57361111,2015-07-31 14:45:00,14,0,1.0,1.0,1.0
Ordinary Theft,24/08/2015,14:00,12.92793333,77.56527778,2015-08-24 14:00:00,14,0,1.0,1.0,1.0
Ordinary Theft,1/12/2015,17:00,12.92248611,77.595,2015-12-01 17:00:00,17,0,1.0,1.0,1.0
Ordinary Theft,17/12/2015,15:00,12.92558889,77.56305556,2015-12-17 15:00:00,15,0,1.0,1.0,1.0
Ordinary Theft,24/03/2016,12:00,12.92393889,77.56055556,2016-03-24 12:00:00,12,0,1.0,1.0,1.0
Ordinary Theft,11/4/2016,19:45,12.91854167,77.57138889,2016-04-11 19:45:00,19,1,1.0,1.5,1.5
Ordinary Theft,17/05/2016,10:30,12.92945278,77.57361111,2016-05-17 10:30:00,10,0,1.0,1.0,1.0
Ordinary Theft,22/05/2016,16:30,12.92393889,77.56055556,2016-05-22 16:30:00,16,0,1.0,1.0,1.0
Ordinary Theft,6/6/2016,18:00,12.91569722,77.55888889,2016-06-06 18:00:00,18,0,1.0,1.0,1.0
Ordinary Theft,4/7/2016,14:30,12.91569722,77.55888889,2016-07-04 14:30:00,14,0,1.0,1.0,1.0
Ordinary Theft,6/8/2016,16:00,12.91615833,77.57,2016-08-06 16:00:00,16,0,1.0,1.0,1.0
Ordinary Theft,25/08/2016,18:00,12.91566944,77.56166667,2016-08-25 18:00:00,18,0,1.0,1.0,1.0
Ordinary Theft,3/9/2016,13:00,12.92279444,77.57138889,2016-09-03 13:00:00,13,0,1.0,1.0,1.0
Ordinary Theft,19/09/2016,17:50,12.91837222,77.56638889,2016-09-19 17:50:00,17,0,1.0,1.0,1.0
Ordinary Theft,6/10/2016,11:30,"12°54'56.36""N","77°33'41.70""E",2016-10-06 11:30:00,11,0,1.0,1.0,1.0
Ordinary Theft,7/10/2016,10:30,"12°55'45.00""N","77°33'50.95""E",2016-10-07 10:30:00,10,0,1.0,1.0,1.0
Ordinary Theft,26/10/2016,20:45,"12°55'24.53""N","77°33'17.88""E",2016-10-26 20:45:00,20,1,1.0,1.5,1.5
Ordinary Theft,17/10/2016,17:20,"12°55'46.61""N","77°34'5.39""E",2016-10-17 17:20:00,17,0,1.0,1.0,1.0
Ordinary Theft,31/10/2016,17:00,"12°55'34.59""N","77°33'44.40""E",2016-10-31 17:00:00,17,0,1.0,1.0,1.0
Ordinary Theft,25/12/2016,15:00,"12°55'3.07""N","77°34'22.99""E",2016-12-25 15:00:00,15,0,1.0,1.0,1.0
Ordinary Theft,28/01/2017,21:00,"12°55'13.78""N","77°33'35.89""E",2017-01-28 21:00:00,21,1,1.0,1.5,1.5
Ordinary Theft,5/2/2017,9:30,"12°55'25.12""N","77°34'24.98""E",2017-02-05 09:30:00,9,0,1.0,1.0,1.0
Ordinary Theft,6/3/2017,17:15,"12°55'23.55""N","77°34'8.71""E",2017-03-06 17:15:00,17,0,1.0,1.0,1.0
Ordinary Theft,9/3/2017,14:40,12.87743,77.500191,2017-03-09 14:40:00,14,0,1.0,1.0,1.0
Ordinary Theft,12/5/2017,10:45,"38°57'33.85""N","95°15'55.75""",2017-05-12 10:45:00,10,0,1.0,1.0,1.0
Ordinary Theft,29/05/2017,15:00,"12°55'20.40""N",77°33'22.7,2017-05-29 15:00:00,15,0,1.0,1.0,1.0
Ordinary Theft,8/6/2017,13:30,"12°55'34.88""N","77°34'36.95""E",2017-06-08 13:30:00,13,0,1.0,1.0,1.0
Ordinary Theft,9/6/2017,16:00,"12°55'30.22""N","77°33'52.78""E.",2017-06-09 16:00:00,16,0,1.0,1.0,1.0
Ordinary Theft,16/06/2017,15:30,"12°55'39.46""N","77°34'13.94""E",2017-06-16 15:30:00,15,0,1.0,1.0,1.0
Ordinary Theft,1/9/2017,17:30,"38°57'33.85""N","95°15'55.75""",2017-09-01 17:30:00,17,0,1.0,1.0,1.0
Ordinary Theft,27/09/2017,17:30,"12°55'50.66""N","77°34'35.36""E",2017-09-27 17:30:00,17,0,1.0,1.0,1.0
Ordinary Theft,4/10/2017,18:30,40.0446,75.08734,2017-10-04 18:30:00,18,0,1.0,1.0,1.0
Ordinary Theft,1/12/2017,10:30,77.554811,12.91595,2017-12-01 10:30:00,10,0,1.0,1.0,1.0
Ordinary Theft,5/12/2017,14:00,"12°55'17.04""N","77°34'22.45""E",2017-12-05 14:00:00,14,0,1.0,1.0,1.0
Ordinary Theft,8/12/2017,22:45,"12°55'46.75""N","77°34'22.48""E",2017-12-08 22:45:00,22,1,1.0,1.5,1.5
Ordinary Theft,29/07/2018,11:45,12.92578,77.566693,2018-07-29 11:45:00,11,0,1.0,1.0,1.0
Ordinary Theft,21/09/2018,15:00,12.91762,77.55959,2018-09-21 15:00:00,15,0,1.0,1.0,1.0
Ordinary Theft,21/11/2018,11:00,16.864691,-79.553238,2018-11-21 11:00:00,11,0,1.0,1.0,1.0
Ordinary Theft,23/11/2018,13:30,16.864691,-79.553238,2018-11-23 13:30:00,13,0,1.0,1.0,1.0
Ordinary Theft,15/12/2018,13:30,12.94351,77.546,2018-12-15 13:30:00,13,0,1.0,1.0,1.0
Ordinary Theft,10/1/2019,19:00,12.91191,77.56723,2019-01-10 19:00:00,19,1,1.0,1.5,1.5
Ordinary Theft,1/2/2019,15:45,12.927296,77.56474,2019-02-01 15:45:00,15,0,1.0,1.0,1.0
Ordinary Theft,12/2/2019,16:10,33.92954,93.00935,2019-02-12 16:10:00,16,0,1.0,1.0,1.0
Ordinary Theft,27/03/2019,11:30,12.92666,77.54795,2019-03-27 11:30:00,11,0,1.0,1.0,1.0
Ordinary Theft,7/4/2019,15:00,12.92199,77.5692,2019-04-07 15:00:00,15,0,1.0,1.0,1.0
Ordinary Theft,20/04/2019,12:00,12.88999,77.5614,2019-04-20 12:00:00,12,0,1.0,1.0,1.0
Ordinary Theft,24/04/2019,11:00,12.97194,77.593689,2019-04-24 11:00:00,11,0,1.0,1.0,1.0
Ordinary Theft,11/8/2019,17:30,12.92804,77.562111,2019-08-11 17:30:00,17,0,1.0,1.0,1.0
Ordinary Theft,12/8/2019,11:45,12.92804,77.562111,2019-08-12 11:45:00,11,0,1.0,1.0,1.0
Ordinary Theft,17/06/2019,18:30,"12°55'52.16""N","77°34'33.62""E",2019-06-17 18:30:00,18,0,1.0,1.0,1.0
Ordinary Theft,26/09/2019,12:00,33.92954,93.00935,2019-09-26 12:00:00,12,0,1.0,1.0,1.0
Ordinary Theft,17/10/2019,11:00,12.9171403,77.5709063,2019-10-17 11:00:00,11,0,1.0,1.0,1.0
Ordinary Theft,15/12/2019,12:15,12.942789,77.5632,2019-12-15 12:15:00,12,0,1.0,1.0,1.0
Ordinary Theft,08/01/2015,9:30,12.942789,77.596405,2015-01-08 09:30:00,9,0,1.0,1.0,1.0
Ordinary Theft,11/01/2015,10:30,12.935919,77.585853,2015-01-11 10:30:00,10,0,1.0,1.0,1.0
Ordinary Theft,15/01/2015,12:30,12.935211,77.585661,2015-01-15 12:30:00,12,0,1.0,1.0,1.0
Ordinary Theft,18/01/2015,18:30,12.952192,77.585083,2015-01-18 18:30:00,18,0,1.0,1.0,1.0
Ordinary Theft,21/01/2015,16:30,12.942789,77.596405,2015-01-21 16:30:00,16,0,1.0,1.0,1.0
Ordinary Theft,21/01/2015,18:00,12.943529,77.58517,2015-01-21 18:00:00,18,0,1.0,1.0,1.0
Ordinary Theft,02/02/2015,15:00,12.941945,77.585178,2015-02-02 15:00:00,15,0,1.0,1.0,1.0
Ordinary Theft,20/02/2015,23:00,12.936654,77.585267,2015-02-20 23:00:00,23,1,1.0,1.5,1.5
Ordinary Theft,16/03/2015,19:00,12.943529,77.58517,2015-03-16 19:00:00,19,1,1.0,1.5,1.5
Ordinary Theft,20/03/2015,16:30,12.941945,77.585178,2015-03-20 16:30:00,16,0,1.0,1.0,1.0
Ordinary Theft,24/03/2015,18:00,12.941058,77.586061,2015-03-24 18:00:00,18,0,1.0,1.0,1.0
Ordinary Theft,27/03/2015,11:30,12.940924,77.580135,2015-03-27 11:30:00,11,0,1.0,1.0,1.0
Ordinary Theft,10/04/2015,13:30,12.952192,77.585083,2015-04-10 13:30:00,13,0,1.0,1.0,1.0
Ordinary Theft,13/04/2015,17:00,12.944089,77.597031,2015-04-13 17:00:00,17,0,1.0,1.0,1.0
Ordinary Theft,01/06/2015,10:30,12.952192,77.585083,2015-06-01 10:30:00,10,0,1.0,1.0,1.0
Ordinary Theft,15/06/2015,10:30,12.941116,77.587038,2015-06-15 10:30:00,10,0,1.0,1.0,1.0
Ordinary Theft,24/06/2015,14:00,12.939949,77.597681,2015-06-24 14:00:00,14,0,1.0,1.0,1.0
Ordinary Theft,11/07/2015,20:00,12.944009,77.59594,2015-07-11 20:00:00,20,1,1.0,1.5,1.5
Ordinary Theft,21/07/2015,20:00,12.948133,77.580087,2015-07-21 20:00:00,20,1,1.0,1.5,1.5
Ordinary Theft,28/07/2015,18:40,12.944045,77.597072,2015-07-28 18:40:00,18,0,1.0,1.0,1.0
Ordinary Theft,05/09/2015,17:00,12.944045,77.597072,2015-09-05 17:00:00,17,0,1.0,1.0,1.0
Ordinary Theft,06/09/2015,10:00,12.951199,77.591267,2015-09-06 10:00:00,10,0,1.0,1.0,1.0
Ordinary Theft,28/09/2015,13:00,12.944045,77.597072,2015-09-28 13:00:00,13,0,1.0,1.0,1.0
Ordinary Theft,06/10/2015,13:30,12.939261,77.585214,2015-10-06 13:30:00,13,0,1.0,1.0,1.0
Ordinary Theft,10/10/2015,10:30,12.938621,77.580436,2015-10-10 10:30:00,10,0,1.0,1.0,1.0
Ordinary Theft,30/10/2015,14:00,12.940924,77.580135,2015-10-30 14:00:00,14,0,1.0,1.0,1.0
Ordinary Theft,14/11/2015,6:00,12.941866,77.59739,2015-11-14 06:00:00,6,0,1.0,1.0,1.0
Ordinary Theft,17/11/2015,15:00,12.939172,77.594614,2015-11-17 15:00:00,15,0,1.0,1.0,1.0
Ordinary Theft,24/11/2015,19:00,12.944323,77.587775,2015-11-24 19:00:00,19,1,1.0,1.5,1.5
Ordinary Theft,03/12/2015,11:00,12.944045,77.597072,2015-12-03 11:00:00,11,0,1.0,1.0,1.0
Ordinary Theft,16/12/2015,10:50,12.945061,77.585683,2015-12-16 10:50:00,10,0,1.0,1.0,1.0
Ordinary Theft,29/12/2015,19:40,12.940163,77.597572,2015-12-29 19:40:00,19,1,1.0,1.5,1.5
Ordinary Theft,27/01/2016,10:30,12.950296,77.584509,2016-01-27 10:30:00,10,0,1.0,1.0,1.0
Ordinary Theft,27/01/2016,14:20,12.938784,77.593298,2016-01-27 14:20:00,14,0,1.0,1.0,1.0
Ordinary Theft,06/02/2016,21:30,12.942789,77.596405,2016-02-06 21:30:00,21,1,1.0,1.5,1.5
Ordinary Theft,08/02/2016,14:00,12.938784,77.593298,2016-02-08 14:00:00,14,0,1.0,1.0,1.0
Ordinary Theft,12/02/2016,11:00,12.941866,77.59739,2016-02-12 11:00:00,11,0,1.0,1.0,1.0
Ordinary Theft,24/03/2016,18:20,12.944045,77.597072,2016-03-24 18:20:00,18,0,1.0,1.0,1.0
Ordinary Theft,30/03/2016,14:00,12.938889,77.582073,2016-03-30 14:00:00,14,0,1.0,1.0,1.0
Ordinary Theft,13/04/2016,16:30,12.938784,77.593298,2016-04-13 16:30:00,16,0,1.0,1.0,1.0
Ordinary Theft,01/05/2016,23:30,12.951485,77.590503,2016-05-01 23:30:00,23,1,1.0,1.5,1.5
Ordinary Theft,01/05/2016,23:35,12.951485,77.590503,2016-05-01 23:35:00,23,1,1.0,1.5,1.5
Ordinary Theft,17/06/2016,13:00,12.939261,77.585214,2016-06-17 13:00:00,13,0,1.0,1.0,1.0
Ordinary Theft,19/06/2016,17:00,12.946087,77.588063,2016-06-19 17:00:00,17,0,1.0,1.0,1.0
Ordinary Theft,20/06/2016,15:00,12.94296,77.585117,2016-06-20 15:00:00,15,0,1.0,1.0,1.0
Ordinary Theft,26/06/2016,11:45,12.951485,77.590503,2016-06-26 11:45:00,11,0,1.0,1.0,1.0
Ordinary Theft,02/07/2016,12:00,12.940373,77.58702,2016-07-02 12:00:00,12,0,1.0,1.0,1.0
Ordinary Theft,27/08/2016,9:30,12.939543,77.584092,2016-08-27 09:30:00,9,0,1.0,1.0,1.0
Ordinary Theft,16/09/2016,11:00,12.940163,77.597572,2016-09-16 11:00:00,11,0,1.0,1.0,1.0
Ordinary Theft,24/07/2017,13:00,12.93455,77.588483,2017-07-24 13:00:00,13,0,1.0,1.0,1.0
Ordinary Theft,25/07/2017,17:30,12.935164,77.592701,2017-07-25 17:30:00,17,0,1.0,1.0,1.0
Ordinary Theft,19/10/2017,18:40,12.947819,77.593877,2017-10-19 18:40:00,18,0,1.0,1.0,1.0
Ordinary Theft,27/10/2017,12:30,12.953955,77.585205,2017-10-27 12:30:00,12,0,1.0,1.0,1.0
Ordinary Theft,07/11/2017,15:00,12.941771,77.585065,2017-11-07 15:00:00,15,0,1.0,1.0,1.0
Ordinary Theft,12/07/2018,13:00,12.947183,77.593819,2018-07-12 13:00:00,13,0,1.0,1.0,1.0
Ordinary Theft,07/08/2018,13:30,12.942983,77.583639,2018-08-07 13:30:00,13,0,1.0,1.0,1.0
Ordinary Theft,15/04/2019,13:00,12.94783,77.59203,2019-04-15 13:00:00,13,0,1.0,1.0,1.0
Ordinary Theft,03/09/2019,17:30,12.937991,77.598547,2019-09-03 17:30:00,17,0,1.0,1.0,1.0
Ordinary Theft,21/09/2019,20:00,12.951485,77.590503,2019-09-21 20:00:00,20,1,1.0,1.5,1.5
Ordinary Theft,25/10/2019,13:30,12.940004,77.597646,2019-10-25 13:30:00,13,0,1.0,1.0,1.0
Ordinary Theft,29/01/2015,23:45,12.88012131,77.55853349,2015-01-29 23:45:00,23,1,1.0,1.5,1.5
Ordinary Theft,2/2/2015,12:30,12.90716514,77.53591462,2015-02-02 12:30:00,12,0,1.0,1.0,1.0
Ordinary Theft,21/02/2015,16:15,12.88211726,77.55729374,2015-02-21 16:15:00,16,0,1.0,1.0,1.0
Ordinary Theft,28/02/2015,16:40,12.9057223,77.53558126,2015-02-28 16:40:00,16,0,1.0,1.0,1.0
Ordinary Theft,15/03/2015,17:30,12.9069403,77.53562112,2015-03-15 17:30:00,17,0,1.0,1.0,1.0
Ordinary Theft,23/03/2015,18:00,12.91396307,77.53932649,2015-03-23 18:00:00,18,0,1.0,1.0,1.0
Ordinary Theft,22/06/2015,18:50,12.8801656,77.57497677,2015-06-22 18:50:00,18,0,1.0,1.0,1.0
Ordinary Theft,3/7/2015,10:45,12.91390096,77.55882025,2015-07-03 10:45:00,10,0,1.0,1.0,1.0
Ordinary Theft,01/10/2015,18:40,12.88276934,77.55756281,2015-10-01 18:40:00,18,0,1.0,1.0,1.0
Ordinary Theft,17/10/2015,10:45,12.90626715,77.55057549,2015-10-17 10:45:00,10,0,1.0,1.0,1.0
Ordinary Theft,7/12/2015,11:30,12.88858018,77.56120326,2015-12-07 11:30:00,11,0,1.0,1.0,1.0
Ordinary Theft,26/11/2015,21:35,12.91147627,77.5401234,2015-11-26 21:35:00,21,1,1.0,1.5,1.5
Ordinary Theft,05/12/2015,23:10,12.88316724,77.55773978,2015-12-05 23:10:00,23,1,1.0,1.5,1.5
Ordinary Theft,07/12/2015,18:30,12.90645643,77.54253804,2015-12-07 18:30:00,18,0,1.0,1.0,1.0
Ordinary Theft,07/01/2016,17:40,12.90471042,77.54488816,2016-01-07 17:40:00,17,0,1.0,1.0,1.0
Ordinary Theft,23/02/2016,23:15,12.88683128,77.56992868,2016-02-23 23:15:00,23,1,1.0,1.5,1.5
Ordinary Theft,30/03/2016,8:40,12.88867402,77.57312221,2016-03-30 08:40:00,8,0,1.0,1.0,1.0
Ordinary Theft,1/4/2016,2:45,12.9066004,77.53756529,2016-04-01 02:45:00,2,1,1.0,1.5,1.5
Ordinary Theft,12/4/2016,6:00,12.8831411,77.56498259,2016-04-12 06:00:00,6,0,1.0,1.0,1.0
Ordinary Theft,7/5/2016,11:06,12.8941218,77.5507072,2016-05-07 11:06:00,11,0,1.0,1.0,1.0
Ordinary Theft,23/05/2016,16:00,12.86717163,77.58310043,2016-05-23 16:00:00,16,0,1.0,1.0,1.0
Ordinary Theft,23/05/2016,16:30,12.90931424,77.55526626,2016-05-23 16:30:00,16,0,1.0,1.0,1.0
Ordinary Theft,31/05/2016,13:50,12.90862205,77.55531561,2016-05-31 13:50:00,13,0,1.0,1.0,1.0
Ordinary Theft,29/08/2016,20:00,12.9057223,77.53558126,2016-08-29 20:00:00,20,1,1.0,1.5,1.5
Ordinary Theft,30/08/2016,17:00,12.90519495,77.54491162,2016-08-30 17:00:00,17,0,1.0,1.0,1.0
Ordinary Theft,27/09/2016,17:00,12.90795681,77.53644101,2016-09-27 17:00:00,17,0,1.0,1.0,1.0
Ordinary Theft,06/10/2016,18:30,12.87795004,77.53644101,2016-10-06 18:30:00,18,0,1.0,1.0,1.0
Ordinary Theft,21/10/2016,12:45,12.90626715,77.55057549,2016-10-21 12:45:00,12,0,1.0,1.0,1.0
Ordinary Theft,27/10/2016,18:40,12.87547634,77.57041839,2016-10-27 18:40:00,18,0,1.0,1.0,1.0
Ordinary Theft,27/12/2016,10:40,12.90616017,77.52982708,2016-12-27 10:40:00,10,0,1.0,1.0,1.0
Ordinary Theft,06/03/2017,14:00,12.91564682,77.53910415,2017-03-06 14:00:00,14,0,1.0,1.0,1.0
Ordinary Theft,04/04/2017,18:00,12.89537161,77.55032355,2017-04-04 18:00:00,18,0,1.0,1.0,1.0
Ordinary Theft,14/06/2017,13:45,12.8831411,77.56498259,2017-06-14 13:45:00,13,0,1.0,1.0,1.0
Ordinary Theft,15/06/2017,13:00,12.88992359,77.58079977,2017-06-15 13:00:00,13,0,1.0,1.0,1.0
Ordinary Theft,16/06/2017,11:30,12.904705,77.53011,2017-06-16 11:30:00,11,0,1.0,1.0,1.0
Ordinary Theft,16/07/2017,21:30,12.89977036,77.54865692,2017-07-16 21:30:00,21,1,1.0,1.5,1.5
Ordinary Theft,19/07/2017,10:00,12.9144943,77.55021425,2017-07-19 10:00:00,10,0,1.0,1.0,1.0
Ordinary Theft,25/07/2017,15:45,12.88296498,77.55735933,2017-07-25 15:45:00,15,0,1.0,1.0,1.0
Ordinary Theft,29/07/2017,10:30,12.9057223,77.53558126,2017-07-29 10:30:00,10,0,1.0,1.0,1.0
Ordinary Theft,16/08/2017,14:00,12.8831411,77.56498259,2017-08-16 14:00:00,14,0,1.0,1.0,1.0
Ordinary Theft,27/08/2017,17:15,12.88376625,77.56842522,2017-08-27 17:15:00,17,0,1.0,1.0,1.0
Ordinary Theft,05/10/2017,22:30,12.90958449,77.55159728,2017-10-05 22:30:00,22,1,1.0,1.5,1.5
Ordinary Theft,30/11/2017,11:30,12.88316724,77.55773978,2017-11-30 11:30:00,11,0,1.0,1.0,1.0
Ordinary Theft,6/2/2018,1:30,12.90590517,77.54273152,2018-02-06 01:30:00,1,1,1.0,1.5,1.5
Ordinary Theft,3/5/2018,4:45,12.87638468,77.57835281,2018-05-03 04:45:00,4,1,1.0,1.5,1.5
Ordinary Theft,20/05/2018,7:30,12.90809631,77.54853759,2018-05-20 07:30:00,7,0,1.0,1.0,1.0
Ordinary Theft,5/7/2018,9:30,12.89246857,77.57540769,2018-07-05 09:30:00,9,0,1.0,1.0,1.0
Ordinary Theft,17/07/2018,8:20,12.89108917,77.55497675,2018-07-17 08:20:00,8,0,1.0,1.0,1.0
Ordinary Theft,3/8/2018,5:30,12.91590055,77.54746898,2018-08-03 05:30:00,5,1,1.0,1.5,1.5
Ordinary Theft,1/10/2018,1:11,12.9057223,77.53558126,2018-10-01 01:11:00,1,1,1.0,1.5,1.5
Ordinary Theft,5/11/2018,10:30,12.9159205,77.53957438,2018-11-05 10:30:00,10,0,1.0,1.0,1.0
Ordinary Theft,11/12/2018,4:00,12.90657165,77.54644706,2018-12-11 04:00:00,4,1,1.0,1.5,1.5
Ordinary Theft,24/01/2019,6:30,12.88293147,77.56708988,2019-01-24 06:30:00,6,0,1.0,1.0,1.0
Ordinary Theft,11/2/2019,4:00,12.9069823,77.552059,2019-02-11 04:00:00,4,1,1.0,1.5,1.5
Ordinary Theft,12/2/2019,11:30,12.89900112,77.544042,2019-02-12 11:30:00,11,0,1.0,1.0,1.0
Ordinary Theft,12/2/2019,9:45,12.9069823,77.552059,2019-02-12 09:45:00,9,0,1.0,1.0,1.0
Ordinary Theft,24/05/2019,5:00,12.90912148,77.55154907,2019-05-24 05:00:00,5,1,1.0,1.5,1.5
Ordinary Theft,28/05/2019,10:30,12.91242363,77.54851768,2019-05-28 10:30:00,10,0,1.0,1.0,1.0
Ordinary Theft,5/7/2019,11:50,12.9057223,77.53558126,2019-07-05 11:50:00,11,0,1.0,1.0,1.0
Ordinary Theft,4/8/2019,5:30,12.91209012,77.54629226,2019-08-04 05:30:00,5,1,1.0,1.5,1.5
Ordinary Theft,12/9/2019,2:00,12.91119993,77.54670654,2019-09-12 02:00:00,2,1,1.0,1.5,1.5
Ordinary Theft,14/09/2019,7:00,12.91381524,77.54861884,2019-09-14 07:00:00,7,0,1.0,1.0,1.0
Ordinary Theft,17/10/2019,5:30,12.9057223,77.53558126,2019-10-17 05:30:00,5,1,1.0,1.5,1.5
Ordinary Theft,25/11/2019,9:00,12.8790848983184,77.5678096465074,2019-11-25 09:00:00,9,0,1.0,1.0,1.0
Ordinary Theft,15/01/2015,17:00,12.885537,77.542174,2015-01-15 17:00:00,17,0,1.0,1.0,1.0
Ordinary Theft,21/01/2015,12:00,12.898497,77.531456,2015-01-21 12:00:00,12,0,1.0,1.0,1.0
Ordinary Theft,04/02/2015,10:30,12.882547,77.531487,2015-02-04 10:30:00,10,0,1.0,1.0,1.0
Ordinary Theft,11/02/2015,10:30,12.894879,77.531497,2015-02-11 10:30:00,10,0,1.0,1.0,1.0
Ordinary Theft,24/04/2015,8:00,12.882457,77.534879,2015-04-24 08:00:00,8,0,1.0,1.0,1.0
Ordinary Theft,16/06/2015,10:00,12.894578,77.543257,2015-06-16 10:00:00,10,0,1.0,1.0,1.0
Ordinary Theft,21/06/2015,11:30,12.883578,77.546789,2015-06-21 11:30:00,11,0,1.0,1.0,1.0
Ordinary Theft,27/08/2015,20:10,12.897588,77.548791,2015-08-27 20:10:00,20,1,1.0,1.5,1.5
Ordinary Theft,28/08/2015,13:45,12.887891,77.545712,2015-08-28 13:45:00,13,0,1.0,1.0,1.0
Ordinary Theft,07/10/2015,19:00,12.882457,77.545721,2015-10-07 19:00:00,19,1,1.0,1.5,1.5
Ordinary Theft,04/11/2015,13:00,12.892457,77.565478,2015-11-04 13:00:00,13,0,1.0,1.0,1.0
Ordinary Theft,04/11/2015,13:00,12.882487,77.545321,2015-11-04 13:00:00,13,0,1.0,1.0,1.0
Ordinary Theft,28/11/2015,11:00,12.875461,77.545211,2015-11-28 11:00:00,11,0,1.0,1.0,1.0
Ordinary Theft,21/12/2015,15:00,12.887489,77.546881,2015-12-21 15:00:00,15,0,1.0,1.0,1.0
Ordinary Theft,16/01/2016,12:30,12.894781,77.546621,2016-01-16 12:30:00,12,0,1.0,1.0,1.0
Ordinary Theft,25/01/2016,12:40,12.889541,77.546913,2016-01-25 12:40:00,12,0,1.0,1.0,1.0
Ordinary Theft,04/02/2016,13:00,12.891231,77.543871,2016-02-04 13:00:00,13,0,1.0,1.0,1.0
Ordinary Theft,18/02/2016,11:45,12.88381,77.546289,2016-02-18 11:45:00,11,0,1.0,1.0,1.0
Ordinary Theft,25/02/2016,19:00,12.893471,77.552697,2016-02-25 19:00:00,19,1,1.0,1.5,1.5
Ordinary Theft,29/02/2016,11:00,12.882138,77.542211,2016-02-29 11:00:00,11,0,1.0,1.0,1.0
Ordinary Theft,03/03/2016,11:30,12.884451,77.546187,2016-03-03 11:30:00,11,0,1.0,1.0,1.0
Ordinary Theft,20/03/2016,19:00,12.872431,77.546971,2016-03-20 19:00:00,19,1,1.0,1.5,1.5
Ordinary Theft,22/03/2016,14:30,12.88591,77.546978,2016-03-22 14:30:00,14,0,1.0,1.0,1.0
Ordinary Theft,14/04/2016,21:40,12.88112,77.54662,2016-04-14 21:40:00,21,1,1.0,1.5,1.5
Ordinary Theft,21/05/2016,18:00,12.894257,77.54691,2016-05-21 18:00:00,18,0,1.0,1.0,1.0
Ordinary Theft,19/11/2016,12:00,12.883891,77.5413,2016-11-19 12:00:00,12,0,1.0,1.0,1.0
Ordinary Theft,29/12/2016,15:20,12.884496,77.541287,2016-12-29 15:20:00,15,0,1.0,1.0,1.0
Ordinary Theft,29/01/2017,22:30,12.875419,77.551481,2017-01-29 22:30:00,22,1,1.0,1.5,1.5
Ordinary Theft,04/02/2017,10:00,12.882148,77.545514,2017-02-04 10:00:00,10,0,1.0,1.0,1.0
Ordinary Theft,21/02/2017,14:30,12.885124,77.546871,2017-02-21 14:30:00,14,0,1.0,1.0,1.0
Ordinary Theft,21/02/2017,12:00,12.881133,77.541236,2017-02-21 12:00:00,12,0,1.0,1.0,1.0
Ordinary Theft,26/08/2017,21:00,12.889457,77.541887,2017-08-26 21:00:00,21,1,1.0,1.5,1.5
Ordinary Theft,26/10/2017,15:15,12.881137,77.54461,2017-10-26 15:15:00,15,0,1.0,1.0,1.0
Ordinary Theft,05/12/2017,15:00,12.881497,77.54487,2017-12-05 15:00:00,15,0,1.0,1.0,1.0
Ordinary Theft,05/12/2017,16:30,12.88991,77.544001,2017-12-05 16:30:00,16,0,1.0,1.0,1.0
Ordinary Theft,07/12/2017,18:00,12.881128,77.541978,2017-12-07 18:00:00,18,0,1.0,1.0,1.0
Ordinary Theft,19/12/2017,13:00,12.876128,77.546139,2017-12-19 13:00:00,13,0,1.0,1.0,1.0
Ordinary Theft,05/01/2018,21:00,12.881276,77.5546123,2018-01-05 21:00:00,21,1,1.0,1.5,1.5
Ordinary Theft,02/05/2018,10:15,12.894438,77.559917,2018-05-02 10:15:00,10,0,1.0,1.0,1.0
Ordinary Theft,20/06/2018,13:00,12.884297,77.543971,2018-06-20 13:00:00,13,0,1.0,1.0,1.0
Ordinary Theft,29/10/2018,14:00,12.894781,77.546913,2018-10-29 14:00:00,14,0,1.0,1.0,1.0
Ordinary Theft,11/11/2018,13:00,12.884331,77.549177,2018-11-11 13:00:00,13,0,1.0,1.0,1.0
Ordinary Theft,30/12/2018,10:00,12.89771,77.551288,2018-12-30 10:00:00,10,0,1.0,1.0,1.0
Ordinary Theft,06/07/2018,18:30,12.886114,77.554697,2018-07-06 18:30:00,18,0,1.0,1.0,1.0
Ordinary Theft,04/03/2019,23:30,12.88921,77.546991,2019-03-04 23:30:00,23,1,1.0,1.5,1.5
Ordinary Theft,27/06/2019,14:30,12.879241,77.54813,2019-06-27 14:30:00,14,0,1.0,1.0,1.0
Ordinary Theft,13/08/2019,17:00,12.88411,77.548118,2019-08-13 17:00:00,17,0,1.0,1.0,1.0
Ordinary Theft,26/10/2019,14:45,12.897001,77.55416,2019-10-26 14:45:00,14,0,1.0,1.0,1.0
Ordinary Theft,30/10/2019,19:00,12.87161,77.54891,2019-10-30 19:00:00,19,1,1.0,1.5,1.5
Ordinary Theft,07/01/2017,12:30,12.861944,77.589989,2017-01-07 12:30:00,12,0,1.0,1.0,1.0
Ordinary Theft,07/03/2017,17:00,12.881514,77.565853,2017-03-07 17:00:00,17,0,1.0,1.0,1.0
Ordinary Theft,18/03/2017,19:00,12.885954,77.575194,2017-03-18 19:00:00,19,1,1.0,1.5,1.5
Ordinary Theft,20/04/2017,16:00,12.88365,77.567108,2017-04-20 16:00:00,16,0,1.0,1.0,1.0
Ordinary Theft,02/07/2017,13:40,12.8890144,77.581716,2017-07-02 13:40:00,13,0,1.0,1.0,1.0
Ordinary Theft,18/08/2017,20:45,12.854933,77.588491,2017-08-18 20:45:00,20,1,1.0,1.5,1.5
Ordinary Theft,22/08/2017,15:40,12.882116,77.574506,2017-08-22 15:40:00,15,0,1.0,1.0,1.0
Ordinary Theft,20/09/2017,18:15,12.88207,77.57099,2017-09-20 18:15:00,18,0,1.0,1.0,1.0
Ordinary Theft,06/10/2017,18:25,12.884707,77.55162,2017-10-06 18:25:00,18,0,1.0,1.0,1.0
Ordinary Theft,07/10/2017,7:35,12.892301,77.570581,2017-10-07 07:35:00,7,0,1.0,1.0,1.0
Ordinary Theft,01/12/2017,14:00,12.86121,77.579766,2017-12-01 14:00:00,14,0,1.0,1.0,1.0
Ordinary Theft,08/12/2017,19:15,12.884707,77.55162,2017-12-08 19:15:00,19,1,1.0,1.5,1.5
Ordinary Theft,14/01/2018,10:00,12.884587,77.569498,2018-01-14 10:00:00,10,0,1.0,1.0,1.0
Ordinary Theft,10/02/2018,19:30,12.845696,77.584186,2018-02-10 19:30:00,19,1,1.0,1.5,1.5
Ordinary Theft,12/02/2018,20:20,12.845696,77.584186,2018-02-12 20:20:00,20,1,1.0,1.5,1.5
Ordinary Theft,14/02/2018,11:30,12.883196,77.566016,2018-02-14 11:30:00,11,0,1.0,1.0,1.0
Ordinary Theft,07/03/2018,18:30,12.891883,77.5783,2018-03-07 18:30:00,18,0,1.0,1.0,1.0
Ordinary Theft,21/03/2018,12:00,12.869362,77.581945,2018-03-21 12:00:00,12,0,1.0,1.0,1.0
Ordinary Theft,24/05/2018,11:00,12.87046,77.557984,2018-05-24 11:00:00,11,0,1.0,1.0,1.0
Ordinary Theft,10/07/2018,11:00,12.89046,77.567984,2018-07-10 11:00:00,11,0,1.0,1.0,1.0
Ordinary Theft,23/07/2018,12:00,12.856442,77.589423,2018-07-23 12:00:00,12,0,1.0,1.0,1.0
Ordinary Theft,30/10/2018,19:05,12.866,77.580872,2018-10-30 19:05:00,19,1,1.0,1.5,1.5
Ordinary Theft,18/12/2018,11:00,12.885353,77.567029,2018-12-18 11:00:00,11,0,1.0,1.0,1.0
Ordinary Theft,11/03/2019,15:00,12.885016,77.577965,2019-03-11 15:00:00,15,0,1.0,1.0,1.0
Ordinary Theft,21/04/2019,14:00,12.885887,77.566884,2019-04-21 14:00:00,14,0,1.0,1.0,1.0
Ordinary Theft,03/07/2019,19:00,12.884592,77.551678,2019-07-03 19:00:00,19,1,1.0,1.5,1.5
Ordinary Theft,10/08/2019,18:30,12.888167,77.570945,2019-08-10 18:30:00,18,0,1.0,1.0,1.0
Ordinary Theft,21/09/2019,13:00,12.887851,77.573581,2019-09-21 13:00:00,13,0,1.0,1.0,1.0
Ordinary Theft,1/5/2015,14:30,12.8996965673904,77.5716115576741,2015-05-01 14:30:00,14,0,1.0,1.0,1.0
Ordinary Theft,1/7/2015,13:00,12.8928133912158,77.5666300513369,2015-07-01 13:00:00,13,0,1.0,1.0,1.0
Ordinary Theft,4/3/2015,14:15,12.9008927627643,77.5698813716385,2015-03-04 14:15:00,14,0,1.0,1.0,1.0
Ordinary Theft,5/11/2015,11:30,12.9076945341477,77.5719852228203,2015-11-05 11:30:00,11,0,1.0,1.0,1.0
Ordinary Theft,6/9/2015,12:45,12.9084899772541,77.5597687026855,2015-09-06 12:45:00,12,0,1.0,1.0,1.0
Ordinary Theft,9/1/2015,15:00,12.8966729945995,77.5607513795297,2015-01-09 15:00:00,15,0,1.0,1.0,1.0
Ordinary Theft,12/4/2015,15:30,12.8928133912158,77.5666300513369,2015-04-12 15:30:00,15,0,1.0,1.0,1.0
Ordinary Theft,12/8/2015,10:00,12.9094534210642,77.5650951734528,2015-08-12 10:00:00,10,0,1.0,1.0,1.0
Ordinary Theft,14/01/2016,13:00,12.9072110220065,77.569757509609,2016-01-14 13:00:00,13,0,1.0,1.0,1.0
Ordinary Theft,25/01/2016,10:30,12.9166716189819,77.5734553925553,2016-01-25 10:30:00,10,0,1.0,1.0,1.0
Ordinary Theft,03/02/2016,21:30,12.9011494733062,77.5706465675149,2016-02-03 21:30:00,21,1,1.0,1.5,1.5
Ordinary Theft,07/02/2016,21:15,12.9058822540435,77.5714810872207,2016-02-07 21:15:00,21,1,1.0,1.5,1.5
Ordinary Theft,19/02/2016,15:45,12.9124182556892,77.5641048370764,2016-02-19 15:45:00,15,0,1.0,1.0,1.0
Ordinary Theft,04/03/2016,14:20,12.8928133912158,77.5666300513369,2016-03-04 14:20:00,14,0,1.0,1.0,1.0
Ordinary Theft,04/03/2016,14:35,12.8928133912158,77.5666300513369,2016-03-04 14:35:00,14,0,1.0,1.0,1.0
Ordinary Theft,21/03/2016,13:15,12.9021874622456,77.5726241709647,2016-03-21 13:15:00,13,0,1.0,1.0,1.0
Ordinary Theft,18/04/2016,9:10,12.8985572712756,77.5691445545836,2016-04-18 09:10:00,9,0,1.0,1.0,1.0
Ordinary Theft,16/05/2016,20:00,12.9026072787272,77.5614887435773,2016-05-16 20:00:00,20,1,1.0,1.5,1.5
Ordinary Theft,18/06/2016,21:30,12.9106184436134,77.5668939212685,2016-06-18 21:30:00,21,1,1.0,1.5,1.5
Ordinary Theft,26/06/2016,10:00,12.9076945341477,77.5719852228203,2016-06-26 10:00:00,10,0,1.0,1.0,1.0
Ordinary Theft,11/07/2016,13:30,12.8928133912158,77.5666300513369,2016-07-11 13:30:00,13,0,1.0,1.0,1.0
Ordinary Theft,18/07/2016,14:00,12.9045264921368,77.5661519120365,2016-07-18 14:00:00,14,0,1.0,1.0,1.0
Ordinary Theft,28/09/2016,17:30,12.9020804066762,77.5651518006063,2016-09-28 17:30:00,17,0,1.0,1.0,1.0
Ordinary Theft,07/10/2016,14:00,12.9021874622456,77.5726241709647,2016-10-07 14:00:00,14,0,1.0,1.0,1.0
Ordinary Theft,11/10/2016,13:00,12.9124182556892,77.5641048370764,2016-10-11 13:00:00,13,0,1.0,1.0,1.0
Ordinary Theft,15/10/2016,11:30,12.8928133912158,77.5666300513369,2016-10-15 11:30:00,11,0,1.0,1.0,1.0
Ordinary Theft,21/10/2016,23:40,12.9085203452405,77.5725265251381,2016-10-21 23:40:00,23,1,1.0,1.5,1.5
Ordinary Theft,31/10/2016,15:00,12.9085203452405,77.5725265251381,2016-10-31 15:00:00,15,0,1.0,1.0,1.0
Ordinary Theft,14/12/2016,17:20,12.895284445528,77.5662128659953,2016-12-14 17:20:00,17,0,1.0,1.0,1.0
Ordinary Theft,15/12/2016,15:00,12.898358820125,77.5613959011009,2016-12-15 15:00:00,15,0,1.0,1.0,1.0
Ordinary Theft,23/12/2016,14:00,12.8928133912158,77.5666300513369,2016-12-23 14:00:00,14,0,1.0,1.0,1.0
Ordinary Theft,1/6/2017,16:00,12.9166716189819,77.5734553925553,2017-06-01 16:00:00,16,0,1.0,1.0,1.0
Ordinary Theft,1/12/2017,14:15,12.8928133912158,77.5666300513369,2017-12-01 14:15:00,14,0,1.0,1.0,1.0
Ordinary Theft,4/7/2017,3:00,12.8928133912158,77.5666300513369,2017-07-04 03:00:00,3,1,1.0,1.5,1.5
Ordinary Theft,4/11/2017,14:00,12.898358820125,77.5613959011009,2017-11-04 14:00:00,14,0,1.0,1.0,1.0
Ordinary Theft,12/6/2018,22:00,12.9109359450741,77.5646696875901,2018-06-12 22:00:00,22,1,1.0,1.5,1.5
Ordinary Theft,12/8/2018,12:30,12.8999136414243,77.5724909471076,2018-08-12 12:30:00,12,0,1.0,1.0,1.0
Ordinary Theft,1/11/2019,17:20,12.8928133912158,77.5666300513369,2019-11-01 17:20:00,17,0,1.0,1.0,1.0
Ordinary Theft,2/2/2019,19:00,12.898358820125,77.5613959011009,2019-02-02 19:00:00,19,1,1.0,1.5,1.5
Ordinary Theft,11/2/2019,12:45,12.8903442323649,77.5642779498096,2019-02-11 12:45:00,12,0,1.0,1.0,1.0
Ordinary Theft,30/12/2019,1:30,12.95142,77.558217,2019-12-30 01:30:00,1,1,1.0,1.5,1.5
Ordinary Theft,5/3/2015,20:25,12.9548104164414,77.5678155931017,2015-03-05 20:25:00,20,1,1.0,1.5,1.5
Ordinary Theft,16/07/2015,20:45,12.95501377,77.5702211,2015-07-16 20:45:00,20,1,1.0,1.5,1.5
Ordinary Theft,27/08/2015,15:00,12.95682,77.56796,2015-08-27 15:00:00,15,0,1.0,1.0,1.0
Ordinary Theft,15/09/2015,7:30,12.95568836,77.56907015,2015-09-15 07:30:00,7,0,1.0,1.0,1.0
Ordinary Theft,7/10/2015,12:15,12.95682,77.56796,2015-10-07 12:15:00,12,0,1.0,1.0,1.0
Ordinary Theft,11/10/2015,15:00,12.95682,77.56796,2015-10-11 15:00:00,15,0,1.0,1.0,1.0
Ordinary Theft,30/10/2015,17:30,12.95176411,77.56840735,2015-10-30 17:30:00,17,0,1.0,1.0,1.0
Ordinary Theft,19/02/2016,12:30,12.94951,77.5674,2016-02-19 12:30:00,12,0,1.0,1.0,1.0
Ordinary Theft,20/07/2016,15:00,12.95682,77.56796,2016-07-20 15:00:00,15,0,1.0,1.0,1.0
Ordinary Theft,17/03/2017,14:30,12.95682,77.56796,2017-03-17 14:30:00,14,0,1.0,1.0,1.0
Ordinary Theft,05/08/2017,12:30,12.95289,77.57194,2017-08-05 12:30:00,12,0,1.0,1.0,1.0
Ordinary Theft,19/11/2017,18:00,12.95682,77.56796,2017-11-19 18:00:00,18,0,1.0,1.0,1.0
Ordinary Theft,26/11/2017,17:15,12.94946,77.5713,2017-11-26 17:15:00,17,0,1.0,1.0,1.0
Ordinary Theft,5/6/2018,11:00,12.94946,77.5713,2018-06-05 11:00:00,11,0,1.0,1.0,1.0
Ordinary Theft,29/11/2018,15:00,12.95722,77.57187,2018-11-29 15:00:00,15,0,1.0,1.0,1.0
Ordinary Theft,12/06/2019,11:45,12.950731,77.568905,2019-06-12 11:45:00,11,0,1.0,1.0,1.0
Ordinary Theft,12/01/2015,12:45,12.95072643,77.57692629,2015-01-12 12:45:00,12,0,1.0,1.0,1.0
Ordinary Theft,2/2/2015,20:45,12.94103,77.5482,2015-02-02 20:45:00,20,1,1.0,1.5,1.5
Ordinary Theft,19/02/2015,16:15,12.938832,77.55328,2015-02-19 16:15:00,16,0,1.0,1.0,1.0
Ordinary Theft,12/3/2015,12:30,12.934955,77.566136,2015-03-12 12:30:00,12,0,1.0,1.0,1.0
Ordinary Theft,1/4/2015,12:00,12.94103,77.5482,2015-04-01 12:00:00,12,0,1.0,1.0,1.0
Ordinary Theft,11/4/2015,19:00,12.938832,77.55328,2015-04-11 19:00:00,19,1,1.0,1.5,1.5
Ordinary Theft,12/5/2015,14:15,12.938832,77.55328,2015-05-12 14:15:00,14,0,1.0,1.0,1.0
Ordinary Theft,20/05/2015,16:45,12.938832,77.55328,2015-05-20 16:45:00,16,0,1.0,1.0,1.0
Ordinary Theft,8/8/2015,21:30,12.938822,77.55128,2015-08-08 21:30:00,21,1,1.0,1.5,1.5
Ordinary Theft,31/08/2015,20:25,12.938102,77.55128,2015-08-31 20:25:00,20,1,1.0,1.5,1.5
Ordinary Theft,22/09/2015,13:00,12.948832,77.55328,2015-09-22 13:00:00,13,0,1.0,1.0,1.0
Ordinary Theft,8/10/2015,3:00,12.938722,77.55128,2015-10-08 03:00:00,3,1,1.0,1.5,1.5
Ordinary Theft,4/12/2015,10:20,12.938832,77.55328,2015-12-04 10:20:00,10,0,1.0,1.0,1.0
Ordinary Theft,8/12/2015,17:00,12.938822,77.55328,2015-12-08 17:00:00,17,0,1.0,1.0,1.0
Ordinary Theft,29/12/2015,18:30,12.938822,77.55328,2015-12-29 18:30:00,18,0,1.0,1.0,1.0
Ordinary Theft,8/1/2016,11:00,12.938822,77.55328,2016-01-08 11:00:00,11,0,1.0,1.0,1.0
Ordinary Theft,25/01/2016,22:30,12.938822,77.55328,2016-01-25 22:30:00,22,1,1.0,1.5,1.5
Ordinary Theft,28/01/2016,16:00,12.938822,77.55328,2016-01-28 16:00:00,16,0,1.0,1.0,1.0
Ordinary Theft,20/02/2016,11:15,12.938832,77.55328,2016-02-20 11:15:00,11,0,1.0,1.0,1.0
Ordinary Theft,29/02/2016,10:30,12.938832,77.55328,2016-02-29 10:30:00,10,0,1.0,1.0,1.0
Ordinary Theft,12/3/2016,11:10,12.937832,77.55328,2016-03-12 11:10:00,11,0,1.0,1.0,1.0
Ordinary Theft,26/05/2016,13:00,12.937832,77.55329,2016-05-26 13:00:00,13,0,1.0,1.0,1.0
Ordinary Theft,30/05/2016,20:30,12.937832,77.55329,2016-05-30 20:30:00,20,1,1.0,1.5,1.5
Ordinary Theft,20/08/2016,15:00,12.938102,77.55128,2016-08-20 15:00:00,15,0,1.0,1.0,1.0
Ordinary Theft,22/09/2016,17:00,12.94103,77.5482,2016-09-22 17:00:00,17,0,1.0,1.0,1.0
Ordinary Theft,24/11/2016,14:30,12.94103,77.5482,2016-11-24 14:30:00,14,0,1.0,1.0,1.0
Ordinary Theft,27/12/2016,10:30,12.94103,77.5482,2016-12-27 10:30:00,10,0,1.0,1.0,1.0
Ordinary Theft,9/1/2017,15:30,12.934955,77.566136,2017-01-09 15:30:00,15,0,1.0,1.0,1.0
Ordinary Theft,10/1/2017,16:00,12.934955,77.566136,2017-01-10 16:00:00,16,0,1.0,1.0,1.0
Ordinary Theft,23/01/2017,21:00,12.934855,77.566137,2017-01-23 21:00:00,21,1,1.0,1.5,1.5
Ordinary Theft,8/2/2017,17:00,12.934955,77.566138,2017-02-08 17:00:00,17,0,1.0,1.0,1.0
Ordinary Theft,20/02/2017,14:30,12.934955,77.566139,2017-02-20 14:30:00,14,0,1.0,1.0,1.0
Ordinary Theft,25/02/2017,21:20,12.934955,77.56614,2017-02-25 21:20:00,21,1,1.0,1.5,1.5
Ordinary Theft,1/4/2017,10:30,12.94103,77.5482,2017-04-01 10:30:00,10,0,1.0,1.0,1.0
Ordinary Theft,10/6/2017,19:00,12.934955,77.566138,2017-06-10 19:00:00,19,1,1.0,1.5,1.5
Ordinary Theft,30/06/2017,3:00,12.94103,77.5482,2017-06-30 03:00:00,3,1,1.0,1.5,1.5
Ordinary Theft,7/8/2017,16:30,12.94103,77.5482,2017-08-07 16:30:00,16,0,1.0,1.0,1.0
Ordinary Theft,10/11/2017,7:30,12.934955,77.566138,2017-11-10 07:30:00,7,0,1.0,1.0,1.0
Ordinary Theft,16/12/2017,15:00,12.94103,77.5482,2017-12-16 15:00:00,15,0,1.0,1.0,1.0
Ordinary Theft,26/01/2018,13:45,12.94103,77.5482,2018-01-26 13:45:00,13,0,1.0,1.0,1.0
Ordinary Theft,22/02/2018,15:30,12.934955,77.566138,2018-02-22 15:30:00,15,0,1.0,1.0,1.0
Ordinary Theft,20/06/2018,14:00,12.94103,77.5482,2018-06-20 14:00:00,14,0,1.0,1.0,1.0
Ordinary Theft,12/8/2018,23:30,12.937832,77.55328,2018-08-12 23:30:00,23,1,1.0,1.5,1.5
Ordinary Theft,9/10/2018,9:45,12.94103,77.5482,2018-10-09 09:45:00,9,0,1.0,1.0,1.0
Ordinary Theft,18/10/2018,13:15,12.937932,77.55328,2018-10-18 13:15:00,13,0,1.0,1.0,1.0
Ordinary Theft,15/03/2019,18:00,12.934955,77.566138,2019-03-15 18:00:00,18,0,1.0,1.0,1.0
Ordinary Theft,8/4/2019,21:15,12.934955,77.566138,2019-04-08 21:15:00,21,1,1.0,1.5,1.5
Ordinary Theft,7/5/2019,13:15,12.94103,77.5482,2019-05-07 13:15:00,13,0,1.0,1.0,1.0
Ordinary Theft,21/05/2019,19:00,12.934955,77.566138,2019-05-21 19:00:00,19,1,1.0,1.5,1.5
Ordinary Theft,1/6/2019,23:30,12.94103,77.5482,2019-06-01 23:30:00,23,1,1.0,1.5,1.5
Ordinary Theft,10/10/2019,18:00,12.934955,77.566138,2019-10-10 18:00:00,18,0,1.0,1.0,1.0
Ordinary Theft,26/11/2019,10:30,12.94103,77.5482,2019-11-26 10:30:00,10,0,1.0,1.0,1.0
Ordinary Theft,27/11/2019,20:00,12.934955,77.566138,2019-11-27 20:00:00,20,1,1.0,1.5,1.5
Ordinary Theft,02/01/2015,19:00,12.926291,77.547338,2015-01-02 19:00:00,19,1,1.0,1.5,1.5
Ordinary Theft,18/02/2015,9:00,12.928179,77.55161,2015-02-18 09:00:00,9,0,1.0,1.0,1.0
Ordinary Theft,24/03/2015,15:20,12.928197,77.550652,2015-03-24 15:20:00,15,0,1.0,1.0,1.0
Ordinary Theft,10/04/2015,11:00,12.935006,77.5437545,2015-04-10 11:00:00,11,0,1.0,1.0,1.0
Ordinary Theft,24/04/2015,11:00,12.930121,77.560592,2015-04-24 11:00:00,11,0,1.0,1.0,1.0
Ordinary Theft,21/05/2015,15:00,12.946995,77.552044,2015-05-21 15:00:00,15,0,1.0,1.0,1.0
Ordinary Theft,17/06/2015,21:00,12.930147,77.560524,2015-06-17 21:00:00,21,1,1.0,1.5,1.5
Ordinary Theft,22/06/2015,18:00,12.923311,77.549288,2015-06-22 18:00:00,18,0,1.0,1.0,1.0
Ordinary Theft,21/07/2015,12:45,12.934049,77.548061,2015-07-21 12:45:00,12,0,1.0,1.0,1.0
Ordinary Theft,06/09/2015,9:00,12.928378,77.556654,2015-09-06 09:00:00,9,0,1.0,1.0,1.0
Ordinary Theft,21/09/2015,12:30,12.921303,77.549263,2015-09-21 12:30:00,12,0,1.0,1.0,1.0
Ordinary Theft,24/02/2016,11:00,12.925561,77.554801,2016-02-24 11:00:00,11,0,1.0,1.0,1.0
Ordinary Theft,26/05/2016,22:42,12.926701,77.56077,2016-05-26 22:42:00,22,1,1.0,1.5,1.5
Ordinary Theft,23/06/2016,11:00,12.930108,77.560549,2016-06-23 11:00:00,11,0,1.0,1.0,1.0
Ordinary Theft,8/11/2016,15:30,12.92320855,77.550565,2016-11-08 15:30:00,15,0,1.0,1.0,1.0
Ordinary Theft,07/12/2016,12:00,12. 928365,77.556668,2016-12-07 12:00:00,12,0,1.0,1.0,1.0
Ordinary Theft,10/12/2016,14:45,12.923029,77.553841,2016-12-10 14:45:00,14,0,1.0,1.0,1.0
Ordinary Theft,16/01/2017,17:00,12.930108,77.560549,2017-01-16 17:00:00,17,0,1.0,1.0,1.0
Ordinary Theft,18/01/2017,12:30,12.930108,77.560549,2017-01-18 12:30:00,12,0,1.0,1.0,1.0
Ordinary Theft,22/01/2017,15:30,12.930106,77.555115,2017-01-22 15:30:00,15,0,1.0,1.0,1.0
Ordinary Theft,05/04/2017,23:15,12.925223,77.550043,2017-04-05 23:15:00,23,1,1.0,1.5,1.5
Ordinary Theft,27/04/2017,14:45,12.925255,77.550376,2017-04-27 14:45:00,14,0,1.0,1.0,1.0
Ordinary Theft,19/08/2017,10:30,12.928742,77.556882,2017-08-19 10:30:00,10,0,1.0,1.0,1.0
Ordinary Theft,20/08/2017,6:30,12.92286,77.543799,2017-08-20 06:30:00,6,0,1.0,1.0,1.0
Ordinary Theft,22/08/2017,9:30,12.93079,77.774284,2017-08-22 09:30:00,9,0,1.0,1.0,1.0
Ordinary Theft,13/9/2017,10:15,12.922719,77.559596,2017-09-13 10:15:00,10,0,1.0,1.0,1.0
Ordinary Theft,16/6/2017,3:00,12.929455,77.55393,2017-06-16 03:00:00,3,1,1.0,1.5,1.5
Ordinary Theft,19/9/2017,12:45,12.928169,77.556016,2017-09-19 12:45:00,12,0,1.0,1.0,1.0
Ordinary Theft,24/9/2017,10:00,12.924486,77.55189,2017-09-24 10:00:00,10,0,1.0,1.0,1.0
Ordinary Theft,24/9/2017,2:30,12.922643,77.532899,2017-09-24 02:30:00,2,1,1.0,1.5,1.5
Ordinary Theft,27/9/2017,10:00,12.923575,77.553426,2017-09-27 10:00:00,10,0,1.0,1.0,1.0
Ordinary Theft,24/11/2017,10:30,12.93424856,77.560608,2017-11-24 10:30:00,10,0,1.0,1.0,1.0
Ordinary Theft,26/11/2017,11:15,12.925357,77.551042,2017-11-26 11:15:00,11,0,1.0,1.0,1.0
Ordinary Theft,18/01/2018,3:30,12.926615,77.559433,2018-01-18 03:30:00,3,1,1.0,1.5,1.5
Ordinary Theft,23/01/2018,7:00,12.922988,77.543718,2018-01-23 07:00:00,7,0,1.0,1.0,1.0
Ordinary Theft,22/02/2018,3:30,12.925671,77.548944,2018-02-22 03:30:00,3,1,1.0,1.5,1.5
Ordinary Theft,24/02/2018,2:00,12.925293,77.549804,2018-02-24 02:00:00,2,1,1.0,1.5,1.5
Ordinary Theft,21/03/2018,10:50,12.926135,77.550311,2018-03-21 10:50:00,10,0,1.0,1.0,1.0
Ordinary Theft,17/08/2018,7:30,12.932048,77.549266,2018-08-17 07:30:00,7,0,1.0,1.0,1.0
Ordinary Theft,23/08/2018,9:15,12.928496,77.545938,2018-08-23 09:15:00,9,0,1.0,1.0,1.0
Ordinary Theft,29/08/2018,12:15,12.919309,77.53946,2018-08-29 12:15:00,12,0,1.0,1.0,1.0
Ordinary Theft,31/08/2018,10:30,12.027957,77.632495,2018-08-31 10:30:00,10,0,1.0,1.0,1.0
Ordinary Theft,22/11/2018,11:50,12.923881,77.553337,2018-11-22 11:50:00,11,0,1.0,1.0,1.0
Ordinary Theft,17/12/2018,5:30,12.923268,77.5479842,2018-12-17 05:30:00,5,1,1.0,1.5,1.5
Ordinary Theft,22/02/2019,6:37,12.928504,77.562012,2019-02-22 06:37:00,6,0,1.0,1.0,1.0
Ordinary Theft,27/02/2019,10:00,12.923777,77.553303,2019-02-27 10:00:00,10,0,1.0,1.0,1.0
Ordinary Theft,27/05/2019,2:00,12.924268,77.551878,2019-05-27 02:00:00,2,1,1.0,1.5,1.5
Kidnap,24/02/2016,13:30,12.544211,77.342996,2016-02-24 13:30:00,13,0,1.0,1.0,1.0
Kidnap,1/9/2016,12:35,12.926974,77.576626,2016-09-01 12:35:00,12,0,1.0,1.0,1.0
Kidnap,9/1/2017,11:20,12.919712,77.575901,2017-01-09 11:20:00,11,0,1.0,1.0,1.0
Kidnap,13/09/2017,16:00,12.912479,77.574069,2017-09-13 16:00:00,16,0,1.0,1.0,1.0
Kidnap,24/10/2017,12:45,12.922032,77.575659,2017-10-24 12:45:00,12,0,1.0,1.0,1.0
Kidnap,31/10/2017,18:15,12.933466,77.584554,2017-10-31 18:15:00,18,0,1.0,1.0,1.0
Kidnap,20/03/2018,13:00,12.929851,77.585404,2018-03-20 13:00:00,13,0,1.0,1.0,1.0
Kidnap,10/4/2018,16:15,12.932018,77.586094,2018-04-10 16:15:00,16,0,1.0,1.0,1.0
Kidnap,24/04/2018,11:00,12.91974,77.578194,2018-04-24 11:00:00,11,0,1.0,1.0,1.0
Kidnap,29/07/2018,17:00,12.922096,77.57601,2018-07-29 17:00:00,17,0,1.0,1.0,1.0
Kidnap,2/11/2018,10:00,13.08022,80.16636,2018-11-02 10:00:00,10,0,1.0,1.0,1.0
Kidnap,30/03/2019,20:45,12.93091,77.57812,2019-03-30 20:45:00,20,1,1.0,1.5,1.5
Kidnap,27/06/2019,21:30,12.935478,77.589671,2019-06-27 21:30:00,21,1,1.0,1.5,1.5
Kidnap,10/8/2019,18:00,12.92924,77.57816,2019-08-10 18:00:00,18,0,1.0,1.0,1.0
Kidnap,19/11/2019,20:30,12.2879,76.63267,2019-11-19 20:30:00,20,1,1.0,1.5,1.5
Kidnap,20/11/2019,16:00,12.28792,76.63243,2019-11-20 16:00:00,16,0,1.0,1.0,1.0
Kidnap,18/07/2015,20:45,12.943265,77.574663,2015-07-18 20:45:00,20,1,1.0,1.5,1.5
Kidnap,26/11/2015,18:15,12.940063,77.573045,2015-11-26 18:15:00,18,0,1.0,1.0,1.0
Kidnap,30/11/2015,23:50,12.940191,77.568224,2015-11-30 23:50:00,23,1,1.0,1.5,1.5
Kidnap,19/12/2015,20:45,12.947992,77.573527,2015-12-19 20:45:00,20,1,1.0,1.5,1.5
Kidnap,13/01/2016,12:30,12.94156,77.567074,2016-01-13 12:30:00,12,0,1.0,1.0,1.0
Kidnap,28/03/2017,14:00,12.563457,77.343049,2017-03-28 14:00:00,14,0,1.0,1.0,1.0
Kidnap,25/06/2017,14:30,12.9402772,77.572097,2017-06-25 14:30:00,14,0,1.0,1.0,1.0
Kidnap,16/10/2017,21:10,12.93543,77.5668,2017-10-16 21:10:00,21,1,1.0,1.5,1.5
Kidnap,26/12/2017,17:00,12.943663,77.574706,2017-12-26 17:00:00,17,0,1.0,1.0,1.0
Kidnap,19/07/2018,22:30,12.944817,77.578516,2018-07-19 22:30:00,22,1,1.0,1.5,1.5
Kidnap,16/02/2019,10:40,12.941435,77.571215,2019-02-16 10:40:00,10,0,1.0,1.0,1.0
Kidnap,14/01/2015,4:10,12.906409,77.5714701,2015-01-14 04:10:00,4,1,1.0,1.5,1.5
Kidnap,24/08/2015,7:30,12.8976927,77.5808958,2015-08-24 07:30:00,7,0,1.0,1.0,1.0
Kidnap,24/09/2015,3:05,12.8977965,77.5836728,2015-09-24 03:05:00,3,1,1.0,1.5,1.5
Kidnap,24/12/2015,1:45,12.9059617,77.5793992,2015-12-24 01:45:00,1,1,1.0,1.5,1.5
Kidnap,30/12/2015,5:05,12.8986817,77.5690523,2015-12-30 05:05:00,5,1,1.0,1.5,1.5
Kidnap,23/01/2016,1:00,12.8980073,77.5939724,2016-01-23 01:00:00,1,1,1.0,1.5,1.5
Kidnap,14/04/2016,6:10,12.8842378,77.5595444,2016-04-14 06:10:00,6,0,1.0,1.0,1.0
Kidnap,17/08/2016,3:25,12.9052883,77.5764984,2016-08-17 03:25:00,3,1,1.0,1.5,1.5
Kidnap,18/08/2016,8:30,12.9096707,77.5790691,2016-08-18 08:30:00,8,0,1.0,1.0,1.0
Kidnap,25/12/2016,9:30,12.911281,77.5902845,2016-12-25 09:30:00,9,0,1.0,1.0,1.0
Kidnap,28/01/2017,4:00,12.915219,77.5818953,2017-01-28 04:00:00,4,1,1.0,1.5,1.5
Kidnap,28/09/2018,4:00,12.9085194,77.5796617,2018-09-28 04:00:00,4,1,1.0,1.5,1.5
Kidnap,17/11/2018,4:00,12.9085194,77.5796617,2018-11-17 04:00:00,4,1,1.0,1.5,1.5
Kidnap,17/11/2018,4:45,12.9096936,77.5792533,2018-11-17 04:45:00,4,1,1.0,1.5,1.5
Kidnap,13/12/2018,4:25,12.9074697,77.5904753,2018-12-13 04:25:00,4,1,1.0,1.5,1.5
Kidnap,19/12/2018,10:00,12.9085194,77.5796617,2018-12-19 10:00:00,10,0,1.0,1.0,1.0
Kidnap,20/08/2019,12:00,12.9107582,77.5767422,2019-08-20 12:00:00,12,0,1.0,1.0,1.0
Kidnap,21/11/2019,8:35,12.9117832,77.5929617,2019-11-21 08:35:00,8,0,1.0,1.0,1.0
Kidnap,10/1/2015,14:30,"12°55'26.37""N","77°33'58.47""E",2015-01-10 14:30:00,14,0,1.0,1.0,1.0
Kidnap,27/02/2015,20:00,"12°55'23.21""N","77°34'24.43""E",2015-02-27 20:00:00,20,1,1.0,1.5,1.5
Kidnap,12/5/2015,23:30,"12°55'1.27""N","77°34'0.73""E",2015-05-12 23:30:00,23,1,1.0,1.5,1.5
Kidnap,19/05/2015,16:00,"12°55'8.27""N","77°33'13.36""E",2015-05-19 16:00:00,16,0,1.0,1.0,1.0
Kidnap,20/05/2015,13:30,"12°54'55.47""N","77°33'51.42""E",2015-05-20 13:30:00,13,0,1.0,1.0,1.0
Kidnap,4/6/2015,13:00,"12°55'29.54""N","77°33'58.47""E",2015-06-04 13:00:00,13,0,1.0,1.0,1.0
Kidnap,7/6/2015,12:00,"12°55'47.58""N","77°34'11.89""E",2015-06-07 12:00:00,12,0,1.0,1.0,1.0
Kidnap,13/06/2015,9:30,"12°55'47.58""N","77°34'11.89""E",2015-06-13 09:30:00,9,0,1.0,1.0,1.0
Kidnap,10/8/2018,9:30,"12°55'28.58""N","77°34'13.00""E",2018-08-10 09:30:00,9,0,1.0,1.0,1.0
Kidnap,12/8/2015,18:30,"12°55'2.56""N","77°34'4.39""E",2015-08-12 18:30:00,18,0,1.0,1.0,1.0
Kidnap,29/12/2018,10:30,12.9261268,77.575693,2018-12-29 10:30:00,10,0,1.0,1.0,1.0
Kidnap,10/10/2015,9:30,"12°55'39.92""N","77°33'36.54""E",2015-10-10 09:30:00,9,0,1.0,1.0,1.0
Kidnap,4/12/2015,1:45,"12°55'24.84""N","77°34'12.01""E",2015-12-04 01:45:00,1,1,1.0,1.5,1.5
Kidnap,7/1/2016,17:00,"12°55'46.75""N","77°34'22.48""E",2016-01-07 17:00:00,17,0,1.0,1.0,1.0
Kidnap,1/2/2016,20:30,"12°55'3.68""N","77°34'25.08""",2016-02-01 20:30:00,20,1,1.0,1.5,1.5
Kidnap,8/2/2016,4:30,"12°55'38.24""N","77°34'21.35""E",2016-02-08 04:30:00,4,1,1.0,1.5,1.5
Kidnap,28/02/2016,12:30,"12°55'42.02""","77°33'38.32""E",2016-02-28 12:30:00,12,0,1.0,1.0,1.0
Kidnap,27/03/2016,14:20,"12°54'55.98""N","77°33'57.88""E",2016-03-27 14:20:00,14,0,1.0,1.0,1.0
Kidnap,6/4/2016,19:45,"12°55'39.92""N","77°33'36.54""E",2016-04-06 19:45:00,19,1,1.0,1.5,1.5
Kidnap,13/04/2016,13:00,"12°55'24.84""N","77°34'12.01""E",2016-04-13 13:00:00,13,0,1.0,1.0,1.0
Kidnap,8/5/2016,21:30,"12°55'2.88""","77°33'58.55""E",2016-05-08 21:30:00,21,1,1.0,1.5,1.5
Kidnap,20/05/2016,17:00,"12°55'24.84""N","77°34'12.01""E",2016-05-20 17:00:00,17,0,1.0,1.0,1.0
Kidnap,5/7/2016,13:45,"12°55'12.00""N","77°34'18.51""E",2016-07-05 13:45:00,13,0,1.0,1.0,1.0
Kidnap,5/7/2016,14:15,"12°55'12.00""N","77°34'18.51""E",2016-07-05 14:15:00,14,0,1.0,1.0,1.0
Kidnap,20/07/2016,10:30,"12°54'55.47""N","77°33'51.42""E",2016-07-20 10:30:00,10,0,1.0,1.0,1.0
Kidnap,23/07/2016,18:30,"12°54'55.47""N","77°33'51.42""E",2016-07-23 18:30:00,18,0,1.0,1.0,1.0
Kidnap,10/9/2016,17:30,"12°54'56.05""N","77°33'24.38""E",2016-09-10 17:30:00,17,0,1.0,1.0,1.0
Kidnap,5/9/2017,20:15,"12°55'0.66""","77°33'20.78""E",2017-09-05 20:15:00,20,1,1.0,1.5,1.5
Kidnap,28/10/2016,20:20,"12°54'59.92""N","77°33'50.71""E",2016-10-28 20:20:00,20,1,1.0,1.5,1.5
Kidnap,18/11/2016,15:00,"12°55'12.00""N","77°34'18.51""E",2016-11-18 15:00:00,15,0,1.0,1.0,1.0
Kidnap,25/12/2016,12:30,"12°55'10.75""N","77°34'26.57""E",2016-12-25 12:30:00,12,0,1.0,1.0,1.0
Kidnap,6/1/2017,0:30,"12°55'39.46""N","77°34'13.94""E",2017-01-06 00:30:00,0,1,1.0,1.5,1.5
Kidnap,16/01/2017,13:00,12.551022,77.334785,2017-01-16 13:00:00,13,0,1.0,1.0,1.0
Kidnap,24/05/2017,20:45,"12°55'3.58""N","77°34'23.78""E",2017-05-24 20:45:00,20,1,1.0,1.5,1.5
Kidnap,19/06/2017,16:00,"12°55'10.19""N","77°33'53.36""E",2017-06-19 16:00:00,16,0,1.0,1.0,1.0
Kidnap,5/9/2017,14:00,"12°55'24.84""N","77°34'12.01""E",2017-09-05 14:00:00,14,0,1.0,1.0,1.0
Kidnap,15/11/2017,17:00,"12°55'45.40""N","77°34'25.14""E",2017-11-15 17:00:00,17,0,1.0,1.0,1.0
Kidnap,22/03/2018,13:00,"12°54'56.05""N","77°33'24.38""E",2018-03-22 13:00:00,13,0,1.0,1.0,1.0
Kidnap,8/5/2018,4:30,"12°54'56.05""N","77°33'24.38""E",2018-05-08 04:30:00,4,1,1.0,1.5,1.5
Kidnap,4/6/2015,14:30,"12°55'29.54""N","77°33'58.47""E",2015-06-04 14:30:00,14,0,1.0,1.0,1.0
Kidnap,23/06/2018,15:00,"12°55'21.52""N","77°34'2.75""E",2018-06-23 15:00:00,15,0,1.0,1.0,1.0
Kidnap,10/8/2018,15:40,"12°55'28.58""N","77°34'13.00""E",2018-08-10 15:40:00,15,0,1.0,1.0,1.0
Kidnap,11/10/2018,21:00,12.9261268,77.575693,2018-10-11 21:00:00,21,1,1.0,1.5,1.5
Kidnap,25/10/2018,11:30,12.94355,77.60976,2018-10-25 11:30:00,11,0,1.0,1.0,1.0
Kidnap,10/11/2018,8:45,"12°54'49.09""N","77°33'18.54""E",2018-11-10 08:45:00,8,0,1.0,1.0,1.0
Kidnap,29/12/2018,18:30,12.9261268,77.575693,2018-12-29 18:30:00,18,0,1.0,1.0,1.0
Kidnap,18/07/2019,21:30,"12°54'56.05""N","77°33'24.38""E",2019-07-18 21:30:00,21,1,1.0,1.5,1.5
Kidnap,4/5/2015,15:30,12.934299,77.591433,2015-05-04 15:30:00,15,0,1.0,1.0,1.0
Kidnap,13/06/2015,19:30,12.946052,77.591889,2015-06-13 19:30:00,19,1,1.0,1.5,1.5
Kidnap,13/07/2015,18:45,12.944562,77.592138,2015-07-13 18:45:00,18,0,1.0,1.0,1.0
Kidnap,29/08/2015,11:00,12.936308,77.593096,2015-08-29 11:00:00,11,0,1.0,1.0,1.0
Kidnap,4/9/2015,13:00,12.934135,77.591152,2015-09-04 13:00:00,13,0,1.0,1.0,1.0
Kidnap,15/01/2016,12:30,12.934263,77.592712,2016-01-15 12:30:00,12,0,1.0,1.0,1.0
Kidnap,23/02/2016,12:40,12.943446,77.594168,2016-02-23 12:40:00,12,0,1.0,1.0,1.0
Kidnap,30/03/2016,11:10,12.946683,77.594379,2016-03-30 11:10:00,11,0,1.0,1.0,1.0
Kidnap,16/06/2016,14:00,12.936308,77.593096,2016-06-16 14:00:00,14,0,1.0,1.0,1.0
Kidnap,15/07/2016,17:30,12.943578,77.591104,2016-07-15 17:30:00,17,0,1.0,1.0,1.0
Kidnap,28/07/2016,15:00,12.942478,77.589838,2016-07-28 15:00:00,15,0,1.0,1.0,1.0
Kidnap,17/10/2016,18:30,12.942789,77.596405,2016-10-17 18:30:00,18,0,1.0,1.0,1.0
Kidnap,7/1/2017,8:20,12.936244,77.596173,2017-01-07 08:20:00,8,0,1.0,1.0,1.0
Kidnap,29/04/2017,22:05,12.945109,77.592747,2017-04-29 22:05:00,22,1,1.0,1.5,1.5
Kidnap,1/5/2017,18:00,12.946168,77.591807,2017-05-01 18:00:00,18,0,1.0,1.0,1.0
Kidnap,4/7/2017,17:00,12.942161,77.592299,2017-07-04 17:00:00,17,0,1.0,1.0,1.0
Kidnap,8/7/2017,15:00,12.945109,77.592747,2017-07-08 15:00:00,15,0,1.0,1.0,1.0
Kidnap,17/07/2017,20:00,12.935645,77.591333,2017-07-17 20:00:00,20,1,1.0,1.5,1.5
Kidnap,24/10/2017,17:00,12.945109,77.592747,2017-10-24 17:00:00,17,0,1.0,1.0,1.0
Kidnap,5/2/2018,20:00,12.940933,77.580283,2018-02-05 20:00:00,20,1,1.0,1.5,1.5
Kidnap,30/04/2018,14:00,12.940022,77.594191,2018-04-30 14:00:00,14,0,1.0,1.0,1.0
Kidnap,17/05/2018,16:00,12.944786,77.592797,2018-05-17 16:00:00,16,0,1.0,1.0,1.0
Kidnap,4/7/2018,10:00,12.942787,77.58337,2018-07-04 10:00:00,10,0,1.0,1.0,1.0
Kidnap,19/09/2018,14:30,12.936244,77.596173,2018-09-19 14:30:00,14,0,1.0,1.0,1.0
Kidnap,24/07/2019,14:00,12.935678,77.597567,2019-07-24 14:00:00,14,0,1.0,1.0,1.0
Kidnap,5/9/2019,12:00,12.933417,77.590693,2019-09-05 12:00:00,12,0,1.0,1.0,1.0
Kidnap,16/09/2019,16:00,12.942787,77.58337,2019-09-16 16:00:00,16,0,1.0,1.0,1.0
Kidnap,16/11/2019,18:00,12.944786,77.592797,2019-11-16 18:00:00,18,0,1.0,1.0,1.0
Kidnap,9/1/2015,5:00,12.90353394,77.54124559,2015-01-09 05:00:00,5,1,1.0,1.5,1.5
Kidnap,24/02/2015,18:15,12.91094209,77.5562327,2015-02-24 18:15:00,18,0,1.0,1.0,1.0
Kidnap,12/3/2015,9:15,12.9060275,77.54555561,2015-03-12 09:15:00,9,0,1.0,1.0,1.0
Kidnap,8/5/2015,14:20,12.91147627,77.5401234,2015-05-08 14:20:00,14,0,1.0,1.0,1.0
Kidnap,12/6/2015,11:45,12.88273731,77.55652345,2015-06-12 11:45:00,11,0,1.0,1.0,1.0
Kidnap,18/08/2015,13:00,12.88289563,77.56647782,2015-08-18 13:00:00,13,0,1.0,1.0,1.0
Kidnap,1/9/2015,15:00,12.90557877,77.55645958,2015-09-01 15:00:00,15,0,1.0,1.0,1.0
Kidnap,15/10/2015,14:10,12.91429834,77.55075847,2015-10-15 14:10:00,14,0,1.0,1.0,1.0
Kidnap,26/10/2015,16:00,12.88982145,77.57974701,2015-10-26 16:00:00,16,0,1.0,1.0,1.0
Kidnap,30/10/2015,10:00,12.90795681,77.53644101,2015-10-30 10:00:00,10,0,1.0,1.0,1.0
Kidnap,20/11/2015,12:00,12.8894463,77.57152367,2015-11-20 12:00:00,12,0,1.0,1.0,1.0
Kidnap,7/12/2015,17:50,12.90874577,77.55546611,2015-12-07 17:50:00,17,0,1.0,1.0,1.0
Kidnap,16/12/2015,1:00,12.91766067,77.57653512,2015-12-16 01:00:00,1,1,1.0,1.5,1.5
Kidnap,24/03/2016,17:50,12.91242363,77.54851768,2016-03-24 17:50:00,17,0,1.0,1.0,1.0
Kidnap,30/03/2016,22:10,12.89153086,77.58114868,2016-03-30 22:10:00,22,1,1.0,1.5,1.5
Kidnap,12/4/2016,13:30,12.88948381,77.56232091,2016-04-12 13:30:00,13,0,1.0,1.0,1.0
Kidnap,13/04/2016,22:50,12.89153086,77.58114868,2016-04-13 22:50:00,22,1,1.0,1.5,1.5
Kidnap,21/04/2016,3:30,12.88168453,77.56599502,2016-04-21 03:30:00,3,1,1.0,1.5,1.5
Kidnap,2/5/2016,5:00,12.89047086,77.57081006,2016-05-02 05:00:00,5,1,1.0,1.5,1.5
Kidnap,9/5/2016,14:00,12.89157884,77.58142943,2016-05-09 14:00:00,14,0,1.0,1.0,1.0
Kidnap,16/05/2016,10:30,12.8894463,77.57152367,2016-05-16 10:30:00,10,0,1.0,1.0,1.0
Kidnap,18/05/2016,17:40,12.8967726,77.5445644,2016-05-18 17:40:00,17,0,1.0,1.0,1.0
Kidnap,23/05/2016,18:30,12.91684492,77.54985732,2016-05-23 18:30:00,18,0,1.0,1.0,1.0
Kidnap,2/6/2016,7:30,12.89594801,77.55219028,2016-06-02 07:30:00,7,0,1.0,1.0,1.0
Kidnap,7/6/2016,10:00,12.87685568,77.58185534,2016-06-07 10:00:00,10,0,1.0,1.0,1.0
Kidnap,25/06/2016,14:00,12.88274382,77.55727251,2016-06-25 14:00:00,14,0,1.0,1.0,1.0
Kidnap,18/07/2016,20:00,12.88376625,77.56842522,2016-07-18 20:00:00,20,1,1.0,1.5,1.5
Kidnap,22/07/2016,13:00,12.88613796,77.5717955,2016-07-22 13:00:00,13,0,1.0,1.0,1.0
Kidnap,12/11/2016,10:45,12.89138852,77.57009241,2016-11-12 10:45:00,10,0,1.0,1.0,1.0
Kidnap,26/12/2016,13:50,12.90711393,77.5439924,2016-12-26 13:50:00,13,0,1.0,1.0,1.0
Kidnap,17/01/2017,16:30,12.88255509,77.5563552,2017-01-17 16:30:00,16,0,1.0,1.0,1.0
Kidnap,6/2/2017,11:00,12.89528068,77.55067452,2017-02-06 11:00:00,11,0,1.0,1.0,1.0
Kidnap,21/02/2017,12:30,12.90827601,77.55022679,2017-02-21 12:30:00,12,0,1.0,1.0,1.0
Kidnap,22/02/2017,11:30,12.89189796,77.55236918,2017-02-22 11:30:00,11,0,1.0,1.0,1.0
Kidnap,25/03/2017,14:00,12.89043496,77.5635394,2017-03-25 14:00:00,14,0,1.0,1.0,1.0
Kidnap,28/03/2017,12:45,12.88613796,77.5717955,2017-03-28 12:45:00,12,0,1.0,1.0,1.0
Kidnap,26/04/2017,16:00,12.91429834,77.55075847,2017-04-26 16:00:00,16,0,1.0,1.0,1.0
Kidnap,5/5/2017,17:00,12.89594801,77.55219028,2017-05-05 17:00:00,17,0,1.0,1.0,1.0
Kidnap,31/05/2017,23:00,12.87236619,77.56684297,2017-05-31 23:00:00,23,1,1.0,1.5,1.5
Kidnap,10/9/2017,8:30,12.91900624,77.5453977,2017-09-10 08:30:00,8,0,1.0,1.0,1.0
Kidnap,8/10/2017,17:45,12.91242457,77.53558039,2017-10-08 17:45:00,17,0,1.0,1.0,1.0
Kidnap,9/11/2017,12:30,12.904705,77.53011,2017-11-09 12:30:00,12,0,1.0,1.0,1.0
Kidnap,14/02/2018,23:00,12.90657165,77.54644706,2018-02-14 23:00:00,23,1,1.0,1.5,1.5
Kidnap,19/02/2018,15:30,12.88023219,77.57384591,2018-02-19 15:30:00,15,0,1.0,1.0,1.0
Kidnap,22/02/2018,8:50,12.88948381,77.56232091,2018-02-22 08:50:00,8,0,1.0,1.0,1.0
Kidnap,2/3/2018,14:00,12.86881387,77.58083431,2018-03-02 14:00:00,14,0,1.0,1.0,1.0
Kidnap,17/03/2018,21:40,12.91031858,77.5563932,2018-03-17 21:40:00,21,1,1.0,1.5,1.5
Kidnap,17/04/2018,12:15,12.91022894,77.5481594,2018-04-17 12:15:00,12,0,1.0,1.0,1.0
Kidnap,19/05/2018,15:45,12.88290759,77.56690606,2018-05-19 15:45:00,15,0,1.0,1.0,1.0
Kidnap,6/7/2018,18:30,12.90532964,77.54489953,2018-07-06 18:30:00,18,0,1.0,1.0,1.0
Kidnap,26/07/2018,10:30,12.905759,77.542703,2018-07-26 10:30:00,10,0,1.0,1.0,1.0
Kidnap,5/8/2018,19:10,12.91739661,77.54533797,2018-08-05 19:10:00,19,1,1.0,1.5,1.5
Kidnap,13/08/2018,17:45,12.88888678,77.57180041,2018-08-13 17:45:00,17,0,1.0,1.0,1.0
Kidnap,16/08/2018,6:50,12.89486583,77.55129522,2018-08-16 06:50:00,6,0,1.0,1.0,1.0
Kidnap,29/08/2018,10:15,12.90476548,77.5371549,2018-08-29 10:15:00,10,0,1.0,1.0,1.0
Kidnap,11/9/2018,14:30,12.90913455,77.55325268,2018-09-11 14:30:00,14,0,1.0,1.0,1.0
Kidnap,22/09/2018,12:30,12.89043496,77.5635394,2018-09-22 12:30:00,12,0,1.0,1.0,1.0
Kidnap,24/10/2018,18:00,12.91555088,77.53947694,2018-10-24 18:00:00,18,0,1.0,1.0,1.0
Kidnap,27/10/2018,11:10,12.90512329,77.54375125,2018-10-27 11:10:00,11,0,1.0,1.0,1.0
Kidnap,14/11/2018,18:30,12.87024907,77.57579285,2018-11-14 18:30:00,18,0,1.0,1.0,1.0
Kidnap,17/11/2018,12:10,12.91298108,77.55815356,2018-11-17 12:10:00,12,0,1.0,1.0,1.0
Kidnap,20/11/2018,16:00,12.917986,77.553778,2018-11-20 16:00:00,16,0,1.0,1.0,1.0
Kidnap,4/12/2018,12:15,12.89528068,77.55067452,2018-12-04 12:15:00,12,0,1.0,1.0,1.0
Kidnap,17/12/2018,13:00,12.8967726,77.5445644,2018-12-17 13:00:00,13,0,1.0,1.0,1.0
Kidnap,28/01/2019,8:15,12.88292452,77.58206937,2019-01-28 08:15:00,8,0,1.0,1.0,1.0
Kidnap,13/03/2019,13:10,12.88992359,77.58079977,2019-03-13 13:10:00,13,0,1.0,1.0,1.0
Kidnap,15/04/2019,23:00,12.91739661,77.54533797,2019-04-15 23:00:00,23,1,1.0,1.5,1.5
Kidnap,22/04/2019,17:40,12.90108207,77.54753806,2019-04-22 17:40:00,17,0,1.0,1.0,1.0
Kidnap,24/04/2019,23:15,12.9057223,77.53558126,2019-04-24 23:15:00,23,1,1.0,1.5,1.5
Kidnap,3/5/2019,14:45,12.89760184,77.54575434,2019-05-03 14:45:00,14,0,1.0,1.0,1.0
Kidnap,29/05/2019,21:00,12.8836526,77.58177943,2019-05-29 21:00:00,21,1,1.0,1.5,1.5
Kidnap,3/7/2019,12:30,12.89157884,77.58142943,2019-07-03 12:30:00,12,0,1.0,1.0,1.0
Kidnap,28/07/2019,20:45,12.90958258,77.55696166,2019-07-28 20:45:00,20,1,1.0,1.5,1.5
Kidnap,26/09/2019,14:10,12.87991967,77.55749353,2019-09-26 14:10:00,14,0,1.0,1.0,1.0
Kidnap,26/10/2019,12:45,12.88962293,77.57213196,2019-10-26 12:45:00,12,0,1.0,1.0,1.0
Kidnap,12/11/2019,14:30,12.9100853,77.55656592,2019-11-12 14:30:00,14,0,1.0,1.0,1.0
Kidnap,26/11/2019,11:45,12.89594801,77.55219028,2019-11-26 11:45:00,11,0,1.0,1.0,1.0
Kidnap,12/3/2015,12:30,12.868638,77.533289,2015-03-12 12:30:00,12,0,1.0,1.0,1.0
Kidnap,13/07/2015,14:00,12.874392,77.567161,2015-07-13 14:00:00,14,0,1.0,1.0,1.0
Kidnap,30/11/2015,14:00,12.86388,77.535496,2015-11-30 14:00:00,14,0,1.0,1.0,1.0
Kidnap,7/12/2015,12:30,12.859705,77.580537,2015-12-07 12:30:00,12,0,1.0,1.0,1.0
Kidnap,29/01/2016,8:45,12.865177,77.51857,2016-01-29 08:45:00,8,0,1.0,1.0,1.0
Kidnap,30/01/2016,20:00,12.859851,77.574956,2016-01-30 20:00:00,20,1,1.0,1.5,1.5
Kidnap,18/03/2016,23:10,12.874882,77.539331,2016-03-18 23:10:00,23,1,1.0,1.5,1.5
Kidnap,13/04/2016,16:00,12.863415,77.527177,2016-04-13 16:00:00,16,0,1.0,1.0,1.0
Kidnap,20/09/2016,19:45,12.885824,77.546078,2016-09-20 19:45:00,19,1,1.0,1.5,1.5
Kidnap,6/2/2017,20:00,12.875491,77.537771,2017-02-06 20:00:00,20,1,1.0,1.5,1.5
Kidnap,1/4/2017,5:30,12.891469,77.541803,2017-04-01 05:30:00,5,1,1.0,1.5,1.5
Kidnap,27/04/2017,17:00,12.863955,77.556258,2017-04-27 17:00:00,17,0,1.0,1.0,1.0
Kidnap,14/05/2017,15:00,12.86562,77.537673,2017-05-14 15:00:00,15,0,1.0,1.0,1.0
Kidnap,8/7/2017,4:00,12.873222,77.534888,2017-07-08 04:00:00,4,1,1.0,1.5,1.5
Kidnap,17/08/2017,12:00,12.866595,77.529815,2017-08-17 12:00:00,12,0,1.0,1.0,1.0
Kidnap,22/08/2017,16:00,12.889883,77.544416,2017-08-22 16:00:00,16,0,1.0,1.0,1.0
Kidnap,1/11/2017,12:00,12.871322,77.532192,2017-11-01 12:00:00,12,0,1.0,1.0,1.0
Kidnap,16/11/2017,11:00,12.864404,77.554397,2017-11-16 11:00:00,11,0,1.0,1.0,1.0
Kidnap,10/12/2017,10:00,12.886135,77.545482,2017-12-10 10:00:00,10,0,1.0,1.0,1.0
Kidnap,16/12/2017,13:00,12.857223,77.548885,2017-12-16 13:00:00,13,0,1.0,1.0,1.0
Kidnap,18/12/2017,22:00,12.870656,77.536163,2017-12-18 22:00:00,22,1,1.0,1.5,1.5
Kidnap,6/1/2018,13:00,12.852892,77.553711,2018-01-06 13:00:00,13,0,1.0,1.0,1.0
Kidnap,29/01/2018,16:00,12.878402,77.55041,2018-01-29 16:00:00,16,0,1.0,1.0,1.0
Kidnap,13/10/2018,21:00,12.875019,77.529843,2018-10-13 21:00:00,21,1,1.0,1.5,1.5
Kidnap,17/12/2018,21:00,12.867056,77.536419,2018-12-17 21:00:00,21,1,1.0,1.5,1.5
Kidnap,17/01/2018,15:00,12.878899,77.485867,2018-01-17 15:00:00,15,0,1.0,1.0,1.0
Kidnap,19/01/2018,10:00,12.876592,77.491665,2018-01-19 10:00:00,10,0,1.0,1.0,1.0
Kidnap,25/02/2019,13:13,12.86738,77.563821,2019-02-25 13:13:00,13,0,1.0,1.0,1.0
Kidnap,22/03/2019,16:00,12.867925,77.563568,2019-03-22 16:00:00,16,0,1.0,1.0,1.0
Kidnap,29/03/2019,10:00,12.853787,77.573044,2019-03-29 10:00:00,10,0,1.0,1.0,1.0
Kidnap,24/05/2019,16:30,12.857401,77.561101,2019-05-24 16:30:00,16,0,1.0,1.0,1.0
Kidnap,7/6/2019,21:30,12.869011,77.565298,2019-06-07 21:30:00,21,1,1.0,1.5,1.5
Kidnap,14/08/2019,16:40,12.880097,77.513418,2019-08-14 16:40:00,16,0,1.0,1.0,1.0
Kidnap,21/08/2019,4:00,12.861796,77.538009,2019-08-21 04:00:00,4,1,1.0,1.5,1.5
Kidnap,25/09/2019,21:15,12.85984,77.575677,2019-09-25 21:15:00,21,1,1.0,1.5,1.5
Kidnap,1/10/2019,18:00,12.870019,77.564431,2019-10-01 18:00:00,18,0,1.0,1.0,1.0
Kidnap,5/1/2017,16:35,12.888188,77.570812,2017-01-05 16:35:00,16,0,1.0,1.0,1.0
Kidnap,14/02/2017,17:30,12.87769,77.56715,2017-02-14 17:30:00,17,0,1.0,1.0,1.0
Kidnap,17/02/2017,10:50,12.883525,77.563547,2017-02-17 10:50:00,10,0,1.0,1.0,1.0
Kidnap,3/3/2017,10:30,12.86409,77.584085,2017-03-03 10:30:00,10,0,1.0,1.0,1.0
Kidnap,6/4/2017,9:30,12.878194,77.57011,2017-04-06 09:30:00,9,0,1.0,1.0,1.0
Kidnap,16/04/2017,17:00,12.884022,77.583093,2017-04-16 17:00:00,17,0,1.0,1.0,1.0
Kidnap,2/5/2017,12:00,12.840839,77.581043,2017-05-02 12:00:00,12,0,1.0,1.0,1.0
Kidnap,5/5/2017,15:00,12.878992,77.562182,2017-05-05 15:00:00,15,0,1.0,1.0,1.0
Kidnap,30/05/2017,16:00,12.887529,77.573481,2017-05-30 16:00:00,16,0,1.0,1.0,1.0
Kidnap,9/9/2017,12:00,12.87822,77.570138,2017-09-09 12:00:00,12,0,1.0,1.0,1.0
Kidnap,26/10/2017,9:00,12.846865,77.582922,2017-10-26 09:00:00,9,0,1.0,1.0,1.0
Kidnap,30/10/2017,8:00,12.748862,77.486417,2017-10-30 08:00:00,8,0,1.0,1.0,1.0
Kidnap,9/1/2018,13:00,12.860378,77.571322,2018-01-09 13:00:00,13,0,1.0,1.0,1.0
Kidnap,16/03/2018,21:35,12.886841,77.567815,2018-03-16 21:35:00,21,1,1.0,1.5,1.5
Kidnap,10/5/2018,13:15,12.84564,77.584142,2018-05-10 13:15:00,13,0,1.0,1.0,1.0
Kidnap,29/05/2018,10:30,12.880104,77.567961,2018-05-29 10:30:00,10,0,1.0,1.0,1.0
Kidnap,1/6/2018,19:15,12.88288,77.578462,2018-06-01 19:15:00,19,1,1.0,1.5,1.5
Kidnap,3/6/2018,16:00,12.8667989,77.580991,2018-06-03 16:00:00,16,0,1.0,1.0,1.0
Kidnap,13/06/2018,15:00,12.8813,77.570951,2018-06-13 15:00:00,15,0,1.0,1.0,1.0
Kidnap,7/7/2018,12:45,12.966528,77.401109,2018-07-07 12:45:00,12,0,1.0,1.0,1.0
Kidnap,29/07/2018,9:30,12.85706,77.58406,2018-07-29 09:30:00,9,0,1.0,1.0,1.0
Kidnap,3/11/2018,9:00,12.884005,77.56634,2018-11-03 09:00:00,9,0,1.0,1.0,1.0
Kidnap,12/11/2018,17:30,12.878655,77.566708,2018-11-12 17:30:00,17,0,1.0,1.0,1.0
Kidnap,6/12/2018,9:50,12.794486,77.62091,2018-12-06 09:50:00,9,0,1.0,1.0,1.0
Kidnap,17/01/2019,13:30,12.872893,77.582921,2019-01-17 13:30:00,13,0,1.0,1.0,1.0
Kidnap,2/2/2019,11:30,12.87331,77.574396,2019-02-02 11:30:00,11,0,1.0,1.0,1.0
Kidnap,3/2/2019,19:00,12.8863383,77.573795,2019-02-03 19:00:00,19,1,1.0,1.5,1.5
Kidnap,1/3/2019,16:40,12.869624,77.58232,2019-03-01 16:40:00,16,0,1.0,1.0,1.0
Kidnap,8/3/2019,10:30,12.89341,77.580255,2019-03-08 10:30:00,10,0,1.0,1.0,1.0
Kidnap,9/4/2019,21:00,12.86383,77.57767,2019-04-09 21:00:00,21,1,1.0,1.5,1.5
Kidnap,29/04/2019,21:30,12.873437,77.583593,2019-04-29 21:30:00,21,1,1.0,1.5,1.5
Kidnap,1/5/2019,21:00,12.89065,77.564006,2019-05-01 21:00:00,21,1,1.0,1.5,1.5
Kidnap,7/5/2019,15:00,12.8824024,77.560456,2019-05-07 15:00:00,15,0,1.0,1.0,1.0
Kidnap,9/5/2019,21:00,12.861253,77.579712,2019-05-09 21:00:00,21,1,1.0,1.5,1.5
Kidnap,22/05/2019,13:00,12.844501,77.584473,2019-05-22 13:00:00,13,0,1.0,1.0,1.0
Kidnap,29/05/2019,21:30,12.885465,77.569815,2019-05-29 21:30:00,21,1,1.0,1.5,1.5
Kidnap,13/06/2019,15:15,12.88829,77.580217,2019-06-13 15:15:00,15,0,1.0,1.0,1.0
Kidnap,10/8/2019,15:30,12.882462,77.569158,2019-08-10 15:30:00,15,0,1.0,1.0,1.0
Kidnap,19/08/2019,19:00,12.845799,77.584087,2019-08-19 19:00:00,19,1,1.0,1.5,1.5
Kidnap,25/08/2019,15:00,12.835799,77.584087,2019-08-25 15:00:00,15,0,1.0,1.0,1.0
Kidnap,31/08/2019,12:15,12.878746,77.5622,2019-08-31 12:15:00,12,0,1.0,1.0,1.0
Kidnap,21/10/2019,12:30,12.863913,77.585848,2019-10-21 12:30:00,12,0,1.0,1.0,1.0
Kidnap,19/11/2019,14:30,12.881754,77.569001,2019-11-19 14:30:00,14,0,1.0,1.0,1.0
Kidnap,6/1/2015,17:00,12.8928133912158,77.5666300513369,2015-01-06 17:00:00,17,0,1.0,1.0,1.0
Kidnap,12/1/2015,17:30,12.8928133912158,77.5666300513369,2015-01-12 17:30:00,17,0,1.0,1.0,1.0
Kidnap,14/06/2016,13:30,12.905037,77.560909,2016-06-14 13:30:00,13,0,1.0,1.0,1.0
Kidnap,3/7/2015,14:00,12.910991,77.561872,2015-07-03 14:00:00,14,0,1.0,1.0,1.0
Kidnap,14/07/2015,18:30,12.904553,77.560433,2015-07-14 18:30:00,18,0,1.0,1.0,1.0
Kidnap,30/07/2015,6:30,12.893906,77.556449,2015-07-30 06:30:00,6,0,1.0,1.0,1.0
Kidnap,23/11/2015,18:45,12.902361,77.56838,2015-11-23 18:45:00,18,0,1.0,1.0,1.0
Kidnap,13/02/2016,13:00,12.9157553,77.571373,2016-02-13 13:00:00,13,0,1.0,1.0,1.0
Kidnap,31/03/2016,13:30,12.904553,77.560433,2016-03-31 13:30:00,13,0,1.0,1.0,1.0
Kidnap,22/07/2016,20:00,12.9116,77.572476,2016-07-22 20:00:00,20,1,1.0,1.5,1.5
Kidnap,3/10/2016,23:45,12.893906,77.556449,2016-10-03 23:45:00,23,1,1.0,1.5,1.5
Kidnap,18/11/2016,18:00,12.910991,77.561872,2016-11-18 18:00:00,18,0,1.0,1.0,1.0
Kidnap,2/12/2016,16:45,12.894779,77.562256,2016-12-02 16:45:00,16,0,1.0,1.0,1.0
Kidnap,27/01/2017,12:00,12.906422,77.570394,2017-01-27 12:00:00,12,0,1.0,1.0,1.0
Kidnap,1/2/2017,23:30,12.893906,77.556449,2017-02-01 23:30:00,23,1,1.0,1.5,1.5
Kidnap,8/2/2017,16:40,12.898577,77.569538,2017-02-08 16:40:00,16,0,1.0,1.0,1.0
Kidnap,11/3/2018,10:30,12.90237,77.55504,2018-03-11 10:30:00,10,0,1.0,1.0,1.0
Kidnap,7/5/2017,11:15,12.893906,77.556449,2017-05-07 11:15:00,11,0,1.0,1.0,1.0
Kidnap,13/05/2017,16:00,12.893906,77.556449,2017-05-13 16:00:00,16,0,1.0,1.0,1.0
Kidnap,31/05/2017,10:00,12.91267,77.562103,2017-05-31 10:00:00,10,0,1.0,1.0,1.0
Kidnap,5/6/2017,13:00,12.900415,77.569332,2017-06-05 13:00:00,13,0,1.0,1.0,1.0
Kidnap,27/06/2017,20:45,12.900415,77.569332,2017-06-27 20:45:00,20,1,1.0,1.5,1.5
Kidnap,17/7/2017,12:30,12.904553,77.560433,2017-07-17 12:30:00,12,0,1.0,1.0,1.0
Kidnap,28/8/2017,13:00,12.91267,77.562103,2017-08-28 13:00:00,13,0,1.0,1.0,1.0
Kidnap,13/12/2017,14:00,12.894779,77.562256,2017-12-13 14:00:00,14,0,1.0,1.0,1.0
Kidnap,1/8/2018,10:30,12.904553,77.560433,2018-08-01 10:30:00,10,0,1.0,1.0,1.0
Kidnap,2/11/2018,16:00,12.904553,77.560433,2018-11-02 16:00:00,16,0,1.0,1.0,1.0
Kidnap,22/02/2018,16:00,12.896566,77.557231,2018-02-22 16:00:00,16,0,1.0,1.0,1.0
Kidnap,26/02/2018,15:10,12.904553,77.560433,2018-02-26 15:10:00,15,0,1.0,1.0,1.0
Kidnap,3/2/2018,15:00,12.8928133912158,77.5666300513369,2018-02-03 15:00:00,15,0,1.0,1.0,1.0
Kidnap,13/03/2018,14:00,12.894779,77.562256,2018-03-13 14:00:00,14,0,1.0,1.0,1.0
Kidnap,4/4/2018,15:00,12.904553,77.560433,2018-04-04 15:00:00,15,0,1.0,1.0,1.0
Kidnap,20/04/2018,19:00,12.9157553,77.571373,2018-04-20 19:00:00,19,1,1.0,1.5,1.5
Kidnap,27/05/2018,13:00,12.910991,77.561872,2018-05-27 13:00:00,13,0,1.0,1.0,1.0
Kidnap,7/7/2018,18:00,12.904553,77.560433,2018-07-07 18:00:00,18,0,1.0,1.0,1.0
Kidnap,11/7/2018,17:00,12.904553,77.560433,2018-07-11 17:00:00,17,0,1.0,1.0,1.0
Kidnap,27/07/2018,23:00,12.906422,77.570394,2018-07-27 23:00:00,23,1,1.0,1.5,1.5
Kidnap,10/8/2018,15:00,12.902556,77.562012,2018-08-10 15:00:00,15,0,1.0,1.0,1.0
Kidnap,17/08/2018,14:00,12.9116,77.572476,2018-08-17 14:00:00,14,0,1.0,1.0,1.0
Kidnap,31/08/2018,18:00,12.9157553,77.571373,2018-08-31 18:00:00,18,0,1.0,1.0,1.0
Kidnap,4/9/2018,18:00,12.9157553,77.571373,2018-09-04 18:00:00,18,0,1.0,1.0,1.0
Kidnap,8/9/2018,18:00,12.894779,77.562256,2018-09-08 18:00:00,18,0,1.0,1.0,1.0
Kidnap,12/12/2018,10:30,12.906422,77.570394,2018-12-12 10:30:00,10,0,1.0,1.0,1.0
Kidnap,19/12/2018,13:00,12.892905,77.561042,2018-12-19 13:00:00,13,0,1.0,1.0,1.0
Kidnap,29/12/2018,14:15,12.91267,77.562103,2018-12-29 14:15:00,14,0,1.0,1.0,1.0
Kidnap,5/1/2019,10:30,12.9157553,77.571373,2019-01-05 10:30:00,10,0,1.0,1.0,1.0
Kidnap,15/02/2019,14:00,12.9157553,77.571373,2019-02-15 14:00:00,14,0,1.0,1.0,1.0
Kidnap,15/02/2019,20:00,12.910581,77.558642,2019-02-15 20:00:00,20,1,1.0,1.5,1.5
Kidnap,27/02/2019,12:00,12.9157553,77.571373,2019-02-27 12:00:00,12,0,1.0,1.0,1.0
Kidnap,11/3/2019,12:20,12.904531,77.565234,2019-03-11 12:20:00,12,0,1.0,1.0,1.0
Kidnap,15/03/2019,20:20,12.894779,77.562256,2019-03-15 20:20:00,20,1,1.0,1.5,1.5
Kidnap,26/04/2019,11:50,12.904553,77.560433,2019-04-26 11:50:00,11,0,1.0,1.0,1.0
Kidnap,8/5/2019,11:00,12.902361,77.56838,2019-05-08 11:00:00,11,0,1.0,1.0,1.0
Kidnap,31/07/2019,15:00,12.9157553,77.571373,2019-07-31 15:00:00,15,0,1.0,1.0,1.0
Kidnap,12/8/2019,12:00,12.904553,77.560433,2019-08-12 12:00:00,12,0,1.0,1.0,1.0
Kidnap,23/10/2019,23:00,12.894779,77.562256,2019-10-23 23:00:00,23,1,1.0,1.5,1.5
Kidnap,24/10/2019,19:30,12.8928133912158,77.5666300513369,2019-10-24 19:30:00,19,1,1.0,1.5,1.5
Kidnap,16/11/2019,11:00,12.904553,77.560433,2019-11-16 11:00:00,11,0,1.0,1.0,1.0
Kidnap,14/12/2019,14:15,12.894779,77.562256,2019-12-14 14:15:00,14,0,1.0,1.0,1.0
Kidnap,26/12/2019,11:30,12.8928133912158,77.5666300513369,2019-12-26 11:30:00,11,0,1.0,1.0,1.0
Kidnap,25/12/2019,13:00,12.9157553,77.571373,2019-12-25 13:00:00,13,0,1.0,1.0,1.0
Kidnap,17/12/2016,11:00,12.942908,77.538157,2016-12-17 11:00:00,11,0,1.0,1.0,1.0
Kidnap,21/12/2016,20:30,12.941531,77.540823,2016-12-21 20:30:00,20,1,1.0,1.5,1.5
Kidnap,29/07/2016,9:30,12.934989,77.551589,2016-07-29 09:30:00,9,0,1.0,1.0,1.0
Kidnap,8/1/2017,20:30,12.928223,77.535324,2017-01-08 20:30:00,20,1,1.0,1.5,1.5
Kidnap,17/01/2017,18:30,12.943098,77.542106,2017-01-17 18:30:00,18,0,1.0,1.0,1.0
Kidnap,7/6/2017,23:00,12.928169,77.536215,2017-06-07 23:00:00,23,1,1.0,1.5,1.5
Kidnap,28/06/2017,11:00,12.929142,77.540449,2017-06-28 11:00:00,11,0,1.0,1.0,1.0
Kidnap,7/7/2017,10:30,12.93629,77.539916,2017-07-07 10:30:00,10,0,1.0,1.0,1.0
Kidnap,19/07/2017,23:30,12.922056,77.537204,2017-07-19 23:30:00,23,1,1.0,1.5,1.5
Kidnap,24/10/2017,18:45,12.768354,77.549231,2017-10-24 18:45:00,18,0,1.0,1.0,1.0
Kidnap,1/12/2018,18:45,12.930393,77.542147,2018-12-01 18:45:00,18,0,1.0,1.0,1.0
Kidnap,3/9/2018,12:15,12.93423,77.543063,2018-09-03 12:15:00,12,0,1.0,1.0,1.0
Kidnap,2/1/2019,18:00,12.943145,77.545449,2019-01-02 18:00:00,18,0,1.0,1.0,1.0
Kidnap,07/09/2016,11:15,77.563213,12.953436,2016-09-07 11:15:00,11,0,1.0,1.0,1.0
Kidnap,13/10/2016,17:45,77.561639,12.953286,2016-10-13 17:45:00,17,0,1.0,1.0,1.0
Kidnap,05/05/2017,14:00,77.55926598,12.95689834,2017-05-05 14:00:00,14,0,1.0,1.0,1.0
Kidnap,07/06/2017,10:15,77.5643001,12.95046684,2017-06-07 10:15:00,10,0,1.0,1.0,1.0
Kidnap,07/06/2017,10:40,77.5643001,12.95046684,2017-06-07 10:40:00,10,0,1.0,1.0,1.0
Kidnap,16/03/2018,17:00,12.94655,77.561969,2018-03-16 17:00:00,17,0,1.0,1.0,1.0
Kidnap,03/04/2018,18:00,12.95367,77.55837,2018-04-03 18:00:00,18,0,1.0,1.0,1.0
Kidnap,07/05/2018,19:30,12.9532,77.562441,2018-05-07 19:30:00,19,1,1.0,1.5,1.5
Kidnap,02/06/2018,23:15,12.953624,77.558171,2018-06-02 23:15:00,23,1,1.0,1.5,1.5
Kidnap,21/06/2018,17:00,12.94739018,77.57228106,2018-06-21 17:00:00,17,0,1.0,1.0,1.0
Kidnap,18/08/2018,18:30,12.95331,77.55839,2018-08-18 18:30:00,18,0,1.0,1.0,1.0
Kidnap,08/10/2018,15:45,12.94682,77.560151,2018-10-08 15:45:00,15,0,1.0,1.0,1.0
Kidnap,25/02/2019,12:30,12.953238,77.557978,2019-02-25 12:30:00,12,0,1.0,1.0,1.0
Kidnap,16/05/2019,18:30,12.95151,77.55573,2019-05-16 18:30:00,18,0,1.0,1.0,1.0
Kidnap,10/06/2019,12:30,12.9562,77.56349,2019-06-10 12:30:00,12,0,1.0,1.0,1.0
Kidnap,04/03/2015,22:15,12.95226481,77.56999599,2015-03-04 22:15:00,22,1,1.0,1.5,1.5
Kidnap,28/07/2016,8:30,12.94946,77.5713,2016-07-28 08:30:00,8,0,1.0,1.0,1.0
Kidnap,10/3/2017,14:00,12.9504085896878,77.5749663400693,2017-03-10 14:00:00,14,0,1.0,1.0,1.0
Kidnap,8/1/2018,11:30,12.9558507587663,77.5755996713555,2018-01-08 11:30:00,11,0,1.0,1.0,1.0
Kidnap,1/2/2018,12:10,12.96240552,77.57056907,2018-02-01 12:10:00,12,0,1.0,1.0,1.0
Kidnap,1/3/2018,11:00,12.96170594,77.57113689,2018-03-01 11:00:00,11,0,1.0,1.0,1.0
Kidnap,8/8/2018,11:30,12.95801501,77.56948559,2018-08-08 11:30:00,11,0,1.0,1.0,1.0
Kidnap,10/11/2018,11:00,12.9595545,77.57161241,2018-11-10 11:00:00,11,0,1.0,1.0,1.0
Kidnap,02/02/2015,16:30,12.94525,77.55439,2015-02-02 16:30:00,16,0,1.0,1.0,1.0
Kidnap,09/05/2015,23:30,12.94757,77.5507,2015-05-09 23:30:00,23,1,1.0,1.5,1.5
Kidnap,07/06/2015,15:00,12.94735,77.55611,2015-06-07 15:00:00,15,0,1.0,1.0,1.0
Kidnap,08/09/2015,15:30,12.94223,77.56522,2015-09-08 15:30:00,15,0,1.0,1.0,1.0
Kidnap,13/10/2015,23:50,12.94364,77.55295,2015-10-13 23:50:00,23,1,1.0,1.5,1.5
Kidnap,13/01/2016,15:00,12.94503,77.55863,2016-01-13 15:00:00,15,0,1.0,1.0,1.0
Kidnap,20/03/2016,20:40,12.94319,77.55245,2016-03-20 20:40:00,20,1,1.0,1.5,1.5
Kidnap,22/04/2016,20:00,12.93624,77.55372,2016-04-22 20:00:00,20,1,1.0,1.5,1.5
Kidnap,10/06/2016,18:30,12.94418,77.55125,2016-06-10 18:30:00,18,0,1.0,1.0,1.0
Kidnap,12/06/2016,21:30,12.93655,77.5602,2016-06-12 21:30:00,21,1,1.0,1.5,1.5
Kidnap,13/07/2016,14:15,12.93576,77.56037,2016-07-13 14:15:00,14,0,1.0,1.0,1.0
Kidnap,11/08/2016,9:00,12.9375,77.55484,2016-08-11 09:00:00,9,0,1.0,1.0,1.0
Kidnap,02/09/2016,19:30,12.94255,77.56258,2016-09-02 19:30:00,19,1,1.0,1.5,1.5
Kidnap,12/12/2016,17:30,12.94242,77.56085,2016-12-12 17:30:00,17,0,1.0,1.0,1.0
Kidnap,27/12/2016,11:00,12.93524,77.56337,2016-12-27 11:00:00,11,0,1.0,1.0,1.0
Kidnap,27/12/2016,11:20,12.93471,77.55548,2016-12-27 11:20:00,11,0,1.0,1.0,1.0
Kidnap,03/03/2017,12:00,12.94716,77.55464,2017-03-03 12:00:00,12,0,1.0,1.0,1.0
Kidnap,28/03/2017,11:30,12.93943,77.5542,2017-03-28 11:30:00,11,0,1.0,1.0,1.0
Kidnap,22/04/2017,11:30,12.94234,77.56534,2017-04-22 11:30:00,11,0,1.0,1.0,1.0
Kidnap,18/05/2017,11:00,12.94852,77.55155,2017-05-18 11:00:00,11,0,1.0,1.0,1.0
Kidnap,08/06/2017,22:15,12.93481,77.56529,2017-06-08 22:15:00,22,1,1.0,1.5,1.5
Kidnap,30/08/2017,17:30,12.94255,77.56258,2017-08-30 17:30:00,17,0,1.0,1.0,1.0
Kidnap,24/09/2017,16:00,12.9471,77.5553,2017-09-24 16:00:00,16,0,1.0,1.0,1.0
Kidnap,08/10/2017,12:45,12.95078,77.55267,2017-10-08 12:45:00,12,0,1.0,1.0,1.0
Kidnap,08/10/2017,18:45,12.94666,77.55441,2017-10-08 18:45:00,18,0,1.0,1.0,1.0
Kidnap,27/10/2017,21:50,12.94486,77.55427,2017-10-27 21:50:00,21,1,1.0,1.5,1.5
Kidnap,18/11/2017,20:30,12.94318,77.55112,2017-11-18 20:30:00,20,1,1.0,1.5,1.5
Kidnap,14/12/2017,21:00,12.94136,77.55381,2017-12-14 21:00:00,21,1,1.0,1.5,1.5
Kidnap,02/02/2018,19:30,12.94716,77.55464,2018-02-02 19:30:00,19,1,1.0,1.5,1.5
Kidnap,14/04/2018,11:15,12.9464,77.55544,2018-04-14 11:15:00,11,0,1.0,1.0,1.0
Kidnap,20/06/2018,19:30,12.94584,77.55967,2018-06-20 19:30:00,19,1,1.0,1.5,1.5
Kidnap,21/09/2018,18:00,12.93524,77.56337,2018-09-21 18:00:00,18,0,1.0,1.0,1.0
Kidnap,27/09/2018,16:30,12.94353,77.56601,2018-09-27 16:30:00,16,0,1.0,1.0,1.0
Kidnap,21/02/2019,21:00,12.94141,77.56263,2019-02-21 21:00:00,21,1,1.0,1.5,1.5
Kidnap,09/07/2019,12:00,12.94165,77.56075,2019-07-09 12:00:00,12,0,1.0,1.0,1.0
Kidnap,27/08/2019,14:15,12.9466,77.56138,2019-08-27 14:15:00,14,0,1.0,1.0,1.0
Kidnap,17/09/2019,12:30,12.94662,77.55213,2019-09-17 12:30:00,12,0,1.0,1.0,1.0
Kidnap,15/10/2019,18:20,12.96153,77.54295,2019-10-15 18:20:00,18,0,1.0,1.0,1.0
Kidnap,15/11/2019,20:30,12.94369,77.55238,2019-11-15 20:30:00,20,1,1.0,1.5,1.5
Kidnap,16/12/2019,21:00,12.9494,77.55375,2019-12-16 21:00:00,21,1,1.0,1.5,1.5
Kidnap,30/11/2015,7:30,12.920302,77.547338,2015-11-30 07:30:00,7,0,1.0,1.0,1.0
Kidnap,6/12/2015,1:30,12.928069,77.556175,2015-12-06 01:30:00,1,1,1.0,1.5,1.5
Kidnap,11/02/2016,3:00,12.927006,77.551285,2016-02-11 03:00:00,3,1,1.0,1.5,1.5
Kidnap,27/02/2016,2:30,12.92678,77.550591,2016-02-27 02:30:00,2,1,1.0,1.5,1.5
Kidnap,02/05/2016,5:00,12.927961,77.552001,2016-05-02 05:00:00,5,1,1.0,1.5,1.5
Kidnap,04/05/2016,9:40,12.932815,77.555745,2016-05-04 09:40:00,9,0,1.0,1.0,1.0
Kidnap,10/05/2016,1:30,12.921142,77.545256,2016-05-10 01:30:00,1,1,1.0,1.5,1.5
Kidnap,06/06/2016,2:00,12.921812,77.540898,2016-06-06 02:00:00,2,1,1.0,1.5,1.5
Kidnap,03/02/2017,9:15,12.91985,77.54513,2017-02-03 09:15:00,9,0,1.0,1.0,1.0
Kidnap,22/02/2017,7:00,12.933133,77.554945,2017-02-22 07:00:00,7,0,1.0,1.0,1.0
Kidnap,29/05/2017,9:45,12.921085,77.545753,2017-05-29 09:45:00,9,0,1.0,1.0,1.0
Kidnap,25/06/2017,12:30,12.933591,77.550183,2017-06-25 12:30:00,12,0,1.0,1.0,1.0
Kidnap,23/10/2017,1:45,12.919566,77.541079,2017-10-23 01:45:00,1,1,1.0,1.5,1.5
Kidnap,11/11/2017,1:00,12.921535,77.543298,2017-11-11 01:00:00,1,1,1.0,1.5,1.5
Kidnap,14/11/2017,5:00,12.927335,77.558155,2017-11-14 05:00:00,5,1,1.0,1.5,1.5
Kidnap,28/02/2018,3:00,12.919443,77.541827,2018-02-28 03:00:00,3,1,1.0,1.5,1.5
Kidnap,26/03/2018,10:15,12.929312,77.552932,2018-03-26 10:15:00,10,0,1.0,1.0,1.0
Kidnap,12/06/2018,4:00,12.922241,77.549207,2018-06-12 04:00:00,4,1,1.0,1.5,1.5
Kidnap,30/06/2018,10:30,12.923399,77.542044,2018-06-30 10:30:00,10,0,1.0,1.0,1.0
Kidnap,21/07/2018,5:00,12.92661,77.543612,2018-07-21 05:00:00,5,1,1.0,1.5,1.5
Kidnap,12/11/2018,4:15,12.934536,77.558654,2018-11-12 04:15:00,4,1,1.0,1.5,1.5
Kidnap,17/11/2018,1:00,12.928254,77.559942,2018-11-17 01:00:00,1,1,1.0,1.5,1.5
Kidnap,28/11/2018,12:15,12.931165,77.561615,2018-11-28 12:15:00,12,0,1.0,1.0,1.0
Kidnap,10/12/2018,6:00,12.930523,77.553762,2018-12-10 06:00:00,6,0,1.0,1.0,1.0
Kidnap,17/12/2018,3:30,12.921935,77.552745,2018-12-17 03:30:00,3,1,1.0,1.5,1.5
Kidnap,03/01/2019,9:30,12.921096,77.542289,2019-01-03 09:30:00,9,0,1.0,1.0,1.0
Kidnap,16/02/2019,3:00,12.922189,77.547143,2019-02-16 03:00:00,3,1,1.0,1.5,1.5
Kidnap,18/03/2019,10:35,12.932799,77.563597,2019-03-18 10:35:00,10,0,1.0,1.0,1.0
Rape,26/10/2017,14:00,12.933274,77.583281,2017-10-26 14:00:00,14,0,5.0,1.0,5.0
Rape,26/12/2017,20:00,12.888238,77.569679,2017-12-26 20:00:00,20,1,5.0,1.5,7.5
Rape,30/10/2015,13:30,12.939824,77.57269,2015-10-30 13:30:00,13,0,5.0,1.0,5.0
Rape,20/05/2019,12:00,12.936987,77.568395,2019-05-20 12:00:00,12,0,5.0,1.0,5.0
Rape,23/02/2015,12:00,12.9117826,77.5776407,2015-02-23 12:00:00,12,0,5.0,1.0,5.0
Rape,18/05/2015,12:00,12.909427,77.5706543,2015-05-18 12:00:00,12,0,5.0,1.0,5.0
Rape,15/03/2018,8:30,12.9075563,77.5708723,2018-03-15 08:30:00,8,0,5.0,1.0,5.0
Rape,24/03/2018,12:30,12.9067545,77.5882936,2018-03-24 12:30:00,12,0,5.0,1.0,5.0
Rape,16/06/2015,13:30,"12°55'42.48""N","77°34'30.90""E",2015-06-16 13:30:00,13,0,5.0,1.0,5.0
Rape,02/03/2016,12:00,"12°55'19.66""N","77°33'16.92""E",2016-03-02 12:00:00,12,0,5.0,1.0,5.0
Rape,24/08/2016,10:00,"12°55'8.38""N","77°33'24.37""E",2016-08-24 10:00:00,10,0,5.0,1.0,5.0
Rape,25/01/2017,18:00,"12°54'56.05""N","77°33'24.38""E",2017-01-25 18:00:00,18,0,5.0,1.0,5.0
Rape,01/11/2017,17:00,13.0184,77.6781,2017-11-01 17:00:00,17,0,5.0,1.0,5.0
Rape,03/08/2018,12:10,"12°55'4.22""N","77°33'51.21""E",2018-08-03 12:10:00,12,0,5.0,1.0,5.0
Rape,26/02/2015,22:30,12.933186,77.591077,2015-02-26 22:30:00,22,1,5.0,1.5,7.5
Rape,04/05/2016,11:00,12.943525,77.594291,2016-05-04 11:00:00,11,0,5.0,1.0,5.0
Rape,29/01/2015,11:30,12.91226037,77.59215042,2015-01-29 11:30:00,11,0,5.0,1.0,5.0
Rape,03/04/2015,13:50,12.91033123,77.55156956,2015-04-03 13:50:00,13,0,5.0,1.0,5.0
Rape,22/04/2015,14:30,12.87795004,77.58300166,2015-04-22 14:30:00,14,0,5.0,1.0,5.0
Rape,19/03/2016,1:30,12.91452342,77.54777923,2016-03-19 01:30:00,1,1,5.0,1.5,7.5
Rape,15/07/2016,17:00,12.89157884,77.58142943,2016-07-15 17:00:00,17,0,5.0,1.0,5.0
Rape,20/07/2016,21:45,12.89825057,77.54800705,2016-07-20 21:45:00,21,1,5.0,1.5,7.5
Rape,27/03/2017,17:00,12.88280504,77.56504176,2017-03-27 17:00:00,17,0,5.0,1.0,5.0
Rape,11/05/2017,18:40,12.90975822,77.55423858,2017-05-11 18:40:00,18,0,5.0,1.0,5.0
Rape,29/05/2018,22:45,12.89688992,77.57136348,2018-05-29 22:45:00,22,1,5.0,1.5,7.5
Rape,10/09/2015,22:00,12.880629,77.543807,2015-09-10 22:00:00,22,1,5.0,1.5,7.5
Rape,10/09/2015,22:00,12.881293,77.547893,2015-09-10 22:00:00,22,1,5.0,1.5,7.5
Rape,22/12/2018,16:00,12.874197,77.52783,2018-12-22 16:00:00,16,0,5.0,1.0,5.0
Rape,04/03/2019,20:00,12.882585,77.546078,2019-03-04 20:00:00,20,1,5.0,1.5,7.5
Rape,07/05/2019,20:00,12.892543,77.366609,2019-05-07 20:00:00,20,1,5.0,1.5,7.5
Rape,20/06/2019,19:00,12.870965,77.53059,2019-06-20 19:00:00,19,1,5.0,1.5,7.5
Rape,20/07/2019,21:00,12.870947,77.536765,2019-07-20 21:00:00,21,1,5.0,1.5,7.5
Rape,17/08/2019,11:45,12.861982,77.563524,2019-08-17 11:45:00,11,0,5.0,1.0,5.0
Rape,02/10/2019,10:00,12.891973,77.541607,2019-10-02 10:00:00,10,0,5.0,1.0,5.0
Rape,03/11/2019,20:00,12.865267,77.557889,2019-11-03 20:00:00,20,1,5.0,1.5,7.5
Rape,20/10/2017,10:00,12.8834428,77.569808,2017-10-20 10:00:00,10,0,5.0,1.0,5.0
Rape,17/12/2017,13:00,12.88822,77.578284,2017-12-17 13:00:00,13,0,5.0,1.0,5.0
Rape,23/03/2018,22:30,12.88296,77.570727,2018-03-23 22:30:00,22,1,5.0,1.5,7.5
Rape,24/03/2018,12:40,12.88086,77.57472,2018-03-24 12:40:00,12,0,5.0,1.0,5.0
Rape,24/03/2018,21:00,12.840419,77.576783,2018-03-24 21:00:00,21,1,5.0,1.5,7.5
Rape,06/07/2018,9:30,12.866994,77.591193,2018-07-06 09:30:00,9,0,5.0,1.0,5.0
Rape,05/08/2018,18:10,12.887741,77.56966,2018-08-05 18:10:00,18,0,5.0,1.0,5.0
Rape,26/11/2018,19:45,12.8807444,77.57559,2018-11-26 19:45:00,19,1,5.0,1.5,7.5
Rape,03/07/2019,12:30,12.888224,77.570902,2019-07-03 12:30:00,12,0,5.0,1.0,5.0
Rape,23/08/2019,23:30,12.88226,77.56431,2019-08-23 23:30:00,23,1,5.0,1.5,7.5
Rape,24/10/2019,17:00,12.844683,77.583062,2019-10-24 17:00:00,17,0,5.0,1.0,5.0
Rape,12/11/2019,7:00,12.889349,77.578031,2019-11-12 07:00:00,7,0,5.0,1.0,5.0
Rape,01/12/2015,3:15,12.9050964485764,77.571337000055,2015-12-01 03:15:00,3,1,5.0,1.5,7.5
Rape,7/4/2017,21:00,12.895284445528,77.5662128659953,2017-04-07 21:00:00,21,1,5.0,1.5,7.5
Rape,7/1/2017,20:00,12.9155719870194,77.5732155912695,2017-01-07 20:00:00,20,1,5.0,1.5,7.5
Rape,06/12/2018,18:00,12.895284445528,77.5662128659953,2018-12-06 18:00:00,18,0,5.0,1.0,5.0
Rape,27/03/2019,16:00,12.8979064683143,77.5594980995282,2019-03-27 16:00:00,16,0,5.0,1.0,5.0
Rape,04/12/2019,16:00,12.9026408373789,77.5697430368268,2019-12-04 16:00:00,16,0,5.0,1.0,5.0
Rape,25/03/2019,21:20,12.951275,77.56574,2019-03-25 21:20:00,21,1,5.0,1.5,7.5
Rape,12/04/2019,20:30,12.95534,77.56122,2019-04-12 20:30:00,20,1,5.0,1.5,7.5
Rape,31/10/2019,18:30,12.95506,77.56706,2019-10-31 18:30:00,18,0,5.0,1.0,5.0
Rape,08/01/2016,3:00,12.933008,77.560953,2016-01-08 03:00:00,3,1,5.0,1.5,7.5
Rape,08/05/2016,11:30,12.923288,77.542503,2016-05-08 11:30:00,11,0,5.0,1.0,5.0
Rape,26/02/2018,8:45,12.923332,77.548353,2018-02-26 08:45:00,8,0,5.0,1.0,5.0
Rape,27/05/2019,9:00,12.930748,77.554886,2019-05-27 09:00:00,9,0,5.0,1.0,5.0
Assault,20/01/2015,11:00,12.915668,77.569861,2015-01-20 11:00:00,11,0,3.0,1.0,3.0
Assault,22/01/2015,12:00,12.92397,77.57968,2015-01-22 12:00:00,12,0,3.0,1.0,3.0
Assault,03/02/2015,1:00,12.88605,77.494843,2015-02-03 01:00:00,1,1,3.0,1.5,4.5
Assault,22/03/2015,10:30,12.88605,77.494843,2015-03-22 10:30:00,10,0,3.0,1.0,3.0
Assault,31/03/2015,12:00,12.971599,77.594563,2015-03-31 12:00:00,12,0,3.0,1.0,3.0
Assault,13/04/2015,4:00,12.919817,77.58481,2015-04-13 04:00:00,4,1,3.0,1.5,4.5
Assault,22/04/2015,5:00,12.926384,77.578007,2015-04-22 05:00:00,5,1,3.0,1.5,4.5
Assault,31/05/2015,6:00,12.926254,77.584896,2015-05-31 06:00:00,6,0,3.0,1.0,3.0
Assault,27/06/2015,7:00,12.550228,77.350844,2015-06-27 07:00:00,7,0,3.0,1.0,3.0
Assault,22/07/2015,11:00,12.9373,77.584642,2015-07-22 11:00:00,11,0,3.0,1.0,3.0
Assault,18/08/2015,11:30,12.926254,77.584896,2015-08-18 11:30:00,11,0,3.0,1.0,3.0
Assault,21/08/2015,11:40,12.927258,77.585571,2015-08-21 11:40:00,11,0,3.0,1.0,3.0
Assault,10/09/2015,12:10,12.922537,77.616736,2015-09-10 12:10:00,12,0,3.0,1.0,3.0
Assault,14/09/2015,9:00,12.920121,77.571397,2015-09-14 09:00:00,9,0,3.0,1.0,3.0
Assault,31/10/2015,9:30,12.971599,77.594563,2015-10-31 09:30:00,9,0,3.0,1.0,3.0
Assault,23/12/2015,10:00,12.9298,77.621739,2015-12-23 10:00:00,10,0,3.0,1.0,3.0
Assault,22/02/2016,12:00,12.919774,77.577703,2016-02-22 12:00:00,12,0,3.0,1.0,3.0
Assault,22/02/2016,9:30,12.930901,77.579527,2016-02-22 09:30:00,9,0,3.0,1.0,3.0
Assault,09/03/2016,9:15,12.942117,77.575361,2016-03-09 09:15:00,9,0,3.0,1.0,3.0
Assault,19/03/2016,11:15,12.971599,77.594563,2016-03-19 11:15:00,11,0,3.0,1.0,3.0
Assault,21/03/2016,11:35,12.92594,77.583042,2016-03-21 11:35:00,11,0,3.0,1.0,3.0
Assault,08/04/2016,12:00,12.928807,77.58585,2016-04-08 12:00:00,12,0,3.0,1.0,3.0
Assault,02/05/2016,9:30,12.930877,77.57673,2016-05-02 09:30:00,9,0,3.0,1.0,3.0
Assault,09/06/2016,5:30,12.544272,77.342621,2016-06-09 05:30:00,5,1,3.0,1.5,4.5
Assault,09/06/2016,4:00,12.92367,77.58014,2016-06-09 04:00:00,4,1,3.0,1.5,4.5
Assault,03/07/2016,8:00,12.35554,77.345587,2016-07-03 08:00:00,8,0,3.0,1.0,3.0
Assault,05/08/2016,9:00,12.926793,77.588426,2016-08-05 09:00:00,9,0,3.0,1.0,3.0
Assault,13/10/2016,9:30,12.582316,77.362914,2016-10-13 09:30:00,9,0,3.0,1.0,3.0
Assault,12/12/2016,4:15,12.94518,77.58715,2016-12-12 04:15:00,4,1,3.0,1.5,4.5
Assault,12/12/2016,5:30,12.554571,77.351017,2016-12-12 05:30:00,5,1,3.0,1.5,4.5
Assault,12/12/2016,4:00,12.971599,77.594563,2016-12-12 04:00:00,4,1,3.0,1.5,4.5
Assault,18/12/2016,5:00,12.971599,77.594563,2016-12-18 05:00:00,5,1,3.0,1.5,4.5
Assault,22/12/2016,5:30,12.971599,77.594563,2016-12-22 05:30:00,5,1,3.0,1.5,4.5
Assault,21/01/2017,11:00,12.92634,77.57802,2017-01-21 11:00:00,11,0,3.0,1.0,3.0
Assault,29/01/2017,11:30,12.91945,77.58825,2017-01-29 11:30:00,11,0,3.0,1.0,3.0
Assault,06/04/2017,12:00,12.91945,77.58825,2017-04-06 12:00:00,12,0,3.0,1.0,3.0
Assault,25/04/2017,12:30,12.91756,77.58832,2017-04-25 12:30:00,12,0,3.0,1.0,3.0
Assault,27/06/2017,11:15,12.92723,77.58548,2017-06-27 11:15:00,11,0,3.0,1.0,3.0
Assault,10/07/2017,12:00,12.92208,77.58953,2017-07-10 12:00:00,12,0,3.0,1.0,3.0
Assault,29/08/2017,12:30,12.92367,77.58014,2017-08-29 12:30:00,12,0,3.0,1.0,3.0
Assault,29/08/2017,1:00,12.925668,77.592755,2017-08-29 01:00:00,1,1,3.0,1.5,4.5
Assault,02/09/2017,5:00,12.921556,77.589475,2017-09-02 05:00:00,5,1,3.0,1.5,4.5
Assault,07/09/2017,4:30,12.9248566,77.576998,2017-09-07 04:30:00,4,1,3.0,1.5,4.5
Assault,13/09/2017,9:15,12.92485,77.5868,2017-09-13 09:15:00,9,0,3.0,1.0,3.0
Assault,29/09/2017,10:20,12.921752,77.586995,2017-09-29 10:20:00,10,0,3.0,1.0,3.0
Assault,02/10/2017,11:30,12.92208,77.58953,2017-10-02 11:30:00,11,0,3.0,1.0,3.0
Assault,28/10/2017,11:45,12.920536,77.5827886,2017-10-28 11:45:00,11,0,3.0,1.0,3.0
Assault,01/11/2017,12:00,12.9237563,77.586952,2017-11-01 12:00:00,12,0,3.0,1.0,3.0
Assault,08/11/2017,1:00,12.924178,77.590603,2017-11-08 01:00:00,1,1,3.0,1.5,4.5
Assault,28/11/2017,8:45,12.553641,77.350641,2017-11-28 08:45:00,8,0,3.0,1.0,3.0
Assault,29/11/2017,9:45,12.9313,77.09397,2017-11-29 09:45:00,9,0,3.0,1.0,3.0
Assault,07/12/2017,1:50,12.555585,77.35006,2017-12-07 01:50:00,1,1,3.0,1.5,4.5
Assault,23/12/2017,2:00,12.554511,77.350073,2017-12-23 02:00:00,2,1,3.0,1.5,4.5
Assault,25/12/2017,10:20,12.545464,77.342616,2017-12-25 10:20:00,10,0,3.0,1.0,3.0
Assault,31/12/2017,11:00,12.16216,77.70683,2017-12-31 11:00:00,11,0,3.0,1.0,3.0
Assault,16/01/2018,11:30,12.47337,77.47787,2018-01-16 11:30:00,11,0,3.0,1.0,3.0
Assault,16/01/2018,1:00,12.926745,77.579258,2018-01-16 01:00:00,1,1,3.0,1.5,4.5
Assault,11/02/2018,2:30,12.555288,77.350521,2018-02-11 02:30:00,2,1,3.0,1.5,4.5
Assault,20/03/2018,11:30,12.92753,77576600,2018-03-20 11:30:00,11,0,3.0,1.0,3.0
Assault,18/04/2018,12:00,12.922517,77.587116,2018-04-18 12:00:00,12,0,3.0,1.0,3.0
Assault,01/06/2018,8:45,12.930749,77.582961,2018-06-01 08:45:00,8,0,3.0,1.0,3.0
Assault,12/08/2018,9:15,12.551592,77.351339,2018-08-12 09:15:00,9,0,3.0,1.0,3.0
Assault,31/08/2018,9:45,12.931904,77.585883,2018-08-31 09:45:00,9,0,3.0,1.0,3.0
Assault,08/09/2018,10:50,12.929561,77.575507,2018-09-08 10:50:00,10,0,3.0,1.0,3.0
Assault,18/02/2019,11:00,12.922517,77.587116,2019-02-18 11:00:00,11,0,3.0,1.0,3.0
Assault,14/03/2019,11:15,12.945182,77.597825,2019-03-14 11:15:00,11,0,3.0,1.0,3.0
Assault,27/03/2019,12:30,12.931566,77.584634,2019-03-27 12:30:00,12,0,3.0,1.0,3.0
Assault,20/04/2019,1:00,12.32331,76.61077,2019-04-20 01:00:00,1,1,3.0,1.5,4.5
Assault,05/05/2019,2:00,12.92626,77.58598,2019-05-05 02:00:00,2,1,3.0,1.5,4.5
Assault,06/05/2019,10:00,12.555156,77.350063,2019-05-06 10:00:00,10,0,3.0,1.0,3.0
Assault,20/05/2019,10:30,12.55474,77.350605,2019-05-20 10:30:00,10,0,3.0,1.0,3.0
Assault,22/05/2019,11:15,12.93087,77.58145,2019-05-22 11:15:00,11,0,3.0,1.0,3.0
Assault,27/05/2019,11:50,12.920789,77.58415,2019-05-27 11:50:00,11,0,3.0,1.0,3.0
Assault,20/06/2019,12:00,12.971599,77.594563,2019-06-20 12:00:00,12,0,3.0,1.0,3.0
Assault,24/06/2019,4:00,12.91795,77.58878,2019-06-24 04:00:00,4,1,3.0,1.5,4.5
Assault,01/10/2019,5:00,12.241653,77.363421,2019-10-01 05:00:00,5,1,3.0,1.5,4.5
Assault,01/11/2019,6:00,12.92938,77.582961,2019-11-01 06:00:00,6,0,3.0,1.0,3.0
Assault,24/11/2019,9:15,12.361236,77.396512,2019-11-24 09:15:00,9,0,3.0,1.0,3.0
Assault,29/11/2019,10:45,12.241653,77.349614,2019-11-29 10:45:00,10,0,3.0,1.0,3.0
Assault,23/12/2019,11:30,12.241652,77.363942,2019-12-23 11:30:00,11,0,3.0,1.0,3.0
Assault,28/12/2019,12:00,12.91796,77.600883,2019-12-28 12:00:00,12,0,3.0,1.0,3.0
Assault,3/3/2015,15:15,12.947483,77.567938,2015-03-03 15:15:00,15,0,3.0,1.0,3.0
Assault,24/03/2015,21:05,12.947999,77.571559,2015-03-24 21:05:00,21,1,3.0,1.5,4.5
Assault,6/5/2015,19:30,12.94262,77.570347,2015-05-06 19:30:00,19,1,3.0,1.5,4.5
Assault,16/05/2015,21:00,12.940197,77.57321,2015-05-16 21:00:00,21,1,3.0,1.5,4.5
Assault,22/05/2015,18:30,12.939577,77.571341,2015-05-22 18:30:00,18,0,3.0,1.0,3.0
Assault,20/06/2015,22:25,12.938381,77.572111,2015-06-20 22:25:00,22,1,3.0,1.5,4.5
Assault,22/06/2015,13:00,12.938381,77.572111,2015-06-22 13:00:00,13,0,3.0,1.0,3.0
Assault,11/7/2015,18:30,12.945012,77.570275,2015-07-11 18:30:00,18,0,3.0,1.0,3.0
Assault,17/07/2015,10:30,13.940623,77.575326,2015-07-17 10:30:00,10,0,3.0,1.0,3.0
Assault,19/08/2015,15:00,12.936641,77.5755,2015-08-19 15:00:00,15,0,3.0,1.0,3.0
Assault,12/9/2015,20:56,12.946584,77.570663,2015-09-12 20:56:00,20,1,3.0,1.5,4.5
Assault,3/10/2015,20:00,12.948113,77.56867,2015-10-03 20:00:00,20,1,3.0,1.5,4.5
Assault,3/12/2015,22:00,12.941737,77.573275,2015-12-03 22:00:00,22,1,3.0,1.5,4.5
Assault,15/12/2015,13:45,12.948132,77.579756,2015-12-15 13:45:00,13,0,3.0,1.0,3.0
Assault,22/12/2015,17:05,12.942133,77.578746,2015-12-22 17:05:00,17,0,3.0,1.0,3.0
Assault,21/01/2016,20:10,12.943177,77.571162,2016-01-21 20:10:00,20,1,3.0,1.5,4.5
Assault,13/02/2016,13:45,12.943177,77.571162,2016-02-13 13:45:00,13,0,3.0,1.0,3.0
Assault,14/04/2016,17:30,12.93599,77.574076,2016-04-14 17:30:00,17,0,3.0,1.0,3.0
Assault,1/5/2016,21:15,12.942133,77.578746,2016-05-01 21:15:00,21,1,3.0,1.5,4.5
Assault,15/05/2016,18:00,12.940208,77.579802,2016-05-15 18:00:00,18,0,3.0,1.0,3.0
Assault,21/05/2016,14:30,12.94255243,77.5798338,2016-05-21 14:30:00,14,0,3.0,1.0,3.0
Assault,31/05/2016,12:15,12.9415428,77.577026,2016-05-31 12:15:00,12,0,3.0,1.0,3.0
Assault,30/06/2016,23:45,12.94629544,77.57029688,2016-06-30 23:45:00,23,1,3.0,1.5,4.5
Assault,18/07/2016,21:00,12.93917139,77.57183068,2016-07-18 21:00:00,21,1,3.0,1.5,4.5
Assault,22/08/2016,16:45,12.9399106,77.56776662,2016-08-22 16:45:00,16,0,3.0,1.0,3.0
Assault,18/09/2016,23:00,12.94419644,77.57926095,2016-09-18 23:00:00,23,1,3.0,1.5,4.5
Assault,26/09/2016,10:30,12.94235652,77.57242618,2016-09-26 10:30:00,10,0,3.0,1.0,3.0
Assault,26/09/2016,11:45,12.94600147,77.56838223,2016-09-26 11:45:00,11,0,3.0,1.0,3.0
Assault,29/09/2016,11:00,12.9417117,77.57477473,2016-09-29 11:00:00,11,0,3.0,1.0,3.0
Assault,16/12/2016,11:30,12.94357002,77.5799236,2016-12-16 11:30:00,11,0,3.0,1.0,3.0
Assault,31/12/2016,17:56,12.93711028,77.58005565,2016-12-31 17:56:00,17,0,3.0,1.0,3.0
Assault,31/01/2017,15:00,12.942133,77.578746,2017-01-31 15:00:00,15,0,3.0,1.0,3.0
Assault,19/02/2017,17:30,12.942133,77.578746,2017-02-19 17:30:00,17,0,3.0,1.0,3.0
Assault,24/04/2017,18:45,12.936325,77.571876,2017-04-24 18:45:00,18,0,3.0,1.0,3.0
Assault,30/04/2017,20:15,12.940447,77.568217,2017-04-30 20:15:00,20,1,3.0,1.5,4.5
Assault,13/05/2017,13:00,12.941295,77.580022,2017-05-13 13:00:00,13,0,3.0,1.0,3.0
Assault,23/05/2017,18:00,12.947533,77.573701,2017-05-23 18:00:00,18,0,3.0,1.0,3.0
Assault,24/05/2017,20:10,12.9391113,77.5697017,2017-05-24 20:10:00,20,1,3.0,1.5,4.5
Assault,25/05/2017,17:45,12.937585,77.573808,2017-05-25 17:45:00,17,0,3.0,1.0,3.0
Assault,18/06/2017,13:30,12.9397949,77.5773812,2017-06-18 13:30:00,13,0,3.0,1.0,3.0
Assault,21/06/2017,19:00,12.941459,77.571213,2017-06-21 19:00:00,19,1,3.0,1.5,4.5
Assault,16/08/2017,17:30,12.936325,77.56892,2017-08-16 17:30:00,17,0,3.0,1.0,3.0
Assault,15/09/2017,17:00,12.93528104,77.57011754,2017-09-15 17:00:00,17,0,3.0,1.0,3.0
Assault,30/09/2017,11:00,12.9378719,77.5787329,2017-09-30 11:00:00,11,0,3.0,1.0,3.0
Assault,18/10/2017,12:45,12.940373,77.579131,2017-10-18 12:45:00,12,0,3.0,1.0,3.0
Assault,19/10/2017,16:45,12.944758,77.578493,2017-10-19 16:45:00,16,0,3.0,1.0,3.0
Assault,25/10/2017,17:20,12.933297,77.344217,2017-10-25 17:20:00,17,0,3.0,1.0,3.0
Assault,17/11/2017,19:50,12.943761,77.567843,2017-11-17 19:50:00,19,1,3.0,1.5,4.5
Assault,21/12/2017,22:00,12.93087,77.568371,2017-12-21 22:00:00,22,1,3.0,1.5,4.5
Assault,17/01/2018,12:30,12.94797384,77.57988959,2018-01-17 12:30:00,12,0,3.0,1.0,3.0
Assault,18/02/2018,13:00,12.9376775,77.57472052,2018-02-18 13:00:00,13,0,3.0,1.0,3.0
Assault,23/03/2018,16:30,12.939976,77.573271,2018-03-23 16:30:00,16,0,3.0,1.0,3.0
Assault,26/08/2018,21:30,12.93695,77.572194,2018-08-26 21:30:00,21,1,3.0,1.5,4.5
Assault,14/09/2018,11:30,12.93551,77.570118,2018-09-14 11:30:00,11,0,3.0,1.0,3.0
Assault,26/02/2019,23:50,12.94005639,77.5798523,2019-02-26 23:50:00,23,1,3.0,1.5,4.5
Assault,18/03/2019,11:00,12.944576,77.572059,2019-03-18 11:00:00,11,0,3.0,1.0,3.0
Assault,21/03/2019,20:00,12.941085,77.579968,2019-03-21 20:00:00,20,1,3.0,1.5,4.5
Assault,16/04/2019,19:30,12.943699,77.579185,2019-04-16 19:30:00,19,1,3.0,1.5,4.5
Assault,19/06/2019,13:00,12.936805,77.571808,2019-06-19 13:00:00,13,0,3.0,1.0,3.0
Assault,14/01/2015,10:31,12.9012051,77.5718812,2015-01-14 10:31:00,10,0,3.0,1.0,3.0
Assault,28/01/2015,8:40,12.9124458,77.5764631,2015-01-28 08:40:00,8,0,3.0,1.0,3.0
Assault,28/02/2015,6:20,12.8980801,77.5804562,2015-02-28 06:20:00,6,0,3.0,1.0,3.0
Assault,22/03/2015,1:35,12.899377,77.5892173,2015-03-22 01:35:00,1,1,3.0,1.5,4.5
Assault,22/04/2015,7:01,12.8917637,77.5925495,2015-04-22 07:01:00,7,0,3.0,1.0,3.0
Assault,26/04/2015,8:35,12.9103402,77.5902664,2015-04-26 08:35:00,8,0,3.0,1.0,3.0
Assault,22/05/2015,1:00,12.8983501,77.573651,2015-05-22 01:00:00,1,1,3.0,1.5,4.5
Assault,22/05/2015,7:30,12.8983494,77.5605187,2015-05-22 07:30:00,7,0,3.0,1.0,3.0
Assault,14/08/2015,9:31,12.9062082,77.5937537,2015-08-14 09:31:00,9,0,3.0,1.0,3.0
Assault,18/08/2015,8:46,12.9046491,77.5785133,2015-08-18 08:46:00,8,0,3.0,1.0,3.0
Assault,26/08/2015,8:05,12.897498,77.594366,2015-08-26 08:05:00,8,0,3.0,1.0,3.0
Assault,15/09/2015,6:10,12.9167674,77.5872982,2015-09-15 06:10:00,6,0,3.0,1.0,3.0
Assault,22/09/2015,9:46,12.9116517,77.5859494,2015-09-22 09:46:00,9,0,3.0,1.0,3.0
Assault,25/09/2015,1:10,12.908521,77.5715554,2015-09-25 01:10:00,1,1,3.0,1.5,4.5
Assault,30/09/2015,6:11,12.9085187,77.5387243,2015-09-30 06:11:00,6,0,3.0,1.0,3.0
Assault,26/10/2015,5:45,12.908514,77.5387242,2015-10-26 05:45:00,5,1,3.0,1.5,4.5
Assault,19/11/2015,8:35,12.8980801,77.5804562,2015-11-19 08:35:00,8,0,3.0,1.0,3.0
Assault,25/01/2016,11:05,12.9019706,77.5702781,2016-01-25 11:05:00,11,0,3.0,1.0,3.0
Assault,27/02/2016,9:30,12.9105026,77.5866048,2016-02-27 09:30:00,9,0,3.0,1.0,3.0
Assault,13/03/2016,5:16,12.9105026,77.5866048,2016-03-13 05:16:00,5,1,3.0,1.5,4.5
Assault,30/03/2016,4:05,12.8934589,77.5831639,2016-03-30 04:05:00,4,1,3.0,1.5,4.5
Assault,15/04/2016,3:00,12.8986817,77.5690523,2016-04-15 03:00:00,3,1,3.0,1.5,4.5
Assault,19/03/2016,12:01,12.8979429,77.5838175,2016-03-19 12:01:00,12,0,3.0,1.0,3.0
Assault,28/12/2015,11:00,12.8979423,77.5684965,2015-12-28 11:00:00,11,0,3.0,1.0,3.0
Assault,19/06/2016,12:15,12.9156234,77.5960689,2016-06-19 12:15:00,12,0,3.0,1.0,3.0
Assault,17/07/2016,8:16,12.9069939,77.5720367,2016-07-17 08:16:00,8,0,3.0,1.0,3.0
Assault,23/07/2016,12:05,12.8992455,77.5891666,2016-07-23 12:05:00,12,0,3.0,1.0,3.0
Assault,26/07/2016,5:01,12.915434,77.5843151,2016-07-26 05:01:00,5,1,3.0,1.5,4.5
Assault,27/07/2016,11:45,12.910852,77.5764323,2016-07-27 11:45:00,11,0,3.0,1.0,3.0
Assault,16/08/2016,11:35,12.8923493,77.5835991,2016-08-16 11:35:00,11,0,3.0,1.0,3.0
Assault,18/09/2016,2:31,12.9573655,77.5672906,2016-09-18 02:31:00,2,1,3.0,1.5,4.5
Assault,21/09/2016,8:50,12.9151812,77.5951825,2016-09-21 08:50:00,8,0,3.0,1.0,3.0
Assault,28/10/2016,6:40,12.9155865,77.5770282,2016-10-28 06:40:00,6,0,3.0,1.0,3.0
Assault,24/12/2016,6:00,12.9115768,77.5723387,2016-12-24 06:00:00,6,0,3.0,1.0,3.0
Assault,20/01/2017,7:35,12.916473,77.5901863,2017-01-20 07:35:00,7,0,3.0,1.0,3.0
Assault,25/01/2017,6:15,12.9109285,77.5768905,2017-01-25 06:15:00,6,0,3.0,1.0,3.0
Assault,16/05/2017,1:05,12.9116975,77.591605,2017-05-16 01:05:00,1,1,3.0,1.5,4.5
Assault,15/06/2017,3:30,12.9116952,77.5587738,2017-06-15 03:30:00,3,1,3.0,1.5,4.5
Assault,30/06/2017,8:50,12.9118162,77.5854349,2017-06-30 08:50:00,8,0,3.0,1.0,3.0
Assault,26/07/2017,11:45,12.9138435,77.5767104,2017-07-26 11:45:00,11,0,3.0,1.0,3.0
Assault,28/09/2017,11:10,12.9091286,77.5782822,2017-09-28 11:10:00,11,0,3.0,1.0,3.0
Assault,19/10/2017,9:10,12.9118139,77.5526038,2017-10-19 09:10:00,9,0,3.0,1.0,3.0
Assault,20/01/2018,11:45,12.9108936,77.575867,2018-01-20 11:45:00,11,0,3.0,1.0,3.0
Assault,20/01/2018,9:10,12.9088884,77.5733033,2018-01-20 09:10:00,9,0,3.0,1.0,3.0
Assault,20/02/2018,8:35,12.9116975,77.591605,2018-02-20 08:35:00,8,0,3.0,1.0,3.0
Assault,24/03/2018,2:40,12.9116973,77.5850389,2018-03-24 02:40:00,2,1,3.0,1.5,4.5
Assault,19/05/2018,1:35,12.9215368,77.5690028,2018-05-19 01:35:00,1,1,3.0,1.5,4.5
Assault,19/05/2018,7:10,12.9109881,77.577546,2018-05-19 07:10:00,7,0,3.0,1.0,3.0
Assault,27/05/2018,6:10,12.8956489,77.558425,2018-05-27 06:10:00,6,0,3.0,1.0,3.0
Assault,30/06/2018,11:00,12.9151616,77.5844195,2018-06-30 11:00:00,11,0,3.0,1.0,3.0
Assault,21/09/2018,11:10,12.9073713,77.5818356,2018-09-21 11:10:00,11,0,3.0,1.0,3.0
Assault,23/10/2018,6:30,12.915389,77.5929853,2018-10-23 06:30:00,6,0,3.0,1.0,3.0
Assault,22/11/2018,6:25,12.916271,77.5871377,2018-11-22 06:25:00,6,0,3.0,1.0,3.0
Assault,16/12/2018,12:35,12.9901083,77.6641461,2018-12-16 12:35:00,12,0,3.0,1.0,3.0
Assault,20/01/2019,1:50,12.9355559,77.6309975,2019-01-20 01:50:00,1,1,3.0,1.5,4.5
Assault,26/01/2019,6:40,12.8998631,77.5898921,2019-01-26 06:40:00,6,0,3.0,1.0,3.0
Assault,18/05/2019,10:15,12.9117027,77.591605,2019-05-18 10:15:00,10,0,3.0,1.0,3.0
Assault,27/06/2019,7:10,12.9102145,77.5929493,2019-06-27 07:10:00,7,0,3.0,1.0,3.0
Assault,22/08/2019,6:30,12.9163635,77.5902506,2019-08-22 06:30:00,6,0,3.0,1.0,3.0
Assault,30/09/2019,9:15,12.911398,77.5764744,2019-09-30 09:15:00,9,0,3.0,1.0,3.0
Assault,22/10/2019,9:20,12.8095916,77.2936558,2019-10-22 09:20:00,9,0,3.0,1.0,3.0
Assault,27/10/2019,10:00,12.9093122,77.5977983,2019-10-27 10:00:00,10,0,3.0,1.0,3.0
Assault,20/11/2018,11:10,12.9093151,77.5731743,2018-11-20 11:10:00,11,0,3.0,1.0,3.0
Assault,14/12/2019,5:30,12.9117027,77.591605,2019-12-14 05:30:00,5,1,3.0,1.5,4.5
Assault,15/12/2019,6:00,12.9088289,77.590309,2019-12-15 06:00:00,6,0,3.0,1.0,3.0
Assault,09/02/2015,12:00,"12°55'24.84""N","77°34'12.01""E",2015-02-09 12:00:00,12,0,3.0,1.0,3.0
Assault,23/02/2015,16:00,"12°55'38.84""N","77°34'7.30""E",2015-02-23 16:00:00,16,0,3.0,1.0,3.0
Assault,01/03/2015,1:00,"12°55'1.92""N","77°33'57.30""E",2015-03-01 01:00:00,1,1,3.0,1.5,4.5
Assault,05/03/2015,13:00,"12°54'55.88""N","77°33'16.70""E",2015-03-05 13:00:00,13,0,3.0,1.0,3.0
Assault,30/03/2015,9:30,"12°55'10.75""N","77°34'26.57""E",2015-03-30 09:30:00,9,0,3.0,1.0,3.0
Assault,19/04/2015,21:30,12.55'5.33''N,77.33'52.42''E,2015-04-19 21:30:00,21,1,3.0,1.5,4.5
Assault,12/05/2015,23:00,"12°54'49.27""N","77°33'51.52""E",2015-05-12 23:00:00,23,1,3.0,1.5,4.5
Assault,05/06/2015,15:00,"12°55'3.36""N","77°34'22.32""E",2015-06-05 15:00:00,15,0,3.0,1.0,3.0
Assault,15/06/2015,9:30,"12°54'55.88""N","77°33'45.57""E",2015-06-15 09:30:00,9,0,3.0,1.0,3.0
Assault,23/07/2015,22:45,"12°55'6.80""N","77°34'21.02""E",2015-07-23 22:45:00,22,1,3.0,1.5,4.5
Assault,07/08/2015,15:00,"12°55'30.48""N","77°33'53.04""E",2015-08-07 15:00:00,15,0,3.0,1.0,3.0
Assault,19/08/2015,12:45,"12°55'5.98""N","77°33'42.01""E",2015-08-19 12:45:00,12,0,3.0,1.0,3.0
Assault,29/08/2015,21:00,"12°55'45.82""N","77°34'10.36""E",2015-08-29 21:00:00,21,1,3.0,1.5,4.5
Assault,29/08/2015,21:15,"12°55'45.82""N","77°34'10.36""E",2015-08-29 21:15:00,21,1,3.0,1.5,4.5
Assault,31/08/2015,20:00,"12°55'10.97""N","77°33'46.94""E",2015-08-31 20:00:00,20,1,3.0,1.5,4.5
Assault,01/09/2015,18:15,"12°55'21.12""N","77°34'25.01""E",2015-09-01 18:15:00,18,0,3.0,1.0,3.0
Assault,16/10/2015,11:45,"12°54'49.09""N","77°33'18.54""E",2015-10-16 11:45:00,11,0,3.0,1.0,3.0
Assault,12/11/2015,1:30,"12°55'22.65""N","77°34'12.30""E",2015-11-12 01:30:00,1,1,3.0,1.5,4.5
Assault,14/12/2015,18:30,"12°55'15.42""N","77°34'26.01""E",2015-12-14 18:30:00,18,0,3.0,1.0,3.0
Assault,31/12/2015,18:15,"12°55'36.30""N","77°33'48.98""",2015-12-31 18:15:00,18,0,3.0,1.0,3.0
Assault,08/02/2016,22:45,"12°54'55.52""N","77°33'43.22""E",2016-02-08 22:45:00,22,1,3.0,1.5,4.5
Assault,10/02/2016,23:30,"12°55'22.65""N","77°34'12.30""E",2016-02-10 23:30:00,23,1,3.0,1.5,4.5
Assault,02/03/2016,13:00,"12°55'19.66""N","77°33'16.92""E",2016-03-02 13:00:00,13,0,3.0,1.0,3.0
Assault,12/03/2016,17:00,"12°54'55.17""N","77°33'49.18""E",2016-03-12 17:00:00,17,0,3.0,1.0,3.0
Assault,17/03/2016,0:15,"12°55'24.79""N","77°33'48.15""E",2016-03-17 00:15:00,0,1,3.0,1.5,4.5
Assault,17/03/2016,0:30,"12°55'24.79""N","77°33'48.15""E",2016-03-17 00:30:00,0,1,3.0,1.5,4.5
Assault,13/07/2016,22:30,"12°55'49.78""N","77°34'25.16""E",2016-07-13 22:30:00,22,1,3.0,1.5,4.5
Assault,09/05/2018,16:00,"12°54'57.84""N","77°33'48.96""E",2018-05-09 16:00:00,16,0,3.0,1.0,3.0
Assault,11/04/2016,15:00,"12°55'4.22""N","77°34'7.05""E",2016-04-11 15:00:00,15,0,3.0,1.0,3.0
Assault,15/04/2016,11:30,"12°54'55.88""N","77°33'45.57""E",2016-04-15 11:30:00,11,0,3.0,1.0,3.0
Assault,02/05/2016,13:00,"12°55'50.66""N","77°34'35.36""E",2016-05-02 13:00:00,13,0,3.0,1.0,3.0
Assault,04/05/2016,23:30,".12°55'13.52""N","77°34'15.72""E",2016-05-04 23:30:00,23,1,3.0,1.5,4.5
Assault,06/05/2016,15:00,"12°55'4.22""N","77°34'7.05""E",2016-05-06 15:00:00,15,0,3.0,1.0,3.0
Assault,09/05/2016,22:40,"12°55'11.34""N","77°34'8.58""E",2016-05-09 22:40:00,22,1,3.0,1.5,4.5
Assault,13/05/2016,0:10,"12°55'12.30""","77°34'11.11""E",2016-05-13 00:10:00,0,1,3.0,1.5,4.5
Assault,28/05/2016,3:30,"12°54'55.44""N","77°34'5.29""E",2016-05-28 03:30:00,3,1,3.0,1.5,4.5
Assault,04/06/2016,13:45,"12°55'24.79""N","77°33'48.15""E",2016-06-04 13:45:00,13,0,3.0,1.0,3.0
Assault,15/06/2016,14:00,"12°55'12.30""",77°34'11.11,2016-06-15 14:00:00,14,0,3.0,1.0,3.0
Assault,18/06/2016,15:00,"12°55'3.06""N","77°33'12.19""E",2016-06-18 15:00:00,15,0,3.0,1.0,3.0
Assault,24/06/2016,15:00,"12°54'57.02""N","77°33'24.81""E",2016-06-24 15:00:00,15,0,3.0,1.0,3.0
Assault,12/07/2016,7:30,"12°55'12.00""N","77°34'18.51""E",2016-07-12 07:30:00,7,0,3.0,1.0,3.0
Assault,13/07/2016,4:30,"12°55'49.78""N","77°34'25.16""E",2016-07-13 04:30:00,4,1,3.0,1.5,4.5
Assault,15/07/2016,18:30,"12°55'30.48""N","77°33'53.04""E",2016-07-15 18:30:00,18,0,3.0,1.0,3.0
Assault,17/07/2016,11:00,"12°55'30.48""N","77°33'53.04""E",2016-07-17 11:00:00,11,0,3.0,1.0,3.0
Assault,17/07/2016,15:00,"12°55'3.64""N","77°33'49.98""E",2016-07-17 15:00:00,15,0,3.0,1.0,3.0
Assault,01/09/2016,19:00,"12°54'49.09""N","77°33'18.54""E",2016-09-01 19:00:00,19,1,3.0,1.5,4.5
Assault,16/09/2016,16:00,"12°55'49.78""N","77°34'25.16""E",2016-09-16 16:00:00,16,0,3.0,1.0,3.0
Assault,21/09/2016,11:00,"12°54'55.35""N","77°33'24.27""E",2016-09-21 11:00:00,11,0,3.0,1.0,3.0
Assault,22/09/2016,16:00,"12°54'55.35""N","77°33'24.27""E",2016-09-22 16:00:00,16,0,3.0,1.0,3.0
Assault,06/10/2016,11:00,"12°54'55.52""N","77°33'43.22""E",2016-10-06 11:00:00,11,0,3.0,1.0,3.0
Assault,11/10/2016,14:30,"12°54'55.52""N","77°33'43.22""E",2016-10-11 14:30:00,14,0,3.0,1.0,3.0
Assault,08/12/2016,20:20,"12°55'40.70""N","77°34'11.52""E",2016-12-08 20:20:00,20,1,3.0,1.5,4.5
Assault,22/12/2016,12:00,"12°55'10.75""N","77°34'26.57""E",2016-12-22 12:00:00,12,0,3.0,1.0,3.0
Assault,05/03/2017,15:00,"12°55'0.46""N","77°34'3.86""",2017-03-05 15:00:00,15,0,3.0,1.0,3.0
Assault,01/04/2017,13:00,12.931114,77.572438,2017-04-01 13:00:00,13,0,3.0,1.0,3.0
Assault,01/05/2017,16:00,12.91507,77.56806,2017-05-01 16:00:00,16,0,3.0,1.0,3.0
Assault,18/06/2017,22:30,"12°54'57.31""N","77°33'51.78""E",2017-06-18 22:30:00,22,1,3.0,1.5,4.5
Assault,24/06/2017,19:30,"12°55'0.46""N","77°34'3.86""",2017-06-24 19:30:00,19,1,3.0,1.5,4.5
Assault,08/07/2017,22:15,"12°55'59.36""N","77°34'10.90""E",2017-07-08 22:15:00,22,1,3.0,1.5,4.5
Assault,09/07/2017,1:15,"12°55'59.36""N","77°34'10.90""E",2017-07-09 01:15:00,1,1,3.0,1.5,4.5
Assault,19/07/2017,13:00,"12°55'22.65""N","77°34'12.30""E",2017-07-19 13:00:00,13,0,3.0,1.0,3.0
Assault,19/07/2017,14:00,"12°55'22.65""N","77°34'12.30""E",2017-07-19 14:00:00,14,0,3.0,1.0,3.0
Assault,28/07/2017,21:00,"12°55'21.52""N","77°34'2.75""E",2017-07-28 21:00:00,21,1,3.0,1.5,4.5
Assault,31/07/2017,19:30,12.909288,77.645849,2017-07-31 19:30:00,19,1,3.0,1.5,4.5
Assault,31/07/2017,20:20,12.934824,77.56557,2017-07-31 20:20:00,20,1,3.0,1.5,4.5
Assault,01/08/2017,10:00,"12°54'56.05""N","77°33'24.38""E",2017-08-01 10:00:00,10,0,3.0,1.0,3.0
Assault,01/08/2017,14:30,"12°55'34.88""N","77°34'36.95""E",2017-08-01 14:30:00,14,0,3.0,1.0,3.0
Assault,07/08/2017,12:00,12.932416,77.567696,2017-08-07 12:00:00,12,0,3.0,1.0,3.0
Assault,07/08/2017,12:30,12.921254,77.55559,2017-08-07 12:30:00,12,0,3.0,1.0,3.0
Assault,07/08/2017,19:00,"12°55'31.55""N","77°33'39.11""E",2017-08-07 19:00:00,19,1,3.0,1.5,4.5
Assault,09/08/2017,22:30,"12°55'21.52""N","77°34'2.75""E",2017-08-09 22:30:00,22,1,3.0,1.5,4.5
Assault,16/08/2017,6:30,"12°55'21.52""N","77°34'2.75""E",2017-08-16 06:30:00,6,0,3.0,1.0,3.0
Assault,21/08/2017,13:00,"12°55'22.65""N","77°34'12.30""E",2017-08-21 13:00:00,13,0,3.0,1.0,3.0
Assault,23/08/2017,9:10,"12°55'39.46""N","77°34'13.94""E",2017-08-23 09:10:00,9,0,3.0,1.0,3.0
Assault,26/08/2017,20:00,12.923069,72.7574224,2017-08-26 20:00:00,20,1,3.0,1.5,4.5
Assault,07/09/2017,10:10,"12°55'2.67""N","77°34'23.02""E",2017-09-07 10:10:00,10,0,3.0,1.0,3.0
Assault,11/09/2017,17:00,"12°55'34.88""N","77°34'36.95""E",2017-09-11 17:00:00,17,0,3.0,1.0,3.0
Assault,22/09/2017,12:30,"12°55'39.46""N","77°34'13.94""E",2017-09-22 12:30:00,12,0,3.0,1.0,3.0
Assault,18/11/2017,16:05,"12°55'18.20""N","77°34'24.78""E",2017-11-18 16:05:00,16,0,3.0,1.0,3.0
Assault,20/11/2017,12:30,"12°54'55.98""N","77°33'57.88""E",2017-11-20 12:30:00,12,0,3.0,1.0,3.0
Assault,12/12/2017,22:30,"12°55'8.38""N","77°33'24.37""",2017-12-12 22:30:00,22,1,3.0,1.5,4.5
Assault,13/12/2017,18:15,"12°54'57.84""N","77°33'48.96""E",2017-12-13 18:15:00,18,0,3.0,1.0,3.0
Assault,23/12/2017,15:00,"12°55'10.75""N","77°34'26.57""E",2017-12-23 15:00:00,15,0,3.0,1.0,3.0
Assault,06/01/2018,10:15,"12°54'49.09""N","77°33'18.54""E",2018-01-06 10:15:00,10,0,3.0,1.0,3.0
Assault,20/02/2018,10:00,"12°55'18.20""N","77°34'24.78""E",2018-02-20 10:00:00,10,0,3.0,1.0,3.0
Assault,20/02/2018,10:30,"12°54'57.84""N","77°33'48.96""E",2018-02-20 10:30:00,10,0,3.0,1.0,3.0
Assault,14/03/2018,21:00,"12°54'57.84""N","77°33'48.96""E",2018-03-14 21:00:00,21,1,3.0,1.5,4.5
Assault,17/03/2018,11:05,"12°55'18.20""N","77°34'24.78""E",2018-03-17 11:05:00,11,0,3.0,1.0,3.0
Assault,29/03/2018,11:45,"12°55'28.58""N","77°34'13.00""E",2018-03-29 11:45:00,11,0,3.0,1.0,3.0
Assault,29/03/2018,17:30,"12°55'29.96""N","77°33'58.55""E",2018-03-29 17:30:00,17,0,3.0,1.0,3.0
Assault,14/04/2018,17:00,"12°55'2.06""N","77°33'47.59""E",2018-04-14 17:00:00,17,0,3.0,1.0,3.0
Assault,18/06/2016,12:45,"12°55'3.06""N","77°33'12.19""E",2016-06-18 12:45:00,12,0,3.0,1.0,3.0
Assault,30/04/2018,13:10,"12°55'10.75""N","77°34'26.57""E",2018-04-30 13:10:00,13,0,3.0,1.0,3.0
Assault,05/05/2018,10:50,"12°55'8.38""N",77°33'24.37,2018-05-05 10:50:00,10,0,3.0,1.0,3.0
Assault,09/05/2018,17:45,"12°54'57.84""N","77°33'48.96""E",2018-05-09 17:45:00,17,0,3.0,1.0,3.0
Assault,21/05/2018,10:40,12.928339,77.56206,2018-05-21 10:40:00,10,0,3.0,1.0,3.0
Assault,24/05/2018,18:00,"12°55'31.55""N","77°33'39.11""E",2018-05-24 18:00:00,18,0,3.0,1.0,3.0
Assault,05/06/2018,14:35,"12°55'39.46""N","77°34'13.94""E",2018-06-05 14:35:00,14,0,3.0,1.0,3.0
Assault,07/07/2018,13:00,"12°55'39.46""N","77°34'13.94""E",2018-07-07 13:00:00,13,0,3.0,1.0,3.0
Assault,22/07/2018,18:30,"12°55'39.46""N","77°34'13.94""E",2018-07-22 18:30:00,18,0,3.0,1.0,3.0
Assault,26/07/2018,13:30,"12°54'57.84""N","77°33'48.96""E",2018-07-26 13:30:00,13,0,3.0,1.0,3.0
Assault,08/08/2018,17:10,12.909288,77.645849,2018-08-08 17:10:00,17,0,3.0,1.0,3.0
Assault,28/08/2018,13:30,"12°55'2.06""N","77°33'47.59""E",2018-08-28 13:30:00,13,0,3.0,1.0,3.0
Assault,02/09/2018,15:15,12.909288,77.645849,2018-09-02 15:15:00,15,0,3.0,1.0,3.0
Assault,11/09/2018,12:30,12.91795,77.55935,2018-09-11 12:30:00,12,0,3.0,1.0,3.0
Assault,15/09/2018,20:00,"12°55'22.65""N","77°34'12.30""E",2018-09-15 20:00:00,20,1,3.0,1.5,4.5
Assault,04/10/2018,12:30,"12°54'55.98""N","77°33'57.88""E",2018-10-04 12:30:00,12,0,3.0,1.0,3.0
Assault,21/10/2018,23:15,13.08595,77.54681,2018-10-21 23:15:00,23,1,3.0,1.5,4.5
Assault,09/11/2018,18:30,"12°55'5.33""N","77°34'19.83""E",2018-11-09 18:30:00,18,0,3.0,1.0,3.0
Assault,16/11/2018,17:00,12.87745,77.49977,2018-11-16 17:00:00,17,0,3.0,1.0,3.0
Assault,11/12/2018,18:45,"12°55'22.65""N","77°34'12.30""E",2018-12-11 18:45:00,18,0,3.0,1.0,3.0
Assault,21/12/2018,16:30,"12°55'10.75""N","77°34'26.57""E",2018-12-21 16:30:00,16,0,3.0,1.0,3.0
Assault,12/02/2019,18:10,"12°55'34.88""N","77°34'36.95""E",2019-02-12 18:10:00,18,0,3.0,1.0,3.0
Assault,19/02/2019,11:00,"12°55'0.89""N","77°34'3.78""E",2019-02-19 11:00:00,11,0,3.0,1.0,3.0
Assault,01/03/2019,11:15,"12°55'11.87""N","77°34'9.41""E",2019-03-01 11:15:00,11,0,3.0,1.0,3.0
Assault,26/04/2019,12:30,12.91507,77.56806,2019-04-26 12:30:00,12,0,3.0,1.0,3.0
Assault,03/06/2019,14:00,"12°55'15.01""N","77°34'26.97""E",2019-06-03 14:00:00,14,0,3.0,1.0,3.0
Assault,05/07/2019,18:30,"12°54'55.88""N","77°33'45.57""E",2019-07-05 18:30:00,18,0,3.0,1.0,3.0
Assault,22/08/2019,13:30,12.933159,77.562189,2019-08-22 13:30:00,13,0,3.0,1.0,3.0
Assault,17/09/2019,10:00,12.931114,77.572438,2019-09-17 10:00:00,10,0,3.0,1.0,3.0
Assault,07/10/2019,12:00,12.931114,77.572438,2019-10-07 12:00:00,12,0,3.0,1.0,3.0
Assault,09/10/2019,17:40,"12°55'3.36""N","77°34'22.32""E",2019-10-09 17:40:00,17,0,3.0,1.0,3.0
Assault,16/10/2019,20:05,"12°55'10.75""N","77°34'26.57""E",2019-10-16 20:05:00,20,1,3.0,1.5,4.5
Assault,31/12/2019,12:30,12.92171,77.58182,2019-12-31 12:30:00,12,0,3.0,1.0,3.0
Assault,07/01/2015,13:30,12.943049,77.593932,2015-01-07 13:30:00,13,0,3.0,1.0,3.0
Assault,07/01/2015,17:00,12.944431,77.592409,2015-01-07 17:00:00,17,0,3.0,1.0,3.0
Assault,07/01/2015,20:15,12.945278,77.595524,2015-01-07 20:15:00,20,1,3.0,1.5,4.5
Assault,27/02/2015,21:30,12.934752,77. 591933,2015-02-27 21:30:00,21,1,3.0,1.5,4.5
Assault,09/03/2015,23:15,12.944233,77.59324,2015-03-09 23:15:00,23,1,3.0,1.5,4.5
Assault,05/04/2015,21:00,12.934752,77. 591933,2015-04-05 21:00:00,21,1,3.0,1.5,4.5
Assault,09/04/2015,12:00,12.946857,77.590644,2015-04-09 12:00:00,12,0,3.0,1.0,3.0
Assault,21/04/2015,15:30,12.943434,77.591206,2015-04-21 15:30:00,15,0,3.0,1.0,3.0
Assault,21/04/2015,19:00,12.939397,77.581866,2015-04-21 19:00:00,19,1,3.0,1.5,4.5
Assault,02/05/2015,14:00,12.944892,77.592975,2015-05-02 14:00:00,14,0,3.0,1.0,3.0
Assault,08/05/2015,17:30,12.945817,77.591605,2015-05-08 17:30:00,17,0,3.0,1.0,3.0
Assault,08/05/2015,20:00,12.944759,77.588346,2015-05-08 20:00:00,20,1,3.0,1.5,4.5
Assault,04/07/2015,9:00,12.93316,77.591128,2015-07-04 09:00:00,9,0,3.0,1.0,3.0
Assault,09/07/2015,20:45,12.934473,77.59165,2015-07-09 20:45:00,20,1,3.0,1.5,4.5
Assault,24/07/2015,18:00,12.939379,77.5811,2015-07-24 18:00:00,18,0,3.0,1.0,3.0
Assault,02/08/2015,21:30,12.943708,77.591165,2015-08-02 21:30:00,21,1,3.0,1.5,4.5
Assault,04/08/2015,19:00,12.934752,77. 591933,2015-08-04 19:00:00,19,1,3.0,1.5,4.5
Assault,22/08/2015,9:30,12.945817,77.591605,2015-08-22 09:30:00,9,0,3.0,1.0,3.0
Assault,27/08/2015,14:00,12.944967,77.591029,2015-08-27 14:00:00,14,0,3.0,1.0,3.0
Assault,28/08/2015,0:00,12.947976,77.593348,2015-08-28 00:00:00,0,1,3.0,1.5,4.5
Assault,02/09/2015,13:00,12.941112,77.587016,2015-09-02 13:00:00,13,0,3.0,1.0,3.0
Assault,14/09/2015,19:00,12.935734,77.590385,2015-09-14 19:00:00,19,1,3.0,1.5,4.5
Assault,16/09/2015,11:50,12.93448,77.590688,2015-09-16 11:50:00,11,0,3.0,1.0,3.0
Assault,17/09/2015,11:45,12.934277,77.591799,2015-09-17 11:45:00,11,0,3.0,1.0,3.0
Assault,20/09/2015,6:30,12.945227,77.595169,2015-09-20 06:30:00,6,0,3.0,1.0,3.0
Assault,17/10/2015,17:30,12.942829,77.583746,2015-10-17 17:30:00,17,0,3.0,1.0,3.0
Assault,19/10/2015,13:30,12.935734,77.590385,2015-10-19 13:30:00,13,0,3.0,1.0,3.0
Assault,23/10/2015,16:00,12.952162,77.586903,2015-10-23 16:00:00,16,0,3.0,1.0,3.0
Assault,29/10/2015,19:20,12.93498,77.594952,2015-10-29 19:20:00,19,1,3.0,1.5,4.5
Assault,22/11/2015,15:00,12.934298,77.591304,2015-11-22 15:00:00,15,0,3.0,1.0,3.0
Assault,22/11/2015,15:05,12.934298,77.591304,2015-11-22 15:05:00,15,0,3.0,1.0,3.0
Assault,10/12/2015,18:30,12.944595,77.592055,2015-12-10 18:30:00,18,0,3.0,1.0,3.0
Assault,17/12/2015,20:00,12.939306,77.584061,2015-12-17 20:00:00,20,1,3.0,1.5,4.5
Assault,08/01/2016,17:15,12.938934,77.58403,2016-01-08 17:15:00,17,0,3.0,1.0,3.0
Assault,10/01/2016,13:30,12.945515,77.595353,2016-01-10 13:30:00,13,0,3.0,1.0,3.0
Assault,19/01/2016,13:00,12.942576,77.586741,2016-01-19 13:00:00,13,0,3.0,1.0,3.0
Assault,05/02/2016,12:45,12.945497,77.589562,2016-02-05 12:45:00,12,0,3.0,1.0,3.0
Assault,27/02/2016,16:00,12.943625,77.585229,2016-02-27 16:00:00,16,0,3.0,1.0,3.0
Assault,05/03/2016,9:00,12.948081,77.59328,2016-03-05 09:00:00,9,0,3.0,1.0,3.0
Assault,11/03/2016,10:30,12.948081,77.59328,2016-03-11 10:30:00,10,0,3.0,1.0,3.0
Assault,28/03/2016,11:00,12.942031,77.59273,2016-03-28 11:00:00,11,0,3.0,1.0,3.0
Assault,30/03/2016,17:00,12.943805,77.593021,2016-03-30 17:00:00,17,0,3.0,1.0,3.0
Assault,06/04/2016,10:20,12.942846,77.594419,2016-04-06 10:20:00,10,0,3.0,1.0,3.0
Assault,30/04/2016,20:00,12.938627,77.581218,2016-04-30 20:00:00,20,1,3.0,1.5,4.5
Assault,01/05/2016,20:00,12.94434,77.587818,2016-05-01 20:00:00,20,1,3.0,1.5,4.5
Assault,01/05/2016,20:15,12.94434,77.587818,2016-05-01 20:15:00,20,1,3.0,1.5,4.5
Assault,11/05/2016,18:00,12.939312,77.586619,2016-05-11 18:00:00,18,0,3.0,1.0,3.0
Assault,11/05/2016,18:15,12.939312,77.586619,2016-05-11 18:15:00,18,0,3.0,1.0,3.0
Assault,22/05/2016,19:00,12.94476,77.592926,2016-05-22 19:00:00,19,1,3.0,1.5,4.5
Assault,07/06/2016,14:00,12.945174,77.595589,2016-06-07 14:00:00,14,0,3.0,1.0,3.0
Assault,10/06/2016,19:10,12.935381,77.591364,2016-06-10 19:10:00,19,1,3.0,1.5,4.5
Assault,10/06/2016,20:00,12.946363,77.592187,2016-06-10 20:00:00,20,1,3.0,1.5,4.5
Assault,29/06/2016,14:25,12.942031,77.59273,2016-06-29 14:25:00,14,0,3.0,1.0,3.0
Assault,29/06/2016,14:50,12.942031,77.59273,2016-06-29 14:50:00,14,0,3.0,1.0,3.0
Assault,03/07/2016,19:50,12.946363,77.592187,2016-07-03 19:50:00,19,1,3.0,1.5,4.5
Assault,20/07/2016,18:00,12.944326,77.592316,2016-07-20 18:00:00,18,0,3.0,1.0,3.0
Assault,21/07/2016,18:00,12.945767,77.588683,2016-07-21 18:00:00,18,0,3.0,1.0,3.0
Assault,15/09/2016,14:00,12.935043,77.594564,2016-09-15 14:00:00,14,0,3.0,1.0,3.0
Assault,06/10/2016,22:30,12.944326,77.592316,2016-10-06 22:30:00,22,1,3.0,1.5,4.5
Assault,22/10/2016,18:00,12.946363,77.592187,2016-10-22 18:00:00,18,0,3.0,1.0,3.0
Assault,26/10/2016,16:00,12.938845,77.584454,2016-10-26 16:00:00,16,0,3.0,1.0,3.0
Assault,02/11/2016,16:00,12.946363,77.592187,2016-11-02 16:00:00,16,0,3.0,1.0,3.0
Assault,09/11/2016,23:00,12.9443,77.594642,2016-11-09 23:00:00,23,1,3.0,1.5,4.5
Assault,22/11/2016,12:00,12.946293,77.587991,2016-11-22 12:00:00,12,0,3.0,1.0,3.0
Assault,22/11/2016,21:15,12.94204,77.580231,2016-11-22 21:15:00,21,1,3.0,1.5,4.5
Assault,24/11/2016,18:00,12.933298,77.590399,2016-11-24 18:00:00,18,0,3.0,1.0,3.0
Assault,29/11/2016,20:00,12.943037,77.592151,2016-11-29 20:00:00,20,1,3.0,1.5,4.5
Assault,30/11/2016,11:30,12.94613,77.591819,2016-11-30 11:30:00,11,0,3.0,1.0,3.0
Assault,01/12/2016,18:00,12.937929,77.583003,2016-12-01 18:00:00,18,0,3.0,1.0,3.0
Assault,07/12/2016,17:00,12.944854,77.593404,2016-12-07 17:00:00,17,0,3.0,1.0,3.0
Assault,17/12/2016,16:00,12.944557,77.593306,2016-12-17 16:00:00,16,0,3.0,1.0,3.0
Assault,19/12/2016,20:45,12.935789,77.590731,2016-12-19 20:45:00,20,1,3.0,1.5,4.5
Assault,22/12/2016,21:40,12.944551,77.590853,2016-12-22 21:40:00,21,1,3.0,1.5,4.5
Assault,01/01/2017,10:00,12.945644,77.591948,2017-01-01 10:00:00,10,0,3.0,1.0,3.0
Assault,07/01/2017,19:30,12.940822,77.585287,2017-01-07 19:30:00,19,1,3.0,1.5,4.5
Assault,11/01/2017,20:00,12.947517,77.593858,2017-01-11 20:00:00,20,1,3.0,1.5,4.5
Assault,25/01/2017,20:00,12.947683,77.591842,2017-01-25 20:00:00,20,1,3.0,1.5,4.5
Assault,28/01/2017,17:30,12.94426,77.593698,2017-01-28 17:30:00,17,0,3.0,1.0,3.0
Assault,04/02/2017,23:45,12.934502,77.589918,2017-02-04 23:45:00,23,1,3.0,1.5,4.5
Assault,25/02/2017,18:05,12.947683,77.591842,2017-02-25 18:05:00,18,0,3.0,1.0,3.0
Assault,01/03/2017,19:45,12.940926,77.58016,2017-03-01 19:45:00,19,1,3.0,1.5,4.5
Assault,06/04/2017,2:45,12.935789,77.590731,2017-04-06 02:45:00,2,1,3.0,1.5,4.5
Assault,11/04/2017,19:00,12.947683,77.591842,2017-04-11 19:00:00,19,1,3.0,1.5,4.5
Assault,24/04/2017,16:50,12.938615,77.592593,2017-04-24 16:50:00,16,0,3.0,1.0,3.0
Assault,29/04/2017,17:00,12.94002,77.597691,2017-04-29 17:00:00,17,0,3.0,1.0,3.0
Assault,29/04/2017,17:45,12.94002,77.597691,2017-04-29 17:45:00,17,0,3.0,1.0,3.0
Assault,01/05/2017,21:45,12.947021,77.594827,2017-05-01 21:45:00,21,1,3.0,1.5,4.5
Assault,29/06/2017,15:00,12.942212,77.593014,2017-06-29 15:00:00,15,0,3.0,1.0,3.0
Assault,06/07/2017,21:30,12.938615,77.592593,2017-07-06 21:30:00,21,1,3.0,1.5,4.5
Assault,25/07/2017,17:00,12.94464,77.58856,2017-07-25 17:00:00,17,0,3.0,1.0,3.0
Assault,25/07/2017,21:00,12.94464,77.588556,2017-07-25 21:00:00,21,1,3.0,1.5,4.5
Assault,08/08/2017,17:20,12.941003,77.59305,2017-08-08 17:20:00,17,0,3.0,1.0,3.0
Assault,12/08/2017,11:00,12.946687,77.594214,2017-08-12 11:00:00,11,0,3.0,1.0,3.0
Assault,12/08/2017,15:30,12.946207,77.591757,2017-08-12 15:30:00,15,0,3.0,1.0,3.0
Assault,21/08/2017,14:00,12.937039,77.601442,2017-08-21 14:00:00,14,0,3.0,1.0,3.0
Assault,29/08/2017,18:00,12.94641,77.59122,2017-08-29 18:00:00,18,0,3.0,1.0,3.0
Assault,29/09/2017,11:30,12.949986,77.593303,2017-09-29 11:30:00,11,0,3.0,1.0,3.0
Assault,02/10/2017,18:30,12.944593,77.590967,2017-10-02 18:30:00,18,0,3.0,1.0,3.0
Assault,10/10/2017,21:00,12.945678,77.588087,2017-10-10 21:00:00,21,1,3.0,1.5,4.5
Assault,19/10/2017,19:45,12.952296,77.586374,2017-10-19 19:45:00,19,1,3.0,1.5,4.5
Assault,06/12/2017,14:50,12.933404,77.591176,2017-12-06 14:50:00,14,0,3.0,1.0,3.0
Assault,10/01/2018,11:00,12.939902,77.597686,2018-01-10 11:00:00,11,0,3.0,1.0,3.0
Assault,07/02/2018,13:00,12.937022,77.59812,2018-02-07 13:00:00,13,0,3.0,1.0,3.0
Assault,25/02/2018,18:30,12.949789,77.586582,2018-02-25 18:30:00,18,0,3.0,1.0,3.0
Assault,11/03/2018,9:00,12.944704,77.591956,2018-03-11 09:00:00,9,0,3.0,1.0,3.0
Assault,31/03/2018,11:00,12.942789,77.596405,2018-03-31 11:00:00,11,0,3.0,1.0,3.0
Assault,03/04/2018,9:30,12.943061,77.583877,2018-04-03 09:30:00,9,0,3.0,1.0,3.0
Assault,04/04/2018,9:30,12.946702,77.591877,2018-04-04 09:30:00,9,0,3.0,1.0,3.0
Assault,29/04/2018,10:10,12.936928,77.622424,2018-04-29 10:10:00,10,0,3.0,1.0,3.0
Assault,05/05/2018,12:30,12.933684,77.592256,2018-05-05 12:30:00,12,0,3.0,1.0,3.0
Assault,25/05/2018,23:15,12.934515,77.591787,2018-05-25 23:15:00,23,1,3.0,1.5,4.5
Assault,03/06/2018,19:00,12.945881,77.591753,2018-06-03 19:00:00,19,1,3.0,1.5,4.5
Assault,03/06/2018,21:30,12.945874,77.589693,2018-06-03 21:30:00,21,1,3.0,1.5,4.5
Assault,09/06/2018,13:45,12.946975,77.594347,2018-06-09 13:45:00,13,0,3.0,1.0,3.0
Assault,21/06/2018,20:45,12.946019,77.592086,2018-06-21 20:45:00,20,1,3.0,1.5,4.5
Assault,06/07/2018,10:00,12.936066,77.585757,2018-07-06 10:00:00,10,0,3.0,1.0,3.0
Assault,15/08/2018,19:00,12.944786,77.588481,2018-08-15 19:00:00,19,1,3.0,1.5,4.5
Assault,15/08/2018,19:30,12.944786,77.588481,2018-08-15 19:30:00,19,1,3.0,1.5,4.5
Assault,07/09/2018,14:30,12.93336,77.590672,2018-09-07 14:30:00,14,0,3.0,1.0,3.0
Assault,10/09/2018,18:30,12.946717,77.592068,2018-09-10 18:30:00,18,0,3.0,1.0,3.0
Assault,18/04/2019,19:00,12.9427756,77.593901,2019-04-18 19:00:00,19,1,3.0,1.5,4.5
Assault,24/04/2019,15:30,12.941015,77.580237,2019-04-24 15:30:00,15,0,3.0,1.0,3.0
Assault,30/04/2019,17:30,12.944998,77.593114,2019-04-30 17:30:00,17,0,3.0,1.0,3.0
Assault,14/06/2019,18:10,12.944719,77.588085,2019-06-14 18:10:00,18,0,3.0,1.0,3.0
Assault,17/08/2019,21:00,12.947918,77.593337,2019-08-17 21:00:00,21,1,3.0,1.5,4.5
Assault,30/08/2019,21:30,12.935595,77.591482,2019-08-30 21:30:00,21,1,3.0,1.5,4.5
Assault,18/09/2019,17:00,12.946237,77.591288,2019-09-18 17:00:00,17,0,3.0,1.0,3.0
Assault,06/11/2019,13:00,12.943253,77.592759,2019-11-06 13:00:00,13,0,3.0,1.0,3.0
Assault,11/11/2019,14:00,12.943611,77.588305,2019-11-11 14:00:00,14,0,3.0,1.0,3.0
Assault,13/12/2019,11:00,12.932763,77.599692,2019-12-13 11:00:00,11,0,3.0,1.0,3.0
Assault,13/12/2019,17:45,12.932763,77.599692,2019-12-13 17:45:00,17,0,3.0,1.0,3.0
Assault,06/01/2015,10:00,12.88259022,77.55804118,2015-01-06 10:00:00,10,0,3.0,1.0,3.0
Assault,12/01/2015,18:00,12.90353394,77.54124559,2015-01-12 18:00:00,18,0,3.0,1.0,3.0
Assault,12/01/2015,17:00,12.90353394,77.54124559,2015-01-12 17:00:00,17,0,3.0,1.0,3.0
Assault,14/01/2015,23:15,12.88849116,77.55160999,2015-01-14 23:15:00,23,1,3.0,1.5,4.5
Assault,23/01/2015,10:45,12.89342871,77.55070305,2015-01-23 10:45:00,10,0,3.0,1.0,3.0
Assault,23/01/2015,19:30,12.89957983,77.57417171,2015-01-23 19:30:00,19,1,3.0,1.5,4.5
Assault,24/01/2015,8:45,12.91386713,77.54283946,2015-01-24 08:45:00,8,0,3.0,1.0,3.0
Assault,27/01/2015,21:00,12.89594801,77.55219028,2015-01-27 21:00:00,21,1,3.0,1.5,4.5
Assault,27/01/2015,9:00,12.89263457,77.58263211,2015-01-27 09:00:00,9,0,3.0,1.0,3.0
Assault,28/01/2015,22:30,12.90661057,77.54316239,2015-01-28 22:30:00,22,1,3.0,1.5,4.5
Assault,29/01/2015,16:45,12.90661057,77.54316239,2015-01-29 16:45:00,16,0,3.0,1.0,3.0
Assault,31/01/2015,15:10,12.90827601,77.55022679,2015-01-31 15:10:00,15,0,3.0,1.0,3.0
Assault,31/01/2015,16:00,12.89110885,77.56991103,2015-01-31 16:00:00,16,0,3.0,1.0,3.0
Assault,04/02/2015,19:45,12.88332979,77.55808014,2015-02-04 19:45:00,19,1,3.0,1.5,4.5
Assault,09/02/2015,11:35,12.89020726,77.56311454,2015-02-09 11:35:00,11,0,3.0,1.0,3.0
Assault,14/02/2015,1:30,12.86918089,77.5857439,2015-02-14 01:30:00,1,1,3.0,1.5,4.5
Assault,20/02/2015,2:00,12.91039335,77.53743981,2015-02-20 02:00:00,2,1,3.0,1.5,4.5
Assault,20/02/2015,6:40,12.91039335,77.53743981,2015-02-20 06:40:00,6,0,3.0,1.0,3.0
Assault,22/02/2015,5:30,12.90108207,77.54753806,2015-02-22 05:30:00,5,1,3.0,1.5,4.5
Assault,26/02/2015,5:00,12.88924511,77.57370198,2015-02-26 05:00:00,5,1,3.0,1.5,4.5
Assault,26/02/2015,12:30,12.88566566,77.55349801,2015-02-26 12:30:00,12,0,3.0,1.0,3.0
Assault,27/02/2015,14:00,12.87284621,77.58266707,2015-02-27 14:00:00,14,0,3.0,1.0,3.0
Assault,27/02/2015,15:00,12.8887116,77.57377343,2015-02-27 15:00:00,15,0,3.0,1.0,3.0
Assault,27/02/2015,10:10,12.87284621,77.58266707,2015-02-27 10:10:00,10,0,3.0,1.0,3.0
Assault,02/03/2015,5:10,12.91381524,77.54861884,2015-03-02 05:10:00,5,1,3.0,1.5,4.5
Assault,04/03/2015,12:10,12.89047086,77.57081006,2015-03-04 12:10:00,12,0,3.0,1.0,3.0
Assault,06/03/2015,15:00,12.89108202,77.57815502,2015-03-06 15:00:00,15,0,3.0,1.0,3.0
Assault,06/03/2015,21:10,13.00748497,77.56788031,2015-03-06 21:10:00,21,1,3.0,1.5,4.5
Assault,09/03/2015,18:40,12.90353394,77.54124559,2015-03-09 18:40:00,18,0,3.0,1.0,3.0
Assault,18/03/2015,19:30,12.91147627,77.5401234,2015-03-18 19:30:00,19,1,3.0,1.5,4.5
Assault,25/03/2015,17:00,12.90471042,77.54488816,2015-03-25 17:00:00,17,0,3.0,1.0,3.0
Assault,29/03/2015,19:00,12.88328789,77.58130555,2015-03-29 19:00:00,19,1,3.0,1.5,4.5
Assault,29/03/2015,12:15,12.88328789,77.58130555,2015-03-29 12:15:00,12,0,3.0,1.0,3.0
Assault,02/04/2015,14:45,12.90958449,77.55159728,2015-04-02 14:45:00,14,0,3.0,1.0,3.0
Assault,04/04/2015,8:40,12.89528068,77.55067452,2015-04-04 08:40:00,8,0,3.0,1.0,3.0
Assault,05/04/2015,11:15,12.88398975,77.56552231,2015-04-05 11:15:00,11,0,3.0,1.0,3.0
Assault,08/04/2015,2:45,12.87645503,77.58473542,2015-04-08 02:45:00,2,1,3.0,1.5,4.5
Assault,14/04/2015,10:15,12.9057223,77.53558126,2015-04-14 10:15:00,10,0,3.0,1.0,3.0
Assault,21/04/2015,13:35,12.90545457,77.54187553,2015-04-21 13:35:00,13,0,3.0,1.0,3.0
Assault,25/04/2015,11:15,12.87915064,77.57683666,2015-04-25 11:15:00,11,0,3.0,1.0,3.0
Assault,10/05/2015,17:45,12.88864991,77.5613003,2015-05-10 17:45:00,17,0,3.0,1.0,3.0
Assault,12/05/2015,10:20,12.91564682,77.53910415,2015-05-12 10:20:00,10,0,3.0,1.0,3.0
Assault,17/05/2015,18:15,12.8790849,77.56780965,2015-05-17 18:15:00,18,0,3.0,1.0,3.0
Assault,18/05/2015,18:40,12.90353394,77.54124559,2015-05-18 18:40:00,18,0,3.0,1.0,3.0
Assault,19/05/2015,14:20,12.90468502,77.54288417,2015-05-19 14:20:00,14,0,3.0,1.0,3.0
Assault,21/05/2015,18:20,12.870236,77.57874006,2015-05-21 18:20:00,18,0,3.0,1.0,3.0
Assault,31/05/2015,9:00,12.90874577,77.55546611,2015-05-31 09:00:00,9,0,3.0,1.0,3.0
Assault,08/06/2015,23:20,12.86854765,77.5801126,2015-06-08 23:20:00,23,1,3.0,1.5,4.5
Assault,26/06/2015,14:35,12.91688388,77.54201107,2015-06-26 14:35:00,14,0,3.0,1.0,3.0
Assault,02/07/2015,17:40,12.91688388,77.54201107,2015-07-02 17:40:00,17,0,3.0,1.0,3.0
Assault,04/07/2015,14:40,12.91022894,77.5481594,2015-07-04 14:40:00,14,0,3.0,1.0,3.0
Assault,16/07/2015,14:15,12.91739661,77.54533797,2015-07-16 14:15:00,14,0,3.0,1.0,3.0
Assault,16/07/2015,14:30,12.89825057,77.54800705,2015-07-16 14:30:00,14,0,3.0,1.0,3.0
Assault,16/07/2015,19:00,12.89110885,77.56991103,2015-07-16 19:00:00,19,1,3.0,1.5,4.5
Assault,19/07/2015,12:50,12.9060275,77.54555561,2015-07-19 12:50:00,12,0,3.0,1.0,3.0
Assault,25/07/2015,15:30,12.87795004,77.58300166,2015-07-25 15:30:00,15,0,3.0,1.0,3.0
Assault,03/08/2015,11:10,12.88211726,77.55729374,2015-08-03 11:10:00,11,0,3.0,1.0,3.0
Assault,11/08/2015,16:30,12.88211726,77.55729374,2015-08-11 16:30:00,16,0,3.0,1.0,3.0
Assault,29/08/2015,15:30,12.89528068,77.55067452,2015-08-29 15:30:00,15,0,3.0,1.0,3.0
Assault,03/09/2015,10:15,12.89964065,77.54399956,2015-09-03 10:15:00,10,0,3.0,1.0,3.0
Assault,04/09/2015,10:30,12.89964065,77.54399956,2015-09-04 10:30:00,10,0,3.0,1.0,3.0
Assault,11/09/2015,19:20,12.86854765,77.5801126,2015-09-11 19:20:00,19,1,3.0,1.5,4.5
Assault,13/09/2015,18:30,12.86854765,77.5801126,2015-09-13 18:30:00,18,0,3.0,1.0,3.0
Assault,14/09/2015,19:45,12.90620929,77.53659557,2015-09-14 19:45:00,19,1,3.0,1.5,4.5
Assault,15/09/2015,16:04,12.89062558,77.56405571,2015-09-15 16:04:00,16,0,3.0,1.0,3.0
Assault,27/09/2015,21:15,12.88045896,77.56403544,2015-09-27 21:15:00,21,1,3.0,1.5,4.5
Assault,19/09/2015,15:10,12.91390096,77.55882025,2015-09-19 15:10:00,15,0,3.0,1.0,3.0
Assault,29/08/2015,13:00,12.89528068,77.55067452,2015-08-29 13:00:00,13,0,3.0,1.0,3.0
Assault,06/10/2015,17:30,12.89071518,77.5768453,2015-10-06 17:30:00,17,0,3.0,1.0,3.0
Assault,07/10/2015,11:40,12.9154534,77.54004271,2015-10-07 11:40:00,11,0,3.0,1.0,3.0
Assault,08/10/2015,23:30,12.9154534,77.54004271,2015-10-08 23:30:00,23,1,3.0,1.5,4.5
Assault,08/10/2015,17:10,12.89071518,77.5768453,2015-10-08 17:10:00,17,0,3.0,1.0,3.0
Assault,11/10/2015,10:00,12.89071518,77.5768453,2015-10-11 10:00:00,10,0,3.0,1.0,3.0
Assault,15/10/2015,20:00,12.88211726,77.55729374,2015-10-15 20:00:00,20,1,3.0,1.5,4.5
Assault,18/10/2015,18:50,12.89637642,77.54752793,2015-10-18 18:50:00,18,0,3.0,1.0,3.0
Assault,18/10/2015,14:00,12.89637642,77.54752793,2015-10-18 14:00:00,14,0,3.0,1.0,3.0
Assault,30/10/2015,12:00,12.90108207,77.54753806,2015-10-30 12:00:00,12,0,3.0,1.0,3.0
Assault,04/11/2015,15:30,12.91641215,77.55006231,2015-11-04 15:30:00,15,0,3.0,1.0,3.0
Assault,04/11/2015,10:00,12.90862205,77.55531561,2015-11-04 10:00:00,10,0,3.0,1.0,3.0
Assault,28/11/2015,22:00,12.89033243,77.56334831,2015-11-28 22:00:00,22,1,3.0,1.5,4.5
Assault,11/12/2015,16:00,12.90552889,77.55685074,2015-12-11 16:00:00,16,0,3.0,1.0,3.0
Assault,15/12/2015,17:00,12.88242852,77.55732835,2015-12-15 17:00:00,17,0,3.0,1.0,3.0
Assault,15/12/2015,21:20,12.88242852,77.55732835,2015-12-15 21:20:00,21,1,3.0,1.5,4.5
Assault,25/12/2015,10:30,12.88242852,77.55732835,2015-12-25 10:30:00,10,0,3.0,1.0,3.0
Assault,30/12/2015,13:20,12.91766067,77.54218713,2015-12-30 13:20:00,13,0,3.0,1.0,3.0
Assault,31/12/2015,20:45,12.86938358,77.58391056,2015-12-31 20:45:00,20,1,3.0,1.5,4.5
Assault,31/12/2015,23:50,12.90552889,77.55685074,2015-12-31 23:50:00,23,1,3.0,1.5,4.5
Assault,07/01/2016,15:15,12.91390096,77.55882025,2016-01-07 15:15:00,15,0,3.0,1.0,3.0
Assault,22/01/2016,18:00,12.89050892,77.57361002,2016-01-22 18:00:00,18,0,3.0,1.0,3.0
Assault,08/02/2016,15:30,12.8887116,77.57377343,2016-02-08 15:30:00,15,0,3.0,1.0,3.0
Assault,10/02/2016,12:20,12.8656847,77.58241633,2016-02-10 12:20:00,12,0,3.0,1.0,3.0
Assault,15/02/2016,15:20,12.91081042,77.53771819,2016-02-15 15:20:00,15,0,3.0,1.0,3.0
Assault,16/02/2016,18:00,12.8967726,77.5445644,2016-02-16 18:00:00,18,0,3.0,1.0,3.0
Assault,18/02/2016,22:30,12.91429834,77.55075847,2016-02-18 22:30:00,22,1,3.0,1.5,4.5
Assault,23/02/2016,7:10,12.91688388,77.54201107,2016-02-23 07:10:00,7,0,3.0,1.0,3.0
Assault,02/03/2016,9:30,12.8656847,77.58241633,2016-03-02 09:30:00,9,0,3.0,1.0,3.0
Assault,13/03/2016,14:40,12.91739661,77.54533797,2016-03-13 14:40:00,14,0,3.0,1.0,3.0
Assault,14/03/2016,10:00,12.8887116,77.57377343,2016-03-14 10:00:00,10,0,3.0,1.0,3.0
Assault,22/03/2016,18:30,12.91242363,77.54851768,2016-03-22 18:30:00,18,0,3.0,1.0,3.0
Assault,25/03/2016,16:00,12.90868716,77.54411899,2016-03-25 16:00:00,16,0,3.0,1.0,3.0
Assault,29/03/2016,20:45,12.9158664,77.53979815,2016-03-29 20:45:00,20,1,3.0,1.5,4.5
Assault,01/04/2016,18:30,12.86717163,77.58310043,2016-04-01 18:30:00,18,0,3.0,1.0,3.0
Assault,09/04/2016,18:30,12.89572496,77.5719447,2016-04-09 18:30:00,18,0,3.0,1.0,3.0
Assault,28/04/2016,9:30,12.91081042,77.53771819,2016-04-28 09:30:00,9,0,3.0,1.0,3.0
Assault,02/05/2016,17:30,12.91242457,77.53558039,2016-05-02 17:30:00,17,0,3.0,1.0,3.0
Assault,13/05/2016,7:50,12.91084893,77.53745649,2016-05-13 07:50:00,7,0,3.0,1.0,3.0
Assault,24/05/2016,12:50,12.88864991,77.5613003,2016-05-24 12:50:00,12,0,3.0,1.0,3.0
Assault,30/05/2016,12:50,12.88350116,77.56902319,2016-05-30 12:50:00,12,0,3.0,1.0,3.0
Assault,02/06/2016,13:00,12.8833525,77.55998912,2016-06-02 13:00:00,13,0,3.0,1.0,3.0
Assault,14/06/2016,15:30,12.88496438,77.55767556,2016-06-14 15:30:00,15,0,3.0,1.0,3.0
Assault,16/06/2016,11:00,12.9072655,77.53613997,2016-06-16 11:00:00,11,0,3.0,1.0,3.0
Assault,20/06/2016,11:45,12.91242363,77.54851768,2016-06-20 11:45:00,11,0,3.0,1.0,3.0
Assault,05/07/2016,11:30,12.89180481,77.55394005,2016-07-05 11:30:00,11,0,3.0,1.0,3.0
Assault,10/07/2016,14:30,12.90419243,77.54053594,2016-07-10 14:30:00,14,0,3.0,1.0,3.0
Assault,20/07/2016,18:15,12.89572496,77.5719447,2016-07-20 18:15:00,18,0,3.0,1.0,3.0
Assault,28/07/2016,10:45,12.9067446,77.5437391,2016-07-28 10:45:00,10,0,3.0,1.0,3.0
Assault,28/07/2016,13:15,12.8776868,77.58071703,2016-07-28 13:15:00,13,0,3.0,1.0,3.0
Assault,28/07/2016,10:30,12.8776868,77.58071703,2016-07-28 10:30:00,10,0,3.0,1.0,3.0
Assault,03/08/2016,14:00,12.88376625,77.56842522,2016-08-03 14:00:00,14,0,3.0,1.0,3.0
Assault,15/08/2016,10:40,12.91828297,77.55232885,2016-08-15 10:40:00,10,0,3.0,1.0,3.0
Assault,28/08/2016,12:15,12.91157239,77.53877462,2016-08-28 12:15:00,12,0,3.0,1.0,3.0
Assault,02/09/2016,13:00,12.88806808,77.56973981,2016-09-02 13:00:00,13,0,3.0,1.0,3.0
Assault,03/09/2016,14:00,12.9031545,77.5438607,2016-09-03 14:00:00,14,0,3.0,1.0,3.0
Assault,04/09/2016,20:15,12.9098892799034,77.5509633514439,2016-09-04 20:15:00,20,1,3.0,1.5,4.5
Assault,05/09/2016,21:10,12.88350116,77.56902319,2016-09-05 21:10:00,21,1,3.0,1.5,4.5
Assault,09/09/2016,22:45,12.90512329,77.54375125,2016-09-09 22:45:00,22,1,3.0,1.5,4.5
Assault,30/09/2016,8:00,12.9067446,77.5437391,2016-09-30 08:00:00,8,0,3.0,1.0,3.0
Assault,25/10/2016,15:00,12.90977693,77.55646166,2016-10-25 15:00:00,15,0,3.0,1.0,3.0
Assault,11/11/2016,20:00,12.91663814,77.56259702,2016-11-11 20:00:00,20,1,3.0,1.5,4.5
Assault,29/11/2016,11:00,12.91009902,77.55485809,2016-11-29 11:00:00,11,0,3.0,1.0,3.0
Assault,26/12/2016,11:35,12.911738,77.556877,2016-12-26 11:35:00,11,0,3.0,1.0,3.0
Assault,15/01/2017,12:15,12.88292452,77.58206937,2017-01-15 12:15:00,12,0,3.0,1.0,3.0
Assault,22/01/2017,13:00,12.88023219,77.57384591,2017-01-22 13:00:00,13,0,3.0,1.0,3.0
Assault,28/01/2017,14:00,13.00748497,77.56788031,2017-01-28 14:00:00,14,0,3.0,1.0,3.0
Assault,30/01/2017,18:00,12.89021991,77.56305833,2017-01-30 18:00:00,18,0,3.0,1.0,3.0
Assault,31/01/2017,17:00,12.88056739,77.56692379,2017-01-31 17:00:00,17,0,3.0,1.0,3.0
Assault,06/02/2017,9:00,12.9144943,77.55021425,2017-02-06 09:00:00,9,0,3.0,1.0,3.0
Assault,02/03/2017,9:30,12.8952806790666,77.5506745177223,2017-03-02 09:30:00,9,0,3.0,1.0,3.0
Assault,05/03/2017,18:30,12.88339446,77.55687281,2017-03-05 18:30:00,18,0,3.0,1.0,3.0
Assault,23/03/2017,9:00,12.90977693,77.55646166,2017-03-23 09:00:00,9,0,3.0,1.0,3.0
Assault,29/03/2017,10:15,12.88292452,77.58206937,2017-03-29 10:15:00,10,0,3.0,1.0,3.0
Assault,12/04/2017,12:20,12.88292452,77.58206937,2017-04-12 12:20:00,12,0,3.0,1.0,3.0
Assault,19/05/2017,15:30,12.911738,77.556877,2017-05-19 15:30:00,15,0,3.0,1.0,3.0
Assault,06/06/2017,11:30,12.90623249,77.54272573,2017-06-06 11:30:00,11,0,3.0,1.0,3.0
Assault,18/07/2017,14:40,12.88255509,77.5563552,2017-07-18 14:40:00,14,0,3.0,1.0,3.0
Assault,24/08/2017,20:15,12.88211726,77.55729374,2017-08-24 20:15:00,20,1,3.0,1.5,4.5
Assault,28/08/2017,13:00,12.90419243,77.54053594,2017-08-28 13:00:00,13,0,3.0,1.0,3.0
Assault,02/09/2017,11:10,12.89189796,77.55236918,2017-09-02 11:10:00,11,0,3.0,1.0,3.0
Assault,19/09/2017,15:00,12.88255509,77.5563552,2017-09-19 15:00:00,15,0,3.0,1.0,3.0
Assault,19/09/2017,18:30,12.89246857,77.57540769,2017-09-19 18:30:00,18,0,3.0,1.0,3.0
Assault,03/10/2017,10:00,12.9057223,77.53558126,2017-10-03 10:00:00,10,0,3.0,1.0,3.0
Assault,12/10/2017,20:15,12.89246857,77.57540769,2017-10-12 20:15:00,20,1,3.0,1.5,4.5
Assault,18/10/2017,13:00,12.905759,77.542703,2017-10-18 13:00:00,13,0,3.0,1.0,3.0
Assault,31/10/2017,18:30,12.91828297,77.55232885,2017-10-31 18:30:00,18,0,3.0,1.0,3.0
Assault,23/11/2017,18:30,12.91688388,77.54201107,2017-11-23 18:30:00,18,0,3.0,1.0,3.0
Assault,01/12/2017,9:00,12.91945321,77.54680384,2017-12-01 09:00:00,9,0,3.0,1.0,3.0
Assault,11/12/2017,11:00,12.88858018,77.56120326,2017-12-11 11:00:00,11,0,3.0,1.0,3.0
Assault,12/12/2017,7:00,12.9069823,77.552059,2017-12-12 07:00:00,7,0,3.0,1.0,3.0
Assault,22/12/2017,10:00,12.88948381,77.56232091,2017-12-22 10:00:00,10,0,3.0,1.0,3.0
Assault,27/12/2017,11:15,12.91147627,77.5401234,2017-12-27 11:15:00,11,0,3.0,1.0,3.0
Assault,07/01/2018,13:00,12.90471042,77.54488816,2018-01-07 13:00:00,13,0,3.0,1.0,3.0
Assault,13/01/2018,11:15,12.91424733,77.54961937,2018-01-13 11:15:00,11,0,3.0,1.0,3.0
Assault,13/01/2018,18:30,12.9031545,77.5438607,2018-01-13 18:30:00,18,0,3.0,1.0,3.0
Assault,14/01/2018,11:15,12.9145439,77.54016178,2018-01-14 11:15:00,11,0,3.0,1.0,3.0
Assault,30/01/2018,11:15,12.90773892,77.53628814,2018-01-30 11:15:00,11,0,3.0,1.0,3.0
Assault,10/02/2018,11:15,12.88948381,77.56232091,2018-02-10 11:15:00,11,0,3.0,1.0,3.0
Assault,21/02/2018,18:30,12.91031858,77.5563932,2018-02-21 18:30:00,18,0,3.0,1.0,3.0
Assault,21/02/2018,20:00,12.89200041,77.57428171,2018-02-21 20:00:00,20,1,3.0,1.5,4.5
Assault,09/03/2018,9:00,12.90989234,77.55673516,2018-03-09 09:00:00,9,0,3.0,1.0,3.0
Assault,21/03/2018,9:40,12.88023219,77.57384591,2018-03-21 09:40:00,9,0,3.0,1.0,3.0
Assault,13/04/2018,9:00,12.91424733,77.54961937,2018-04-13 09:00:00,9,0,3.0,1.0,3.0
Assault,23/04/2018,10:00,12.91688388,77.54201107,2018-04-23 10:00:00,10,0,3.0,1.0,3.0
Assault,16/05/2018,11:15,12.90809631,77.54853759,2018-05-16 11:15:00,11,0,3.0,1.0,3.0
Assault,22/05/2018,13:00,12.89020726,77.56311454,2018-05-22 13:00:00,13,0,3.0,1.0,3.0
Assault,29/07/2018,20:15,12.91564682,77.53910415,2018-07-29 20:15:00,20,1,3.0,1.5,4.5
Assault,08/08/2018,9:00,12.90545457,77.54187553,2018-08-08 09:00:00,9,0,3.0,1.0,3.0
Assault,22/08/2018,11:00,12.90353394,77.54124559,2018-08-22 11:00:00,11,0,3.0,1.0,3.0
Assault,22/08/2018,18:30,12.90353394,77.54124559,2018-08-22 18:30:00,18,0,3.0,1.0,3.0
Assault,24/08/2018,9:00,12.88010332,77.57426142,2018-08-24 09:00:00,9,0,3.0,1.0,3.0
Assault,24/08/2018,9:00,12.89638857,77.54451167,2018-08-24 09:00:00,9,0,3.0,1.0,3.0
Assault,29/08/2018,9:00,12.905759,77.5427,2018-08-29 09:00:00,9,0,3.0,1.0,3.0
Assault,19/11/2018,10:00,12.89025011,77.58218798,2018-11-19 10:00:00,10,0,3.0,1.0,3.0
Assault,23/11/2018,13:00,12.88992359,77.58079977,2018-11-23 13:00:00,13,0,3.0,1.0,3.0
Assault,14/12/2018,18:30,12.91563196,77.55525352,2018-12-14 18:30:00,18,0,3.0,1.0,3.0
Assault,18/12/2018,9:00,12.90836274,77.55368473,2018-12-18 09:00:00,9,0,3.0,1.0,3.0
Assault,06/01/2019,9:00,12.91242363,77.54851768,2019-01-06 09:00:00,9,0,3.0,1.0,3.0
Assault,06/01/2019,11:15,12.91242363,77.54851768,2019-01-06 11:15:00,11,0,3.0,1.0,3.0
Assault,23/01/2019,9:00,12.90108207,77.54753806,2019-01-23 09:00:00,9,0,3.0,1.0,3.0
Assault,28/01/2019,13:00,12.88292452,77.58206937,2019-01-28 13:00:00,13,0,3.0,1.0,3.0
Assault,30/01/2019,20:15,12.9060275,77.54555561,2019-01-30 20:15:00,20,1,3.0,1.5,4.5
Assault,22/02/2019,10:00,12.91016458,77.53811823,2019-02-22 10:00:00,10,0,3.0,1.0,3.0
Assault,26/02/2019,9:00,12.9057223,77.53558126,2019-02-26 09:00:00,9,0,3.0,1.0,3.0
Assault,05/03/2019,9:00,12.89594801,77.55219028,2019-03-05 09:00:00,9,0,3.0,1.0,3.0
Assault,11/03/2019,9:00,12.91412376,77.54086376,2019-03-11 09:00:00,9,0,3.0,1.0,3.0
Assault,11/03/2019,21:00,12.91641215,77.55006231,2019-03-11 21:00:00,21,1,3.0,1.5,4.5
Assault,18/03/2019,9:00,12.91390096,77.55882025,2019-03-18 09:00:00,9,0,3.0,1.0,3.0
Assault,19/03/2019,21:00,12.90505271,77.54189573,2019-03-19 21:00:00,21,1,3.0,1.5,4.5
Assault,22/03/2019,21:00,12.8836526,77.58177943,2019-03-22 21:00:00,21,1,3.0,1.5,4.5
Assault,25/03/2019,21:00,12.9144943,77.55021425,2019-03-25 21:00:00,21,1,3.0,1.5,4.5
Assault,29/03/2019,21:00,12.86717163,77.58310043,2019-03-29 21:00:00,21,1,3.0,1.5,4.5
Assault,08/04/2019,21:00,12.89200041,77.57428171,2019-04-08 21:00:00,21,1,3.0,1.5,4.5
Assault,08/04/2019,18:00,12.91548032,77.54962241,2019-04-08 18:00:00,18,0,3.0,1.0,3.0
Assault,11/04/2019,10:00,12.89825057,77.54800705,2019-04-11 10:00:00,10,0,3.0,1.0,3.0
Assault,20/04/2019,11:15,12.9057223,77.53558126,2019-04-20 11:15:00,11,0,3.0,1.0,3.0
Assault,25/04/2019,10:00,12.903573,77.543788,2019-04-25 10:00:00,10,0,3.0,1.0,3.0
Assault,04/05/2019,17:00,12.90860182,77.53621018,2019-05-04 17:00:00,17,0,3.0,1.0,3.0
Assault,14/05/2019,13:00,12.908367,77.541598,2019-05-14 13:00:00,13,0,3.0,1.0,3.0
Assault,14/05/2019,18:30,12.909619,77.549214,2019-05-14 18:30:00,18,0,3.0,1.0,3.0
Assault,27/06/2019,21:00,12.90699357,77.53582623,2019-06-27 21:00:00,21,1,3.0,1.5,4.5
Assault,01/07/2019,21:00,12.88376625,77.56842522,2019-07-01 21:00:00,21,1,3.0,1.5,4.5
Assault,10/07/2019,18:30,12.89157884,77.58142943,2019-07-10 18:30:00,18,0,3.0,1.0,3.0
Assault,05/08/2019,21:00,12.91429834,77.55075847,2019-08-05 21:00:00,21,1,3.0,1.5,4.5
Assault,06/08/2019,18:20,12.89025011,77.58218798,2019-08-06 18:20:00,18,0,3.0,1.0,3.0
Assault,22/08/2019,13:00,12.9057223,77.53558126,2019-08-22 13:00:00,13,0,3.0,1.0,3.0
Assault,09/09/2019,21:00,12.9057223,77.53558126,2019-09-09 21:00:00,21,1,3.0,1.5,4.5
Assault,11/09/2019,11:15,12.91564682,77.53910415,2019-09-11 11:15:00,11,0,3.0,1.0,3.0
Assault,11/11/2019,21:00,12.90797019,77.53636053,2019-11-11 21:00:00,21,1,3.0,1.5,4.5
Assault,29/11/2019,10:00,12.88292452,77.58206937,2019-11-29 10:00:00,10,0,3.0,1.0,3.0
Assault,15/12/2019,11:15,12.88292452,77.58206937,2019-12-15 11:15:00,11,0,3.0,1.0,3.0
Assault,18/01/2015,16:45,12.869623,77.561821,2015-01-18 16:45:00,16,0,3.0,1.0,3.0
Assault,28/01/2015,21:30,12.871692,77.54315,2015-01-28 21:30:00,21,1,3.0,1.5,4.5
Assault,28/01/2015,22:15,12.871191,77.543016,2015-01-28 22:15:00,22,1,3.0,1.5,4.5
Assault,11/02/2015,17:30,12.859118,77.572322,2015-02-11 17:30:00,17,0,3.0,1.0,3.0
Assault,22/02/2015,18:00,12.894204,77.54277,2015-02-22 18:00:00,18,0,3.0,1.0,3.0
Assault,08/03/2015,23:30,12.893191,77.542505,2015-03-08 23:30:00,23,1,3.0,1.5,4.5
Assault,13/03/2015,14:00,12.871628,77.561261,2015-03-13 14:00:00,14,0,3.0,1.0,3.0
Assault,14/03/2015,13:00,12.893554,77.538895,2015-03-14 13:00:00,13,0,3.0,1.0,3.0
Assault,22/03/2015,14:05,12.8698,77.555385,2015-03-22 14:05:00,14,0,3.0,1.0,3.0
Assault,26/03/2015,13:30,12.877426,77.539985,2015-03-26 13:30:00,13,0,3.0,1.0,3.0
Assault,26/03/2015,14:00,12.876958,77.539428,2015-03-26 14:00:00,14,0,3.0,1.0,3.0
Assault,15/04/2015,11:00,12.856172,77.555703,2015-04-15 11:00:00,11,0,3.0,1.0,3.0
Assault,19/04/2015,13:15,12.860333,77.523031,2015-04-19 13:15:00,13,0,3.0,1.0,3.0
Assault,24/04/2015,15:10,12.883543,77.547526,2015-04-24 15:10:00,15,0,3.0,1.0,3.0
Assault,29/04/2015,11:00,12.881747,77.546289,2015-04-29 11:00:00,11,0,3.0,1.0,3.0
Assault,03/04/2015,14:00,12.881747,77.546289,2015-04-03 14:00:00,14,0,3.0,1.0,3.0
Assault,08/05/2015,16:00,12.863652,77.555527,2015-05-08 16:00:00,16,0,3.0,1.0,3.0
Assault,19/05/2015,21:00,12.891342,77.523967,2015-05-19 21:00:00,21,1,3.0,1.5,4.5
Assault,22/05/2015,22:00,12.864784,77.55421,2015-05-22 22:00:00,22,1,3.0,1.5,4.5
Assault,26/05/2015,18:30,12.856018,77.564528,2015-05-26 18:30:00,18,0,3.0,1.0,3.0
Assault,26/05/2015,0:15,12.890073,77.542276,2015-05-26 00:15:00,0,1,3.0,1.5,4.5
Assault,01/06/2015,13:50,12.866266,77.543685,2015-06-01 13:50:00,13,0,3.0,1.0,3.0
Assault,06/06/2015,15:00,12.866541,77.567617,2015-06-06 15:00:00,15,0,3.0,1.0,3.0
Assault,08/06/2015,10:30,12.855414,77.565999,2015-06-08 10:30:00,10,0,3.0,1.0,3.0
Assault,03/07/2015,14:00,12.867267,77.543673,2015-07-03 14:00:00,14,0,3.0,1.0,3.0
Assault,09/07/2015,13:15,12.871688,77.555856,2015-07-09 13:15:00,13,0,3.0,1.0,3.0
Assault,13/08/2015,16:15,12.869293,77.572492,2015-08-13 16:15:00,16,0,3.0,1.0,3.0
Assault,01/09/2015,14:10,12.869297,77.525191,2015-09-01 14:10:00,14,0,3.0,1.0,3.0
Assault,14/09/2015,1:30,12.856072,77.576919,2015-09-14 01:30:00,1,1,3.0,1.5,4.5
Assault,21/09/2015,18:00,12.878058,77.511198,2015-09-21 18:00:00,18,0,3.0,1.0,3.0
Assault,30/09/2015,22:45,12.869635,77.534393,2015-09-30 22:45:00,22,1,3.0,1.5,4.5
Assault,01/10/2015,10:10,12.869635,77.534393,2015-10-01 10:10:00,10,0,3.0,1.0,3.0
Assault,29/10/2015,18:30,12.876895,77.545061,2015-10-29 18:30:00,18,0,3.0,1.0,3.0
Assault,2/11/2015,10:30,12.861869,77.558201,2015-11-02 10:30:00,10,0,3.0,1.0,3.0
Assault,02/11/2015,11:30,12.878629,77.545068,2015-11-02 11:30:00,11,0,3.0,1.0,3.0
Assault,03/11/2015,17:30,12.869541,77.546971,2015-11-03 17:30:00,17,0,3.0,1.0,3.0
Assault,19/11/2015,18:30,12.866147,77.546218,2015-11-19 18:30:00,18,0,3.0,1.0,3.0
Assault,08/12/2015,12:30,12.864551,77.542888,2015-12-08 12:30:00,12,0,3.0,1.0,3.0
Assault,08/12/2015,22:49,12.868749,77.542331,2015-12-08 22:49:00,22,1,3.0,1.5,4.5
Assault,10/01/2016,14:00,12.869944,77.549881,2016-01-10 14:00:00,14,0,3.0,1.0,3.0
Assault,04/02/2016,23:30,12.861122,77.549811,2016-02-04 23:30:00,23,1,3.0,1.5,4.5
Assault,19/03/2016,15:30,12.867781,77.542544,2016-03-19 15:30:00,15,0,3.0,1.0,3.0
Assault,20/03/2016,13:00,12.865478,77.541168,2016-03-20 13:00:00,13,0,3.0,1.0,3.0
Assault,21/03/2016,13:15,12.865221,77.543077,2016-03-21 13:15:00,13,0,3.0,1.0,3.0
Assault,23/03/2016,23:30,12.86611,77.546988,2016-03-23 23:30:00,23,1,3.0,1.5,4.5
Assault,25/03/2016,20:00,12.879408,77.545308,2016-03-25 20:00:00,20,1,3.0,1.5,4.5
Assault,02/04/2016,17:00,12.864789,77.541129,2016-04-02 17:00:00,17,0,3.0,1.0,3.0
Assault,04/04/2016,12:00,12.8661,77.54678,2016-04-04 12:00:00,12,0,3.0,1.0,3.0
Assault,07/04/2016,16:00,12.864977,77.546611,2016-04-07 16:00:00,16,0,3.0,1.0,3.0
Assault,02/06/2016,10:30,12.86112,77.54997,2016-06-02 10:30:00,10,0,3.0,1.0,3.0
Assault,19/06/2016,16:00,12.868478,77.546611,2016-06-19 16:00:00,16,0,3.0,1.0,3.0
Assault,21/06/2016,20:00,12.876147,77.546997,2016-06-21 20:00:00,20,1,3.0,1.5,4.5
Assault,29/06/2016,21:15,12.862001,77.54811,2016-06-29 21:15:00,21,1,3.0,1.5,4.5
Assault,18/07/2016,14:30,12.866147,77.548811,2016-07-18 14:30:00,14,0,3.0,1.0,3.0
Assault,18/07/2016,14:30,12.879147,77.541197,2016-07-18 14:30:00,14,0,3.0,1.0,3.0
Assault,24/7/2016,11:00,12.863331,77.548994,2016-07-24 11:00:00,11,0,3.0,1.0,3.0
Assault,25/07/2016,21:30,12.864778,77.544617,2016-07-25 21:30:00,21,1,3.0,1.5,4.5
Assault,11/08/2016,18:30,12.869714,77.548791,2016-08-11 18:30:00,18,0,3.0,1.0,3.0
Assault,06/09/2016,16:00,12.861174,77.5463271,2016-09-06 16:00:00,16,0,3.0,1.0,3.0
Assault,13/09/2016,18:00,12.863971,77.548741,2016-09-13 18:00:00,18,0,3.0,1.0,3.0
Assault,28/9/2016,9:00,12.869108,77.545478,2016-09-28 09:00:00,9,0,3.0,1.0,3.0
Assault,07/10/2016,10:30,12.863974,77.542119,2016-10-07 10:30:00,10,0,3.0,1.0,3.0
Assault,24/10/2016,0:15,12.862397,77.542974,2016-10-24 00:15:00,0,1,3.0,1.5,4.5
Assault,29/10/2016,14:30,12.862674,77.541191,2016-10-29 14:30:00,14,0,3.0,1.0,3.0
Assault,03/11/2016,11:15,12.863971,77.541228,2016-11-03 11:15:00,11,0,3.0,1.0,3.0
Assault,06/11/2016,16:30,12.867448,77.543691,2016-11-06 16:30:00,16,0,3.0,1.0,3.0
Assault,07/11/2016,22:00,12.861587,77.543947,2016-11-07 22:00:00,22,1,3.0,1.5,4.5
Assault,09/11/2016,22:00,12.862551,77.543557,2016-11-09 22:00:00,22,1,3.0,1.5,4.5
Assault,14/11/2016,23:00,12.865517,77.543381,2016-11-14 23:00:00,23,1,3.0,1.5,4.5
Assault,16/11/2016,11:00,12.869417,77.547194,2016-11-16 11:00:00,11,0,3.0,1.0,3.0
Assault,16/11/2016,12:00,12.866221,77.543187,2016-11-16 12:00:00,12,0,3.0,1.0,3.0
Assault,15/11/2016,17:00,12.862947,77.568471,2016-11-15 17:00:00,17,0,3.0,1.0,3.0
Assault,18/11/2016,16:30,12.876178,77.542841,2016-11-18 16:30:00,16,0,3.0,1.0,3.0
Assault,29/11/2016,10:00,12.862178,77.541884,2016-11-29 10:00:00,10,0,3.0,1.0,3.0
Assault,05/01/2016,10:00,12.861578,77.542134,2016-01-05 10:00:00,10,0,3.0,1.0,3.0
Assault,06/01/2017,11:30,12.863971,77.541557,2017-01-06 11:30:00,11,0,3.0,1.0,3.0
Assault,10/01/2017,21:30,12.861874,77.541977,2017-01-10 21:30:00,21,1,3.0,1.5,4.5
Assault,18/01/2017,12:00,12.869871,77.543378,2017-01-18 12:00:00,12,0,3.0,1.0,3.0
Assault,29/01/2017,3:30,12.861578,77.549557,2017-01-29 03:30:00,3,1,3.0,1.5,4.5
Assault,19/02/2017,21:00,12.866114,77.543448,2017-02-19 21:00:00,21,1,3.0,1.5,4.5
Assault,13/03/2017,14:15,12.869594,77.5436217,2017-03-13 14:15:00,14,0,3.0,1.0,3.0
Assault,28/03/2017,9:05,12.866178,77.543947,2017-03-28 09:05:00,9,0,3.0,1.0,3.0
Assault,04/04/2017,9:30,12.8621781,77.543319,2017-04-04 09:30:00,9,0,3.0,1.0,3.0
Assault,02/05/2017,17:00,12.8665478,77.546781,2017-05-02 17:00:00,17,0,3.0,1.0,3.0
Assault,25/05/2017,3:00,12.862178,77.545443,2017-05-25 03:00:00,3,1,3.0,1.5,4.5
Assault,25/06/2017,20:20,12.861287,77.546719,2017-06-25 20:20:00,20,1,3.0,1.5,4.5
Assault,04/08/2017,10:00,12.865547,77.543994,2017-08-04 10:00:00,10,0,3.0,1.0,3.0
Assault,24/09/2017,15:35,12.863388,77.5415478,2017-09-24 15:35:00,15,0,3.0,1.0,3.0
Assault,03/10/2017,21:00,12.878478,77.542174,2017-10-03 21:00:00,21,1,3.0,1.5,4.5
Assault,12/10/2017,12:00,12.862881,77.544487,2017-10-12 12:00:00,12,0,3.0,1.0,3.0
Assault,17/10/2017,17:00,12.861278,77.543957,2017-10-17 17:00:00,17,0,3.0,1.0,3.0
Assault,24/10/2017,17:00,12.861478,77.568457,2017-10-24 17:00:00,17,0,3.0,1.0,3.0
Assault,08/11/2017,23:00,12.878781,77.546147,2017-11-08 23:00:00,23,1,3.0,1.5,4.5
Assault,26/11/2017,23:15,12.8621789,77.542144,2017-11-26 23:15:00,23,1,3.0,1.5,4.5
Assault,05/12/2017,16:00,12.861947,77.54,2017-12-05 16:00:00,16,0,3.0,1.0,3.0
Assault,10/12/2017,10:30,12.863447,77.54,2017-12-10 10:30:00,10,0,3.0,1.0,3.0
Assault,31/12/2015,12:15,12.862174,77.546112,2015-12-31 12:15:00,12,0,3.0,1.0,3.0
Assault,04/01/2018,22:15,12.860171,77.546471,2018-01-04 22:15:00,22,1,3.0,1.5,4.5
Assault,06/01/2018,20:15,12.860118,77.543697,2018-01-06 20:15:00,20,1,3.0,1.5,4.5
Assault,18/01/2018,16:00,12.860018,77.54447,2018-01-18 16:00:00,16,0,3.0,1.0,3.0
Assault,18/01/2018,17:00,12.865517,77.5491478,2018-01-18 17:00:00,17,0,3.0,1.0,3.0
Assault,20/01/2018,4:00,12.863947,77.542178,2018-01-20 04:00:00,4,1,3.0,1.5,4.5
Assault,29/01/2018,16:00,12.863178,77.540157,2018-01-29 16:00:00,16,0,3.0,1.0,3.0
Assault,09/02/2018,15:00,12.860017,77.54674,2018-02-09 15:00:00,15,0,3.0,1.0,3.0
Assault,16/02/2018,13:15,12.863314,77.546614,2018-02-16 13:15:00,13,0,3.0,1.0,3.0
Assault,24/02/2018,12:30,12.86288,77.546974,2018-02-24 12:30:00,12,0,3.0,1.0,3.0
Assault,25/03/2018,12:30,12.86987,77.543884,2018-03-25 12:30:00,12,0,3.0,1.0,3.0
Assault,02/04/2018,17:00,12.862178,77.543971,2018-04-02 17:00:00,17,0,3.0,1.0,3.0
Assault,13/04/2018,15:00,12.863971,77.542177,2018-04-13 15:00:00,15,0,3.0,1.0,3.0
Assault,13/04/2018,19:00,12.865541,77.559741,2018-04-13 19:00:00,19,1,3.0,1.5,4.5
Assault,17/04/2018,19:00,12.862178,77.543301,2018-04-17 19:00:00,19,1,3.0,1.5,4.5
Assault,26/04/2018,10:15,12.866108,77.547841,2018-04-26 10:15:00,10,0,3.0,1.0,3.0
Assault,12/5/2018,17:00,12.862174,77.547617,2018-05-12 17:00:00,17,0,3.0,1.0,3.0
Assault,28/05/2018,16:00,12.862178,77.542991,2018-05-28 16:00:00,16,0,3.0,1.0,3.0
Assault,23/06/2018,17:00,12.860178,77.543971,2018-06-23 17:00:00,17,0,3.0,1.0,3.0
Assault,16/07/2018,21:00,12.863391,77.549631,2018-07-16 21:00:00,21,1,3.0,1.5,4.5
Assault,26/07/2018,12:00,12.869713,77.54228,2018-07-26 12:00:00,12,0,3.0,1.0,3.0
Assault,30/07/2018,16:00,12.863971,77.541498,2018-07-30 16:00:00,16,0,3.0,1.0,3.0
Assault,30/07/2018,17:00,12.863971,77.542871,2018-07-30 17:00:00,17,0,3.0,1.0,3.0
Assault,04/08/2018,10:30,12.86331,77.548714,2018-08-04 10:30:00,10,0,3.0,1.0,3.0
Assault,13/8/2018,20:45,12.869941,77.543971,2018-08-13 20:45:00,20,1,3.0,1.5,4.5
Assault,13/8/2018,23:00,12.863741,77.54331,2018-08-13 23:00:00,23,1,3.0,1.5,4.5
Assault,26/08/2018,14:58,12.862178,77.543971,2018-08-26 14:58:00,14,0,3.0,1.0,3.0
Assault,04/10/2018,23:00,12.878179,77.551471,2018-10-04 23:00:00,23,1,3.0,1.5,4.5
Assault,07/10/2018,17:45,12.847479,77.558479,2018-10-07 17:45:00,17,0,3.0,1.0,3.0
Assault,14/10/2018,10:00,12.862147,77.548814,2018-10-14 10:00:00,10,0,3.0,1.0,3.0
Assault,16/10/2018,15:00,12.8601789,77.545471,2018-10-16 15:00:00,15,0,3.0,1.0,3.0
Assault,20/10/2018,2:00,12.86441,77.549381,2018-10-20 02:00:00,2,1,3.0,1.5,4.5
Assault,27/10/2018,10:10,12.864578,77.543974,2018-10-27 10:10:00,10,0,3.0,1.0,3.0
Assault,05/11/2018,13:15,12.862147,77.541478,2018-11-05 13:15:00,13,0,3.0,1.0,3.0
Assault,22/05/2018,11:00,12.862879,77.543971,2018-05-22 11:00:00,11,0,3.0,1.0,3.0
Assault,17/11/2018,15:30,12.861107,77.546971,2018-11-17 15:30:00,15,0,3.0,1.0,3.0
Assault,24/11/2018,21:00,12.866671,77.544487,2018-11-24 21:00:00,21,1,3.0,1.5,4.5
Assault,05/12/2018,13:00,12.862178,77.546717,2018-12-05 13:00:00,13,0,3.0,1.0,3.0
Assault,13/12/2018,22:00,12.862284,77.543017,2018-12-13 22:00:00,22,1,3.0,1.5,4.5
Assault,18/11/2018,20:15,12.863278,77.540141,2018-11-18 20:15:00,20,1,3.0,1.5,4.5
Assault,29/05/2018,22:00,12.862178,77.543271,2018-05-29 22:00:00,22,1,3.0,1.5,4.5
Assault,26/02/2019,14:00,12.863971,77.542178,2019-02-26 14:00:00,14,0,3.0,1.0,3.0
Assault,05/03/2019,18:30,12.870174,77.542211,2019-03-05 18:30:00,18,0,3.0,1.0,3.0
Assault,07/03/2019,13:30,12.863971,77.540157,2019-03-07 13:30:00,13,0,3.0,1.0,3.0
Assault,14/03/2019,15:00,12.866617,77.545732,2019-03-14 15:00:00,15,0,3.0,1.0,3.0
Assault,28/03/2019,21:50,12.863976,77.544131,2019-03-28 21:50:00,21,1,3.0,1.5,4.5
Assault,03/04/2019,17:00,12.872208,77.566316,2019-04-03 17:00:00,17,0,3.0,1.0,3.0
Assault,03/04/2019,22:30,12.874712,77.533853,2019-04-03 22:30:00,22,1,3.0,1.5,4.5
Assault,08/04/2019,11:30,12.875183,77.533083,2019-04-08 11:30:00,11,0,3.0,1.0,3.0
Assault,08/04/2019,13:00,12.89413,77.541369,2019-04-08 13:00:00,13,0,3.0,1.0,3.0
Assault,03/05/2019,19:30,12.873542,77.53235,2019-05-03 19:30:00,19,1,3.0,1.5,4.5
Assault,10/07/2019,3:30,12.871934,77.533441,2019-07-10 03:30:00,3,1,3.0,1.5,4.5
Assault,23/08/2019,19:00,12.859276,77.563266,2019-08-23 19:00:00,19,1,3.0,1.5,4.5
Assault,23/08/2019,21:30,12.87121,77.564375,2019-08-23 21:30:00,21,1,3.0,1.5,4.5
Assault,04/09/2019,13:00,12.89447,77.541371,2019-09-04 13:00:00,13,0,3.0,1.0,3.0
Assault,13/09/2019,1:00,12.89197,77.52341,2019-09-13 01:00:00,1,1,3.0,1.5,4.5
Assault,02/07/2019,22:00,12.878127,77.545653,2019-07-02 22:00:00,22,1,3.0,1.5,4.5
Assault,22/07/2019,16:15,12.872577,77.562818,2019-07-22 16:15:00,16,0,3.0,1.0,3.0
Assault,20/10/2019,16:15,12.875743,77.544554,2019-10-20 16:15:00,16,0,3.0,1.0,3.0
Assault,31/05/2019,12:12,12.895617,77.541573,2019-05-31 12:12:00,12,0,3.0,1.0,3.0
Assault,13/11/2019,13:30,12.862618,77.531543,2019-11-13 13:30:00,13,0,3.0,1.0,3.0
Assault,23/11/2019,11:45,12.883127,77.546741,2019-11-23 11:45:00,11,0,3.0,1.0,3.0
Assault,01/11/2019,11:45,12.866041,77.77543801,2019-11-01 11:45:00,11,0,3.0,1.0,3.0
Assault,17/12/2019,18:00,12.876338,77.540164,2019-12-17 18:00:00,18,0,3.0,1.0,3.0
Assault,04/12/2019,16:00,12.867778,77.5357,2019-12-04 16:00:00,16,0,3.0,1.0,3.0
Assault,24/01/2017,17:00,12.86825,77.582154,2017-01-24 17:00:00,17,0,3.0,1.0,3.0
Assault,15/02/2017,21:35,12.879174,77.564244,2017-02-15 21:35:00,21,1,3.0,1.5,4.5
Assault,25/02/2017,18:00,12.87929,77.567728,2017-02-25 18:00:00,18,0,3.0,1.0,3.0
Assault,25/02/2017,21:30,12.890678,77.564027,2017-02-25 21:30:00,21,1,3.0,1.5,4.5
Assault,18/03/2017,21:00,12.879174,77.564244,2017-03-18 21:00:00,21,1,3.0,1.5,4.5
Assault,19/04/2017,11:30,12.888167,77.570983,2017-04-19 11:30:00,11,0,3.0,1.0,3.0
Assault,27/04/2017,9:00,12.844683,77.583062,2017-04-27 09:00:00,9,0,3.0,1.0,3.0
Assault,03/05/2017,9:00,12.865815,77.580803,2017-05-03 09:00:00,9,0,3.0,1.0,3.0
Assault,28/05/2017,18:00,12.867538,77.534498,2017-05-28 18:00:00,18,0,3.0,1.0,3.0
Assault,02/06/2017,16:30,12.87575,77.581656,2017-06-02 16:30:00,16,0,3.0,1.0,3.0
Assault,06/06/2017,23:30,12.908554,77.591969,2017-06-06 23:30:00,23,1,3.0,1.5,4.5
Assault,14/06/2017,18:30,12.844683,77.583062,2017-06-14 18:30:00,18,0,3.0,1.0,3.0
Assault,01/07/2017,16:00,12.890678,77.564027,2017-07-01 16:00:00,16,0,3.0,1.0,3.0
Assault,01/07/2017,12:00,12.879174,77.564244,2017-07-01 12:00:00,12,0,3.0,1.0,3.0
Assault,02/07/2017,15:00,12.908554,77.591969,2017-07-02 15:00:00,15,0,3.0,1.0,3.0
Assault,08/07/2017,19:30,12.876396,77.5836,2017-07-08 19:30:00,19,1,3.0,1.5,4.5
Assault,11/07/2017,23:30,12.88995,77.582318,2017-07-11 23:30:00,23,1,3.0,1.5,4.5
Assault,12/07/2017,13:30,12.745792,77.48775,2017-07-12 13:30:00,13,0,3.0,1.0,3.0
Assault,14/07/2017,14:30,12.88164,77.571036,2017-07-14 14:30:00,14,0,3.0,1.0,3.0
Assault,23/07/2017,11:45,12.890678,77.564027,2017-07-23 11:45:00,11,0,3.0,1.0,3.0
Assault,02/08/2017,11:45,12.844683,77.583062,2017-08-02 11:45:00,11,0,3.0,1.0,3.0
Assault,05/08/2017,10:30,12.834683,77.583062,2017-08-05 10:30:00,10,0,3.0,1.0,3.0
Assault,01/09/2017,13:50,12.88164,77.571036,2017-09-01 13:50:00,13,0,3.0,1.0,3.0
Assault,13/09/2017,16:50,12.861915,77.561583,2017-09-13 16:50:00,16,0,3.0,1.0,3.0
Assault,18/09/2017,10:15,12.867463,77.583062,2017-09-18 10:15:00,10,0,3.0,1.0,3.0
Assault,20/09/2017,15:20,12.854683,77.583042,2017-09-20 15:20:00,15,0,3.0,1.0,3.0
Assault,25/09/2017,11:45,12.87257,17.588882,2017-09-25 11:45:00,11,0,3.0,1.0,3.0
Assault,26/09/2017,11:30,12.88825,77.572154,2017-09-26 11:30:00,11,0,3.0,1.0,3.0
Assault,30/09/2017,9:20,12.89825,77.5712169,2017-09-30 09:20:00,9,0,3.0,1.0,3.0
Assault,13/10/2017,17:00,12.865815,77.580803,2017-10-13 17:00:00,17,0,3.0,1.0,3.0
Assault,15/10/2017,16:30,12.87825,77.582154,2017-10-15 16:30:00,16,0,3.0,1.0,3.0
Assault,20/10/2017,16:00,12.86825,77.582154,2017-10-20 16:00:00,16,0,3.0,1.0,3.0
Assault,20/10/2017,22:15,12.88825,77.5821342,2017-10-20 22:15:00,22,1,3.0,1.5,4.5
Assault,23/10/2017,18:00,12.98825,77.582154,2017-10-23 18:00:00,18,0,3.0,1.0,3.0
Assault,11/11/2017,13:00,12.845799,77.584087,2017-11-11 13:00:00,13,0,3.0,1.0,3.0
Assault,11/11/2017,21:15,12.88086,77.57472,2017-11-11 21:15:00,21,1,3.0,1.5,4.5
Assault,20/11/2017,1:00,12.88829,77.580217,2017-11-20 01:00:00,1,1,3.0,1.5,4.5
Assault,13/12/2017,19:00,12.835799,77.584087,2017-12-13 19:00:00,19,1,3.0,1.5,4.5
Assault,29/12/2017,14:00,12.835799,77.584087,2017-12-29 14:00:00,14,0,3.0,1.0,3.0
Assault,05/01/2018,19:15,12.895925,77.585328,2018-01-05 19:15:00,19,1,3.0,1.5,4.5
Assault,11/01/2018,15:00,12.835799,77.584087,2018-01-11 15:00:00,15,0,3.0,1.0,3.0
Assault,17/01/2018,12:50,12.845799,77.584087,2018-01-17 12:50:00,12,0,3.0,1.0,3.0
Assault,25/01/2018,15:30,12.878746,77.5622,2018-01-25 15:30:00,15,0,3.0,1.0,3.0
Assault,26/01/2018,16:00,12.835799,77.584087,2018-01-26 16:00:00,16,0,3.0,1.0,3.0
Assault,27/01/2018,21:15,12.88086,77.57472,2018-01-27 21:15:00,21,1,3.0,1.5,4.5
Assault,06/02/2018,19:00,12.835799,77.584087,2018-02-06 19:00:00,19,1,3.0,1.5,4.5
Assault,12/02/2018,16:30,12.88365,77.567108,2018-02-12 16:30:00,16,0,3.0,1.0,3.0
Assault,16/02/2018,11:00,12.845799,77.584087,2018-02-16 11:00:00,11,0,3.0,1.0,3.0
Assault,19/02/2018,17:00,12.882462,77.569158,2018-02-19 17:00:00,17,0,3.0,1.0,3.0
Assault,21/02/2018,19:30,12.88829,77.580217,2018-02-21 19:30:00,19,1,3.0,1.5,4.5
Assault,06/03/2018,11:15,12.845799,77.584087,2018-03-06 11:15:00,11,0,3.0,1.0,3.0
Assault,10/03/2018,16:00,12.884587,77.569498,2018-03-10 16:00:00,16,0,3.0,1.0,3.0
Assault,15/03/2018,22:30,12.844501,77.584473,2018-03-15 22:30:00,22,1,3.0,1.5,4.5
Assault,21/03/2018,20:40,12.88829,77.580217,2018-03-21 20:40:00,20,1,3.0,1.5,4.5
Assault,23/03/2018,11:55,12.8834428,77.569808,2018-03-23 11:55:00,11,0,3.0,1.0,3.0
Assault,26/03/2018,12:00,12.881754,77.569001,2018-03-26 12:00:00,12,0,3.0,1.0,3.0
Assault,26/03/2018,21:30,12.854933,77.588491,2018-03-26 21:30:00,21,1,3.0,1.5,4.5
Assault,31/03/2018,11:15,12.882116,77.574506,2018-03-31 11:15:00,11,0,3.0,1.0,3.0
Assault,11/04/2018,9:35,12.87825,77.582172,2018-04-11 09:35:00,9,0,3.0,1.0,3.0
Assault,13/04/2018,15:30,12.892825,77.58269,2018-04-13 15:30:00,15,0,3.0,1.0,3.0
Assault,21/04/2018,22:15,12.87825,77.582172,2018-04-21 22:15:00,22,1,3.0,1.5,4.5
Assault,27/04/2018,16:00,12.88825,77.582165,2018-04-27 16:00:00,16,0,3.0,1.0,3.0
Assault,01/05/2018,17:15,12.86825,77.582161,2018-05-01 17:15:00,17,0,3.0,1.0,3.0
Assault,01/05/2018,17:30,12.86825,77.582172,2018-05-01 17:30:00,17,0,3.0,1.0,3.0
Assault,01/05/2018,23:50,12.872825,77.582169,2018-05-01 23:50:00,23,1,3.0,1.5,4.5
Assault,14/05/2018,16:10,12.78825,77.582154,2018-05-14 16:10:00,16,0,3.0,1.0,3.0
Assault,03/06/2018,15:30,12.86825,77.582169,2018-06-03 15:30:00,15,0,3.0,1.0,3.0
Assault,08/06/2018,2:30,12.796825,77.582172,2018-06-08 02:30:00,2,1,3.0,1.5,4.5
Assault,09/06/2018,10:30,12.86825,77.582154,2018-06-09 10:30:00,10,0,3.0,1.0,3.0
Assault,15/06/2018,23:20,12.86825,77.582154,2018-06-15 23:20:00,23,1,3.0,1.5,4.5
Assault,30/06/2018,20:50,12.86825,77.582154,2018-06-30 20:50:00,20,1,3.0,1.5,4.5
Assault,14/07/2018,7:00,12.86825,77.582154,2018-07-14 07:00:00,7,0,3.0,1.0,3.0
Assault,16/07/2018,22:15,12.86825,77.582154,2018-07-16 22:15:00,22,1,3.0,1.5,4.5
Assault,16/07/2018,22:30,12.86825,77.582154,2018-07-16 22:30:00,22,1,3.0,1.5,4.5
Assault,31/07/2018,22:00,12.86825,77.582154,2018-07-31 22:00:00,22,1,3.0,1.5,4.5
Assault,02/08/2018,10:30,12.86825,77.582154,2018-08-02 10:30:00,10,0,3.0,1.0,3.0
Assault,04/08/2018,17:45,12.86825,77.582154,2018-08-04 17:45:00,17,0,3.0,1.0,3.0
Assault,09/08/2018,12:30,12.86825,77.582154,2018-08-09 12:30:00,12,0,3.0,1.0,3.0
Assault,02/09/2018,9:30,12.86825,77.582154,2018-09-02 09:30:00,9,0,3.0,1.0,3.0
Assault,18/09/2018,3:45,12.86825,77.582154,2018-09-18 03:45:00,3,1,3.0,1.5,4.5
Assault,01/10/2018,21:00,12.86825,77.582154,2018-10-01 21:00:00,21,1,3.0,1.5,4.5
Assault,04/10/2018,13:00,12.86825,77.582154,2018-10-04 13:00:00,13,0,3.0,1.0,3.0
Assault,04/10/2018,16:30,12.86825,77.582154,2018-10-04 16:30:00,16,0,3.0,1.0,3.0
Assault,11/10/2018,18:15,12.86825,77.582154,2018-10-11 18:15:00,18,0,3.0,1.0,3.0
Assault,21/10/2018,16:15,12.86825,77.582154,2018-10-21 16:15:00,16,0,3.0,1.0,3.0
Assault,29/10/2018,4:10,12.86825,77.582154,2018-10-29 04:10:00,4,1,3.0,1.5,4.5
Assault,09/11/2018,18:00,12.86825,77.582154,2018-11-09 18:00:00,18,0,3.0,1.0,3.0
Assault,09/11/2018,19:00,12.86825,77.582154,2018-11-09 19:00:00,19,1,3.0,1.5,4.5
Assault,10/11/2018,19:00,12.86825,77.582154,2018-11-10 19:00:00,19,1,3.0,1.5,4.5
Assault,20/12/2018,14:00,12.86825,77.582154,2018-12-20 14:00:00,14,0,3.0,1.0,3.0
Assault,25/12/2018,22:45,12.86825,77.582154,2018-12-25 22:45:00,22,1,3.0,1.5,4.5
Assault,07/01/2019,15:15,12.86825,77.582154,2019-01-07 15:15:00,15,0,3.0,1.0,3.0
Assault,14/01/2019,20:00,12.86825,77.582154,2019-01-14 20:00:00,20,1,3.0,1.5,4.5
Assault,29/01/2019,17:00,12.86825,77.582154,2019-01-29 17:00:00,17,0,3.0,1.0,3.0
Assault,02/02/2019,18:00,12.78825,77.582154,2019-02-02 18:00:00,18,0,3.0,1.0,3.0
Assault,06/02/2019,13:30,12.89825,77.582154,2019-02-06 13:30:00,13,0,3.0,1.0,3.0
Assault,07/02/2019,17:00,12.882462,77.569158,2019-02-07 17:00:00,17,0,3.0,1.0,3.0
Assault,21/02/2019,19:20,12.892462,77.579158,2019-02-21 19:20:00,19,1,3.0,1.5,4.5
Assault,03/03/2019,22:45,12.86825,77.582154,2019-03-03 22:45:00,22,1,3.0,1.5,4.5
Assault,13/03/2019,13:10,12.86825,77.582154,2019-03-13 13:10:00,13,0,3.0,1.0,3.0
Assault,16/03/2019,23:30,12.86825,77.582154,2019-03-16 23:30:00,23,1,3.0,1.5,4.5
Assault,01/04/2019,13:15,12.86825,77.582154,2019-04-01 13:15:00,13,0,3.0,1.0,3.0
Assault,04/04/2019,21:15,12.873437,77.583593,2019-04-04 21:15:00,21,1,3.0,1.5,4.5
Assault,09/04/2019,21:10,12.883437,77.583593,2019-04-09 21:10:00,21,1,3.0,1.5,4.5
Assault,23/04/2019,17:30,12.87825,77.582154,2019-04-23 17:30:00,17,0,3.0,1.0,3.0
Assault,28/04/2019,13:15,12.85825,77.582154,2019-04-28 13:15:00,13,0,3.0,1.0,3.0
Assault,07/05/2019,14:40,12.86825,77.582154,2019-05-07 14:40:00,14,0,3.0,1.0,3.0
Assault,13/05/2019,20:45,12.86825,77.582154,2019-05-13 20:45:00,20,1,3.0,1.5,4.5
Assault,18/05/2019,18:45,12.87825,77.582154,2019-05-18 18:45:00,18,0,3.0,1.0,3.0
Assault,23/05/2019,15:15,12.89825,77.582154,2019-05-23 15:15:00,15,0,3.0,1.0,3.0
Assault,30/05/2019,23:50,12.8925,77.582154,2019-05-30 23:50:00,23,1,3.0,1.5,4.5
Assault,25/06/2019,20:15,12.83271,77.71821714,2019-06-25 20:15:00,20,1,3.0,1.5,4.5
Assault,25/06/2019,20:25,12.868271,77.71821714,2019-06-25 20:25:00,20,1,3.0,1.5,4.5
Assault,28/06/2019,14:00,12.868271,77.71821714,2019-06-28 14:00:00,14,0,3.0,1.0,3.0
Assault,04/07/2019,22:15,12.878271,77.71821714,2019-07-04 22:15:00,22,1,3.0,1.5,4.5
Assault,06/07/2019,9:45,12.888271,77.71821714,2019-07-06 09:45:00,9,0,3.0,1.0,3.0
Assault,09/07/2019,15:00,12.878271,77.71821714,2019-07-09 15:00:00,15,0,3.0,1.0,3.0
Assault,16/07/2019,22:15,12.898271,77.71821714,2019-07-16 22:15:00,22,1,3.0,1.5,4.5
Assault,16/07/2019,22:40,12.844683,77.583062,2019-07-16 22:40:00,22,1,3.0,1.5,4.5
Assault,25/07/2019,16:45,12.88365,77.567108,2019-07-25 16:45:00,16,0,3.0,1.0,3.0
Assault,05/08/2019,13:30,12.84365,77.567108,2019-08-05 13:30:00,13,0,3.0,1.0,3.0
Assault,13/08/2019,11:30,12.88822,77.578284,2019-08-13 11:30:00,11,0,3.0,1.0,3.0
Assault,27/08/2019,17:30,12.88822,77.578284,2019-08-27 17:30:00,17,0,3.0,1.0,3.0
Assault,30/08/2019,13:30,12.844683,77.583062,2019-08-30 13:30:00,13,0,3.0,1.0,3.0
Assault,01/09/2019,17:00,12.880803,77.584041,2019-09-01 17:00:00,17,0,3.0,1.0,3.0
Assault,01/09/2019,17:15,12.880803,77.584041,2019-09-01 17:15:00,17,0,3.0,1.0,3.0
Assault,03/09/2019,3:00,12.880777,77.584035,2019-09-03 03:00:00,3,1,3.0,1.5,4.5
Assault,16/11/2019,19:00,12.897696,77.571659,2019-11-16 19:00:00,19,1,3.0,1.5,4.5
Assault,01/12/2019,13:00,12.89282,77.578196,2019-12-01 13:00:00,13,0,3.0,1.0,3.0
Assault,05/12/2019,18:30,12.8886343,77.567481,2019-12-05 18:30:00,18,0,3.0,1.0,3.0
Assault,08/01/2015,14:00,12.911758,77.572653,2015-01-08 14:00:00,14,0,3.0,1.0,3.0
Assault,19/01/2015,9:45,12.9028808337357,77.5721867734704,2015-01-19 09:45:00,9,0,3.0,1.0,3.0
Assault,20/01/2015,23:10,12.9144905944493,77.5721064816148,2015-01-20 23:10:00,23,1,3.0,1.5,4.5
Assault,25/01/2015,8:45,12.9058711122321,77.5646367108323,2015-01-25 08:45:00,8,0,3.0,1.0,3.0
Assault,23/02/2015,12:30,12.9061712471247,77.5698458437946,2015-02-23 12:30:00,12,0,3.0,1.0,3.0
Assault,24/03/2015,12:00,12.9109359450741,77.5646696875901,2015-03-24 12:00:00,12,0,3.0,1.0,3.0
Assault,20/04/2015,12:00,12.9008927627643,77.5698813716385,2015-04-20 12:00:00,12,0,3.0,1.0,3.0
Assault,02/05/2015,13:45,12.9109359450741,77.5646696875901,2015-05-02 13:45:00,13,0,3.0,1.0,3.0
Assault,04/05/2015,21:15,12.8981950397319,77.5693753268396,2015-05-04 21:15:00,21,1,3.0,1.5,4.5
Assault,16/05/2015,12:30,12.8981950397319,77.5693753268396,2015-05-16 12:30:00,12,0,3.0,1.0,3.0
Assault,16/05/2015,4:45,12.8981950397319,77.5693753268396,2015-05-16 04:45:00,4,1,3.0,1.5,4.5
Assault,04/06/2015,10:15,12.8981950397319,77.5693753268396,2015-06-04 10:15:00,10,0,3.0,1.0,3.0
Assault,15/06/2015,14:30,12.9061712471247,77.5698458437946,2015-06-15 14:30:00,14,0,3.0,1.0,3.0
Assault,21/06/2015,23:50,12.8981950397319,77.5693753268396,2015-06-21 23:50:00,23,1,3.0,1.5,4.5
Assault,22/06/2015,17:00,12.9109359450741,77.5646696875901,2015-06-22 17:00:00,17,0,3.0,1.0,3.0
Assault,09/07/2015,21:30,12.9008927627643,77.5698813716385,2015-07-09 21:30:00,21,1,3.0,1.5,4.5
Assault,01/08/2015,13:30,12.9061712471247,77.5698458437946,2015-08-01 13:30:00,13,0,3.0,1.0,3.0
Assault,12/08/2015,16:50,12.9109359450741,77.5646696875901,2015-08-12 16:50:00,16,0,3.0,1.0,3.0
Assault,18/08/2015,2:45,12.9109359450741,77.5646696875901,2015-08-18 02:45:00,2,1,3.0,1.5,4.5
Assault,19/08/2015,19:00,12.9109359450741,77.5646696875901,2015-08-19 19:00:00,19,1,3.0,1.5,4.5
Assault,23/08/2015,14:45,12.9109359450741,77.5646696875901,2015-08-23 14:45:00,14,0,3.0,1.0,3.0
Assault,26/08/2015,10:10,12.9061712471247,77.5698458437946,2015-08-26 10:10:00,10,0,3.0,1.0,3.0
Assault,14/09/2015,12:00,12.8981950397319,77.5693753268396,2015-09-14 12:00:00,12,0,3.0,1.0,3.0
Assault,22/09/2015,16:00,12.9109359450741,77.5646696875901,2015-09-22 16:00:00,16,0,3.0,1.0,3.0
Assault,28/09/2015,22:30,12.9109359450741,77.5646696875901,2015-09-28 22:30:00,22,1,3.0,1.5,4.5
Assault,08/10/2015,14:00,12.9109359450741,77.5646696875901,2015-10-08 14:00:00,14,0,3.0,1.0,3.0
Assault,20/10/2015,23:30,12.9109359450741,77.5646696875901,2015-10-20 23:30:00,23,1,3.0,1.5,4.5
Assault,21/10/2015,17:40,12.8981950397319,77.5693753268396,2015-10-21 17:40:00,17,0,3.0,1.0,3.0
Assault,23/10/2015,2:45,12.9109359450741,77.5646696875901,2015-10-23 02:45:00,2,1,3.0,1.5,4.5
Assault,23/10/2015,22:45,12.9076945341477,77.5719852228203,2015-10-23 22:45:00,22,1,3.0,1.5,4.5
Assault,02/11/2015,15:30,12.9008927627643,77.5698813716385,2015-11-02 15:30:00,15,0,3.0,1.0,3.0
Assault,03/11/2015,6:45,12.8981950397319,77.5693753268396,2015-11-03 06:45:00,6,0,3.0,1.0,3.0
Assault,05/11/2015,23:00,12.9008927627643,77.5698813716385,2015-11-05 23:00:00,23,1,3.0,1.5,4.5
Assault,22/11/2015,2:30,12.9109359450741,77.5646696875901,2015-11-22 02:30:00,2,1,3.0,1.5,4.5
Assault,24/11/2015,9:00,12.8981950397319,77.5693753268396,2015-11-24 09:00:00,9,0,3.0,1.0,3.0
Assault,28/11/2015,10:45,12.9109359450741,77.5646696875901,2015-11-28 10:45:00,10,0,3.0,1.0,3.0
Assault,03/12/2015,21:55,12.8981950397319,77.5693753268396,2015-12-03 21:55:00,21,1,3.0,1.5,4.5
Assault,15/12/2015,3:00,12.9076945341477,77.5719852228203,2015-12-15 03:00:00,3,1,3.0,1.5,4.5
Assault,19/12/2015,15:45,12.9109359450741,77.5646696875901,2015-12-19 15:45:00,15,0,3.0,1.0,3.0
Assault,05/01/2016,11:00,12.8981950397319,77.5693753268396,2016-01-05 11:00:00,11,0,3.0,1.0,3.0
Assault,10/01/2016,22:45,12.9076945341477,77.5719852228203,2016-01-10 22:45:00,22,1,3.0,1.5,4.5
Assault,19/01/2016,19:00,12.9109359450741,77.5646696875901,2016-01-19 19:00:00,19,1,3.0,1.5,4.5
Assault,21/01/2016,12:30,12.9109359450741,77.5646696875901,2016-01-21 12:30:00,12,0,3.0,1.0,3.0
Assault,27/02/2016,18:00,12.9109359450741,77.5646696875901,2016-02-27 18:00:00,18,0,3.0,1.0,3.0
Assault,13/03/2016,23:55,12.9076945341477,77.5719852228203,2016-03-13 23:55:00,23,1,3.0,1.5,4.5
Assault,20/03/2016,12:15,12.8981950397319,77.5693753268396,2016-03-20 12:15:00,12,0,3.0,1.0,3.0
Assault,24/03/2016,16:00,12.9008927627643,77.5698813716385,2016-03-24 16:00:00,16,0,3.0,1.0,3.0
Assault,25/03/2016,23:30,12.9109359450741,77.5646696875901,2016-03-25 23:30:00,23,1,3.0,1.5,4.5
Assault,21/04/2016,13:00,12.9073405371661,77.5726119249203,2016-04-21 13:00:00,13,0,3.0,1.0,3.0
Assault,04/05/2016,12:00,12.9109359450741,77.5646696875901,2016-05-04 12:00:00,12,0,3.0,1.0,3.0
Assault,18/05/2016,12:30,12.898598198697,77.556897937156,2016-05-18 12:30:00,12,0,3.0,1.0,3.0
Assault,19/05/2016,14:30,12.9008927627643,77.5698813716385,2016-05-19 14:30:00,14,0,3.0,1.0,3.0
Assault,19/05/2016,16:40,12.9109359450741,77.5646696875901,2016-05-19 16:40:00,16,0,3.0,1.0,3.0
Assault,21/05/2016,22:30,12.9109359450741,77.5646696875901,2016-05-21 22:30:00,22,1,3.0,1.5,4.5
Assault,30/05/2016,23:00,12.8981950397319,77.5693753268396,2016-05-30 23:00:00,23,1,3.0,1.5,4.5
Assault,11/06/2016,10:00,12.9061712471247,77.5698458437946,2016-06-11 10:00:00,10,0,3.0,1.0,3.0
Assault,18/06/2016,22:15,12.8981950397319,77.5693753268396,2016-06-18 22:15:00,22,1,3.0,1.5,4.5
Assault,21/06/2016,22:15,12.9109359450741,77.5646696875901,2016-06-21 22:15:00,22,1,3.0,1.5,4.5
Assault,08/08/2016,20:00,12.9008927627643,77.5698813716385,2016-08-08 20:00:00,20,1,3.0,1.5,4.5
Assault,10/08/2016,21:00,12.9073405371661,77.5726119249203,2016-08-10 21:00:00,21,1,3.0,1.5,4.5
Assault,15/08/2016,10:00,12.9043309015663,77.5684681501214,2016-08-15 10:00:00,10,0,3.0,1.0,3.0
Assault,15/08/2016,12:00,12.9076945341477,77.5719852228203,2016-08-15 12:00:00,12,0,3.0,1.0,3.0
Assault,14/09/2016,21:30,12.9043309015663,77.5684681501214,2016-09-14 21:30:00,21,1,3.0,1.5,4.5
Assault,15/09/2016,21:00,12.9008927627643,77.5698813716385,2016-09-15 21:00:00,21,1,3.0,1.5,4.5
Assault,27/09/2016,18:30,12.8981950397319,77.5693753268396,2016-09-27 18:30:00,18,0,3.0,1.0,3.0
Assault,02/10/2016,13:15,12.9076945341477,77.5719852228203,2016-10-02 13:15:00,13,0,3.0,1.0,3.0
Assault,06/10/2016,21:30,12.9008927627643,77.5698813716385,2016-10-06 21:30:00,21,1,3.0,1.5,4.5
Assault,08/11/2016,11:30,12.8981950397319,77.5693753268396,2016-11-08 11:30:00,11,0,3.0,1.0,3.0
Assault,09/11/2016,13:30,12.8981950397319,77.5693753268396,2016-11-09 13:30:00,13,0,3.0,1.0,3.0
Assault,09/11/2016,16:15,12.9109359450741,77.5646696875901,2016-11-09 16:15:00,16,0,3.0,1.0,3.0
Assault,23/11/2016,12:15,12.9109359450741,77.5646696875901,2016-11-23 12:15:00,12,0,3.0,1.0,3.0
Assault,09/12/2016,19:00,12.9109359450741,77.5646696875901,2016-12-09 19:00:00,19,1,3.0,1.5,4.5
Assault,11/12/2016,21:00,12.9076945341477,77.5719852228203,2016-12-11 21:00:00,21,1,3.0,1.5,4.5
Assault,27/12/2016,21:35,12.8981950397319,77.5693753268396,2016-12-27 21:35:00,21,1,3.0,1.5,4.5
Assault,25/01/2017,23:15,12.9057414168407,77.5652834749371,2017-01-25 23:15:00,23,1,3.0,1.5,4.5
Assault,15/02/2017,11:00,12.9008927627643,77.5698813716385,2017-02-15 11:00:00,11,0,3.0,1.0,3.0
Assault,21/02/2017,12:00,12.9008927627643,77.5698813716385,2017-02-21 12:00:00,12,0,3.0,1.0,3.0
Assault,23/02/2017,15:00,12.8981950397319,77.5693753268396,2017-02-23 15:00:00,15,0,3.0,1.0,3.0
Assault,27/02/2017,13:10,12.898598198697,77.556897937156,2017-02-27 13:10:00,13,0,3.0,1.0,3.0
Assault,30/03/2017,15:00,12.9008927627643,77.5698813716385,2017-03-30 15:00:00,15,0,3.0,1.0,3.0
Assault,31/03/2017,14:00,12.898598198697,77.556897937156,2017-03-31 14:00:00,14,0,3.0,1.0,3.0
Assault,04/04/2017,15:00,12.8981950397319,77.5693753268396,2017-04-04 15:00:00,15,0,3.0,1.0,3.0
Assault,10/04/2017,13:00,12.9109359450741,77.5646696875901,2017-04-10 13:00:00,13,0,3.0,1.0,3.0
Assault,22/04/2017,18:00,12.8981950397319,77.5693753268396,2017-04-22 18:00:00,18,0,3.0,1.0,3.0
Assault,05/05/2017,15:00,12.8981950397319,77.5693753268396,2017-05-05 15:00:00,15,0,3.0,1.0,3.0
Assault,09/05/2017,19:00,12.9109359450741,77.5646696875901,2017-05-09 19:00:00,19,1,3.0,1.5,4.5
Assault,13/05/2017,21:30,12.8981950397319,77.5693753268396,2017-05-13 21:30:00,21,1,3.0,1.5,4.5
Assault,18/05/2017,16:30,12.9053291297934,77.5632981341383,2017-05-18 16:30:00,16,0,3.0,1.0,3.0
Assault,01/06/2017,22:30,12.9109359450741,77.5646696875901,2017-06-01 22:30:00,22,1,3.0,1.5,4.5
Assault,04/07/2017,11:15,12.9109359450741,77.5646696875901,2017-07-04 11:15:00,11,0,3.0,1.0,3.0
Assault,06/07/2017,11:00,12.8981950397319,77.5693753268396,2017-07-06 11:00:00,11,0,3.0,1.0,3.0
Assault,08/07/2017,15:30,12.9109359450741,77.5646696875901,2017-07-08 15:30:00,15,0,3.0,1.0,3.0
Assault,08/07/2017,18:30,12.9109359450741,77.5646696875901,2017-07-08 18:30:00,18,0,3.0,1.0,3.0
Assault,15/07/2017,15:00,12.9109359450741,77.5646696875901,2017-07-15 15:00:00,15,0,3.0,1.0,3.0
Assault,16/07/2017,11:00,12.9076945341477,77.5719852228203,2017-07-16 11:00:00,11,0,3.0,1.0,3.0
Assault,18/07/2017,12:00,12.9008927627643,77.5698813716385,2017-07-18 12:00:00,12,0,3.0,1.0,3.0
Assault,25/07/2017,13:00,12.9109359450741,77.5698458437946,2017-07-25 13:00:00,13,0,3.0,1.0,3.0
Assault,01/08/2017,14:00,12.8981950397319,77.5693753268396,2017-08-01 14:00:00,14,0,3.0,1.0,3.0
Assault,14/08/2017,15:00,12.9061712471247,77.5698458437946,2017-08-14 15:00:00,15,0,3.0,1.0,3.0
Assault,17/08/2017,13:00,12.898598198697,77.556897937156,2017-08-17 13:00:00,13,0,3.0,1.0,3.0
Assault,17/08/2017,14:00,12.898598198697,77.556897937156,2017-08-17 14:00:00,14,0,3.0,1.0,3.0
Assault,20/08/2017,14:00,12.9061712471247,77.5698458437946,2017-08-20 14:00:00,14,0,3.0,1.0,3.0
Assault,23/08/2017,15:00,12.9109359450741,77.5646696875901,2017-08-23 15:00:00,15,0,3.0,1.0,3.0
Assault,24/08/2017,18:30,12.9061712471247,77.5698458437946,2017-08-24 18:30:00,18,0,3.0,1.0,3.0
Assault,03/09/2017,13:45,12.9109359450741,77.5646696875901,2017-09-03 13:45:00,13,0,3.0,1.0,3.0
Assault,11/09/2017,14:45,12.898598198697,77.556897937156,2017-09-11 14:45:00,14,0,3.0,1.0,3.0
Assault,16/09/2017,19:20,12.9109359450741,77.5646696875901,2017-09-16 19:20:00,19,1,3.0,1.5,4.5
Assault,19/09/2017,20:00,12.9076945341477,77.5719852228203,2017-09-19 20:00:00,20,1,3.0,1.5,4.5
Assault,07/10/2017,16:20,12.8981950397319,77.5693753268396,2017-10-07 16:20:00,16,0,3.0,1.0,3.0
Assault,12/10/2017,20:00,12.9076945341477,77.5719852228203,2017-10-12 20:00:00,20,1,3.0,1.5,4.5
Assault,12/10/2017,21:00,12.9076945341477,77.5719852228203,2017-10-12 21:00:00,21,1,3.0,1.5,4.5
Assault,20/10/2017,22:45,12.8981950397319,77.5693753268396,2017-10-20 22:45:00,22,1,3.0,1.5,4.5
Assault,30/10/2017,21:15,12.8957622003642,77.5599416215927,2017-10-30 21:15:00,21,1,3.0,1.5,4.5
Assault,01/11/2017,22:00,12.9109359450741,77.5646696875901,2017-11-01 22:00:00,22,1,3.0,1.5,4.5
Assault,03/11/2017,14:00,12.9109359450741,77.5646696875901,2017-11-03 14:00:00,14,0,3.0,1.0,3.0
Assault,03/11/2017,20:00,12.9076945341477,77.5719852228203,2017-11-03 20:00:00,20,1,3.0,1.5,4.5
Assault,12/11/2017,19:30,12.9155359324014,77.5616258170776,2017-11-12 19:30:00,19,1,3.0,1.5,4.5
Assault,26/11/2017,13:00,12.898598198697,77.556897937156,2017-11-26 13:00:00,13,0,3.0,1.0,3.0
Assault,27/11/2017,16:30,12.9114198115401,77.5620768564236,2017-11-27 16:30:00,16,0,3.0,1.0,3.0
Assault,27/11/2017,17:00,12.9109359450741,77.5646696875901,2017-11-27 17:00:00,17,0,3.0,1.0,3.0
Assault,05/12/2017,15:00,12.9077016670668,77.5713097696338,2017-12-05 15:00:00,15,0,3.0,1.0,3.0
Assault,08/12/2017,12:00,12.9061712471247,77.5698458437946,2017-12-08 12:00:00,12,0,3.0,1.0,3.0
Assault,17/12/2017,18:00,12.9162974053303,77.5707956209262,2017-12-17 18:00:00,18,0,3.0,1.0,3.0
Assault,27/01/2018,15:15,12.9109359450741,77.5646696875901,2018-01-27 15:15:00,15,0,3.0,1.0,3.0
Assault,09/02/2018,11:15,12.9109359450741,77.5646696875901,2018-02-09 11:15:00,11,0,3.0,1.0,3.0
Assault,09/02/2018,12:30,12.9109359450741,77.5646696875901,2018-02-09 12:30:00,12,0,3.0,1.0,3.0
Assault,18/02/2018,20:45,12.9109359450741,77.5646696875901,2018-02-18 20:45:00,20,1,3.0,1.5,4.5
Assault,18/02/2018,22:30,12.9109359450741,77.5646696875901,2018-02-18 22:30:00,22,1,3.0,1.5,4.5
Assault,27/02/2018,9:00,12.9109359450741,77.5646696875901,2018-02-27 09:00:00,9,0,3.0,1.0,3.0
Assault,13/03/2018,10:00,12.9109359450741,77.5646696875901,2018-03-13 10:00:00,10,0,3.0,1.0,3.0
Assault,20/03/2018,13:00,12.9109359450741,77.5646696875901,2018-03-20 13:00:00,13,0,3.0,1.0,3.0
Assault,20/03/2018,13:30,12.9109359450741,77.5646696875901,2018-03-20 13:30:00,13,0,3.0,1.0,3.0
Assault,23/03/2018,16:00,12.9061712471247,77.5698458437946,2018-03-23 16:00:00,16,0,3.0,1.0,3.0
Assault,12/04/2018,13:20,12.898598198697,77.556897937156,2018-04-12 13:20:00,13,0,3.0,1.0,3.0
Assault,20/04/2018,19:15,12.9061712471247,77.5698458437946,2018-04-20 19:15:00,19,1,3.0,1.5,4.5
Assault,01/05/2018,18:20,12.9109359450741,77.5646696875901,2018-05-01 18:20:00,18,0,3.0,1.0,3.0
Assault,03/05/2018,19:00,12.9109359450741,77.5646696875901,2018-05-03 19:00:00,19,1,3.0,1.5,4.5
Assault,03/05/2018,16:30,12.9076945341477,77.5719852228203,2018-05-03 16:30:00,16,0,3.0,1.0,3.0
Assault,07/05/2018,15:00,12.9076945341477,77.5719852228203,2018-05-07 15:00:00,15,0,3.0,1.0,3.0
Assault,20/05/2018,15:30,12.898598198697,77.556897937156,2018-05-20 15:30:00,15,0,3.0,1.0,3.0
Assault,21/05/2018,14:00,12.9109359450741,77.5646696875901,2018-05-21 14:00:00,14,0,3.0,1.0,3.0
Assault,27/05/2018,17:00,12.898598198697,77.556897937156,2018-05-27 17:00:00,17,0,3.0,1.0,3.0
Assault,28/06/2018,17:30,12.9079107980595,77.5667368067783,2018-06-28 17:30:00,17,0,3.0,1.0,3.0
Assault,08/08/2018,17:45,12.9023385605328,77.5653252772123,2018-08-08 17:45:00,17,0,3.0,1.0,3.0
Assault,15/08/2018,19:00,12.9076945341477,77.5719852228203,2018-08-15 19:00:00,19,1,3.0,1.5,4.5
Assault,30/08/2018,19:50,12.8999136414243,77.5724909471076,2018-08-30 19:50:00,19,1,3.0,1.5,4.5
Assault,25/09/2018,17:10,12.9109359450741,77.5646696875901,2018-09-25 17:10:00,17,0,3.0,1.0,3.0
Assault,14/10/2018,11:00,12.902333328087,77.56892819667,2018-10-14 11:00:00,11,0,3.0,1.0,3.0
Assault,23/10/2018,11:30,12.9109359450741,77.5646696875901,2018-10-23 11:30:00,11,0,3.0,1.0,3.0
Assault,24/10/2018,16:00,12.9109359450741,77.5646696875901,2018-10-24 16:00:00,16,0,3.0,1.0,3.0
Assault,25/10/2018,12:00,12.9109359450741,77.5646696875901,2018-10-25 12:00:00,12,0,3.0,1.0,3.0
Assault,25/10/2018,13:00,12.9109359450741,77.5646696875901,2018-10-25 13:00:00,13,0,3.0,1.0,3.0
Assault,23/11/2018,10:00,12.9061712471247,77.5698458437946,2018-11-23 10:00:00,10,0,3.0,1.0,3.0
Assault,05/12/2018,20:30,12.9061712471247,77.5698458437946,2018-12-05 20:30:00,20,1,3.0,1.5,4.5
Assault,10/12/2018,19:15,12.9061712471247,77.5698458437946,2018-12-10 19:15:00,19,1,3.0,1.5,4.5
Assault,10/01/2019,15:00,12.9133048035839,77.5680350394204,2019-01-10 15:00:00,15,0,3.0,1.0,3.0
Assault,23/01/2019,14:40,12.9109359450741,77.5646696875901,2019-01-23 14:40:00,14,0,3.0,1.0,3.0
Assault,03/02/2019,17:15,12.8981950397319,77.5693753268396,2019-02-03 17:15:00,17,0,3.0,1.0,3.0
Assault,09/02/2019,12:00,12.9073405371661,77.5726119249203,2019-02-09 12:00:00,12,0,3.0,1.0,3.0
Assault,12/02/2019,11:30,12.9150986419594,77.5618402041499,2019-02-12 11:30:00,11,0,3.0,1.0,3.0
Assault,14/02/2019,10:00,12.8981950397319,77.5693753268396,2019-02-14 10:00:00,10,0,3.0,1.0,3.0
Assault,24/02/2019,19:30,12.9109359450741,77.5646696875901,2019-02-24 19:30:00,19,1,3.0,1.5,4.5
Assault,25/02/2019,10:30,12.9073405371661,77.5726119249203,2019-02-25 10:30:00,10,0,3.0,1.0,3.0
Assault,26/02/2019,15:15,12.9109359450741,77.5646696875901,2019-02-26 15:15:00,15,0,3.0,1.0,3.0
Assault,10/03/2019,15:30,12.9109359450741,77.5646696875901,2019-03-10 15:30:00,15,0,3.0,1.0,3.0
Assault,10/03/2019,14:00,12.9109359450741,77.5646696875901,2019-03-10 14:00:00,14,0,3.0,1.0,3.0
Assault,20/03/2019,14:15,12.9133048035839,77.5680350394204,2019-03-20 14:15:00,14,0,3.0,1.0,3.0
Assault,06/04/2019,18:30,12.9109359450741,77.5680350394204,2019-04-06 18:30:00,18,0,3.0,1.0,3.0
Assault,07/04/2019,14:30,12.9109359450741,77.5646696875901,2019-04-07 14:30:00,14,0,3.0,1.0,3.0
Assault,25/04/2019,20:00,12.9155359324014,77.5616258170776,2019-04-25 20:00:00,20,1,3.0,1.5,4.5
Assault,26/04/2019,10:00,12.9141256400484,77.5633354568206,2019-04-26 10:00:00,10,0,3.0,1.0,3.0
Assault,10/05/2019,18:00,12.9109359450741,77.5646696875901,2019-05-10 18:00:00,18,0,3.0,1.0,3.0
Assault,16/05/2019,13:00,12.9077016670668,77.5713097696338,2019-05-16 13:00:00,13,0,3.0,1.0,3.0
Assault,07/06/2019,15:30,12.9151436819703,77.5694191266274,2019-06-07 15:30:00,15,0,3.0,1.0,3.0
Assault,13/06/2019,13:10,12.9109359450741,77.5646696875901,2019-06-13 13:10:00,13,0,3.0,1.0,3.0
Assault,14/06/2019,23:10,12.9109359450741,77.5646696875901,2019-06-14 23:10:00,23,1,3.0,1.5,4.5
Assault,25/06/2019,14:15,12.9109359450741,77.5646696875901,2019-06-25 14:15:00,14,0,3.0,1.0,3.0
Assault,28/06/2019,23:40,12.9073405371661,77.5726119249203,2019-06-28 23:40:00,23,1,3.0,1.5,4.5
Assault,03/07/2019,13:30,12.9073405371661,77.5726119249203,2019-07-03 13:30:00,13,0,3.0,1.0,3.0
Assault,11/07/2019,16:30,12.9043309015663,77.5684681501214,2019-07-11 16:30:00,16,0,3.0,1.0,3.0
Assault,24/07/2019,2:30,12.9073405371661,77.5726119249203,2019-07-24 02:30:00,2,1,3.0,1.5,4.5
Assault,26/07/2019,10:10,12.9073405371661,77.5726119249203,2019-07-26 10:10:00,10,0,3.0,1.0,3.0
Assault,31/07/2019,15:50,12.9109359450741,77.5646696875901,2019-07-31 15:50:00,15,0,3.0,1.0,3.0
Assault,29/09/2019,11:00,12.9073405371661,77.5726119249203,2019-09-29 11:00:00,11,0,3.0,1.0,3.0
Assault,29/09/2019,19:45,12.9073405371661,77.5726119249203,2019-09-29 19:45:00,19,1,3.0,1.5,4.5
Assault,04/10/2019,10:30,12.9061712471247,77.5698458437946,2019-10-04 10:30:00,10,0,3.0,1.0,3.0
Assault,04/10/2019,15:00,12.9109359450741,77.5646696875901,2019-10-04 15:00:00,15,0,3.0,1.0,3.0
Assault,15/11/2019,15:00,12.9109359450741,77.5646696875901,2019-11-15 15:00:00,15,0,3.0,1.0,3.0
Assault,19/11/2019,12:10,12.9073405371661,77.5726119249203,2019-11-19 12:10:00,12,0,3.0,1.0,3.0
Assault,28/11/2019,13:30,12.9109359450741,77.5646696875901,2019-11-28 13:30:00,13,0,3.0,1.0,3.0
Assault,21/12/2019,18:30,12.9109359450741,77.5646696875901,2019-12-21 18:30:00,18,0,3.0,1.0,3.0
Assault,22/12/2019,18:30,12.9073405371661,77.5726119249203,2019-12-22 18:30:00,18,0,3.0,1.0,3.0
Assault,10/08/2015,1:30,12.948212,77.562999,2015-08-10 01:30:00,1,1,3.0,1.5,4.5
Assault,10/08/2015,2:15,12.948212,77.562999,2015-08-10 02:15:00,2,1,3.0,1.5,4.5
Assault,01/01/2016,17:40,12.94723,77.564242,2016-01-01 17:40:00,17,0,3.0,1.0,3.0
Assault,11/02/2016,2:30,12.9563077,77.5634098,2016-02-11 02:30:00,2,1,3.0,1.5,4.5
Assault,05/03/2016,22:45,12.952299,77.564412,2016-03-05 22:45:00,22,1,3.0,1.5,4.5
Assault,28/03/2016,18:30,12.94865677,77.56227641,2016-03-28 18:30:00,18,0,3.0,1.0,3.0
Assault,06/04/2016,22:50,12.956997,77.564332,2016-04-06 22:50:00,22,1,3.0,1.5,4.5
Assault,18/04/2016,0:05,12.95776309,77.55560342,2016-04-18 00:05:00,0,1,3.0,1.5,4.5
Assault,06/01/2017,1:00,12.9532085,77.56492303,2017-01-06 01:00:00,1,1,3.0,1.5,4.5
Assault,02/03/2017,11:15,12.952299,77.564412,2017-03-02 11:15:00,11,0,3.0,1.0,3.0
Assault,02/03/2017,11:45,12.952299,77.564412,2017-03-02 11:45:00,11,0,3.0,1.0,3.0
Assault,25/07/2017,18:30,12.94865677,77.56227641,2017-07-25 18:30:00,18,0,3.0,1.0,3.0
Assault,16/12/2017,11:30,12.956997,77.564332,2017-12-16 11:30:00,11,0,3.0,1.0,3.0
Assault,15/02/2018,15:30,12.950853,77.563428,2018-02-15 15:30:00,15,0,3.0,1.0,3.0
Assault,29/03/2018,19:30,12.949096,77.55491,2018-03-29 19:30:00,19,1,3.0,1.5,4.5
Assault,08/04/2018,16:45,12.94855,77.56059,2018-04-08 16:45:00,16,0,3.0,1.0,3.0
Assault,17/04/2018,14:00,12.95497,77.56627,2018-04-17 14:00:00,14,0,3.0,1.0,3.0
Assault,30/05/2018,14:30,12.94818,77.56009,2018-05-30 14:30:00,14,0,3.0,1.0,3.0
Assault,02/07/2018,21:40,12.95411,77.56167,2018-07-02 21:40:00,21,1,3.0,1.5,4.5
Assault,26/08/2018,12:15,12.946004,77.558921,2018-08-26 12:15:00,12,0,3.0,1.0,3.0
Assault,07/10/2018,12:30,12.94783,77.55976,2018-10-07 12:30:00,12,0,3.0,1.0,3.0
Assault,10/11/2018,19:00,12.949588,77.56199,2018-11-10 19:00:00,19,1,3.0,1.5,4.5
Assault,25/12/2018,17:30,12.95689834,77.55926598,2018-12-25 17:30:00,17,0,3.0,1.0,3.0
Assault,31/12/2018,20:40,12.94749,77.56073,2018-12-31 20:40:00,20,1,3.0,1.5,4.5
Assault,14/01/2019,11:30,12.94967,77.557683,2019-01-14 11:30:00,11,0,3.0,1.0,3.0
Assault,21/04/2019,12:00,12.94749,77.56045,2019-04-21 12:00:00,12,0,3.0,1.0,3.0
Assault,30/05/2019,13:10,12.94745,77.56633,2019-05-30 13:10:00,13,0,3.0,1.0,3.0
Assault,01/06/2019,13:20,12.94552,77.56172,2019-06-01 13:20:00,13,0,3.0,1.0,3.0
Assault,18/07/2019,10:50,12.94831,77.55999,2019-07-18 10:50:00,10,0,3.0,1.0,3.0
Assault,25/07/2019,12:30,12.94816,77.5678,2019-07-25 12:30:00,12,0,3.0,1.0,3.0
Assault,10/08/2019,13:20,12.95351,77.55839,2019-08-10 13:20:00,13,0,3.0,1.0,3.0
Assault,15/11/2019,10:00,12.95271,77.56254,2019-11-15 10:00:00,10,0,3.0,1.0,3.0
Assault,26/11/2019,20:30,12.94714,77.56241,2019-11-26 20:30:00,20,1,3.0,1.5,4.5
Assault,13/12/2019,18:00,12.9508,77.56377,2019-12-13 18:00:00,18,0,3.0,1.0,3.0
Assault,14/10/2015,10:00,12.9523,77.56858,2015-10-14 10:00:00,10,0,3.0,1.0,3.0
Assault,28/10/2015,16:00,12.95056,77.56923,2015-10-28 16:00:00,16,0,3.0,1.0,3.0
Assault,05/12/2015,19:00,12.94951,77.5674,2015-12-05 19:00:00,19,1,3.0,1.5,4.5
Assault,6/12/2015,13:45,12.9556,77.56883,2015-12-06 13:45:00,13,0,3.0,1.0,3.0
Assault,7/2/2016,10:10,12.95289,77.57194,2016-02-07 10:10:00,10,0,3.0,1.0,3.0
Assault,07/07/2017,13:30,12.95501377,77.5702211,2017-07-07 13:30:00,13,0,3.0,1.0,3.0
Assault,13/09/2017,17:30,12.95722,77.57187,2017-09-13 17:30:00,17,0,3.0,1.0,3.0
Assault,13/10/2017,18:30,12.94946,77.5713,2017-10-13 18:30:00,18,0,3.0,1.0,3.0
Assault,08/11/2017,19:00,12.94898752,77.56995676,2017-11-08 19:00:00,19,1,3.0,1.5,4.5
Assault,29/12/2017,14:00,12.95722,77.57187,2017-12-29 14:00:00,14,0,3.0,1.0,3.0
Assault,29/03/2018,21:10,12.94807837,77.56861929,2018-03-29 21:10:00,21,1,3.0,1.5,4.5
Assault,10/6/2019,11:00,12.9556,77.56883,2019-06-10 11:00:00,11,0,3.0,1.0,3.0
Assault,20/06/2019,21:20,12.95289,77.57242,2019-06-20 21:20:00,21,1,3.0,1.5,4.5
Assault,14/01/2015,22:00,12.565,77.3306,2015-01-14 22:00:00,22,1,3.0,1.5,4.5
Assault,10/02/2015,21:30,12.6056,77.4338,2015-02-10 21:30:00,21,1,3.0,1.5,4.5
Assault,27/02/2015,11:30,12.5636,77.3342,2015-02-27 11:30:00,11,0,3.0,1.0,3.0
Assault,13/03/2015,16:30,12.5619,77.3327,2015-03-13 16:30:00,16,0,3.0,1.0,3.0
Assault,28/03/2015,21:30,12.5613,77.3317,2015-03-28 21:30:00,21,1,3.0,1.5,4.5
Assault,16/04/2015,12:00,12.564,77.3347,2015-04-16 12:00:00,12,0,3.0,1.0,3.0
Assault,27/04/2015,23:30,12.5624,77.3325,2015-04-27 23:30:00,23,1,3.0,1.5,4.5
Assault,27/04/2015,23:45,12.5624,77.3326,2015-04-27 23:45:00,23,1,3.0,1.5,4.5
Assault,02/05/2015,14:15,12.5635,77.333,2015-05-02 14:15:00,14,0,3.0,1.0,3.0
Assault,02/05/2015,20:45,12.5636,77.3335,2015-05-02 20:45:00,20,1,3.0,1.5,4.5
Assault,07/05/2015,12:00,12.5635,77.3339,2015-05-07 12:00:00,12,0,3.0,1.0,3.0
Assault,19/05/2015,23:10,12.5644,77.3333,2015-05-19 23:10:00,23,1,3.0,1.5,4.5
Assault,20/05/2015,16:00,12.5644,77.3334,2015-05-20 16:00:00,16,0,3.0,1.0,3.0
Assault,24/05/2015,3:15,12.5629,77.3339,2015-05-24 03:15:00,3,1,3.0,1.5,4.5
Assault,28/05/2015,15:00,12.5648,77.3238,2015-05-28 15:00:00,15,0,3.0,1.0,3.0
Assault,29/05/2015,18:10,12.5625,77.3259,2015-05-29 18:10:00,18,0,3.0,1.0,3.0
Assault,29/05/2015,22:45,12.5619,77.3326,2015-05-29 22:45:00,22,1,3.0,1.5,4.5
Assault,03/06/2015,22:00,12.5614,77.3329,2015-06-03 22:00:00,22,1,3.0,1.5,4.5
Assault,21/06/2015,23:30,12.57,77.3311,2015-06-21 23:30:00,23,1,3.0,1.5,4.5
Assault,02/07/2015,10:30,12.5643,77.3308,2015-07-02 10:30:00,10,0,3.0,1.0,3.0
Assault,11/07/2015,21:30,12.5619,77.3412,2015-07-11 21:30:00,21,1,3.0,1.5,4.5
Assault,20/07/2015,19:00,12.5622,77.3334,2015-07-20 19:00:00,19,1,3.0,1.5,4.5
Assault,15/08/2015,8:15,12.5642,77.3314,2015-08-15 08:15:00,8,0,3.0,1.0,3.0
Assault,21/08/2015,12:30,12.563,77.3351,2015-08-21 12:30:00,12,0,3.0,1.0,3.0
Assault,23/08/2015,22:30,12.5641,77.3301,2015-08-23 22:30:00,22,1,3.0,1.5,4.5
Assault,08/09/2015,16:00,12.5654,77.3305,2015-09-08 16:00:00,16,0,3.0,1.0,3.0
Assault,22/09/2015,12:00,12.5647,77.3335,2015-09-22 12:00:00,12,0,3.0,1.0,3.0
Assault,04/10/2015,10:45,12.5643,77.334,2015-10-04 10:45:00,10,0,3.0,1.0,3.0
Assault,08/10/2015,8:40,12.5609,77.3321,2015-10-08 08:40:00,8,0,3.0,1.0,3.0
Assault,15/11/2015,19:30,12.5522,77.3357,2015-11-15 19:30:00,19,1,3.0,1.5,4.5
Assault,20/11/2015,13:30,12.5636,77.333,2015-11-20 13:30:00,13,0,3.0,1.0,3.0
Assault,27/11/2015,9:00,12.5626,77.3334,2015-11-27 09:00:00,9,0,3.0,1.0,3.0
Assault,04/12/2015,10:30,12.5635,77.3355,2015-12-04 10:30:00,10,0,3.0,1.0,3.0
Assault,10/12/2015,15:35,12.5617,77.3315,2015-12-10 15:35:00,15,0,3.0,1.0,3.0
Assault,16/12/2015,13:00,12.5633,77.3345,2015-12-16 13:00:00,13,0,3.0,1.0,3.0
Assault,18/12/2015,15:20,12.5635,77.3345,2015-12-18 15:20:00,15,0,3.0,1.0,3.0
Assault,26/12/2015,17:50,12.5608,77.332,2015-12-26 17:50:00,17,0,3.0,1.0,3.0
Assault,28/12/2015,2:30,12.5629,77.3356,2015-12-28 02:30:00,2,1,3.0,1.5,4.5
Assault,03/01/2016,18:15,12.5646,77.3333,2016-01-03 18:15:00,18,0,3.0,1.0,3.0
Assault,04/01/2016,12:00,12.5646,77.3333,2016-01-04 12:00:00,12,0,3.0,1.0,3.0
Assault,10/01/2016,10:45,12.5529,77.3437,2016-01-10 10:45:00,10,0,3.0,1.0,3.0
Assault,12/01/2016,12:00,12.5646,77.3314,2016-01-12 12:00:00,12,0,3.0,1.0,3.0
Assault,21/02/2016,15:00,12.5649,77.3312,2016-02-21 15:00:00,15,0,3.0,1.0,3.0
Assault,23/02/2016,12:40,12.564,77.3307,2016-02-23 12:40:00,12,0,3.0,1.0,3.0
Assault,04/03/2016,20:50,12.5623,77.3326,2016-03-04 20:50:00,20,1,3.0,1.5,4.5
Assault,13/03/2016,13:00,12.564,77.334,2016-03-13 13:00:00,13,0,3.0,1.0,3.0
Assault,21/03/2016,13:50,12.5636,77.3358,2016-03-21 13:50:00,13,0,3.0,1.0,3.0
Assault,01/05/2016,16:15,12.5609,77.3321,2016-05-01 16:15:00,16,0,3.0,1.0,3.0
Assault,09/05/2016,13:44,12.5644,77.3318,2016-05-09 13:44:00,13,0,3.0,1.0,3.0
Assault,15/05/2016,10:30,12.5632,77.3448,2016-05-15 10:30:00,10,0,3.0,1.0,3.0
Assault,14/06/2016,17:30,12.5628,77.3323,2016-06-14 17:30:00,17,0,3.0,1.0,3.0
Assault,25/06/2016,20:40,12.5633,77.3309,2016-06-25 20:40:00,20,1,3.0,1.5,4.5
Assault,06/07/2016,12:45,12.5614,77.3323,2016-07-06 12:45:00,12,0,3.0,1.0,3.0
Assault,06/08/2016,18:30,12.5654,77.3305,2016-08-06 18:30:00,18,0,3.0,1.0,3.0
Assault,13/08/2016,21:00,12.5647,77.3319,2016-08-13 21:00:00,21,1,3.0,1.5,4.5
Assault,29/08/2016,15:00,12.5633,77.3337,2016-08-29 15:00:00,15,0,3.0,1.0,3.0
Assault,02/09/2016,15:00,12.5642,77.3351,2016-09-02 15:00:00,15,0,3.0,1.0,3.0
Assault,17/09/2016,2:30,12.94838,77.55057,2016-09-17 02:30:00,2,1,3.0,1.5,4.5
Assault,15/11/2016,15:00,12.565379,77.331753,2016-11-15 15:00:00,15,0,3.0,1.0,3.0
Assault,23/11/2016,11:30,12.9484,77.55052,2016-11-23 11:30:00,11,0,3.0,1.0,3.0
Assault,03/12/2016,20:45,12.94253,77.55236,2016-12-03 20:45:00,20,1,3.0,1.5,4.5
Assault,12/12/2016,16:00,12.93604,77.5596,2016-12-12 16:00:00,16,0,3.0,1.0,3.0
Assault,25/12/2016,20:45,12.93789,77.55487,2016-12-25 20:45:00,20,1,3.0,1.5,4.5
Assault,18/01/2017,14:15,12.93637,77.5614,2017-01-18 14:15:00,14,0,3.0,1.0,3.0
Assault,01/02/2017,23:30,12.94253,77.55236,2017-02-01 23:30:00,23,1,3.0,1.5,4.5
Assault,12/02/2017,1:30,12.94432,77.55506,2017-02-12 01:30:00,1,1,3.0,1.5,4.5
Assault,13/02/2017,15:00,12.94498,77.56258,2017-02-13 15:00:00,15,0,3.0,1.0,3.0
Assault,11/03/2017,10:30,12.94364,77.55992,2017-03-11 10:30:00,10,0,3.0,1.0,3.0
Assault,20/03/2017,17:00,12.9369,77.55998,2017-03-20 17:00:00,17,0,3.0,1.0,3.0
Assault,16/04/2017,0:30,12.94451,77.56212,2017-04-16 00:30:00,0,1,3.0,1.5,4.5
Assault,06/07/2017,12:30,12.94456,77.55497,2017-07-06 12:30:00,12,0,3.0,1.0,3.0
Assault,14/07/2017,12:10,12.94429,77.55415,2017-07-14 12:10:00,12,0,3.0,1.0,3.0
Assault,15/07/2017,17:00,12.94637,77.56196,2017-07-15 17:00:00,17,0,3.0,1.0,3.0
Assault,18/07/2017,16:30,12.93794,77.55416,2017-07-18 16:30:00,16,0,3.0,1.0,3.0
Assault,18/07/2017,17:00,12.93794,77.55416,2017-07-18 17:00:00,17,0,3.0,1.0,3.0
Assault,30/08/2017,14:10,12.94103,77.56541,2017-08-30 14:10:00,14,0,3.0,1.0,3.0
Assault,11/09/2017,17:00,12.94168,77.55631,2017-09-11 17:00:00,17,0,3.0,1.0,3.0
Assault,19/09/2017,18:00,12.94077,77.5576,2017-09-19 18:00:00,18,0,3.0,1.0,3.0
Assault,22/09/2017,14:30,12.94041,77.56239,2017-09-22 14:30:00,14,0,3.0,1.0,3.0
Assault,23/10/2017,20:40,12.94488,77.55022,2017-10-23 20:40:00,20,1,3.0,1.5,4.5
Assault,24/10/2017,16:30,12.94047,77.55845,2017-10-24 16:30:00,16,0,3.0,1.0,3.0
Assault,04/11/2017,12:30,12.94162,77.56016,2017-11-04 12:30:00,12,0,3.0,1.0,3.0
Assault,04/11/2017,19:00,12.94026,77.55412,2017-11-04 19:00:00,19,1,3.0,1.5,4.5
Assault,04/11/2017,20:45,12.94026,77.55412,2017-11-04 20:45:00,20,1,3.0,1.5,4.5
Assault,17/11/2017,20:40,12.94315,77.56575,2017-11-17 20:40:00,20,1,3.0,1.5,4.5
Assault,12/12/2017,12:00,12.93628,77.56139,2017-12-12 12:00:00,12,0,3.0,1.0,3.0
Assault,05/01/2018,20:30,12.94085,77.56135,2018-01-05 20:30:00,20,1,3.0,1.5,4.5
Assault,17/01/2018,16:20,12.93593,77.55374,2018-01-17 16:20:00,16,0,3.0,1.0,3.0
Assault,29/01/2018,17:15,12.94258,77.56391,2018-01-29 17:15:00,17,0,3.0,1.0,3.0
Assault,13/02/2018,13:30,12.94841,77.55258,2018-02-13 13:30:00,13,0,3.0,1.0,3.0
Assault,10/03/2018,23:15,12.94841,77.55258,2018-03-10 23:15:00,23,1,3.0,1.5,4.5
Assault,11/03/2018,5:00,12.94264,77.55531,2018-03-11 05:00:00,5,1,3.0,1.5,4.5
Assault,12/03/2018,20:40,12.94264,77.55531,2018-03-12 20:40:00,20,1,3.0,1.5,4.5
Assault,18/03/2018,10:45,12.9369,77.55998,2018-03-18 10:45:00,10,0,3.0,1.0,3.0
Assault,22/03/2018,20:40,12.9429,77.56502,2018-03-22 20:40:00,20,1,3.0,1.5,4.5
Assault,07/04/2018,1:15,12.94841,77.55258,2018-04-07 01:15:00,1,1,3.0,1.5,4.5
Assault,18/04/2018,18:00,12.94968,77.55154,2018-04-18 18:00:00,18,0,3.0,1.0,3.0
Assault,11/05/2018,23:00,12.93974,77.55915,2018-05-11 23:00:00,23,1,3.0,1.5,4.5
Assault,31/05/2018,15:30,12.94013,77.55851,2018-05-31 15:30:00,15,0,3.0,1.0,3.0
Assault,09/06/2018,10:00,12.93747,77.55656,2018-06-09 10:00:00,10,0,3.0,1.0,3.0
Assault,21/07/2018,11:30,12.94386,77.56116,2018-07-21 11:30:00,11,0,3.0,1.0,3.0
Assault,21/07/2018,11:45,12.94386,77.56116,2018-07-21 11:45:00,11,0,3.0,1.0,3.0
Assault,21/07/2018,12:00,12.94386,77.56116,2018-07-21 12:00:00,12,0,3.0,1.0,3.0
Assault,02/09/2018,8:10,12.93623,77.5598,2018-09-02 08:10:00,8,0,3.0,1.0,3.0
Assault,31/10/2018,14:30,12.94818,77.55885,2018-10-31 14:30:00,14,0,3.0,1.0,3.0
Assault,09/11/2018,0:30,12.94435,77.55654,2018-11-09 00:30:00,0,1,3.0,1.5,4.5
Assault,02/12/2018,16:30,12.9493,77.55299,2018-12-02 16:30:00,16,0,3.0,1.0,3.0
Assault,22/12/2018,19:00,12.93644,77.56136,2018-12-22 19:00:00,19,1,3.0,1.5,4.5
Assault,29/12/2018,20:45,12.93506,77.5614,2018-12-29 20:45:00,20,1,3.0,1.5,4.5
Assault,05/01/2019,18:15,12.93396,77.5552,2019-01-05 18:15:00,18,0,3.0,1.0,3.0
Assault,19/03/2019,20:00,12.94575,77.55912,2019-03-19 20:00:00,20,1,3.0,1.5,4.5
Assault,29/03/2019,17:00,12.9482,77.55078,2019-03-29 17:00:00,17,0,3.0,1.0,3.0
Assault,08/04/2019,23:45,12.94858,77.5576,2019-04-08 23:45:00,23,1,3.0,1.5,4.5
Assault,19/04/2019,20:10,12.94518,77.55861,2019-04-19 20:10:00,20,1,3.0,1.5,4.5
Assault,23/05/2019,19:00,12.93559,77.5597,2019-05-23 19:00:00,19,1,3.0,1.5,4.5
Assault,28/05/2019,19:00,12.94138,77.55371,2019-05-28 19:00:00,19,1,3.0,1.5,4.5
Assault,19/06/2019,22:18,12.94156,77.56134,2019-06-19 22:18:00,22,1,3.0,1.5,4.5
Assault,24/06/2019,15:45,12.9464,77.55544,2019-06-24 15:45:00,15,0,3.0,1.0,3.0
Assault,26/06/2019,13:30,12.94442,77.55475,2019-06-26 13:30:00,13,0,3.0,1.0,3.0
Assault,06/07/2019,16:10,12.94803,77.5562,2019-07-06 16:10:00,16,0,3.0,1.0,3.0
Assault,23/07/2019,10:00,12.93628,77.54862,2019-07-23 10:00:00,10,0,3.0,1.0,3.0
Assault,01/08/2019,20:45,12.94567,77.55906,2019-08-01 20:45:00,20,1,3.0,1.5,4.5
Assault,19/08/2019,23:25,12.93631,77.55979,2019-08-19 23:25:00,23,1,3.0,1.5,4.5
Assault,31/08/2019,13:00,12.93815,77.5568,2019-08-31 13:00:00,13,0,3.0,1.0,3.0
Assault,03/09/2019,9:00,12.94789,77.56137,2019-09-03 09:00:00,9,0,3.0,1.0,3.0
Assault,03/09/2019,11:00,12.94789,77.56137,2019-09-03 11:00:00,11,0,3.0,1.0,3.0
Assault,03/09/2019,20:45,12.93685,77.5614,2019-09-03 20:45:00,20,1,3.0,1.5,4.5
Assault,16/09/2019,10:30,12.935649,77.56595,2019-09-16 10:30:00,10,0,3.0,1.0,3.0
Assault,10/10/2019,9:30,12.95026,77.55345,2019-10-10 09:30:00,9,0,3.0,1.0,3.0
Assault,17/10/2019,20:40,12.93633,77.55453,2019-10-17 20:40:00,20,1,3.0,1.5,4.5
Assault,21/10/2019,12:30,12.94676,77.55677,2019-10-21 12:30:00,12,0,3.0,1.0,3.0
Assault,21/10/2019,17:30,12.94676,77.55677,2019-10-21 17:30:00,17,0,3.0,1.0,3.0
Assault,04/11/2019,17:45,12.93632,77.55847,2019-11-04 17:45:00,17,0,3.0,1.0,3.0
Assault,04/11/2019,18:20,12.94825,77.55216,2019-11-04 18:20:00,18,0,3.0,1.0,3.0
Assault,10/11/2019,15:00,12.94469,77.55291,2019-11-10 15:00:00,15,0,3.0,1.0,3.0
Assault,13/11/2019,21:00,12.94372,77.55869,2019-11-13 21:00:00,21,1,3.0,1.5,4.5
Assault,27/11/2019,19:30,12.94021,77.56257,2019-11-27 19:30:00,19,1,3.0,1.5,4.5
Assault,19/01/2015,21:30,12.941659,77.570149,2015-01-19 21:30:00,21,1,3.0,1.5,4.5
Assault,03/02/2015,8:45,12.940784,77.570644,2015-02-03 08:45:00,8,0,3.0,1.0,3.0
Assault,10/02/2015,11:00,12.940182,77.570361,2015-02-10 11:00:00,11,0,3.0,1.0,3.0
Assault,11/2/2015,23:00,12.940062,77.57036,2015-02-11 23:00:00,23,1,3.0,1.5,4.5
Assault,16/02/2015,12:15,12.941519,77.570132,2015-02-16 12:15:00,12,0,3.0,1.0,3.0
Assault,24/02/2015,19:30,12.940929,77.569127,2015-02-24 19:30:00,19,1,3.0,1.5,4.5
Assault,24/02/2015,21:45,12.941067,77.569371,2015-02-24 21:45:00,21,1,3.0,1.5,4.5
Assault,26/2/2015,10:10,12.941168,77.567535,2015-02-26 10:10:00,10,0,3.0,1.0,3.0
Assault,30/03/2015,15:00,12.94146,77.566771,2015-03-30 15:00:00,15,0,3.0,1.0,3.0
Assault,09/04/2015,21:15,12.941157,77.566236,2015-04-09 21:15:00,21,1,3.0,1.5,4.5
Assault,27/04/2015,11:30,12.940809,77.566506,2015-04-27 11:30:00,11,0,3.0,1.0,3.0
Assault,09/06/2015,10:00,12.930503,77.561289,2015-06-09 10:00:00,10,0,3.0,1.0,3.0
Assault,16/08/2015,15:15,12.939982,77.565725,2015-08-16 15:15:00,15,0,3.0,1.0,3.0
Assault,01/09/2015,13:40,12.931947,77.554626,2015-09-01 13:40:00,13,0,3.0,1.0,3.0
Assault,08/09/2015,22:30,12.941387,77.565792,2015-09-08 22:30:00,22,1,3.0,1.5,4.5
Assault,11/09/2015,15:00,12-928778,77.555819,2015-09-11 15:00:00,15,0,3.0,1.0,3.0
Assault,17/09/2015,10:00,12.921471,77.546786,2015-09-17 10:00:00,10,0,3.0,1.0,3.0
Assault,06/10/2015,13:00,12.941387,77.565792,2015-10-06 13:00:00,13,0,3.0,1.0,3.0
Assault,14/10/2015,15:30,12.94186,77.564677,2015-10-14 15:30:00,15,0,3.0,1.0,3.0
Assault,31/10/2015,11:15,12.941291,77.565246,2015-10-31 11:15:00,11,0,3.0,1.0,3.0
Assault,11/11/2015,9:00,12.928528,77.553422,2015-11-11 09:00:00,9,0,3.0,1.0,3.0
Assault,11/11/2015,18:10,12.928528,77.553422,2015-11-11 18:10:00,18,0,3.0,1.0,3.0
Assault,28/12/2015,20:45,12.937372,77.559465,2015-12-28 20:45:00,20,1,3.0,1.5,4.5
Assault,07/06/2015,17:30,12.933799,77.560909,2015-06-07 17:30:00,17,0,3.0,1.0,3.0
Assault,02/01/2016,5:00,12.920588,77.542815,2016-01-02 05:00:00,5,1,3.0,1.5,4.5
Assault,04/01/2016,6:00,12.930279,77.554362,2016-01-04 06:00:00,6,0,3.0,1.0,3.0
Assault,04/01/2016,6:45,12.930279,77.554362,2016-01-04 06:45:00,6,0,3.0,1.0,3.0
Assault,21/01/2016,6:20,12.931046,77.554513,2016-01-21 06:20:00,6,0,3.0,1.0,3.0
Assault,22/01/2016,2:00,12.923695,77.549489,2016-01-22 02:00:00,2,1,3.0,1.5,4.5
Assault,06/02/2016,12:30,12.920327,77.54309,2016-02-06 12:30:00,12,0,3.0,1.0,3.0
Assault,25/02/2016,2:15,12.922046,77.553024,2016-02-25 02:15:00,2,1,3.0,1.5,4.5
Assault,25/02/2016,4:45,12.922516,77.553774,2016-02-25 04:45:00,4,1,3.0,1.5,4.5
Assault,03/06/2016,10:00,12.930932,77.561421,2016-06-03 10:00:00,10,0,3.0,1.0,3.0
Assault,10/06/2016,7:15,12.923037,77.548988,2016-06-10 07:15:00,7,0,3.0,1.0,3.0
Assault,19/06/2016,10:30,12.924151,77.553847,2016-06-19 10:30:00,10,0,3.0,1.0,3.0
Assault,11/07/2016,1:50,12.932791,77.560929,2016-07-11 01:50:00,1,1,3.0,1.5,4.5
Assault,31/07/2016,11:30,12.921484,77.545423,2016-07-31 11:30:00,11,0,3.0,1.0,3.0
Assault,08/08/2016,1:00,12.931113,77.562634,2016-08-08 01:00:00,1,1,3.0,1.5,4.5
Assault,16/08/2016,8:00,12.928718,77.54772,2016-08-16 08:00:00,8,0,3.0,1.0,3.0
Assault,30/08/2016,9:45,12.924687,77.543169,2016-08-30 09:45:00,9,0,3.0,1.0,3.0
Assault,09/10/2016,12:15,12.923023,77.549088,2016-10-09 12:15:00,12,0,3.0,1.0,3.0
Assault,08/11/2016,7:45,12.922066,77.546981,2016-11-08 07:45:00,7,0,3.0,1.0,3.0
Assault,08/11/2016,1:00,12.932767,77.560731,2016-11-08 01:00:00,1,1,3.0,1.5,4.5
Assault,15/11/2016,9:15,12.929407,77.559801,2016-11-15 09:15:00,9,0,3.0,1.0,3.0
Assault,16/11/2016,1:30,12.931529,77.561607,2016-11-16 01:30:00,1,1,3.0,1.5,4.5
Assault,19/11/2016,5:15,12.919646,77.542205,2016-11-19 05:15:00,5,1,3.0,1.5,4.5
Assault,19/11/2016,6:00,12.928064,77.554389,2016-11-19 06:00:00,6,0,3.0,1.0,3.0
Assault,3/12/2016,7:30,12.923105,77.543831,2016-12-03 07:30:00,7,0,3.0,1.0,3.0
Assault,06/12/2016,10:30,12.930367,77.553533,2016-12-06 10:30:00,10,0,3.0,1.0,3.0
Assault,11/12/2016,7:45,12.930698,77.560669,2016-12-11 07:45:00,7,0,3.0,1.0,3.0
Assault,13/12/2016,6:00,12.926046,77.55903,2016-12-13 06:00:00,6,0,3.0,1.0,3.0
Assault,13/12/2016,6:30,12.930226,77.54772,2016-12-13 06:30:00,6,0,3.0,1.0,3.0
Assault,17/12/2016,1:30,12.931165,77.561349,2016-12-17 01:30:00,1,1,3.0,1.5,4.5
Assault,19/12/2016,10:00,12.929131,77.553641,2016-12-19 10:00:00,10,0,3.0,1.0,3.0
Assault,14/01/2017,1:15,12.922802,77.543715,2017-01-14 01:15:00,1,1,3.0,1.5,4.5
Assault,02/03/2017,3:15,12.923552,77.553632,2017-03-02 03:15:00,3,1,3.0,1.5,4.5
Assault,12/03/2017,1:30,12.925239,77.550007,2017-03-12 01:30:00,1,1,3.0,1.5,4.5
Assault,19/03/2017,21:00,12.92574,77.549373,2017-03-19 21:00:00,21,1,3.0,1.5,4.5
Assault,01/04/2017,6:10,12.931092,77.563794,2017-04-01 06:10:00,6,0,3.0,1.0,3.0
Assault,16/04/2017,17:40,12.928314,77.55323,2017-04-16 17:40:00,17,0,3.0,1.0,3.0
Assault,16/04/2017,22:00,12.928314,77.55323,2017-04-16 22:00:00,22,1,3.0,1.5,4.5
Assault,20/05/2017,22:40,12.929838,77.557014,2017-05-20 22:40:00,22,1,3.0,1.5,4.5
Assault,04/06/2017,12:30,12.929701,77.551714,2017-06-04 12:30:00,12,0,3.0,1.0,3.0
Assault,07/06/2017,1:15,12.930834,77.553989,2017-06-07 01:15:00,1,1,3.0,1.5,4.5
Assault,03/08/2017,11:00,12.9259,77.556179,2017-08-03 11:00:00,11,0,3.0,1.0,3.0
Assault,23/08/2017,4:30,12.931526,77.562053,2017-08-23 04:30:00,4,1,3.0,1.5,4.5
Assault,23/08/2017,12:30,12.91999,77.542212,2017-08-23 12:30:00,12,0,3.0,1.0,3.0
Assault,03/09/2017,20:00,12.930424,77.547698,2017-09-03 20:00:00,20,1,3.0,1.5,4.5
Assault,13/09/2017,23:00,12.939663,77.556532,2017-09-13 23:00:00,23,1,3.0,1.5,4.5
Assault,19/09/2017,19:05,12.927076,77.559599,2017-09-19 19:05:00,19,1,3.0,1.5,4.5
Assault,07/10/2017,14:45,12.9215465,77.542884,2017-10-07 14:45:00,14,0,3.0,1.0,3.0
Assault,06/11/2017,19:45,12.926405,77.558428,2017-11-06 19:45:00,19,1,3.0,1.5,4.5
Assault,05/12/2017,19:45,12.929683,77.560433,2017-12-05 19:45:00,19,1,3.0,1.5,4.5
Assault,29/12/2017,12:00,12.930084,77.566022,2017-12-29 12:00:00,12,0,3.0,1.0,3.0
Assault,09/01/2018,21:10,12.929236,77.560969,2018-01-09 21:10:00,21,1,3.0,1.5,4.5
Assault,27/04/2018,13:15,12.919427,77.539456,2018-04-27 13:15:00,13,0,3.0,1.0,3.0
Assault,02/05/2018,17:00,12.928803,77.557334,2018-05-02 17:00:00,17,0,3.0,1.0,3.0
Assault,30/05/2018,16:00,12.921823,77.552017,2018-05-30 16:00:00,16,0,3.0,1.0,3.0
Assault,09/07/2018,8:50,12.927112,77.550283,2018-07-09 08:50:00,8,0,3.0,1.0,3.0
Assault,10/07/2018,19:00,12.933061,77.561938,2018-07-10 19:00:00,19,1,3.0,1.5,4.5
Assault,31/07/2018,18:00,12.929409,77.560959,2018-07-31 18:00:00,18,0,3.0,1.0,3.0
Assault,28/08/2018,16:45,12.927827,77.546113,2018-08-28 16:45:00,16,0,3.0,1.0,3.0
Assault,30/08/2018,22:30,12.92561,77.560108,2018-08-30 22:30:00,22,1,3.0,1.5,4.5
Assault,02/09/2018,13:00,12.930655,77.550198,2018-09-02 13:00:00,13,0,3.0,1.0,3.0
Assault,15/12/2018,18:00,12.928368,77.561098,2018-12-15 18:00:00,18,0,3.0,1.0,3.0
Assault,16/12/2018,18:00,12.926168,77.546814,2018-12-16 18:00:00,18,0,3.0,1.0,3.0
Assault,27/02/2019,21:30,12.9,77.5,2019-02-27 21:30:00,21,1,3.0,1.5,4.5
Assault,13/03/2019,22:00,12.927351,77.561885,2019-03-13 22:00:00,22,1,3.0,1.5,4.5
Assault,06/05/2019,19:30,12.929965,77.560395,2019-05-06 19:30:00,19,1,3.0,1.5,4.5
Assault,17/05/2019,16:00,12.930581,77.553535,2019-05-17 16:00:00,16,0,3.0,1.0,3.0
Assault,30/05/2019,14:00,12.937935,77.556871,2019-05-30 14:00:00,14,0,3.0,1.0,3.0
Assault,30/05/2019,18:00,12.938483,77.543257,2019-05-30 18:00:00,18,0,3.0,1.0,3.0
Assault,28/07/2019,18:30,12.931345,77.562065,2019-07-28 18:30:00,18,0,3.0,1.0,3.0
Assault,27/08/2019,10:50,12.929877,77.560448,2019-08-27 10:50:00,10,0,3.0,1.0,3.0
Assault,30/08/2019,15:15,12.928988,77.539462,2019-08-30 15:15:00,15,0,3.0,1.0,3.0
Assault,30/08/2019,16:00,12.923855,77.540945,2019-08-30 16:00:00,16,0,3.0,1.0,3.0
Assault,02/09/2019,21:05,12.925281,77.540622,2019-09-02 21:05:00,21,1,3.0,1.5,4.5
Assault,2/9/2019,21:30,12.931575,77.561964,2019-09-02 21:30:00,21,1,3.0,1.5,4.5
Assault,03/10/2019,10:45,12.927888,77.563032,2019-10-03 10:45:00,10,0,3.0,1.0,3.0
Assault,15/10/2019,17:30,12.923006,77.548955,2019-10-15 17:30:00,17,0,3.0,1.0,3.0
Assault,13/12/2019,23:30,12.933749,77.556942,2019-12-13 23:30:00,23,1,3.0,1.5,4.5
Assault,20/12/2019,18:00,12.927836,77.543928,2019-12-20 18:00:00,18,0,3.0,1.0,3.0
